"No.","Time","Source","Destination","Protocol","Length","Info"
"36","1.590483","100.69.171.196","204.79.197.200","TCP","1494","61011  >  443 [ACK] Seq=1 Ack=1 Win=53798 Len=1440 [TCP segment of a reassembled PDU]"
"37","1.590484","100.69.171.196","204.79.197.200","TCP","1494","61011  >  443 [ACK] Seq=1441 Ack=1 Win=53798 Len=1440 [TCP segment of a reassembled PDU]"
"38","1.590501","100.69.171.196","204.79.197.200","TLSv1.2","175","Application Data"
"43","1.603410","204.79.197.200","100.69.171.196","TCP","56","443  >  61011 [ACK] Seq=1 Ack=3002 Win=16385 Len=0"
"44","1.655476","204.79.197.200","100.69.171.196","TLSv1.2","1204","Application Data"
"45","1.655477","204.79.197.200","100.69.171.196","TCP","1514","443  >  61011 [ACK] Seq=1151 Ack=3002 Win=16385 Len=1460 [TCP segment of a reassembled PDU]"
"46","1.655478","204.79.197.200","100.69.171.196","TLSv1.2","611","Application Data"
"47","1.655479","204.79.197.200","100.69.171.196","TCP","1514","443  >  61011 [ACK] Seq=3168 Ack=3002 Win=16385 Len=1460 [TCP segment of a reassembled PDU]"
"48","1.655479","204.79.197.200","100.69.171.196","TCP","1514","443  >  61011 [ACK] Seq=4628 Ack=3002 Win=16385 Len=1460 [TCP segment of a reassembled PDU]"
"49","1.655566","100.69.171.196","204.79.197.200","TCP","54","61011  >  443 [ACK] Seq=3002 Ack=6088 Win=53703 Len=0"
"50","1.655703","100.69.171.196","204.79.197.200","TCP","54","[TCP Window Update] 61011  >  443 [ACK] Seq=3002 Ack=6088 Win=53798 Len=0"
"51","1.657167","204.79.197.200","100.69.171.196","TLSv1.2","1268","Application Data"
"52","1.657168","204.79.197.200","100.69.171.196","TCP","1514","443  >  61011 [ACK] Seq=7302 Ack=3002 Win=16385 Len=1460 [TCP segment of a reassembled PDU]"
"53","1.657409","100.69.171.196","204.79.197.200","TCP","54","61011  >  443 [ACK] Seq=3002 Ack=8762 Win=53756 Len=0"
"54","1.657918","204.79.197.200","100.69.171.196","TCP","1514","443  >  61011 [ACK] Seq=8762 Ack=3002 Win=16385 Len=1460 [TCP segment of a reassembled PDU]"
"55","1.657919","204.79.197.200","100.69.171.196","TLSv1.2","1268","Application Data"
"56","1.657920","204.79.197.200","100.69.171.196","TCP","1514","443  >  61011 [ACK] Seq=11436 Ack=3002 Win=16385 Len=1460 [TCP segment of a reassembled PDU]"
"57","1.657921","204.79.197.200","100.69.171.196","TCP","1514","443  >  61011 [ACK] Seq=12896 Ack=3002 Win=16385 Len=1460 [TCP segment of a reassembled PDU]"
"58","1.657922","204.79.197.200","100.69.171.196","TLSv1.2","1268","Application Data"
"59","1.657922","204.79.197.200","100.69.171.196","TCP","1514","443  >  61011 [ACK] Seq=15570 Ack=3002 Win=16385 Len=1460 [TCP segment of a reassembled PDU]"
"60","1.657923","204.79.197.200","100.69.171.196","TCP","1514","443  >  61011 [ACK] Seq=17030 Ack=3002 Win=16385 Len=1460 [TCP segment of a reassembled PDU]"
"61","1.657924","204.79.197.200","100.69.171.196","TLSv1.2","1268","Application Data"
"62","1.657925","204.79.197.200","100.69.171.196","TCP","1514","443  >  61011 [ACK] Seq=19704 Ack=3002 Win=16385 Len=1460 [TCP segment of a reassembled PDU]"
"63","1.657926","204.79.197.200","100.69.171.196","TCP","1514","443  >  61011 [ACK] Seq=21164 Ack=3002 Win=16385 Len=1460 [TCP segment of a reassembled PDU]"
"64","1.657927","204.79.197.200","100.69.171.196","TLSv1.2","1268","Application Data"
"65","1.657928","204.79.197.200","100.69.171.196","TCP","1514","443  >  61011 [ACK] Seq=23838 Ack=3002 Win=16385 Len=1460 [TCP segment of a reassembled PDU]"
"66","1.657929","204.79.197.200","100.69.171.196","TCP","1514","443  >  61011 [ACK] Seq=25298 Ack=3002 Win=16385 Len=1460 [TCP segment of a reassembled PDU]"
"67","1.657930","204.79.197.200","100.69.171.196","TLSv1.2","1268","Application Data"
"68","1.657931","204.79.197.200","100.69.171.196","TCP","1514","443  >  61011 [ACK] Seq=27972 Ack=3002 Win=16385 Len=1460 [TCP segment of a reassembled PDU]"
"69","1.657932","204.79.197.200","100.69.171.196","TLSv1.2","94","Application Data"
"70","1.657932","204.79.197.200","100.69.171.196","TLSv1.2","92","Application Data"
"71","1.657969","100.69.171.196","204.79.197.200","TCP","54","61011  >  443 [ACK] Seq=3002 Ack=23838 Win=53562 Len=0"
"72","1.657988","100.69.171.196","204.79.197.200","TCP","54","61011  >  443 [ACK] Seq=3002 Ack=29510 Win=53474 Len=0"
"73","1.658037","100.69.171.196","204.79.197.200","TCP","54","[TCP Window Update] 61011  >  443 [ACK] Seq=3002 Ack=29510 Win=53798 Len=0"
"74","1.761532","100.69.171.196","204.79.197.200","TCP","1494","61011  >  443 [ACK] Seq=3002 Ack=29510 Win=53798 Len=1440 [TCP segment of a reassembled PDU]"
"75","1.761534","100.69.171.196","204.79.197.200","TCP","1494","61011  >  443 [ACK] Seq=4442 Ack=29510 Win=53798 Len=1440 [TCP segment of a reassembled PDU]"
"76","1.761570","100.69.171.196","204.79.197.200","TLSv1.2","998","Application Data"
"77","1.769330","100.69.171.196","204.79.197.200","TCP","1494","61011  >  443 [ACK] Seq=6826 Ack=29510 Win=53798 Len=1440 [TCP segment of a reassembled PDU]"
"78","1.769331","100.69.171.196","204.79.197.200","TCP","1494","61011  >  443 [ACK] Seq=8266 Ack=29510 Win=53798 Len=1440 [TCP segment of a reassembled PDU]"
"79","1.769360","100.69.171.196","204.79.197.200","TLSv1.2","167","Application Data"
"80","1.773720","204.79.197.200","100.69.171.196","TCP","56","443  >  61011 [ACK] Seq=29510 Ack=4442 Win=16379 Len=0"
"81","1.773721","204.79.197.200","100.69.171.196","TCP","56","443  >  61011 [ACK] Seq=29510 Ack=6826 Win=16381 Len=0"
"82","1.781566","204.79.197.200","100.69.171.196","TCP","56","443  >  61011 [ACK] Seq=29510 Ack=8266 Win=16385 Len=0"
"83","1.781567","204.79.197.200","100.69.171.196","TCP","56","443  >  61011 [ACK] Seq=29510 Ack=9819 Win=16385 Len=0"
"84","1.783164","204.79.197.200","100.69.171.196","TLSv1.2","337","Application Data"
"85","1.783377","100.69.171.196","204.79.197.200","TCP","54","61011  >  443 [ACK] Seq=9819 Ack=29793 Win=53794 Len=0"
"87","1.815502","100.69.171.196","204.79.197.200","TCP","1494","61011  >  443 [ACK] Seq=9819 Ack=29793 Win=53798 Len=1440 [TCP segment of a reassembled PDU]"
"88","1.815504","100.69.171.196","204.79.197.200","TCP","1494","61011  >  443 [ACK] Seq=11259 Ack=29793 Win=53798 Len=1440 [TCP segment of a reassembled PDU]"
"89","1.815535","100.69.171.196","204.79.197.200","TLSv1.2","320","Application Data"
"90","1.850018","100.69.171.196","204.79.197.200","TCP","1494","[TCP Retransmission] 61011  >  443 [PSH, ACK] Seq=11525 Ack=29793 Win=53798 Len=1440 [TCP segment of a reassembled PDU]"
"92","1.850788","204.79.197.200","100.69.171.196","TCP","1514","443  >  61011 [ACK] Seq=29793 Ack=9819 Win=16385 Len=1460 [TCP segment of a reassembled PDU]"
"93","1.850790","204.79.197.200","100.69.171.196","TLSv1.2","319","Application Data"
"94","1.850940","100.69.171.196","204.79.197.200","TCP","54","61011  >  443 [ACK] Seq=12965 Ack=31518 Win=53771 Len=0"
"95","1.850959","204.79.197.200","100.69.171.196","TLSv1.2","92","Application Data"
"96","1.851005","100.69.171.196","204.79.197.200","TCP","54","61011  >  443 [ACK] Seq=12965 Ack=31556 Win=53797 Len=0"
"97","1.860793","204.79.197.200","100.69.171.196","TCP","56","443  >  61011 [ACK] Seq=31556 Ack=12965 Win=16385 Len=0"
"98","1.860945","204.79.197.200","100.69.171.196","TCP","66","[TCP Dup ACK 97#1] 443  >  61011 [ACK] Seq=31556 Ack=12965 Win=16385 Len=0 SLE=11525 SRE=12965"
"123","1.882259","100.69.171.196","204.79.197.200","TCP","1494","61011  >  443 [ACK] Seq=12965 Ack=31556 Win=53798 Len=1440 [TCP segment of a reassembled PDU]"
"124","1.882261","100.69.171.196","204.79.197.200","TCP","1494","61011  >  443 [ACK] Seq=14405 Ack=31556 Win=53798 Len=1440 [TCP segment of a reassembled PDU]"
"125","1.882278","100.69.171.196","204.79.197.200","TLSv1.2","346","Application Data"
"139","1.895855","100.69.171.196","204.79.197.200","TCP","1494","61011  >  443 [ACK] Seq=16137 Ack=31556 Win=53798 Len=1440 [TCP segment of a reassembled PDU]"
"140","1.895857","100.69.171.196","204.79.197.200","TCP","1494","61011  >  443 [ACK] Seq=17577 Ack=31556 Win=53798 Len=1440 [TCP segment of a reassembled PDU]"
"141","1.895874","100.69.171.196","204.79.197.200","TLSv1.2","169","Application Data"
"142","1.897701","204.79.197.200","100.69.171.196","TCP","56","443  >  61011 [ACK] Seq=31556 Ack=16137 Win=16385 Len=0"
"143","1.901297","204.79.197.200","100.69.171.196","TCP","1514","443  >  61011 [ACK] Seq=31556 Ack=16137 Win=16385 Len=1460 [TCP segment of a reassembled PDU]"
"144","1.901299","204.79.197.200","100.69.171.196","TLSv1.2","1224","Application Data"
"145","1.901299","204.79.197.200","100.69.171.196","TLSv1.2","92","Application Data"
"146","1.901367","100.69.171.196","204.79.197.200","TCP","54","61011  >  443 [ACK] Seq=19132 Ack=34224 Win=53756 Len=0"
"147","1.908023","204.79.197.200","100.69.171.196","TCP","56","443  >  61011 [ACK] Seq=34224 Ack=17577 Win=16379 Len=0"
"148","1.908024","204.79.197.200","100.69.171.196","TCP","56","443  >  61011 [ACK] Seq=34224 Ack=19132 Win=16384 Len=0"
"149","1.918954","204.79.197.200","100.69.171.196","TCP","1514","443  >  61011 [ACK] Seq=34224 Ack=19132 Win=16384 Len=1460 [TCP segment of a reassembled PDU]"
"150","1.918956","204.79.197.200","100.69.171.196","TLSv1.2","702","Application Data"
"151","1.918956","204.79.197.200","100.69.171.196","TLSv1.2","92","Application Data"
"152","1.919043","100.69.171.196","204.79.197.200","TCP","54","61011  >  443 [ACK] Seq=19132 Ack=36370 Win=53764 Len=0"
"169","1.958423","100.69.171.196","204.79.197.200","TCP","1494","61011  >  443 [ACK] Seq=19132 Ack=36370 Win=53798 Len=1440 [TCP segment of a reassembled PDU]"
"170","1.958425","100.69.171.196","204.79.197.200","TCP","1494","61011  >  443 [ACK] Seq=20572 Ack=36370 Win=53798 Len=1440 [TCP segment of a reassembled PDU]"
"171","1.958426","100.69.171.196","204.79.197.200","TCP","1494","61011  >  443 [ACK] Seq=22012 Ack=36370 Win=53798 Len=1440 [TCP segment of a reassembled PDU]"
"172","1.958448","100.69.171.196","204.79.197.200","TLSv1.2","273","Application Data"
"175","1.986684","100.69.171.196","204.79.197.200","TCP","1494","61011  >  443 [ACK] Seq=23671 Ack=36370 Win=53798 Len=1440 [TCP segment of a reassembled PDU]"
"176","1.986687","100.69.171.196","204.79.197.200","TCP","1494","61011  >  443 [ACK] Seq=25111 Ack=36370 Win=53798 Len=1440 [TCP segment of a reassembled PDU]"
"177","1.986714","100.69.171.196","204.79.197.200","TLSv1.2","169","Application Data"
"178","2.021949","100.69.171.196","204.79.197.200","TCP","1494","[TCP Retransmission] 61011  >  443 [PSH, ACK] Seq=25226 Ack=36370 Win=53798 Len=1440 [TCP segment of a reassembled PDU]"
"187","2.038960","204.79.197.200","100.69.171.196","TCP","1514","443  >  61011 [ACK] Seq=36370 Ack=19132 Win=16384 Len=1460 [TCP segment of a reassembled PDU]"
"188","2.038961","204.79.197.200","100.69.171.196","TLSv1.2","300","Application Data"
"189","2.038962","204.79.197.200","100.69.171.196","TLSv1.2","92","Application Data"
"190","2.038962","204.79.197.200","100.69.171.196","TCP","1514","[TCP Retransmission] 443  >  61011 [PSH, ACK] Seq=36654 Ack=19132 Win=16384 Len=1460"
"191","2.039061","100.69.171.196","204.79.197.200","TCP","66","61011  >  443 [ACK] Seq=26666 Ack=38114 Win=53771 Len=0 SLE=36654 SRE=38114"
"203","2.048932","204.79.197.200","100.69.171.196","TCP","66","443  >  61011 [ACK] Seq=38114 Ack=26666 Win=16385 Len=0 SLE=25226 SRE=26666"
"209","2.057213","204.79.197.200","100.69.171.196","TLSv1.2","203","Application Data"
"210","2.057268","100.69.171.196","204.79.197.200","TCP","54","61011  >  443 [ACK] Seq=26666 Ack=38263 Win=53796 Len=0"
"228","2.104575","204.79.197.200","100.69.171.196","TCP","1514","443  >  61011 [ACK] Seq=38263 Ack=26666 Win=16385 Len=1460 [TCP segment of a reassembled PDU]"
"229","2.104576","204.79.197.200","100.69.171.196","TLSv1.2","522","Application Data"
"230","2.104577","204.79.197.200","100.69.171.196","TLSv1.2","92","Application Data"
"231","2.104667","100.69.171.196","204.79.197.200","TCP","54","61011  >  443 [ACK] Seq=26666 Ack=40229 Win=53767 Len=0"
"232","2.114753","100.69.171.196","204.79.197.200","TCP","1494","61011  >  443 [ACK] Seq=26666 Ack=40229 Win=53798 Len=1440 [TCP segment of a reassembled PDU]"
"233","2.114755","100.69.171.196","204.79.197.200","TCP","1494","61011  >  443 [ACK] Seq=28106 Ack=40229 Win=53798 Len=1440 [TCP segment of a reassembled PDU]"
"234","2.114778","100.69.171.196","204.79.197.200","TLSv1.2","1114","Application Data"
"235","2.117418","100.69.171.196","204.79.197.200","TCP","1494","61011  >  443 [ACK] Seq=30606 Ack=40229 Win=53798 Len=1440 [TCP segment of a reassembled PDU]"
"236","2.117420","100.69.171.196","204.79.197.200","TCP","1494","61011  >  443 [ACK] Seq=32046 Ack=40229 Win=53798 Len=1440 [TCP segment of a reassembled PDU]"
"237","2.117436","100.69.171.196","204.79.197.200","TLSv1.2","376","Application Data"
"238","2.120928","100.69.171.196","204.79.197.200","TCP","1494","61011  >  443 [ACK] Seq=33808 Ack=40229 Win=53798 Len=1440 [TCP segment of a reassembled PDU]"
"239","2.120929","100.69.171.196","204.79.197.200","TCP","1494","61011  >  443 [ACK] Seq=35248 Ack=40229 Win=53798 Len=1440 [TCP segment of a reassembled PDU]"
"240","2.120940","100.69.171.196","204.79.197.200","TLSv1.2","538","Application Data"
"241","2.126655","204.79.197.200","100.69.171.196","TCP","56","443  >  61011 [ACK] Seq=40229 Ack=28106 Win=16379 Len=0"
"242","2.126656","204.79.197.200","100.69.171.196","TCP","56","443  >  61011 [ACK] Seq=40229 Ack=29546 Win=16385 Len=0"
"243","2.126656","204.79.197.200","100.69.171.196","TCP","56","443  >  61011 [ACK] Seq=40229 Ack=30606 Win=16380 Len=0"
"244","2.128865","100.69.171.196","204.79.197.200","TCP","1494","61011  >  443 [ACK] Seq=37172 Ack=40229 Win=53798 Len=1440 [TCP segment of a reassembled PDU]"
"245","2.128867","100.69.171.196","204.79.197.200","TCP","1494","61011  >  443 [ACK] Seq=38612 Ack=40229 Win=53798 Len=1440 [TCP segment of a reassembled PDU]"
"246","2.128886","100.69.171.196","204.79.197.200","TLSv1.2","478","Application Data"
"247","2.129328","204.79.197.200","100.69.171.196","TCP","56","443  >  61011 [ACK] Seq=40229 Ack=33808 Win=16385 Len=0"
"248","2.131922","100.69.171.196","204.79.197.200","TCP","1494","61011  >  443 [ACK] Seq=40476 Ack=40229 Win=53798 Len=1440 [TCP segment of a reassembled PDU]"
"249","2.131923","100.69.171.196","204.79.197.200","TCP","1494","61011  >  443 [ACK] Seq=41916 Ack=40229 Win=53798 Len=1440 [TCP segment of a reassembled PDU]"
"250","2.131954","100.69.171.196","204.79.197.200","TLSv1.2","470","Application Data"
"251","2.132665","204.79.197.200","100.69.171.196","TCP","56","443  >  61011 [ACK] Seq=40229 Ack=37172 Win=16385 Len=0"
"252","2.135279","204.79.197.200","100.69.171.196","TLSv1.2","200","Application Data"
"253","2.135347","100.69.171.196","204.79.197.200","TCP","54","61011  >  443 [ACK] Seq=43772 Ack=40375 Win=53796 Len=0"
"257","2.140973","204.79.197.200","100.69.171.196","TLSv1.2","200","Application Data"
"258","2.140974","204.79.197.200","100.69.171.196","TCP","56","443  >  61011 [ACK] Seq=40521 Ack=40476 Win=16383 Len=0"
"259","2.141063","100.69.171.196","204.79.197.200","TCP","54","61011  >  443 [ACK] Seq=43772 Ack=40521 Win=53796 Len=0"
"263","2.143929","204.79.197.200","100.69.171.196","TCP","56","443  >  61011 [ACK] Seq=40521 Ack=43772 Win=16385 Len=0"
"265","2.153074","204.79.197.200","100.69.171.196","TLSv1.2","530","Application Data, Application Data, Application Data"
"266","2.153165","100.69.171.196","204.79.197.200","TCP","54","61011  >  443 [ACK] Seq=43772 Ack=40997 Win=53791 Len=0"
"281","2.168092","100.69.171.196","204.79.197.200","TCP","1494","61011  >  443 [ACK] Seq=43772 Ack=40997 Win=53798 Len=1440 [TCP segment of a reassembled PDU]"
"282","2.168094","100.69.171.196","204.79.197.200","TCP","1494","61011  >  443 [ACK] Seq=45212 Ack=40997 Win=53798 Len=1440 [TCP segment of a reassembled PDU]"
"283","2.168113","100.69.171.196","204.79.197.200","TLSv1.2","786","Application Data"
"291","2.180834","204.79.197.200","100.69.171.196","TCP","56","443  >  61011 [ACK] Seq=40997 Ack=46652 Win=16385 Len=0"
"292","2.180835","204.79.197.200","100.69.171.196","TCP","56","443  >  61011 [ACK] Seq=40997 Ack=47384 Win=16382 Len=0"
"293","2.188249","100.69.171.196","204.79.197.200","TCP","1494","61011  >  443 [ACK] Seq=47384 Ack=40997 Win=53798 Len=1440 [TCP segment of a reassembled PDU]"
"294","2.188251","100.69.171.196","204.79.197.200","TCP","1494","61011  >  443 [ACK] Seq=48824 Ack=40997 Win=53798 Len=1440 [TCP segment of a reassembled PDU]"
"295","2.188270","100.69.171.196","204.79.197.200","TLSv1.2","476","Application Data"
"296","2.189109","204.79.197.200","100.69.171.196","TLSv1.2","200","Application Data"
"297","2.189184","100.69.171.196","204.79.197.200","TCP","54","61011  >  443 [ACK] Seq=50686 Ack=41143 Win=53798 Len=0"
"298","2.197671","100.69.171.196","204.79.197.200","TCP","1494","61011  >  443 [ACK] Seq=50686 Ack=41143 Win=53798 Len=1440 [TCP segment of a reassembled PDU]"
"299","2.197672","100.69.171.196","204.79.197.200","TCP","1494","61011  >  443 [ACK] Seq=52126 Ack=41143 Win=53798 Len=1440 [TCP segment of a reassembled PDU]"
"300","2.197694","100.69.171.196","204.79.197.200","TLSv1.2","331","Application Data"
"301","2.198074","100.69.171.196","204.79.197.200","TLSv1.2","437","Application Data"
"302","2.200586","204.79.197.200","100.69.171.196","TCP","56","443  >  61011 [ACK] Seq=41143 Ack=50686 Win=16385 Len=0"
"303","2.202264","100.69.171.196","204.79.197.200","TCP","1494","61011  >  443 [ACK] Seq=54226 Ack=41143 Win=53798 Len=1440 [TCP segment of a reassembled PDU]"
"304","2.202266","100.69.171.196","204.79.197.200","TCP","1494","61011  >  443 [ACK] Seq=55666 Ack=41143 Win=53798 Len=1440 [TCP segment of a reassembled PDU]"
"305","2.202283","100.69.171.196","204.79.197.200","TLSv1.2","366","Application Data"
"306","2.207735","100.69.171.196","204.79.197.200","TCP","1494","61011  >  443 [ACK] Seq=57418 Ack=41143 Win=53798 Len=1440 [TCP segment of a reassembled PDU]"
"307","2.207737","100.69.171.196","204.79.197.200","TCP","1494","61011  >  443 [ACK] Seq=58858 Ack=41143 Win=53798 Len=1440 [TCP segment of a reassembled PDU]"
"308","2.207769","100.69.171.196","204.79.197.200","TLSv1.2","201","Application Data"
"309","2.209189","204.79.197.200","100.69.171.196","TCP","56","443  >  61011 [ACK] Seq=41143 Ack=53843 Win=16385 Len=0"
"310","2.211167","204.79.197.200","100.69.171.196","TCP","56","443  >  61011 [ACK] Seq=41143 Ack=54226 Win=16383 Len=0"
"311","2.214442","204.79.197.200","100.69.171.196","TCP","56","443  >  61011 [ACK] Seq=41143 Ack=57418 Win=16385 Len=0"
"312","2.218026","204.79.197.200","100.69.171.196","TLSv1.2","201","Application Data"
"313","2.218122","100.69.171.196","204.79.197.200","TCP","54","61011  >  443 [ACK] Seq=60445 Ack=41290 Win=53798 Len=0"
"314","2.219626","204.79.197.200","100.69.171.196","TCP","56","443  >  61011 [ACK] Seq=41290 Ack=60445 Win=16385 Len=0"
"315","2.222929","204.79.197.200","100.69.171.196","TCP","1514","443  >  61011 [ACK] Seq=41290 Ack=60445 Win=16385 Len=1460 [TCP segment of a reassembled PDU]"
"316","2.222930","204.79.197.200","100.69.171.196","TCP","1514","443  >  61011 [ACK] Seq=42750 Ack=60445 Win=16385 Len=1460 [TCP segment of a reassembled PDU]"
"317","2.222931","204.79.197.200","100.69.171.196","TLSv1.2","286","Application Data"
"318","2.222931","204.79.197.200","100.69.171.196","TLSv1.2","92","Application Data"
"319","2.223047","100.69.171.196","204.79.197.200","TCP","54","61011  >  443 [ACK] Seq=60445 Ack=44480 Win=53798 Len=0"
"320","2.258356","204.79.197.200","100.69.171.196","TCP","1514","443  >  61011 [ACK] Seq=44480 Ack=60445 Win=16385 Len=1460 [TCP segment of a reassembled PDU]"
"321","2.258357","204.79.197.200","100.69.171.196","TCP","1514","443  >  61011 [ACK] Seq=45940 Ack=60445 Win=16385 Len=1460 [TCP segment of a reassembled PDU]"
"322","2.258359","204.79.197.200","100.69.171.196","TLSv1.2","741","Application Data"
"323","2.258360","204.79.197.200","100.69.171.196","TLSv1.2","147","Application Data"
"324","2.258360","204.79.197.200","100.69.171.196","TCP","1514","443  >  61011 [ACK] Seq=48180 Ack=60445 Win=16385 Len=1460 [TCP segment of a reassembled PDU]"
"325","2.258362","204.79.197.200","100.69.171.196","TCP","1514","443  >  61011 [ACK] Seq=49640 Ack=60445 Win=16385 Len=1460 [TCP segment of a reassembled PDU]"
"326","2.258363","204.79.197.200","100.69.171.196","TLSv1.2","1268","Application Data"
"327","2.258365","204.79.197.200","100.69.171.196","TCP","1514","443  >  61011 [ACK] Seq=52314 Ack=60445 Win=16385 Len=1460 [TCP segment of a reassembled PDU]"
"328","2.258367","204.79.197.200","100.69.171.196","TCP","1514","443  >  61011 [ACK] Seq=53774 Ack=60445 Win=16385 Len=1460 [TCP segment of a reassembled PDU]"
"329","2.258368","204.79.197.200","100.69.171.196","TLSv1.2","1268","Application Data"
"330","2.258369","204.79.197.200","100.69.171.196","TCP","1514","443  >  61011 [ACK] Seq=56448 Ack=60445 Win=16385 Len=1460 [TCP segment of a reassembled PDU]"
"331","2.258545","100.69.171.196","204.79.197.200","TCP","54","61011  >  443 [ACK] Seq=60445 Ack=57908 Win=53798 Len=0"
"332","2.259816","204.79.197.200","100.69.171.196","TCP","1514","443  >  61011 [ACK] Seq=57908 Ack=60445 Win=16385 Len=1460 [TCP segment of a reassembled PDU]"
"333","2.259817","204.79.197.200","100.69.171.196","TLSv1.2","1268","Application Data"
"334","2.259818","204.79.197.200","100.69.171.196","TCP","1514","443  >  61011 [ACK] Seq=60582 Ack=60445 Win=16385 Len=1460 [TCP segment of a reassembled PDU]"
"335","2.259819","204.79.197.200","100.69.171.196","TCP","1514","443  >  61011 [ACK] Seq=62042 Ack=60445 Win=16385 Len=1460 [TCP segment of a reassembled PDU]"
"336","2.259820","204.79.197.200","100.69.171.196","TLSv1.2","1268","Application Data"
"337","2.259822","204.79.197.200","100.69.171.196","TCP","1514","443  >  61011 [ACK] Seq=64716 Ack=60445 Win=16385 Len=1460 [TCP segment of a reassembled PDU]"
"338","2.259823","204.79.197.200","100.69.171.196","TCP","1514","443  >  61011 [ACK] Seq=66176 Ack=60445 Win=16385 Len=1460 [TCP segment of a reassembled PDU]"
"339","2.259824","204.79.197.200","100.69.171.196","TLSv1.2","1268","Application Data"
"340","2.259824","204.79.197.200","100.69.171.196","TCP","1514","443  >  61011 [ACK] Seq=68850 Ack=60445 Win=16385 Len=1460 [TCP segment of a reassembled PDU]"
"341","2.259825","204.79.197.200","100.69.171.196","TCP","1514","443  >  61011 [ACK] Seq=70310 Ack=60445 Win=16385 Len=1460 [TCP segment of a reassembled PDU]"
"342","2.259826","204.79.197.200","100.69.171.196","TLSv1.2","1268","Application Data"
"343","2.259827","204.79.197.200","100.69.171.196","TCP","1514","443  >  61011 [ACK] Seq=72984 Ack=60445 Win=16385 Len=1460 [TCP segment of a reassembled PDU]"
"344","2.259827","204.79.197.200","100.69.171.196","TCP","1514","443  >  61011 [ACK] Seq=74444 Ack=60445 Win=16385 Len=1460 [TCP segment of a reassembled PDU]"
"345","2.259828","204.79.197.200","100.69.171.196","TLSv1.2","1268","Application Data"
"346","2.259829","204.79.197.200","100.69.171.196","TCP","1514","443  >  61011 [ACK] Seq=77118 Ack=60445 Win=16385 Len=1460 [TCP segment of a reassembled PDU]"
"347","2.259829","204.79.197.200","100.69.171.196","TCP","1514","443  >  61011 [ACK] Seq=78578 Ack=60445 Win=16385 Len=1460 [TCP segment of a reassembled PDU]"
"348","2.259830","204.79.197.200","100.69.171.196","TLSv1.2","1268","Application Data"
"349","2.259831","204.79.197.200","100.69.171.196","TCP","1514","443  >  61011 [ACK] Seq=81252 Ack=60445 Win=16385 Len=1460 [TCP segment of a reassembled PDU]"
"350","2.259832","204.79.197.200","100.69.171.196","TLSv1.2","1106","Application Data"
"351","2.259945","100.69.171.196","204.79.197.200","TCP","54","61011  >  443 [ACK] Seq=60445 Ack=83764 Win=53798 Len=0"
"352","2.276202","100.69.171.196","204.79.197.200","TCP","1494","61011  >  443 [ACK] Seq=60445 Ack=83764 Win=53798 Len=1440 [TCP segment of a reassembled PDU]"
"353","2.276204","100.69.171.196","204.79.197.200","TCP","1494","61011  >  443 [ACK] Seq=61885 Ack=83764 Win=53798 Len=1440 [TCP segment of a reassembled PDU]"
"354","2.276228","100.69.171.196","204.79.197.200","TLSv1.2","275","Application Data"
"355","2.276412","100.69.171.196","204.79.197.200","TCP","1494","61011  >  443 [ACK] Seq=63546 Ack=83764 Win=53798 Len=1440 [TCP segment of a reassembled PDU]"
"356","2.276413","100.69.171.196","204.79.197.200","TCP","1494","61011  >  443 [ACK] Seq=64986 Ack=83764 Win=53798 Len=1440 [TCP segment of a reassembled PDU]"
"357","2.276420","100.69.171.196","204.79.197.200","TLSv1.2","317","Application Data"
"358","2.281489","100.69.171.196","204.79.197.200","TCP","1494","61011  >  443 [ACK] Seq=66689 Ack=83764 Win=53798 Len=1440 [TCP segment of a reassembled PDU]"
"359","2.281490","100.69.171.196","204.79.197.200","TCP","1494","61011  >  443 [ACK] Seq=68129 Ack=83764 Win=53798 Len=1440 [TCP segment of a reassembled PDU]"
"360","2.281514","100.69.171.196","204.79.197.200","TLSv1.2","284","Application Data"
"361","2.281634","100.69.171.196","204.79.197.200","TLSv1.2","502","Application Data"
"362","2.288541","204.79.197.200","100.69.171.196","TCP","56","443  >  61011 [ACK] Seq=83764 Ack=63546 Win=16385 Len=0"
"363","2.288542","204.79.197.200","100.69.171.196","TCP","56","443  >  61011 [ACK] Seq=83764 Ack=66689 Win=16385 Len=0"
"364","2.293705","204.79.197.200","100.69.171.196","TLSv1.2","202","Application Data"
"365","2.293794","100.69.171.196","204.79.197.200","TCP","54","61011  >  443 [ACK] Seq=70247 Ack=83912 Win=53796 Len=0"
"366","2.307398","204.79.197.200","100.69.171.196","TLSv1.2","344","Application Data, Application Data"
"367","2.307508","100.69.171.196","204.79.197.200","TCP","54","61011  >  443 [ACK] Seq=70247 Ack=84202 Win=53798 Len=0"
"370","2.506159","100.69.171.196","204.79.197.200","TCP","1494","61011  >  443 [ACK] Seq=70247 Ack=84202 Win=53798 Len=1440 [TCP segment of a reassembled PDU]"
"371","2.506162","100.69.171.196","204.79.197.200","TCP","1494","61011  >  443 [ACK] Seq=71687 Ack=84202 Win=53798 Len=1440 [TCP segment of a reassembled PDU]"
"372","2.506185","100.69.171.196","204.79.197.200","TLSv1.2","435","Application Data"
"375","2.537655","100.69.171.196","204.79.197.200","TLSv1.2","97","Application Data"
"376","2.568967","100.69.171.196","204.79.197.200","TCP","1494","[TCP Retransmission] 61011  >  443 [PSH, ACK] Seq=72111 Ack=84202 Win=53798 Len=1440"
"380","2.584470","204.79.197.200","100.69.171.196","TCP","66","443  >  61011 [ACK] Seq=84202 Ack=73551 Win=16385 Len=0 SLE=72111 SRE=73551"
"381","2.589256","204.79.197.200","100.69.171.196","TCP","1514","443  >  61011 [ACK] Seq=84202 Ack=73551 Win=16385 Len=1460 [TCP segment of a reassembled PDU]"
"382","2.589257","204.79.197.200","100.69.171.196","TCP","1514","443  >  61011 [ACK] Seq=85662 Ack=73551 Win=16385 Len=1460 [TCP segment of a reassembled PDU]"
"383","2.589258","204.79.197.200","100.69.171.196","TCP","1514","443  >  61011 [ACK] Seq=87122 Ack=73551 Win=16385 Len=1460 [TCP segment of a reassembled PDU]"
"384","2.589378","100.69.171.196","204.79.197.200","TCP","54","61011  >  443 [ACK] Seq=73551 Ack=88582 Win=53798 Len=0"
"385","2.590204","204.79.197.200","100.69.171.196","TCP","1514","443  >  61011 [ACK] Seq=88582 Ack=73551 Win=16385 Len=1460 [TCP segment of a reassembled PDU]"
"386","2.590205","204.79.197.200","100.69.171.196","TCP","1514","443  >  61011 [ACK] Seq=90042 Ack=73551 Win=16385 Len=1460 [TCP segment of a reassembled PDU]"
"387","2.590206","204.79.197.200","100.69.171.196","TCP","1514","443  >  61011 [ACK] Seq=91502 Ack=73551 Win=16385 Len=1460 [TCP segment of a reassembled PDU]"
"388","2.590206","204.79.197.200","100.69.171.196","TLSv1.2","651","Application Data"
"389","2.590207","204.79.197.200","100.69.171.196","TLSv1.2","92","Application Data"
"390","2.590262","100.69.171.196","204.79.197.200","TCP","54","61011  >  443 [ACK] Seq=73551 Ack=93597 Win=53798 Len=0"
"415","2.674802","204.79.197.200","100.69.171.196","TCP","1514","443  >  61011 [ACK] Seq=93597 Ack=73551 Win=16385 Len=1460 [TCP segment of a reassembled PDU]"
"416","2.674803","204.79.197.200","100.69.171.196","TCP","1514","443  >  61011 [ACK] Seq=95057 Ack=73551 Win=16385 Len=1460 [TCP segment of a reassembled PDU]"
"417","2.674804","204.79.197.200","100.69.171.196","TLSv1.2","1211","Application Data"
"418","2.675032","100.69.171.196","204.79.197.200","TCP","54","61011  >  443 [ACK] Seq=73551 Ack=97674 Win=53798 Len=0"
"419","2.677097","204.79.197.200","100.69.171.196","TLSv1.2","142","Application Data"
"420","2.677098","204.79.197.200","100.69.171.196","TCP","1514","443  >  61011 [ACK] Seq=97762 Ack=73551 Win=16385 Len=1460 [TCP segment of a reassembled PDU]"
"421","2.677099","204.79.197.200","100.69.171.196","TCP","1514","443  >  61011 [ACK] Seq=99222 Ack=73551 Win=16385 Len=1460 [TCP segment of a reassembled PDU]"
"422","2.677100","204.79.197.200","100.69.171.196","TLSv1.2","1268","Application Data"
"423","2.677101","204.79.197.200","100.69.171.196","TCP","1514","443  >  61011 [ACK] Seq=101896 Ack=73551 Win=16385 Len=1460 [TCP segment of a reassembled PDU]"
"424","2.677101","204.79.197.200","100.69.171.196","TCP","1514","443  >  61011 [ACK] Seq=103356 Ack=73551 Win=16385 Len=1460 [TCP segment of a reassembled PDU]"
"425","2.677102","204.79.197.200","100.69.171.196","TLSv1.2","1268","Application Data"
"426","2.677103","204.79.197.200","100.69.171.196","TCP","1514","443  >  61011 [ACK] Seq=106030 Ack=73551 Win=16385 Len=1460 [TCP segment of a reassembled PDU]"
"427","2.677103","204.79.197.200","100.69.171.196","TCP","1514","443  >  61011 [ACK] Seq=107490 Ack=73551 Win=16385 Len=1460 [TCP segment of a reassembled PDU]"
"428","2.677104","204.79.197.200","100.69.171.196","TLSv1.2","1268","Application Data"
"429","2.677105","204.79.197.200","100.69.171.196","TCP","1514","443  >  61011 [ACK] Seq=110164 Ack=73551 Win=16385 Len=1460 [TCP segment of a reassembled PDU]"
"430","2.677106","204.79.197.200","100.69.171.196","TCP","1514","443  >  61011 [ACK] Seq=111624 Ack=73551 Win=16385 Len=1460 [TCP segment of a reassembled PDU]"
"431","2.677106","204.79.197.200","100.69.171.196","TLSv1.2","1268","Application Data"
"432","2.677107","204.79.197.200","100.69.171.196","TCP","1514","443  >  61011 [ACK] Seq=114298 Ack=73551 Win=16385 Len=1460 [TCP segment of a reassembled PDU]"
"433","2.677108","204.79.197.200","100.69.171.196","TCP","1514","443  >  61011 [ACK] Seq=115758 Ack=73551 Win=16385 Len=1460 [TCP segment of a reassembled PDU]"
"434","2.677109","204.79.197.200","100.69.171.196","TLSv1.2","1268","Application Data"
"435","2.677109","204.79.197.200","100.69.171.196","TCP","1514","443  >  61011 [ACK] Seq=118432 Ack=73551 Win=16385 Len=1460 [TCP segment of a reassembled PDU]"
"436","2.677110","204.79.197.200","100.69.171.196","TCP","1514","443  >  61011 [ACK] Seq=119892 Ack=73551 Win=16385 Len=1460 [TCP segment of a reassembled PDU]"
"437","2.677111","204.79.197.200","100.69.171.196","TLSv1.2","1268","Application Data"
"438","2.677111","204.79.197.200","100.69.171.196","TCP","1514","443  >  61011 [ACK] Seq=122566 Ack=73551 Win=16385 Len=1460 [TCP segment of a reassembled PDU]"
"439","2.677112","204.79.197.200","100.69.171.196","TCP","1514","443  >  61011 [ACK] Seq=124026 Ack=73551 Win=16385 Len=1460 [TCP segment of a reassembled PDU]"
"440","2.677113","204.79.197.200","100.69.171.196","TLSv1.2","1268","Application Data"
"441","2.677114","204.79.197.200","100.69.171.196","TCP","1514","443  >  61011 [ACK] Seq=126700 Ack=73551 Win=16385 Len=1460 [TCP segment of a reassembled PDU]"
"442","2.677114","204.79.197.200","100.69.171.196","TCP","1514","443  >  61011 [ACK] Seq=128160 Ack=73551 Win=16385 Len=1460 [TCP segment of a reassembled PDU]"
"443","2.677115","204.79.197.200","100.69.171.196","TLSv1.2","1268","Application Data"
"444","2.677116","204.79.197.200","100.69.171.196","TCP","1514","443  >  61011 [ACK] Seq=130834 Ack=73551 Win=16385 Len=1460 [TCP segment of a reassembled PDU]"
"445","2.677117","204.79.197.200","100.69.171.196","TCP","1514","443  >  61011 [ACK] Seq=132294 Ack=73551 Win=16385 Len=1460 [TCP segment of a reassembled PDU]"
"446","2.677117","204.79.197.200","100.69.171.196","TLSv1.2","1268","Application Data"
"447","2.677118","204.79.197.200","100.69.171.196","TCP","1514","443  >  61011 [ACK] Seq=134968 Ack=73551 Win=16385 Len=1460 [TCP segment of a reassembled PDU]"
"448","2.677119","204.79.197.200","100.69.171.196","TCP","1514","443  >  61011 [ACK] Seq=136428 Ack=73551 Win=16385 Len=1460 [TCP segment of a reassembled PDU]"
"449","2.677120","204.79.197.200","100.69.171.196","TLSv1.2","1268","Application Data"
"450","2.677120","204.79.197.200","100.69.171.196","TCP","1514","443  >  61011 [ACK] Seq=139102 Ack=73551 Win=16385 Len=1460 [TCP segment of a reassembled PDU]"
"451","2.677241","100.69.171.196","204.79.197.200","TCP","54","61011  >  443 [ACK] Seq=73551 Ack=140562 Win=53798 Len=0"
"452","2.678866","204.79.197.200","100.69.171.196","TCP","1514","443  >  61011 [ACK] Seq=140562 Ack=73551 Win=16385 Len=1460 [TCP segment of a reassembled PDU]"
"453","2.678866","204.79.197.200","100.69.171.196","TLSv1.2","1268","Application Data"
"454","2.678867","204.79.197.200","100.69.171.196","TCP","1514","443  >  61011 [ACK] Seq=143236 Ack=73551 Win=16385 Len=1460 [TCP segment of a reassembled PDU]"
"455","2.678868","204.79.197.200","100.69.171.196","TCP","1514","443  >  61011 [ACK] Seq=144696 Ack=73551 Win=16385 Len=1460 [TCP segment of a reassembled PDU]"
"456","2.678869","204.79.197.200","100.69.171.196","TLSv1.2","1268","Application Data"
"457","2.678869","204.79.197.200","100.69.171.196","TCP","1514","443  >  61011 [ACK] Seq=147370 Ack=73551 Win=16385 Len=1460 [TCP segment of a reassembled PDU]"
"458","2.678870","204.79.197.200","100.69.171.196","TCP","1514","443  >  61011 [ACK] Seq=148830 Ack=73551 Win=16385 Len=1460 [TCP segment of a reassembled PDU]"
"459","2.678871","204.79.197.200","100.69.171.196","TLSv1.2","1268","Application Data"
"460","2.678871","204.79.197.200","100.69.171.196","TCP","1514","443  >  61011 [ACK] Seq=151504 Ack=73551 Win=16385 Len=1460 [TCP segment of a reassembled PDU]"
"461","2.678872","204.79.197.200","100.69.171.196","TCP","1514","443  >  61011 [ACK] Seq=152964 Ack=73551 Win=16385 Len=1460 [TCP segment of a reassembled PDU]"
"462","2.678873","204.79.197.200","100.69.171.196","TLSv1.2","1268","Application Data"
"463","2.678873","204.79.197.200","100.69.171.196","TCP","1514","443  >  61011 [ACK] Seq=155638 Ack=73551 Win=16385 Len=1460 [TCP segment of a reassembled PDU]"
"464","2.678874","204.79.197.200","100.69.171.196","TCP","1514","443  >  61011 [ACK] Seq=157098 Ack=73551 Win=16385 Len=1460 [TCP segment of a reassembled PDU]"
"465","2.678875","204.79.197.200","100.69.171.196","TLSv1.2","1268","Application Data"
"466","2.678876","204.79.197.200","100.69.171.196","TCP","1514","443  >  61011 [ACK] Seq=159772 Ack=73551 Win=16385 Len=1460 [TCP segment of a reassembled PDU]"
"467","2.678876","204.79.197.200","100.69.171.196","TCP","1514","443  >  61011 [ACK] Seq=161232 Ack=73551 Win=16385 Len=1460 [TCP segment of a reassembled PDU]"
"468","2.678877","204.79.197.200","100.69.171.196","TLSv1.2","1268","Application Data"
"469","2.678878","204.79.197.200","100.69.171.196","TCP","1514","443  >  61011 [ACK] Seq=163906 Ack=73551 Win=16385 Len=1460 [TCP segment of a reassembled PDU]"
"470","2.678878","204.79.197.200","100.69.171.196","TCP","1514","443  >  61011 [ACK] Seq=165366 Ack=73551 Win=16385 Len=1460 [TCP segment of a reassembled PDU]"
"471","2.678879","204.79.197.200","100.69.171.196","TLSv1.2","1268","Application Data"
"472","2.678880","204.79.197.200","100.69.171.196","TCP","1514","443  >  61011 [ACK] Seq=168040 Ack=73551 Win=16385 Len=1460 [TCP segment of a reassembled PDU]"
"473","2.678880","204.79.197.200","100.69.171.196","TCP","1514","443  >  61011 [ACK] Seq=169500 Ack=73551 Win=16385 Len=1460 [TCP segment of a reassembled PDU]"
"474","2.678881","204.79.197.200","100.69.171.196","TLSv1.2","1268","Application Data"
"475","2.678882","204.79.197.200","100.69.171.196","TCP","1514","443  >  61011 [ACK] Seq=172174 Ack=73551 Win=16385 Len=1460 [TCP segment of a reassembled PDU]"
"476","2.678882","204.79.197.200","100.69.171.196","TCP","1514","443  >  61011 [ACK] Seq=173634 Ack=73551 Win=16385 Len=1460 [TCP segment of a reassembled PDU]"
"477","2.678883","204.79.197.200","100.69.171.196","TLSv1.2","1268","Application Data"
"478","2.678985","100.69.171.196","204.79.197.200","TCP","54","61011  >  443 [ACK] Seq=73551 Ack=176308 Win=53798 Len=0"
"479","2.681770","204.79.197.200","100.69.171.196","TCP","1514","443  >  61011 [ACK] Seq=176308 Ack=73551 Win=16385 Len=1460 [TCP segment of a reassembled PDU]"
"480","2.681772","204.79.197.200","100.69.171.196","TCP","1514","443  >  61011 [ACK] Seq=177768 Ack=73551 Win=16385 Len=1460 [TCP segment of a reassembled PDU]"
"481","2.681773","204.79.197.200","100.69.171.196","TLSv1.2","1268","Application Data"
"482","2.681773","204.79.197.200","100.69.171.196","TCP","1514","443  >  61011 [ACK] Seq=180442 Ack=73551 Win=16385 Len=1460 [TCP segment of a reassembled PDU]"
"483","2.681774","204.79.197.200","100.69.171.196","TCP","1514","443  >  61011 [ACK] Seq=181902 Ack=73551 Win=16385 Len=1460 [TCP segment of a reassembled PDU]"
"484","2.681776","204.79.197.200","100.69.171.196","TLSv1.2","1268","Application Data"
"485","2.681777","204.79.197.200","100.69.171.196","TCP","1514","443  >  61011 [ACK] Seq=184576 Ack=73551 Win=16385 Len=1460 [TCP segment of a reassembled PDU]"
"486","2.681778","204.79.197.200","100.69.171.196","TCP","1514","443  >  61011 [ACK] Seq=186036 Ack=73551 Win=16385 Len=1460 [TCP segment of a reassembled PDU]"
"487","2.681779","204.79.197.200","100.69.171.196","TLSv1.2","1268","Application Data"
"488","2.681780","204.79.197.200","100.69.171.196","TCP","1514","443  >  61011 [ACK] Seq=188710 Ack=73551 Win=16385 Len=1460 [TCP segment of a reassembled PDU]"
"489","2.681780","204.79.197.200","100.69.171.196","TCP","1514","443  >  61011 [ACK] Seq=190170 Ack=73551 Win=16385 Len=1460 [TCP segment of a reassembled PDU]"
"490","2.681781","204.79.197.200","100.69.171.196","TLSv1.2","1268","Application Data"
"491","2.681782","204.79.197.200","100.69.171.196","TCP","1514","443  >  61011 [ACK] Seq=192844 Ack=73551 Win=16385 Len=1460 [TCP segment of a reassembled PDU]"
"492","2.681783","204.79.197.200","100.69.171.196","TCP","1514","443  >  61011 [ACK] Seq=194304 Ack=73551 Win=16385 Len=1460 [TCP segment of a reassembled PDU]"
"493","2.681784","204.79.197.200","100.69.171.196","TLSv1.2","1268","Application Data"
"494","2.681785","204.79.197.200","100.69.171.196","TCP","1514","443  >  61011 [ACK] Seq=196978 Ack=73551 Win=16385 Len=1460 [TCP segment of a reassembled PDU]"
"495","2.681786","204.79.197.200","100.69.171.196","TCP","1514","443  >  61011 [ACK] Seq=198438 Ack=73551 Win=16385 Len=1460 [TCP segment of a reassembled PDU]"
"496","2.681787","204.79.197.200","100.69.171.196","TLSv1.2","1268","Application Data"
"497","2.681787","204.79.197.200","100.69.171.196","TCP","1514","443  >  61011 [ACK] Seq=201112 Ack=73551 Win=16385 Len=1460 [TCP segment of a reassembled PDU]"
"498","2.681788","204.79.197.200","100.69.171.196","TCP","1514","443  >  61011 [ACK] Seq=202572 Ack=73551 Win=16385 Len=1460 [TCP segment of a reassembled PDU]"
"499","2.681789","204.79.197.200","100.69.171.196","TLSv1.2","1268","Application Data"
"500","2.681790","204.79.197.200","100.69.171.196","TCP","1514","443  >  61011 [ACK] Seq=205246 Ack=73551 Win=16385 Len=1460 [TCP segment of a reassembled PDU]"
"501","2.681791","204.79.197.200","100.69.171.196","TCP","1514","443  >  61011 [ACK] Seq=206706 Ack=73551 Win=16385 Len=1460 [TCP segment of a reassembled PDU]"
"502","2.681792","204.79.197.200","100.69.171.196","TLSv1.2","1268","Application Data"
"503","2.681792","204.79.197.200","100.69.171.196","TCP","1514","443  >  61011 [ACK] Seq=209380 Ack=73551 Win=16385 Len=1460 [TCP segment of a reassembled PDU]"
