"No.","Time","Source","Destination","Protocol","Length","Info"
"433","1.482243","192.168.0.92","18.160.17.214","TLSv1.2","339","Application Data"
"436","1.501534","18.160.17.214","192.168.0.92","TCP","66","443  >  50106 [ACK] Seq=1 Ack=274 Win=413 Len=0 TSval=2743063394 TSecr=1205496904"
"440","1.514965","18.160.17.214","192.168.0.92","TLSv1.2","630","Application Data"
"441","1.514967","18.160.17.214","192.168.0.92","TLSv1.2","97","Application Data"
"442","1.515127","192.168.0.92","18.160.17.214","TCP","66","50106  >  443 [ACK] Seq=274 Ack=596 Win=8174 Len=0 TSval=1205496937 TSecr=2743063407"
"559","2.154429","192.168.0.92","18.160.17.214","TLSv1.2","402","Application Data"
"562","2.186943","18.160.17.214","192.168.0.92","TLSv1.2","816","Application Data"
"563","2.186944","18.160.17.214","192.168.0.92","TLSv1.2","97","Application Data"
"564","2.187072","192.168.0.92","18.160.17.214","TCP","66","50106  >  443 [ACK] Seq=610 Ack=1377 Win=8171 Len=0 TSval=1205497609 TSecr=2743064077"
"718","2.243960","192.168.0.92","18.160.17.214","TLSv1.2","441","Application Data"
"732","2.298785","18.160.17.214","192.168.0.92","TLSv1.2","1258","Application Data"
"733","2.298786","18.160.17.214","192.168.0.92","TCP","1494","443  >  50106 [ACK] Seq=2569 Ack=985 Win=424 Len=1428 TSval=2743064191 TSecr=1205497665 [TCP segment of a reassembled PDU]"
"734","2.298787","18.160.17.214","192.168.0.92","TCP","1494","443  >  50106 [ACK] Seq=3997 Ack=985 Win=424 Len=1428 TSval=2743064191 TSecr=1205497665 [TCP segment of a reassembled PDU]"
"735","2.298788","18.160.17.214","192.168.0.92","TCP","1494","443  >  50106 [ACK] Seq=5425 Ack=985 Win=424 Len=1428 TSval=2743064191 TSecr=1205497665 [TCP segment of a reassembled PDU]"
"736","2.298789","18.160.17.214","192.168.0.92","TLSv1.2","720","Application Data"
"737","2.298918","192.168.0.92","18.160.17.214","TCP","66","50106  >  443 [ACK] Seq=985 Ack=7507 Win=8088 Len=0 TSval=1205497721 TSecr=2743064191"
"738","2.299031","192.168.0.92","18.160.17.214","TCP","66","[TCP Window Update] 50106  >  443 [ACK] Seq=985 Ack=7507 Win=8183 Len=0 TSval=1205497721 TSecr=2743064191"
"739","2.307193","18.160.17.214","192.168.0.92","TCP","1494","443  >  50106 [ACK] Seq=7507 Ack=985 Win=424 Len=1428 TSval=2743064198 TSecr=1205497665 [TCP segment of a reassembled PDU]"
"740","2.307316","192.168.0.92","18.160.17.214","TCP","66","50106  >  443 [ACK] Seq=985 Ack=8935 Win=8161 Len=0 TSval=1205497729 TSecr=2743064198"
"741","2.309032","18.160.17.214","192.168.0.92","TCP","1494","443  >  50106 [ACK] Seq=8935 Ack=985 Win=424 Len=1428 TSval=2743064198 TSecr=1205497665 [TCP segment of a reassembled PDU]"
"742","2.309033","18.160.17.214","192.168.0.92","TCP","1494","443  >  50106 [ACK] Seq=10363 Ack=985 Win=424 Len=1428 TSval=2743064198 TSecr=1205497665 [TCP segment of a reassembled PDU]"
"743","2.309034","18.160.17.214","192.168.0.92","TCP","1494","443  >  50106 [ACK] Seq=11791 Ack=985 Win=424 Len=1428 TSval=2743064198 TSecr=1205497665 [TCP segment of a reassembled PDU]"
"744","2.309035","18.160.17.214","192.168.0.92","TCP","1494","443  >  50106 [ACK] Seq=13219 Ack=985 Win=424 Len=1428 TSval=2743064198 TSecr=1205497665 [TCP segment of a reassembled PDU]"
"745","2.309036","18.160.17.214","192.168.0.92","TCP","1494","443  >  50106 [ACK] Seq=14647 Ack=985 Win=424 Len=1428 TSval=2743064198 TSecr=1205497665 [TCP segment of a reassembled PDU]"
"746","2.309037","18.160.17.214","192.168.0.92","TLSv1.2","354","Application Data"
"747","2.309037","18.160.17.214","192.168.0.92","TLSv1.2","121","Application Data"
"748","2.309038","18.160.17.214","192.168.0.92","TCP","1494","443  >  50106 [ACK] Seq=16418 Ack=985 Win=424 Len=1428 TSval=2743064200 TSecr=1205497665 [TCP segment of a reassembled PDU]"
"749","2.309039","18.160.17.214","192.168.0.92","TLSv1.2","379","Application Data"
"750","2.309039","18.160.17.214","192.168.0.92","TLSv1.2","555","Application Data"
"751","2.309040","18.160.17.214","192.168.0.92","TCP","1494","443  >  50106 [ACK] Seq=18648 Ack=985 Win=424 Len=1428 TSval=2743064201 TSecr=1205497665 [TCP segment of a reassembled PDU]"
"752","2.309178","192.168.0.92","18.160.17.214","TCP","66","50106  >  443 [ACK] Seq=985 Ack=20076 Win=7987 Len=0 TSval=1205497731 TSecr=2743064201"
"753","2.310723","18.160.17.214","192.168.0.92","TCP","1494","443  >  50106 [ACK] Seq=20076 Ack=985 Win=424 Len=1428 TSval=2743064201 TSecr=1205497665 [TCP segment of a reassembled PDU]"
"754","2.310724","18.160.17.214","192.168.0.92","TCP","1494","443  >  50106 [ACK] Seq=21504 Ack=985 Win=424 Len=1428 TSval=2743064201 TSecr=1205497665 [TCP segment of a reassembled PDU]"
"755","2.310725","18.160.17.214","192.168.0.92","TCP","1494","443  >  50106 [ACK] Seq=22932 Ack=985 Win=424 Len=1428 TSval=2743064201 TSecr=1205497665 [TCP segment of a reassembled PDU]"
"756","2.310726","18.160.17.214","192.168.0.92","TLSv1.2","1284","Application Data"
"757","2.310727","18.160.17.214","192.168.0.92","TLSv1.2","924","Application Data"
"759","2.310855","192.168.0.92","18.160.17.214","TCP","66","50106  >  443 [ACK] Seq=985 Ack=26436 Win=7888 Len=0 TSval=1205497733 TSecr=2743064201"
"760","2.351002","192.168.0.92","18.160.17.214","TCP","66","[TCP Window Update] 50106  >  443 [ACK] Seq=985 Ack=26436 Win=8183 Len=0 TSval=1205497773 TSecr=2743064201"
"761","2.351742","18.160.17.214","192.168.0.92","TCP","1494","443  >  50106 [ACK] Seq=26436 Ack=985 Win=424 Len=1428 TSval=2743064244 TSecr=1205497733 [TCP segment of a reassembled PDU]"
"762","2.351744","18.160.17.214","192.168.0.92","TCP","1494","443  >  50106 [ACK] Seq=27864 Ack=985 Win=424 Len=1428 TSval=2743064244 TSecr=1205497733 [TCP segment of a reassembled PDU]"
"763","2.351745","18.160.17.214","192.168.0.92","TCP","1494","443  >  50106 [ACK] Seq=29292 Ack=985 Win=424 Len=1428 TSval=2743064244 TSecr=1205497733 [TCP segment of a reassembled PDU]"
"764","2.351746","18.160.17.214","192.168.0.92","TCP","1494","443  >  50106 [ACK] Seq=30720 Ack=985 Win=424 Len=1428 TSval=2743064244 TSecr=1205497733 [TCP segment of a reassembled PDU]"
"765","2.351864","192.168.0.92","18.160.17.214","TCP","66","50106  >  443 [ACK] Seq=985 Ack=32148 Win=8094 Len=0 TSval=1205497773 TSecr=2743064244"
"766","2.352612","18.160.17.214","192.168.0.92","TCP","1494","443  >  50106 [ACK] Seq=32148 Ack=985 Win=424 Len=1428 TSval=2743064244 TSecr=1205497733 [TCP segment of a reassembled PDU]"
"767","2.352613","18.160.17.214","192.168.0.92","TCP","1494","443  >  50106 [ACK] Seq=33576 Ack=985 Win=424 Len=1428 TSval=2743064244 TSecr=1205497733 [TCP segment of a reassembled PDU]"
"768","2.352614","18.160.17.214","192.168.0.92","TCP","1494","443  >  50106 [ACK] Seq=35004 Ack=985 Win=424 Len=1428 TSval=2743064244 TSecr=1205497733 [TCP segment of a reassembled PDU]"
"769","2.352614","18.160.17.214","192.168.0.92","TCP","1494","443  >  50106 [ACK] Seq=36432 Ack=985 Win=424 Len=1428 TSval=2743064244 TSecr=1205497733 [TCP segment of a reassembled PDU]"
"770","2.352615","18.160.17.214","192.168.0.92","TCP","1494","443  >  50106 [ACK] Seq=37860 Ack=985 Win=424 Len=1428 TSval=2743064244 TSecr=1205497733 [TCP segment of a reassembled PDU]"
"771","2.352616","18.160.17.214","192.168.0.92","TCP","1494","443  >  50106 [PSH, ACK] Seq=39288 Ack=985 Win=424 Len=1428 TSval=2743064244 TSecr=1205497733 [TCP segment of a reassembled PDU]"
"772","2.352617","18.160.17.214","192.168.0.92","TCP","1494","443  >  50106 [ACK] Seq=40716 Ack=985 Win=424 Len=1428 TSval=2743064244 TSecr=1205497733 [TCP segment of a reassembled PDU]"
"773","2.352617","18.160.17.214","192.168.0.92","TLSv1.2","680","Application Data"
"774","2.352693","192.168.0.92","18.160.17.214","TCP","66","50106  >  443 [ACK] Seq=985 Ack=42758 Win=7928 Len=0 TSval=1205497775 TSecr=2743064244"
"775","2.354437","192.168.0.92","18.160.17.214","TCP","66","[TCP Window Update] 50106  >  443 [ACK] Seq=985 Ack=42758 Win=8183 Len=0 TSval=1205497776 TSecr=2743064244"
"871","3.090248","18.160.17.214","192.168.0.92","TCP","1494","443  >  50106 [ACK] Seq=42758 Ack=985 Win=424 Len=1428 TSval=2743064981 TSecr=1205497776 [TCP segment of a reassembled PDU]"
"872","3.090251","18.160.17.214","192.168.0.92","TCP","1494","443  >  50106 [ACK] Seq=44186 Ack=985 Win=424 Len=1428 TSval=2743064981 TSecr=1205497776 [TCP segment of a reassembled PDU]"
"873","3.090252","18.160.17.214","192.168.0.92","TCP","1494","443  >  50106 [ACK] Seq=45614 Ack=985 Win=424 Len=1428 TSval=2743064981 TSecr=1205497776 [TCP segment of a reassembled PDU]"
"874","3.090253","18.160.17.214","192.168.0.92","TCP","1494","443  >  50106 [ACK] Seq=47042 Ack=985 Win=424 Len=1428 TSval=2743064981 TSecr=1205497776 [TCP segment of a reassembled PDU]"
"875","3.090254","18.160.17.214","192.168.0.92","TCP","1494","443  >  50106 [ACK] Seq=48470 Ack=985 Win=424 Len=1428 TSval=2743064981 TSecr=1205497776 [TCP segment of a reassembled PDU]"
"876","3.090255","18.160.17.214","192.168.0.92","TLSv1.2","1143","Application Data"
"877","3.090256","18.160.17.214","192.168.0.92","TCP","1494","443  >  50106 [ACK] Seq=50975 Ack=985 Win=424 Len=1428 TSval=2743064982 TSecr=1205497776 [TCP segment of a reassembled PDU]"
"878","3.090257","18.160.17.214","192.168.0.92","TCP","1494","443  >  50106 [ACK] Seq=52403 Ack=985 Win=424 Len=1428 TSval=2743064982 TSecr=1205497776 [TCP segment of a reassembled PDU]"
"879","3.090258","18.160.17.214","192.168.0.92","TCP","1494","443  >  50106 [ACK] Seq=53831 Ack=985 Win=424 Len=1428 TSval=2743064982 TSecr=1205497776 [TCP segment of a reassembled PDU]"
"880","3.090259","18.160.17.214","192.168.0.92","TCP","1494","443  >  50106 [ACK] Seq=55259 Ack=985 Win=424 Len=1428 TSval=2743064982 TSecr=1205497776 [TCP segment of a reassembled PDU]"
"881","3.090259","18.160.17.214","192.168.0.92","TCP","1494","443  >  50106 [ACK] Seq=56687 Ack=985 Win=424 Len=1428 TSval=2743064982 TSecr=1205497776 [TCP segment of a reassembled PDU]"
"882","3.090260","18.160.17.214","192.168.0.92","TLSv1.2","1141","Application Data"
"883","3.090260","18.160.17.214","192.168.0.92","TCP","1494","443  >  50106 [ACK] Seq=59190 Ack=985 Win=424 Len=1428 TSval=2743064982 TSecr=1205497776 [TCP segment of a reassembled PDU]"
"884","3.090402","192.168.0.92","18.160.17.214","TCP","66","50106  >  443 [ACK] Seq=985 Ack=58115 Win=7943 Len=0 TSval=1205498512 TSecr=2743064982"
"885","3.090454","192.168.0.92","18.160.17.214","TCP","66","50106  >  443 [ACK] Seq=985 Ack=60618 Win=7904 Len=0 TSval=1205498512 TSecr=2743064982"
"886","3.090675","192.168.0.92","18.160.17.214","TCP","66","[TCP Window Update] 50106  >  443 [ACK] Seq=985 Ack=60618 Win=8183 Len=0 TSval=1205498512 TSecr=2743064982"
"887","3.091336","18.160.17.214","192.168.0.92","TCP","1494","443  >  50106 [ACK] Seq=60618 Ack=985 Win=424 Len=1428 TSval=2743064982 TSecr=1205497776 [TCP segment of a reassembled PDU]"
"888","3.091337","18.160.17.214","192.168.0.92","TCP","1494","443  >  50106 [ACK] Seq=62046 Ack=985 Win=424 Len=1428 TSval=2743064982 TSecr=1205497776 [TCP segment of a reassembled PDU]"
"889","3.091338","18.160.17.214","192.168.0.92","TCP","1494","443  >  50106 [ACK] Seq=63474 Ack=985 Win=424 Len=1428 TSval=2743064982 TSecr=1205497776 [TCP segment of a reassembled PDU]"
"890","3.091339","18.160.17.214","192.168.0.92","TCP","1494","443  >  50106 [ACK] Seq=64902 Ack=985 Win=424 Len=1428 TSval=2743064982 TSecr=1205497776 [TCP segment of a reassembled PDU]"
"891","3.091340","18.160.17.214","192.168.0.92","TLSv1.2","834","Application Data"
"892","3.091410","192.168.0.92","18.160.17.214","TCP","66","50106  >  443 [ACK] Seq=985 Ack=67098 Win=8082 Len=0 TSval=1205498514 TSecr=2743064982"
"893","3.092025","192.168.0.92","18.160.17.214","TCP","66","[TCP Window Update] 50106  >  443 [ACK] Seq=985 Ack=67098 Win=8183 Len=0 TSval=1205498514 TSecr=2743064982"
"895","3.118024","18.160.17.214","192.168.0.92","TCP","1494","443  >  50106 [ACK] Seq=67098 Ack=985 Win=424 Len=1428 TSval=2743065009 TSecr=1205498514 [TCP segment of a reassembled PDU]"
"896","3.118026","18.160.17.214","192.168.0.92","TCP","1494","443  >  50106 [ACK] Seq=68526 Ack=985 Win=424 Len=1428 TSval=2743065009 TSecr=1205498514 [TCP segment of a reassembled PDU]"
"897","3.118027","18.160.17.214","192.168.0.92","TLSv1.2","1185","Application Data"
"898","3.118144","192.168.0.92","18.160.17.214","TCP","66","50106  >  443 [ACK] Seq=985 Ack=71073 Win=8121 Len=0 TSval=1205498540 TSecr=2743065009"
"899","3.120584","192.168.0.92","18.160.17.214","TCP","66","[TCP Window Update] 50106  >  443 [ACK] Seq=985 Ack=71073 Win=8183 Len=0 TSval=1205498543 TSecr=2743065009"
"1093","3.489196","192.168.0.92","18.160.17.214","TLSv1.2","1172","Application Data"
"1094","3.552413","18.160.17.214","192.168.0.92","TCP","66","443  >  50106 [ACK] Seq=71073 Ack=2091 Win=430 Len=0 TSval=2743065445 TSecr=1205498911"
"1097","3.620765","192.168.0.92","18.160.17.214","TLSv1.2","774","Application Data"
"1101","3.638805","18.160.17.214","192.168.0.92","TCP","66","443  >  50106 [ACK] Seq=71073 Ack=2799 Win=435 Len=0 TSval=2743065531 TSecr=1205499043"
"1102","3.642984","18.160.17.214","192.168.0.92","TLSv1.2","509","Application Data"
"1103","3.642985","18.160.17.214","192.168.0.92","TLSv1.2","97","Application Data"
"1104","3.643086","192.168.0.92","18.160.17.214","TCP","66","50106  >  443 [ACK] Seq=2799 Ack=71547 Win=8176 Len=0 TSval=1205499065 TSecr=2743065535"
"1105","3.664868","192.168.0.92","18.160.17.214","TLSv1.2","645","Application Data"
"1106","3.665345","192.168.0.92","18.160.17.214","TCP","1494","50106  >  443 [ACK] Seq=3378 Ack=71547 Win=8183 Len=1428 TSval=1205499087 TSecr=2743065535 [TCP segment of a reassembled PDU]"
"1107","3.665358","192.168.0.92","18.160.17.214","TLSv1.2","1209","Application Data"
"1108","3.675672","192.168.0.92","18.160.17.214","TLSv1.2","444","Application Data"
"1109","3.676572","192.168.0.92","18.160.17.214","TCP","1494","50106  >  443 [ACK] Seq=6327 Ack=71547 Win=8183 Len=1428 TSval=1205499099 TSecr=2743065535 [TCP segment of a reassembled PDU]"
"1110","3.676595","192.168.0.92","18.160.17.214","TLSv1.2","1174","Application Data"
"1111","3.685948","192.168.0.92","18.160.17.214","TLSv1.2","444","Application Data"
"1112","3.686802","192.168.0.92","18.160.17.214","TCP","1494","50106  >  443 [ACK] Seq=9241 Ack=71547 Win=8183 Len=1428 TSval=1205499108 TSecr=2743065535 [TCP segment of a reassembled PDU]"
"1113","3.686815","192.168.0.92","18.160.17.214","TLSv1.2","1174","Application Data"
"1114","3.688816","18.160.17.214","192.168.0.92","TCP","66","443  >  50106 [ACK] Seq=71547 Ack=5949 Win=451 Len=0 TSval=2743065582 TSecr=1205499087"
"1115","3.692380","192.168.0.92","18.160.17.214","TLSv1.2","444","Application Data"
"1116","3.693126","192.168.0.92","18.160.17.214","TCP","1494","50106  >  443 [ACK] Seq=12155 Ack=71547 Win=8183 Len=1428 TSval=1205499114 TSecr=2743065582 [TCP segment of a reassembled PDU]"
"1117","3.693147","192.168.0.92","18.160.17.214","TLSv1.2","1174","Application Data"
"1118","3.697095","18.160.17.214","192.168.0.92","TCP","66","443  >  50106 [ACK] Seq=71547 Ack=8863 Win=466 Len=0 TSval=2743065589 TSecr=1205499097"
"1119","3.709473","18.160.17.214","192.168.0.92","TCP","66","443  >  50106 [ACK] Seq=71547 Ack=11777 Win=482 Len=0 TSval=2743065601 TSecr=1205499108"
"1120","3.717972","18.160.17.214","192.168.0.92","TCP","66","443  >  50106 [ACK] Seq=71547 Ack=14691 Win=497 Len=0 TSval=2743065608 TSecr=1205499114"
"1121","3.747008","18.160.17.214","192.168.0.92","TCP","1494","443  >  50106 [ACK] Seq=71547 Ack=14691 Win=497 Len=1428 TSval=2743065638 TSecr=1205499114 [TCP segment of a reassembled PDU]"
"1122","3.747098","192.168.0.92","18.160.17.214","TCP","66","50106  >  443 [ACK] Seq=14691 Ack=72975 Win=8161 Len=0 TSval=1205499169 TSecr=2743065638"
"1123","3.748242","18.160.17.214","192.168.0.92","TCP","1494","443  >  50106 [ACK] Seq=72975 Ack=14691 Win=497 Len=1428 TSval=2743065638 TSecr=1205499114 [TCP segment of a reassembled PDU]"
"1124","3.748243","18.160.17.214","192.168.0.92","TCP","1494","443  >  50106 [ACK] Seq=74403 Ack=14691 Win=497 Len=1428 TSval=2743065638 TSecr=1205499114 [TCP segment of a reassembled PDU]"
"1125","3.748244","18.160.17.214","192.168.0.92","TCP","1494","443  >  50106 [ACK] Seq=75831 Ack=14691 Win=497 Len=1428 TSval=2743065638 TSecr=1205499114 [TCP segment of a reassembled PDU]"
"1126","3.748244","18.160.17.214","192.168.0.92","TCP","1494","443  >  50106 [ACK] Seq=77259 Ack=14691 Win=497 Len=1428 TSval=2743065638 TSecr=1205499114 [TCP segment of a reassembled PDU]"
"1127","3.748245","18.160.17.214","192.168.0.92","TCP","1494","443  >  50106 [ACK] Seq=78687 Ack=14691 Win=497 Len=1428 TSval=2743065638 TSecr=1205499114 [TCP segment of a reassembled PDU]"
"1128","3.748246","18.160.17.214","192.168.0.92","TCP","1494","443  >  50106 [ACK] Seq=80115 Ack=14691 Win=497 Len=1428 TSval=2743065638 TSecr=1205499114 [TCP segment of a reassembled PDU]"
"1129","3.748246","18.160.17.214","192.168.0.92","TCP","1494","443  >  50106 [ACK] Seq=81543 Ack=14691 Win=497 Len=1428 TSval=2743065638 TSecr=1205499114 [TCP segment of a reassembled PDU]"
"1130","3.748247","18.160.17.214","192.168.0.92","TCP","1494","443  >  50106 [ACK] Seq=82971 Ack=14691 Win=497 Len=1428 TSval=2743065638 TSecr=1205499114 [TCP segment of a reassembled PDU]"
"1131","3.748248","18.160.17.214","192.168.0.92","TLSv1.2","354","Application Data"
"1132","3.748350","192.168.0.92","18.160.17.214","TCP","66","50106  >  443 [ACK] Seq=14691 Ack=84687 Win=8000 Len=0 TSval=1205499170 TSecr=2743065638"
"1133","3.748420","192.168.0.92","18.160.17.214","TCP","66","[TCP Window Update] 50106  >  443 [ACK] Seq=14691 Ack=84687 Win=8183 Len=0 TSval=1205499170 TSecr=2743065638"
"1134","3.755274","18.160.17.214","192.168.0.92","TCP","1494","443  >  50106 [ACK] Seq=84687 Ack=14691 Win=497 Len=1428 TSval=2743065647 TSecr=1205499114 [TCP segment of a reassembled PDU]"
"1135","3.755370","192.168.0.92","18.160.17.214","TCP","66","50106  >  443 [ACK] Seq=14691 Ack=86115 Win=8161 Len=0 TSval=1205499177 TSecr=2743065647"
"1136","3.757913","18.160.17.214","192.168.0.92","TCP","1494","443  >  50106 [ACK] Seq=86115 Ack=14691 Win=497 Len=1428 TSval=2743065647 TSecr=1205499114 [TCP segment of a reassembled PDU]"
"1137","3.757914","18.160.17.214","192.168.0.92","TCP","1494","443  >  50106 [ACK] Seq=87543 Ack=14691 Win=497 Len=1428 TSval=2743065647 TSecr=1205499114 [TCP segment of a reassembled PDU]"
"1138","3.757915","18.160.17.214","192.168.0.92","TCP","1494","443  >  50106 [ACK] Seq=88971 Ack=14691 Win=497 Len=1428 TSval=2743065647 TSecr=1205499114 [TCP segment of a reassembled PDU]"
"1139","3.757916","18.160.17.214","192.168.0.92","TCP","1494","443  >  50106 [ACK] Seq=90399 Ack=14691 Win=497 Len=1428 TSval=2743065647 TSecr=1205499114 [TCP segment of a reassembled PDU]"
"1140","3.757917","18.160.17.214","192.168.0.92","TCP","1494","443  >  50106 [ACK] Seq=91827 Ack=14691 Win=497 Len=1428 TSval=2743065647 TSecr=1205499114 [TCP segment of a reassembled PDU]"
"1141","3.757918","18.160.17.214","192.168.0.92","TCP","1494","443  >  50106 [ACK] Seq=93255 Ack=14691 Win=497 Len=1428 TSval=2743065647 TSecr=1205499114 [TCP segment of a reassembled PDU]"
"1142","3.757919","18.160.17.214","192.168.0.92","TLSv1.2","258","Application Data"
"1143","3.757919","18.160.17.214","192.168.0.92","TCP","1494","443  >  50106 [ACK] Seq=94875 Ack=14691 Win=497 Len=1428 TSval=2743065649 TSecr=1205499114 [TCP segment of a reassembled PDU]"
"1144","3.757920","18.160.17.214","192.168.0.92","TCP","1494","443  >  50106 [ACK] Seq=96303 Ack=14691 Win=497 Len=1428 TSval=2743065649 TSecr=1205499114 [TCP segment of a reassembled PDU]"
"1145","3.757921","18.160.17.214","192.168.0.92","TLSv1.2","950","Application Data"
"1146","3.758267","192.168.0.92","18.160.17.214","TCP","66","50106  >  443 [ACK] Seq=14691 Ack=98615 Win=7988 Len=0 TSval=1205499180 TSecr=2743065649"
"1147","3.759417","192.168.0.92","18.160.17.214","TCP","66","[TCP Window Update] 50106  >  443 [ACK] Seq=14691 Ack=98615 Win=8183 Len=0 TSval=1205499182 TSecr=2743065649"
"1148","3.791929","18.160.17.214","192.168.0.92","TCP","1494","443  >  50106 [ACK] Seq=98615 Ack=14691 Win=497 Len=1428 TSval=2743065683 TSecr=1205499182 [TCP segment of a reassembled PDU]"
"1149","3.792021","192.168.0.92","18.160.17.214","TCP","66","50106  >  443 [ACK] Seq=14691 Ack=100043 Win=8161 Len=0 TSval=1205499214 TSecr=2743065683"
"1150","3.795306","18.160.17.214","192.168.0.92","TCP","1494","443  >  50106 [ACK] Seq=100043 Ack=14691 Win=497 Len=1428 TSval=2743065683 TSecr=1205499182 [TCP segment of a reassembled PDU]"
"1151","3.795308","18.160.17.214","192.168.0.92","TLSv1.2","1070","Application Data"
"1152","3.795308","18.160.17.214","192.168.0.92","TCP","1494","443  >  50106 [ACK] Seq=102475 Ack=14691 Win=497 Len=1428 TSval=2743065683 TSecr=1205499182 [TCP segment of a reassembled PDU]"
"1153","3.795309","18.160.17.214","192.168.0.92","TLSv1.2","1007","Application Data"
"1154","3.795310","18.160.17.214","192.168.0.92","TLSv1.2","1231","Application Data"
"1155","3.795311","18.160.17.214","192.168.0.92","TLSv1.2","242","Application Data"
"1156","3.795312","18.160.17.214","192.168.0.92","TLSv1.2","1412","Application Data"
"1157","3.795313","18.160.17.214","192.168.0.92","TLSv1.2","118","Application Data"
"1158","3.795313","18.160.17.214","192.168.0.92","TLSv1.2","97","Application Data"
"1159","3.795420","192.168.0.92","18.160.17.214","TCP","66","50106  >  443 [ACK] Seq=14691 Ack=107614 Win=8065 Len=0 TSval=1205499218 TSecr=2743065684"
"1160","3.795575","192.168.0.92","18.160.17.214","TCP","66","[TCP Window Update] 50106  >  443 [ACK] Seq=14691 Ack=107614 Win=8183 Len=0 TSval=1205499218 TSecr=2743065684"
"1161","3.811454","18.160.17.214","192.168.0.92","TCP","1494","443  >  50106 [ACK] Seq=107614 Ack=14691 Win=497 Len=1428 TSval=2743065703 TSecr=1205499182 [TCP segment of a reassembled PDU]"
"1162","3.811544","192.168.0.92","18.160.17.214","TCP","66","50106  >  443 [ACK] Seq=14691 Ack=109042 Win=8161 Len=0 TSval=1205499234 TSecr=2743065703"
"1163","3.813206","18.160.17.214","192.168.0.92","TCP","1494","443  >  50106 [ACK] Seq=109042 Ack=14691 Win=497 Len=1428 TSval=2743065703 TSecr=1205499182 [TCP segment of a reassembled PDU]"
"1164","3.813208","18.160.17.214","192.168.0.92","TCP","1494","443  >  50106 [ACK] Seq=110470 Ack=14691 Win=497 Len=1428 TSval=2743065703 TSecr=1205499182 [TCP segment of a reassembled PDU]"
"1165","3.813209","18.160.17.214","192.168.0.92","TCP","1494","443  >  50106 [ACK] Seq=111898 Ack=14691 Win=497 Len=1428 TSval=2743065703 TSecr=1205499182 [TCP segment of a reassembled PDU]"
"1166","3.813209","18.160.17.214","192.168.0.92","TCP","1494","443  >  50106 [ACK] Seq=113326 Ack=14691 Win=497 Len=1428 TSval=2743065703 TSecr=1205499182 [TCP segment of a reassembled PDU]"
"1167","3.813210","18.160.17.214","192.168.0.92","TCP","1494","443  >  50106 [ACK] Seq=114754 Ack=14691 Win=497 Len=1428 TSval=2743065703 TSecr=1205499182 [TCP segment of a reassembled PDU]"
"1168","3.813211","18.160.17.214","192.168.0.92","TCP","1494","443  >  50106 [ACK] Seq=116182 Ack=14691 Win=497 Len=1428 TSval=2743065703 TSecr=1205499182 [TCP segment of a reassembled PDU]"
"1169","3.813212","18.160.17.214","192.168.0.92","TCP","1494","443  >  50106 [ACK] Seq=117610 Ack=14691 Win=497 Len=1428 TSval=2743065703 TSecr=1205499182 [TCP segment of a reassembled PDU]"
"1170","3.813212","18.160.17.214","192.168.0.92","TCP","1494","443  >  50106 [ACK] Seq=119038 Ack=14691 Win=497 Len=1428 TSval=2743065703 TSecr=1205499182 [TCP segment of a reassembled PDU]"
"1171","3.813213","18.160.17.214","192.168.0.92","TCP","1494","443  >  50106 [PSH, ACK] Seq=120466 Ack=14691 Win=497 Len=1428 TSval=2743065703 TSecr=1205499182 [TCP segment of a reassembled PDU]"
"1172","3.813214","18.160.17.214","192.168.0.92","TLSv1.2","140","Application Data"
"1173","3.813308","192.168.0.92","18.160.17.214","TCP","66","50106  >  443 [ACK] Seq=14691 Ack=121968 Win=7981 Len=0 TSval=1205499235 TSecr=2743065703"
"1174","3.813404","192.168.0.92","18.160.17.214","TCP","66","[TCP Window Update] 50106  >  443 [ACK] Seq=14691 Ack=121968 Win=8183 Len=0 TSval=1205499235 TSecr=2743065703"
"1175","3.814249","18.160.17.214","192.168.0.92","TCP","1494","443  >  50106 [ACK] Seq=121968 Ack=14691 Win=497 Len=1428 TSval=2743065706 TSecr=1205499218 [TCP segment of a reassembled PDU]"
"1176","3.814333","192.168.0.92","18.160.17.214","TCP","66","50106  >  443 [ACK] Seq=14691 Ack=123396 Win=8161 Len=0 TSval=1205499236 TSecr=2743065706"
"1177","3.816496","18.160.17.214","192.168.0.92","TCP","1494","443  >  50106 [ACK] Seq=123396 Ack=14691 Win=497 Len=1428 TSval=2743065706 TSecr=1205499218 [TCP segment of a reassembled PDU]"
"1178","3.816498","18.160.17.214","192.168.0.92","TCP","1494","443  >  50106 [ACK] Seq=124824 Ack=14691 Win=497 Len=1428 TSval=2743065706 TSecr=1205499218 [TCP segment of a reassembled PDU]"
"1179","3.816499","18.160.17.214","192.168.0.92","TCP","1494","443  >  50106 [ACK] Seq=126252 Ack=14691 Win=497 Len=1428 TSval=2743065706 TSecr=1205499218 [TCP segment of a reassembled PDU]"
"1180","3.816500","18.160.17.214","192.168.0.92","TCP","1494","443  >  50106 [ACK] Seq=127680 Ack=14691 Win=497 Len=1428 TSval=2743065706 TSecr=1205499218 [TCP segment of a reassembled PDU]"
"1181","3.816500","18.160.17.214","192.168.0.92","TCP","1494","443  >  50106 [ACK] Seq=129108 Ack=14691 Win=497 Len=1428 TSval=2743065706 TSecr=1205499218 [TCP segment of a reassembled PDU]"
"1182","3.816501","18.160.17.214","192.168.0.92","TCP","1494","443  >  50106 [ACK] Seq=130536 Ack=14691 Win=497 Len=1428 TSval=2743065706 TSecr=1205499218 [TCP segment of a reassembled PDU]"
"1183","3.816501","18.160.17.214","192.168.0.92","TCP","1494","443  >  50106 [ACK] Seq=131964 Ack=14691 Win=497 Len=1428 TSval=2743065706 TSecr=1205499218 [TCP segment of a reassembled PDU]"
"1184","3.816502","18.160.17.214","192.168.0.92","TCP","1494","443  >  50106 [ACK] Seq=133392 Ack=14691 Win=497 Len=1428 TSval=2743065706 TSecr=1205499218 [TCP segment of a reassembled PDU]"
"1185","3.816503","18.160.17.214","192.168.0.92","TCP","1494","443  >  50106 [PSH, ACK] Seq=134820 Ack=14691 Win=497 Len=1428 TSval=2743065706 TSecr=1205499218 [TCP segment of a reassembled PDU]"
"1186","3.816503","18.160.17.214","192.168.0.92","TCP","1494","443  >  50106 [ACK] Seq=136248 Ack=14691 Win=497 Len=1428 TSval=2743065707 TSecr=1205499218 [TCP segment of a reassembled PDU]"
"1187","3.816504","18.160.17.214","192.168.0.92","TLSv1.2","790","Application Data, Application Data"
"1188","3.816505","18.160.17.214","192.168.0.92","TCP","1494","443  >  50106 [ACK] Seq=138400 Ack=14691 Win=497 Len=1428 TSval=2743065708 TSecr=1205499218 [TCP segment of a reassembled PDU]"
"1189","3.816603","192.168.0.92","18.160.17.214","TCP","66","50106  >  443 [ACK] Seq=14691 Ack=138400 Win=7949 Len=0 TSval=1205499239 TSecr=2743065707"
"1190","3.816649","192.168.0.92","18.160.17.214","TCP","66","50106  >  443 [ACK] Seq=14691 Ack=139828 Win=7927 Len=0 TSval=1205499239 TSecr=2743065708"
"1191","3.816703","192.168.0.92","18.160.17.214","TCP","66","[TCP Window Update] 50106  >  443 [ACK] Seq=14691 Ack=139828 Win=8183 Len=0 TSval=1205499239 TSecr=2743065708"
"1192","3.819924","18.160.17.214","192.168.0.92","TCP","1494","443  >  50106 [ACK] Seq=139828 Ack=14691 Win=497 Len=1428 TSval=2743065708 TSecr=1205499218 [TCP segment of a reassembled PDU]"
"1193","3.819926","18.160.17.214","192.168.0.92","TCP","1494","443  >  50106 [ACK] Seq=141256 Ack=14691 Win=497 Len=1428 TSval=2743065708 TSecr=1205499218 [TCP segment of a reassembled PDU]"
"1194","3.819927","18.160.17.214","192.168.0.92","TCP","1494","443  >  50106 [ACK] Seq=142684 Ack=14691 Win=497 Len=1428 TSval=2743065708 TSecr=1205499218 [TCP segment of a reassembled PDU]"
"1195","3.819927","18.160.17.214","192.168.0.92","TCP","1494","443  >  50106 [ACK] Seq=144112 Ack=14691 Win=497 Len=1428 TSval=2743065708 TSecr=1205499218 [TCP segment of a reassembled PDU]"
"1196","3.819928","18.160.17.214","192.168.0.92","TCP","1494","443  >  50106 [ACK] Seq=145540 Ack=14691 Win=497 Len=1428 TSval=2743065708 TSecr=1205499218 [TCP segment of a reassembled PDU]"
"1197","3.819928","18.160.17.214","192.168.0.92","TCP","1494","443  >  50106 [ACK] Seq=146968 Ack=14691 Win=497 Len=1428 TSval=2743065708 TSecr=1205499218 [TCP segment of a reassembled PDU]"
"1198","3.819929","18.160.17.214","192.168.0.92","TCP","1494","443  >  50106 [ACK] Seq=148396 Ack=14691 Win=497 Len=1428 TSval=2743065708 TSecr=1205499218 [TCP segment of a reassembled PDU]"
"1199","3.819930","18.160.17.214","192.168.0.92","TCP","1494","443  >  50106 [ACK] Seq=149824 Ack=14691 Win=497 Len=1428 TSval=2743065708 TSecr=1205499218 [TCP segment of a reassembled PDU]"
"1200","3.819930","18.160.17.214","192.168.0.92","TCP","1494","443  >  50106 [PSH, ACK] Seq=151252 Ack=14691 Win=497 Len=1428 TSval=2743065708 TSecr=1205499218 [TCP segment of a reassembled PDU]"
"1201","3.819931","18.160.17.214","192.168.0.92","TCP","1494","443  >  50106 [ACK] Seq=152680 Ack=14691 Win=497 Len=1428 TSval=2743065708 TSecr=1205499218 [TCP segment of a reassembled PDU]"
"1202","3.819932","18.160.17.214","192.168.0.92","TLSv1.2","764","Application Data"
"1203","3.819932","18.160.17.214","192.168.0.92","TCP","1494","443  >  50106 [ACK] Seq=154806 Ack=14691 Win=497 Len=1428 TSval=2743065708 TSecr=1205499218 [TCP segment of a reassembled PDU]"
"1204","3.819933","18.160.17.214","192.168.0.92","TCP","1494","443  >  50106 [ACK] Seq=156234 Ack=14691 Win=497 Len=1428 TSval=2743065708 TSecr=1205499218 [TCP segment of a reassembled PDU]"
"1205","3.819934","18.160.17.214","192.168.0.92","TCP","1494","443  >  50106 [ACK] Seq=157662 Ack=14691 Win=497 Len=1428 TSval=2743065708 TSecr=1205499218 [TCP segment of a reassembled PDU]"
"1206","3.819934","18.160.17.214","192.168.0.92","TLSv1.2","1145","Application Data"
"1207","3.819935","18.160.17.214","192.168.0.92","TLSv1.2","97","Application Data"
"1208","3.820036","192.168.0.92","18.160.17.214","TCP","66","50106  >  443 [ACK] Seq=14691 Ack=154806 Win=7949 Len=0 TSval=1205499242 TSecr=2743065708"
"1209","3.820082","192.168.0.92","18.160.17.214","TCP","66","50106  >  443 [ACK] Seq=14691 Ack=160200 Win=7865 Len=0 TSval=1205499242 TSecr=2743065709"
"1210","3.820349","192.168.0.92","18.160.17.214","TCP","66","[TCP Window Update] 50106  >  443 [ACK] Seq=14691 Ack=160200 Win=8183 Len=0 TSval=1205499242 TSecr=2743065709"
"1225","3.889522","18.160.17.214","192.168.0.92","TCP","1494","443  >  50106 [ACK] Seq=160200 Ack=14691 Win=497 Len=1428 TSval=2743065781 TSecr=1205499242 [TCP segment of a reassembled PDU]"
"1226","3.889638","192.168.0.92","18.160.17.214","TCP","66","50106  >  443 [ACK] Seq=14691 Ack=161628 Win=8161 Len=0 TSval=1205499312 TSecr=2743065781"
"1227","3.891385","18.160.17.214","192.168.0.92","TCP","1494","443  >  50106 [ACK] Seq=161628 Ack=14691 Win=497 Len=1428 TSval=2743065781 TSecr=1205499242 [TCP segment of a reassembled PDU]"
"1228","3.891386","18.160.17.214","192.168.0.92","TCP","1494","443  >  50106 [ACK] Seq=163056 Ack=14691 Win=497 Len=1428 TSval=2743065781 TSecr=1205499242 [TCP segment of a reassembled PDU]"
"1229","3.891387","18.160.17.214","192.168.0.92","TCP","1494","443  >  50106 [ACK] Seq=164484 Ack=14691 Win=497 Len=1428 TSval=2743065781 TSecr=1205499242 [TCP segment of a reassembled PDU]"
"1230","3.891388","18.160.17.214","192.168.0.92","TLSv1.2","658","Application Data"
"1231","3.891389","18.160.17.214","192.168.0.92","TLSv1.2","97","Application Data"
"1232","3.891496","192.168.0.92","18.160.17.214","TCP","66","50106  >  443 [ACK] Seq=14691 Ack=166535 Win=8107 Len=0 TSval=1205499314 TSecr=2743065782"
"1233","3.891617","192.168.0.92","18.160.17.214","TCP","66","[TCP Window Update] 50106  >  443 [ACK] Seq=14691 Ack=166535 Win=8183 Len=0 TSval=1205499314 TSecr=2743065782"
"1244","3.903600","18.160.17.214","192.168.0.92","TCP","1494","443  >  50106 [ACK] Seq=166535 Ack=14691 Win=497 Len=1428 TSval=2743065795 TSecr=1205499242 [TCP segment of a reassembled PDU]"
"1245","3.905279","18.160.17.214","192.168.0.92","TCP","1494","443  >  50106 [ACK] Seq=167963 Ack=14691 Win=497 Len=1428 TSval=2743065795 TSecr=1205499242 [TCP segment of a reassembled PDU]"
"1246","3.905281","18.160.17.214","192.168.0.92","TCP","1494","443  >  50106 [ACK] Seq=169391 Ack=14691 Win=497 Len=1428 TSval=2743065795 TSecr=1205499242 [TCP segment of a reassembled PDU]"
"1247","3.905283","18.160.17.214","192.168.0.92","TCP","1494","443  >  50106 [ACK] Seq=170819 Ack=14691 Win=497 Len=1428 TSval=2743065795 TSecr=1205499242 [TCP segment of a reassembled PDU]"
"1248","3.905283","18.160.17.214","192.168.0.92","TLSv1.2","1021","Application Data"
"1249","3.905284","18.160.17.214","192.168.0.92","TLSv1.2","97","Application Data"
"1251","3.907663","192.168.0.92","18.160.17.214","TCP","66","50106  >  443 [ACK] Seq=14691 Ack=173233 Win=8183 Len=0 TSval=1205499329 TSecr=2743065795"
"1252","3.907884","18.160.17.214","192.168.0.92","TCP","1494","443  >  50106 [ACK] Seq=173233 Ack=14691 Win=497 Len=1428 TSval=2743065800 TSecr=1205499242 [TCP segment of a reassembled PDU]"
"1253","3.907885","18.160.17.214","192.168.0.92","TCP","1494","443  >  50106 [ACK] Seq=174661 Ack=14691 Win=497 Len=1428 TSval=2743065800 TSecr=1205499242 [TCP segment of a reassembled PDU]"
"1254","3.907886","18.160.17.214","192.168.0.92","TLSv1.2","423","Application Data"
"1255","3.907887","18.160.17.214","192.168.0.92","TCP","1494","443  >  50106 [ACK] Seq=176446 Ack=14691 Win=497 Len=1428 TSval=2743065800 TSecr=1205499242 [TCP segment of a reassembled PDU]"
"1256","3.907889","18.160.17.214","192.168.0.92","TCP","1494","443  >  50106 [ACK] Seq=177874 Ack=14691 Win=497 Len=1428 TSval=2743065800 TSecr=1205499242 [TCP segment of a reassembled PDU]"
"1257","3.907889","18.160.17.214","192.168.0.92","TLSv1.2","310","Application Data"
"1258","3.907890","18.160.17.214","192.168.0.92","TLSv1.2","97","Application Data"
"1259","3.909640","192.168.0.92","18.160.17.214","TCP","66","50106  >  443 [ACK] Seq=14691 Ack=179577 Win=8183 Len=0 TSval=1205499331 TSecr=2743065800"
"1285","3.972758","18.160.17.214","192.168.0.92","TCP","1494","443  >  50106 [ACK] Seq=179577 Ack=14691 Win=497 Len=1428 TSval=2743065865 TSecr=1205499331 [TCP segment of a reassembled PDU]"
"1287","3.973996","18.160.17.214","192.168.0.92","TCP","1494","443  >  50106 [ACK] Seq=181005 Ack=14691 Win=497 Len=1428 TSval=2743065865 TSecr=1205499331 [TCP segment of a reassembled PDU]"
"1288","3.973998","18.160.17.214","192.168.0.92","TCP","1494","443  >  50106 [ACK] Seq=182433 Ack=14691 Win=497 Len=1428 TSval=2743065865 TSecr=1205499331 [TCP segment of a reassembled PDU]"
"1289","3.973999","18.160.17.214","192.168.0.92","TCP","1494","443  >  50106 [ACK] Seq=183861 Ack=14691 Win=497 Len=1428 TSval=2743065865 TSecr=1205499331 [TCP segment of a reassembled PDU]"
"1290","3.974000","18.160.17.214","192.168.0.92","TLSv1.2","81","Application Data"
"1291","3.974000","18.160.17.214","192.168.0.92","TLSv1.2","1066","Application Data"
"1292","3.974001","18.160.17.214","192.168.0.92","TLSv1.2","97","Application Data"
"1293","3.974123","192.168.0.92","18.160.17.214","TCP","66","50106  >  443 [ACK] Seq=14691 Ack=186335 Win=8183 Len=0 TSval=1205499396 TSecr=2743065865"
"1478","4.421648","192.168.0.92","18.160.17.214","TLSv1.2","509","Application Data"
"1479","4.422180","192.168.0.92","18.160.17.214","TCP","1494","50106  >  443 [ACK] Seq=15134 Ack=186335 Win=8183 Len=1428 TSval=1205499844 TSecr=2743065865 [TCP segment of a reassembled PDU]"
"1480","4.422183","192.168.0.92","18.160.17.214","TCP","1494","50106  >  443 [ACK] Seq=16562 Ack=186335 Win=8183 Len=1428 TSval=1205499844 TSecr=2743065865 [TCP segment of a reassembled PDU]"
"1481","4.422214","192.168.0.92","18.160.17.214","TLSv1.2","1369","Application Data"
"1482","4.446055","192.168.0.92","18.160.17.214","TLSv1.2","444","Application Data"
"1483","4.446494","192.168.0.92","18.160.17.214","TCP","1494","50106  >  443 [ACK] Seq=19671 Ack=186335 Win=8183 Len=1428 TSval=1205499868 TSecr=2743065865 [TCP segment of a reassembled PDU]"
"1484","4.446507","192.168.0.92","18.160.17.214","TLSv1.2","1175","Application Data"
"1485","4.447262","18.160.17.214","192.168.0.92","TCP","66","443  >  50106 [ACK] Seq=186335 Ack=17990 Win=514 Len=0 TSval=2743066339 TSecr=1205499844"
"1486","4.467569","18.160.17.214","192.168.0.92","TCP","66","443  >  50106 [ACK] Seq=186335 Ack=19671 Win=525 Len=0 TSval=2743066359 TSecr=1205499844"
"1487","4.469677","18.160.17.214","192.168.0.92","TCP","66","443  >  50106 [ACK] Seq=186335 Ack=22208 Win=535 Len=0 TSval=2743066361 TSecr=1205499868"
"1488","4.472519","192.168.0.92","18.160.17.214","TLSv1.2","444","Application Data"
"1489","4.473013","192.168.0.92","18.160.17.214","TCP","1494","50106  >  443 [ACK] Seq=22586 Ack=186335 Win=8183 Len=1428 TSval=1205499895 TSecr=2743066361 [TCP segment of a reassembled PDU]"
"1490","4.473033","192.168.0.92","18.160.17.214","TLSv1.2","1175","Application Data"
"1491","4.493724","18.160.17.214","192.168.0.92","TCP","66","443  >  50106 [ACK] Seq=186335 Ack=25123 Win=551 Len=0 TSval=2743066385 TSecr=1205499895"
"1492","4.497229","192.168.0.92","18.160.17.214","TLSv1.2","444","Application Data"
"1493","4.498062","192.168.0.92","18.160.17.214","TCP","1494","50106  >  443 [ACK] Seq=25501 Ack=186335 Win=8183 Len=1428 TSval=1205499919 TSecr=2743066385 [TCP segment of a reassembled PDU]"
"1494","4.498095","192.168.0.92","18.160.17.214","TLSv1.2","1174","Application Data"
"1495","4.519483","18.160.17.214","192.168.0.92","TCP","66","443  >  50106 [ACK] Seq=186335 Ack=28037 Win=566 Len=0 TSval=2743066411 TSecr=1205499919"
"1498","4.647256","18.160.17.214","192.168.0.92","TCP","1494","443  >  50106 [ACK] Seq=186335 Ack=28037 Win=566 Len=1428 TSval=2743066539 TSecr=1205499919 [TCP segment of a reassembled PDU]"
"1499","4.647362","192.168.0.92","18.160.17.214","TCP","66","50106  >  443 [ACK] Seq=28037 Ack=187763 Win=8161 Len=0 TSval=1205500070 TSecr=2743066539"
"1500","4.649100","18.160.17.214","192.168.0.92","TCP","1494","443  >  50106 [ACK] Seq=187763 Ack=28037 Win=566 Len=1428 TSval=2743066539 TSecr=1205499919 [TCP segment of a reassembled PDU]"
"1501","4.649102","18.160.17.214","192.168.0.92","TCP","1494","443  >  50106 [ACK] Seq=189191 Ack=28037 Win=566 Len=1428 TSval=2743066539 TSecr=1205499919 [TCP segment of a reassembled PDU]"
"1502","4.649103","18.160.17.214","192.168.0.92","TLSv1.2","1436","Application Data"
"1503","4.649104","18.160.17.214","192.168.0.92","TLSv1.2","97","Application Data"
"1504","4.649218","192.168.0.92","18.160.17.214","TCP","66","50106  >  443 [ACK] Seq=28037 Ack=192020 Win=8117 Len=0 TSval=1205500071 TSecr=2743066539"
"1505","4.649383","192.168.0.92","18.160.17.214","TCP","66","[TCP Window Update] 50106  >  443 [ACK] Seq=28037 Ack=192020 Win=8183 Len=0 TSval=1205500071 TSecr=2743066539"
"1506","4.710117","18.160.17.214","192.168.0.92","TCP","1494","443  >  50106 [ACK] Seq=192020 Ack=28037 Win=566 Len=1428 TSval=2743066601 TSecr=1205500071 [TCP segment of a reassembled PDU]"
"1507","4.710227","192.168.0.92","18.160.17.214","TCP","66","50106  >  443 [ACK] Seq=28037 Ack=193448 Win=8161 Len=0 TSval=1205500132 TSecr=2743066601"
"1508","4.711741","18.160.17.214","192.168.0.92","TCP","1494","443  >  50106 [ACK] Seq=193448 Ack=28037 Win=566 Len=1428 TSval=2743066601 TSecr=1205500071 [TCP segment of a reassembled PDU]"
"1509","4.711743","18.160.17.214","192.168.0.92","TLSv1.2","548","Application Data"
"1510","4.711745","18.160.17.214","192.168.0.92","TCP","1494","443  >  50106 [ACK] Seq=195358 Ack=28037 Win=566 Len=1428 TSval=2743066602 TSecr=1205500071 [TCP segment of a reassembled PDU]"
"1511","4.711746","18.160.17.214","192.168.0.92","TLSv1.2","1083","Application Data"
"1512","4.711747","18.160.17.214","192.168.0.92","TLSv1.2","889","Application Data"
"1513","4.711747","18.160.17.214","192.168.0.92","TLSv1.2","115","Application Data"
"1514","4.711748","18.160.17.214","192.168.0.92","TLSv1.2","97","Application Data"
"1515","4.711878","192.168.0.92","18.160.17.214","TCP","66","50106  >  443 [ACK] Seq=28037 Ack=198706 Win=8101 Len=0 TSval=1205500134 TSecr=2743066603"
"1516","4.712047","192.168.0.92","18.160.17.214","TCP","66","[TCP Window Update] 50106  >  443 [ACK] Seq=28037 Ack=198706 Win=8183 Len=0 TSval=1205500134 TSecr=2743066603"
"1517","4.723101","18.160.17.214","192.168.0.92","TCP","1494","443  >  50106 [ACK] Seq=198706 Ack=28037 Win=566 Len=1428 TSval=2743066615 TSecr=1205500071 [TCP segment of a reassembled PDU]"
"1518","4.723103","18.160.17.214","192.168.0.92","TCP","1494","443  >  50106 [ACK] Seq=200134 Ack=28037 Win=566 Len=1428 TSval=2743066615 TSecr=1205500071 [TCP segment of a reassembled PDU]"
"1519","4.723104","18.160.17.214","192.168.0.92","TCP","1494","443  >  50106 [ACK] Seq=201562 Ack=28037 Win=566 Len=1428 TSval=2743066615 TSecr=1205500071 [TCP segment of a reassembled PDU]"
"1520","4.723105","18.160.17.214","192.168.0.92","TCP","1494","443  >  50106 [ACK] Seq=202990 Ack=28037 Win=566 Len=1428 TSval=2743066615 TSecr=1205500071 [TCP segment of a reassembled PDU]"
"1521","4.723106","18.160.17.214","192.168.0.92","TLSv1.2","1004","Application Data"
"1522","4.723107","18.160.17.214","192.168.0.92","TLSv1.2","97","Application Data"
"1523","4.723229","192.168.0.92","18.160.17.214","TCP","66","50106  >  443 [ACK] Seq=28037 Ack=205387 Win=8079 Len=0 TSval=1205500145 TSecr=2743066615"
"1524","4.723337","192.168.0.92","18.160.17.214","TCP","66","[TCP Window Update] 50106  >  443 [ACK] Seq=28037 Ack=205387 Win=8183 Len=0 TSval=1205500145 TSecr=2743066615"
"1549","4.837117","192.168.0.92","18.160.17.214","TLSv1.2","444","Application Data"
"1550","4.841273","192.168.0.92","18.160.17.214","TCP","1494","50106  >  443 [ACK] Seq=28415 Ack=205387 Win=8183 Len=1428 TSval=1205500263 TSecr=2743066615 [TCP segment of a reassembled PDU]"
"1551","4.841320","192.168.0.92","18.160.17.214","TLSv1.2","1174","Application Data"
"1552","4.861815","192.168.0.92","18.160.17.214","TLSv1.2","444","Application Data"
"1553","4.861949","18.160.17.214","192.168.0.92","TCP","66","443  >  50106 [ACK] Seq=205387 Ack=30951 Win=582 Len=0 TSval=2743066753 TSecr=1205500259"
"1554","4.862771","192.168.0.92","18.160.17.214","TCP","1494","50106  >  443 [ACK] Seq=31329 Ack=205387 Win=8183 Len=1428 TSval=1205500285 TSecr=2743066753 [TCP segment of a reassembled PDU]"
"1555","4.862803","192.168.0.92","18.160.17.214","TLSv1.2","1173","Application Data"
"1556","4.884056","18.160.17.214","192.168.0.92","TCP","66","443  >  50106 [ACK] Seq=205387 Ack=33864 Win=597 Len=0 TSval=2743066775 TSecr=1205500284"
"1557","4.887452","192.168.0.92","18.160.17.214","TLSv1.2","444","Application Data"
"1558","4.887843","192.168.0.92","18.160.17.214","TCP","1494","50106  >  443 [ACK] Seq=34242 Ack=205387 Win=8183 Len=1428 TSval=1205500310 TSecr=2743066775 [TCP segment of a reassembled PDU]"
"1559","4.887901","192.168.0.92","18.160.17.214","TLSv1.2","1174","Application Data"
"1560","4.910612","18.160.17.214","192.168.0.92","TCP","66","443  >  50106 [ACK] Seq=205387 Ack=35670 Win=608 Len=0 TSval=2743066801 TSecr=1205500310"
"1561","4.949289","192.168.0.92","18.160.17.214","TCP","1174","[TCP Retransmission] 50106  >  443 [PSH, ACK] Seq=35670 Ack=205387 Win=8183 Len=1108 TSval=1205500371 TSecr=2743066801 [TCP segment of a reassembled PDU]"
"1562","4.956470","18.160.17.214","192.168.0.92","TCP","66","443  >  50106 [ACK] Seq=205387 Ack=36778 Win=614 Len=0 TSval=2743066849 TSecr=1205500310"
"1563","4.970644","18.160.17.214","192.168.0.92","TCP","78","[TCP Dup ACK 1562#1] 443  >  50106 [ACK] Seq=205387 Ack=36778 Win=614 Len=0 TSval=2743066862 TSecr=1205500371 SLE=35670 SRE=36778"
"1565","5.020688","18.160.17.214","192.168.0.92","TCP","1494","443  >  50106 [ACK] Seq=205387 Ack=36778 Win=614 Len=1428 TSval=2743066912 TSecr=1205500371 [TCP segment of a reassembled PDU]"
"1566","5.020797","192.168.0.92","18.160.17.214","TCP","66","50106  >  443 [ACK] Seq=36778 Ack=206815 Win=8161 Len=0 TSval=1205500443 TSecr=2743066912"
"1567","5.023255","18.160.17.214","192.168.0.92","TCP","1494","443  >  50106 [ACK] Seq=206815 Ack=36778 Win=614 Len=1428 TSval=2743066912 TSecr=1205500371 [TCP segment of a reassembled PDU]"
"1568","5.023257","18.160.17.214","192.168.0.92","TLSv1.2","797","Application Data"
"1569","5.023258","18.160.17.214","192.168.0.92","TCP","1494","443  >  50106 [ACK] Seq=208974 Ack=36778 Win=614 Len=1428 TSval=2743066912 TSecr=1205500371 [TCP segment of a reassembled PDU]"
"1570","5.023258","18.160.17.214","192.168.0.92","TLSv1.2","1191","Application Data"
"1571","5.023260","18.160.17.214","192.168.0.92","TLSv1.2","487","Application Data"
"1572","5.023260","18.160.17.214","192.168.0.92","TLSv1.2","423","Application Data"
"1573","5.023261","18.160.17.214","192.168.0.92","TLSv1.2","276","Application Data"
"1574","5.023261","18.160.17.214","192.168.0.92","TLSv1.2","580","Application Data"
"1575","5.023262","18.160.17.214","192.168.0.92","TLSv1.2","476","Application Data"
"1576","5.023263","18.160.17.214","192.168.0.92","TLSv1.2","132","Application Data"
"1577","5.023264","18.160.17.214","192.168.0.92","TLSv1.2","115","Application Data"
"1578","5.023265","18.160.17.214","192.168.0.92","TLSv1.2","97","Application Data"
"1579","5.023382","192.168.0.92","18.160.17.214","TCP","66","50106  >  443 [ACK] Seq=36778 Ack=213585 Win=8078 Len=0 TSval=1205500446 TSecr=2743066913"
"1580","5.023625","192.168.0.92","18.160.17.214","TCP","66","[TCP Window Update] 50106  >  443 [ACK] Seq=36778 Ack=213585 Win=8183 Len=0 TSval=1205500446 TSecr=2743066913"
"1581","5.065740","18.160.17.214","192.168.0.92","TCP","1494","443  >  50106 [ACK] Seq=213585 Ack=36778 Win=614 Len=1428 TSval=2743066956 TSecr=1205500446 [TCP segment of a reassembled PDU]"
"1582","5.065742","18.160.17.214","192.168.0.92","TCP","1494","443  >  50106 [ACK] Seq=215013 Ack=36778 Win=614 Len=1428 TSval=2743066956 TSecr=1205500446 [TCP segment of a reassembled PDU]"
"1583","5.065743","18.160.17.214","192.168.0.92","TLSv1.2","583","Application Data"
"1584","5.065744","18.160.17.214","192.168.0.92","TCP","1494","443  >  50106 [ACK] Seq=216958 Ack=36778 Win=614 Len=1428 TSval=2743066956 TSecr=1205500446 [TCP segment of a reassembled PDU]"
"1585","5.065745","18.160.17.214","192.168.0.92","TLSv1.2","1437","Application Data"
"1586","5.065746","18.160.17.214","192.168.0.92","TLSv1.2","115","Application Data"
"1587","5.065747","18.160.17.214","192.168.0.92","TLSv1.2","97","Application Data"
"1588","5.065859","192.168.0.92","18.160.17.214","TCP","66","50106  >  443 [ACK] Seq=36778 Ack=219837 Win=8086 Len=0 TSval=1205500488 TSecr=2743066956"
"1589","5.067025","18.160.17.214","192.168.0.92","TCP","1494","443  >  50106 [ACK] Seq=219837 Ack=36778 Win=614 Len=1428 TSval=2743066960 TSecr=1205500446 [TCP segment of a reassembled PDU]"
"1590","5.067128","192.168.0.92","18.160.17.214","TCP","66","50106  >  443 [ACK] Seq=36778 Ack=221265 Win=8063 Len=0 TSval=1205500489 TSecr=2743066960"
"1591","5.067839","192.168.0.92","18.160.17.214","TCP","66","[TCP Window Update] 50106  >  443 [ACK] Seq=36778 Ack=221265 Win=8183 Len=0 TSval=1205500489 TSecr=2743066960"
"1592","5.068262","192.168.0.92","18.160.17.214","TLSv1.2","444","Application Data"
"1593","5.069018","192.168.0.92","18.160.17.214","TCP","1494","50106  >  443 [ACK] Seq=37156 Ack=221265 Win=8183 Len=1428 TSval=1205500490 TSecr=2743066960 [TCP segment of a reassembled PDU]"
"1594","5.069036","192.168.0.92","18.160.17.214","TLSv1.2","1174","Application Data"
"1595","5.069890","18.160.17.214","192.168.0.92","TCP","1494","443  >  50106 [ACK] Seq=221265 Ack=36778 Win=614 Len=1428 TSval=2743066960 TSecr=1205500446 [TCP segment of a reassembled PDU]"
"1596","5.069892","18.160.17.214","192.168.0.92","TCP","1494","443  >  50106 [ACK] Seq=222693 Ack=36778 Win=614 Len=1428 TSval=2743066960 TSecr=1205500446 [TCP segment of a reassembled PDU]"
"1597","5.069893","18.160.17.214","192.168.0.92","TLSv1.2","1422","Application Data"
"1598","5.069894","18.160.17.214","192.168.0.92","TLSv1.2","898","Application Data"
"1599","5.069895","18.160.17.214","192.168.0.92","TLSv1.2","138","Application Data, Application Data"
"1600","5.069988","192.168.0.92","18.160.17.214","TCP","66","50106  >  443 [ACK] Seq=39692 Ack=226381 Win=8104 Len=0 TSval=1205500492 TSecr=2743066960"
"1601","5.070122","192.168.0.92","18.160.17.214","TCP","66","[TCP Window Update] 50106  >  443 [ACK] Seq=39692 Ack=226381 Win=8183 Len=0 TSval=1205500492 TSecr=2743066960"
"1603","5.089407","18.160.17.214","192.168.0.92","TCP","66","443  >  50106 [ACK] Seq=226381 Ack=37156 Win=619 Len=0 TSval=2743066981 TSecr=1205500490"
"1604","5.089409","18.160.17.214","192.168.0.92","TCP","66","443  >  50106 [ACK] Seq=226381 Ack=38584 Win=625 Len=0 TSval=2743066981 TSecr=1205500490"
"1605","5.089409","18.160.17.214","192.168.0.92","TCP","66","443  >  50106 [ACK] Seq=226381 Ack=39692 Win=630 Len=0 TSval=2743066981 TSecr=1205500490"
"1616","5.100171","18.160.17.214","192.168.0.92","TCP","1494","443  >  50106 [ACK] Seq=226381 Ack=39692 Win=630 Len=1428 TSval=2743066993 TSecr=1205500490 [TCP segment of a reassembled PDU]"
"1617","5.100172","18.160.17.214","192.168.0.92","TCP","1494","443  >  50106 [ACK] Seq=227809 Ack=39692 Win=630 Len=1428 TSval=2743066993 TSecr=1205500490 [TCP segment of a reassembled PDU]"
"1618","5.100174","18.160.17.214","192.168.0.92","TLSv1.2","476","Application Data"
"1619","5.100226","18.160.17.214","192.168.0.92","TCP","1494","443  >  50106 [ACK] Seq=229647 Ack=39692 Win=630 Len=1428 TSval=2743066993 TSecr=1205500490 [TCP segment of a reassembled PDU]"
"1621","5.100387","192.168.0.92","18.160.17.214","TCP","66","50106  >  443 [ACK] Seq=39692 Ack=229647 Win=8132 Len=0 TSval=1205500522 TSecr=2743066993"
"1622","5.100417","192.168.0.92","18.160.17.214","TCP","66","50106  >  443 [ACK] Seq=39692 Ack=231075 Win=8110 Len=0 TSval=1205500522 TSecr=2743066993"
"1624","5.101082","192.168.0.92","18.160.17.214","TCP","66","[TCP Window Update] 50106  >  443 [ACK] Seq=39692 Ack=231075 Win=8183 Len=0 TSval=1205500522 TSecr=2743066993"
"1625","5.101328","18.160.17.214","192.168.0.92","TLSv1.2","985","Application Data"
"1626","5.101329","18.160.17.214","192.168.0.92","TLSv1.2","845","Application Data"
"1627","5.101330","18.160.17.214","192.168.0.92","TLSv1.2","115","Application Data"
"1628","5.101331","18.160.17.214","192.168.0.92","TLSv1.2","97","Application Data"
"1629","5.101397","192.168.0.92","18.160.17.214","TCP","66","50106  >  443 [ACK] Seq=39692 Ack=232853 Win=8156 Len=0 TSval=1205500524 TSecr=2743066993"
"1691","5.305954","18.160.17.214","192.168.0.92","TCP","1494","443  >  50106 [ACK] Seq=232853 Ack=39692 Win=630 Len=1428 TSval=2743067198 TSecr=1205500524 [TCP segment of a reassembled PDU]"
"1692","5.305956","18.160.17.214","192.168.0.92","TCP","1494","443  >  50106 [ACK] Seq=234281 Ack=39692 Win=630 Len=1428 TSval=2743067198 TSecr=1205500524 [TCP segment of a reassembled PDU]"
"1693","5.305957","18.160.17.214","192.168.0.92","TCP","1494","443  >  50106 [ACK] Seq=235709 Ack=39692 Win=630 Len=1428 TSval=2743067198 TSecr=1205500524 [TCP segment of a reassembled PDU]"
"1694","5.305958","18.160.17.214","192.168.0.92","TCP","1494","443  >  50106 [ACK] Seq=237137 Ack=39692 Win=630 Len=1428 TSval=2743067198 TSecr=1205500524 [TCP segment of a reassembled PDU]"
"1695","5.305959","18.160.17.214","192.168.0.92","TLSv1.2","594","Application Data"
"1696","5.305959","18.160.17.214","192.168.0.92","TLSv1.2","97","Application Data"
"1697","5.306059","192.168.0.92","18.160.17.214","TCP","66","50106  >  443 [ACK] Seq=39692 Ack=239124 Win=8085 Len=0 TSval=1205500728 TSecr=2743067198"
"1698","5.306172","192.168.0.92","18.160.17.214","TCP","66","[TCP Window Update] 50106  >  443 [ACK] Seq=39692 Ack=239124 Win=8183 Len=0 TSval=1205500728 TSecr=2743067198"
"1699","5.388539","192.168.0.92","18.160.17.214","TLSv1.2","857","Application Data"
"1708","5.422921","18.160.17.214","192.168.0.92","TLSv1.2","1346","Application Data"
"1709","5.422922","18.160.17.214","192.168.0.92","TLSv1.2","97","Application Data"
"1710","5.423008","192.168.0.92","18.160.17.214","TCP","66","50106  >  443 [ACK] Seq=40483 Ack=240435 Win=8163 Len=0 TSval=1205500845 TSecr=2743067315"
"1866","5.514292","192.168.0.92","18.160.17.214","TLSv1.2","450","Application Data"
"1867","5.514634","192.168.0.92","18.160.17.214","TCP","1494","50106  >  443 [ACK] Seq=40867 Ack=240435 Win=8183 Len=1428 TSval=1205500936 TSecr=2743067315 [TCP segment of a reassembled PDU]"
"1868","5.514636","192.168.0.92","18.160.17.214","TCP","1494","50106  >  443 [ACK] Seq=42295 Ack=240435 Win=8183 Len=1428 TSval=1205500936 TSecr=2743067315 [TCP segment of a reassembled PDU]"
"1869","5.514653","192.168.0.92","18.160.17.214","TLSv1.2","369","Application Data"
"1882","5.535100","192.168.0.92","18.160.17.214","TLSv1.2","444","Application Data"
"1883","5.535245","192.168.0.92","18.160.17.214","TCP","1494","50106  >  443 [ACK] Seq=44404 Ack=240435 Win=8183 Len=1428 TSval=1205500957 TSecr=2743067315 [TCP segment of a reassembled PDU]"
"1884","5.535255","192.168.0.92","18.160.17.214","TLSv1.2","1174","Application Data"
"1885","5.537992","18.160.17.214","192.168.0.92","TCP","66","443  >  50106 [ACK] Seq=240435 Ack=42295 Win=647 Len=0 TSval=2743067429 TSecr=1205500936"
"1886","5.537993","18.160.17.214","192.168.0.92","TCP","66","443  >  50106 [ACK] Seq=240435 Ack=44026 Win=658 Len=0 TSval=2743067429 TSecr=1205500936"
"1890","5.555031","18.160.17.214","192.168.0.92","TCP","66","443  >  50106 [ACK] Seq=240435 Ack=45832 Win=670 Len=0 TSval=2743067447 TSecr=1205500957"
"1895","5.596786","192.168.0.92","18.160.17.214","TCP","1174","[TCP Retransmission] 50106  >  443 [PSH, ACK] Seq=45832 Ack=240435 Win=8183 Len=1108 TSval=1205501019 TSecr=2743067447 [TCP segment of a reassembled PDU]"
"1897","5.600335","18.160.17.214","192.168.0.92","TCP","66","443  >  50106 [ACK] Seq=240435 Ack=46940 Win=675 Len=0 TSval=2743067493 TSecr=1205500957"
"1898","5.618660","18.160.17.214","192.168.0.92","TCP","78","[TCP Dup ACK 1897#1] 443  >  50106 [ACK] Seq=240435 Ack=46940 Win=675 Len=0 TSval=2743067510 TSecr=1205501019 SLE=45832 SRE=46940"
"1899","5.684562","192.168.0.92","18.160.17.214","TLSv1.2","579","Application Data"
"1900","5.685331","192.168.0.92","18.160.17.214","TLSv1.2","600","Application Data"
"1901","5.709998","18.160.17.214","192.168.0.92","TCP","66","443  >  50106 [ACK] Seq=240435 Ack=47453 Win=681 Len=0 TSval=2743067602 TSecr=1205501107"
"1902","5.710000","18.160.17.214","192.168.0.92","TCP","66","443  >  50106 [ACK] Seq=240435 Ack=47987 Win=686 Len=0 TSval=2743067602 TSecr=1205501107"
"1907","5.778571","18.160.17.214","192.168.0.92","TCP","1494","443  >  50106 [ACK] Seq=240435 Ack=47987 Win=686 Len=1428 TSval=2743067671 TSecr=1205501107 [TCP segment of a reassembled PDU]"
"1908","5.778669","192.168.0.92","18.160.17.214","TCP","66","50106  >  443 [ACK] Seq=47987 Ack=241863 Win=8161 Len=0 TSval=1205501201 TSecr=2743067671"
"1909","5.780297","18.160.17.214","192.168.0.92","TCP","1494","443  >  50106 [ACK] Seq=241863 Ack=47987 Win=686 Len=1428 TSval=2743067671 TSecr=1205501107 [TCP segment of a reassembled PDU]"
"1910","5.780299","18.160.17.214","192.168.0.92","TCP","1494","443  >  50106 [ACK] Seq=243291 Ack=47987 Win=686 Len=1428 TSval=2743067671 TSecr=1205501107 [TCP segment of a reassembled PDU]"
"1911","5.780300","18.160.17.214","192.168.0.92","TCP","1494","443  >  50106 [ACK] Seq=244719 Ack=47987 Win=686 Len=1428 TSval=2743067671 TSecr=1205501107 [TCP segment of a reassembled PDU]"
"1912","5.780301","18.160.17.214","192.168.0.92","TLSv1.2","617","Application Data"
"1913","5.780301","18.160.17.214","192.168.0.92","TLSv1.2","97","Application Data"
"1914","5.780441","192.168.0.92","18.160.17.214","TCP","66","50106  >  443 [ACK] Seq=47987 Ack=246729 Win=8183 Len=0 TSval=1205501203 TSecr=2743067671"
"1934","5.855221","192.168.0.92","18.160.17.214","TCP","1494","50106  >  443 [ACK] Seq=47987 Ack=246729 Win=8183 Len=1428 TSval=1205501277 TSecr=2743067671 [TCP segment of a reassembled PDU]"
"1935","5.855266","192.168.0.92","18.160.17.214","TLSv1.2","363","Application Data"
"1938","5.856675","192.168.0.92","18.160.17.214","TLSv1.2","129","Application Data"
"1947","5.876207","18.160.17.214","192.168.0.92","TCP","66","443  >  50106 [ACK] Seq=246729 Ack=49712 Win=693 Len=0 TSval=2743067767 TSecr=1205501277"
"1948","5.876208","18.160.17.214","192.168.0.92","TCP","66","443  >  50106 [ACK] Seq=246729 Ack=49775 Win=693 Len=0 TSval=2743067769 TSecr=1205501279"
"1961","5.903280","18.160.17.214","192.168.0.92","TLSv1.2","1084","Application Data"
"1962","5.903282","18.160.17.214","192.168.0.92","TLSv1.2","97","Application Data"
"1963","5.903424","192.168.0.92","18.160.17.214","TCP","66","50106  >  443 [ACK] Seq=49775 Ack=247778 Win=8183 Len=0 TSval=1205501326 TSecr=2743067793"
"1995","5.971666","18.160.17.214","192.168.0.92","TLSv1.2","1059","Application Data"
"1996","5.971668","18.160.17.214","192.168.0.92","TLSv1.2","114","Application Data"
"1997","5.971668","18.160.17.214","192.168.0.92","TLSv1.2","97","Application Data"
"1998","5.971831","192.168.0.92","18.160.17.214","TCP","66","50106  >  443 [ACK] Seq=49775 Ack=248850 Win=8183 Len=0 TSval=1205501394 TSecr=2743067864"
"2036","6.058504","192.168.0.92","18.160.17.214","TLSv1.2","1186","Application Data"
"2037","6.058980","192.168.0.92","18.160.17.214","TLSv1.2","129","Application Data"
"2047","6.079395","18.160.17.214","192.168.0.92","TCP","66","443  >  50106 [ACK] Seq=248850 Ack=50958 Win=699 Len=0 TSval=2743067971 TSecr=1205501481"
"2080","6.170092","18.160.17.214","192.168.0.92","TLSv1.2","1059","Application Data"
"2081","6.170373","192.168.0.92","18.160.17.214","TCP","66","50106  >  443 [ACK] Seq=50958 Ack=249843 Win=8183 Len=0 TSval=1205501592 TSecr=2743068062"
"2082","6.171640","18.160.17.214","192.168.0.92","TLSv1.2","114","Application Data"
"2083","6.171641","18.160.17.214","192.168.0.92","TLSv1.2","97","Application Data"
"2084","6.171842","192.168.0.92","18.160.17.214","TCP","66","50106  >  443 [ACK] Seq=50958 Ack=249922 Win=8183 Len=0 TSval=1205501594 TSecr=2743068063"
"2087","6.316846","18.160.17.214","192.168.0.92","TCP","1494","443  >  50106 [ACK] Seq=249922 Ack=50958 Win=699 Len=1428 TSval=2743068208 TSecr=1205501594 [TCP segment of a reassembled PDU]"
"2088","6.316848","18.160.17.214","192.168.0.92","TCP","1494","443  >  50106 [ACK] Seq=251350 Ack=50958 Win=699 Len=1428 TSval=2743068208 TSecr=1205501594 [TCP segment of a reassembled PDU]"
"2089","6.316992","192.168.0.92","18.160.17.214","TCP","66","50106  >  443 [ACK] Seq=50958 Ack=252778 Win=8183 Len=0 TSval=1205501739 TSecr=2743068208"
"2090","6.318312","18.160.17.214","192.168.0.92","TLSv1.2","778","Application Data"
"2091","6.318314","18.160.17.214","192.168.0.92","TCP","1494","443  >  50106 [ACK] Seq=253490 Ack=50958 Win=699 Len=1428 TSval=2743068208 TSecr=1205501594 [TCP segment of a reassembled PDU]"
"2092","6.318314","18.160.17.214","192.168.0.92","TLSv1.2","1032","Application Data"
"2093","6.318315","18.160.17.214","192.168.0.92","TLSv1.2","777","Application Data"
"2094","6.318316","18.160.17.214","192.168.0.92","TLSv1.2","338","Application Data"
"2095","6.318317","18.160.17.214","192.168.0.92","TLSv1.2","105","Application Data"
"2096","6.318317","18.160.17.214","192.168.0.92","TLSv1.2","107","Application Data"
"2097","6.318321","18.160.17.214","192.168.0.92","TLSv1.2","97","Application Data"
"2098","6.318476","192.168.0.92","18.160.17.214","TCP","66","50106  >  443 [ACK] Seq=50958 Ack=256978 Win=8183 Len=0 TSval=1205501741 TSecr=2743068208"
"2178","6.892860","192.168.0.92","18.160.17.214","TLSv1.2","431","Application Data"
"2182","6.961466","18.160.17.214","192.168.0.92","TCP","66","443  >  50106 [ACK] Seq=256978 Ack=51323 Win=704 Len=0 TSval=2743068849 TSecr=1205502315"
"2356","7.245251","18.160.17.214","192.168.0.92","TCP","1494","443  >  50106 [ACK] Seq=256978 Ack=51323 Win=704 Len=1428 TSval=2743069136 TSecr=1205502315 [TCP segment of a reassembled PDU]"
"2357","7.245358","192.168.0.92","18.160.17.214","TCP","66","50106  >  443 [ACK] Seq=51323 Ack=258406 Win=8161 Len=0 TSval=1205502668 TSecr=2743069136"
"2358","7.246841","18.160.17.214","192.168.0.92","TLSv1.2","1123","Application Data"
"2359","7.246843","18.160.17.214","192.168.0.92","TCP","1494","443  >  50106 [ACK] Seq=259463 Ack=51323 Win=704 Len=1428 TSval=2743069137 TSecr=1205502315 [TCP segment of a reassembled PDU]"
"2360","7.246844","18.160.17.214","192.168.0.92","TCP","1494","443  >  50106 [ACK] Seq=260891 Ack=51323 Win=704 Len=1428 TSval=2743069137 TSecr=1205502315 [TCP segment of a reassembled PDU]"
"2361","7.246845","18.160.17.214","192.168.0.92","TCP","1494","443  >  50106 [ACK] Seq=262319 Ack=51323 Win=704 Len=1428 TSval=2743069137 TSecr=1205502315 [TCP segment of a reassembled PDU]"
"2362","7.246846","18.160.17.214","192.168.0.92","TLSv1.2","586","Application Data"
"2363","7.246847","18.160.17.214","192.168.0.92","TLSv1.2","238","Application Data"
"2364","7.246848","18.160.17.214","192.168.0.92","TLSv1.2","1233","Application Data"
"2365","7.246849","18.160.17.214","192.168.0.92","TLSv1.2","116","Application Data"
"2366","7.246849","18.160.17.214","192.168.0.92","TLSv1.2","257","Application Data"
"2367","7.246850","18.160.17.214","192.168.0.92","TLSv1.2","216","Application Data"
"2368","7.246850","18.160.17.214","192.168.0.92","TLSv1.2","113","Application Data"
"2369","7.246965","192.168.0.92","18.160.17.214","TCP","66","50106  >  443 [ACK] Seq=51323 Ack=266044 Win=8064 Len=0 TSval=1205502669 TSecr=2743069138"
"2370","7.247578","18.160.17.214","192.168.0.92","TLSv1.2","879","Application Data"
"2371","7.247579","18.160.17.214","192.168.0.92","TLSv1.2","118","Application Data"
"2372","7.247580","18.160.17.214","192.168.0.92","TLSv1.2","97","Application Data"
"2373","7.247650","192.168.0.92","18.160.17.214","TCP","66","50106  >  443 [ACK] Seq=51323 Ack=266940 Win=8050 Len=0 TSval=1205502669 TSecr=2743069139"
"2374","7.248566","192.168.0.92","18.160.17.214","TCP","66","[TCP Window Update] 50106  >  443 [ACK] Seq=51323 Ack=266940 Win=8183 Len=0 TSval=1205502671 TSecr=2743069139"
