"No.","Time","Source","Destination","Protocol","Length","Info"
"23","2.426445","192.168.0.92","18.160.17.214","TLSv1.2","259","Application Data"
"25","2.426647","192.168.0.92","18.160.17.214","TLSv1.2","434","Application Data"
"26","2.451463","18.160.17.214","192.168.0.92","TCP","66","443  >  50106 [ACK] Seq=1 Ack=562 Win=721 Len=0 TSval=2743104219 TSecr=1205537725"
"43","2.758848","18.160.17.214","192.168.0.92","TCP","1494","443  >  50106 [ACK] Seq=1 Ack=562 Win=721 Len=1428 TSval=2743104527 TSecr=1205537725 [TCP segment of a reassembled PDU]"
"44","2.758853","18.160.17.214","192.168.0.92","TLSv1.2","87","Application Data"
"45","2.758854","18.160.17.214","192.168.0.92","TLSv1.2","97","Application Data"
"46","2.758972","192.168.0.92","18.160.17.214","TCP","66","50106  >  443 [ACK] Seq=562 Ack=1481 Win=8160 Len=0 TSval=1205538058 TSecr=2743104527"
"47","2.788507","192.168.0.92","18.160.17.214","TLSv1.2","323","Application Data"
"53","2.830006","18.160.17.214","192.168.0.92","TLSv1.2","629","Application Data"
"54","2.830008","18.160.17.214","192.168.0.92","TLSv1.2","97","Application Data"
"55","2.830104","192.168.0.92","18.160.17.214","TCP","66","50106  >  443 [ACK] Seq=819 Ack=2075 Win=8174 Len=0 TSval=1205538129 TSecr=2743104597"
"80","6.505536","192.168.0.92","18.160.17.214","TLSv1.2","207","Application Data"
"81","6.506997","192.168.0.92","18.160.17.214","TLSv1.2","401","Application Data"
"83","6.534030","18.160.17.214","192.168.0.92","TCP","66","443  >  50106 [ACK] Seq=2075 Ack=1295 Win=738 Len=0 TSval=2743108300 TSecr=1205541804"
"102","7.010121","18.160.17.214","192.168.0.92","TCP","1494","443  >  50106 [ACK] Seq=2075 Ack=1295 Win=738 Len=1428 TSval=2743108736 TSecr=1205541804 [TCP segment of a reassembled PDU]"
"103","7.010123","18.160.17.214","192.168.0.92","TCP","1494","443  >  50106 [ACK] Seq=3503 Ack=1295 Win=738 Len=1428 TSval=2743108736 TSecr=1205541804 [TCP segment of a reassembled PDU]"
"104","7.010125","18.160.17.214","192.168.0.92","TCP","1494","443  >  50106 [ACK] Seq=4931 Ack=1295 Win=738 Len=1428 TSval=2743108736 TSecr=1205541804 [TCP segment of a reassembled PDU]"
"105","7.010126","18.160.17.214","192.168.0.92","TLSv1.2","198","Application Data"
"106","7.010126","18.160.17.214","192.168.0.92","TLSv1.2","97","Application Data"
"107","7.010127","18.160.17.214","192.168.0.92","TCP","97","[TCP Retransmission] 443  >  50106 [PSH, ACK] Seq=6491 Ack=1295 Win=738 Len=31 TSval=2743108777 TSecr=1205541804"
"108","7.010222","192.168.0.92","18.160.17.214","TCP","66","50106  >  443 [ACK] Seq=1295 Ack=6522 Win=8114 Len=0 TSval=1205542309 TSecr=2743108736"
"109","7.010264","192.168.0.92","18.160.17.214","TCP","78","[TCP Dup ACK 108#1] 50106  >  443 [ACK] Seq=1295 Ack=6522 Win=8114 Len=0 TSval=1205542309 TSecr=2743108777 SLE=6491 SRE=6522"
"110","7.010565","192.168.0.92","18.160.17.214","TCP","66","[TCP Window Update] 50106  >  443 [ACK] Seq=1295 Ack=6522 Win=8183 Len=0 TSval=1205542309 TSecr=2743108777"
"119","7.054978","192.168.0.92","18.160.17.214","TLSv1.2","310","Application Data"
"125","7.085673","18.160.17.214","192.168.0.92","TLSv1.2","629","Application Data"
"126","7.085674","18.160.17.214","192.168.0.92","TLSv1.2","97","Application Data"
"127","7.085777","192.168.0.92","18.160.17.214","TCP","66","50106  >  443 [ACK] Seq=1539 Ack=7116 Win=8174 Len=0 TSval=1205542384 TSecr=2743108853"
"252","12.604358","192.168.0.92","18.160.17.214","TLSv1.2","351","Application Data"
"267","12.642384","192.168.0.92","18.160.17.214","TLSv1.2","549","Application Data"
"270","12.651788","18.160.17.214","192.168.0.92","TLSv1.2","630","Application Data"
"271","12.651788","18.160.17.214","192.168.0.92","TLSv1.2","97","Application Data"
"277","12.651891","192.168.0.92","18.160.17.214","TCP","66","50106  >  443 [ACK] Seq=2307 Ack=7711 Win=8174 Len=0 TSval=1205547950 TSecr=2743114409"
"279","12.714041","18.160.17.214","192.168.0.92","TLSv1.2","1258","Application Data"
"280","12.714043","18.160.17.214","192.168.0.92","TCP","1494","443  >  50106 [ACK] Seq=8903 Ack=2307 Win=754 Len=1428 TSval=2743114477 TSecr=1205547903 [TCP segment of a reassembled PDU]"
"281","12.714043","18.160.17.214","192.168.0.92","TCP","1494","443  >  50106 [ACK] Seq=10331 Ack=2307 Win=754 Len=1428 TSval=2743114477 TSecr=1205547903 [TCP segment of a reassembled PDU]"
"282","12.714045","18.160.17.214","192.168.0.92","TCP","1494","443  >  50106 [ACK] Seq=11759 Ack=2307 Win=754 Len=1428 TSval=2743114477 TSecr=1205547903 [TCP segment of a reassembled PDU]"
"283","12.714045","18.160.17.214","192.168.0.92","TLSv1.2","689","Application Data"
"284","12.714160","192.168.0.92","18.160.17.214","TCP","66","50106  >  443 [ACK] Seq=2307 Ack=13810 Win=8088 Len=0 TSval=1205548013 TSecr=2743114477"
"285","12.714265","192.168.0.92","18.160.17.214","TCP","66","[TCP Window Update] 50106  >  443 [ACK] Seq=2307 Ack=13810 Win=8183 Len=0 TSval=1205548013 TSecr=2743114477"
"286","12.719339","18.160.17.214","192.168.0.92","TCP","1494","443  >  50106 [ACK] Seq=13810 Ack=2307 Win=754 Len=1428 TSval=2743114484 TSecr=1205547903 [TCP segment of a reassembled PDU]"
"287","12.719341","18.160.17.214","192.168.0.92","TCP","1494","443  >  50106 [ACK] Seq=15238 Ack=2307 Win=754 Len=1428 TSval=2743114484 TSecr=1205547903 [TCP segment of a reassembled PDU]"
"288","12.719424","192.168.0.92","18.160.17.214","TCP","66","50106  >  443 [ACK] Seq=2307 Ack=16666 Win=8139 Len=0 TSval=1205548018 TSecr=2743114484"
"289","12.719500","192.168.0.92","18.160.17.214","TCP","66","[TCP Window Update] 50106  >  443 [ACK] Seq=2307 Ack=16666 Win=8183 Len=0 TSval=1205548018 TSecr=2743114484"
"290","12.721680","18.160.17.214","192.168.0.92","TCP","1494","443  >  50106 [ACK] Seq=16666 Ack=2307 Win=754 Len=1428 TSval=2743114484 TSecr=1205547903 [TCP segment of a reassembled PDU]"
"291","12.721681","18.160.17.214","192.168.0.92","TCP","1494","443  >  50106 [ACK] Seq=18094 Ack=2307 Win=754 Len=1428 TSval=2743114484 TSecr=1205547903 [TCP segment of a reassembled PDU]"
"292","12.721682","18.160.17.214","192.168.0.92","TCP","1494","443  >  50106 [ACK] Seq=19522 Ack=2307 Win=754 Len=1428 TSval=2743114484 TSecr=1205547903 [TCP segment of a reassembled PDU]"
"293","12.721683","18.160.17.214","192.168.0.92","TCP","1494","443  >  50106 [ACK] Seq=20950 Ack=2307 Win=754 Len=1428 TSval=2743114484 TSecr=1205547903 [TCP segment of a reassembled PDU]"
"294","12.721684","18.160.17.214","192.168.0.92","TLSv1.2","378","Application Data"
"295","12.721684","18.160.17.214","192.168.0.92","TCP","1494","443  >  50106 [ACK] Seq=22690 Ack=2307 Win=754 Len=1428 TSval=2743114485 TSecr=1205547903 [TCP segment of a reassembled PDU]"
"296","12.721685","18.160.17.214","192.168.0.92","TLSv1.2","380","Application Data"
"297","12.721685","18.160.17.214","192.168.0.92","TLSv1.2","555","Application Data"
"298","12.721686","18.160.17.214","192.168.0.92","TCP","1494","443  >  50106 [ACK] Seq=24921 Ack=2307 Win=754 Len=1428 TSval=2743114486 TSecr=1205547903 [TCP segment of a reassembled PDU]"
"299","12.721686","18.160.17.214","192.168.0.92","TCP","1494","443  >  50106 [ACK] Seq=26349 Ack=2307 Win=754 Len=1428 TSval=2743114486 TSecr=1205547903 [TCP segment of a reassembled PDU]"
"300","12.721687","18.160.17.214","192.168.0.92","TCP","1494","443  >  50106 [ACK] Seq=27777 Ack=2307 Win=754 Len=1428 TSval=2743114486 TSecr=1205547903 [TCP segment of a reassembled PDU]"
"301","12.721688","18.160.17.214","192.168.0.92","TCP","1494","443  >  50106 [ACK] Seq=29205 Ack=2307 Win=754 Len=1428 TSval=2743114486 TSecr=1205547903 [TCP segment of a reassembled PDU]"
"302","12.721689","18.160.17.214","192.168.0.92","TLSv1.2","1283","Application Data"
"303","12.721690","18.160.17.214","192.168.0.92","TLSv1.2","924","Application Data"
"304","12.721766","192.168.0.92","18.160.17.214","TCP","66","50106  >  443 [ACK] Seq=2307 Ack=32708 Win=7933 Len=0 TSval=1205548021 TSecr=2743114487"
"305","12.721827","192.168.0.92","18.160.17.214","TCP","66","[TCP Window Update] 50106  >  443 [ACK] Seq=2307 Ack=32708 Win=8183 Len=0 TSval=1205548021 TSecr=2743114487"
"314","12.769824","18.160.17.214","192.168.0.92","TCP","1494","443  >  50106 [ACK] Seq=32708 Ack=2307 Win=754 Len=1428 TSval=2743114537 TSecr=1205548021 [TCP segment of a reassembled PDU]"
"315","12.769931","192.168.0.92","18.160.17.214","TCP","66","50106  >  443 [ACK] Seq=2307 Ack=34136 Win=8161 Len=0 TSval=1205548069 TSecr=2743114537"
"316","12.771305","18.160.17.214","192.168.0.92","TCP","1494","443  >  50106 [ACK] Seq=34136 Ack=2307 Win=754 Len=1428 TSval=2743114537 TSecr=1205548021 [TCP segment of a reassembled PDU]"
"317","12.771306","18.160.17.214","192.168.0.92","TCP","1494","443  >  50106 [ACK] Seq=35564 Ack=2307 Win=754 Len=1428 TSval=2743114537 TSecr=1205548021 [TCP segment of a reassembled PDU]"
"318","12.771306","18.160.17.214","192.168.0.92","TCP","1494","443  >  50106 [ACK] Seq=36992 Ack=2307 Win=754 Len=1428 TSval=2743114537 TSecr=1205548021 [TCP segment of a reassembled PDU]"
"319","12.771308","18.160.17.214","192.168.0.92","TCP","1494","443  >  50106 [ACK] Seq=38420 Ack=2307 Win=754 Len=1428 TSval=2743114537 TSecr=1205548021 [TCP segment of a reassembled PDU]"
"320","12.771308","18.160.17.214","192.168.0.92","TCP","1494","443  >  50106 [ACK] Seq=39848 Ack=2307 Win=754 Len=1428 TSval=2743114537 TSecr=1205548021 [TCP segment of a reassembled PDU]"
"321","12.771309","18.160.17.214","192.168.0.92","TCP","1494","443  >  50106 [ACK] Seq=41276 Ack=2307 Win=754 Len=1428 TSval=2743114537 TSecr=1205548021 [TCP segment of a reassembled PDU]"
"322","12.771310","18.160.17.214","192.168.0.92","TCP","1494","443  >  50106 [ACK] Seq=42704 Ack=2307 Win=754 Len=1428 TSval=2743114537 TSecr=1205548021 [TCP segment of a reassembled PDU]"
"323","12.771311","18.160.17.214","192.168.0.92","TCP","1494","443  >  50106 [ACK] Seq=44132 Ack=2307 Win=754 Len=1428 TSval=2743114537 TSecr=1205548021 [TCP segment of a reassembled PDU]"
"324","12.771312","18.160.17.214","192.168.0.92","TCP","1494","443  >  50106 [PSH, ACK] Seq=45560 Ack=2307 Win=754 Len=1428 TSval=2743114537 TSecr=1205548021 [TCP segment of a reassembled PDU]"
"325","12.771312","18.160.17.214","192.168.0.92","TCP","1494","443  >  50106 [ACK] Seq=46988 Ack=2307 Win=754 Len=1428 TSval=2743114538 TSecr=1205548021 [TCP segment of a reassembled PDU]"
"326","12.771313","18.160.17.214","192.168.0.92","TLSv1.2","686","Application Data"
"327","12.771352","192.168.0.92","18.160.17.214","TCP","66","50106  >  443 [ACK] Seq=2307 Ack=49036 Win=7951 Len=0 TSval=1205548070 TSecr=2743114538"
"328","12.771444","192.168.0.92","18.160.17.214","TCP","66","[TCP Window Update] 50106  >  443 [ACK] Seq=2307 Ack=49036 Win=8183 Len=0 TSval=1205548070 TSecr=2743114538"
"340","13.267029","18.160.17.214","192.168.0.92","TCP","1494","443  >  50106 [ACK] Seq=49036 Ack=2307 Win=754 Len=1428 TSval=2743115016 TSecr=1205548070 [TCP segment of a reassembled PDU]"
"341","13.267031","18.160.17.214","192.168.0.92","TCP","1494","443  >  50106 [ACK] Seq=50464 Ack=2307 Win=754 Len=1428 TSval=2743115016 TSecr=1205548070 [TCP segment of a reassembled PDU]"
"342","13.267032","18.160.17.214","192.168.0.92","TCP","1494","443  >  50106 [ACK] Seq=51892 Ack=2307 Win=754 Len=1428 TSval=2743115016 TSecr=1205548070 [TCP segment of a reassembled PDU]"
"343","13.267033","18.160.17.214","192.168.0.92","TCP","1494","443  >  50106 [ACK] Seq=53320 Ack=2307 Win=754 Len=1428 TSval=2743115016 TSecr=1205548070 [TCP segment of a reassembled PDU]"
"344","13.267034","18.160.17.214","192.168.0.92","TCP","1494","443  >  50106 [ACK] Seq=54748 Ack=2307 Win=754 Len=1428 TSval=2743115016 TSecr=1205548070 [TCP segment of a reassembled PDU]"
"345","13.267035","18.160.17.214","192.168.0.92","TLSv1.2","1143","Application Data"
"346","13.267035","18.160.17.214","192.168.0.92","TCP","1494","443  >  50106 [ACK] Seq=57253 Ack=2307 Win=754 Len=1428 TSval=2743115017 TSecr=1205548070 [TCP segment of a reassembled PDU]"
"347","13.267036","18.160.17.214","192.168.0.92","TCP","1494","443  >  50106 [ACK] Seq=58681 Ack=2307 Win=754 Len=1428 TSval=2743115017 TSecr=1205548070 [TCP segment of a reassembled PDU]"
"348","13.267037","18.160.17.214","192.168.0.92","TCP","1494","443  >  50106 [ACK] Seq=60109 Ack=2307 Win=754 Len=1428 TSval=2743115017 TSecr=1205548070 [TCP segment of a reassembled PDU]"
"349","13.267038","18.160.17.214","192.168.0.92","TCP","1494","443  >  50106 [ACK] Seq=61537 Ack=2307 Win=754 Len=1428 TSval=2743115017 TSecr=1205548070 [TCP segment of a reassembled PDU]"
"350","13.267039","18.160.17.214","192.168.0.92","TCP","1494","443  >  50106 [ACK] Seq=62965 Ack=2307 Win=754 Len=1428 TSval=2743115017 TSecr=1205548070 [TCP segment of a reassembled PDU]"
"351","13.267040","18.160.17.214","192.168.0.92","TCP","1494","443  >  50106 [ACK] Seq=64393 Ack=2307 Win=754 Len=1428 TSval=2743115017 TSecr=1205548070 [TCP segment of a reassembled PDU]"
"352","13.267040","18.160.17.214","192.168.0.92","TLSv1.2","1348","Application Data"
"353","13.267134","192.168.0.92","18.160.17.214","TCP","66","50106  >  443 [ACK] Seq=2307 Ack=64393 Win=7943 Len=0 TSval=1205548566 TSecr=2743115017"
"354","13.267171","192.168.0.92","18.160.17.214","TCP","66","50106  >  443 [ACK] Seq=2307 Ack=67103 Win=7901 Len=0 TSval=1205548566 TSecr=2743115017"
"355","13.267247","192.168.0.92","18.160.17.214","TCP","66","[TCP Window Update] 50106  >  443 [ACK] Seq=2307 Ack=67103 Win=8183 Len=0 TSval=1205548566 TSecr=2743115017"
"356","13.278873","18.160.17.214","192.168.0.92","TCP","1494","443  >  50106 [ACK] Seq=67103 Ack=2307 Win=754 Len=1428 TSval=2743115046 TSecr=1205548070 [TCP segment of a reassembled PDU]"
"357","13.278874","18.160.17.214","192.168.0.92","TCP","1494","443  >  50106 [ACK] Seq=68531 Ack=2307 Win=754 Len=1428 TSval=2743115046 TSecr=1205548070 [TCP segment of a reassembled PDU]"
"358","13.278875","18.160.17.214","192.168.0.92","TLSv1.2","1230","Application Data"
"359","13.278954","192.168.0.92","18.160.17.214","TCP","66","50106  >  443 [ACK] Seq=2307 Ack=71123 Win=8121 Len=0 TSval=1205548578 TSecr=2743115046"
"360","13.279044","192.168.0.92","18.160.17.214","TCP","66","[TCP Window Update] 50106  >  443 [ACK] Seq=2307 Ack=71123 Win=8183 Len=0 TSval=1205548578 TSecr=2743115046"
"362","13.397312","192.168.0.92","18.160.17.214","TLSv1.2","706","Application Data"
"365","13.455198","192.168.0.92","18.160.17.214","TCP","1494","50106  >  443 [ACK] Seq=2947 Ack=71123 Win=8183 Len=1428 TSval=1205548754 TSecr=2743115046 [TCP segment of a reassembled PDU]"
"366","13.455222","192.168.0.92","18.160.17.214","TLSv1.2","85","Application Data"
"367","13.455299","192.168.0.92","18.160.17.214","TCP","1494","50106  >  443 [ACK] Seq=4394 Ack=71123 Win=8183 Len=1428 TSval=1205548754 TSecr=2743115046 [TCP segment of a reassembled PDU]"
"368","13.455305","192.168.0.92","18.160.17.214","TLSv1.2","1103","Application Data"
"369","13.460108","192.168.0.92","18.160.17.214","TLSv1.2","510","Application Data"
"370","13.460518","192.168.0.92","18.160.17.214","TCP","1494","50106  >  443 [ACK] Seq=7303 Ack=71123 Win=8183 Len=1428 TSval=1205548759 TSecr=2743115046 [TCP segment of a reassembled PDU]"
"371","13.460540","192.168.0.92","18.160.17.214","TLSv1.2","1256","Application Data"
"372","13.462155","18.160.17.214","192.168.0.92","TCP","66","443  >  50106 [ACK] Seq=71123 Ack=2947 Win=760 Len=0 TSval=2743115229 TSecr=1205548696"
"376","13.474996","18.160.17.214","192.168.0.92","TCP","66","443  >  50106 [ACK] Seq=71123 Ack=4394 Win=766 Len=0 TSval=2743115243 TSecr=1205548754"
"377","13.474997","18.160.17.214","192.168.0.92","TCP","66","443  >  50106 [ACK] Seq=71123 Ack=6859 Win=775 Len=0 TSval=2743115243 TSecr=1205548754"
"380","13.481864","18.160.17.214","192.168.0.92","TCP","66","443  >  50106 [ACK] Seq=71123 Ack=7303 Win=781 Len=0 TSval=2743115249 TSecr=1205548759"
"381","13.481866","18.160.17.214","192.168.0.92","TCP","66","443  >  50106 [ACK] Seq=71123 Ack=9921 Win=791 Len=0 TSval=2743115249 TSecr=1205548759"
"395","13.636820","18.160.17.214","192.168.0.92","TCP","1494","443  >  50106 [ACK] Seq=71123 Ack=9921 Win=791 Len=1428 TSval=2743115404 TSecr=1205548759 [TCP segment of a reassembled PDU]"
"396","13.636821","18.160.17.214","192.168.0.92","TCP","1494","443  >  50106 [ACK] Seq=72551 Ack=9921 Win=791 Len=1428 TSval=2743115404 TSecr=1205548759 [TCP segment of a reassembled PDU]"
"397","13.636822","18.160.17.214","192.168.0.92","TCP","1494","443  >  50106 [ACK] Seq=73979 Ack=9921 Win=791 Len=1428 TSval=2743115404 TSecr=1205548759 [TCP segment of a reassembled PDU]"
"398","13.636823","18.160.17.214","192.168.0.92","TCP","1494","443  >  50106 [ACK] Seq=75407 Ack=9921 Win=791 Len=1428 TSval=2743115404 TSecr=1205548759 [TCP segment of a reassembled PDU]"
"399","13.636824","18.160.17.214","192.168.0.92","TLSv1.2","503","Application Data"
"400","13.636824","18.160.17.214","192.168.0.92","TLSv1.2","97","Application Data"
"401","13.636935","192.168.0.92","18.160.17.214","TCP","66","50106  >  443 [ACK] Seq=9921 Ack=77303 Win=8087 Len=0 TSval=1205548936 TSecr=2743115405"
"402","13.637033","192.168.0.92","18.160.17.214","TCP","66","[TCP Window Update] 50106  >  443 [ACK] Seq=9921 Ack=77303 Win=8183 Len=0 TSval=1205548936 TSecr=2743115405"
"416","13.652355","18.160.17.214","192.168.0.92","TCP","1494","443  >  50106 [ACK] Seq=77303 Ack=9921 Win=791 Len=1428 TSval=2743115420 TSecr=1205548936 [TCP segment of a reassembled PDU]"
"417","13.652357","18.160.17.214","192.168.0.92","TCP","1494","443  >  50106 [ACK] Seq=78731 Ack=9921 Win=791 Len=1428 TSval=2743115420 TSecr=1205548936 [TCP segment of a reassembled PDU]"
"418","13.652359","18.160.17.214","192.168.0.92","TLSv1.2","1094","Application Data"
"419","13.652360","18.160.17.214","192.168.0.92","TCP","1494","443  >  50106 [ACK] Seq=81187 Ack=9921 Win=791 Len=1428 TSval=2743115421 TSecr=1205548936 [TCP segment of a reassembled PDU]"
"420","13.652477","192.168.0.92","18.160.17.214","TCP","66","50106  >  443 [ACK] Seq=9921 Ack=82615 Win=8100 Len=0 TSval=1205548951 TSecr=2743115421"
"421","13.652574","192.168.0.92","18.160.17.214","TCP","66","[TCP Window Update] 50106  >  443 [ACK] Seq=9921 Ack=82615 Win=8183 Len=0 TSval=1205548951 TSecr=2743115421"
"422","13.653058","18.160.17.214","192.168.0.92","TCP","1494","443  >  50106 [ACK] Seq=82615 Ack=9921 Win=791 Len=1428 TSval=2743115421 TSecr=1205548936 [TCP segment of a reassembled PDU]"
"423","13.653059","18.160.17.214","192.168.0.92","TLSv1.2","721","Application Data"
"424","13.653226","192.168.0.92","18.160.17.214","TCP","66","50106  >  443 [ACK] Seq=9921 Ack=84698 Win=8151 Len=0 TSval=1205548951 TSecr=2743115421"
"427","13.657385","18.160.17.214","192.168.0.92","TLSv1.2","255","Application Data"
"428","13.657386","18.160.17.214","192.168.0.92","TLSv1.2","1423","Application Data"
"429","13.657387","18.160.17.214","192.168.0.92","TLSv1.2","108","Application Data"
"430","13.657388","18.160.17.214","192.168.0.92","TLSv1.2","107","Application Data"
"431","13.657389","18.160.17.214","192.168.0.92","TLSv1.2","97","Application Data"
"432","13.657493","192.168.0.92","18.160.17.214","TCP","66","50106  >  443 [ACK] Seq=9921 Ack=86358 Win=8158 Len=0 TSval=1205548956 TSecr=2743115424"
"452","13.736227","192.168.0.92","18.160.17.214","TLSv1.2","1115","Application Data"
"453","13.736417","192.168.0.92","18.160.17.214","TLSv1.2","129","Application Data"
"454","13.757296","18.160.17.214","192.168.0.92","TCP","66","443  >  50106 [ACK] Seq=86358 Ack=10970 Win=797 Len=0 TSval=2743115525 TSecr=1205549035"
"455","13.757297","18.160.17.214","192.168.0.92","TCP","66","443  >  50106 [ACK] Seq=86358 Ack=11033 Win=797 Len=0 TSval=2743115525 TSecr=1205549035"
"456","13.811981","18.160.17.214","192.168.0.92","TCP","1494","443  >  50106 [ACK] Seq=86358 Ack=11033 Win=797 Len=1428 TSval=2743115580 TSecr=1205549035 [TCP segment of a reassembled PDU]"
"457","13.811982","18.160.17.214","192.168.0.92","TCP","1494","443  >  50106 [ACK] Seq=87786 Ack=11033 Win=797 Len=1428 TSval=2743115580 TSecr=1205549035 [TCP segment of a reassembled PDU]"
"458","13.811983","18.160.17.214","192.168.0.92","TLSv1.2","339","Application Data"
"459","13.811984","18.160.17.214","192.168.0.92","TCP","1494","443  >  50106 [ACK] Seq=89487 Ack=11033 Win=797 Len=1428 TSval=2743115580 TSecr=1205549035 [TCP segment of a reassembled PDU]"
"460","13.811985","18.160.17.214","192.168.0.92","TLSv1.2","1096","Application Data"
"461","13.811985","18.160.17.214","192.168.0.92","TCP","1494","443  >  50106 [ACK] Seq=91945 Ack=11033 Win=797 Len=1428 TSval=2743115581 TSecr=1205549035 [TCP segment of a reassembled PDU]"
"462","13.812086","192.168.0.92","18.160.17.214","TCP","66","50106  >  443 [ACK] Seq=11033 Ack=93373 Win=8074 Len=0 TSval=1205549111 TSecr=2743115581"
"463","13.812183","192.168.0.92","18.160.17.214","TCP","66","[TCP Window Update] 50106  >  443 [ACK] Seq=11033 Ack=93373 Win=8183 Len=0 TSval=1205549111 TSecr=2743115581"
"464","13.813055","18.160.17.214","192.168.0.92","TCP","1494","443  >  50106 [ACK] Seq=93373 Ack=11033 Win=797 Len=1428 TSval=2743115581 TSecr=1205549035 [TCP segment of a reassembled PDU]"
"465","13.813056","18.160.17.214","192.168.0.92","TLSv1.2","355","Application Data"
"466","13.813057","18.160.17.214","192.168.0.92","TLSv1.2","97","Application Data"
"467","13.813097","192.168.0.92","18.160.17.214","TCP","66","50106  >  443 [ACK] Seq=11033 Ack=95121 Win=8156 Len=0 TSval=1205549112 TSecr=2743115581"
"468","13.815970","18.160.17.214","192.168.0.92","TCP","1494","443  >  50106 [ACK] Seq=95121 Ack=11033 Win=797 Len=1428 TSval=2743115583 TSecr=1205549035 [TCP segment of a reassembled PDU]"
"469","13.816053","192.168.0.92","18.160.17.214","TCP","66","50106  >  443 [ACK] Seq=11033 Ack=96549 Win=8161 Len=0 TSval=1205549115 TSecr=2743115583"
"470","13.817265","18.160.17.214","192.168.0.92","TCP","1494","443  >  50106 [ACK] Seq=96549 Ack=11033 Win=797 Len=1428 TSval=2743115583 TSecr=1205549035 [TCP segment of a reassembled PDU]"
"471","13.817269","18.160.17.214","192.168.0.92","TCP","1494","443  >  50106 [ACK] Seq=97977 Ack=11033 Win=797 Len=1428 TSval=2743115583 TSecr=1205549035 [TCP segment of a reassembled PDU]"
"472","13.817270","18.160.17.214","192.168.0.92","TCP","1494","443  >  50106 [ACK] Seq=99405 Ack=11033 Win=797 Len=1428 TSval=2743115583 TSecr=1205549035 [TCP segment of a reassembled PDU]"
"473","13.817271","18.160.17.214","192.168.0.92","TCP","1494","443  >  50106 [ACK] Seq=100833 Ack=11033 Win=797 Len=1428 TSval=2743115583 TSecr=1205549035 [TCP segment of a reassembled PDU]"
"474","13.817272","18.160.17.214","192.168.0.92","TCP","1494","443  >  50106 [ACK] Seq=102261 Ack=11033 Win=797 Len=1428 TSval=2743115583 TSecr=1205549035 [TCP segment of a reassembled PDU]"
"475","13.817273","18.160.17.214","192.168.0.92","TCP","1494","443  >  50106 [ACK] Seq=103689 Ack=11033 Win=797 Len=1428 TSval=2743115583 TSecr=1205549035 [TCP segment of a reassembled PDU]"
"476","13.817274","18.160.17.214","192.168.0.92","TCP","1494","443  >  50106 [ACK] Seq=105117 Ack=11033 Win=797 Len=1428 TSval=2743115583 TSecr=1205549035 [TCP segment of a reassembled PDU]"
"477","13.817275","18.160.17.214","192.168.0.92","TCP","1494","443  >  50106 [ACK] Seq=106545 Ack=11033 Win=797 Len=1428 TSval=2743115583 TSecr=1205549035 [TCP segment of a reassembled PDU]"
"478","13.817276","18.160.17.214","192.168.0.92","TCP","1494","443  >  50106 [PSH, ACK] Seq=107973 Ack=11033 Win=797 Len=1428 TSval=2743115583 TSecr=1205549035 [TCP segment of a reassembled PDU]"
"479","13.817277","18.160.17.214","192.168.0.92","TCP","1494","443  >  50106 [ACK] Seq=109401 Ack=11033 Win=797 Len=1428 TSval=2743115584 TSecr=1205549035 [TCP segment of a reassembled PDU]"
"480","13.817278","18.160.17.214","192.168.0.92","TLSv1.2","764","Application Data"
"481","13.817279","18.160.17.214","192.168.0.92","TCP","1494","443  >  50106 [ACK] Seq=111527 Ack=11033 Win=797 Len=1428 TSval=2743115584 TSecr=1205549035 [TCP segment of a reassembled PDU]"
"482","13.817280","18.160.17.214","192.168.0.92","TCP","1494","443  >  50106 [ACK] Seq=112955 Ack=11033 Win=797 Len=1428 TSval=2743115584 TSecr=1205549035 [TCP segment of a reassembled PDU]"
"483","13.817281","18.160.17.214","192.168.0.92","TCP","1494","443  >  50106 [ACK] Seq=114383 Ack=11033 Win=797 Len=1428 TSval=2743115584 TSecr=1205549035 [TCP segment of a reassembled PDU]"
"484","13.817281","18.160.17.214","192.168.0.92","TCP","1494","443  >  50106 [ACK] Seq=115811 Ack=11033 Win=797 Len=1428 TSval=2743115584 TSecr=1205549035 [TCP segment of a reassembled PDU]"
"485","13.817283","18.160.17.214","192.168.0.92","TCP","1494","443  >  50106 [ACK] Seq=117239 Ack=11033 Win=797 Len=1428 TSval=2743115584 TSecr=1205549035 [TCP segment of a reassembled PDU]"
"486","13.817283","18.160.17.214","192.168.0.92","TLSv1.2","1202","Application Data"
"487","13.817409","192.168.0.92","18.160.17.214","TCP","66","50106  >  443 [ACK] Seq=11033 Ack=119803 Win=8183 Len=0 TSval=1205549116 TSecr=2743115584"
"488","13.820980","18.160.17.214","192.168.0.92","TCP","1494","443  >  50106 [ACK] Seq=119803 Ack=11033 Win=797 Len=1428 TSval=2743115589 TSecr=1205549035 [TCP segment of a reassembled PDU]"
"489","13.820981","18.160.17.214","192.168.0.92","TCP","1494","443  >  50106 [ACK] Seq=121231 Ack=11033 Win=797 Len=1428 TSval=2743115589 TSecr=1205549035 [TCP segment of a reassembled PDU]"
"490","13.820981","18.160.17.214","192.168.0.92","TCP","1494","443  >  50106 [ACK] Seq=122659 Ack=11033 Win=797 Len=1428 TSval=2743115589 TSecr=1205549035 [TCP segment of a reassembled PDU]"
"491","13.821117","192.168.0.92","18.160.17.214","TCP","66","50106  >  443 [ACK] Seq=11033 Ack=124087 Win=8183 Len=0 TSval=1205549120 TSecr=2743115589"
"492","13.822304","18.160.17.214","192.168.0.92","TCP","1494","443  >  50106 [ACK] Seq=124087 Ack=11033 Win=797 Len=1428 TSval=2743115589 TSecr=1205549035 [TCP segment of a reassembled PDU]"
"493","13.822305","18.160.17.214","192.168.0.92","TCP","1494","443  >  50106 [ACK] Seq=125515 Ack=11033 Win=797 Len=1428 TSval=2743115589 TSecr=1205549035 [TCP segment of a reassembled PDU]"
"494","13.822306","18.160.17.214","192.168.0.92","TCP","1494","443  >  50106 [ACK] Seq=126943 Ack=11033 Win=797 Len=1428 TSval=2743115589 TSecr=1205549035 [TCP segment of a reassembled PDU]"
"495","13.822307","18.160.17.214","192.168.0.92","TCP","1494","443  >  50106 [ACK] Seq=128371 Ack=11033 Win=797 Len=1428 TSval=2743115589 TSecr=1205549035 [TCP segment of a reassembled PDU]"
"496","13.822308","18.160.17.214","192.168.0.92","TCP","1494","443  >  50106 [ACK] Seq=129799 Ack=11033 Win=797 Len=1428 TSval=2743115589 TSecr=1205549035 [TCP segment of a reassembled PDU]"
"497","13.822308","18.160.17.214","192.168.0.92","TCP","1494","443  >  50106 [ACK] Seq=131227 Ack=11033 Win=797 Len=1428 TSval=2743115589 TSecr=1205549035 [TCP segment of a reassembled PDU]"
"498","13.822309","18.160.17.214","192.168.0.92","TCP","1494","443  >  50106 [PSH, ACK] Seq=132655 Ack=11033 Win=797 Len=1428 TSval=2743115589 TSecr=1205549035 [TCP segment of a reassembled PDU]"
"499","13.822310","18.160.17.214","192.168.0.92","TLSv1.2","134","Application Data"
"500","13.822369","192.168.0.92","18.160.17.214","TCP","66","50106  >  443 [ACK] Seq=11033 Ack=134151 Win=8183 Len=0 TSval=1205549121 TSecr=2743115589"
"501","13.825580","18.160.17.214","192.168.0.92","TCP","1494","443  >  50106 [ACK] Seq=134151 Ack=11033 Win=797 Len=1428 TSval=2743115593 TSecr=1205549035 [TCP segment of a reassembled PDU]"
"502","13.825582","18.160.17.214","192.168.0.92","TCP","1494","443  >  50106 [ACK] Seq=135579 Ack=11033 Win=797 Len=1428 TSval=2743115593 TSecr=1205549035 [TCP segment of a reassembled PDU]"
"503","13.825583","18.160.17.214","192.168.0.92","TCP","1494","443  >  50106 [ACK] Seq=137007 Ack=11033 Win=797 Len=1428 TSval=2743115593 TSecr=1205549035 [TCP segment of a reassembled PDU]"
"504","13.825584","18.160.17.214","192.168.0.92","TCP","1494","443  >  50106 [ACK] Seq=138435 Ack=11033 Win=797 Len=1428 TSval=2743115593 TSecr=1205549035 [TCP segment of a reassembled PDU]"
"505","13.825585","18.160.17.214","192.168.0.92","TCP","1494","443  >  50106 [ACK] Seq=139863 Ack=11033 Win=797 Len=1428 TSval=2743115593 TSecr=1205549035 [TCP segment of a reassembled PDU]"
"506","13.825585","18.160.17.214","192.168.0.92","TCP","1494","443  >  50106 [ACK] Seq=141291 Ack=11033 Win=797 Len=1428 TSval=2743115593 TSecr=1205549035 [TCP segment of a reassembled PDU]"
"507","13.825586","18.160.17.214","192.168.0.92","TCP","1494","443  >  50106 [ACK] Seq=142719 Ack=11033 Win=797 Len=1428 TSval=2743115593 TSecr=1205549035 [TCP segment of a reassembled PDU]"
"508","13.825587","18.160.17.214","192.168.0.92","TCP","1494","443  >  50106 [ACK] Seq=144147 Ack=11033 Win=797 Len=1428 TSval=2743115593 TSecr=1205549035 [TCP segment of a reassembled PDU]"
"509","13.825588","18.160.17.214","192.168.0.92","TCP","1494","443  >  50106 [ACK] Seq=145575 Ack=11033 Win=797 Len=1428 TSval=2743115593 TSecr=1205549035 [TCP segment of a reassembled PDU]"
"510","13.825589","18.160.17.214","192.168.0.92","TCP","1494","443  >  50106 [PSH, ACK] Seq=147003 Ack=11033 Win=797 Len=1428 TSval=2743115593 TSecr=1205549035 [TCP segment of a reassembled PDU]"
"511","13.825590","18.160.17.214","192.168.0.92","TCP","1494","443  >  50106 [ACK] Seq=148431 Ack=11033 Win=797 Len=1428 TSval=2743115593 TSecr=1205549035 [TCP segment of a reassembled PDU]"
"512","13.825591","18.160.17.214","192.168.0.92","TLSv1.2","790","Application Data, Application Data"
"513","13.825591","18.160.17.214","192.168.0.92","TCP","1494","443  >  50106 [ACK] Seq=150583 Ack=11033 Win=797 Len=1428 TSval=2743115594 TSecr=1205549035 [TCP segment of a reassembled PDU]"
"514","13.825691","192.168.0.92","18.160.17.214","TCP","66","50106  >  443 [ACK] Seq=11033 Ack=152011 Win=8183 Len=0 TSval=1205549125 TSecr=2743115593"
"515","13.826949","18.160.17.214","192.168.0.92","TCP","1494","443  >  50106 [ACK] Seq=152011 Ack=11033 Win=797 Len=1428 TSval=2743115594 TSecr=1205549035 [TCP segment of a reassembled PDU]"
"516","13.826950","18.160.17.214","192.168.0.92","TCP","1494","443  >  50106 [ACK] Seq=153439 Ack=11033 Win=797 Len=1428 TSval=2743115594 TSecr=1205549035 [TCP segment of a reassembled PDU]"
"517","13.826951","18.160.17.214","192.168.0.92","TCP","1494","443  >  50106 [ACK] Seq=154867 Ack=11033 Win=797 Len=1428 TSval=2743115594 TSecr=1205549035 [TCP segment of a reassembled PDU]"
"518","13.826951","18.160.17.214","192.168.0.92","TCP","1494","443  >  50106 [ACK] Seq=156295 Ack=11033 Win=797 Len=1428 TSval=2743115594 TSecr=1205549035 [TCP segment of a reassembled PDU]"
"519","13.826952","18.160.17.214","192.168.0.92","TCP","1494","443  >  50106 [ACK] Seq=157723 Ack=11033 Win=797 Len=1428 TSval=2743115594 TSecr=1205549035 [TCP segment of a reassembled PDU]"
"520","13.826953","18.160.17.214","192.168.0.92","TCP","1494","443  >  50106 [ACK] Seq=159151 Ack=11033 Win=797 Len=1428 TSval=2743115594 TSecr=1205549035 [TCP segment of a reassembled PDU]"
"521","13.826954","18.160.17.214","192.168.0.92","TCP","1494","443  >  50106 [ACK] Seq=160579 Ack=11033 Win=797 Len=1428 TSval=2743115594 TSecr=1205549035 [TCP segment of a reassembled PDU]"
"522","13.826954","18.160.17.214","192.168.0.92","TCP","1494","443  >  50106 [ACK] Seq=162007 Ack=11033 Win=797 Len=1428 TSval=2743115594 TSecr=1205549035 [TCP segment of a reassembled PDU]"
"523","13.826955","18.160.17.214","192.168.0.92","TCP","1494","443  >  50106 [PSH, ACK] Seq=163435 Ack=11033 Win=797 Len=1428 TSval=2743115594 TSecr=1205549035 [TCP segment of a reassembled PDU]"
"524","13.826956","18.160.17.214","192.168.0.92","TCP","1494","443  >  50106 [ACK] Seq=164863 Ack=11033 Win=797 Len=1428 TSval=2743115595 TSecr=1205549035 [TCP segment of a reassembled PDU]"
"525","13.826957","18.160.17.214","192.168.0.92","TLSv1.2","1494","Application Data"
"526","13.826958","18.160.17.214","192.168.0.92","TCP","1494","443  >  50106 [ACK] Seq=167719 Ack=11033 Win=797 Len=1428 TSval=2743115595 TSecr=1205549035 [TCP segment of a reassembled PDU]"
"527","13.826958","18.160.17.214","192.168.0.92","TCP","1494","443  >  50106 [ACK] Seq=169147 Ack=11033 Win=797 Len=1428 TSval=2743115595 TSecr=1205549035 [TCP segment of a reassembled PDU]"
"528","13.826959","18.160.17.214","192.168.0.92","TCP","1494","443  >  50106 [ACK] Seq=170575 Ack=11033 Win=797 Len=1428 TSval=2743115595 TSecr=1205549035 [TCP segment of a reassembled PDU]"
"529","13.826960","18.160.17.214","192.168.0.92","TLSv1.2","411","Application Data"
"530","13.826960","18.160.17.214","192.168.0.92","TLSv1.2","97","Application Data"
"531","13.827054","192.168.0.92","18.160.17.214","TCP","66","50106  >  443 [ACK] Seq=11033 Ack=172379 Win=8183 Len=0 TSval=1205549126 TSecr=2743115595"
"534","13.856671","18.160.17.214","192.168.0.92","TLSv1.2","1060","Application Data"
"535","13.856672","18.160.17.214","192.168.0.92","TLSv1.2","114","Application Data"
"536","13.856672","18.160.17.214","192.168.0.92","TLSv1.2","97","Application Data"
"537","13.856796","192.168.0.92","18.160.17.214","TCP","66","50106  >  443 [ACK] Seq=11033 Ack=173452 Win=8183 Len=0 TSval=1205549156 TSecr=2743115625"
"556","14.207507","192.168.0.92","18.160.17.214","TLSv1.2","1096","Application Data"
"557","14.207892","192.168.0.92","18.160.17.214","TLSv1.2","129","Application Data"
"558","14.227627","18.160.17.214","192.168.0.92","TCP","66","443  >  50106 [ACK] Seq=173452 Ack=12063 Win=802 Len=0 TSval=2743115996 TSecr=1205549506"
"559","14.228899","18.160.17.214","192.168.0.92","TCP","66","443  >  50106 [ACK] Seq=173452 Ack=12126 Win=802 Len=0 TSval=2743115996 TSecr=1205549506"
"560","14.281315","192.168.0.92","18.160.17.214","TCP","1494","50106  >  443 [ACK] Seq=12126 Ack=173452 Win=8183 Len=1428 TSval=1205549580 TSecr=2743115996 [TCP segment of a reassembled PDU]"
"561","14.281347","192.168.0.92","18.160.17.214","TLSv1.2","415","Application Data"
"572","14.302733","18.160.17.214","192.168.0.92","TCP","66","443  >  50106 [ACK] Seq=173452 Ack=13903 Win=809 Len=0 TSval=2743116069 TSecr=1205549580"
"578","14.318016","18.160.17.214","192.168.0.92","TLSv1.2","1314","Application Data"
"579","14.318017","18.160.17.214","192.168.0.92","TLSv1.2","97","Application Data"
"580","14.318060","192.168.0.92","18.160.17.214","TCP","66","50106  >  443 [ACK] Seq=13903 Ack=174731 Win=8163 Len=0 TSval=1205549616 TSecr=2743116084"
"583","14.319470","18.160.17.214","192.168.0.92","TLSv1.2","1059","Application Data"
"584","14.319546","192.168.0.92","18.160.17.214","TCP","66","50106  >  443 [ACK] Seq=13903 Ack=175724 Win=8168 Len=0 TSval=1205549618 TSecr=2743116088"
"588","14.322377","18.160.17.214","192.168.0.92","TLSv1.2","114","Application Data"
"589","14.322378","18.160.17.214","192.168.0.92","TLSv1.2","97","Application Data"
"590","14.322472","192.168.0.92","18.160.17.214","TCP","66","50106  >  443 [ACK] Seq=13903 Ack=175803 Win=8182 Len=0 TSval=1205549621 TSecr=2743116091"
