"No.","Time","Source","Destination","Protocol","Length","Info"
"130","4.434765","192.168.0.92","18.165.77.79","TLSv1.2","387","Application Data"
"141","4.458843","192.168.0.92","18.165.77.79","TLSv1.2","218","Application Data"
"147","4.467790","18.165.77.79","192.168.0.92","TLSv1.2","629","Application Data"
"148","4.467792","18.165.77.79","192.168.0.92","TLSv1.2","97","Application Data"
"149","4.467872","192.168.0.92","18.165.77.79","TCP","66","63409  >  443 [ACK] Seq=474 Ack=595 Win=3779 Len=0 TSval=1024278429 TSecr=3519396101"
"161","4.521285","18.165.77.79","192.168.0.92","TLSv1.2","1310","Application Data"
"162","4.521375","192.168.0.92","18.165.77.79","TCP","66","63409  >  443 [ACK] Seq=474 Ack=1839 Win=3768 Len=0 TSval=1024278483 TSecr=3519396148"
"163","4.525172","18.165.77.79","192.168.0.92","TCP","1494","443  >  63409 [ACK] Seq=1839 Ack=474 Win=260 Len=1428 TSval=3519396149 TSecr=1024278420 [TCP segment of a reassembled PDU]"
"164","4.525174","18.165.77.79","192.168.0.92","TCP","1494","443  >  63409 [ACK] Seq=3267 Ack=474 Win=260 Len=1428 TSval=3519396149 TSecr=1024278420 [TCP segment of a reassembled PDU]"
"165","4.525175","18.165.77.79","192.168.0.92","TCP","1494","443  >  63409 [ACK] Seq=4695 Ack=474 Win=260 Len=1428 TSval=3519396149 TSecr=1024278420 [TCP segment of a reassembled PDU]"
"166","4.525176","18.165.77.79","192.168.0.92","TLSv1.2","695","Application Data"
"167","4.525228","192.168.0.92","18.165.77.79","TCP","66","63409  >  443 [ACK] Seq=474 Ack=6752 Win=3711 Len=0 TSval=1024278487 TSecr=3519396149"
"168","4.525317","192.168.0.92","18.165.77.79","TCP","66","[TCP Window Update] 63409  >  443 [ACK] Seq=474 Ack=6752 Win=3788 Len=0 TSval=1024278487 TSecr=3519396149"
"169","4.528504","18.165.77.79","192.168.0.92","TCP","1494","443  >  63409 [ACK] Seq=6752 Ack=474 Win=260 Len=1428 TSval=3519396159 TSecr=1024278420 [TCP segment of a reassembled PDU]"
"170","4.528610","192.168.0.92","18.165.77.79","TCP","66","63409  >  443 [ACK] Seq=474 Ack=8180 Win=3766 Len=0 TSval=1024278490 TSecr=3519396159"
"171","4.534798","18.165.77.79","192.168.0.92","TCP","1494","443  >  63409 [ACK] Seq=8180 Ack=474 Win=260 Len=1428 TSval=3519396159 TSecr=1024278420 [TCP segment of a reassembled PDU]"
"172","4.534800","18.165.77.79","192.168.0.92","TCP","1494","443  >  63409 [ACK] Seq=9608 Ack=474 Win=260 Len=1428 TSval=3519396159 TSecr=1024278420 [TCP segment of a reassembled PDU]"
"173","4.534801","18.165.77.79","192.168.0.92","TCP","1494","443  >  63409 [ACK] Seq=11036 Ack=474 Win=260 Len=1428 TSval=3519396159 TSecr=1024278420 [TCP segment of a reassembled PDU]"
"174","4.534801","18.165.77.79","192.168.0.92","TCP","1494","443  >  63409 [ACK] Seq=12464 Ack=474 Win=260 Len=1428 TSval=3519396159 TSecr=1024278420 [TCP segment of a reassembled PDU]"
"175","4.534802","18.165.77.79","192.168.0.92","TLSv1.2","1267","Application Data"
"176","4.534803","18.165.77.79","192.168.0.92","TCP","1494","443  >  63409 [ACK] Seq=15093 Ack=474 Win=260 Len=1428 TSval=3519396160 TSecr=1024278420 [TCP segment of a reassembled PDU]"
"177","4.534804","18.165.77.79","192.168.0.92","TCP","1494","443  >  63409 [ACK] Seq=16521 Ack=474 Win=260 Len=1428 TSval=3519396160 TSecr=1024278420 [TCP segment of a reassembled PDU]"
"178","4.534805","18.165.77.79","192.168.0.92","TCP","1494","443  >  63409 [ACK] Seq=17949 Ack=474 Win=260 Len=1428 TSval=3519396160 TSecr=1024278420 [TCP segment of a reassembled PDU]"
"179","4.534806","18.165.77.79","192.168.0.92","TLSv1.2","1002","Application Data"
"180","4.534807","18.165.77.79","192.168.0.92","TCP","1494","443  >  63409 [ACK] Seq=20313 Ack=474 Win=260 Len=1428 TSval=3519396161 TSecr=1024278420 [TCP segment of a reassembled PDU]"
"181","4.534808","18.165.77.79","192.168.0.92","TLSv1.2","942","Application Data"
"182","4.534808","18.165.77.79","192.168.0.92","TCP","1494","443  >  63409 [ACK] Seq=22617 Ack=474 Win=260 Len=1428 TSval=3519396162 TSecr=1024278420 [TCP segment of a reassembled PDU]"
"183","4.534809","18.165.77.79","192.168.0.92","TCP","1494","443  >  63409 [ACK] Seq=24045 Ack=474 Win=260 Len=1428 TSval=3519396162 TSecr=1024278420 [TCP segment of a reassembled PDU]"
"184","4.534810","18.165.77.79","192.168.0.92","TCP","1494","443  >  63409 [ACK] Seq=25473 Ack=474 Win=260 Len=1428 TSval=3519396162 TSecr=1024278420 [TCP segment of a reassembled PDU]"
"185","4.534811","18.165.77.79","192.168.0.92","TCP","1494","443  >  63409 [ACK] Seq=26901 Ack=474 Win=260 Len=1428 TSval=3519396162 TSecr=1024278420 [TCP segment of a reassembled PDU]"
"186","4.534812","18.165.77.79","192.168.0.92","TLSv1.2","1323","Application Data"
"187","4.534813","18.165.77.79","192.168.0.92","TLSv1.2","1014","Application Data"
"188","4.534927","192.168.0.92","18.165.77.79","TCP","66","63409  >  443 [ACK] Seq=474 Ack=24045 Win=3540 Len=0 TSval=1024278497 TSecr=3519396162"
"189","4.534966","192.168.0.92","18.165.77.79","TCP","66","63409  >  443 [ACK] Seq=474 Ack=30534 Win=3439 Len=0 TSval=1024278497 TSecr=3519396162"
"190","4.535026","192.168.0.92","18.165.77.79","TCP","66","[TCP Window Update] 63409  >  443 [ACK] Seq=474 Ack=30534 Win=3788 Len=0 TSval=1024278497 TSecr=3519396162"
"198","4.581963","18.165.77.79","192.168.0.92","TCP","1494","443  >  63409 [ACK] Seq=30534 Ack=474 Win=260 Len=1428 TSval=3519396215 TSecr=1024278497 [TCP segment of a reassembled PDU]"
"199","4.581965","18.165.77.79","192.168.0.92","TCP","1494","443  >  63409 [ACK] Seq=31962 Ack=474 Win=260 Len=1428 TSval=3519396215 TSecr=1024278497 [TCP segment of a reassembled PDU]"
"200","4.581966","18.165.77.79","192.168.0.92","TCP","1494","443  >  63409 [ACK] Seq=33390 Ack=474 Win=260 Len=1428 TSval=3519396215 TSecr=1024278497 [TCP segment of a reassembled PDU]"
"201","4.582078","192.168.0.92","18.165.77.79","TCP","66","63409  >  443 [ACK] Seq=474 Ack=34818 Win=3721 Len=0 TSval=1024278544 TSecr=3519396215"
"202","4.582180","192.168.0.92","18.165.77.79","TCP","66","[TCP Window Update] 63409  >  443 [ACK] Seq=474 Ack=34818 Win=3788 Len=0 TSval=1024278544 TSecr=3519396215"
"203","4.585433","18.165.77.79","192.168.0.92","TCP","1494","443  >  63409 [ACK] Seq=34818 Ack=474 Win=260 Len=1428 TSval=3519396215 TSecr=1024278497 [TCP segment of a reassembled PDU]"
"204","4.585435","18.165.77.79","192.168.0.92","TCP","1494","443  >  63409 [ACK] Seq=36246 Ack=474 Win=260 Len=1428 TSval=3519396215 TSecr=1024278497 [TCP segment of a reassembled PDU]"
"205","4.585435","18.165.77.79","192.168.0.92","TCP","1494","443  >  63409 [ACK] Seq=37674 Ack=474 Win=260 Len=1428 TSval=3519396215 TSecr=1024278497 [TCP segment of a reassembled PDU]"
"206","4.585436","18.165.77.79","192.168.0.92","TCP","1494","443  >  63409 [PSH, ACK] Seq=39102 Ack=474 Win=260 Len=1428 TSval=3519396215 TSecr=1024278497 [TCP segment of a reassembled PDU]"
"207","4.585437","18.165.77.79","192.168.0.92","TCP","1494","443  >  63409 [ACK] Seq=40530 Ack=474 Win=260 Len=1428 TSval=3519396216 TSecr=1024278497 [TCP segment of a reassembled PDU]"
"208","4.585438","18.165.77.79","192.168.0.92","TCP","1494","443  >  63409 [ACK] Seq=41958 Ack=474 Win=260 Len=1428 TSval=3519396216 TSecr=1024278497 [TCP segment of a reassembled PDU]"
"209","4.585439","18.165.77.79","192.168.0.92","TCP","1494","443  >  63409 [ACK] Seq=43386 Ack=474 Win=260 Len=1428 TSval=3519396216 TSecr=1024278497 [TCP segment of a reassembled PDU]"
"210","4.585439","18.165.77.79","192.168.0.92","TCP","1494","443  >  63409 [ACK] Seq=44814 Ack=474 Win=260 Len=1428 TSval=3519396216 TSecr=1024278497 [TCP segment of a reassembled PDU]"
"211","4.585440","18.165.77.79","192.168.0.92","TLSv1.2","487","Application Data"
"212","4.585531","192.168.0.92","18.165.77.79","TCP","66","63409  >  443 [ACK] Seq=474 Ack=46663 Win=3603 Len=0 TSval=1024278547 TSecr=3519396216"
"213","4.585631","192.168.0.92","18.165.77.79","TCP","66","[TCP Window Update] 63409  >  443 [ACK] Seq=474 Ack=46663 Win=3788 Len=0 TSval=1024278547 TSecr=3519396216"
"222","5.002127","18.165.77.79","192.168.0.92","TLSv1.2","430","Application Data"
"223","5.002128","18.165.77.79","192.168.0.92","TCP","1494","443  >  63409 [ACK] Seq=47027 Ack=474 Win=260 Len=1428 TSval=3519396554 TSecr=1024278547 [TCP segment of a reassembled PDU]"
"224","5.002129","18.165.77.79","192.168.0.92","TCP","1494","443  >  63409 [ACK] Seq=48455 Ack=474 Win=260 Len=1428 TSval=3519396554 TSecr=1024278547 [TCP segment of a reassembled PDU]"
"225","5.002130","18.165.77.79","192.168.0.92","TCP","1494","443  >  63409 [ACK] Seq=49883 Ack=474 Win=260 Len=1428 TSval=3519396554 TSecr=1024278547 [TCP segment of a reassembled PDU]"
"226","5.002131","18.165.77.79","192.168.0.92","TCP","1494","443  >  63409 [ACK] Seq=51311 Ack=474 Win=260 Len=1428 TSval=3519396554 TSecr=1024278547 [TCP segment of a reassembled PDU]"
"227","5.002132","18.165.77.79","192.168.0.92","TCP","1494","443  >  63409 [ACK] Seq=52739 Ack=474 Win=260 Len=1428 TSval=3519396554 TSecr=1024278547 [TCP segment of a reassembled PDU]"
"228","5.002133","18.165.77.79","192.168.0.92","TLSv1.2","1143","Application Data"
"229","5.002133","18.165.77.79","192.168.0.92","TCP","1494","443  >  63409 [ACK] Seq=55244 Ack=474 Win=260 Len=1428 TSval=3519396555 TSecr=1024278547 [TCP segment of a reassembled PDU]"
"230","5.002134","18.165.77.79","192.168.0.92","TCP","1494","443  >  63409 [ACK] Seq=56672 Ack=474 Win=260 Len=1428 TSval=3519396555 TSecr=1024278547 [TCP segment of a reassembled PDU]"
"231","5.002135","18.165.77.79","192.168.0.92","TCP","1494","443  >  63409 [ACK] Seq=58100 Ack=474 Win=260 Len=1428 TSval=3519396555 TSecr=1024278547 [TCP segment of a reassembled PDU]"
"232","5.002136","18.165.77.79","192.168.0.92","TCP","1494","443  >  63409 [ACK] Seq=59528 Ack=474 Win=260 Len=1428 TSval=3519396555 TSecr=1024278547 [TCP segment of a reassembled PDU]"
"233","5.002136","18.165.77.79","192.168.0.92","TLSv1.2","1307","Application Data"
"234","5.002137","18.165.77.79","192.168.0.92","TCP","1307","[TCP Retransmission] 443  >  63409 [PSH, ACK] Seq=60956 Ack=474 Win=260 Len=1241 TSval=3519396611 TSecr=1024278547 [TCP segment of a reassembled PDU]"
"235","5.002240","192.168.0.92","18.165.77.79","TCP","66","63409  >  443 [ACK] Seq=474 Ack=62197 Win=3545 Len=0 TSval=1024278964 TSecr=3519396555"
"236","5.002300","192.168.0.92","18.165.77.79","TCP","78","[TCP Dup ACK 235#1] 63409  >  443 [ACK] Seq=474 Ack=62197 Win=3545 Len=0 TSval=1024278964 TSecr=3519396611 SLE=60956 SRE=62197"
"237","5.002361","192.168.0.92","18.165.77.79","TCP","66","[TCP Window Update] 63409  >  443 [ACK] Seq=474 Ack=62197 Win=3788 Len=0 TSval=1024278964 TSecr=3519396611"
"350","5.426583","18.165.77.79","192.168.0.92","TCP","1494","443  >  63409 [ACK] Seq=62197 Ack=474 Win=260 Len=1428 TSval=3519397012 TSecr=1024278964 [TCP segment of a reassembled PDU]"
"351","5.426585","18.165.77.79","192.168.0.92","TCP","1494","443  >  63409 [ACK] Seq=63625 Ack=474 Win=260 Len=1428 TSval=3519397012 TSecr=1024278964 [TCP segment of a reassembled PDU]"
"352","5.426586","18.165.77.79","192.168.0.92","TCP","1494","443  >  63409 [ACK] Seq=65053 Ack=474 Win=260 Len=1428 TSval=3519397012 TSecr=1024278964 [TCP segment of a reassembled PDU]"
"353","5.426588","18.165.77.79","192.168.0.92","TCP","1494","443  >  63409 [ACK] Seq=66481 Ack=474 Win=260 Len=1428 TSval=3519397012 TSecr=1024278964 [TCP segment of a reassembled PDU]"
"354","5.426589","18.165.77.79","192.168.0.92","TCP","1494","443  >  63409 [ACK] Seq=67909 Ack=474 Win=260 Len=1428 TSval=3519397012 TSecr=1024278964 [TCP segment of a reassembled PDU]"
"355","5.426591","18.165.77.79","192.168.0.92","TCP","1494","443  >  63409 [ACK] Seq=69337 Ack=474 Win=260 Len=1428 TSval=3519397012 TSecr=1024278964 [TCP segment of a reassembled PDU]"
"356","5.426592","18.165.77.79","192.168.0.92","TCP","1494","443  >  63409 [PSH, ACK] Seq=70765 Ack=474 Win=260 Len=1428 TSval=3519397012 TSecr=1024278964 [TCP segment of a reassembled PDU]"
"357","5.426593","18.165.77.79","192.168.0.92","TCP","1494","443  >  63409 [ACK] Seq=72193 Ack=474 Win=260 Len=1428 TSval=3519397012 TSecr=1024278964 [TCP segment of a reassembled PDU]"
"358","5.426594","18.165.77.79","192.168.0.92","TCP","1494","443  >  63409 [ACK] Seq=73621 Ack=474 Win=260 Len=1428 TSval=3519397012 TSecr=1024278964 [TCP segment of a reassembled PDU]"
"359","5.426595","18.165.77.79","192.168.0.92","TCP","1494","443  >  63409 [ACK] Seq=75049 Ack=474 Win=260 Len=1428 TSval=3519397012 TSecr=1024278964 [TCP segment of a reassembled PDU]"
"360","5.426596","18.165.77.79","192.168.0.92","TCP","1494","443  >  63409 [ACK] Seq=76477 Ack=474 Win=260 Len=1428 TSval=3519397012 TSecr=1024278964 [TCP segment of a reassembled PDU]"
"361","5.426597","18.165.77.79","192.168.0.92","TLSv1.2","69","Application Data"
"362","5.426598","18.165.77.79","192.168.0.92","TLSv1.2","306","Application Data"
"363","5.426732","192.168.0.92","18.165.77.79","TCP","66","63409  >  443 [ACK] Seq=474 Ack=78148 Win=3539 Len=0 TSval=1024279388 TSecr=3519397038"
"364","5.426858","192.168.0.92","18.165.77.79","TCP","66","[TCP Window Update] 63409  >  443 [ACK] Seq=474 Ack=78148 Win=3788 Len=0 TSval=1024279388 TSecr=3519397038"
"626","5.651787","18.165.77.79","192.168.0.92","TCP","1494","443  >  63409 [ACK] Seq=78148 Ack=474 Win=260 Len=1428 TSval=3519397285 TSecr=1024279388 [TCP segment of a reassembled PDU]"
"627","5.651876","192.168.0.92","18.165.77.79","TCP","66","63409  >  443 [ACK] Seq=474 Ack=79576 Win=3766 Len=0 TSval=1024279613 TSecr=3519397285"
"628","5.653416","18.165.77.79","192.168.0.92","TCP","1494","443  >  63409 [ACK] Seq=79576 Ack=474 Win=260 Len=1428 TSval=3519397285 TSecr=1024279388 [TCP segment of a reassembled PDU]"
"629","5.653417","18.165.77.79","192.168.0.92","TLSv1.2","143","Application Data"
"630","5.653417","18.165.77.79","192.168.0.92","TLSv1.2","552","Application Data"
"631","5.653418","18.165.77.79","192.168.0.92","TLSv1.2","1377","Application Data"
"632","5.653419","18.165.77.79","192.168.0.92","TLSv1.2","660","Application Data"
"633","5.653420","18.165.77.79","192.168.0.92","TLSv1.2","520","Application Data"
"634","5.653420","18.165.77.79","192.168.0.92","TCP","1494","443  >  63409 [ACK] Seq=83926 Ack=474 Win=260 Len=1428 TSval=3519397286 TSecr=1024279388 [TCP segment of a reassembled PDU]"
"635","5.653421","18.165.77.79","192.168.0.92","TLSv1.2","612","Application Data"
"636","5.653422","18.165.77.79","192.168.0.92","TLSv1.2","812","Application Data"
"637","5.653423","18.165.77.79","192.168.0.92","TLSv1.2","603","Application Data"
"638","5.653424","18.165.77.79","192.168.0.92","TLSv1.2","848","Application Data"
"639","5.653507","192.168.0.92","18.165.77.79","TCP","66","63409  >  443 [ACK] Seq=474 Ack=87965 Win=3657 Len=0 TSval=1024279615 TSecr=3519397287"
"640","5.653572","192.168.0.92","18.165.77.79","TCP","66","[TCP Window Update] 63409  >  443 [ACK] Seq=474 Ack=87965 Win=3788 Len=0 TSval=1024279615 TSecr=3519397287"
"641","5.654903","18.165.77.79","192.168.0.92","TCP","1494","443  >  63409 [ACK] Seq=87965 Ack=474 Win=260 Len=1428 TSval=3519397287 TSecr=1024279388 [TCP segment of a reassembled PDU]"
"642","5.654905","18.165.77.79","192.168.0.92","TLSv1.2","939","Application Data"
"643","5.654905","18.165.77.79","192.168.0.92","TLSv1.2","416","Application Data"
"644","5.654906","18.165.77.79","192.168.0.92","TLSv1.2","673","Application Data"
"645","5.654907","18.165.77.79","192.168.0.92","TCP","1494","443  >  63409 [ACK] Seq=91223 Ack=474 Win=260 Len=1428 TSval=3519397288 TSecr=1024279388 [TCP segment of a reassembled PDU]"
"646","5.654908","18.165.77.79","192.168.0.92","TLSv1.2","273","Application Data"
"647","5.654908","18.165.77.79","192.168.0.92","TCP","1494","443  >  63409 [ACK] Seq=92858 Ack=474 Win=260 Len=1428 TSval=3519397288 TSecr=1024279388 [TCP segment of a reassembled PDU]"
"648","5.654909","18.165.77.79","192.168.0.92","TLSv1.2","71","Application Data"
"649","5.654909","18.165.77.79","192.168.0.92","TLSv1.2","1435","Application Data"
"650","5.655000","192.168.0.92","18.165.77.79","TCP","66","63409  >  443 [ACK] Seq=474 Ack=95660 Win=3668 Len=0 TSval=1024279617 TSecr=3519397289"
"651","5.655053","192.168.0.92","18.165.77.79","TCP","66","[TCP Window Update] 63409  >  443 [ACK] Seq=474 Ack=95660 Win=3788 Len=0 TSval=1024279617 TSecr=3519397289"
"652","5.655844","18.165.77.79","192.168.0.92","TLSv1.2","410","Application Data"
"653","5.655886","192.168.0.92","18.165.77.79","TCP","66","63409  >  443 [ACK] Seq=474 Ack=96004 Win=3783 Len=0 TSval=1024279617 TSecr=3519397290"
"655","5.659223","18.165.77.79","192.168.0.92","TLSv1.2","1061","Application Data"
"656","5.659224","18.165.77.79","192.168.0.92","TCP","1494","443  >  63409 [ACK] Seq=96999 Ack=474 Win=260 Len=1428 TSval=3519397292 TSecr=1024279388 [TCP segment of a reassembled PDU]"
"657","5.659225","18.165.77.79","192.168.0.92","TCP","1494","443  >  63409 [ACK] Seq=98427 Ack=474 Win=260 Len=1428 TSval=3519397292 TSecr=1024279388 [TCP segment of a reassembled PDU]"
"658","5.659225","18.165.77.79","192.168.0.92","TLSv1.2","115","Application Data"
"659","5.659480","192.168.0.92","18.165.77.79","TCP","66","63409  >  443 [ACK] Seq=474 Ack=99904 Win=3788 Len=0 TSval=1024279620 TSecr=3519397292"
"660","5.661843","18.165.77.79","192.168.0.92","TCP","1494","443  >  63409 [ACK] Seq=99904 Ack=474 Win=260 Len=1428 TSval=3519397295 TSecr=1024279388 [TCP segment of a reassembled PDU]"
"661","5.664390","18.165.77.79","192.168.0.92","TCP","1494","443  >  63409 [ACK] Seq=101332 Ack=474 Win=260 Len=1428 TSval=3519397295 TSecr=1024279388 [TCP segment of a reassembled PDU]"
"662","5.664392","18.165.77.79","192.168.0.92","TCP","1494","443  >  63409 [ACK] Seq=102760 Ack=474 Win=260 Len=1428 TSval=3519397295 TSecr=1024279388 [TCP segment of a reassembled PDU]"
"663","5.664393","18.165.77.79","192.168.0.92","TCP","1494","443  >  63409 [ACK] Seq=104188 Ack=474 Win=260 Len=1428 TSval=3519397295 TSecr=1024279388 [TCP segment of a reassembled PDU]"
"664","5.664394","18.165.77.79","192.168.0.92","TCP","1494","443  >  63409 [ACK] Seq=105616 Ack=474 Win=260 Len=1428 TSval=3519397295 TSecr=1024279388 [TCP segment of a reassembled PDU]"
"665","5.664395","18.165.77.79","192.168.0.92","TCP","1494","443  >  63409 [ACK] Seq=107044 Ack=474 Win=260 Len=1428 TSval=3519397295 TSecr=1024279388 [TCP segment of a reassembled PDU]"
"666","5.664396","18.165.77.79","192.168.0.92","TCP","1494","443  >  63409 [PSH, ACK] Seq=108472 Ack=474 Win=260 Len=1428 TSval=3519397295 TSecr=1024279388 [TCP segment of a reassembled PDU]"
"667","5.664397","18.165.77.79","192.168.0.92","TLSv1.2","635","Application Data"
"668","5.664398","18.165.77.79","192.168.0.92","TLSv1.2","995","Application Data"
"669","5.664399","18.165.77.79","192.168.0.92","TLSv1.2","453","Application Data, Application Data"
"671","5.664546","192.168.0.92","18.165.77.79","TCP","66","63409  >  443 [ACK] Seq=474 Ack=111785 Win=3788 Len=0 TSval=1024279626 TSecr=3519397295"
"672","5.667455","18.165.77.79","192.168.0.92","TCP","1494","443  >  63409 [ACK] Seq=111785 Ack=474 Win=260 Len=1428 TSval=3519397300 TSecr=1024279388 [TCP segment of a reassembled PDU]"
"673","5.667456","18.165.77.79","192.168.0.92","TLSv1.2","1090","Application Data"
"674","5.667531","192.168.0.92","18.165.77.79","TCP","66","63409  >  443 [ACK] Seq=474 Ack=114237 Win=3788 Len=0 TSval=1024279629 TSecr=3519397300"
"675","5.668982","18.165.77.79","192.168.0.92","TCP","1494","443  >  63409 [ACK] Seq=114237 Ack=474 Win=260 Len=1428 TSval=3519397303 TSecr=1024279388 [TCP segment of a reassembled PDU]"
"676","5.668983","18.165.77.79","192.168.0.92","TLSv1.2","504","Application Data"
"677","5.669065","192.168.0.92","18.165.77.79","TCP","66","63409  >  443 [ACK] Seq=474 Ack=116103 Win=3788 Len=0 TSval=1024279631 TSecr=3519397303"
"678","5.679376","18.165.77.79","192.168.0.92","TCP","1494","443  >  63409 [ACK] Seq=116103 Ack=474 Win=260 Len=1428 TSval=3519397311 TSecr=1024279617 [TCP segment of a reassembled PDU]"
"679","5.685000","18.165.77.79","192.168.0.92","TCP","1494","443  >  63409 [ACK] Seq=117531 Ack=474 Win=260 Len=1428 TSval=3519397311 TSecr=1024279617 [TCP segment of a reassembled PDU]"
"680","5.685002","18.165.77.79","192.168.0.92","TCP","1494","443  >  63409 [ACK] Seq=118959 Ack=474 Win=260 Len=1428 TSval=3519397311 TSecr=1024279617 [TCP segment of a reassembled PDU]"
"681","5.685003","18.165.77.79","192.168.0.92","TLSv1.2","490","Application Data"
"682","5.685004","18.165.77.79","192.168.0.92","TLSv1.2","192","Application Data"
"683","5.685004","18.165.77.79","192.168.0.92","TLSv1.2","285","Application Data"
"684","5.685005","18.165.77.79","192.168.0.92","TLSv1.2","288","Application Data"
"685","5.685006","18.165.77.79","192.168.0.92","TLSv1.2","166","Application Data"
"686","5.685117","192.168.0.92","18.165.77.79","TCP","66","63409  >  443 [ACK] Seq=474 Ack=121478 Win=3788 Len=0 TSval=1024279647 TSecr=3519397311"
"687","5.686605","18.165.77.79","192.168.0.92","TLSv1.2","802","Application Data"
"713","5.686708","192.168.0.92","18.165.77.79","TCP","66","63409  >  443 [ACK] Seq=474 Ack=122214 Win=3788 Len=0 TSval=1024279648 TSecr=3519397314"
"717","5.690973","18.165.77.79","192.168.0.92","TCP","1494","443  >  63409 [ACK] Seq=122214 Ack=474 Win=260 Len=1428 TSval=3519397324 TSecr=1024279631 [TCP segment of a reassembled PDU]"
"718","5.690974","18.165.77.79","192.168.0.92","TCP","1494","443  >  63409 [ACK] Seq=123642 Ack=474 Win=260 Len=1428 TSval=3519397324 TSecr=1024279631 [TCP segment of a reassembled PDU]"
"719","5.690975","18.165.77.79","192.168.0.92","TCP","1494","443  >  63409 [ACK] Seq=125070 Ack=474 Win=260 Len=1428 TSval=3519397324 TSecr=1024279631 [TCP segment of a reassembled PDU]"
"720","5.690976","18.165.77.79","192.168.0.92","TCP","1494","443  >  63409 [ACK] Seq=126498 Ack=474 Win=260 Len=1428 TSval=3519397324 TSecr=1024279631 [TCP segment of a reassembled PDU]"
"721","5.691077","192.168.0.92","18.165.77.79","TCP","66","63409  >  443 [ACK] Seq=474 Ack=127926 Win=3788 Len=0 TSval=1024279653 TSecr=3519397324"
"722","5.693353","18.165.77.79","192.168.0.92","TCP","1494","443  >  63409 [ACK] Seq=127926 Ack=474 Win=260 Len=1428 TSval=3519397324 TSecr=1024279631 [TCP segment of a reassembled PDU]"
"723","5.693355","18.165.77.79","192.168.0.92","TCP","1494","443  >  63409 [ACK] Seq=129354 Ack=474 Win=260 Len=1428 TSval=3519397324 TSecr=1024279631 [TCP segment of a reassembled PDU]"
"724","5.693355","18.165.77.79","192.168.0.92","TLSv1.2","1268","Application Data"
"725","5.693424","192.168.0.92","18.165.77.79","TCP","66","63409  >  443 [ACK] Seq=474 Ack=131984 Win=3788 Len=0 TSval=1024279655 TSecr=3519397324"
"742","5.708918","18.165.77.79","192.168.0.92","TCP","1494","443  >  63409 [ACK] Seq=131984 Ack=474 Win=260 Len=1428 TSval=3519397343 TSecr=1024279653 [TCP segment of a reassembled PDU]"
"743","5.708919","18.165.77.79","192.168.0.92","TCP","1494","443  >  63409 [ACK] Seq=133412 Ack=474 Win=260 Len=1428 TSval=3519397343 TSecr=1024279653 [TCP segment of a reassembled PDU]"
"744","5.708920","18.165.77.79","192.168.0.92","TCP","1494","443  >  63409 [ACK] Seq=134840 Ack=474 Win=260 Len=1428 TSval=3519397343 TSecr=1024279653 [TCP segment of a reassembled PDU]"
"745","5.708921","18.165.77.79","192.168.0.92","TCP","1494","443  >  63409 [ACK] Seq=136268 Ack=474 Win=260 Len=1428 TSval=3519397343 TSecr=1024279653 [TCP segment of a reassembled PDU]"
"746","5.709066","192.168.0.92","18.165.77.79","TCP","66","63409  >  443 [ACK] Seq=474 Ack=137696 Win=3788 Len=0 TSval=1024279671 TSecr=3519397343"
"747","5.712344","18.165.77.79","192.168.0.92","TCP","1494","443  >  63409 [ACK] Seq=137696 Ack=474 Win=260 Len=1428 TSval=3519397343 TSecr=1024279653 [TCP segment of a reassembled PDU]"
"748","5.712352","18.165.77.79","192.168.0.92","TCP","1494","443  >  63409 [ACK] Seq=139124 Ack=474 Win=260 Len=1428 TSval=3519397343 TSecr=1024279653 [TCP segment of a reassembled PDU]"
"749","5.712353","18.165.77.79","192.168.0.92","TCP","1494","443  >  63409 [PSH, ACK] Seq=140552 Ack=474 Win=260 Len=1428 TSval=3519397343 TSecr=1024279653 [TCP segment of a reassembled PDU]"
"750","5.712354","18.165.77.79","192.168.0.92","TCP","1494","443  >  63409 [ACK] Seq=141980 Ack=474 Win=260 Len=1428 TSval=3519397343 TSecr=1024279653 [TCP segment of a reassembled PDU]"
"751","5.712355","18.165.77.79","192.168.0.92","TCP","1494","443  >  63409 [ACK] Seq=143408 Ack=474 Win=260 Len=1428 TSval=3519397343 TSecr=1024279653 [TCP segment of a reassembled PDU]"
"752","5.712356","18.165.77.79","192.168.0.92","TCP","1494","443  >  63409 [ACK] Seq=144836 Ack=474 Win=260 Len=1428 TSval=3519397343 TSecr=1024279653 [TCP segment of a reassembled PDU]"
"753","5.712357","18.165.77.79","192.168.0.92","TCP","1494","443  >  63409 [ACK] Seq=146264 Ack=474 Win=260 Len=1428 TSval=3519397343 TSecr=1024279653 [TCP segment of a reassembled PDU]"
"754","5.712358","18.165.77.79","192.168.0.92","TLSv1.2","761","Application Data"
"755","5.712358","18.165.77.79","192.168.0.92","TCP","1494","443  >  63409 [ACK] Seq=148387 Ack=474 Win=260 Len=1428 TSval=3519397344 TSecr=1024279653 [TCP segment of a reassembled PDU]"
"756","5.712359","18.165.77.79","192.168.0.92","TCP","1494","443  >  63409 [ACK] Seq=149815 Ack=474 Win=260 Len=1428 TSval=3519397344 TSecr=1024279653 [TCP segment of a reassembled PDU]"
"757","5.712360","18.165.77.79","192.168.0.92","TCP","1494","443  >  63409 [ACK] Seq=151243 Ack=474 Win=260 Len=1428 TSval=3519397344 TSecr=1024279653 [TCP segment of a reassembled PDU]"
"758","5.712361","18.165.77.79","192.168.0.92","TCP","1494","443  >  63409 [ACK] Seq=152671 Ack=474 Win=260 Len=1428 TSval=3519397344 TSecr=1024279653 [TCP segment of a reassembled PDU]"
"759","5.712362","18.165.77.79","192.168.0.92","TCP","1494","443  >  63409 [ACK] Seq=154099 Ack=474 Win=260 Len=1428 TSval=3519397344 TSecr=1024279653 [TCP segment of a reassembled PDU]"
"760","5.712363","18.165.77.79","192.168.0.92","TCP","1494","443  >  63409 [ACK] Seq=155527 Ack=474 Win=260 Len=1428 TSval=3519397344 TSecr=1024279653 [TCP segment of a reassembled PDU]"
"761","5.712363","18.165.77.79","192.168.0.92","TCP","1494","443  >  63409 [PSH, ACK] Seq=156955 Ack=474 Win=260 Len=1428 TSval=3519397344 TSecr=1024279653 [TCP segment of a reassembled PDU]"
"774","5.712375","18.165.77.79","192.168.0.92","TCP","1494","443  >  63409 [ACK] Seq=158383 Ack=474 Win=260 Len=1428 TSval=3519397345 TSecr=1024279653 [TCP segment of a reassembled PDU]"
"775","5.712376","18.165.77.79","192.168.0.92","TCP","1494","443  >  63409 [ACK] Seq=159811 Ack=474 Win=260 Len=1428 TSval=3519397345 TSecr=1024279653 [TCP segment of a reassembled PDU]"
"776","5.712377","18.165.77.79","192.168.0.92","TCP","1494","443  >  63409 [ACK] Seq=161239 Ack=474 Win=260 Len=1428 TSval=3519397345 TSecr=1024279653 [TCP segment of a reassembled PDU]"
"777","5.712378","18.165.77.79","192.168.0.92","TCP","1494","443  >  63409 [ACK] Seq=162667 Ack=474 Win=260 Len=1428 TSval=3519397345 TSecr=1024279653 [TCP segment of a reassembled PDU]"
"778","5.712379","18.165.77.79","192.168.0.92","TLSv1.2","764","Application Data"
"779","5.712380","18.165.77.79","192.168.0.92","TLSv1.2","100","Application Data"
"780","5.712380","18.165.77.79","192.168.0.92","TCP","1494","443  >  63409 [ACK] Seq=164827 Ack=474 Win=260 Len=1428 TSval=3519397345 TSecr=1024279653 [TCP segment of a reassembled PDU]"
"781","5.712381","18.165.77.79","192.168.0.92","TCP","1494","443  >  63409 [ACK] Seq=166255 Ack=474 Win=260 Len=1428 TSval=3519397345 TSecr=1024279653 [TCP segment of a reassembled PDU]"
"782","5.712382","18.165.77.79","192.168.0.92","TCP","1494","443  >  63409 [ACK] Seq=167683 Ack=474 Win=260 Len=1428 TSval=3519397345 TSecr=1024279653 [TCP segment of a reassembled PDU]"
"783","5.712383","18.165.77.79","192.168.0.92","TCP","1494","443  >  63409 [ACK] Seq=169111 Ack=474 Win=260 Len=1428 TSval=3519397345 TSecr=1024279653 [TCP segment of a reassembled PDU]"
"784","5.712384","18.165.77.79","192.168.0.92","TCP","1494","443  >  63409 [ACK] Seq=170539 Ack=474 Win=260 Len=1428 TSval=3519397345 TSecr=1024279653 [TCP segment of a reassembled PDU]"
"785","5.712385","18.165.77.79","192.168.0.92","TLSv1.2","740","Application Data"
"786","5.712452","18.165.77.79","192.168.0.92","TLSv1.2","97","Application Data"
"787","5.712533","192.168.0.92","18.165.77.79","TCP","66","63409  >  443 [ACK] Seq=474 Ack=172672 Win=3788 Len=0 TSval=1024279674 TSecr=3519397344"
"1125","6.242248","192.168.0.92","18.165.77.79","TLSv1.2","712","Application Data"
"1134","6.274852","18.165.77.79","192.168.0.92","TLSv1.2","628","Application Data"
"1135","6.274853","18.165.77.79","192.168.0.92","TLSv1.2","97","Application Data"
"1136","6.274954","192.168.0.92","18.165.77.79","TCP","66","63409  >  443 [ACK] Seq=1120 Ack=173265 Win=3779 Len=0 TSval=1024280237 TSecr=3519397908"
"1158","6.387425","192.168.0.92","18.165.77.79","TLSv1.2","164","Application Data"
"1159","6.392200","192.168.0.92","18.165.77.79","TLSv1.2","248","Application Data"
"1175","6.416203","18.165.77.79","192.168.0.92","TCP","66","443  >  63409 [ACK] Seq=173265 Ack=1400 Win=269 Len=0 TSval=3519398050 TSecr=1024280348"
"1178","6.419350","18.165.77.79","192.168.0.92","TLSv1.2","508","Application Data"
"1179","6.419352","18.165.77.79","192.168.0.92","TLSv1.2","97","Application Data"
"1180","6.419431","192.168.0.92","18.165.77.79","TCP","66","63409  >  443 [ACK] Seq=1400 Ack=173738 Win=3780 Len=0 TSval=1024280380 TSecr=3519398053"
"1196","6.462539","18.165.77.79","192.168.0.92","TLSv1.2","976","Application Data"
"1197","6.462639","192.168.0.92","18.165.77.79","TCP","66","63409  >  443 [ACK] Seq=1400 Ack=174648 Win=3774 Len=0 TSval=1024280424 TSecr=3519398092"
"1198","6.463842","18.165.77.79","192.168.0.92","TLSv1.2","97","Application Data"
"1199","6.463927","192.168.0.92","18.165.77.79","TCP","66","63409  >  443 [ACK] Seq=1400 Ack=174679 Win=3787 Len=0 TSval=1024280426 TSecr=3519398092"
"1200","6.573841","192.168.0.92","18.165.77.79","TLSv1.2","226","Application Data"
"1201","6.578029","192.168.0.92","18.165.77.79","TLSv1.2","200","Application Data"
"1202","6.602644","18.165.77.79","192.168.0.92","TCP","66","443  >  63409 [ACK] Seq=174679 Ack=1694 Win=279 Len=0 TSval=3519398234 TSecr=1024280535"
"1203","6.637860","18.165.77.79","192.168.0.92","TCP","1494","443  >  63409 [ACK] Seq=174679 Ack=1694 Win=279 Len=1428 TSval=3519398270 TSecr=1024280535 [TCP segment of a reassembled PDU]"
"1204","6.637954","192.168.0.92","18.165.77.79","TCP","66","63409  >  443 [ACK] Seq=1694 Ack=176107 Win=3766 Len=0 TSval=1024280600 TSecr=3519398270"
"1205","6.639975","18.165.77.79","192.168.0.92","TCP","1494","443  >  63409 [ACK] Seq=176107 Ack=1694 Win=279 Len=1428 TSval=3519398270 TSecr=1024280535 [TCP segment of a reassembled PDU]"
"1206","6.639976","18.165.77.79","192.168.0.92","TLSv1.2","1190","Application Data"
"1207","6.639978","18.165.77.79","192.168.0.92","TLSv1.2","1135","Application Data"
"1208","6.639979","18.165.77.79","192.168.0.92","TCP","1494","443  >  63409 [ACK] Seq=179728 Ack=1694 Win=279 Len=1428 TSval=3519398271 TSecr=1024280535 [TCP segment of a reassembled PDU]"
"1209","6.639980","18.165.77.79","192.168.0.92","TCP","1494","443  >  63409 [ACK] Seq=181156 Ack=1694 Win=279 Len=1428 TSval=3519398271 TSecr=1024280535 [TCP segment of a reassembled PDU]"
"1210","6.639981","18.165.77.79","192.168.0.92","TLSv1.2","972","Application Data"
"1211","6.639982","18.165.77.79","192.168.0.92","TCP","1494","443  >  63409 [ACK] Seq=183490 Ack=1694 Win=279 Len=1428 TSval=3519398271 TSecr=1024280535 [TCP segment of a reassembled PDU]"
"1212","6.639982","18.165.77.79","192.168.0.92","TCP","1494","443  >  63409 [ACK] Seq=184918 Ack=1694 Win=279 Len=1428 TSval=3519398271 TSecr=1024280535 [TCP segment of a reassembled PDU]"
"1213","6.639984","18.165.77.79","192.168.0.92","TLSv1.2","695","Application Data"
"1214","6.639984","18.165.77.79","192.168.0.92","TCP","1494","443  >  63409 [ACK] Seq=186975 Ack=1694 Win=279 Len=1428 TSval=3519398272 TSecr=1024280535 [TCP segment of a reassembled PDU]"
"1215","6.640089","192.168.0.92","18.165.77.79","TCP","66","63409  >  443 [ACK] Seq=1694 Ack=188403 Win=3596 Len=0 TSval=1024280601 TSecr=3519398272"
"1216","6.641484","18.165.77.79","192.168.0.92","TCP","1494","443  >  63409 [ACK] Seq=188403 Ack=1694 Win=279 Len=1428 TSval=3519398272 TSecr=1024280535 [TCP segment of a reassembled PDU]"
"1217","6.641486","18.165.77.79","192.168.0.92","TCP","1494","443  >  63409 [ACK] Seq=189831 Ack=1694 Win=279 Len=1428 TSval=3519398272 TSecr=1024280535 [TCP segment of a reassembled PDU]"
"1218","6.641487","18.165.77.79","192.168.0.92","TCP","1494","443  >  63409 [ACK] Seq=191259 Ack=1694 Win=279 Len=1428 TSval=3519398272 TSecr=1024280535 [TCP segment of a reassembled PDU]"
"1219","6.641488","18.165.77.79","192.168.0.92","TCP","1494","443  >  63409 [ACK] Seq=192687 Ack=1694 Win=279 Len=1428 TSval=3519398272 TSecr=1024280535 [TCP segment of a reassembled PDU]"
"1220","6.641489","18.165.77.79","192.168.0.92","TCP","1494","443  >  63409 [ACK] Seq=194115 Ack=1694 Win=279 Len=1428 TSval=3519398272 TSecr=1024280535 [TCP segment of a reassembled PDU]"
"1221","6.641490","18.165.77.79","192.168.0.92","TCP","1494","443  >  63409 [PSH, ACK] Seq=195543 Ack=1694 Win=279 Len=1428 TSval=3519398272 TSecr=1024280535 [TCP segment of a reassembled PDU]"
"1222","6.641491","18.165.77.79","192.168.0.92","TLSv1.2","82","Application Data"
"1223","6.641492","18.165.77.79","192.168.0.92","TCP","1494","443  >  63409 [ACK] Seq=196987 Ack=1694 Win=279 Len=1428 TSval=3519398273 TSecr=1024280535 [TCP segment of a reassembled PDU]"
"1224","6.641493","18.165.77.79","192.168.0.92","TLSv1.2","605","Application Data"
"1225","6.641494","18.165.77.79","192.168.0.92","TLSv1.2","97","Application Data"
"1226","6.641494","18.165.77.79","192.168.0.92","TCP","1494","443  >  63409 [ACK] Seq=198985 Ack=1694 Win=279 Len=1428 TSval=3519398273 TSecr=1024280535 [TCP segment of a reassembled PDU]"
"1227","6.641495","18.165.77.79","192.168.0.92","TCP","1494","443  >  63409 [ACK] Seq=200413 Ack=1694 Win=279 Len=1428 TSval=3519398273 TSecr=1024280535 [TCP segment of a reassembled PDU]"
"1228","6.641496","18.165.77.79","192.168.0.92","TCP","1494","443  >  63409 [ACK] Seq=201841 Ack=1694 Win=279 Len=1428 TSval=3519398273 TSecr=1024280535 [TCP segment of a reassembled PDU]"
"1229","6.641497","18.165.77.79","192.168.0.92","TCP","1494","443  >  63409 [ACK] Seq=203269 Ack=1694 Win=279 Len=1428 TSval=3519398273 TSecr=1024280535 [TCP segment of a reassembled PDU]"
"1230","6.641498","18.165.77.79","192.168.0.92","TCP","1494","443  >  63409 [ACK] Seq=204697 Ack=1694 Win=279 Len=1428 TSval=3519398273 TSecr=1024280535 [TCP segment of a reassembled PDU]"
"1231","6.641499","18.165.77.79","192.168.0.92","TCP","1494","443  >  63409 [ACK] Seq=206125 Ack=1694 Win=279 Len=1428 TSval=3519398273 TSecr=1024280535 [TCP segment of a reassembled PDU]"
"1232","6.641500","18.165.77.79","192.168.0.92","TLSv1.2","1112","Application Data"
"1233","6.641501","18.165.77.79","192.168.0.92","TCP","1494","443  >  63409 [ACK] Seq=208599 Ack=1694 Win=279 Len=1428 TSval=3519398274 TSecr=1024280535 [TCP segment of a reassembled PDU]"
"1234","6.641800","18.165.77.79","192.168.0.92","TCP","1494","443  >  63409 [ACK] Seq=210027 Ack=1694 Win=279 Len=1428 TSval=3519398274 TSecr=1024280535 [TCP segment of a reassembled PDU]"
"1235","6.641801","18.165.77.79","192.168.0.92","TCP","1494","443  >  63409 [ACK] Seq=211455 Ack=1694 Win=279 Len=1428 TSval=3519398274 TSecr=1024280535 [TCP segment of a reassembled PDU]"
"1236","6.641802","18.165.77.79","192.168.0.92","TCP","1494","443  >  63409 [ACK] Seq=212883 Ack=1694 Win=279 Len=1428 TSval=3519398274 TSecr=1024280535 [TCP segment of a reassembled PDU]"
"1237","6.641803","18.165.77.79","192.168.0.92","TLSv1.2","731","Application Data"
"1238","6.641804","18.165.77.79","192.168.0.92","TCP","1494","443  >  63409 [ACK] Seq=214976 Ack=1694 Win=279 Len=1428 TSval=3519398275 TSecr=1024280535 [TCP segment of a reassembled PDU]"
"1239","6.641804","18.165.77.79","192.168.0.92","TLSv1.2","1414","Application Data"
"1240","6.641805","18.165.77.79","192.168.0.92","TLSv1.2","424","Application Data, Application Data, Application Data"
"1241","6.641847","192.168.0.92","18.165.77.79","TCP","66","63409  >  443 [ACK] Seq=1694 Ack=218110 Win=3132 Len=0 TSval=1024280603 TSecr=3519398275"
"1242","6.642310","192.168.0.92","18.165.77.79","TCP","66","[TCP Window Update] 63409  >  443 [ACK] Seq=1694 Ack=218110 Win=3788 Len=0 TSval=1024280603 TSecr=3519398275"
"1243","6.658903","192.168.0.92","18.165.77.79","TLSv1.2","577","Application Data"
"1251","6.688064","192.168.0.92","18.165.77.79","TLSv1.2","201","Application Data"
"1253","6.699282","18.165.77.79","192.168.0.92","TLSv1.2","1086","Application Data"
"1254","6.699308","18.165.77.79","192.168.0.92","TLSv1.2","97","Application Data"
"1256","6.699383","192.168.0.92","18.165.77.79","TCP","66","63409  >  443 [ACK] Seq=2340 Ack=219130 Win=3772 Len=0 TSval=1024280661 TSecr=3519398333"
"1258","6.699454","192.168.0.92","18.165.77.79","TCP","66","63409  >  443 [ACK] Seq=2340 Ack=219161 Win=3771 Len=0 TSval=1024280661 TSecr=3519398333"
"1382","6.752323","18.165.77.79","192.168.0.92","TCP","66","443  >  63409 [ACK] Seq=219161 Ack=2340 Win=288 Len=0 TSval=3519398383 TSecr=1024280650"
"1383","6.752323","18.165.77.79","192.168.0.92","TCP","1494","443  >  63409 [ACK] Seq=219161 Ack=2340 Win=288 Len=1428 TSval=3519398384 TSecr=1024280650 [TCP segment of a reassembled PDU]"
"1384","6.752324","18.165.77.79","192.168.0.92","TCP","1494","443  >  63409 [ACK] Seq=220589 Ack=2340 Win=288 Len=1428 TSval=3519398384 TSecr=1024280650 [TCP segment of a reassembled PDU]"
"1388","6.752502","192.168.0.92","18.165.77.79","TCP","66","63409  >  443 [ACK] Seq=2340 Ack=222017 Win=3743 Len=0 TSval=1024280714 TSecr=3519398384"
"1390","6.752813","192.168.0.92","18.165.77.79","TCP","66","[TCP Window Update] 63409  >  443 [ACK] Seq=2340 Ack=222017 Win=3788 Len=0 TSval=1024280714 TSecr=3519398384"
"1391","6.755749","18.165.77.79","192.168.0.92","TCP","1494","443  >  63409 [ACK] Seq=222017 Ack=2340 Win=288 Len=1428 TSval=3519398384 TSecr=1024280650 [TCP segment of a reassembled PDU]"
"1392","6.755751","18.165.77.79","192.168.0.92","TCP","1494","443  >  63409 [ACK] Seq=223445 Ack=2340 Win=288 Len=1428 TSval=3519398384 TSecr=1024280650 [TCP segment of a reassembled PDU]"
"1393","6.755751","18.165.77.79","192.168.0.92","TCP","1494","443  >  63409 [ACK] Seq=224873 Ack=2340 Win=288 Len=1428 TSval=3519398384 TSecr=1024280650 [TCP segment of a reassembled PDU]"
"1394","6.755752","18.165.77.79","192.168.0.92","TCP","1494","443  >  63409 [ACK] Seq=226301 Ack=2340 Win=288 Len=1428 TSval=3519398384 TSecr=1024280650 [TCP segment of a reassembled PDU]"
"1395","6.755753","18.165.77.79","192.168.0.92","TLSv1.2","286","Application Data"
"1396","6.755756","18.165.77.79","192.168.0.92","TCP","1494","443  >  63409 [ACK] Seq=227949 Ack=2340 Win=288 Len=1428 TSval=3519398384 TSecr=1024280650 [TCP segment of a reassembled PDU]"
"1397","6.755757","18.165.77.79","192.168.0.92","TLSv1.2","112","Application Data"
"1398","6.755758","18.165.77.79","192.168.0.92","TCP","1494","443  >  63409 [ACK] Seq=229423 Ack=2340 Win=288 Len=1428 TSval=3519398386 TSecr=1024280650 [TCP segment of a reassembled PDU]"
"1399","6.755758","18.165.77.79","192.168.0.92","TCP","1494","443  >  63409 [ACK] Seq=230851 Ack=2340 Win=288 Len=1428 TSval=3519398386 TSecr=1024280650 [TCP segment of a reassembled PDU]"
"1400","6.755759","18.165.77.79","192.168.0.92","TCP","1494","443  >  63409 [ACK] Seq=232279 Ack=2340 Win=288 Len=1428 TSval=3519398386 TSecr=1024280650 [TCP segment of a reassembled PDU]"
"1401","6.755760","18.165.77.79","192.168.0.92","TCP","1494","443  >  63409 [ACK] Seq=233707 Ack=2340 Win=288 Len=1428 TSval=3519398386 TSecr=1024280650 [TCP segment of a reassembled PDU]"
"1402","6.755761","18.165.77.79","192.168.0.92","TCP","1494","443  >  63409 [ACK] Seq=235135 Ack=2340 Win=288 Len=1428 TSval=3519398386 TSecr=1024280650 [TCP segment of a reassembled PDU]"
"1403","6.755762","18.165.77.79","192.168.0.92","TCP","1494","443  >  63409 [ACK] Seq=236563 Ack=2340 Win=288 Len=1428 TSval=3519398386 TSecr=1024280650 [TCP segment of a reassembled PDU]"
"1404","6.755762","18.165.77.79","192.168.0.92","TCP","1494","443  >  63409 [PSH, ACK] Seq=237991 Ack=2340 Win=288 Len=1428 TSval=3519398386 TSecr=1024280650 [TCP segment of a reassembled PDU]"
"1429","6.755790","18.165.77.79","192.168.0.92","TCP","1494","443  >  63409 [ACK] Seq=239419 Ack=2340 Win=288 Len=1428 TSval=3519398386 TSecr=1024280650 [TCP segment of a reassembled PDU]"
"1430","6.755791","18.165.77.79","192.168.0.92","TCP","1494","443  >  63409 [ACK] Seq=240847 Ack=2340 Win=288 Len=1428 TSval=3519398386 TSecr=1024280650 [TCP segment of a reassembled PDU]"
"1431","6.755792","18.165.77.79","192.168.0.92","TCP","1494","443  >  63409 [ACK] Seq=242275 Ack=2340 Win=288 Len=1428 TSval=3519398386 TSecr=1024280650 [TCP segment of a reassembled PDU]"
"1432","6.755793","18.165.77.79","192.168.0.92","TCP","1494","443  >  63409 [ACK] Seq=243703 Ack=2340 Win=288 Len=1428 TSval=3519398386 TSecr=1024280650 [TCP segment of a reassembled PDU]"
"1433","6.755794","18.165.77.79","192.168.0.92","TLSv1.2","764","Application Data"
"1478","6.755831","18.165.77.79","192.168.0.92","TCP","1494","443  >  63409 [ACK] Seq=245829 Ack=2340 Win=288 Len=1428 TSval=3519398387 TSecr=1024280650 [TCP segment of a reassembled PDU]"
"1479","6.755832","18.165.77.79","192.168.0.92","TLSv1.2","392","Application Data"
"1504","6.756235","18.165.77.79","192.168.0.92","TCP","1494","443  >  63409 [ACK] Seq=247583 Ack=2340 Win=288 Len=1428 TSval=3519398387 TSecr=1024280650 [TCP segment of a reassembled PDU]"
"1505","6.756236","18.165.77.79","192.168.0.92","TCP","1494","443  >  63409 [ACK] Seq=249011 Ack=2340 Win=288 Len=1428 TSval=3519398387 TSecr=1024280650 [TCP segment of a reassembled PDU]"
"1506","6.756237","18.165.77.79","192.168.0.92","TCP","1494","443  >  63409 [ACK] Seq=250439 Ack=2340 Win=288 Len=1428 TSval=3519398387 TSecr=1024280650 [TCP segment of a reassembled PDU]"
"1507","6.756238","18.165.77.79","192.168.0.92","TCP","1494","443  >  63409 [ACK] Seq=251867 Ack=2340 Win=288 Len=1428 TSval=3519398387 TSecr=1024280650 [TCP segment of a reassembled PDU]"
"1508","6.756239","18.165.77.79","192.168.0.92","TLSv1.2","864","Application Data"
"1511","6.756242","18.165.77.79","192.168.0.92","TCP","1494","443  >  63409 [ACK] Seq=254093 Ack=2340 Win=288 Len=1428 TSval=3519398387 TSecr=1024280650 [TCP segment of a reassembled PDU]"
"1512","6.756242","18.165.77.79","192.168.0.92","TCP","1494","443  >  63409 [ACK] Seq=255521 Ack=2340 Win=288 Len=1428 TSval=3519398387 TSecr=1024280650 [TCP segment of a reassembled PDU]"
"1513","6.756243","18.165.77.79","192.168.0.92","TLSv1.2","585","Application Data"
"1514","6.756244","18.165.77.79","192.168.0.92","TCP","1494","443  >  63409 [ACK] Seq=257468 Ack=2340 Win=288 Len=1428 TSval=3519398388 TSecr=1024280650 [TCP segment of a reassembled PDU]"
"1515","6.756345","192.168.0.92","18.165.77.79","TCP","66","63409  >  443 [ACK] Seq=2340 Ack=247583 Win=3788 Len=0 TSval=1024280718 TSecr=3519398387"
"1517","6.756376","18.165.77.79","192.168.0.92","TCP","1494","443  >  63409 [ACK] Seq=258896 Ack=2340 Win=288 Len=1428 TSval=3519398388 TSecr=1024280650 [TCP segment of a reassembled PDU]"
"1518","6.756377","18.165.77.79","192.168.0.92","TLSv1.2","314","Application Data, Application Data"
"1520","6.760044","192.168.0.92","18.165.77.79","TCP","66","63409  >  443 [ACK] Seq=2340 Ack=260572 Win=3788 Len=0 TSval=1024280722 TSecr=3519398388"
"1521","6.771619","192.168.0.92","18.165.77.79","TLSv1.2","201","Application Data"
"1523","6.792641","18.165.77.79","192.168.0.92","TCP","66","443  >  63409 [ACK] Seq=260572 Ack=2475 Win=293 Len=0 TSval=3519398426 TSecr=1024280733"
"1524","6.827416","192.168.0.92","18.165.77.79","TLSv1.2","199","Application Data"
"1525","6.832226","18.165.77.79","192.168.0.92","TLSv1.2","1435","Application Data"
"1526","6.832227","18.165.77.79","192.168.0.92","TCP","1494","443  >  63409 [ACK] Seq=261941 Ack=2475 Win=293 Len=1428 TSval=3519398466 TSecr=1024280733 [TCP segment of a reassembled PDU]"
"1527","6.832400","192.168.0.92","18.165.77.79","TCP","66","63409  >  443 [ACK] Seq=2608 Ack=263369 Win=3788 Len=0 TSval=1024280794 TSecr=3519398466"
"1528","6.836082","18.165.77.79","192.168.0.92","TCP","1494","443  >  63409 [ACK] Seq=263369 Ack=2475 Win=293 Len=1428 TSval=3519398466 TSecr=1024280733 [TCP segment of a reassembled PDU]"
"1529","6.836084","18.165.77.79","192.168.0.92","TCP","1494","443  >  63409 [ACK] Seq=264797 Ack=2475 Win=293 Len=1428 TSval=3519398466 TSecr=1024280733 [TCP segment of a reassembled PDU]"
"1530","6.836085","18.165.77.79","192.168.0.92","TCP","1494","443  >  63409 [ACK] Seq=266225 Ack=2475 Win=293 Len=1428 TSval=3519398466 TSecr=1024280733 [TCP segment of a reassembled PDU]"
"1531","6.836085","18.165.77.79","192.168.0.92","TCP","1494","443  >  63409 [ACK] Seq=267653 Ack=2475 Win=293 Len=1428 TSval=3519398466 TSecr=1024280733 [TCP segment of a reassembled PDU]"
"1532","6.836086","18.165.77.79","192.168.0.92","TLSv1.2","320","Application Data"
"1533","6.836087","18.165.77.79","192.168.0.92","TCP","1494","443  >  63409 [ACK] Seq=269335 Ack=2475 Win=293 Len=1428 TSval=3519398467 TSecr=1024280733 [TCP segment of a reassembled PDU]"
"1534","6.836088","18.165.77.79","192.168.0.92","TCP","1494","443  >  63409 [ACK] Seq=270763 Ack=2475 Win=293 Len=1428 TSval=3519398467 TSecr=1024280733 [TCP segment of a reassembled PDU]"
"1535","6.836089","18.165.77.79","192.168.0.92","TCP","1494","443  >  63409 [ACK] Seq=272191 Ack=2475 Win=293 Len=1428 TSval=3519398467 TSecr=1024280733 [TCP segment of a reassembled PDU]"
"1536","6.836090","18.165.77.79","192.168.0.92","TCP","1494","443  >  63409 [ACK] Seq=273619 Ack=2475 Win=293 Len=1428 TSval=3519398467 TSecr=1024280733 [TCP segment of a reassembled PDU]"
"1537","6.836091","18.165.77.79","192.168.0.92","TCP","1494","443  >  63409 [ACK] Seq=275047 Ack=2475 Win=293 Len=1428 TSval=3519398467 TSecr=1024280733 [TCP segment of a reassembled PDU]"
"1538","6.836091","18.165.77.79","192.168.0.92","TCP","1494","443  >  63409 [ACK] Seq=276475 Ack=2475 Win=293 Len=1428 TSval=3519398467 TSecr=1024280733 [TCP segment of a reassembled PDU]"
"1539","6.836092","18.165.77.79","192.168.0.92","TCP","1494","443  >  63409 [PSH, ACK] Seq=277903 Ack=2475 Win=293 Len=1428 TSval=3519398467 TSecr=1024280733 [TCP segment of a reassembled PDU]"
"1540","6.836094","18.165.77.79","192.168.0.92","TCP","1494","443  >  63409 [ACK] Seq=279331 Ack=2475 Win=293 Len=1428 TSval=3519398468 TSecr=1024280733 [TCP segment of a reassembled PDU]"
"1541","6.836094","18.165.77.79","192.168.0.92","TCP","1494","443  >  63409 [ACK] Seq=280759 Ack=2475 Win=293 Len=1428 TSval=3519398468 TSecr=1024280733 [TCP segment of a reassembled PDU]"
"1542","6.836095","18.165.77.79","192.168.0.92","TLSv1.2","515","Application Data"
"1543","6.836096","18.165.77.79","192.168.0.92","TCP","1494","443  >  63409 [ACK] Seq=282636 Ack=2475 Win=293 Len=1428 TSval=3519398468 TSecr=1024280733 [TCP segment of a reassembled PDU]"
"1544","6.836261","192.168.0.92","18.165.77.79","TCP","66","63409  >  443 [ACK] Seq=2608 Ack=284064 Win=3788 Len=0 TSval=1024280798 TSecr=3519398467"
"1545","6.838393","18.165.77.79","192.168.0.92","TCP","1494","443  >  63409 [ACK] Seq=284064 Ack=2475 Win=293 Len=1428 TSval=3519398468 TSecr=1024280733 [TCP segment of a reassembled PDU]"
"1546","6.838396","18.165.77.79","192.168.0.92","TLSv1.2","433","Application Data"
"1547","6.838397","18.165.77.79","192.168.0.92","TCP","1494","443  >  63409 [ACK] Seq=285859 Ack=2475 Win=293 Len=1428 TSval=3519398468 TSecr=1024280733 [TCP segment of a reassembled PDU]"
"1548","6.838399","18.165.77.79","192.168.0.92","TCP","1494","443  >  63409 [ACK] Seq=287287 Ack=2475 Win=293 Len=1428 TSval=3519398468 TSecr=1024280733 [TCP segment of a reassembled PDU]"
"1549","6.838401","18.165.77.79","192.168.0.92","TCP","1494","443  >  63409 [ACK] Seq=288715 Ack=2475 Win=293 Len=1428 TSval=3519398468 TSecr=1024280733 [TCP segment of a reassembled PDU]"
"1550","6.838402","18.165.77.79","192.168.0.92","TCP","1494","443  >  63409 [ACK] Seq=290143 Ack=2475 Win=293 Len=1428 TSval=3519398468 TSecr=1024280733 [TCP segment of a reassembled PDU]"
"1551","6.838403","18.165.77.79","192.168.0.92","TCP","1494","443  >  63409 [ACK] Seq=291571 Ack=2475 Win=293 Len=1428 TSval=3519398468 TSecr=1024280733 [TCP segment of a reassembled PDU]"
"1552","6.838406","18.165.77.79","192.168.0.92","TCP","1494","443  >  63409 [ACK] Seq=292999 Ack=2475 Win=293 Len=1428 TSval=3519398468 TSecr=1024280733 [TCP segment of a reassembled PDU]"
"1553","6.838407","18.165.77.79","192.168.0.92","TLSv1.2","1011","Application Data"
"1554","6.838408","18.165.77.79","192.168.0.92","TCP","1494","443  >  63409 [ACK] Seq=295372 Ack=2475 Win=293 Len=1428 TSval=3519398469 TSecr=1024280733 [TCP segment of a reassembled PDU]"
"1555","6.838409","18.165.77.79","192.168.0.92","TCP","1494","443  >  63409 [ACK] Seq=296800 Ack=2475 Win=293 Len=1428 TSval=3519398469 TSecr=1024280733 [TCP segment of a reassembled PDU]"
"1556","6.838585","192.168.0.92","18.165.77.79","TCP","66","63409  >  443 [ACK] Seq=2608 Ack=298228 Win=3788 Len=0 TSval=1024280800 TSecr=3519398469"
"1557","6.841386","18.165.77.79","192.168.0.92","TCP","1494","443  >  63409 [ACK] Seq=298228 Ack=2475 Win=293 Len=1428 TSval=3519398469 TSecr=1024280733 [TCP segment of a reassembled PDU]"
"1558","6.841388","18.165.77.79","192.168.0.92","TLSv1.2","530","Application Data"
"1559","6.841389","18.165.77.79","192.168.0.92","TCP","1494","443  >  63409 [ACK] Seq=300120 Ack=2475 Win=293 Len=1428 TSval=3519398470 TSecr=1024280733 [TCP segment of a reassembled PDU]"
"1560","6.841390","18.165.77.79","192.168.0.92","TLSv1.2","1218","Application Data, Application Data"
"1561","6.841575","192.168.0.92","18.165.77.79","TCP","66","63409  >  443 [ACK] Seq=2608 Ack=302700 Win=3788 Len=0 TSval=1024280803 TSecr=3519398470"
"1562","6.848433","18.165.77.79","192.168.0.92","TCP","66","443  >  63409 [ACK] Seq=302700 Ack=2608 Win=297 Len=0 TSval=3519398482 TSecr=1024280789"
"1563","6.875629","192.168.0.92","18.165.77.79","TLSv1.2","201","Application Data"
"1565","6.892732","18.165.77.79","192.168.0.92","TLSv1.2","1391","Application Data"
"1566","6.892846","192.168.0.92","18.165.77.79","TCP","66","63409  >  443 [ACK] Seq=2743 Ack=304025 Win=3788 Len=0 TSval=1024280854 TSecr=3519398522"
"1567","6.895837","18.165.77.79","192.168.0.92","TLSv1.2","97","Application Data"
"1568","6.895838","18.165.77.79","192.168.0.92","TCP","66","443  >  63409 [ACK] Seq=304056 Ack=2743 Win=302 Len=0 TSval=3519398530 TSecr=1024280837"
"1569","6.895953","192.168.0.92","18.165.77.79","TCP","66","63409  >  443 [ACK] Seq=2743 Ack=304056 Win=3788 Len=0 TSval=1024280858 TSecr=3519398523"
"1572","6.934672","18.165.77.79","192.168.0.92","TCP","1494","443  >  63409 [ACK] Seq=304056 Ack=2743 Win=302 Len=1428 TSval=3519398568 TSecr=1024280858 [TCP segment of a reassembled PDU]"
"1573","6.934674","18.165.77.79","192.168.0.92","TCP","1494","443  >  63409 [ACK] Seq=305484 Ack=2743 Win=302 Len=1428 TSval=3519398568 TSecr=1024280858 [TCP segment of a reassembled PDU]"
"1574","6.934675","18.165.77.79","192.168.0.92","TCP","1494","443  >  63409 [ACK] Seq=306912 Ack=2743 Win=302 Len=1428 TSval=3519398568 TSecr=1024280858 [TCP segment of a reassembled PDU]"
"1575","6.936931","18.165.77.79","192.168.0.92","TLSv1.2","802","Application Data"
"1576","6.936933","18.165.77.79","192.168.0.92","TCP","1494","443  >  63409 [ACK] Seq=309076 Ack=2743 Win=302 Len=1428 TSval=3519398568 TSecr=1024280858 [TCP segment of a reassembled PDU]"
"1577","6.936934","18.165.77.79","192.168.0.92","TLSv1.2","112","Application Data"
"1578","6.936935","18.165.77.79","192.168.0.92","TCP","1494","443  >  63409 [ACK] Seq=310550 Ack=2743 Win=302 Len=1428 TSval=3519398568 TSecr=1024280858 [TCP segment of a reassembled PDU]"
"1579","6.936936","18.165.77.79","192.168.0.92","TLSv1.2","938","Application Data"
"1580","6.936937","18.165.77.79","192.168.0.92","TCP","1494","443  >  63409 [ACK] Seq=312850 Ack=2743 Win=302 Len=1428 TSval=3519398569 TSecr=1024280858 [TCP segment of a reassembled PDU]"
"1581","6.936938","18.165.77.79","192.168.0.92","TLSv1.2","112","Application Data"
"1582","6.936939","18.165.77.79","192.168.0.92","TCP","1494","443  >  63409 [ACK] Seq=314324 Ack=2743 Win=302 Len=1428 TSval=3519398569 TSecr=1024280858 [TCP segment of a reassembled PDU]"
"1583","6.936940","18.165.77.79","192.168.0.92","TLSv1.2","675","Application Data"
"1584","6.936941","18.165.77.79","192.168.0.92","TCP","1494","443  >  63409 [ACK] Seq=316361 Ack=2743 Win=302 Len=1428 TSval=3519398569 TSecr=1024280858 [TCP segment of a reassembled PDU]"
"1585","6.936942","18.165.77.79","192.168.0.92","TCP","1494","443  >  63409 [ACK] Seq=317789 Ack=2743 Win=302 Len=1428 TSval=3519398569 TSecr=1024280858 [TCP segment of a reassembled PDU]"
"1586","6.936944","18.165.77.79","192.168.0.92","TLSv1.2","873","Application Data"
"1587","6.936945","18.165.77.79","192.168.0.92","TCP","1494","443  >  63409 [ACK] Seq=320024 Ack=2743 Win=302 Len=1428 TSval=3519398569 TSecr=1024280858 [TCP segment of a reassembled PDU]"
"1588","6.936947","18.165.77.79","192.168.0.92","TCP","1494","443  >  63409 [ACK] Seq=321452 Ack=2743 Win=302 Len=1428 TSval=3519398569 TSecr=1024280858 [TCP segment of a reassembled PDU]"
"1589","6.936948","18.165.77.79","192.168.0.92","TLSv1.2","368","Application Data"
"1590","6.936949","18.165.77.79","192.168.0.92","TCP","1494","443  >  63409 [ACK] Seq=323182 Ack=2743 Win=302 Len=1428 TSval=3519398570 TSecr=1024280858 [TCP segment of a reassembled PDU]"
"1591","6.936950","18.165.77.79","192.168.0.92","TLSv1.2","1494","Application Data"
"1592","6.936952","18.165.77.79","192.168.0.92","TLSv1.2","484","Application Data"
"1593","6.936953","18.165.77.79","192.168.0.92","TCP","1494","443  >  63409 [ACK] Seq=326456 Ack=2743 Win=302 Len=1428 TSval=3519398570 TSecr=1024280858 [TCP segment of a reassembled PDU]"
"1594","6.936954","18.165.77.79","192.168.0.92","TLSv1.2","1494","Application Data"
"1595","6.936956","18.165.77.79","192.168.0.92","TLSv1.2","267","Application Data"
"1596","6.938340","192.168.0.92","18.165.77.79","TCP","66","63409  >  443 [ACK] Seq=2743 Ack=329513 Win=3788 Len=0 TSval=1024280900 TSecr=3519398568"
"1597","6.940971","18.165.77.79","192.168.0.92","TCP","1494","443  >  63409 [ACK] Seq=329513 Ack=2743 Win=302 Len=1428 TSval=3519398570 TSecr=1024280858 [TCP segment of a reassembled PDU]"
"1598","6.940973","18.165.77.79","192.168.0.92","TLSv1.2","112","Application Data"
"1599","6.940973","18.165.77.79","192.168.0.92","TCP","1494","443  >  63409 [ACK] Seq=330987 Ack=2743 Win=302 Len=1428 TSval=3519398570 TSecr=1024280858 [TCP segment of a reassembled PDU]"
"1600","6.940974","18.165.77.79","192.168.0.92","TLSv1.2","370","Application Data"
"1601","6.940975","18.165.77.79","192.168.0.92","TCP","1494","443  >  63409 [ACK] Seq=332719 Ack=2743 Win=302 Len=1428 TSval=3519398571 TSecr=1024280858 [TCP segment of a reassembled PDU]"
"1602","6.940976","18.165.77.79","192.168.0.92","TLSv1.2","112","Application Data"
"1603","6.940976","18.165.77.79","192.168.0.92","TCP","1494","443  >  63409 [ACK] Seq=334193 Ack=2743 Win=302 Len=1428 TSval=3519398571 TSecr=1024280858 [TCP segment of a reassembled PDU]"
"1604","6.940977","18.165.77.79","192.168.0.92","TLSv1.2","669","Application Data"
"1605","6.940978","18.165.77.79","192.168.0.92","TCP","1494","443  >  63409 [ACK] Seq=336224 Ack=2743 Win=302 Len=1428 TSval=3519398571 TSecr=1024280858 [TCP segment of a reassembled PDU]"
"1606","6.940979","18.165.77.79","192.168.0.92","TLSv1.2","112","Application Data"
"1607","6.940980","18.165.77.79","192.168.0.92","TCP","1494","443  >  63409 [ACK] Seq=337698 Ack=2743 Win=302 Len=1428 TSval=3519398571 TSecr=1024280858 [TCP segment of a reassembled PDU]"
"1608","6.940981","18.165.77.79","192.168.0.92","TLSv1.2","224","Application Data"
"1609","6.940981","18.165.77.79","192.168.0.92","TCP","1494","443  >  63409 [ACK] Seq=339284 Ack=2743 Win=302 Len=1428 TSval=3519398571 TSecr=1024280858 [TCP segment of a reassembled PDU]"
"1610","6.941378","192.168.0.92","18.165.77.79","TCP","66","63409  >  443 [ACK] Seq=2743 Ack=340712 Win=3788 Len=0 TSval=1024280903 TSecr=3519398571"
"1611","6.943035","18.165.77.79","192.168.0.92","TCP","1494","443  >  63409 [ACK] Seq=340712 Ack=2743 Win=302 Len=1428 TSval=3519398571 TSecr=1024280858 [TCP segment of a reassembled PDU]"
"1612","6.943039","18.165.77.79","192.168.0.92","TLSv1.2","581","Application Data"
"1613","6.943041","18.165.77.79","192.168.0.92","TCP","1494","443  >  63409 [ACK] Seq=342655 Ack=2743 Win=302 Len=1428 TSval=3519398572 TSecr=1024280858 [TCP segment of a reassembled PDU]"
"1614","6.943043","18.165.77.79","192.168.0.92","TCP","1494","443  >  63409 [ACK] Seq=344083 Ack=2743 Win=302 Len=1428 TSval=3519398572 TSecr=1024280858 [TCP segment of a reassembled PDU]"
"1615","6.943045","18.165.77.79","192.168.0.92","TLSv1.2","246","Application Data"
"1616","6.943046","18.165.77.79","192.168.0.92","TLSv1.2","97","Application Data"
"1617","6.943657","192.168.0.92","18.165.77.79","TCP","66","63409  >  443 [ACK] Seq=2743 Ack=345722 Win=3788 Len=0 TSval=1024280905 TSecr=3519398572"
"4246","9.801266","192.168.0.92","18.165.77.79","TLSv1.2","386","Application Data"
"4248","9.820795","18.165.77.79","192.168.0.92","TCP","66","443  >  63409 [ACK] Seq=345722 Ack=3063 Win=307 Len=0 TSval=3519401454 TSecr=1024283763"
"4252","9.833312","18.165.77.79","192.168.0.92","TLSv1.2","630","Application Data"
"4253","9.833313","18.165.77.79","192.168.0.92","TLSv1.2","97","Application Data"
"4254","9.833372","192.168.0.92","18.165.77.79","TCP","66","63409  >  443 [ACK] Seq=3063 Ack=346317 Win=3779 Len=0 TSval=1024283795 TSecr=3519401466"
"4425","9.932178","192.168.0.92","18.165.77.79","TLSv1.2","185","Application Data"
"4436","9.980575","18.165.77.79","192.168.0.92","TLSv1.2","911","Application Data"
"4437","9.980576","18.165.77.79","192.168.0.92","TLSv1.2","97","Application Data"
"4438","9.980680","192.168.0.92","18.165.77.79","TCP","66","63409  >  443 [ACK] Seq=3182 Ack=347193 Win=3774 Len=0 TSval=1024283942 TSecr=3519401613"
"4439","9.995827","192.168.0.92","18.165.77.79","TLSv1.2","185","Application Data"
"4440","10.065603","18.165.77.79","192.168.0.92","TCP","66","443  >  63409 [ACK] Seq=347193 Ack=3301 Win=307 Len=0 TSval=3519401699 TSecr=1024283958"
"4441","10.072098","18.165.77.79","192.168.0.92","TLSv1.2","1276","Application Data"
"4442","10.072184","192.168.0.92","18.165.77.79","TCP","66","63409  >  443 [ACK] Seq=3301 Ack=348403 Win=3769 Len=0 TSval=1024284034 TSecr=3519401704"
"4443","10.073982","18.165.77.79","192.168.0.92","TCP","1494","443  >  63409 [ACK] Seq=348403 Ack=3301 Win=307 Len=1428 TSval=3519401705 TSecr=1024283958 [TCP segment of a reassembled PDU]"
"4444","10.073983","18.165.77.79","192.168.0.92","TCP","1494","443  >  63409 [ACK] Seq=349831 Ack=3301 Win=307 Len=1428 TSval=3519401705 TSecr=1024283958 [TCP segment of a reassembled PDU]"
"4445","10.073984","18.165.77.79","192.168.0.92","TCP","1494","443  >  63409 [ACK] Seq=351259 Ack=3301 Win=307 Len=1428 TSval=3519401705 TSecr=1024283958 [TCP segment of a reassembled PDU]"
"4446","10.073985","18.165.77.79","192.168.0.92","TLSv1.2","720","Application Data"
"4447","10.074038","192.168.0.92","18.165.77.79","TCP","66","63409  >  443 [ACK] Seq=3301 Ack=353341 Win=3711 Len=0 TSval=1024284036 TSecr=3519401705"
"4448","10.074096","192.168.0.92","18.165.77.79","TCP","66","[TCP Window Update] 63409  >  443 [ACK] Seq=3301 Ack=353341 Win=3788 Len=0 TSval=1024284036 TSecr=3519401705"
"4449","10.079600","18.165.77.79","192.168.0.92","TCP","1494","443  >  63409 [ACK] Seq=353341 Ack=3301 Win=307 Len=1428 TSval=3519401712 TSecr=1024283958 [TCP segment of a reassembled PDU]"
"4450","10.079683","192.168.0.92","18.165.77.79","TCP","66","63409  >  443 [ACK] Seq=3301 Ack=354769 Win=3766 Len=0 TSval=1024284041 TSecr=3519401712"
"4451","10.084025","18.165.77.79","192.168.0.92","TCP","1494","443  >  63409 [ACK] Seq=354769 Ack=3301 Win=307 Len=1428 TSval=3519401712 TSecr=1024283958 [TCP segment of a reassembled PDU]"
"4452","10.084026","18.165.77.79","192.168.0.92","TCP","1494","443  >  63409 [ACK] Seq=356197 Ack=3301 Win=307 Len=1428 TSval=3519401712 TSecr=1024283958 [TCP segment of a reassembled PDU]"
"4453","10.084027","18.165.77.79","192.168.0.92","TCP","1494","443  >  63409 [ACK] Seq=357625 Ack=3301 Win=307 Len=1428 TSval=3519401712 TSecr=1024283958 [TCP segment of a reassembled PDU]"
"4454","10.084028","18.165.77.79","192.168.0.92","TCP","1494","443  >  63409 [ACK] Seq=359053 Ack=3301 Win=307 Len=1428 TSval=3519401712 TSecr=1024283958 [TCP segment of a reassembled PDU]"
"4455","10.084029","18.165.77.79","192.168.0.92","TLSv1.2","1209","Application Data"
"4456","10.084030","18.165.77.79","192.168.0.92","TCP","1494","443  >  63409 [ACK] Seq=361624 Ack=3301 Win=307 Len=1428 TSval=3519401713 TSecr=1024283958 [TCP segment of a reassembled PDU]"
"4457","10.084031","18.165.77.79","192.168.0.92","TCP","1494","443  >  63409 [ACK] Seq=363052 Ack=3301 Win=307 Len=1428 TSval=3519401713 TSecr=1024283958 [TCP segment of a reassembled PDU]"
"4458","10.084032","18.165.77.79","192.168.0.92","TCP","1494","443  >  63409 [ACK] Seq=364480 Ack=3301 Win=307 Len=1428 TSval=3519401713 TSecr=1024283958 [TCP segment of a reassembled PDU]"
"4459","10.084033","18.165.77.79","192.168.0.92","TCP","1494","443  >  63409 [ACK] Seq=365908 Ack=3301 Win=307 Len=1428 TSval=3519401713 TSecr=1024283958 [TCP segment of a reassembled PDU]"
"4460","10.084034","18.165.77.79","192.168.0.92","TCP","1494","443  >  63409 [ACK] Seq=367336 Ack=3301 Win=307 Len=1428 TSval=3519401713 TSecr=1024283958 [TCP segment of a reassembled PDU]"
"4461","10.084034","18.165.77.79","192.168.0.92","TCP","1494","443  >  63409 [ACK] Seq=368764 Ack=3301 Win=307 Len=1428 TSval=3519401713 TSecr=1024283958 [TCP segment of a reassembled PDU]"
"4462","10.084035","18.165.77.79","192.168.0.92","TLSv1.2","1100","Application Data"
"4463","10.084036","18.165.77.79","192.168.0.92","TLSv1.2","551","Application Data"
"4464","10.084037","18.165.77.79","192.168.0.92","TLSv1.2","562","Application Data"
"4465","10.084037","18.165.77.79","192.168.0.92","TLSv1.2","1345","Application Data"
"4466","10.084139","192.168.0.92","18.165.77.79","TCP","66","63409  >  443 [ACK] Seq=3301 Ack=370192 Win=3547 Len=0 TSval=1024284046 TSecr=3519401713"
"4467","10.084219","192.168.0.92","18.165.77.79","TCP","66","63409  >  443 [ACK] Seq=3301 Ack=373486 Win=3495 Len=0 TSval=1024284046 TSecr=3519401715"
"4468","10.084270","192.168.0.92","18.165.77.79","TCP","66","[TCP Window Update] 63409  >  443 [ACK] Seq=3301 Ack=373486 Win=3788 Len=0 TSval=1024284046 TSecr=3519401715"
"4473","10.128047","18.165.77.79","192.168.0.92","TCP","1494","443  >  63409 [ACK] Seq=373486 Ack=3301 Win=307 Len=1428 TSval=3519401759 TSecr=1024284046 [TCP segment of a reassembled PDU]"
"4474","10.128048","18.165.77.79","192.168.0.92","TCP","1494","443  >  63409 [ACK] Seq=374914 Ack=3301 Win=307 Len=1428 TSval=3519401759 TSecr=1024284046 [TCP segment of a reassembled PDU]"
"4475","10.128049","18.165.77.79","192.168.0.92","TCP","1494","443  >  63409 [ACK] Seq=376342 Ack=3301 Win=307 Len=1428 TSval=3519401759 TSecr=1024284046 [TCP segment of a reassembled PDU]"
"4476","10.128050","18.165.77.79","192.168.0.92","TCP","1494","443  >  63409 [ACK] Seq=377770 Ack=3301 Win=307 Len=1428 TSval=3519401759 TSecr=1024284046 [TCP segment of a reassembled PDU]"
"4477","10.128051","18.165.77.79","192.168.0.92","TCP","1494","443  >  63409 [ACK] Seq=379198 Ack=3301 Win=307 Len=1428 TSval=3519401759 TSecr=1024284046 [TCP segment of a reassembled PDU]"
"4478","10.128051","18.165.77.79","192.168.0.92","TCP","1494","443  >  63409 [ACK] Seq=380626 Ack=3301 Win=307 Len=1428 TSval=3519401759 TSecr=1024284046 [TCP segment of a reassembled PDU]"
"4479","10.128052","18.165.77.79","192.168.0.92","TCP","1494","443  >  63409 [PSH, ACK] Seq=382054 Ack=3301 Win=307 Len=1428 TSval=3519401759 TSecr=1024284046 [TCP segment of a reassembled PDU]"
"4480","10.128053","18.165.77.79","192.168.0.92","TCP","1494","443  >  63409 [ACK] Seq=383482 Ack=3301 Win=307 Len=1428 TSval=3519401760 TSecr=1024284046 [TCP segment of a reassembled PDU]"
"4481","10.128054","18.165.77.79","192.168.0.92","TCP","1494","443  >  63409 [ACK] Seq=384910 Ack=3301 Win=307 Len=1428 TSval=3519401760 TSecr=1024284046 [TCP segment of a reassembled PDU]"
"4482","10.128055","18.165.77.79","192.168.0.92","TCP","1494","443  >  63409 [ACK] Seq=386338 Ack=3301 Win=307 Len=1428 TSval=3519401760 TSecr=1024284046 [TCP segment of a reassembled PDU]"
"4483","10.128056","18.165.77.79","192.168.0.92","TCP","1494","443  >  63409 [ACK] Seq=387766 Ack=3301 Win=307 Len=1428 TSval=3519401760 TSecr=1024284046 [TCP segment of a reassembled PDU]"
"4484","10.128056","18.165.77.79","192.168.0.92","TLSv1.2","754","Application Data"
"4485","10.128057","18.165.77.79","192.168.0.92","TCP","1494","443  >  63409 [ACK] Seq=389882 Ack=3301 Win=307 Len=1428 TSval=3519401760 TSecr=1024284046 [TCP segment of a reassembled PDU]"
"4486","10.128058","18.165.77.79","192.168.0.92","TCP","1494","443  >  63409 [ACK] Seq=391310 Ack=3301 Win=307 Len=1428 TSval=3519401760 TSecr=1024284046 [TCP segment of a reassembled PDU]"
"4487","10.128058","18.165.77.79","192.168.0.92","TCP","1494","443  >  63409 [ACK] Seq=392738 Ack=3301 Win=307 Len=1428 TSval=3519401760 TSecr=1024284046 [TCP segment of a reassembled PDU]"
"4488","10.128059","18.165.77.79","192.168.0.92","TCP","1494","443  >  63409 [ACK] Seq=394166 Ack=3301 Win=307 Len=1428 TSval=3519401760 TSecr=1024284046 [TCP segment of a reassembled PDU]"
"4489","10.128060","18.165.77.79","192.168.0.92","TCP","1494","443  >  63409 [ACK] Seq=395594 Ack=3301 Win=307 Len=1428 TSval=3519401760 TSecr=1024284046 [TCP segment of a reassembled PDU]"
"4490","10.128061","18.165.77.79","192.168.0.92","TCP","1494","443  >  63409 [ACK] Seq=397022 Ack=3301 Win=307 Len=1428 TSval=3519401760 TSecr=1024284046 [TCP segment of a reassembled PDU]"
"4491","10.128062","18.165.77.79","192.168.0.92","TCP","1494","443  >  63409 [PSH, ACK] Seq=398450 Ack=3301 Win=307 Len=1428 TSval=3519401760 TSecr=1024284046 [TCP segment of a reassembled PDU]"
"4492","10.128062","18.165.77.79","192.168.0.92","TCP","1494","443  >  63409 [ACK] Seq=399878 Ack=3301 Win=307 Len=1428 TSval=3519401761 TSecr=1024284046 [TCP segment of a reassembled PDU]"
"4493","10.128063","18.165.77.79","192.168.0.92","TCP","1494","443  >  63409 [ACK] Seq=401306 Ack=3301 Win=307 Len=1428 TSval=3519401761 TSecr=1024284046 [TCP segment of a reassembled PDU]"
"4494","10.128064","18.165.77.79","192.168.0.92","TCP","1494","443  >  63409 [ACK] Seq=402734 Ack=3301 Win=307 Len=1428 TSval=3519401761 TSecr=1024284046 [TCP segment of a reassembled PDU]"
"4495","10.128065","18.165.77.79","192.168.0.92","TCP","1494","443  >  63409 [ACK] Seq=404162 Ack=3301 Win=307 Len=1428 TSval=3519401761 TSecr=1024284046 [TCP segment of a reassembled PDU]"
"4496","10.128066","18.165.77.79","192.168.0.92","TLSv1.2","764","Application Data"
"4497","10.128066","18.165.77.79","192.168.0.92","TCP","1494","443  >  63409 [ACK] Seq=406288 Ack=3301 Win=307 Len=1428 TSval=3519401762 TSecr=1024284046 [TCP segment of a reassembled PDU]"
"4498","10.128173","192.168.0.92","18.165.77.79","TCP","66","63409  >  443 [ACK] Seq=3301 Ack=389194 Win=3542 Len=0 TSval=1024284090 TSecr=3519401760"
"4499","10.128207","192.168.0.92","18.165.77.79","TCP","66","63409  >  443 [ACK] Seq=3301 Ack=404162 Win=3309 Len=0 TSval=1024284090 TSecr=3519401761"
"4500","10.128219","192.168.0.92","18.165.77.79","TCP","66","63409  >  443 [ACK] Seq=3301 Ack=407716 Win=3253 Len=0 TSval=1024284090 TSecr=3519401762"
"4501","10.128298","192.168.0.92","18.165.77.79","TCP","66","[TCP Window Update] 63409  >  443 [ACK] Seq=3301 Ack=407716 Win=3788 Len=0 TSval=1024284090 TSecr=3519401762"
"4502","10.136149","18.165.77.79","192.168.0.92","TCP","1494","443  >  63409 [ACK] Seq=407716 Ack=3301 Win=307 Len=1428 TSval=3519401762 TSecr=1024284046 [TCP segment of a reassembled PDU]"
"4503","10.136151","18.165.77.79","192.168.0.92","TCP","1494","443  >  63409 [ACK] Seq=409144 Ack=3301 Win=307 Len=1428 TSval=3519401762 TSecr=1024284046 [TCP segment of a reassembled PDU]"
"4504","10.136151","18.165.77.79","192.168.0.92","TCP","1494","443  >  63409 [ACK] Seq=410572 Ack=3301 Win=307 Len=1428 TSval=3519401762 TSecr=1024284046 [TCP segment of a reassembled PDU]"
"4505","10.136152","18.165.77.79","192.168.0.92","TCP","1494","443  >  63409 [ACK] Seq=412000 Ack=3301 Win=307 Len=1428 TSval=3519401762 TSecr=1024284046 [TCP segment of a reassembled PDU]"
"4506","10.136153","18.165.77.79","192.168.0.92","TCP","1494","443  >  63409 [ACK] Seq=413428 Ack=3301 Win=307 Len=1428 TSval=3519401762 TSecr=1024284046 [TCP segment of a reassembled PDU]"
"4507","10.136154","18.165.77.79","192.168.0.92","TCP","1494","443  >  63409 [PSH, ACK] Seq=414856 Ack=3301 Win=307 Len=1428 TSval=3519401762 TSecr=1024284046 [TCP segment of a reassembled PDU]"
"4508","10.136155","18.165.77.79","192.168.0.92","TLSv1.2","377","Application Data"
"4509","10.136238","192.168.0.92","18.165.77.79","TCP","66","63409  >  443 [ACK] Seq=3301 Ack=416595 Win=3649 Len=0 TSval=1024284098 TSecr=3519401763"
"4510","10.136345","192.168.0.92","18.165.77.79","TCP","66","[TCP Window Update] 63409  >  443 [ACK] Seq=3301 Ack=416595 Win=3788 Len=0 TSval=1024284098 TSecr=3519401763"
"4514","10.139491","18.165.77.79","192.168.0.92","TCP","1494","443  >  63409 [ACK] Seq=416595 Ack=3301 Win=307 Len=1428 TSval=3519401773 TSecr=1024284046 [TCP segment of a reassembled PDU]"
"4516","10.139525","192.168.0.92","18.165.77.79","TCP","66","63409  >  443 [ACK] Seq=3301 Ack=418023 Win=3766 Len=0 TSval=1024284101 TSecr=3519401773"
"4518","10.145052","18.165.77.79","192.168.0.92","TLSv1.2","1336","Application Data"
"4523","10.145057","18.165.77.79","192.168.0.92","TCP","1494","443  >  63409 [ACK] Seq=419293 Ack=3301 Win=307 Len=1428 TSval=3519401776 TSecr=1024284046 [TCP segment of a reassembled PDU]"
"4524","10.145058","18.165.77.79","192.168.0.92","TCP","1494","443  >  63409 [ACK] Seq=420721 Ack=3301 Win=307 Len=1428 TSval=3519401776 TSecr=1024284046 [TCP segment of a reassembled PDU]"
"4525","10.145058","18.165.77.79","192.168.0.92","TCP","1494","443  >  63409 [ACK] Seq=422149 Ack=3301 Win=307 Len=1428 TSval=3519401776 TSecr=1024284046 [TCP segment of a reassembled PDU]"
"4526","10.145059","18.165.77.79","192.168.0.92","TCP","1494","443  >  63409 [ACK] Seq=423577 Ack=3301 Win=307 Len=1428 TSval=3519401776 TSecr=1024284046 [TCP segment of a reassembled PDU]"
"4527","10.145060","18.165.77.79","192.168.0.92","TCP","1494","443  >  63409 [ACK] Seq=425005 Ack=3301 Win=307 Len=1428 TSval=3519401776 TSecr=1024284046 [TCP segment of a reassembled PDU]"
"4528","10.145061","18.165.77.79","192.168.0.92","TCP","1494","443  >  63409 [ACK] Seq=426433 Ack=3301 Win=307 Len=1428 TSval=3519401776 TSecr=1024284046 [TCP segment of a reassembled PDU]"
"4529","10.145061","18.165.77.79","192.168.0.92","TCP","1494","443  >  63409 [PSH, ACK] Seq=427861 Ack=3301 Win=307 Len=1428 TSval=3519401776 TSecr=1024284046 [TCP segment of a reassembled PDU]"
"4530","10.145062","18.165.77.79","192.168.0.92","TCP","1494","443  >  63409 [ACK] Seq=429289 Ack=3301 Win=307 Len=1428 TSval=3519401777 TSecr=1024284046 [TCP segment of a reassembled PDU]"
"4531","10.145063","18.165.77.79","192.168.0.92","TCP","1494","443  >  63409 [ACK] Seq=430717 Ack=3301 Win=307 Len=1428 TSval=3519401777 TSecr=1024284046 [TCP segment of a reassembled PDU]"
"4532","10.145064","18.165.77.79","192.168.0.92","TCP","1494","443  >  63409 [ACK] Seq=432145 Ack=3301 Win=307 Len=1428 TSval=3519401777 TSecr=1024284046 [TCP segment of a reassembled PDU]"
"4533","10.145064","18.165.77.79","192.168.0.92","TCP","1494","443  >  63409 [ACK] Seq=433573 Ack=3301 Win=307 Len=1428 TSval=3519401777 TSecr=1024284046 [TCP segment of a reassembled PDU]"
"4534","10.145065","18.165.77.79","192.168.0.92","TLSv1.2","764","Application Data"
"4535","10.145066","18.165.77.79","192.168.0.92","TLSv1.2","92","Application Data"
"4536","10.145066","18.165.77.79","192.168.0.92","TCP","1494","443  >  63409 [ACK] Seq=435725 Ack=3301 Win=307 Len=1428 TSval=3519401777 TSecr=1024284046 [TCP segment of a reassembled PDU]"
"4537","10.145067","18.165.77.79","192.168.0.92","TCP","1494","443  >  63409 [ACK] Seq=437153 Ack=3301 Win=307 Len=1428 TSval=3519401777 TSecr=1024284046 [TCP segment of a reassembled PDU]"
"4538","10.145068","18.165.77.79","192.168.0.92","TCP","1494","443  >  63409 [ACK] Seq=438581 Ack=3301 Win=307 Len=1428 TSval=3519401777 TSecr=1024284046 [TCP segment of a reassembled PDU]"
"4539","10.145069","18.165.77.79","192.168.0.92","TCP","1494","443  >  63409 [ACK] Seq=440009 Ack=3301 Win=307 Len=1428 TSval=3519401777 TSecr=1024284046 [TCP segment of a reassembled PDU]"
"4540","10.145069","18.165.77.79","192.168.0.92","TCP","1494","443  >  63409 [ACK] Seq=441437 Ack=3301 Win=307 Len=1428 TSval=3519401777 TSecr=1024284046 [TCP segment of a reassembled PDU]"
"4541","10.145070","18.165.77.79","192.168.0.92","TCP","1494","443  >  63409 [ACK] Seq=442865 Ack=3301 Win=307 Len=1428 TSval=3519401777 TSecr=1024284046 [TCP segment of a reassembled PDU]"
"4542","10.145071","18.165.77.79","192.168.0.92","TCP","1494","443  >  63409 [PSH, ACK] Seq=444293 Ack=3301 Win=307 Len=1428 TSval=3519401777 TSecr=1024284046 [TCP segment of a reassembled PDU]"
"4543","10.145176","192.168.0.92","18.165.77.79","TCP","66","63409  >  443 [ACK] Seq=3301 Ack=433573 Win=3545 Len=0 TSval=1024284107 TSecr=3519401777"
"4544","10.145212","192.168.0.92","18.165.77.79","TCP","66","63409  >  443 [ACK] Seq=3301 Ack=445721 Win=3355 Len=0 TSval=1024284107 TSecr=3519401777"
"4546","10.146071","18.165.77.79","192.168.0.92","TCP","1494","443  >  63409 [ACK] Seq=445721 Ack=3301 Win=307 Len=1428 TSval=3519401778 TSecr=1024284046 [TCP segment of a reassembled PDU]"
"4547","10.146100","192.168.0.92","18.165.77.79","TCP","66","63409  >  443 [ACK] Seq=3301 Ack=447149 Win=3333 Len=0 TSval=1024284107 TSecr=3519401778"
"4548","10.146363","192.168.0.92","18.165.77.79","TCP","66","[TCP Window Update] 63409  >  443 [ACK] Seq=3301 Ack=447149 Win=3788 Len=0 TSval=1024284108 TSecr=3519401778"
"4550","10.148419","18.165.77.79","192.168.0.92","TCP","1494","443  >  63409 [ACK] Seq=447149 Ack=3301 Win=307 Len=1428 TSval=3519401778 TSecr=1024284046 [TCP segment of a reassembled PDU]"
"4551","10.148421","18.165.77.79","192.168.0.92","TCP","1494","443  >  63409 [ACK] Seq=448577 Ack=3301 Win=307 Len=1428 TSval=3519401778 TSecr=1024284046 [TCP segment of a reassembled PDU]"
"4552","10.148422","18.165.77.79","192.168.0.92","TCP","1494","443  >  63409 [ACK] Seq=450005 Ack=3301 Win=307 Len=1428 TSval=3519401778 TSecr=1024284046 [TCP segment of a reassembled PDU]"
"4553","10.148437","18.165.77.79","192.168.0.92","TLSv1.2","764","Application Data"
"4554","10.148438","18.165.77.79","192.168.0.92","TCP","1494","443  >  63409 [ACK] Seq=452131 Ack=3301 Win=307 Len=1428 TSval=3519401779 TSecr=1024284046 [TCP segment of a reassembled PDU]"
"4555","10.148440","18.165.77.79","192.168.0.92","TCP","1494","443  >  63409 [ACK] Seq=453559 Ack=3301 Win=307 Len=1428 TSval=3519401779 TSecr=1024284046 [TCP segment of a reassembled PDU]"
"4556","10.148441","18.165.77.79","192.168.0.92","TCP","1494","443  >  63409 [ACK] Seq=454987 Ack=3301 Win=307 Len=1428 TSval=3519401779 TSecr=1024284046 [TCP segment of a reassembled PDU]"
"4557","10.148442","18.165.77.79","192.168.0.92","TLSv1.2","271","Application Data, Application Data"
"4558","10.148531","192.168.0.92","18.165.77.79","TCP","66","63409  >  443 [ACK] Seq=3301 Ack=456620 Win=3640 Len=0 TSval=1024284110 TSecr=3519401779"
"4559","10.149992","192.168.0.92","18.165.77.79","TCP","66","[TCP Window Update] 63409  >  443 [ACK] Seq=3301 Ack=456620 Win=3788 Len=0 TSval=1024284112 TSecr=3519401779"
"4975","10.759889","192.168.0.92","18.165.77.79","TLSv1.2","735","Application Data"
"5005","10.781326","18.165.77.79","192.168.0.92","TCP","66","443  >  63409 [ACK] Seq=456620 Ack=3970 Win=311 Len=0 TSval=3519402414 TSecr=1024284722"
"5010","10.792725","18.165.77.79","192.168.0.92","TLSv1.2","1128","Application Data"
"5011","10.792727","18.165.77.79","192.168.0.92","TLSv1.2","97","Application Data"
"5012","10.792795","192.168.0.92","18.165.77.79","TCP","66","63409  >  443 [ACK] Seq=3970 Ack=457713 Win=3771 Len=0 TSval=1024284754 TSecr=3519402426"
