"No.","Time","Source","Destination","Protocol","Length","Info"
"11","1.423502","192.168.0.92","18.160.17.214","TLSv1.2","422","Application Data"
"23","1.445838","18.160.17.214","192.168.0.92","TCP","66","443  >  50106 [ACK] Seq=1 Ack=357 Win=876 Len=0 TSval=2743141979 TSecr=1205575489"
"24","1.451606","192.168.0.92","18.160.17.214","TLSv1.2","628","Application Data"
"29","1.465495","18.160.17.214","192.168.0.92","TLSv1.2","631","Application Data"
"30","1.465495","18.160.17.214","192.168.0.92","TLSv1.2","97","Application Data"
"33","1.465574","192.168.0.92","18.160.17.214","TCP","66","50106  >  443 [ACK] Seq=919 Ack=597 Win=8174 Len=0 TSval=1205575531 TSecr=2743141999"
"38","1.507405","18.160.17.214","192.168.0.92","TLSv1.2","1277","Application Data"
"39","1.507504","192.168.0.92","18.160.17.214","TCP","66","50106  >  443 [ACK] Seq=919 Ack=1808 Win=8165 Len=0 TSval=1205575573 TSecr=2743142039"
"40","1.508999","18.160.17.214","192.168.0.92","TCP","1494","443  >  50106 [ACK] Seq=1808 Ack=919 Win=882 Len=1428 TSval=2743142039 TSecr=1205575516 [TCP segment of a reassembled PDU]"
"41","1.509000","18.160.17.214","192.168.0.92","TCP","1494","443  >  50106 [ACK] Seq=3236 Ack=919 Win=882 Len=1428 TSval=2743142039 TSecr=1205575516 [TCP segment of a reassembled PDU]"
"42","1.509001","18.160.17.214","192.168.0.92","TCP","1494","443  >  50106 [ACK] Seq=4664 Ack=919 Win=882 Len=1428 TSval=2743142039 TSecr=1205575516 [TCP segment of a reassembled PDU]"
"43","1.509002","18.160.17.214","192.168.0.92","TLSv1.2","698","Application Data"
"44","1.509030","192.168.0.92","18.160.17.214","TCP","66","50106  >  443 [ACK] Seq=919 Ack=6724 Win=8107 Len=0 TSval=1205575574 TSecr=2743142039"
"45","1.509074","192.168.0.92","18.160.17.214","TCP","66","[TCP Window Update] 50106  >  443 [ACK] Seq=919 Ack=6724 Win=8183 Len=0 TSval=1205575574 TSecr=2743142039"
"46","1.515056","18.160.17.214","192.168.0.92","TCP","1494","443  >  50106 [ACK] Seq=6724 Ack=919 Win=882 Len=1428 TSval=2743142049 TSecr=1205575516 [TCP segment of a reassembled PDU]"
"47","1.515058","18.160.17.214","192.168.0.92","TCP","1494","443  >  50106 [ACK] Seq=8152 Ack=919 Win=882 Len=1428 TSval=2743142049 TSecr=1205575516 [TCP segment of a reassembled PDU]"
"48","1.515059","18.160.17.214","192.168.0.92","TCP","1494","443  >  50106 [ACK] Seq=9580 Ack=919 Win=882 Len=1428 TSval=2743142049 TSecr=1205575516 [TCP segment of a reassembled PDU]"
"49","1.515060","18.160.17.214","192.168.0.92","TCP","1494","443  >  50106 [ACK] Seq=11008 Ack=919 Win=882 Len=1428 TSval=2743142049 TSecr=1205575516 [TCP segment of a reassembled PDU]"
"50","1.515061","18.160.17.214","192.168.0.92","TCP","1494","443  >  50106 [ACK] Seq=12436 Ack=919 Win=882 Len=1428 TSval=2743142049 TSecr=1205575516 [TCP segment of a reassembled PDU]"
"51","1.515062","18.160.17.214","192.168.0.92","TLSv1.2","1425","Application Data"
"52","1.515167","192.168.0.92","18.160.17.214","TCP","66","50106  >  443 [ACK] Seq=919 Ack=15223 Win=8051 Len=0 TSval=1205575580 TSecr=2743142049"
"53","1.515259","192.168.0.92","18.160.17.214","TCP","66","[TCP Window Update] 50106  >  443 [ACK] Seq=919 Ack=15223 Win=8183 Len=0 TSval=1205575580 TSecr=2743142049"
"54","1.516705","18.160.17.214","192.168.0.92","TCP","1494","443  >  50106 [ACK] Seq=15223 Ack=919 Win=882 Len=1428 TSval=2743142049 TSecr=1205575516 [TCP segment of a reassembled PDU]"
"55","1.516707","18.160.17.214","192.168.0.92","TLSv1.2","250","Application Data"
"56","1.516707","18.160.17.214","192.168.0.92","TLSv1.2","184","Application Data"
"57","1.516708","18.160.17.214","192.168.0.92","TLSv1.2","554","Application Data"
"58","1.516709","18.160.17.214","192.168.0.92","TCP","1494","443  >  50106 [ACK] Seq=17441 Ack=919 Win=882 Len=1428 TSval=2743142050 TSecr=1205575516 [TCP segment of a reassembled PDU]"
"59","1.516710","18.160.17.214","192.168.0.92","TCP","1494","443  >  50106 [ACK] Seq=18869 Ack=919 Win=882 Len=1428 TSval=2743142050 TSecr=1205575516 [TCP segment of a reassembled PDU]"
"60","1.516711","18.160.17.214","192.168.0.92","TCP","1494","443  >  50106 [ACK] Seq=20297 Ack=919 Win=882 Len=1428 TSval=2743142050 TSecr=1205575516 [TCP segment of a reassembled PDU]"
"61","1.516712","18.160.17.214","192.168.0.92","TCP","1494","443  >  50106 [ACK] Seq=21725 Ack=919 Win=882 Len=1428 TSval=2743142050 TSecr=1205575516 [TCP segment of a reassembled PDU]"
"62","1.516713","18.160.17.214","192.168.0.92","TCP","1494","443  >  50106 [ACK] Seq=23153 Ack=919 Win=882 Len=1428 TSval=2743142050 TSecr=1205575516 [TCP segment of a reassembled PDU]"
"63","1.516714","18.160.17.214","192.168.0.92","TLSv1.2","643","Application Data"
"64","1.516789","192.168.0.92","18.160.17.214","TCP","66","50106  >  443 [ACK] Seq=919 Ack=25158 Win=8028 Len=0 TSval=1205575582 TSecr=2743142050"
"65","1.516843","192.168.0.92","18.160.17.214","TCP","66","[TCP Window Update] 50106  >  443 [ACK] Seq=919 Ack=25158 Win=8183 Len=0 TSval=1205575582 TSecr=2743142050"
"74","1.555565","18.160.17.214","192.168.0.92","TCP","1494","443  >  50106 [ACK] Seq=25158 Ack=919 Win=882 Len=1428 TSval=2743142090 TSecr=1205575582 [TCP segment of a reassembled PDU]"
"76","1.555692","192.168.0.92","18.160.17.214","TCP","66","50106  >  443 [ACK] Seq=919 Ack=26586 Win=8161 Len=0 TSval=1205575621 TSecr=2743142090"
"77","1.557013","18.160.17.214","192.168.0.92","TCP","1494","443  >  50106 [ACK] Seq=26586 Ack=919 Win=882 Len=1428 TSval=2743142090 TSecr=1205575582 [TCP segment of a reassembled PDU]"
"78","1.557014","18.160.17.214","192.168.0.92","TCP","1494","443  >  50106 [ACK] Seq=28014 Ack=919 Win=882 Len=1428 TSval=2743142090 TSecr=1205575582 [TCP segment of a reassembled PDU]"
"79","1.557015","18.160.17.214","192.168.0.92","TCP","1494","443  >  50106 [ACK] Seq=29442 Ack=919 Win=882 Len=1428 TSval=2743142090 TSecr=1205575582 [TCP segment of a reassembled PDU]"
"80","1.557016","18.160.17.214","192.168.0.92","TCP","1494","443  >  50106 [ACK] Seq=30870 Ack=919 Win=882 Len=1428 TSval=2743142090 TSecr=1205575582 [TCP segment of a reassembled PDU]"
"81","1.557017","18.160.17.214","192.168.0.92","TCP","1494","443  >  50106 [ACK] Seq=32298 Ack=919 Win=882 Len=1428 TSval=2743142090 TSecr=1205575582 [TCP segment of a reassembled PDU]"
"82","1.557018","18.160.17.214","192.168.0.92","TCP","1494","443  >  50106 [ACK] Seq=33726 Ack=919 Win=882 Len=1428 TSval=2743142090 TSecr=1205575582 [TCP segment of a reassembled PDU]"
"83","1.557018","18.160.17.214","192.168.0.92","TCP","1494","443  >  50106 [ACK] Seq=35154 Ack=919 Win=882 Len=1428 TSval=2743142090 TSecr=1205575582 [TCP segment of a reassembled PDU]"
"84","1.557019","18.160.17.214","192.168.0.92","TCP","1494","443  >  50106 [ACK] Seq=36582 Ack=919 Win=882 Len=1428 TSval=2743142090 TSecr=1205575582 [TCP segment of a reassembled PDU]"
"85","1.557020","18.160.17.214","192.168.0.92","TCP","1494","443  >  50106 [PSH, ACK] Seq=38010 Ack=919 Win=882 Len=1428 TSval=2743142090 TSecr=1205575582 [TCP segment of a reassembled PDU]"
"86","1.557021","18.160.17.214","192.168.0.92","TCP","1494","443  >  50106 [ACK] Seq=39438 Ack=919 Win=882 Len=1428 TSval=2743142091 TSecr=1205575582 [TCP segment of a reassembled PDU]"
"87","1.557022","18.160.17.214","192.168.0.92","TLSv1.2","764","Application Data"
"88","1.557022","18.160.17.214","192.168.0.92","TCP","1494","443  >  50106 [ACK] Seq=41564 Ack=919 Win=882 Len=1428 TSval=2743142091 TSecr=1205575582 [TCP segment of a reassembled PDU]"
"89","1.557023","18.160.17.214","192.168.0.92","TCP","1494","443  >  50106 [ACK] Seq=42992 Ack=919 Win=882 Len=1428 TSval=2743142091 TSecr=1205575582 [TCP segment of a reassembled PDU]"
"90","1.557024","18.160.17.214","192.168.0.92","TLSv1.2","713","Application Data"
"91","1.557104","192.168.0.92","18.160.17.214","TCP","66","50106  >  443 [ACK] Seq=919 Ack=41564 Win=7949 Len=0 TSval=1205575622 TSecr=2743142091"
"92","1.557134","192.168.0.92","18.160.17.214","TCP","66","50106  >  443 [ACK] Seq=919 Ack=45067 Win=7895 Len=0 TSval=1205575622 TSecr=2743142091"
"93","1.557181","192.168.0.92","18.160.17.214","TCP","66","[TCP Window Update] 50106  >  443 [ACK] Seq=919 Ack=45067 Win=8183 Len=0 TSval=1205575622 TSecr=2743142091"
"94","1.586917","18.160.17.214","192.168.0.92","TCP","1494","443  >  50106 [ACK] Seq=45067 Ack=919 Win=882 Len=1428 TSval=2743142121 TSecr=1205575622 [TCP segment of a reassembled PDU]"
"95","1.586918","18.160.17.214","192.168.0.92","TCP","1494","443  >  50106 [ACK] Seq=46495 Ack=919 Win=882 Len=1428 TSval=2743142121 TSecr=1205575622 [TCP segment of a reassembled PDU]"
"96","1.586920","18.160.17.214","192.168.0.92","TLSv1.2","840","Application Data"
"97","1.587019","192.168.0.92","18.160.17.214","TCP","66","50106  >  443 [ACK] Seq=919 Ack=48697 Win=8127 Len=0 TSval=1205575652 TSecr=2743142121"
"98","1.587224","192.168.0.92","18.160.17.214","TCP","66","[TCP Window Update] 50106  >  443 [ACK] Seq=919 Ack=48697 Win=8183 Len=0 TSval=1205575652 TSecr=2743142121"
"99","1.588244","18.160.17.214","192.168.0.92","TCP","1494","443  >  50106 [ACK] Seq=48697 Ack=919 Win=882 Len=1428 TSval=2743142122 TSecr=1205575622 [TCP segment of a reassembled PDU]"
"100","1.588320","192.168.0.92","18.160.17.214","TCP","66","50106  >  443 [ACK] Seq=919 Ack=50125 Win=8161 Len=0 TSval=1205575653 TSecr=2743142122"
"101","1.589795","18.160.17.214","192.168.0.92","TCP","1494","443  >  50106 [ACK] Seq=50125 Ack=919 Win=882 Len=1428 TSval=2743142122 TSecr=1205575622 [TCP segment of a reassembled PDU]"
"102","1.589797","18.160.17.214","192.168.0.92","TCP","1494","443  >  50106 [ACK] Seq=51553 Ack=919 Win=882 Len=1428 TSval=2743142122 TSecr=1205575622 [TCP segment of a reassembled PDU]"
"103","1.589798","18.160.17.214","192.168.0.92","TCP","1494","443  >  50106 [ACK] Seq=52981 Ack=919 Win=882 Len=1428 TSval=2743142122 TSecr=1205575622 [TCP segment of a reassembled PDU]"
"104","1.589799","18.160.17.214","192.168.0.92","TCP","1494","443  >  50106 [ACK] Seq=54409 Ack=919 Win=882 Len=1428 TSval=2743142122 TSecr=1205575622 [TCP segment of a reassembled PDU]"
"105","1.589800","18.160.17.214","192.168.0.92","TCP","1494","443  >  50106 [ACK] Seq=55837 Ack=919 Win=882 Len=1428 TSval=2743142122 TSecr=1205575622 [TCP segment of a reassembled PDU]"
"106","1.589801","18.160.17.214","192.168.0.92","TCP","1494","443  >  50106 [ACK] Seq=57265 Ack=919 Win=882 Len=1428 TSval=2743142122 TSecr=1205575622 [TCP segment of a reassembled PDU]"
"107","1.589802","18.160.17.214","192.168.0.92","TCP","1494","443  >  50106 [ACK] Seq=58693 Ack=919 Win=882 Len=1428 TSval=2743142122 TSecr=1205575622 [TCP segment of a reassembled PDU]"
"108","1.589802","18.160.17.214","192.168.0.92","TCP","1494","443  >  50106 [ACK] Seq=60121 Ack=919 Win=882 Len=1428 TSval=2743142122 TSecr=1205575622 [TCP segment of a reassembled PDU]"
"109","1.589804","18.160.17.214","192.168.0.92","TCP","1494","443  >  50106 [PSH, ACK] Seq=61549 Ack=919 Win=882 Len=1428 TSval=2743142122 TSecr=1205575622 [TCP segment of a reassembled PDU]"
"110","1.589805","18.160.17.214","192.168.0.92","TCP","1494","443  >  50106 [ACK] Seq=62977 Ack=919 Win=882 Len=1428 TSval=2743142122 TSecr=1205575622 [TCP segment of a reassembled PDU]"
"111","1.589805","18.160.17.214","192.168.0.92","TLSv1.2","790","Application Data, Application Data"
"112","1.589806","18.160.17.214","192.168.0.92","TCP","1494","443  >  50106 [ACK] Seq=65129 Ack=919 Win=882 Len=1428 TSval=2743142123 TSecr=1205575622 [TCP segment of a reassembled PDU]"
"113","1.589891","192.168.0.92","18.160.17.214","TCP","66","50106  >  443 [ACK] Seq=919 Ack=65129 Win=7949 Len=0 TSval=1205575655 TSecr=2743142122"
"114","1.589920","192.168.0.92","18.160.17.214","TCP","66","50106  >  443 [ACK] Seq=919 Ack=66557 Win=7927 Len=0 TSval=1205575655 TSecr=2743142123"
"115","1.589962","192.168.0.92","18.160.17.214","TCP","66","[TCP Window Update] 50106  >  443 [ACK] Seq=919 Ack=66557 Win=8183 Len=0 TSval=1205575655 TSecr=2743142123"
"116","1.590441","18.160.17.214","192.168.0.92","TCP","1494","443  >  50106 [ACK] Seq=66557 Ack=919 Win=882 Len=1428 TSval=2743142123 TSecr=1205575622 [TCP segment of a reassembled PDU]"
"117","1.590442","18.160.17.214","192.168.0.92","TCP","1494","443  >  50106 [ACK] Seq=67985 Ack=919 Win=882 Len=1428 TSval=2743142123 TSecr=1205575622 [TCP segment of a reassembled PDU]"
"118","1.590443","18.160.17.214","192.168.0.92","TCP","1494","443  >  50106 [ACK] Seq=69413 Ack=919 Win=882 Len=1428 TSval=2743142123 TSecr=1205575622 [TCP segment of a reassembled PDU]"
"119","1.590444","18.160.17.214","192.168.0.92","TCP","1494","443  >  50106 [ACK] Seq=70841 Ack=919 Win=882 Len=1428 TSval=2743142123 TSecr=1205575622 [TCP segment of a reassembled PDU]"
"120","1.590445","18.160.17.214","192.168.0.92","TCP","1494","443  >  50106 [ACK] Seq=72269 Ack=919 Win=882 Len=1428 TSval=2743142123 TSecr=1205575622 [TCP segment of a reassembled PDU]"
"121","1.590446","18.160.17.214","192.168.0.92","TCP","1494","443  >  50106 [ACK] Seq=73697 Ack=919 Win=882 Len=1428 TSval=2743142123 TSecr=1205575622 [TCP segment of a reassembled PDU]"
"122","1.590447","18.160.17.214","192.168.0.92","TCP","1494","443  >  50106 [ACK] Seq=75125 Ack=919 Win=882 Len=1428 TSval=2743142123 TSecr=1205575622 [TCP segment of a reassembled PDU]"
"123","1.590448","18.160.17.214","192.168.0.92","TCP","1494","443  >  50106 [ACK] Seq=76553 Ack=919 Win=882 Len=1428 TSval=2743142123 TSecr=1205575622 [TCP segment of a reassembled PDU]"
"124","1.590449","18.160.17.214","192.168.0.92","TCP","1494","443  >  50106 [PSH, ACK] Seq=77981 Ack=919 Win=882 Len=1428 TSval=2743142123 TSecr=1205575622 [TCP segment of a reassembled PDU]"
"125","1.590450","18.160.17.214","192.168.0.92","TCP","1494","443  >  50106 [ACK] Seq=79409 Ack=919 Win=882 Len=1428 TSval=2743142123 TSecr=1205575622 [TCP segment of a reassembled PDU]"
"126","1.590451","18.160.17.214","192.168.0.92","TLSv1.2","1494","Application Data"
"127","1.590452","18.160.17.214","192.168.0.92","TCP","1494","443  >  50106 [ACK] Seq=82265 Ack=919 Win=882 Len=1428 TSval=2743142123 TSecr=1205575622 [TCP segment of a reassembled PDU]"
"128","1.590452","18.160.17.214","192.168.0.92","TCP","1494","443  >  50106 [ACK] Seq=83693 Ack=919 Win=882 Len=1428 TSval=2743142123 TSecr=1205575622 [TCP segment of a reassembled PDU]"
"129","1.590453","18.160.17.214","192.168.0.92","TCP","1494","443  >  50106 [ACK] Seq=85121 Ack=919 Win=882 Len=1428 TSval=2743142123 TSecr=1205575622 [TCP segment of a reassembled PDU]"
"130","1.590454","18.160.17.214","192.168.0.92","TLSv1.2","302","Application Data"
"131","1.590455","18.160.17.214","192.168.0.92","TLSv1.2","97","Application Data"
"132","1.590523","192.168.0.92","18.160.17.214","TCP","66","50106  >  443 [ACK] Seq=919 Ack=82265 Win=7938 Len=0 TSval=1205575655 TSecr=2743142123"
"133","1.590547","192.168.0.92","18.160.17.214","TCP","66","50106  >  443 [ACK] Seq=919 Ack=86816 Win=7867 Len=0 TSval=1205575655 TSecr=2743142124"
"134","1.590582","192.168.0.92","18.160.17.214","TCP","66","[TCP Window Update] 50106  >  443 [ACK] Seq=919 Ack=86816 Win=8183 Len=0 TSval=1205575655 TSecr=2743142124"
"150","2.080230","192.168.0.92","18.160.17.214","TLSv1.2","1144","Application Data"
"153","2.128410","192.168.0.92","18.160.17.214","TLSv1.2","823","Application Data"
"157","2.146417","18.160.17.214","192.168.0.92","TCP","66","443  >  50106 [ACK] Seq=86816 Ack=1997 Win=887 Len=0 TSval=2743142677 TSecr=1205576145"
"180","2.150494","18.160.17.214","192.168.0.92","TCP","66","443  >  50106 [ACK] Seq=86816 Ack=2754 Win=893 Len=0 TSval=2743142683 TSecr=1205576194"
"186","2.163814","18.160.17.214","192.168.0.92","TLSv1.2","1302","Application Data"
"187","2.163816","18.160.17.214","192.168.0.92","TLSv1.2","97","Application Data"
"188","2.163904","192.168.0.92","18.160.17.214","TCP","66","50106  >  443 [ACK] Seq=2754 Ack=88083 Win=8164 Len=0 TSval=1205576229 TSecr=2743142697"
"196","2.211504","192.168.0.92","18.160.17.214","TLSv1.2","183","Application Data"
"197","2.215782","192.168.0.92","18.160.17.214","TLSv1.2","183","Application Data"
"198","2.234709","18.160.17.214","192.168.0.92","TCP","66","443  >  50106 [ACK] Seq=88083 Ack=2988 Win=893 Len=0 TSval=2743142767 TSecr=1205576277"
"199","2.236794","18.160.17.214","192.168.0.92","TLSv1.2","510","Application Data"
"200","2.236795","18.160.17.214","192.168.0.92","TLSv1.2","97","Application Data"
"201","2.236888","192.168.0.92","18.160.17.214","TCP","66","50106  >  443 [ACK] Seq=2988 Ack=88558 Win=8176 Len=0 TSval=1205576302 TSecr=2743142770"
"202","2.266977","192.168.0.92","18.160.17.214","TLSv1.2","393","Application Data"
"203","2.277956","18.160.17.214","192.168.0.92","TLSv1.2","1463","Application Data"
"204","2.277958","18.160.17.214","192.168.0.92","TLSv1.2","97","Application Data"
"205","2.278051","192.168.0.92","18.160.17.214","TCP","66","50106  >  443 [ACK] Seq=3315 Ack=89986 Win=8161 Len=0 TSval=1205576343 TSecr=2743142811"
"207","2.286743","18.160.17.214","192.168.0.92","TCP","1494","443  >  50106 [ACK] Seq=89986 Ack=2988 Win=893 Len=1428 TSval=2743142820 TSecr=1205576302 [TCP segment of a reassembled PDU]"
"208","2.286745","18.160.17.214","192.168.0.92","TCP","1494","443  >  50106 [ACK] Seq=91414 Ack=2988 Win=893 Len=1428 TSval=2743142820 TSecr=1205576302 [TCP segment of a reassembled PDU]"
"209","2.286746","18.160.17.214","192.168.0.92","TLSv1.2","1070","Application Data"
"210","2.286746","18.160.17.214","192.168.0.92","TCP","1494","443  >  50106 [ACK] Seq=93846 Ack=2988 Win=893 Len=1428 TSval=2743142820 TSecr=1205576302 [TCP segment of a reassembled PDU]"
"211","2.286747","18.160.17.214","192.168.0.92","TCP","1494","443  >  50106 [ACK] Seq=95274 Ack=2988 Win=893 Len=1428 TSval=2743142820 TSecr=1205576302 [TCP segment of a reassembled PDU]"
"212","2.286748","18.160.17.214","192.168.0.92","TCP","1494","443  >  50106 [ACK] Seq=96702 Ack=2988 Win=893 Len=1428 TSval=2743142820 TSecr=1205576302 [TCP segment of a reassembled PDU]"
"213","2.286749","18.160.17.214","192.168.0.92","TLSv1.2","821","Application Data"
"214","2.286750","18.160.17.214","192.168.0.92","TLSv1.2","97","Application Data"
"215","2.286826","192.168.0.92","18.160.17.214","TCP","66","50106  >  443 [ACK] Seq=3315 Ack=98916 Win=8044 Len=0 TSval=1205576352 TSecr=2743142820"
"216","2.286887","192.168.0.92","18.160.17.214","TCP","66","[TCP Window Update] 50106  >  443 [ACK] Seq=3315 Ack=98916 Win=8183 Len=0 TSval=1205576352 TSecr=2743142820"
"220","2.330721","18.160.17.214","192.168.0.92","TCP","66","443  >  50106 [ACK] Seq=98916 Ack=3315 Win=898 Len=0 TSval=2743142865 TSecr=1205576332"
"230","2.526901","192.168.0.92","18.160.17.214","TLSv1.2","267","Application Data"
"231","2.530951","192.168.0.92","18.160.17.214","TLSv1.2","218","Application Data"
"232","2.550503","18.160.17.214","192.168.0.92","TCP","66","443  >  50106 [ACK] Seq=98916 Ack=3516 Win=904 Len=0 TSval=2743143084 TSecr=1205576592"
"233","2.550504","18.160.17.214","192.168.0.92","TCP","66","443  >  50106 [ACK] Seq=98916 Ack=3668 Win=910 Len=0 TSval=2743143085 TSecr=1205576596"
"236","2.593941","18.160.17.214","192.168.0.92","TLSv1.2","1389","Application Data"
"237","2.593943","18.160.17.214","192.168.0.92","TLSv1.2","97","Application Data"
"238","2.594040","192.168.0.92","18.160.17.214","TCP","66","50106  >  443 [ACK] Seq=3668 Ack=100270 Win=8162 Len=0 TSval=1205576659 TSecr=2743143128"
"240","2.620314","18.160.17.214","192.168.0.92","TLSv1.2","1060","Application Data"
"241","2.620315","18.160.17.214","192.168.0.92","TLSv1.2","97","Application Data"
"242","2.620405","192.168.0.92","18.160.17.214","TCP","66","50106  >  443 [ACK] Seq=3668 Ack=101295 Win=8167 Len=0 TSval=1205576686 TSecr=2743143154"
"262","2.914068","18.160.17.214","192.168.0.92","TCP","1494","443  >  50106 [ACK] Seq=101295 Ack=3668 Win=910 Len=1428 TSval=2743143448 TSecr=1205576686 [TCP segment of a reassembled PDU]"
"263","2.914070","18.160.17.214","192.168.0.92","TCP","1494","443  >  50106 [ACK] Seq=102723 Ack=3668 Win=910 Len=1428 TSval=2743143448 TSecr=1205576686 [TCP segment of a reassembled PDU]"
"264","2.914163","192.168.0.92","18.160.17.214","TCP","66","50106  >  443 [ACK] Seq=3668 Ack=104151 Win=8139 Len=0 TSval=1205576979 TSecr=2743143448"
"265","2.914266","192.168.0.92","18.160.17.214","TCP","66","[TCP Window Update] 50106  >  443 [ACK] Seq=3668 Ack=104151 Win=8183 Len=0 TSval=1205576979 TSecr=2743143448"
"266","2.915391","18.160.17.214","192.168.0.92","TCP","1494","443  >  50106 [ACK] Seq=104151 Ack=3668 Win=910 Len=1428 TSval=2743143448 TSecr=1205576686 [TCP segment of a reassembled PDU]"
"267","2.915392","18.160.17.214","192.168.0.92","TCP","1494","443  >  50106 [ACK] Seq=105579 Ack=3668 Win=910 Len=1428 TSval=2743143448 TSecr=1205576686 [TCP segment of a reassembled PDU]"
"268","2.915392","18.160.17.214","192.168.0.92","TCP","1494","443  >  50106 [ACK] Seq=107007 Ack=3668 Win=910 Len=1428 TSval=2743143448 TSecr=1205576686 [TCP segment of a reassembled PDU]"
"269","2.915393","18.160.17.214","192.168.0.92","TLSv1.2","946","Application Data"
"270","2.915394","18.160.17.214","192.168.0.92","TCP","1494","443  >  50106 [ACK] Seq=109315 Ack=3668 Win=910 Len=1428 TSval=2743143448 TSecr=1205576686 [TCP segment of a reassembled PDU]"
"271","2.915394","18.160.17.214","192.168.0.92","TLSv1.2","99","Application Data"
"272","2.915395","18.160.17.214","192.168.0.92","TCP","1494","443  >  50106 [ACK] Seq=110776 Ack=3668 Win=910 Len=1428 TSval=2743143448 TSecr=1205576686 [TCP segment of a reassembled PDU]"
"273","2.915396","18.160.17.214","192.168.0.92","TLSv1.2","354","Application Data"
"274","2.915396","18.160.17.214","192.168.0.92","TLSv1.2","629","Application Data"
"275","2.915397","18.160.17.214","192.168.0.92","TLSv1.2","531","Application Data"
"276","2.915397","18.160.17.214","192.168.0.92","TLSv1.2","655","Application Data"
"277","2.915398","18.160.17.214","192.168.0.92","TLSv1.2","332","Application Data"
"278","2.915398","18.160.17.214","192.168.0.92","TCP","1494","443  >  50106 [ACK] Seq=114375 Ack=3668 Win=910 Len=1428 TSval=2743143450 TSecr=1205576686 [TCP segment of a reassembled PDU]"
"279","2.915435","192.168.0.92","18.160.17.214","TCP","66","50106  >  443 [ACK] Seq=3668 Ack=115803 Win=8001 Len=0 TSval=1205576981 TSecr=2743143450"
"280","2.915476","192.168.0.92","18.160.17.214","TCP","66","[TCP Window Update] 50106  >  443 [ACK] Seq=3668 Ack=115803 Win=8183 Len=0 TSval=1205576981 TSecr=2743143450"
"281","2.917433","18.160.17.214","192.168.0.92","TLSv1.2","559","Application Data"
"282","2.917434","18.160.17.214","192.168.0.92","TLSv1.2","1091","Application Data"
"283","2.917436","18.160.17.214","192.168.0.92","TLSv1.2","1242","Application Data"
"284","2.917437","18.160.17.214","192.168.0.92","TCP","1494","443  >  50106 [ACK] Seq=118497 Ack=3668 Win=910 Len=1428 TSval=2743143450 TSecr=1205576686 [TCP segment of a reassembled PDU]"
"285","2.917438","18.160.17.214","192.168.0.92","TLSv1.2","346","Application Data"
"286","2.917439","18.160.17.214","192.168.0.92","TLSv1.2","1150","Application Data"
"287","2.917440","18.160.17.214","192.168.0.92","TCP","1494","443  >  50106 [ACK] Seq=121289 Ack=3668 Win=910 Len=1428 TSval=2743143450 TSecr=1205576686 [TCP segment of a reassembled PDU]"
"288","2.917442","18.160.17.214","192.168.0.92","TLSv1.2","1070","Application Data"
"289","2.917442","18.160.17.214","192.168.0.92","TLSv1.2","698","Application Data"
"290","2.917444","18.160.17.214","192.168.0.92","TLSv1.2","545","Application Data"
"291","2.917444","18.160.17.214","192.168.0.92","TLSv1.2","221","Application Data"
"292","2.917445","18.160.17.214","192.168.0.92","TLSv1.2","941","Application Data"
"293","2.917446","18.160.17.214","192.168.0.92","TLSv1.2","986","Application Data"
"294","2.917447","18.160.17.214","192.168.0.92","TLSv1.2","850","Application Data"
"295","2.917448","18.160.17.214","192.168.0.92","TLSv1.2","757","Application Data"
"296","2.917450","18.160.17.214","192.168.0.92","TLSv1.2","271","Application Data"
"297","2.917451","18.160.17.214","192.168.0.92","TLSv1.2","560","Application Data"
"298","2.917452","18.160.17.214","192.168.0.92","TLSv1.2","232","Application Data"
"299","2.917453","18.160.17.214","192.168.0.92","TLSv1.2","393","Application Data"
"300","2.917454","18.160.17.214","192.168.0.92","TCP","1494","443  >  50106 [ACK] Seq=129449 Ack=3668 Win=910 Len=1428 TSval=2743143452 TSecr=1205576686 [TCP segment of a reassembled PDU]"
"301","2.917500","192.168.0.92","18.160.17.214","TCP","66","50106  >  443 [ACK] Seq=3668 Ack=130877 Win=7948 Len=0 TSval=1205576983 TSecr=2743143452"
"302","2.917558","192.168.0.92","18.160.17.214","TCP","66","[TCP Window Update] 50106  >  443 [ACK] Seq=3668 Ack=130877 Win=8183 Len=0 TSval=1205576983 TSecr=2743143452"
"303","2.918275","18.160.17.214","192.168.0.92","TCP","1494","443  >  50106 [ACK] Seq=130877 Ack=3668 Win=910 Len=1428 TSval=2743143452 TSecr=1205576686 [TCP segment of a reassembled PDU]"
"304","2.918276","18.160.17.214","192.168.0.92","TLSv1.2","107","Application Data"
"305","2.918310","192.168.0.92","18.160.17.214","TCP","66","50106  >  443 [ACK] Seq=3668 Ack=132346 Win=8160 Len=0 TSval=1205576983 TSecr=2743143452"
"306","2.919206","18.160.17.214","192.168.0.92","TLSv1.2","952","Application Data"
"307","2.919207","18.160.17.214","192.168.0.92","TCP","1494","443  >  50106 [ACK] Seq=133232 Ack=3668 Win=910 Len=1428 TSval=2743143452 TSecr=1205576686 [TCP segment of a reassembled PDU]"
"308","2.919209","18.160.17.214","192.168.0.92","TLSv1.2","877","Application Data"
"309","2.919211","18.160.17.214","192.168.0.92","TLSv1.2","315","Application Data"
"310","2.919211","18.160.17.214","192.168.0.92","TLSv1.2","1480","Application Data"
"311","2.919213","18.160.17.214","192.168.0.92","TLSv1.2","582","Application Data"
"312","2.919214","18.160.17.214","192.168.0.92","TLSv1.2","842","Application Data"
"313","2.919216","18.160.17.214","192.168.0.92","TLSv1.2","107","Application Data"
"314","2.919217","18.160.17.214","192.168.0.92","TLSv1.2","97","Application Data"
"315","2.919274","192.168.0.92","18.160.17.214","TCP","66","50106  >  443 [ACK] Seq=3668 Ack=138498 Win=8087 Len=0 TSval=1205576984 TSecr=2743143453"
"316","2.919321","192.168.0.92","18.160.17.214","TCP","66","[TCP Window Update] 50106  >  443 [ACK] Seq=3668 Ack=138498 Win=8183 Len=0 TSval=1205576984 TSecr=2743143453"
"856","3.855168","192.168.0.92","18.160.17.214","TLSv1.2","1118","Application Data"
"857","3.855283","192.168.0.92","18.160.17.214","TLSv1.2","112","Application Data"
"858","3.875508","18.160.17.214","192.168.0.92","TCP","66","443  >  50106 [ACK] Seq=138498 Ack=4720 Win=915 Len=0 TSval=2743144409 TSecr=1205577920"
"859","3.875513","18.160.17.214","192.168.0.92","TCP","66","443  >  50106 [ACK] Seq=138498 Ack=4766 Win=915 Len=0 TSval=2743144409 TSecr=1205577920"
"860","3.951224","18.160.17.214","192.168.0.92","TLSv1.2","948","Application Data"
"861","3.951229","18.160.17.214","192.168.0.92","TLSv1.2","97","Application Data"
"862","3.951365","192.168.0.92","18.160.17.214","TCP","66","50106  >  443 [ACK] Seq=4766 Ack=139411 Win=8169 Len=0 TSval=1205578017 TSecr=2743144484"
"863","3.965747","192.168.0.92","18.160.17.214","TLSv1.2","391","Application Data"
"866","3.990835","18.160.17.214","192.168.0.92","TCP","66","443  >  50106 [ACK] Seq=139411 Ack=5091 Win=921 Len=0 TSval=2743144524 TSecr=1205578031"
"872","4.005814","18.160.17.214","192.168.0.92","TLSv1.2","629","Application Data"
"873","4.005816","18.160.17.214","192.168.0.92","TLSv1.2","97","Application Data"
"876","4.005923","192.168.0.92","18.160.17.214","TCP","66","50106  >  443 [ACK] Seq=5091 Ack=140005 Win=8174 Len=0 TSval=1205578071 TSecr=2743144537"
"938","4.063702","192.168.0.92","18.160.17.214","TLSv1.2","677","Application Data"
"954","4.126520","18.160.17.214","192.168.0.92","TCP","1494","443  >  50106 [ACK] Seq=140005 Ack=5702 Win=926 Len=1428 TSval=2743144660 TSecr=1205578129 [TCP segment of a reassembled PDU]"
"955","4.126521","18.160.17.214","192.168.0.92","TCP","1494","443  >  50106 [ACK] Seq=141433 Ack=5702 Win=926 Len=1428 TSval=2743144660 TSecr=1205578129 [TCP segment of a reassembled PDU]"
"956","4.126522","18.160.17.214","192.168.0.92","TCP","1494","443  >  50106 [ACK] Seq=142861 Ack=5702 Win=926 Len=1428 TSval=2743144660 TSecr=1205578129 [TCP segment of a reassembled PDU]"
"957","4.126523","18.160.17.214","192.168.0.92","TCP","1494","443  >  50106 [ACK] Seq=144289 Ack=5702 Win=926 Len=1428 TSval=2743144660 TSecr=1205578129 [TCP segment of a reassembled PDU]"
"958","4.126524","18.160.17.214","192.168.0.92","TLSv1.2","456","Application Data"
"959","4.126628","192.168.0.92","18.160.17.214","TCP","66","50106  >  443 [ACK] Seq=5702 Ack=146107 Win=8088 Len=0 TSval=1205578192 TSecr=2743144660"
"960","4.126740","192.168.0.92","18.160.17.214","TCP","66","[TCP Window Update] 50106  >  443 [ACK] Seq=5702 Ack=146107 Win=8183 Len=0 TSval=1205578192 TSecr=2743144660"
"961","4.131958","18.160.17.214","192.168.0.92","TCP","1494","443  >  50106 [ACK] Seq=146107 Ack=5702 Win=926 Len=1428 TSval=2743144666 TSecr=1205578129 [TCP segment of a reassembled PDU]"
"962","4.131960","18.160.17.214","192.168.0.92","TCP","1494","443  >  50106 [ACK] Seq=147535 Ack=5702 Win=926 Len=1428 TSval=2743144666 TSecr=1205578129 [TCP segment of a reassembled PDU]"
"963","4.132045","192.168.0.92","18.160.17.214","TCP","66","50106  >  443 [ACK] Seq=5702 Ack=148963 Win=8139 Len=0 TSval=1205578197 TSecr=2743144666"
"964","4.132123","192.168.0.92","18.160.17.214","TCP","66","[TCP Window Update] 50106  >  443 [ACK] Seq=5702 Ack=148963 Win=8183 Len=0 TSval=1205578197 TSecr=2743144666"
"965","4.133676","18.160.17.214","192.168.0.92","TCP","1494","443  >  50106 [ACK] Seq=148963 Ack=5702 Win=926 Len=1428 TSval=2743144666 TSecr=1205578129 [TCP segment of a reassembled PDU]"
"966","4.133677","18.160.17.214","192.168.0.92","TCP","1494","443  >  50106 [ACK] Seq=150391 Ack=5702 Win=926 Len=1428 TSval=2743144666 TSecr=1205578129 [TCP segment of a reassembled PDU]"
"967","4.133677","18.160.17.214","192.168.0.92","TCP","1494","443  >  50106 [ACK] Seq=151819 Ack=5702 Win=926 Len=1428 TSval=2743144666 TSecr=1205578129 [TCP segment of a reassembled PDU]"
"968","4.133678","18.160.17.214","192.168.0.92","TLSv1.2","1433","Application Data"
"969","4.133679","18.160.17.214","192.168.0.92","TCP","1494","443  >  50106 [ACK] Seq=154614 Ack=5702 Win=926 Len=1428 TSval=2743144666 TSecr=1205578129 [TCP segment of a reassembled PDU]"
"970","4.133680","18.160.17.214","192.168.0.92","TLSv1.2","334","Application Data"
"971","4.133680","18.160.17.214","192.168.0.92","TLSv1.2","554","Application Data"
"972","4.133681","18.160.17.214","192.168.0.92","TCP","1494","443  >  50106 [ACK] Seq=156798 Ack=5702 Win=926 Len=1428 TSval=2743144667 TSecr=1205578129 [TCP segment of a reassembled PDU]"
"973","4.133681","18.160.17.214","192.168.0.92","TCP","1494","443  >  50106 [ACK] Seq=158226 Ack=5702 Win=926 Len=1428 TSval=2743144667 TSecr=1205578129 [TCP segment of a reassembled PDU]"
"974","4.133682","18.160.17.214","192.168.0.92","TCP","1494","443  >  50106 [ACK] Seq=159654 Ack=5702 Win=926 Len=1428 TSval=2743144667 TSecr=1205578129 [TCP segment of a reassembled PDU]"
"975","4.133683","18.160.17.214","192.168.0.92","TCP","1494","443  >  50106 [ACK] Seq=161082 Ack=5702 Win=926 Len=1428 TSval=2743144667 TSecr=1205578129 [TCP segment of a reassembled PDU]"
"976","4.133684","18.160.17.214","192.168.0.92","TCP","1494","443  >  50106 [ACK] Seq=162510 Ack=5702 Win=926 Len=1428 TSval=2743144667 TSecr=1205578129 [TCP segment of a reassembled PDU]"
"977","4.133685","18.160.17.214","192.168.0.92","TLSv1.2","643","Application Data"
"978","4.133730","192.168.0.92","18.160.17.214","TCP","66","50106  >  443 [ACK] Seq=5702 Ack=164515 Win=7940 Len=0 TSval=1205578199 TSecr=2743144667"
"979","4.133796","192.168.0.92","18.160.17.214","TCP","66","[TCP Window Update] 50106  >  443 [ACK] Seq=5702 Ack=164515 Win=8183 Len=0 TSval=1205578199 TSecr=2743144667"
"989","4.176891","18.160.17.214","192.168.0.92","TCP","1494","443  >  50106 [ACK] Seq=164515 Ack=5702 Win=926 Len=1428 TSval=2743144710 TSecr=1205578199 [TCP segment of a reassembled PDU]"
"990","4.176939","192.168.0.92","18.160.17.214","TCP","66","50106  >  443 [ACK] Seq=5702 Ack=165943 Win=8161 Len=0 TSval=1205578242 TSecr=2743144710"
"991","4.177688","18.160.17.214","192.168.0.92","TCP","1494","443  >  50106 [ACK] Seq=165943 Ack=5702 Win=926 Len=1428 TSval=2743144710 TSecr=1205578199 [TCP segment of a reassembled PDU]"
"992","4.177689","18.160.17.214","192.168.0.92","TCP","1494","443  >  50106 [ACK] Seq=167371 Ack=5702 Win=926 Len=1428 TSval=2743144710 TSecr=1205578199 [TCP segment of a reassembled PDU]"
"993","4.177690","18.160.17.214","192.168.0.92","TCP","1494","443  >  50106 [ACK] Seq=168799 Ack=5702 Win=926 Len=1428 TSval=2743144710 TSecr=1205578199 [TCP segment of a reassembled PDU]"
"994","4.177691","18.160.17.214","192.168.0.92","TCP","1494","443  >  50106 [ACK] Seq=170227 Ack=5702 Win=926 Len=1428 TSval=2743144710 TSecr=1205578199 [TCP segment of a reassembled PDU]"
"995","4.177692","18.160.17.214","192.168.0.92","TCP","1494","443  >  50106 [ACK] Seq=171655 Ack=5702 Win=926 Len=1428 TSval=2743144710 TSecr=1205578199 [TCP segment of a reassembled PDU]"
"996","4.177692","18.160.17.214","192.168.0.92","TCP","1494","443  >  50106 [ACK] Seq=173083 Ack=5702 Win=926 Len=1428 TSval=2743144710 TSecr=1205578199 [TCP segment of a reassembled PDU]"
"997","4.177693","18.160.17.214","192.168.0.92","TCP","1494","443  >  50106 [ACK] Seq=174511 Ack=5702 Win=926 Len=1428 TSval=2743144710 TSecr=1205578199 [TCP segment of a reassembled PDU]"
"998","4.177694","18.160.17.214","192.168.0.92","TCP","1494","443  >  50106 [ACK] Seq=175939 Ack=5702 Win=926 Len=1428 TSval=2743144710 TSecr=1205578199 [TCP segment of a reassembled PDU]"
"999","4.177695","18.160.17.214","192.168.0.92","TCP","1494","443  >  50106 [PSH, ACK] Seq=177367 Ack=5702 Win=926 Len=1428 TSval=2743144710 TSecr=1205578199 [TCP segment of a reassembled PDU]"
"1000","4.177696","18.160.17.214","192.168.0.92","TCP","1494","443  >  50106 [ACK] Seq=178795 Ack=5702 Win=926 Len=1428 TSval=2743144710 TSecr=1205578199 [TCP segment of a reassembled PDU]"
"1001","4.177697","18.160.17.214","192.168.0.92","TLSv1.2","764","Application Data"
"1002","4.177697","18.160.17.214","192.168.0.92","TLSv1.2","422","Application Data"
"1003","4.177698","18.160.17.214","192.168.0.92","TCP","1494","443  >  50106 [ACK] Seq=181277 Ack=5702 Win=926 Len=1428 TSval=2743144710 TSecr=1205578199 [TCP segment of a reassembled PDU]"
"1004","4.177699","18.160.17.214","192.168.0.92","TCP","1494","443  >  50106 [ACK] Seq=182705 Ack=5702 Win=926 Len=1428 TSval=2743144710 TSecr=1205578199 [TCP segment of a reassembled PDU]"
"1005","4.177699","18.160.17.214","192.168.0.92","TLSv1.2","857","Application Data"
"1006","4.177739","192.168.0.92","18.160.17.214","TCP","66","50106  >  443 [ACK] Seq=5702 Ack=181277 Win=7944 Len=0 TSval=1205578242 TSecr=2743144710"
"1007","4.177750","192.168.0.92","18.160.17.214","TCP","66","50106  >  443 [ACK] Seq=5702 Ack=184924 Win=7887 Len=0 TSval=1205578242 TSecr=2743144710"
"1008","4.177821","192.168.0.92","18.160.17.214","TCP","66","[TCP Window Update] 50106  >  443 [ACK] Seq=5702 Ack=184924 Win=8183 Len=0 TSval=1205578242 TSecr=2743144710"
"1009","4.205114","18.160.17.214","192.168.0.92","TCP","1494","443  >  50106 [ACK] Seq=184924 Ack=5702 Win=926 Len=1428 TSval=2743144738 TSecr=1205578242 [TCP segment of a reassembled PDU]"
"1010","4.205116","18.160.17.214","192.168.0.92","TCP","1494","443  >  50106 [ACK] Seq=186352 Ack=5702 Win=926 Len=1428 TSval=2743144738 TSecr=1205578242 [TCP segment of a reassembled PDU]"
"1011","4.205117","18.160.17.214","192.168.0.92","TLSv1.2","994","Application Data"
"1012","4.205197","192.168.0.92","18.160.17.214","TCP","66","50106  >  443 [ACK] Seq=5702 Ack=188708 Win=8124 Len=0 TSval=1205578270 TSecr=2743144738"
"1013","4.205286","192.168.0.92","18.160.17.214","TCP","66","[TCP Window Update] 50106  >  443 [ACK] Seq=5702 Ack=188708 Win=8183 Len=0 TSval=1205578270 TSecr=2743144738"
"1014","4.206710","18.160.17.214","192.168.0.92","TCP","1494","443  >  50106 [ACK] Seq=188708 Ack=5702 Win=926 Len=1428 TSval=2743144741 TSecr=1205578242 [TCP segment of a reassembled PDU]"
"1015","4.206711","18.160.17.214","192.168.0.92","TCP","1494","443  >  50106 [ACK] Seq=190136 Ack=5702 Win=926 Len=1428 TSval=2743144741 TSecr=1205578242 [TCP segment of a reassembled PDU]"
"1016","4.206741","192.168.0.92","18.160.17.214","TCP","66","50106  >  443 [ACK] Seq=5702 Ack=191564 Win=8139 Len=0 TSval=1205578272 TSecr=2743144741"
"1017","4.206805","192.168.0.92","18.160.17.214","TCP","66","[TCP Window Update] 50106  >  443 [ACK] Seq=5702 Ack=191564 Win=8183 Len=0 TSval=1205578272 TSecr=2743144741"
"1018","4.209289","18.160.17.214","192.168.0.92","TCP","1494","443  >  50106 [ACK] Seq=191564 Ack=5702 Win=926 Len=1428 TSval=2743144741 TSecr=1205578242 [TCP segment of a reassembled PDU]"
"1019","4.209290","18.160.17.214","192.168.0.92","TCP","1494","443  >  50106 [ACK] Seq=192992 Ack=5702 Win=926 Len=1428 TSval=2743144741 TSecr=1205578242 [TCP segment of a reassembled PDU]"
"1020","4.209291","18.160.17.214","192.168.0.92","TCP","1494","443  >  50106 [ACK] Seq=194420 Ack=5702 Win=926 Len=1428 TSval=2743144741 TSecr=1205578242 [TCP segment of a reassembled PDU]"
"1021","4.209291","18.160.17.214","192.168.0.92","TCP","1494","443  >  50106 [ACK] Seq=195848 Ack=5702 Win=926 Len=1428 TSval=2743144741 TSecr=1205578242 [TCP segment of a reassembled PDU]"
"1022","4.209292","18.160.17.214","192.168.0.92","TCP","1494","443  >  50106 [ACK] Seq=197276 Ack=5702 Win=926 Len=1428 TSval=2743144741 TSecr=1205578242 [TCP segment of a reassembled PDU]"
"1023","4.209293","18.160.17.214","192.168.0.92","TCP","1494","443  >  50106 [ACK] Seq=198704 Ack=5702 Win=926 Len=1428 TSval=2743144741 TSecr=1205578242 [TCP segment of a reassembled PDU]"
"1024","4.209294","18.160.17.214","192.168.0.92","TCP","1494","443  >  50106 [ACK] Seq=200132 Ack=5702 Win=926 Len=1428 TSval=2743144741 TSecr=1205578242 [TCP segment of a reassembled PDU]"
"1025","4.209294","18.160.17.214","192.168.0.92","TCP","1494","443  >  50106 [PSH, ACK] Seq=201560 Ack=5702 Win=926 Len=1428 TSval=2743144741 TSecr=1205578242 [TCP segment of a reassembled PDU]"
"1026","4.209295","18.160.17.214","192.168.0.92","TCP","1494","443  >  50106 [ACK] Seq=202988 Ack=5702 Win=926 Len=1428 TSval=2743144742 TSecr=1205578242 [TCP segment of a reassembled PDU]"
"1027","4.209296","18.160.17.214","192.168.0.92","TLSv1.2","790","Application Data, Application Data"
"1028","4.209296","18.160.17.214","192.168.0.92","TCP","1494","443  >  50106 [ACK] Seq=205140 Ack=5702 Win=926 Len=1428 TSval=2743144743 TSecr=1205578242 [TCP segment of a reassembled PDU]"
"1029","4.209297","18.160.17.214","192.168.0.92","TCP","1494","443  >  50106 [ACK] Seq=206568 Ack=5702 Win=926 Len=1428 TSval=2743144743 TSecr=1205578242 [TCP segment of a reassembled PDU]"
"1030","4.209298","18.160.17.214","192.168.0.92","TCP","1494","443  >  50106 [ACK] Seq=207996 Ack=5702 Win=926 Len=1428 TSval=2743144743 TSecr=1205578242 [TCP segment of a reassembled PDU]"
"1031","4.209299","18.160.17.214","192.168.0.92","TCP","1494","443  >  50106 [ACK] Seq=209424 Ack=5702 Win=926 Len=1428 TSval=2743144743 TSecr=1205578242 [TCP segment of a reassembled PDU]"
"1032","4.209299","18.160.17.214","192.168.0.92","TCP","1494","443  >  50106 [ACK] Seq=210852 Ack=5702 Win=926 Len=1428 TSval=2743144743 TSecr=1205578242 [TCP segment of a reassembled PDU]"
"1033","4.209300","18.160.17.214","192.168.0.92","TCP","1494","443  >  50106 [ACK] Seq=212280 Ack=5702 Win=926 Len=1428 TSval=2743144743 TSecr=1205578242 [TCP segment of a reassembled PDU]"
"1034","4.209301","18.160.17.214","192.168.0.92","TCP","1494","443  >  50106 [ACK] Seq=213708 Ack=5702 Win=926 Len=1428 TSval=2743144743 TSecr=1205578242 [TCP segment of a reassembled PDU]"
"1035","4.209301","18.160.17.214","192.168.0.92","TCP","1494","443  >  50106 [ACK] Seq=215136 Ack=5702 Win=926 Len=1428 TSval=2743144743 TSecr=1205578242 [TCP segment of a reassembled PDU]"
"1036","4.209302","18.160.17.214","192.168.0.92","TCP","1494","443  >  50106 [ACK] Seq=216564 Ack=5702 Win=926 Len=1428 TSval=2743144743 TSecr=1205578242 [TCP segment of a reassembled PDU]"
"1037","4.209303","18.160.17.214","192.168.0.92","TCP","1494","443  >  50106 [PSH, ACK] Seq=217992 Ack=5702 Win=926 Len=1428 TSval=2743144743 TSecr=1205578242 [TCP segment of a reassembled PDU]"
"1038","4.209304","18.160.17.214","192.168.0.92","TCP","1494","443  >  50106 [ACK] Seq=219420 Ack=5702 Win=926 Len=1428 TSval=2743144743 TSecr=1205578242 [TCP segment of a reassembled PDU]"
"1039","4.209543","192.168.0.92","18.160.17.214","TCP","66","50106  >  443 [ACK] Seq=5702 Ack=220848 Win=8183 Len=0 TSval=1205578275 TSecr=2743144743"
"1040","4.210812","18.160.17.214","192.168.0.92","TLSv1.2","1494","Application Data"
"1041","4.210813","18.160.17.214","192.168.0.92","TCP","1494","443  >  50106 [ACK] Seq=222276 Ack=5702 Win=926 Len=1428 TSval=2743144743 TSecr=1205578242 [TCP segment of a reassembled PDU]"
"1042","4.210814","18.160.17.214","192.168.0.92","TCP","1494","443  >  50106 [ACK] Seq=223704 Ack=5702 Win=926 Len=1428 TSval=2743144743 TSecr=1205578242 [TCP segment of a reassembled PDU]"
"1043","4.210815","18.160.17.214","192.168.0.92","TCP","1494","443  >  50106 [ACK] Seq=225132 Ack=5702 Win=926 Len=1428 TSval=2743144743 TSecr=1205578242 [TCP segment of a reassembled PDU]"
"1044","4.210816","18.160.17.214","192.168.0.92","TLSv1.2","574","Application Data"
"1045","4.210816","18.160.17.214","192.168.0.92","TLSv1.2","138","Application Data, Application Data"
"1046","4.210878","192.168.0.92","18.160.17.214","TCP","66","50106  >  443 [ACK] Seq=5702 Ack=227140 Win=8085 Len=0 TSval=1205578276 TSecr=2743144744"
"1047","4.210958","192.168.0.92","18.160.17.214","TCP","66","[TCP Window Update] 50106  >  443 [ACK] Seq=5702 Ack=227140 Win=8183 Len=0 TSval=1205578276 TSecr=2743144744"
"1152","4.552839","192.168.0.92","18.160.17.214","TLSv1.2","1458","Application Data"
"1179","4.589454","18.160.17.214","192.168.0.92","TLSv1.2","1288","Application Data"
"1180","4.589455","18.160.17.214","192.168.0.92","TLSv1.2","97","Application Data"
"1184","4.589549","192.168.0.92","18.160.17.214","TCP","66","50106  >  443 [ACK] Seq=7094 Ack=228393 Win=8164 Len=0 TSval=1205578655 TSecr=2743145121"
"1186","4.594619","192.168.0.92","18.160.17.214","TLSv1.2","378","Application Data"
"1196","4.658067","18.160.17.214","192.168.0.92","TCP","66","443  >  50106 [ACK] Seq=228393 Ack=7406 Win=937 Len=0 TSval=2743145193 TSecr=1205578660"
"1203","4.750582","192.168.0.92","18.160.17.214","TLSv1.2","317","Application Data"
"1204","4.769860","18.160.17.214","192.168.0.92","TCP","66","443  >  50106 [ACK] Seq=228393 Ack=7657 Win=943 Len=0 TSval=2743145303 TSecr=1205578816"
"1205","4.921560","18.160.17.214","192.168.0.92","TCP","1494","443  >  50106 [ACK] Seq=228393 Ack=7657 Win=943 Len=1428 TSval=2743145449 TSecr=1205578816 [TCP segment of a reassembled PDU]"
"1206","4.921562","18.160.17.214","192.168.0.92","TCP","1494","443  >  50106 [ACK] Seq=229821 Ack=7657 Win=943 Len=1428 TSval=2743145449 TSecr=1205578816 [TCP segment of a reassembled PDU]"
"1207","4.921563","18.160.17.214","192.168.0.92","TLSv1.2","1096","Application Data"
"1208","4.921564","18.160.17.214","192.168.0.92","TCP","1494","443  >  50106 [ACK] Seq=232279 Ack=7657 Win=943 Len=1428 TSval=2743145450 TSecr=1205578816 [TCP segment of a reassembled PDU]"
"1209","4.921565","18.160.17.214","192.168.0.92","TLSv1.2","1078","Application Data"
"1210","4.921567","18.160.17.214","192.168.0.92","TLSv1.2","1237","Application Data"
"1211","4.921568","18.160.17.214","192.168.0.92","TLSv1.2","260","Application Data"
"1212","4.921568","18.160.17.214","192.168.0.92","TLSv1.2","1080","Application Data"
"1213","4.921569","18.160.17.214","192.168.0.92","TLSv1.2","497","Application Data"
"1214","4.921570","18.160.17.214","192.168.0.92","TLSv1.2","118","Application Data"
"1215","4.921571","18.160.17.214","192.168.0.92","TLSv1.2","97","Application Data"
"1216","4.921709","192.168.0.92","18.160.17.214","TCP","66","50106  >  443 [ACK] Seq=7657 Ack=237612 Win=8039 Len=0 TSval=1205578987 TSecr=2743145450"
"1217","4.921816","192.168.0.92","18.160.17.214","TCP","66","[TCP Window Update] 50106  >  443 [ACK] Seq=7657 Ack=237612 Win=8183 Len=0 TSval=1205578987 TSecr=2743145450"
"1251","5.385769","18.160.17.214","192.168.0.92","TCP","1494","443  >  50106 [ACK] Seq=237612 Ack=7657 Win=943 Len=1428 TSval=2743145919 TSecr=1205578987 [TCP segment of a reassembled PDU]"
"1252","5.385770","18.160.17.214","192.168.0.92","TCP","1494","443  >  50106 [ACK] Seq=239040 Ack=7657 Win=943 Len=1428 TSval=2743145919 TSecr=1205578987 [TCP segment of a reassembled PDU]"
"1253","5.385771","18.160.17.214","192.168.0.92","TLSv1.2","958","Application Data"
"1254","5.385860","192.168.0.92","18.160.17.214","TCP","66","50106  >  443 [ACK] Seq=7657 Ack=241360 Win=8125 Len=0 TSval=1205579451 TSecr=2743145919"
"1255","5.388019","18.160.17.214","192.168.0.92","TCP","1494","443  >  50106 [ACK] Seq=241360 Ack=7657 Win=943 Len=1428 TSval=2743145921 TSecr=1205578987 [TCP segment of a reassembled PDU]"
"1256","5.388024","18.160.17.214","192.168.0.92","TCP","1494","443  >  50106 [ACK] Seq=242788 Ack=7657 Win=943 Len=1428 TSval=2743145921 TSecr=1205578987 [TCP segment of a reassembled PDU]"
"1257","5.388025","18.160.17.214","192.168.0.92","TCP","1494","443  >  50106 [ACK] Seq=244216 Ack=7657 Win=943 Len=1428 TSval=2743145921 TSecr=1205578987 [TCP segment of a reassembled PDU]"
"1258","5.388027","18.160.17.214","192.168.0.92","TCP","1494","443  >  50106 [ACK] Seq=245644 Ack=7657 Win=943 Len=1428 TSval=2743145921 TSecr=1205578987 [TCP segment of a reassembled PDU]"
"1259","5.388028","18.160.17.214","192.168.0.92","TCP","1494","443  >  50106 [ACK] Seq=247072 Ack=7657 Win=943 Len=1428 TSval=2743145921 TSecr=1205578987 [TCP segment of a reassembled PDU]"
"1260","5.388029","18.160.17.214","192.168.0.92","TCP","1494","443  >  50106 [ACK] Seq=248500 Ack=7657 Win=943 Len=1428 TSval=2743145921 TSecr=1205578987 [TCP segment of a reassembled PDU]"
"1261","5.388030","18.160.17.214","192.168.0.92","TCP","1494","443  >  50106 [ACK] Seq=249928 Ack=7657 Win=943 Len=1428 TSval=2743145921 TSecr=1205578987 [TCP segment of a reassembled PDU]"
"1262","5.388031","18.160.17.214","192.168.0.92","TLSv1.2","413","Application Data"
"1263","5.388032","18.160.17.214","192.168.0.92","TLSv1.2","543","Application Data"
"1264","5.388032","18.160.17.214","192.168.0.92","TLSv1.2","545","Application Data"
"1265","5.388127","192.168.0.92","18.160.17.214","TCP","66","50106  >  443 [ACK] Seq=7657 Ack=252659 Win=7948 Len=0 TSval=1205579453 TSecr=2743145921"
"1266","5.389144","18.160.17.214","192.168.0.92","TLSv1.2","1071","Application Data"
"1267","5.389234","192.168.0.92","18.160.17.214","TCP","66","50106  >  443 [ACK] Seq=7657 Ack=253664 Win=7933 Len=0 TSval=1205579454 TSecr=2743145922"
"1268","5.389440","192.168.0.92","18.160.17.214","TCP","66","[TCP Window Update] 50106  >  443 [ACK] Seq=7657 Ack=253664 Win=8183 Len=0 TSval=1205579454 TSecr=2743145922"
"1269","5.390546","18.160.17.214","192.168.0.92","TCP","1494","443  >  50106 [ACK] Seq=253664 Ack=7657 Win=943 Len=1428 TSval=2743145924 TSecr=1205578987 [TCP segment of a reassembled PDU]"
"1270","5.390548","18.160.17.214","192.168.0.92","TCP","1494","443  >  50106 [ACK] Seq=255092 Ack=7657 Win=943 Len=1428 TSval=2743145924 TSecr=1205578987 [TCP segment of a reassembled PDU]"
"1271","5.390549","18.160.17.214","192.168.0.92","TCP","1494","443  >  50106 [ACK] Seq=256520 Ack=7657 Win=943 Len=1428 TSval=2743145924 TSecr=1205578987 [TCP segment of a reassembled PDU]"
"1272","5.390550","18.160.17.214","192.168.0.92","TCP","1494","443  >  50106 [ACK] Seq=257948 Ack=7657 Win=943 Len=1428 TSval=2743145924 TSecr=1205578987 [TCP segment of a reassembled PDU]"
"1273","5.390551","18.160.17.214","192.168.0.92","TCP","1494","443  >  50106 [ACK] Seq=259376 Ack=7657 Win=943 Len=1428 TSval=2743145924 TSecr=1205578987 [TCP segment of a reassembled PDU]"
"1274","5.390551","18.160.17.214","192.168.0.92","TCP","1494","443  >  50106 [ACK] Seq=260804 Ack=7657 Win=943 Len=1428 TSval=2743145924 TSecr=1205578987 [TCP segment of a reassembled PDU]"
"1275","5.390552","18.160.17.214","192.168.0.92","TCP","1494","443  >  50106 [ACK] Seq=262232 Ack=7657 Win=943 Len=1428 TSval=2743145924 TSecr=1205578987 [TCP segment of a reassembled PDU]"
"1276","5.390554","18.160.17.214","192.168.0.92","TLSv1.2","374","Application Data"
"1277","5.390554","18.160.17.214","192.168.0.92","TCP","1494","443  >  50106 [ACK] Seq=263968 Ack=7657 Win=943 Len=1428 TSval=2743145924 TSecr=1205578987 [TCP segment of a reassembled PDU]"
"1278","5.390555","18.160.17.214","192.168.0.92","TCP","1494","443  >  50106 [ACK] Seq=265396 Ack=7657 Win=943 Len=1428 TSval=2743145924 TSecr=1205578987 [TCP segment of a reassembled PDU]"
"1279","5.390556","18.160.17.214","192.168.0.92","TLSv1.2","448","Application Data"
"1280","5.390557","18.160.17.214","192.168.0.92","TLSv1.2","1206","Application Data"
"1281","5.390636","192.168.0.92","18.160.17.214","TCP","66","50106  >  443 [ACK] Seq=7657 Ack=268346 Win=7954 Len=0 TSval=1205579456 TSecr=2743145924"
"1282","5.390740","192.168.0.92","18.160.17.214","TCP","66","[TCP Window Update] 50106  >  443 [ACK] Seq=7657 Ack=268346 Win=8183 Len=0 TSval=1205579456 TSecr=2743145924"
"1283","5.391832","18.160.17.214","192.168.0.92","TCP","1494","443  >  50106 [ACK] Seq=268346 Ack=7657 Win=943 Len=1428 TSval=2743145926 TSecr=1205578987 [TCP segment of a reassembled PDU]"
"1284","5.391897","192.168.0.92","18.160.17.214","TCP","66","50106  >  443 [ACK] Seq=7657 Ack=269774 Win=8161 Len=0 TSval=1205579457 TSecr=2743145926"
"1285","5.393516","18.160.17.214","192.168.0.92","TLSv1.2","1042","Application Data"
"1286","5.393581","192.168.0.92","18.160.17.214","TCP","66","50106  >  443 [ACK] Seq=7657 Ack=270750 Win=8146 Len=0 TSval=1205579459 TSecr=2743145926"
"1287","5.394802","18.160.17.214","192.168.0.92","TCP","1494","443  >  50106 [ACK] Seq=270750 Ack=7657 Win=943 Len=1428 TSval=2743145927 TSecr=1205578987 [TCP segment of a reassembled PDU]"
"1288","5.394803","18.160.17.214","192.168.0.92","TLSv1.2","1155","Application Data"
"1289","5.394804","18.160.17.214","192.168.0.92","TLSv1.2","617","Application Data"
"1290","5.394805","18.160.17.214","192.168.0.92","TLSv1.2","97","Application Data"
"1291","5.394897","192.168.0.92","18.160.17.214","TCP","66","50106  >  443 [ACK] Seq=7657 Ack=273849 Win=8135 Len=0 TSval=1205579460 TSecr=2743145927"
"1292","5.394961","192.168.0.92","18.160.17.214","TCP","66","[TCP Window Update] 50106  >  443 [ACK] Seq=7657 Ack=273849 Win=8183 Len=0 TSval=1205579460 TSecr=2743145927"
