"No.","Time","Source","Destination","Protocol","Length","Info"
"124","1.388416","13.32.208.51","192.168.0.92","TCP","1494","443  >  57522 [ACK] Seq=1429 Ack=518 Win=67072 Len=1428 TSval=3228050535 TSecr=3920818729 [TCP segment of a reassembled PDU]"
"125","1.388417","13.32.208.51","192.168.0.92","TCP","1494","443  >  57522 [ACK] Seq=2857 Ack=518 Win=67072 Len=1428 TSval=3228050535 TSecr=3920818729 [TCP segment of a reassembled PDU]"
"126","1.388418","13.32.208.51","192.168.0.92","TCP","1494","443  >  57522 [PSH, ACK] Seq=4285 Ack=518 Win=67072 Len=1428 TSval=3228050535 TSecr=3920818729 [TCP segment of a reassembled PDU]"
"127","1.388418","13.32.208.51","192.168.0.92","TLSv1.3","584","Application Data, Application Data, Application Data"
"128","1.388472","192.168.0.92","13.32.208.51","TCP","66","57522  >  443 [ACK] Seq=518 Ack=6231 Win=125120 Len=0 TSval=3920818750 TSecr=3228050537"
"129","1.388488","192.168.0.92","13.32.208.51","TLSv1.3","1214","Application Data"
"130","1.388540","192.168.0.92","13.32.208.51","TCP","66","[TCP Window Update] 57522  >  443 [ACK] Seq=518 Ack=6231 Win=131072 Len=0 TSval=3920818750 TSecr=3228050537"
"131","1.391142","192.168.0.92","13.32.208.51","TLSv1.3","130","Change Cipher Spec, Application Data"
"132","1.391372","13.32.208.51","192.168.0.92","TCP","66","443  >  57520 [ACK] Seq=6231 Ack=582 Win=67072 Len=0 TSval=2080704703 TSecr=850193316"
"133","1.391373","13.32.208.51","192.168.0.92","TLSv1.3","212","Application Data"
"134","1.391438","192.168.0.92","13.32.208.51","TCP","66","57520  >  443 [ACK] Seq=1334 Ack=6377 Win=130880 Len=0 TSval=850193337 TSecr=2080704703"
"135","1.391808","192.168.0.92","13.32.208.51","TLSv1.3","952","Application Data"
"136","1.392991","52.21.30.220","192.168.0.92","TLSv1.2","261","Application Data"
"137","1.393035","192.168.0.92","52.21.30.220","TCP","66","57469  >  443 [ACK] Seq=14052 Ack=3705 Win=2044 Len=0 TSval=1476652135 TSecr=253638386"
"138","1.393109","52.21.30.220","192.168.0.92","TCP","66","443  >  57469 [ACK] Seq=3705 Ack=14052 Win=425 Len=0 TSval=253638387 TSecr=1476652112"
"139","1.394229","52.21.30.220","192.168.0.92","TLSv1.2","261","Application Data"
"140","1.394251","192.168.0.92","52.21.30.220","TCP","66","57469  >  443 [ACK] Seq=14052 Ack=3900 Win=2044 Len=0 TSval=1476652136 TSecr=253638389"
"141","1.396078","52.21.30.220","192.168.0.92","TLSv1.2","261","Application Data"
"142","1.396144","192.168.0.92","52.21.30.220","TCP","66","57469  >  443 [ACK] Seq=14052 Ack=4095 Win=2048 Len=0 TSval=1476652138 TSecr=253638390"
"143","1.404176","192.168.0.92","54.221.47.239","TLSv1.2","320","Application Data"
"144","1.409922","18.67.76.75","192.168.0.92","TCP","66","443  >  57523 [ACK] Seq=1 Ack=518 Win=67072 Len=0 TSval=1737498034 TSecr=4052275115"
"145","1.409923","13.32.208.51","192.168.0.92","TCP","66","443  >  57521 [ACK] Seq=6231 Ack=582 Win=67072 Len=0 TSval=3369878480 TSecr=2995193286"
"146","1.409924","13.32.208.51","192.168.0.92","TLSv1.3","212","Application Data"
"147","1.409924","18.67.76.75","192.168.0.92","TLSv1.3","1494","Server Hello, Change Cipher Spec, Application Data"
"148","1.409925","18.67.76.75","192.168.0.92","TCP","1494","443  >  57523 [ACK] Seq=1429 Ack=518 Win=67072 Len=1428 TSval=1737498034 TSecr=4052275115 [TCP segment of a reassembled PDU]"
"149","1.409926","18.67.76.75","192.168.0.92","TCP","1494","443  >  57523 [PSH, ACK] Seq=2857 Ack=518 Win=67072 Len=1428 TSval=1737498034 TSecr=4052275115 [TCP segment of a reassembled PDU]"
"150","1.410040","192.168.0.92","18.67.76.75","TCP","66","57523  >  443 [ACK] Seq=518 Ack=4285 Win=127040 Len=0 TSval=4052275142 TSecr=1737498034"
"151","1.410082","192.168.0.92","13.32.208.51","TCP","66","57521  >  443 [ACK] Seq=1730 Ack=6377 Win=130880 Len=0 TSval=2995193308 TSecr=3369878481"
"152","1.410138","192.168.0.92","18.67.76.75","TCP","66","[TCP Window Update] 57523  >  443 [ACK] Seq=518 Ack=4285 Win=131072 Len=0 TSval=4052275142 TSecr=1737498034"
"153","1.411320","18.67.76.75","192.168.0.92","TLSv1.3","830","Application Data, Application Data, Application Data"
"154","1.411354","192.168.0.92","18.67.76.75","TCP","66","57523  >  443 [ACK] Seq=518 Ack=5049 Win=130304 Len=0 TSval=4052275144 TSecr=1737498036"
"155","1.414817","192.168.0.92","18.67.76.75","TLSv1.3","130","Change Cipher Spec, Application Data"
"156","1.415434","192.168.0.92","18.67.76.75","TLSv1.3","1007","Application Data"
"157","1.417810","13.32.208.51","192.168.0.92","TCP","66","443  >  57522 [ACK] Seq=6231 Ack=1468 Win=68608 Len=0 TSval=3228050565 TSecr=3920818753"
"158","1.417811","13.32.208.51","192.168.0.92","TLSv1.3","212","Application Data"
"159","1.417914","192.168.0.92","13.32.208.51","TCP","66","57522  >  443 [ACK] Seq=1468 Ack=6377 Win=130880 Len=0 TSval=3920818780 TSecr=3228050565"
"160","1.424589","13.32.208.51","192.168.0.92","TLSv1.3","979","Application Data"
"161","1.424666","192.168.0.92","13.32.208.51","TCP","66","57522  >  443 [ACK] Seq=1468 Ack=7290 Win=130112 Len=0 TSval=3920818787 TSecr=3228050572"
"162","1.425920","192.168.0.92","13.32.208.51","TCP","1494","57522  >  443 [ACK] Seq=1468 Ack=7290 Win=131072 Len=1428 TSval=3920818788 TSecr=3228050572 [TCP segment of a reassembled PDU]"
"163","1.425935","192.168.0.92","13.32.208.51","TLSv1.3","922","Application Data"
"164","1.426038","54.221.47.239","192.168.0.92","TLSv1.2","386","Application Data"
"165","1.426039","54.221.47.239","192.168.0.92","TLSv1.2","104","Application Data"
"166","1.426122","192.168.0.92","54.221.47.239","TCP","66","57517  >  443 [ACK] Seq=255 Ack=359 Win=2042 Len=0 TSval=1682527376 TSecr=446441858"
"167","1.427906","13.32.208.51","192.168.0.92","TLSv1.3","980","Application Data"
"168","1.427976","192.168.0.92","13.32.208.51","TCP","66","57521  >  443 [ACK] Seq=1730 Ack=7291 Win=130112 Len=0 TSval=2995193326 TSecr=3369878498"
"169","1.428918","192.168.0.92","13.32.208.51","TCP","1494","57521  >  443 [ACK] Seq=1730 Ack=7291 Win=131072 Len=1428 TSval=2995193326 TSecr=3369878498 [TCP segment of a reassembled PDU]"
"170","1.428931","192.168.0.92","13.32.208.51","TLSv1.3","1184","Application Data"
"171","1.432229","18.67.76.75","192.168.0.92","TCP","66","443  >  57523 [ACK] Seq=5049 Ack=582 Win=67072 Len=0 TSval=1737498056 TSecr=4052275147"
"172","1.432230","18.67.76.75","192.168.0.92","TLSv1.3","212","Application Data"
"173","1.432324","192.168.0.92","18.67.76.75","TCP","66","57523  >  443 [ACK] Seq=1523 Ack=5195 Win=130880 Len=0 TSval=4052275165 TSecr=1737498056"
"174","1.435693","13.32.208.51","192.168.0.92","TCP","66","443  >  57520 [ACK] Seq=6377 Ack=1334 Win=68608 Len=0 TSval=2080704746 TSecr=850193316"
"175","1.441327","18.67.76.75","192.168.0.92","TCP","1494","443  >  57523 [ACK] Seq=5195 Ack=1523 Win=69632 Len=1428 TSval=1737498065 TSecr=4052275147 [TCP segment of a reassembled PDU]"
"176","1.441329","18.67.76.75","192.168.0.92","TCP","1494","443  >  57523 [ACK] Seq=6623 Ack=1523 Win=69632 Len=1428 TSval=1737498065 TSecr=4052275147 [TCP segment of a reassembled PDU]"
"177","1.441330","18.67.76.75","192.168.0.92","TCP","1494","443  >  57523 [PSH, ACK] Seq=8051 Ack=1523 Win=69632 Len=1428 TSval=1737498065 TSecr=4052275147 [TCP segment of a reassembled PDU]"
"178","1.441331","18.67.76.75","192.168.0.92","TCP","1494","443  >  57523 [ACK] Seq=9479 Ack=1523 Win=69632 Len=1428 TSval=1737498065 TSecr=4052275147 [TCP segment of a reassembled PDU]"
"179","1.441333","18.67.76.75","192.168.0.92","TCP","1494","443  >  57523 [ACK] Seq=10907 Ack=1523 Win=69632 Len=1428 TSval=1737498065 TSecr=4052275147 [TCP segment of a reassembled PDU]"
"180","1.441449","192.168.0.92","18.67.76.75","TCP","66","57523  >  443 [ACK] Seq=1523 Ack=12335 Win=123904 Len=0 TSval=4052275174 TSecr=1737498065"
"181","1.441539","192.168.0.92","18.67.76.75","TCP","66","[TCP Window Update] 57523  >  443 [ACK] Seq=1523 Ack=12335 Win=131072 Len=0 TSval=4052275174 TSecr=1737498065"
"182","1.443519","18.67.76.75","192.168.0.92","TCP","1494","443  >  57523 [PSH, ACK] Seq=12335 Ack=1523 Win=69632 Len=1428 TSval=1737498065 TSecr=4052275147 [TCP segment of a reassembled PDU]"
"183","1.443521","18.67.76.75","192.168.0.92","TCP","1494","443  >  57523 [ACK] Seq=13763 Ack=1523 Win=69632 Len=1428 TSval=1737498066 TSecr=4052275147 [TCP segment of a reassembled PDU]"
"184","1.443522","18.67.76.75","192.168.0.92","TCP","1494","[TCP Previous segment not captured] 443  >  57523 [ACK] Seq=18047 Ack=1523 Win=69632 Len=1428 TSval=1737498067 TSecr=4052275147 [TCP segment of a reassembled PDU]"
"185","1.443523","18.67.76.75","192.168.0.92","TCP","1494","443  >  57523 [PSH, ACK] Seq=19475 Ack=1523 Win=69632 Len=1428 TSval=1737498067 TSecr=4052275147 [TCP segment of a reassembled PDU]"
"186","1.443524","18.67.76.75","192.168.0.92","TCP","1494","443  >  57523 [ACK] Seq=20903 Ack=1523 Win=69632 Len=1428 TSval=1737498068 TSecr=4052275147 [TCP segment of a reassembled PDU]"
"187","1.443525","18.67.76.75","192.168.0.92","TCP","1494","[TCP Out-Of-Order] 443  >  57523 [ACK] Seq=15191 Ack=1523 Win=69632 Len=1428 TSval=1737498066 TSecr=4052275147 [TCP segment of a reassembled PDU]"
"188","1.443526","18.67.76.75","192.168.0.92","TCP","1494","[TCP Out-Of-Order] 443  >  57523 [PSH, ACK] Seq=16619 Ack=1523 Win=69632 Len=1428 TSval=1737498066 TSecr=4052275147"
"189","1.443528","18.67.76.75","192.168.0.92","TCP","1494","443  >  57523 [ACK] Seq=22331 Ack=1523 Win=69632 Len=1428 TSval=1737498068 TSecr=4052275147 [TCP segment of a reassembled PDU]"
"190","1.443529","18.67.76.75","192.168.0.92","TCP","1494","443  >  57523 [PSH, ACK] Seq=23759 Ack=1523 Win=69632 Len=1428 TSval=1737498068 TSecr=4052275147 [TCP segment of a reassembled PDU]"
"191","1.443530","18.67.76.75","192.168.0.92","TCP","1494","443  >  57523 [ACK] Seq=25187 Ack=1523 Win=69632 Len=1428 TSval=1737498069 TSecr=4052275147 [TCP segment of a reassembled PDU]"
"192","1.443531","18.67.76.75","192.168.0.92","TCP","1494","443  >  57523 [ACK] Seq=26615 Ack=1523 Win=69632 Len=1428 TSval=1737498069 TSecr=4052275147 [TCP segment of a reassembled PDU]"
"193","1.443534","18.67.76.75","192.168.0.92","TCP","1494","443  >  57523 [PSH, ACK] Seq=28043 Ack=1523 Win=69632 Len=1428 TSval=1737498069 TSecr=4052275147 [TCP segment of a reassembled PDU]"
"194","1.443535","18.67.76.75","192.168.0.92","TCP","1494","443  >  57523 [ACK] Seq=29471 Ack=1523 Win=69632 Len=1428 TSval=1737498070 TSecr=4052275147 [TCP segment of a reassembled PDU]"
"195","1.443616","192.168.0.92","18.67.76.75","TCP","66","57523  >  443 [ACK] Seq=1523 Ack=15191 Win=128192 Len=0 TSval=4052275176 TSecr=1737498066"
"196","1.443682","192.168.0.92","18.67.76.75","TCP","78","[TCP Dup ACK 195#1] 57523  >  443 [ACK] Seq=1523 Ack=15191 Win=128192 Len=0 TSval=4052275176 TSecr=1737498066 SLE=18047 SRE=22331"
"197","1.443702","192.168.0.92","18.67.76.75","TCP","78","[TCP Window Update] 57523  >  443 [ACK] Seq=1523 Ack=15191 Win=131072 Len=0 TSval=4052275176 TSecr=1737498066 SLE=18047 SRE=22331"
"198","1.443728","192.168.0.92","18.67.76.75","TCP","66","57523  >  443 [ACK] Seq=1523 Ack=22331 Win=123904 Len=0 TSval=4052275176 TSecr=1737498066"
"199","1.443756","192.168.0.92","18.67.76.75","TCP","66","57523  >  443 [ACK] Seq=1523 Ack=30899 Win=115328 Len=0 TSval=4052275176 TSecr=1737498070"
"200","1.443778","192.168.0.92","18.67.76.75","TCP","66","[TCP Window Update] 57523  >  443 [ACK] Seq=1523 Ack=30899 Win=131072 Len=0 TSval=4052275176 TSecr=1737498070"
"201","1.444718","18.67.76.75","192.168.0.92","TCP","1494","443  >  57523 [ACK] Seq=30899 Ack=1523 Win=69632 Len=1428 TSval=1737498070 TSecr=4052275147 [TCP segment of a reassembled PDU]"
"202","1.444719","18.67.76.75","192.168.0.92","TCP","1494","443  >  57523 [PSH, ACK] Seq=32327 Ack=1523 Win=69632 Len=1428 TSval=1737498070 TSecr=4052275147 [TCP segment of a reassembled PDU]"
"203","1.444720","18.67.76.75","192.168.0.92","TCP","1494","443  >  57523 [ACK] Seq=33755 Ack=1523 Win=69632 Len=1428 TSval=1737498070 TSecr=4052275147 [TCP segment of a reassembled PDU]"
"204","1.444721","18.67.76.75","192.168.0.92","TCP","1494","443  >  57523 [ACK] Seq=35183 Ack=1523 Win=69632 Len=1428 TSval=1737498070 TSecr=4052275147 [TCP segment of a reassembled PDU]"
"205","1.444794","192.168.0.92","18.67.76.75","TCP","66","57523  >  443 [ACK] Seq=1523 Ack=36611 Win=125312 Len=0 TSval=4052275177 TSecr=1737498070"
"206","1.444831","192.168.0.92","18.67.76.75","TCP","66","[TCP Window Update] 57523  >  443 [ACK] Seq=1523 Ack=36611 Win=131072 Len=0 TSval=4052275177 TSecr=1737498070"
"207","1.446615","18.67.76.75","192.168.0.92","TLSv1.3","1494","Application Data"
"208","1.446616","18.67.76.75","192.168.0.92","TCP","1494","443  >  57523 [ACK] Seq=38039 Ack=1523 Win=69632 Len=1428 TSval=1737498071 TSecr=4052275147 [TCP segment of a reassembled PDU]"
"209","1.446617","18.67.76.75","192.168.0.92","TCP","1494","443  >  57523 [ACK] Seq=39467 Ack=1523 Win=69632 Len=1428 TSval=1737498071 TSecr=4052275147 [TCP segment of a reassembled PDU]"
"210","1.446619","18.67.76.75","192.168.0.92","TCP","1494","443  >  57523 [PSH, ACK] Seq=40895 Ack=1523 Win=69632 Len=1428 TSval=1737498071 TSecr=4052275147 [TCP segment of a reassembled PDU]"
"211","1.446684","192.168.0.92","18.67.76.75","TCP","66","57523  >  443 [ACK] Seq=1523 Ack=42323 Win=125312 Len=0 TSval=4052275179 TSecr=1737498071"
"212","1.446717","192.168.0.92","18.67.76.75","TCP","66","[TCP Window Update] 57523  >  443 [ACK] Seq=1523 Ack=42323 Win=131072 Len=0 TSval=4052275179 TSecr=1737498071"
"213","1.452617","18.67.76.75","192.168.0.92","TCP","1494","443  >  57523 [ACK] Seq=42323 Ack=1523 Win=69632 Len=1428 TSval=1737498078 TSecr=4052275165 [TCP segment of a reassembled PDU]"
"214","1.452619","18.67.76.75","192.168.0.92","TCP","1494","443  >  57523 [ACK] Seq=43751 Ack=1523 Win=69632 Len=1428 TSval=1737498078 TSecr=4052275165 [TCP segment of a reassembled PDU]"
"215","1.452620","18.67.76.75","192.168.0.92","TCP","1494","443  >  57523 [PSH, ACK] Seq=45179 Ack=1523 Win=69632 Len=1428 TSval=1737498078 TSecr=4052275165 [TCP segment of a reassembled PDU]"
"216","1.452731","192.168.0.92","18.67.76.75","TCP","66","57523  >  443 [ACK] Seq=1523 Ack=46607 Win=161024 Len=0 TSval=4052275185 TSecr=1737498078"
"217","1.452820","192.168.0.92","18.67.76.75","TCP","66","[TCP Window Update] 57523  >  443 [ACK] Seq=1523 Ack=46607 Win=165312 Len=0 TSval=4052275185 TSecr=1737498078"
"218","1.454145","13.32.208.51","192.168.0.92","TCP","66","443  >  57522 [ACK] Seq=7290 Ack=3752 Win=74240 Len=0 TSval=3228050601 TSecr=3920818788"
"219","1.454145","13.32.208.51","192.168.0.92","TCP","66","443  >  57521 [ACK] Seq=7291 Ack=4276 Win=74752 Len=0 TSval=3369878524 TSecr=2995193326"
"220","1.462172","13.32.208.51","192.168.0.92","TLSv1.3","1030","Application Data"
"221","1.462174","18.67.76.75","192.168.0.92","TCP","1494","443  >  57523 [ACK] Seq=46607 Ack=1523 Win=69632 Len=1428 TSval=1737498088 TSecr=4052275174 [TCP segment of a reassembled PDU]"
"222","1.462175","18.67.76.75","192.168.0.92","TCP","1494","443  >  57523 [ACK] Seq=48035 Ack=1523 Win=69632 Len=1428 TSval=1737498088 TSecr=4052275174 [TCP segment of a reassembled PDU]"
"223","1.462177","18.67.76.75","192.168.0.92","TCP","1494","443  >  57523 [PSH, ACK] Seq=49463 Ack=1523 Win=69632 Len=1428 TSval=1737498088 TSecr=4052275174 [TCP segment of a reassembled PDU]"
"224","1.462178","18.67.76.75","192.168.0.92","TCP","1494","443  >  57523 [ACK] Seq=50891 Ack=1523 Win=69632 Len=1428 TSval=1737498088 TSecr=4052275174 [TCP segment of a reassembled PDU]"
"225","1.462279","192.168.0.92","13.32.208.51","TCP","66","57520  >  443 [ACK] Seq=1334 Ack=7341 Win=130048 Len=0 TSval=850193408 TSecr=2080704774"
"226","1.462350","192.168.0.92","18.67.76.75","TCP","66","57523  >  443 [ACK] Seq=1523 Ack=52319 Win=159616 Len=0 TSval=4052275194 TSecr=1737498088"
"227","1.462488","192.168.0.92","18.67.76.75","TCP","66","[TCP Window Update] 57523  >  443 [ACK] Seq=1523 Ack=52319 Win=165312 Len=0 TSval=4052275194 TSecr=1737498088"
"228","1.463390","18.67.76.75","192.168.0.92","TCP","1494","443  >  57523 [ACK] Seq=52319 Ack=1523 Win=69632 Len=1428 TSval=1737498088 TSecr=4052275174 [TCP segment of a reassembled PDU]"
"229","1.463391","18.67.76.75","192.168.0.92","TLSv1.3","1494","Application Data"
"230","1.463392","18.67.76.75","192.168.0.92","TCP","1494","443  >  57523 [ACK] Seq=55175 Ack=1523 Win=69632 Len=1428 TSval=1737498089 TSecr=4052275176 [TCP segment of a reassembled PDU]"
"231","1.463394","18.67.76.75","192.168.0.92","TCP","1494","443  >  57523 [ACK] Seq=56603 Ack=1523 Win=69632 Len=1428 TSval=1737498089 TSecr=4052275176 [TCP segment of a reassembled PDU]"
"232","1.463394","18.67.76.75","192.168.0.92","TCP","1494","443  >  57523 [PSH, ACK] Seq=58031 Ack=1523 Win=69632 Len=1428 TSval=1737498089 TSecr=4052275176 [TCP segment of a reassembled PDU]"
"233","1.463440","192.168.0.92","18.67.76.75","TCP","66","57523  >  443 [ACK] Seq=1523 Ack=59459 Win=158144 Len=0 TSval=4052275196 TSecr=1737498089"
"234","1.463480","192.168.0.92","13.32.208.51","TCP","1494","57520  >  443 [ACK] Seq=1334 Ack=7341 Win=131072 Len=1428 TSval=850193410 TSecr=2080704774 [TCP segment of a reassembled PDU]"
"235","1.463487","192.168.0.92","13.32.208.51","TLSv1.3","866","Application Data"
"236","1.463533","192.168.0.92","18.67.76.75","TCP","66","[TCP Window Update] 57523  >  443 [ACK] Seq=1523 Ack=59459 Win=165312 Len=0 TSval=4052275196 TSecr=1737498089"
"237","1.463687","192.168.0.92","13.32.208.51","TCP","1494","57520  >  443 [ACK] Seq=3562 Ack=7341 Win=131072 Len=1428 TSval=850193410 TSecr=2080704774 [TCP segment of a reassembled PDU]"
"238","1.463691","192.168.0.92","13.32.208.51","TLSv1.3","274","Application Data"
"239","1.464662","18.67.76.75","192.168.0.92","TCP","1494","443  >  57523 [ACK] Seq=59459 Ack=1523 Win=69632 Len=1428 TSval=1737498090 TSecr=4052275176 [TCP segment of a reassembled PDU]"
"240","1.464663","18.67.76.75","192.168.0.92","TCP","1494","443  >  57523 [ACK] Seq=60887 Ack=1523 Win=69632 Len=1428 TSval=1737498090 TSecr=4052275176 [TCP segment of a reassembled PDU]"
"241","1.464664","18.67.76.75","192.168.0.92","TCP","1494","443  >  57523 [PSH, ACK] Seq=62315 Ack=1523 Win=69632 Len=1428 TSval=1737498090 TSecr=4052275176 [TCP segment of a reassembled PDU]"
"242","1.464712","192.168.0.92","18.67.76.75","TCP","66","57523  >  443 [ACK] Seq=1523 Ack=63743 Win=161024 Len=0 TSval=4052275197 TSecr=1737498090"
"243","1.464766","192.168.0.92","18.67.76.75","TCP","66","[TCP Window Update] 57523  >  443 [ACK] Seq=1523 Ack=63743 Win=165312 Len=0 TSval=4052275197 TSecr=1737498090"
"244","1.464959","18.67.76.75","192.168.0.92","TCP","1494","443  >  57523 [ACK] Seq=63743 Ack=1523 Win=69632 Len=1428 TSval=1737498091 TSecr=4052275176 [TCP segment of a reassembled PDU]"
"245","1.465012","192.168.0.92","18.67.76.75","TCP","66","57523  >  443 [ACK] Seq=1523 Ack=65171 Win=163904 Len=0 TSval=4052275197 TSecr=1737498091"
"246","1.466577","18.67.76.75","192.168.0.92","TCP","1494","443  >  57523 [ACK] Seq=65171 Ack=1523 Win=69632 Len=1428 TSval=1737498091 TSecr=4052275176 [TCP segment of a reassembled PDU]"
"247","1.466579","18.67.76.75","192.168.0.92","TCP","1494","443  >  57523 [PSH, ACK] Seq=66599 Ack=1523 Win=69632 Len=1428 TSval=1737498091 TSecr=4052275176 [TCP segment of a reassembled PDU]"
"248","1.466580","18.67.76.75","192.168.0.92","TCP","1494","443  >  57523 [ACK] Seq=68027 Ack=1523 Win=69632 Len=1428 TSval=1737498092 TSecr=4052275176 [TCP segment of a reassembled PDU]"
"249","1.466629","192.168.0.92","18.67.76.75","TCP","66","57523  >  443 [ACK] Seq=1523 Ack=69455 Win=161024 Len=0 TSval=4052275199 TSecr=1737498092"
"250","1.466686","192.168.0.92","18.67.76.75","TCP","66","[TCP Window Update] 57523  >  443 [ACK] Seq=1523 Ack=69455 Win=165312 Len=0 TSval=4052275199 TSecr=1737498092"
"251","1.469262","18.67.76.75","192.168.0.92","TLSv1.3","1494","Application Data"
"252","1.469264","18.67.76.75","192.168.0.92","TCP","1494","443  >  57523 [PSH, ACK] Seq=70883 Ack=1523 Win=69632 Len=1428 TSval=1737498092 TSecr=4052275176 [TCP segment of a reassembled PDU]"
"253","1.469265","18.67.76.75","192.168.0.92","TCP","1494","443  >  57523 [ACK] Seq=72311 Ack=1523 Win=69632 Len=1428 TSval=1737498093 TSecr=4052275176 [TCP segment of a reassembled PDU]"
"254","1.469266","18.67.76.75","192.168.0.92","TCP","1494","443  >  57523 [ACK] Seq=73739 Ack=1523 Win=69632 Len=1428 TSval=1737498093 TSecr=4052275176 [TCP segment of a reassembled PDU]"
"255","1.469268","18.67.76.75","192.168.0.92","TCP","1494","443  >  57523 [PSH, ACK] Seq=75167 Ack=1523 Win=69632 Len=1428 TSval=1737498093 TSecr=4052275176 [TCP segment of a reassembled PDU]"
"256","1.469269","18.67.76.75","192.168.0.92","TCP","1494","443  >  57523 [ACK] Seq=76595 Ack=1523 Win=69632 Len=1428 TSval=1737498094 TSecr=4052275176 [TCP segment of a reassembled PDU]"
"257","1.469270","18.67.76.75","192.168.0.92","TCP","1494","443  >  57523 [ACK] Seq=78023 Ack=1523 Win=69632 Len=1428 TSval=1737498094 TSecr=4052275176 [TCP segment of a reassembled PDU]"
"258","1.469271","18.67.76.75","192.168.0.92","TCP","1494","443  >  57523 [PSH, ACK] Seq=79451 Ack=1523 Win=69632 Len=1428 TSval=1737498094 TSecr=4052275176 [TCP segment of a reassembled PDU]"
"259","1.469272","18.67.76.75","192.168.0.92","TCP","1494","443  >  57523 [ACK] Seq=80879 Ack=1523 Win=69632 Len=1428 TSval=1737498094 TSecr=4052275176 [TCP segment of a reassembled PDU]"
"260","1.469273","18.67.76.75","192.168.0.92","TCP","1494","443  >  57523 [ACK] Seq=82307 Ack=1523 Win=69632 Len=1428 TSval=1737498094 TSecr=4052275176 [TCP segment of a reassembled PDU]"
"261","1.469274","18.67.76.75","192.168.0.92","TCP","1494","443  >  57523 [PSH, ACK] Seq=83735 Ack=1523 Win=69632 Len=1428 TSval=1737498094 TSecr=4052275176 [TCP segment of a reassembled PDU]"
"262","1.469340","192.168.0.92","18.67.76.75","TCP","66","57523  >  443 [ACK] Seq=1523 Ack=85163 Win=149632 Len=0 TSval=4052275202 TSecr=1737498094"
"263","1.469408","192.168.0.92","18.67.76.75","TCP","66","[TCP Window Update] 57523  >  443 [ACK] Seq=1523 Ack=85163 Win=165312 Len=0 TSval=4052275202 TSecr=1737498094"
"264","1.470611","18.67.76.75","192.168.0.92","TCP","1494","443  >  57523 [ACK] Seq=85163 Ack=1523 Win=69632 Len=1428 TSval=1737498095 TSecr=4052275176 [TCP segment of a reassembled PDU]"
"265","1.470612","18.67.76.75","192.168.0.92","TLSv1.3","1494","Application Data"
"266","1.470613","18.67.76.75","192.168.0.92","TCP","1494","443  >  57523 [PSH, ACK] Seq=88019 Ack=1523 Win=69632 Len=1428 TSval=1737498095 TSecr=4052275176 [TCP segment of a reassembled PDU]"
"267","1.470614","18.67.76.75","192.168.0.92","TCP","1494","443  >  57523 [ACK] Seq=89447 Ack=1523 Win=69632 Len=1428 TSval=1737498096 TSecr=4052275185 [TCP segment of a reassembled PDU]"
"268","1.470916","192.168.0.92","18.67.76.75","TCP","66","57523  >  443 [ACK] Seq=1523 Ack=90875 Win=165312 Len=0 TSval=4052275203 TSecr=1737498096"
"269","1.472247","18.67.76.75","192.168.0.92","TCP","1494","443  >  57523 [ACK] Seq=90875 Ack=1523 Win=69632 Len=1428 TSval=1737498096 TSecr=4052275185 [TCP segment of a reassembled PDU]"
"270","1.472249","18.67.76.75","192.168.0.92","TCP","1494","443  >  57523 [PSH, ACK] Seq=92303 Ack=1523 Win=69632 Len=1428 TSval=1737498096 TSecr=4052275185 [TCP segment of a reassembled PDU]"
"271","1.472250","18.67.76.75","192.168.0.92","TCP","1494","443  >  57523 [ACK] Seq=93731 Ack=1523 Win=69632 Len=1428 TSval=1737498097 TSecr=4052275185 [TCP segment of a reassembled PDU]"
"272","1.472251","18.67.76.75","192.168.0.92","TCP","1494","443  >  57523 [ACK] Seq=95159 Ack=1523 Win=69632 Len=1428 TSval=1737498097 TSecr=4052275185 [TCP segment of a reassembled PDU]"
"273","1.472252","18.67.76.75","192.168.0.92","TCP","1494","443  >  57523 [PSH, ACK] Seq=96587 Ack=1523 Win=69632 Len=1428 TSval=1737498097 TSecr=4052275185 [TCP segment of a reassembled PDU]"
"274","1.472253","18.67.76.75","192.168.0.92","TCP","1494","443  >  57523 [ACK] Seq=98015 Ack=1523 Win=69632 Len=1428 TSval=1737498098 TSecr=4052275185 [TCP segment of a reassembled PDU]"
"275","1.472254","18.67.76.75","192.168.0.92","TCP","1494","443  >  57523 [ACK] Seq=99443 Ack=1523 Win=69632 Len=1428 TSval=1737498098 TSecr=4052275185 [TCP segment of a reassembled PDU]"
"276","1.472255","18.67.76.75","192.168.0.92","TCP","1494","443  >  57523 [PSH, ACK] Seq=100871 Ack=1523 Win=69632 Len=1428 TSval=1737498098 TSecr=4052275185 [TCP segment of a reassembled PDU]"
"277","1.472342","192.168.0.92","18.67.76.75","TCP","66","57523  >  443 [ACK] Seq=1523 Ack=102299 Win=153920 Len=0 TSval=4052275205 TSecr=1737498098"
"278","1.472405","192.168.0.92","18.67.76.75","TCP","66","[TCP Window Update] 57523  >  443 [ACK] Seq=1523 Ack=102299 Win=165312 Len=0 TSval=4052275205 TSecr=1737498098"
"279","1.473399","18.67.76.75","192.168.0.92","TLSv1.3","1494","Application Data"
"280","1.473401","18.67.76.75","192.168.0.92","TCP","1494","443  >  57523 [ACK] Seq=103727 Ack=1523 Win=69632 Len=1428 TSval=1737498099 TSecr=4052275185 [TCP segment of a reassembled PDU]"
"281","1.473402","18.67.76.75","192.168.0.92","TCP","1494","443  >  57523 [PSH, ACK] Seq=105155 Ack=1523 Win=69632 Len=1428 TSval=1737498099 TSecr=4052275185 [TCP segment of a reassembled PDU]"
"282","1.473403","18.67.76.75","192.168.0.92","TCP","1494","443  >  57523 [ACK] Seq=106583 Ack=1523 Win=69632 Len=1428 TSval=1737498099 TSecr=4052275185 [TCP segment of a reassembled PDU]"
"283","1.473457","192.168.0.92","18.67.76.75","TCP","66","57523  >  443 [ACK] Seq=1523 Ack=108011 Win=159616 Len=0 TSval=4052275206 TSecr=1737498099"
"284","1.473514","192.168.0.92","18.67.76.75","TCP","66","[TCP Window Update] 57523  >  443 [ACK] Seq=1523 Ack=108011 Win=165312 Len=0 TSval=4052275206 TSecr=1737498099"
"285","1.474538","18.67.76.75","192.168.0.92","TCP","1494","443  >  57523 [ACK] Seq=108011 Ack=1523 Win=69632 Len=1428 TSval=1737498099 TSecr=4052275185 [TCP segment of a reassembled PDU]"
"286","1.474539","18.67.76.75","192.168.0.92","TCP","1494","443  >  57523 [PSH, ACK] Seq=109439 Ack=1523 Win=69632 Len=1428 TSval=1737498099 TSecr=4052275185 [TCP segment of a reassembled PDU]"
"287","1.474589","192.168.0.92","18.67.76.75","TCP","66","57523  >  443 [ACK] Seq=1523 Ack=110867 Win=162432 Len=0 TSval=4052275207 TSecr=1737498099"
"288","1.474651","192.168.0.92","18.67.76.75","TCP","66","[TCP Window Update] 57523  >  443 [ACK] Seq=1523 Ack=110867 Win=165312 Len=0 TSval=4052275207 TSecr=1737498099"
"289","1.476427","18.67.76.75","192.168.0.92","TCP","1494","443  >  57523 [ACK] Seq=110867 Ack=1523 Win=69632 Len=1428 TSval=1737498100 TSecr=4052275185 [TCP segment of a reassembled PDU]"
"290","1.476428","18.67.76.75","192.168.0.92","TCP","1494","443  >  57523 [ACK] Seq=112295 Ack=1523 Win=69632 Len=1428 TSval=1737498100 TSecr=4052275185 [TCP segment of a reassembled PDU]"
"291","1.476429","18.67.76.75","192.168.0.92","TCP","1494","443  >  57523 [PSH, ACK] Seq=113723 Ack=1523 Win=69632 Len=1428 TSval=1737498100 TSecr=4052275185 [TCP segment of a reassembled PDU]"
"292","1.476499","192.168.0.92","18.67.76.75","TCP","66","57523  >  443 [ACK] Seq=1523 Ack=115151 Win=161024 Len=0 TSval=4052275209 TSecr=1737498100"
"293","1.476570","192.168.0.92","18.67.76.75","TCP","66","[TCP Window Update] 57523  >  443 [ACK] Seq=1523 Ack=115151 Win=165312 Len=0 TSval=4052275209 TSecr=1737498100"
"294","1.477770","18.67.76.75","192.168.0.92","TCP","1494","443  >  57523 [ACK] Seq=115151 Ack=1523 Win=69632 Len=1428 TSval=1737498101 TSecr=4052275185 [TCP segment of a reassembled PDU]"
"295","1.477771","18.67.76.75","192.168.0.92","TCP","1494","443  >  57523 [ACK] Seq=116579 Ack=1523 Win=69632 Len=1428 TSval=1737498101 TSecr=4052275185 [TCP segment of a reassembled PDU]"
"296","1.477772","18.67.76.75","192.168.0.92","TCP","1494","443  >  57523 [PSH, ACK] Seq=118007 Ack=1523 Win=69632 Len=1428 TSval=1737498101 TSecr=4052275185 [TCP segment of a reassembled PDU]"
"297","1.477773","18.67.76.75","192.168.0.92","TLSv1.3","1494","Application Data"
"298","1.477775","18.67.76.75","192.168.0.92","TCP","1494","443  >  57523 [ACK] Seq=120863 Ack=1523 Win=69632 Len=1428 TSval=1737498102 TSecr=4052275185 [TCP segment of a reassembled PDU]"
"299","1.477776","18.67.76.75","192.168.0.92","TCP","1494","443  >  57523 [PSH, ACK] Seq=122291 Ack=1523 Win=69632 Len=1428 TSval=1737498102 TSecr=4052275185 [TCP segment of a reassembled PDU]"
"300","1.477831","192.168.0.92","18.67.76.75","TCP","66","57523  >  443 [ACK] Seq=1523 Ack=123719 Win=156736 Len=0 TSval=4052275210 TSecr=1737498102"
"301","1.477893","192.168.0.92","18.67.76.75","TCP","66","[TCP Window Update] 57523  >  443 [ACK] Seq=1523 Ack=123719 Win=165312 Len=0 TSval=4052275210 TSecr=1737498102"
"302","1.484398","18.67.76.75","192.168.0.92","TCP","1494","443  >  57523 [ACK] Seq=123719 Ack=1523 Win=69632 Len=1428 TSval=1737498108 TSecr=4052275197 [TCP segment of a reassembled PDU]"
"303","1.484399","18.67.76.75","192.168.0.92","TCP","1494","443  >  57523 [ACK] Seq=125147 Ack=1523 Win=69632 Len=1428 TSval=1737498108 TSecr=4052275197 [TCP segment of a reassembled PDU]"
"304","1.484400","18.67.76.75","192.168.0.92","TCP","1494","443  >  57523 [PSH, ACK] Seq=126575 Ack=1523 Win=69632 Len=1428 TSval=1737498108 TSecr=4052275197 [TCP segment of a reassembled PDU]"
"305","1.484401","18.67.76.75","192.168.0.92","TCP","1494","443  >  57523 [ACK] Seq=128003 Ack=1523 Win=69632 Len=1428 TSval=1737498108 TSecr=4052275197 [TCP segment of a reassembled PDU]"
"306","1.484402","18.67.76.75","192.168.0.92","TCP","1494","443  >  57523 [ACK] Seq=129431 Ack=1523 Win=69632 Len=1428 TSval=1737498108 TSecr=4052275197 [TCP segment of a reassembled PDU]"
"307","1.484403","18.67.76.75","192.168.0.92","TCP","1494","443  >  57523 [PSH, ACK] Seq=130859 Ack=1523 Win=69632 Len=1428 TSval=1737498108 TSecr=4052275197 [TCP segment of a reassembled PDU]"
"308","1.484404","18.67.76.75","192.168.0.92","TCP","1494","443  >  57523 [ACK] Seq=132287 Ack=1523 Win=69632 Len=1428 TSval=1737498109 TSecr=4052275197 [TCP segment of a reassembled PDU]"
"309","1.484404","18.67.76.75","192.168.0.92","TCP","1494","443  >  57523 [ACK] Seq=133715 Ack=1523 Win=69632 Len=1428 TSval=1737498109 TSecr=4052275197 [TCP segment of a reassembled PDU]"
"310","1.484405","18.67.76.75","192.168.0.92","TLSv1.3","1494","Application Data"
"311","1.484406","18.67.76.75","192.168.0.92","TCP","1494","443  >  57523 [ACK] Seq=136571 Ack=1523 Win=69632 Len=1428 TSval=1737498110 TSecr=4052275197 [TCP segment of a reassembled PDU]"
"312","1.484407","18.67.76.75","192.168.0.92","TCP","1494","443  >  57523 [ACK] Seq=137999 Ack=1523 Win=69632 Len=1428 TSval=1737498110 TSecr=4052275197 [TCP segment of a reassembled PDU]"
"313","1.484407","18.67.76.75","192.168.0.92","TCP","1494","443  >  57523 [PSH, ACK] Seq=139427 Ack=1523 Win=69632 Len=1428 TSval=1737498110 TSecr=4052275197 [TCP segment of a reassembled PDU]"
"314","1.484506","192.168.0.92","18.67.76.75","TCP","66","57523  >  443 [ACK] Seq=1523 Ack=139427 Win=149632 Len=0 TSval=4052275217 TSecr=1737498110"
"315","1.484580","192.168.0.92","18.67.76.75","TCP","66","57523  >  443 [ACK] Seq=1523 Ack=140855 Win=165312 Len=0 TSval=4052275217 TSecr=1737498110"
"316","1.486415","18.67.76.75","192.168.0.92","TCP","1494","443  >  57523 [ACK] Seq=140855 Ack=1523 Win=69632 Len=1428 TSval=1737498111 TSecr=4052275197 [TCP segment of a reassembled PDU]"
"317","1.486416","18.67.76.75","192.168.0.92","TCP","1494","443  >  57523 [ACK] Seq=142283 Ack=1523 Win=69632 Len=1428 TSval=1737498111 TSecr=4052275197 [TCP segment of a reassembled PDU]"
"318","1.486417","18.67.76.75","192.168.0.92","TCP","1494","443  >  57523 [PSH, ACK] Seq=143711 Ack=1523 Win=69632 Len=1428 TSval=1737498111 TSecr=4052275197 [TCP segment of a reassembled PDU]"
"319","1.486418","18.67.76.75","192.168.0.92","TCP","1494","443  >  57523 [ACK] Seq=145139 Ack=1523 Win=69632 Len=1428 TSval=1737498112 TSecr=4052275197 [TCP segment of a reassembled PDU]"
"320","1.486419","18.67.76.75","192.168.0.92","TCP","1494","443  >  57523 [ACK] Seq=146567 Ack=1523 Win=69632 Len=1428 TSval=1737498112 TSecr=4052275197 [TCP segment of a reassembled PDU]"
"321","1.486419","18.67.76.75","192.168.0.92","TCP","1494","443  >  57523 [PSH, ACK] Seq=147995 Ack=1523 Win=69632 Len=1428 TSval=1737498112 TSecr=4052275197 [TCP segment of a reassembled PDU]"
"322","1.486458","192.168.0.92","18.67.76.75","TCP","66","57523  >  443 [ACK] Seq=1523 Ack=149423 Win=156736 Len=0 TSval=4052275219 TSecr=1737498112"
"323","1.486508","192.168.0.92","18.67.76.75","TCP","66","[TCP Window Update] 57523  >  443 [ACK] Seq=1523 Ack=149423 Win=165312 Len=0 TSval=4052275219 TSecr=1737498112"
"324","1.487718","18.67.76.75","192.168.0.92","TCP","1494","443  >  57523 [ACK] Seq=149423 Ack=1523 Win=69632 Len=1428 TSval=1737498112 TSecr=4052275202 [TCP segment of a reassembled PDU]"
"325","1.487719","18.67.76.75","192.168.0.92","TCP","1494","443  >  57523 [ACK] Seq=150851 Ack=1523 Win=69632 Len=1428 TSval=1737498112 TSecr=4052275202 [TCP segment of a reassembled PDU]"
"326","1.487720","18.67.76.75","192.168.0.92","TLSv1.3","1494","Application Data"
"327","1.487763","192.168.0.92","18.67.76.75","TCP","66","57523  >  443 [ACK] Seq=1523 Ack=153707 Win=161024 Len=0 TSval=4052275220 TSecr=1737498112"
"328","1.487796","192.168.0.92","18.67.76.75","TCP","66","[TCP Window Update] 57523  >  443 [ACK] Seq=1523 Ack=153707 Win=165312 Len=0 TSval=4052275220 TSecr=1737498112"
"329","1.490635","18.67.76.75","192.168.0.92","TCP","1494","443  >  57523 [ACK] Seq=153707 Ack=1523 Win=69632 Len=1428 TSval=1737498113 TSecr=4052275202 [TCP segment of a reassembled PDU]"
"330","1.490636","18.67.76.75","192.168.0.92","TCP","1494","443  >  57523 [ACK] Seq=155135 Ack=1523 Win=69632 Len=1428 TSval=1737498113 TSecr=4052275202 [TCP segment of a reassembled PDU]"
"331","1.490637","18.67.76.75","192.168.0.92","TCP","1494","443  >  57523 [PSH, ACK] Seq=156563 Ack=1523 Win=69632 Len=1428 TSval=1737498113 TSecr=4052275202 [TCP segment of a reassembled PDU]"
"332","1.490638","18.67.76.75","192.168.0.92","TCP","1494","443  >  57523 [ACK] Seq=157991 Ack=1523 Win=69632 Len=1428 TSval=1737498114 TSecr=4052275202 [TCP segment of a reassembled PDU]"
"333","1.490639","18.67.76.75","192.168.0.92","TCP","1494","443  >  57523 [ACK] Seq=159419 Ack=1523 Win=69632 Len=1428 TSval=1737498114 TSecr=4052275202 [TCP segment of a reassembled PDU]"
"334","1.490639","18.67.76.75","192.168.0.92","TCP","1494","443  >  57523 [ACK] Seq=160847 Ack=1523 Win=69632 Len=1428 TSval=1737498114 TSecr=4052275202 [TCP segment of a reassembled PDU]"
"335","1.490640","18.67.76.75","192.168.0.92","TCP","1494","443  >  57523 [PSH, ACK] Seq=162275 Ack=1523 Win=69632 Len=1428 TSval=1737498114 TSecr=4052275202 [TCP segment of a reassembled PDU]"
"336","1.490641","18.67.76.75","192.168.0.92","TCP","1494","443  >  57523 [ACK] Seq=163703 Ack=1523 Win=69632 Len=1428 TSval=1737498115 TSecr=4052275202 [TCP segment of a reassembled PDU]"
"337","1.490642","18.67.76.75","192.168.0.92","TCP","1494","443  >  57523 [ACK] Seq=165131 Ack=1523 Win=69632 Len=1428 TSval=1737498115 TSecr=4052275202 [TCP segment of a reassembled PDU]"
"338","1.490642","18.67.76.75","192.168.0.92","TCP","1494","443  >  57523 [ACK] Seq=166559 Ack=1523 Win=69632 Len=1428 TSval=1737498115 TSecr=4052275202 [TCP segment of a reassembled PDU]"
"339","1.490643","18.67.76.75","192.168.0.92","TLSv1.3","1494","Application Data"
"340","1.490644","13.32.208.51","192.168.0.92","TCP","66","443  >  57520 [ACK] Seq=7341 Ack=3562 Win=72704 Len=0 TSval=2080704801 TSecr=850193410"
"341","1.490644","13.32.208.51","192.168.0.92","TCP","66","443  >  57520 [ACK] Seq=7341 Ack=5198 Win=76288 Len=0 TSval=2080704801 TSecr=850193410"
"342","1.490645","18.67.76.75","192.168.0.92","TCP","1494","443  >  57523 [ACK] Seq=169415 Ack=1523 Win=69632 Len=1428 TSval=1737498115 TSecr=4052275207 [TCP segment of a reassembled PDU]"
"343","1.490645","18.67.76.75","192.168.0.92","TCP","1494","443  >  57523 [ACK] Seq=170843 Ack=1523 Win=69632 Len=1428 TSval=1737498115 TSecr=4052275207 [TCP segment of a reassembled PDU]"
"344","1.490646","18.67.76.75","192.168.0.92","TCP","1494","443  >  57523 [ACK] Seq=172271 Ack=1523 Win=69632 Len=1428 TSval=1737498115 TSecr=4052275207 [TCP segment of a reassembled PDU]"
"345","1.490647","18.67.76.75","192.168.0.92","TCP","1494","443  >  57523 [PSH, ACK] Seq=173699 Ack=1523 Win=69632 Len=1428 TSval=1737498115 TSecr=4052275207 [TCP segment of a reassembled PDU]"
"346","1.490648","18.67.76.75","192.168.0.92","TCP","1494","443  >  57523 [ACK] Seq=175127 Ack=1523 Win=69632 Len=1428 TSval=1737498116 TSecr=4052275207 [TCP segment of a reassembled PDU]"
"347","1.490649","18.67.76.75","192.168.0.92","TCP","1494","443  >  57523 [ACK] Seq=176555 Ack=1523 Win=69632 Len=1428 TSval=1737498116 TSecr=4052275207 [TCP segment of a reassembled PDU]"
"348","1.490713","192.168.0.92","18.67.76.75","TCP","66","57523  >  443 [ACK] Seq=1523 Ack=169415 Win=149632 Len=0 TSval=4052275223 TSecr=1737498115"
"349","1.490736","192.168.0.92","18.67.76.75","TCP","66","57523  >  443 [ACK] Seq=1523 Ack=177983 Win=323840 Len=0 TSval=4052275223 TSecr=1737498116"
"350","1.490788","192.168.0.92","18.67.76.75","TCP","66","[TCP Window Update] 57523  >  443 [ACK] Seq=1523 Ack=177983 Win=348096 Len=0 TSval=4052275223 TSecr=1737498116"
"351","1.492036","18.67.76.75","192.168.0.92","TCP","1494","443  >  57523 [ACK] Seq=177983 Ack=1523 Win=69632 Len=1428 TSval=1737498116 TSecr=4052275207 [TCP segment of a reassembled PDU]"
"352","1.492037","18.67.76.75","192.168.0.92","TCP","1494","443  >  57523 [ACK] Seq=179411 Ack=1523 Win=69632 Len=1428 TSval=1737498116 TSecr=4052275207 [TCP segment of a reassembled PDU]"
"353","1.492037","18.67.76.75","192.168.0.92","TCP","1494","443  >  57523 [PSH, ACK] Seq=180839 Ack=1523 Win=69632 Len=1428 TSval=1737498116 TSecr=4052275207 [TCP segment of a reassembled PDU]"
"354","1.492038","18.67.76.75","192.168.0.92","TCP","1494","443  >  57523 [ACK] Seq=182267 Ack=1523 Win=69632 Len=1428 TSval=1737498117 TSecr=4052275207 [TCP segment of a reassembled PDU]"
"355","1.492126","192.168.0.92","18.67.76.75","TCP","66","57523  >  443 [ACK] Seq=1523 Ack=183695 Win=348096 Len=0 TSval=4052275224 TSecr=1737498117"
"356","1.493552","18.67.76.75","192.168.0.92","TCP","1494","443  >  57523 [ACK] Seq=183695 Ack=1523 Win=69632 Len=1428 TSval=1737498117 TSecr=4052275207 [TCP segment of a reassembled PDU]"
"357","1.493553","18.67.76.75","192.168.0.92","TLSv1.3","1494","Application Data"
"358","1.493554","18.67.76.75","192.168.0.92","TCP","1494","443  >  57523 [ACK] Seq=186551 Ack=1523 Win=69632 Len=1428 TSval=1737498117 TSecr=4052275207 [TCP segment of a reassembled PDU]"
"359","1.493557","18.67.76.75","192.168.0.92","TCP","1494","443  >  57523 [PSH, ACK] Seq=187979 Ack=1523 Win=69632 Len=1428 TSval=1737498117 TSecr=4052275207 [TCP segment of a reassembled PDU]"
"360","1.493558","18.67.76.75","192.168.0.92","TCP","1494","443  >  57523 [ACK] Seq=189407 Ack=1523 Win=69632 Len=1428 TSval=1737498118 TSecr=4052275210 [TCP segment of a reassembled PDU]"
"361","1.493559","18.67.76.75","192.168.0.92","TCP","1494","443  >  57523 [ACK] Seq=190835 Ack=1523 Win=69632 Len=1428 TSval=1737498118 TSecr=4052275210 [TCP segment of a reassembled PDU]"
"362","1.493560","18.67.76.75","192.168.0.92","TCP","1494","443  >  57523 [ACK] Seq=192263 Ack=1523 Win=69632 Len=1428 TSval=1737498118 TSecr=4052275210 [TCP segment of a reassembled PDU]"
"363","1.493561","18.67.76.75","192.168.0.92","TCP","1494","443  >  57523 [ACK] Seq=193691 Ack=1523 Win=69632 Len=1428 TSval=1737498118 TSecr=4052275210 [TCP segment of a reassembled PDU]"
"364","1.493562","18.67.76.75","192.168.0.92","TCP","1494","443  >  57523 [PSH, ACK] Seq=195119 Ack=1523 Win=69632 Len=1428 TSval=1737498118 TSecr=4052275210 [TCP segment of a reassembled PDU]"
"365","1.493563","18.67.76.75","192.168.0.92","TCP","1494","443  >  57523 [ACK] Seq=196547 Ack=1523 Win=69632 Len=1428 TSval=1737498119 TSecr=4052275210 [TCP segment of a reassembled PDU]"
