"No.","Time","Source","Destination","Protocol","Length","Info"
"822","2.404364","70.186.28.136","192.168.0.92","TLSv1.2","1494","Application Data"
"823","2.404365","70.186.28.136","192.168.0.92","TCP","1494","443  >  65184 [ACK] Seq=1001932 Ack=616 Win=250 Len=1428 TSval=1209924880 TSecr=4265718617 [TCP segment of a reassembled PDU]"
"824","2.404366","70.186.28.136","192.168.0.92","TCP","1494","443  >  65184 [ACK] Seq=1003360 Ack=616 Win=250 Len=1428 TSval=1209924880 TSecr=4265718617 [TCP segment of a reassembled PDU]"
"825","2.404367","70.186.28.136","192.168.0.92","TCP","1494","443  >  65184 [ACK] Seq=1004788 Ack=616 Win=250 Len=1428 TSval=1209924880 TSecr=4265718617 [TCP segment of a reassembled PDU]"
"826","2.404487","192.168.0.92","70.186.28.136","TCP","66","65184  >  443 [ACK] Seq=616 Ack=1006216 Win=65535 Len=0 TSval=4265718655 TSecr=1209924880"
"827","2.405040","70.186.28.136","192.168.0.92","TCP","1494","443  >  65184 [ACK] Seq=1006216 Ack=616 Win=250 Len=1428 TSval=1209924880 TSecr=4265718617 [TCP segment of a reassembled PDU]"
"828","2.405041","70.186.28.136","192.168.0.92","TCP","1494","443  >  65184 [ACK] Seq=1007644 Ack=616 Win=250 Len=1428 TSval=1209924880 TSecr=4265718617 [TCP segment of a reassembled PDU]"
"829","2.405042","70.186.28.136","192.168.0.92","TCP","1494","443  >  65184 [ACK] Seq=1009072 Ack=616 Win=250 Len=1428 TSval=1209924880 TSecr=4265718617 [TCP segment of a reassembled PDU]"
"830","2.405043","70.186.28.136","192.168.0.92","TCP","1494","443  >  65184 [ACK] Seq=1010500 Ack=616 Win=250 Len=1428 TSval=1209924880 TSecr=4265718617 [TCP segment of a reassembled PDU]"
"831","2.405044","70.186.28.136","192.168.0.92","TCP","1494","443  >  65184 [ACK] Seq=1011928 Ack=616 Win=250 Len=1428 TSval=1209924880 TSecr=4265718617 [TCP segment of a reassembled PDU]"
"832","2.405044","70.186.28.136","192.168.0.92","TCP","1494","443  >  65184 [ACK] Seq=1013356 Ack=616 Win=250 Len=1428 TSval=1209924880 TSecr=4265718617 [TCP segment of a reassembled PDU]"
"833","2.405046","70.186.28.136","192.168.0.92","TCP","1494","443  >  65184 [ACK] Seq=1014784 Ack=616 Win=250 Len=1428 TSval=1209924880 TSecr=4265718617 [TCP segment of a reassembled PDU]"
"834","2.405047","70.186.28.136","192.168.0.92","TCP","1494","443  >  65184 [ACK] Seq=1016212 Ack=616 Win=250 Len=1428 TSval=1209924880 TSecr=4265718617 [TCP segment of a reassembled PDU]"
"835","2.405047","70.186.28.136","192.168.0.92","TLSv1.2","1494","Application Data"
"836","2.405048","70.186.28.136","192.168.0.92","TCP","1494","443  >  65184 [ACK] Seq=1019068 Ack=616 Win=250 Len=1428 TSval=1209924880 TSecr=4265718617 [TCP segment of a reassembled PDU]"
"837","2.405049","70.186.28.136","192.168.0.92","TCP","1494","443  >  65184 [ACK] Seq=1020496 Ack=616 Win=250 Len=1428 TSval=1209924880 TSecr=4265718617 [TCP segment of a reassembled PDU]"
"838","2.405050","70.186.28.136","192.168.0.92","TCP","1494","443  >  65184 [PSH, ACK] Seq=1021924 Ack=616 Win=250 Len=1428 TSval=1209924880 TSecr=4265718617 [TCP segment of a reassembled PDU]"
"839","2.405051","70.186.28.136","192.168.0.92","TCP","1494","443  >  65184 [ACK] Seq=1023352 Ack=616 Win=250 Len=1428 TSval=1209924881 TSecr=4265718617 [TCP segment of a reassembled PDU]"
"840","2.405052","70.186.28.136","192.168.0.92","TCP","1494","443  >  65184 [ACK] Seq=1024780 Ack=616 Win=250 Len=1428 TSval=1209924881 TSecr=4265718617 [TCP segment of a reassembled PDU]"
"841","2.405052","70.186.28.136","192.168.0.92","TCP","1494","443  >  65184 [ACK] Seq=1026208 Ack=616 Win=250 Len=1428 TSval=1209924881 TSecr=4265718617 [TCP segment of a reassembled PDU]"
"842","2.405053","70.186.28.136","192.168.0.92","TCP","1494","443  >  65184 [ACK] Seq=1027636 Ack=616 Win=250 Len=1428 TSval=1209924881 TSecr=4265718617 [TCP segment of a reassembled PDU]"
"843","2.405054","70.186.28.136","192.168.0.92","TCP","1494","443  >  65184 [ACK] Seq=1029064 Ack=616 Win=250 Len=1428 TSval=1209924881 TSecr=4265718617 [TCP segment of a reassembled PDU]"
"844","2.405055","70.186.28.136","192.168.0.92","TCP","1494","443  >  65184 [ACK] Seq=1030492 Ack=616 Win=250 Len=1428 TSval=1209924881 TSecr=4265718617 [TCP segment of a reassembled PDU]"
"845","2.405055","70.186.28.136","192.168.0.92","TCP","1494","443  >  65184 [ACK] Seq=1031920 Ack=616 Win=250 Len=1428 TSval=1209924881 TSecr=4265718617 [TCP segment of a reassembled PDU]"
"846","2.405056","70.186.28.136","192.168.0.92","TLSv1.2","1494","Application Data"
"847","2.405057","70.186.28.136","192.168.0.92","TCP","1494","443  >  65184 [ACK] Seq=1034776 Ack=616 Win=250 Len=1428 TSval=1209924881 TSecr=4265718617 [TCP segment of a reassembled PDU]"
"848","2.405058","70.186.28.136","192.168.0.92","TCP","1494","443  >  65184 [ACK] Seq=1036204 Ack=616 Win=250 Len=1428 TSval=1209924881 TSecr=4265718617 [TCP segment of a reassembled PDU]"
"849","2.405059","70.186.28.136","192.168.0.92","TCP","1494","443  >  65184 [ACK] Seq=1037632 Ack=616 Win=250 Len=1428 TSval=1209924881 TSecr=4265718617 [TCP segment of a reassembled PDU]"
"850","2.405060","70.186.28.136","192.168.0.92","TCP","1494","443  >  65184 [ACK] Seq=1039060 Ack=616 Win=250 Len=1428 TSval=1209924881 TSecr=4265718617 [TCP segment of a reassembled PDU]"
"851","2.405060","70.186.28.136","192.168.0.92","TCP","1494","443  >  65184 [ACK] Seq=1040488 Ack=616 Win=250 Len=1428 TSval=1209924881 TSecr=4265718617 [TCP segment of a reassembled PDU]"
"852","2.405061","70.186.28.136","192.168.0.92","TCP","1494","443  >  65184 [ACK] Seq=1041916 Ack=616 Win=250 Len=1428 TSval=1209924881 TSecr=4265718617 [TCP segment of a reassembled PDU]"
"853","2.405062","70.186.28.136","192.168.0.92","TCP","1494","443  >  65184 [ACK] Seq=1043344 Ack=616 Win=250 Len=1428 TSval=1209924881 TSecr=4265718617 [TCP segment of a reassembled PDU]"
"854","2.405063","70.186.28.136","192.168.0.92","TCP","1494","443  >  65184 [ACK] Seq=1044772 Ack=616 Win=250 Len=1428 TSval=1209924881 TSecr=4265718617 [TCP segment of a reassembled PDU]"
"855","2.405064","70.186.28.136","192.168.0.92","TCP","1494","443  >  65184 [ACK] Seq=1046200 Ack=616 Win=250 Len=1428 TSval=1209924881 TSecr=4265718617 [TCP segment of a reassembled PDU]"
"856","2.405065","70.186.28.136","192.168.0.92","TCP","1494","443  >  65184 [ACK] Seq=1047628 Ack=616 Win=250 Len=1428 TSval=1209924881 TSecr=4265718617 [TCP segment of a reassembled PDU]"
"857","2.405066","70.186.28.136","192.168.0.92","TCP","1494","443  >  65184 [ACK] Seq=1049056 Ack=616 Win=250 Len=1428 TSval=1209924881 TSecr=4265718617 [TCP segment of a reassembled PDU]"
"858","2.405066","70.186.28.136","192.168.0.92","TLSv1.2","1494","Application Data"
"859","2.405162","192.168.0.92","70.186.28.136","TCP","66","65184  >  443 [ACK] Seq=616 Ack=1051912 Win=65535 Len=0 TSval=4265718657 TSecr=1209924880"
"860","2.405892","70.186.28.136","192.168.0.92","TCP","1494","443  >  65184 [ACK] Seq=1051912 Ack=616 Win=250 Len=1428 TSval=1209924881 TSecr=4265718617 [TCP segment of a reassembled PDU]"
"861","2.405893","70.186.28.136","192.168.0.92","TCP","1494","443  >  65184 [ACK] Seq=1053340 Ack=616 Win=250 Len=1428 TSval=1209924881 TSecr=4265718617 [TCP segment of a reassembled PDU]"
"862","2.405894","70.186.28.136","192.168.0.92","TCP","1494","443  >  65184 [ACK] Seq=1054768 Ack=616 Win=250 Len=1428 TSval=1209924881 TSecr=4265718617 [TCP segment of a reassembled PDU]"
"863","2.405895","70.186.28.136","192.168.0.92","TCP","1494","443  >  65184 [ACK] Seq=1056196 Ack=616 Win=250 Len=1428 TSval=1209924881 TSecr=4265718617 [TCP segment of a reassembled PDU]"
"864","2.405896","70.186.28.136","192.168.0.92","TCP","1494","443  >  65184 [ACK] Seq=1057624 Ack=616 Win=250 Len=1428 TSval=1209924881 TSecr=4265718617 [TCP segment of a reassembled PDU]"
"865","2.405897","70.186.28.136","192.168.0.92","TCP","1494","443  >  65184 [ACK] Seq=1059052 Ack=616 Win=250 Len=1428 TSval=1209924881 TSecr=4265718617 [TCP segment of a reassembled PDU]"
"866","2.405898","70.186.28.136","192.168.0.92","TCP","1494","443  >  65184 [ACK] Seq=1060480 Ack=616 Win=250 Len=1428 TSval=1209924881 TSecr=4265718617 [TCP segment of a reassembled PDU]"
"867","2.405899","70.186.28.136","192.168.0.92","TCP","1494","443  >  65184 [ACK] Seq=1061908 Ack=616 Win=250 Len=1428 TSval=1209924881 TSecr=4265718617 [TCP segment of a reassembled PDU]"
"868","2.405900","70.186.28.136","192.168.0.92","TCP","1494","443  >  65184 [ACK] Seq=1063336 Ack=616 Win=250 Len=1428 TSval=1209924881 TSecr=4265718617 [TCP segment of a reassembled PDU]"
"869","2.405900","70.186.28.136","192.168.0.92","TCP","1494","443  >  65184 [ACK] Seq=1064764 Ack=616 Win=250 Len=1428 TSval=1209924881 TSecr=4265718617 [TCP segment of a reassembled PDU]"
"870","2.405901","70.186.28.136","192.168.0.92","TLSv1.2","1494","Application Data"
"871","2.405902","70.186.28.136","192.168.0.92","TCP","1494","443  >  65184 [ACK] Seq=1067620 Ack=616 Win=250 Len=1428 TSval=1209924881 TSecr=4265718617 [TCP segment of a reassembled PDU]"
"872","2.405903","70.186.28.136","192.168.0.92","TCP","1494","443  >  65184 [ACK] Seq=1069048 Ack=616 Win=250 Len=1428 TSval=1209924881 TSecr=4265718617 [TCP segment of a reassembled PDU]"
"873","2.405904","70.186.28.136","192.168.0.92","TCP","1494","443  >  65184 [ACK] Seq=1070476 Ack=616 Win=250 Len=1428 TSval=1209924881 TSecr=4265718617 [TCP segment of a reassembled PDU]"
"874","2.405904","70.186.28.136","192.168.0.92","TCP","1494","443  >  65184 [ACK] Seq=1071904 Ack=616 Win=250 Len=1428 TSval=1209924881 TSecr=4265718617 [TCP segment of a reassembled PDU]"
"875","2.405905","70.186.28.136","192.168.0.92","TCP","1494","443  >  65184 [ACK] Seq=1073332 Ack=616 Win=250 Len=1428 TSval=1209924881 TSecr=4265718617 [TCP segment of a reassembled PDU]"
"876","2.405906","70.186.28.136","192.168.0.92","TCP","1494","443  >  65184 [ACK] Seq=1074760 Ack=616 Win=250 Len=1428 TSval=1209924881 TSecr=4265718617 [TCP segment of a reassembled PDU]"
"877","2.405907","70.186.28.136","192.168.0.92","TCP","1494","443  >  65184 [ACK] Seq=1076188 Ack=616 Win=250 Len=1428 TSval=1209924881 TSecr=4265718617 [TCP segment of a reassembled PDU]"
"878","2.405908","70.186.28.136","192.168.0.92","TCP","1494","443  >  65184 [ACK] Seq=1077616 Ack=616 Win=250 Len=1428 TSval=1209924881 TSecr=4265718617 [TCP segment of a reassembled PDU]"
"879","2.405909","70.186.28.136","192.168.0.92","TCP","1494","443  >  65184 [ACK] Seq=1079044 Ack=616 Win=250 Len=1428 TSval=1209924881 TSecr=4265718617 [TCP segment of a reassembled PDU]"
"880","2.405910","70.186.28.136","192.168.0.92","TCP","1494","443  >  65184 [ACK] Seq=1080472 Ack=616 Win=250 Len=1428 TSval=1209924881 TSecr=4265718617 [TCP segment of a reassembled PDU]"
"881","2.405911","70.186.28.136","192.168.0.92","TCP","1494","443  >  65184 [ACK] Seq=1081900 Ack=616 Win=250 Len=1428 TSval=1209924881 TSecr=4265718617 [TCP segment of a reassembled PDU]"
"882","2.405912","70.186.28.136","192.168.0.92","TLSv1.2","1494","Application Data"
"883","2.405912","70.186.28.136","192.168.0.92","TCP","1494","443  >  65184 [ACK] Seq=1084756 Ack=616 Win=250 Len=1428 TSval=1209924881 TSecr=4265718617 [TCP segment of a reassembled PDU]"
"884","2.405913","70.186.28.136","192.168.0.92","TCP","1494","443  >  65184 [PSH, ACK] Seq=1086184 Ack=616 Win=250 Len=1428 TSval=1209924881 TSecr=4265718617 [TCP segment of a reassembled PDU]"
"885","2.405914","70.186.28.136","192.168.0.92","TCP","1494","443  >  65184 [ACK] Seq=1087612 Ack=616 Win=250 Len=1428 TSval=1209924882 TSecr=4265718617 [TCP segment of a reassembled PDU]"
"886","2.405915","70.186.28.136","192.168.0.92","TCP","1494","443  >  65184 [ACK] Seq=1089040 Ack=616 Win=250 Len=1428 TSval=1209924882 TSecr=4265718617 [TCP segment of a reassembled PDU]"
"887","2.405916","70.186.28.136","192.168.0.92","TCP","1494","443  >  65184 [ACK] Seq=1090468 Ack=616 Win=250 Len=1428 TSval=1209924882 TSecr=4265718617 [TCP segment of a reassembled PDU]"
"888","2.405917","70.186.28.136","192.168.0.92","TCP","1494","443  >  65184 [ACK] Seq=1091896 Ack=616 Win=250 Len=1428 TSval=1209924882 TSecr=4265718617 [TCP segment of a reassembled PDU]"
"889","2.405918","70.186.28.136","192.168.0.92","TCP","1494","443  >  65184 [ACK] Seq=1093324 Ack=616 Win=250 Len=1428 TSval=1209924882 TSecr=4265718617 [TCP segment of a reassembled PDU]"
"890","2.405918","70.186.28.136","192.168.0.92","TCP","1494","443  >  65184 [ACK] Seq=1094752 Ack=616 Win=250 Len=1428 TSval=1209924882 TSecr=4265718617 [TCP segment of a reassembled PDU]"
"891","2.405919","70.186.28.136","192.168.0.92","TCP","1494","443  >  65184 [ACK] Seq=1096180 Ack=616 Win=250 Len=1428 TSval=1209924882 TSecr=4265718617 [TCP segment of a reassembled PDU]"
"892","2.405920","70.186.28.136","192.168.0.92","TCP","1494","443  >  65184 [ACK] Seq=1097608 Ack=616 Win=250 Len=1428 TSval=1209924882 TSecr=4265718617 [TCP segment of a reassembled PDU]"
"893","2.405921","70.186.28.136","192.168.0.92","TLSv1.2","1494","Application Data"
"894","2.405921","70.186.28.136","192.168.0.92","TCP","1494","443  >  65184 [ACK] Seq=1100464 Ack=616 Win=250 Len=1428 TSval=1209924882 TSecr=4265718617 [TCP segment of a reassembled PDU]"
"895","2.405922","70.186.28.136","192.168.0.92","TCP","1494","443  >  65184 [ACK] Seq=1101892 Ack=616 Win=250 Len=1428 TSval=1209924882 TSecr=4265718617 [TCP segment of a reassembled PDU]"
"896","2.405923","70.186.28.136","192.168.0.92","TCP","1494","443  >  65184 [ACK] Seq=1103320 Ack=616 Win=250 Len=1428 TSval=1209924882 TSecr=4265718617 [TCP segment of a reassembled PDU]"
"897","2.405924","70.186.28.136","192.168.0.92","TCP","1494","443  >  65184 [ACK] Seq=1104748 Ack=616 Win=250 Len=1428 TSval=1209924882 TSecr=4265718617 [TCP segment of a reassembled PDU]"
"898","2.405925","70.186.28.136","192.168.0.92","TCP","1494","443  >  65184 [ACK] Seq=1106176 Ack=616 Win=250 Len=1428 TSval=1209924882 TSecr=4265718617 [TCP segment of a reassembled PDU]"
"899","2.405926","70.186.28.136","192.168.0.92","TCP","1494","443  >  65184 [ACK] Seq=1107604 Ack=616 Win=250 Len=1428 TSval=1209924882 TSecr=4265718617 [TCP segment of a reassembled PDU]"
"900","2.405927","70.186.28.136","192.168.0.92","TCP","1494","443  >  65184 [ACK] Seq=1109032 Ack=616 Win=250 Len=1428 TSval=1209924882 TSecr=4265718617 [TCP segment of a reassembled PDU]"
"901","2.405927","70.186.28.136","192.168.0.92","TCP","1494","443  >  65184 [ACK] Seq=1110460 Ack=616 Win=250 Len=1428 TSval=1209924882 TSecr=4265718617 [TCP segment of a reassembled PDU]"
"902","2.405928","70.186.28.136","192.168.0.92","TCP","1494","443  >  65184 [ACK] Seq=1111888 Ack=616 Win=250 Len=1428 TSval=1209924882 TSecr=4265718617 [TCP segment of a reassembled PDU]"
"903","2.405929","70.186.28.136","192.168.0.92","TCP","1494","443  >  65184 [ACK] Seq=1113316 Ack=616 Win=250 Len=1428 TSval=1209924882 TSecr=4265718617 [TCP segment of a reassembled PDU]"
"904","2.406032","192.168.0.92","70.186.28.136","TCP","66","65184  >  443 [ACK] Seq=616 Ack=1114744 Win=65535 Len=0 TSval=4265718657 TSecr=1209924881"
"905","2.407144","70.186.28.136","192.168.0.92","TCP","1494","443  >  65184 [ACK] Seq=1114744 Ack=616 Win=250 Len=1428 TSval=1209924882 TSecr=4265718617 [TCP segment of a reassembled PDU]"
"906","2.407145","70.186.28.136","192.168.0.92","TLSv1.2","1494","Application Data"
"907","2.407147","70.186.28.136","192.168.0.92","TCP","1494","443  >  65184 [ACK] Seq=1117600 Ack=616 Win=250 Len=1428 TSval=1209924882 TSecr=4265718617 [TCP segment of a reassembled PDU]"
"908","2.407147","70.186.28.136","192.168.0.92","TCP","1494","443  >  65184 [ACK] Seq=1119028 Ack=616 Win=250 Len=1428 TSval=1209924882 TSecr=4265718617 [TCP segment of a reassembled PDU]"
"909","2.407148","70.186.28.136","192.168.0.92","TCP","1494","443  >  65184 [ACK] Seq=1120456 Ack=616 Win=250 Len=1428 TSval=1209924882 TSecr=4265718617 [TCP segment of a reassembled PDU]"
"910","2.407150","70.186.28.136","192.168.0.92","TCP","1494","443  >  65184 [ACK] Seq=1121884 Ack=616 Win=250 Len=1428 TSval=1209924882 TSecr=4265718617 [TCP segment of a reassembled PDU]"
"911","2.407151","70.186.28.136","192.168.0.92","TCP","1494","443  >  65184 [ACK] Seq=1123312 Ack=616 Win=250 Len=1428 TSval=1209924882 TSecr=4265718617 [TCP segment of a reassembled PDU]"
"912","2.407152","70.186.28.136","192.168.0.92","TCP","1494","443  >  65184 [ACK] Seq=1124740 Ack=616 Win=250 Len=1428 TSval=1209924882 TSecr=4265718617 [TCP segment of a reassembled PDU]"
"913","2.407153","70.186.28.136","192.168.0.92","TCP","1494","443  >  65184 [ACK] Seq=1126168 Ack=616 Win=250 Len=1428 TSval=1209924882 TSecr=4265718617 [TCP segment of a reassembled PDU]"
"914","2.407154","70.186.28.136","192.168.0.92","TCP","1494","443  >  65184 [ACK] Seq=1127596 Ack=616 Win=250 Len=1428 TSval=1209924882 TSecr=4265718617 [TCP segment of a reassembled PDU]"
"915","2.407154","70.186.28.136","192.168.0.92","TCP","1494","443  >  65184 [ACK] Seq=1129024 Ack=616 Win=250 Len=1428 TSval=1209924882 TSecr=4265718617 [TCP segment of a reassembled PDU]"
"916","2.407155","70.186.28.136","192.168.0.92","TCP","1494","443  >  65184 [ACK] Seq=1130452 Ack=616 Win=250 Len=1428 TSval=1209924882 TSecr=4265718617 [TCP segment of a reassembled PDU]"
"917","2.407263","192.168.0.92","70.186.28.136","TCP","66","65184  >  443 [ACK] Seq=616 Ack=1131880 Win=65535 Len=0 TSval=4265718659 TSecr=1209924882"
"918","2.407852","70.186.28.136","192.168.0.92","TLSv1.2","1494","Application Data"
"919","2.407853","70.186.28.136","192.168.0.92","TCP","1494","443  >  65184 [ACK] Seq=1133308 Ack=616 Win=250 Len=1428 TSval=1209924882 TSecr=4265718617 [TCP segment of a reassembled PDU]"
"920","2.407854","70.186.28.136","192.168.0.92","TCP","1494","443  >  65184 [ACK] Seq=1134736 Ack=616 Win=250 Len=1428 TSval=1209924882 TSecr=4265718617 [TCP segment of a reassembled PDU]"
"921","2.407856","70.186.28.136","192.168.0.92","TCP","1494","443  >  65184 [ACK] Seq=1136164 Ack=616 Win=250 Len=1428 TSval=1209924882 TSecr=4265718617 [TCP segment of a reassembled PDU]"
"922","2.407857","70.186.28.136","192.168.0.92","TCP","1494","443  >  65184 [ACK] Seq=1137592 Ack=616 Win=250 Len=1428 TSval=1209924882 TSecr=4265718617 [TCP segment of a reassembled PDU]"
"923","2.407857","70.186.28.136","192.168.0.92","TCP","1494","443  >  65184 [ACK] Seq=1139020 Ack=616 Win=250 Len=1428 TSval=1209924882 TSecr=4265718617 [TCP segment of a reassembled PDU]"
"924","2.407858","70.186.28.136","192.168.0.92","TCP","1494","443  >  65184 [ACK] Seq=1140448 Ack=616 Win=250 Len=1428 TSval=1209924882 TSecr=4265718617 [TCP segment of a reassembled PDU]"
"925","2.407860","70.186.28.136","192.168.0.92","TCP","1494","443  >  65184 [ACK] Seq=1141876 Ack=616 Win=250 Len=1428 TSval=1209924882 TSecr=4265718617 [TCP segment of a reassembled PDU]"
"926","2.407862","70.186.28.136","192.168.0.92","TCP","1494","443  >  65184 [ACK] Seq=1143304 Ack=616 Win=250 Len=1428 TSval=1209924882 TSecr=4265718617 [TCP segment of a reassembled PDU]"
"927","2.407863","70.186.28.136","192.168.0.92","TCP","1494","443  >  65184 [ACK] Seq=1144732 Ack=616 Win=250 Len=1428 TSval=1209924882 TSecr=4265718617 [TCP segment of a reassembled PDU]"
"928","2.407864","70.186.28.136","192.168.0.92","TCP","1494","443  >  65184 [ACK] Seq=1146160 Ack=616 Win=250 Len=1428 TSval=1209924882 TSecr=4265718617 [TCP segment of a reassembled PDU]"
"929","2.407865","70.186.28.136","192.168.0.92","TCP","1494","443  >  65184 [ACK] Seq=1147588 Ack=616 Win=250 Len=1428 TSval=1209924882 TSecr=4265718617 [TCP segment of a reassembled PDU]"
"930","2.407867","70.186.28.136","192.168.0.92","TLSv1.2","1494","Application Data"
"931","2.407867","70.186.28.136","192.168.0.92","TCP","1494","443  >  65184 [PSH, ACK] Seq=1150444 Ack=616 Win=250 Len=1428 TSval=1209924882 TSecr=4265718617 [TCP segment of a reassembled PDU]"
"932","2.407868","70.186.28.136","192.168.0.92","TCP","1494","443  >  65184 [ACK] Seq=1151872 Ack=616 Win=250 Len=1428 TSval=1209924883 TSecr=4265718617 [TCP segment of a reassembled PDU]"
"933","2.407869","70.186.28.136","192.168.0.92","TCP","1494","443  >  65184 [ACK] Seq=1153300 Ack=616 Win=250 Len=1428 TSval=1209924883 TSecr=4265718617 [TCP segment of a reassembled PDU]"
"934","2.407870","70.186.28.136","192.168.0.92","TCP","1494","443  >  65184 [ACK] Seq=1154728 Ack=616 Win=250 Len=1428 TSval=1209924883 TSecr=4265718617 [TCP segment of a reassembled PDU]"
"935","2.407871","70.186.28.136","192.168.0.92","TCP","1494","443  >  65184 [ACK] Seq=1156156 Ack=616 Win=250 Len=1428 TSval=1209924883 TSecr=4265718617 [TCP segment of a reassembled PDU]"
"936","2.407872","70.186.28.136","192.168.0.92","TCP","1494","443  >  65184 [ACK] Seq=1157584 Ack=616 Win=250 Len=1428 TSval=1209924883 TSecr=4265718617 [TCP segment of a reassembled PDU]"
"937","2.407873","70.186.28.136","192.168.0.92","TCP","1494","443  >  65184 [ACK] Seq=1159012 Ack=616 Win=250 Len=1428 TSval=1209924883 TSecr=4265718617 [TCP segment of a reassembled PDU]"
"938","2.407874","70.186.28.136","192.168.0.92","TCP","1494","443  >  65184 [ACK] Seq=1160440 Ack=616 Win=250 Len=1428 TSval=1209924883 TSecr=4265718617 [TCP segment of a reassembled PDU]"
"939","2.407875","70.186.28.136","192.168.0.92","TCP","1494","443  >  65184 [ACK] Seq=1161868 Ack=616 Win=250 Len=1428 TSval=1209924883 TSecr=4265718617 [TCP segment of a reassembled PDU]"
"940","2.407879","70.186.28.136","192.168.0.92","TCP","1494","443  >  65184 [ACK] Seq=1163296 Ack=616 Win=250 Len=1428 TSval=1209924883 TSecr=4265718617 [TCP segment of a reassembled PDU]"
"941","2.407880","70.186.28.136","192.168.0.92","TLSv1.2","1494","Application Data"
"942","2.407880","70.186.28.136","192.168.0.92","TCP","1494","443  >  65184 [ACK] Seq=1166152 Ack=616 Win=250 Len=1428 TSval=1209924883 TSecr=4265718617 [TCP segment of a reassembled PDU]"
"943","2.407881","70.186.28.136","192.168.0.92","TCP","1494","443  >  65184 [ACK] Seq=1167580 Ack=616 Win=250 Len=1428 TSval=1209924883 TSecr=4265718617 [TCP segment of a reassembled PDU]"
"944","2.407882","70.186.28.136","192.168.0.92","TCP","1494","443  >  65184 [ACK] Seq=1169008 Ack=616 Win=250 Len=1428 TSval=1209924883 TSecr=4265718617 [TCP segment of a reassembled PDU]"
"945","2.407883","70.186.28.136","192.168.0.92","TCP","1494","443  >  65184 [ACK] Seq=1170436 Ack=616 Win=250 Len=1428 TSval=1209924883 TSecr=4265718617 [TCP segment of a reassembled PDU]"
"946","2.407884","70.186.28.136","192.168.0.92","TCP","1494","443  >  65184 [ACK] Seq=1171864 Ack=616 Win=250 Len=1428 TSval=1209924883 TSecr=4265718617 [TCP segment of a reassembled PDU]"
"947","2.407885","70.186.28.136","192.168.0.92","TCP","1494","443  >  65184 [ACK] Seq=1173292 Ack=616 Win=250 Len=1428 TSval=1209924883 TSecr=4265718617 [TCP segment of a reassembled PDU]"
"948","2.407886","70.186.28.136","192.168.0.92","TCP","1494","443  >  65184 [ACK] Seq=1174720 Ack=616 Win=250 Len=1428 TSval=1209924883 TSecr=4265718617 [TCP segment of a reassembled PDU]"
"949","2.407887","70.186.28.136","192.168.0.92","TCP","1494","443  >  65184 [ACK] Seq=1176148 Ack=616 Win=250 Len=1428 TSval=1209924883 TSecr=4265718617 [TCP segment of a reassembled PDU]"
"950","2.407888","70.186.28.136","192.168.0.92","TCP","1494","443  >  65184 [ACK] Seq=1177576 Ack=616 Win=250 Len=1428 TSval=1209924883 TSecr=4265718617 [TCP segment of a reassembled PDU]"
"951","2.407888","70.186.28.136","192.168.0.92","TCP","1494","443  >  65184 [ACK] Seq=1179004 Ack=616 Win=250 Len=1428 TSval=1209924883 TSecr=4265718617 [TCP segment of a reassembled PDU]"
"952","2.407890","70.186.28.136","192.168.0.92","TCP","1494","443  >  65184 [ACK] Seq=1180432 Ack=616 Win=250 Len=1428 TSval=1209924883 TSecr=4265718617 [TCP segment of a reassembled PDU]"
"953","2.407892","70.186.28.136","192.168.0.92","TLSv1.2","1494","Application Data"
"954","2.407893","70.186.28.136","192.168.0.92","TCP","1494","443  >  65184 [ACK] Seq=1183288 Ack=616 Win=250 Len=1428 TSval=1209924883 TSecr=4265718617 [TCP segment of a reassembled PDU]"
"955","2.407894","70.186.28.136","192.168.0.92","TCP","1494","443  >  65184 [ACK] Seq=1184716 Ack=616 Win=250 Len=1428 TSval=1209924883 TSecr=4265718617 [TCP segment of a reassembled PDU]"
"956","2.407895","70.186.28.136","192.168.0.92","TCP","1494","443  >  65184 [ACK] Seq=1186144 Ack=616 Win=250 Len=1428 TSval=1209924883 TSecr=4265718617 [TCP segment of a reassembled PDU]"
"957","2.407896","70.186.28.136","192.168.0.92","TCP","1494","443  >  65184 [ACK] Seq=1187572 Ack=616 Win=250 Len=1428 TSval=1209924883 TSecr=4265718617 [TCP segment of a reassembled PDU]"
"958","2.407898","70.186.28.136","192.168.0.92","TCP","1494","443  >  65184 [ACK] Seq=1189000 Ack=616 Win=250 Len=1428 TSval=1209924883 TSecr=4265718617 [TCP segment of a reassembled PDU]"
"959","2.407902","70.186.28.136","192.168.0.92","TCP","1494","443  >  65184 [ACK] Seq=1190428 Ack=616 Win=250 Len=1428 TSval=1209924883 TSecr=4265718617 [TCP segment of a reassembled PDU]"
"960","2.407903","70.186.28.136","192.168.0.92","TCP","1494","443  >  65184 [ACK] Seq=1191856 Ack=616 Win=250 Len=1428 TSval=1209924883 TSecr=4265718617 [TCP segment of a reassembled PDU]"
"961","2.407905","70.186.28.136","192.168.0.92","TCP","1494","443  >  65184 [ACK] Seq=1193284 Ack=616 Win=250 Len=1428 TSval=1209924883 TSecr=4265718617 [TCP segment of a reassembled PDU]"
"962","2.407906","70.186.28.136","192.168.0.92","TCP","1494","443  >  65184 [ACK] Seq=1194712 Ack=616 Win=250 Len=1428 TSval=1209924883 TSecr=4265718617 [TCP segment of a reassembled PDU]"
"963","2.407907","70.186.28.136","192.168.0.92","TCP","1494","443  >  65184 [ACK] Seq=1196140 Ack=616 Win=250 Len=1428 TSval=1209924883 TSecr=4265718617 [TCP segment of a reassembled PDU]"
"964","2.407908","70.186.28.136","192.168.0.92","TLSv1.2","1494","Application Data"
"965","2.407910","70.186.28.136","192.168.0.92","TCP","1494","443  >  65184 [ACK] Seq=1198996 Ack=616 Win=250 Len=1428 TSval=1209924883 TSecr=4265718617 [TCP segment of a reassembled PDU]"
"966","2.407912","70.186.28.136","192.168.0.92","TCP","1494","443  >  65184 [ACK] Seq=1200424 Ack=616 Win=250 Len=1428 TSval=1209924883 TSecr=4265718617 [TCP segment of a reassembled PDU]"
"967","2.407913","70.186.28.136","192.168.0.92","TCP","1494","443  >  65184 [ACK] Seq=1201852 Ack=616 Win=250 Len=1428 TSval=1209924883 TSecr=4265718617 [TCP segment of a reassembled PDU]"
"968","2.407914","70.186.28.136","192.168.0.92","TCP","1494","443  >  65184 [ACK] Seq=1203280 Ack=616 Win=250 Len=1428 TSval=1209924883 TSecr=4265718617 [TCP segment of a reassembled PDU]"
"969","2.407915","70.186.28.136","192.168.0.92","TCP","1494","443  >  65184 [ACK] Seq=1204708 Ack=616 Win=250 Len=1428 TSval=1209924883 TSecr=4265718617 [TCP segment of a reassembled PDU]"
"970","2.407917","70.186.28.136","192.168.0.92","TCP","1494","443  >  65184 [ACK] Seq=1206136 Ack=616 Win=250 Len=1428 TSval=1209924883 TSecr=4265718617 [TCP segment of a reassembled PDU]"
"971","2.407919","70.186.28.136","192.168.0.92","TCP","1494","443  >  65184 [ACK] Seq=1207564 Ack=616 Win=250 Len=1428 TSval=1209924883 TSecr=4265718617 [TCP segment of a reassembled PDU]"
"972","2.407920","70.186.28.136","192.168.0.92","TCP","1494","443  >  65184 [ACK] Seq=1208992 Ack=616 Win=250 Len=1428 TSval=1209924883 TSecr=4265718617 [TCP segment of a reassembled PDU]"
"973","2.407921","70.186.28.136","192.168.0.92","TCP","1494","443  >  65184 [ACK] Seq=1210420 Ack=616 Win=250 Len=1428 TSval=1209924883 TSecr=4265718617 [TCP segment of a reassembled PDU]"
"974","2.407923","70.186.28.136","192.168.0.92","TCP","1494","443  >  65184 [ACK] Seq=1211848 Ack=616 Win=250 Len=1428 TSval=1209924883 TSecr=4265718617 [TCP segment of a reassembled PDU]"
"975","2.407924","70.186.28.136","192.168.0.92","TCP","1494","443  >  65184 [ACK] Seq=1213276 Ack=616 Win=250 Len=1428 TSval=1209924883 TSecr=4265718617 [TCP segment of a reassembled PDU]"
"976","2.407939","70.186.28.136","192.168.0.92","TLSv1.2","1494","Application Data"
"977","2.407941","70.186.28.136","192.168.0.92","TCP","1494","443  >  65184 [ACK] Seq=1216132 Ack=616 Win=250 Len=1428 TSval=1209924884 TSecr=4265718617 [TCP segment of a reassembled PDU]"
"978","2.407942","70.186.28.136","192.168.0.92","TCP","1494","443  >  65184 [ACK] Seq=1217560 Ack=616 Win=250 Len=1428 TSval=1209924884 TSecr=4265718617 [TCP segment of a reassembled PDU]"
"979","2.407943","70.186.28.136","192.168.0.92","TCP","1494","443  >  65184 [ACK] Seq=1218988 Ack=616 Win=250 Len=1428 TSval=1209924884 TSecr=4265718617 [TCP segment of a reassembled PDU]"
"980","2.407944","70.186.28.136","192.168.0.92","TCP","1494","443  >  65184 [ACK] Seq=1220416 Ack=616 Win=250 Len=1428 TSval=1209924884 TSecr=4265718617 [TCP segment of a reassembled PDU]"
"981","2.407945","70.186.28.136","192.168.0.92","TCP","1494","443  >  65184 [ACK] Seq=1221844 Ack=616 Win=250 Len=1428 TSval=1209924884 TSecr=4265718617 [TCP segment of a reassembled PDU]"
"982","2.408296","192.168.0.92","70.186.28.136","TCP","66","65184  >  443 [ACK] Seq=616 Ack=1223272 Win=65535 Len=0 TSval=4265718659 TSecr=1209924882"
"983","2.410676","70.186.28.136","192.168.0.92","TCP","1494","443  >  65184 [ACK] Seq=1223272 Ack=616 Win=250 Len=1428 TSval=1209924884 TSecr=4265718617 [TCP segment of a reassembled PDU]"
"984","2.410678","70.186.28.136","192.168.0.92","TCP","1494","443  >  65184 [ACK] Seq=1224700 Ack=616 Win=250 Len=1428 TSval=1209924884 TSecr=4265718617 [TCP segment of a reassembled PDU]"
"985","2.410679","70.186.28.136","192.168.0.92","TCP","1494","443  >  65184 [ACK] Seq=1226128 Ack=616 Win=250 Len=1428 TSval=1209924884 TSecr=4265718617 [TCP segment of a reassembled PDU]"
"986","2.410680","70.186.28.136","192.168.0.92","TCP","1494","443  >  65184 [ACK] Seq=1227556 Ack=616 Win=250 Len=1428 TSval=1209924884 TSecr=4265718617 [TCP segment of a reassembled PDU]"
"987","2.410680","70.186.28.136","192.168.0.92","TCP","1494","443  >  65184 [ACK] Seq=1228984 Ack=616 Win=250 Len=1428 TSval=1209924884 TSecr=4265718617 [TCP segment of a reassembled PDU]"
"988","2.410681","70.186.28.136","192.168.0.92","TLSv1.2","1494","Application Data"
"989","2.410682","70.186.28.136","192.168.0.92","TCP","1494","443  >  65184 [ACK] Seq=1231840 Ack=616 Win=250 Len=1428 TSval=1209924884 TSecr=4265718617 [TCP segment of a reassembled PDU]"
"990","2.410683","70.186.28.136","192.168.0.92","TCP","1494","443  >  65184 [ACK] Seq=1233268 Ack=616 Win=250 Len=1428 TSval=1209924884 TSecr=4265718617 [TCP segment of a reassembled PDU]"
"991","2.410684","70.186.28.136","192.168.0.92","TCP","1494","443  >  65184 [ACK] Seq=1234696 Ack=616 Win=250 Len=1428 TSval=1209924884 TSecr=4265718617 [TCP segment of a reassembled PDU]"
"992","2.410685","70.186.28.136","192.168.0.92","TCP","1494","443  >  65184 [ACK] Seq=1236124 Ack=616 Win=250 Len=1428 TSval=1209924884 TSecr=4265718617 [TCP segment of a reassembled PDU]"
"993","2.410686","70.186.28.136","192.168.0.92","TCP","1494","443  >  65184 [ACK] Seq=1237552 Ack=616 Win=250 Len=1428 TSval=1209924884 TSecr=4265718617 [TCP segment of a reassembled PDU]"
"994","2.410687","70.186.28.136","192.168.0.92","TCP","1494","443  >  65184 [ACK] Seq=1238980 Ack=616 Win=250 Len=1428 TSval=1209924884 TSecr=4265718617 [TCP segment of a reassembled PDU]"
"995","2.410688","70.186.28.136","192.168.0.92","TCP","1494","443  >  65184 [ACK] Seq=1240408 Ack=616 Win=250 Len=1428 TSval=1209924884 TSecr=4265718617 [TCP segment of a reassembled PDU]"
"996","2.410689","70.186.28.136","192.168.0.92","TCP","1494","443  >  65184 [ACK] Seq=1241836 Ack=616 Win=250 Len=1428 TSval=1209924884 TSecr=4265718617 [TCP segment of a reassembled PDU]"
"997","2.410693","70.186.28.136","192.168.0.92","TCP","1494","443  >  65184 [ACK] Seq=1243264 Ack=616 Win=250 Len=1428 TSval=1209924884 TSecr=4265718617 [TCP segment of a reassembled PDU]"
"998","2.410694","70.186.28.136","192.168.0.92","TCP","1494","443  >  65184 [ACK] Seq=1244692 Ack=616 Win=250 Len=1428 TSval=1209924884 TSecr=4265718617 [TCP segment of a reassembled PDU]"
"999","2.410695","70.186.28.136","192.168.0.92","TCP","1494","443  >  65184 [ACK] Seq=1246120 Ack=616 Win=250 Len=1428 TSval=1209924884 TSecr=4265718617 [TCP segment of a reassembled PDU]"
"1000","2.410696","70.186.28.136","192.168.0.92","TLSv1.2","1494","Application Data"
"1001","2.410696","70.186.28.136","192.168.0.92","TCP","1494","443  >  65184 [ACK] Seq=1248976 Ack=616 Win=250 Len=1428 TSval=1209924884 TSecr=4265718617 [TCP segment of a reassembled PDU]"
"1002","2.410697","70.186.28.136","192.168.0.92","TCP","1494","443  >  65184 [ACK] Seq=1250404 Ack=616 Win=250 Len=1428 TSval=1209924884 TSecr=4265718617 [TCP segment of a reassembled PDU]"
"1003","2.410698","70.186.28.136","192.168.0.92","TCP","1494","443  >  65184 [ACK] Seq=1251832 Ack=616 Win=250 Len=1428 TSval=1209924884 TSecr=4265718617 [TCP segment of a reassembled PDU]"
"1004","2.410699","70.186.28.136","192.168.0.92","TCP","1494","443  >  65184 [ACK] Seq=1253260 Ack=616 Win=250 Len=1428 TSval=1209924884 TSecr=4265718617 [TCP segment of a reassembled PDU]"
"1005","2.410700","70.186.28.136","192.168.0.92","TCP","1494","443  >  65184 [ACK] Seq=1254688 Ack=616 Win=250 Len=1428 TSval=1209924884 TSecr=4265718617 [TCP segment of a reassembled PDU]"
"1006","2.410701","70.186.28.136","192.168.0.92","TCP","1494","443  >  65184 [ACK] Seq=1256116 Ack=616 Win=250 Len=1428 TSval=1209924884 TSecr=4265718617 [TCP segment of a reassembled PDU]"
"1007","2.410702","70.186.28.136","192.168.0.92","TCP","1494","443  >  65184 [ACK] Seq=1257544 Ack=616 Win=250 Len=1428 TSval=1209924884 TSecr=4265718617 [TCP segment of a reassembled PDU]"
"1008","2.410703","70.186.28.136","192.168.0.92","TCP","1494","443  >  65184 [ACK] Seq=1258972 Ack=616 Win=250 Len=1428 TSval=1209924884 TSecr=4265718617 [TCP segment of a reassembled PDU]"
"1009","2.410704","70.186.28.136","192.168.0.92","TCP","1494","443  >  65184 [ACK] Seq=1260400 Ack=616 Win=250 Len=1428 TSval=1209924884 TSecr=4265718617 [TCP segment of a reassembled PDU]"
"1010","2.410705","70.186.28.136","192.168.0.92","TCP","1494","443  >  65184 [ACK] Seq=1261828 Ack=616 Win=250 Len=1428 TSval=1209924884 TSecr=4265718617 [TCP segment of a reassembled PDU]"
"1011","2.410705","70.186.28.136","192.168.0.92","TLSv1.2","1494","Application Data"
"1012","2.410706","70.186.28.136","192.168.0.92","TCP","1494","443  >  65184 [ACK] Seq=1264684 Ack=616 Win=250 Len=1428 TSval=1209924884 TSecr=4265718617 [TCP segment of a reassembled PDU]"
"1013","2.410707","70.186.28.136","192.168.0.92","TCP","1494","443  >  65184 [ACK] Seq=1266112 Ack=616 Win=250 Len=1428 TSval=1209924884 TSecr=4265718617 [TCP segment of a reassembled PDU]"
"1014","2.410708","70.186.28.136","192.168.0.92","TCP","1494","443  >  65184 [ACK] Seq=1267540 Ack=616 Win=250 Len=1428 TSval=1209924884 TSecr=4265718617 [TCP segment of a reassembled PDU]"
"1015","2.410826","192.168.0.92","70.186.28.136","TCP","66","65184  >  443 [ACK] Seq=616 Ack=1268968 Win=65535 Len=0 TSval=4265718662 TSecr=1209924884"
"1016","2.411895","70.186.28.136","192.168.0.92","TCP","1494","443  >  65184 [ACK] Seq=1268968 Ack=616 Win=250 Len=1428 TSval=1209924884 TSecr=4265718617 [TCP segment of a reassembled PDU]"
"1017","2.411897","70.186.28.136","192.168.0.92","TCP","1494","443  >  65184 [ACK] Seq=1270396 Ack=616 Win=250 Len=1428 TSval=1209924884 TSecr=4265718617 [TCP segment of a reassembled PDU]"
"1018","2.411898","70.186.28.136","192.168.0.92","TCP","1494","443  >  65184 [ACK] Seq=1271824 Ack=616 Win=250 Len=1428 TSval=1209924884 TSecr=4265718617 [TCP segment of a reassembled PDU]"
"1019","2.411898","70.186.28.136","192.168.0.92","TCP","1494","443  >  65184 [ACK] Seq=1273252 Ack=616 Win=250 Len=1428 TSval=1209924884 TSecr=4265718617 [TCP segment of a reassembled PDU]"
"1020","2.411899","70.186.28.136","192.168.0.92","TCP","1494","443  >  65184 [ACK] Seq=1274680 Ack=616 Win=250 Len=1428 TSval=1209924884 TSecr=4265718617 [TCP segment of a reassembled PDU]"
"1021","2.411900","70.186.28.136","192.168.0.92","TCP","1494","443  >  65184 [ACK] Seq=1276108 Ack=616 Win=250 Len=1428 TSval=1209924884 TSecr=4265718617 [TCP segment of a reassembled PDU]"
"1022","2.411901","70.186.28.136","192.168.0.92","TCP","1494","443  >  65184 [ACK] Seq=1277536 Ack=616 Win=250 Len=1428 TSval=1209924884 TSecr=4265718617 [TCP segment of a reassembled PDU]"
"1023","2.411902","70.186.28.136","192.168.0.92","TLSv1.2","1494","Application Data"
"1024","2.411903","70.186.28.136","192.168.0.92","TCP","1494","443  >  65184 [ACK] Seq=1280392 Ack=616 Win=250 Len=1428 TSval=1209924885 TSecr=4265718617 [TCP segment of a reassembled PDU]"
"1025","2.411904","70.186.28.136","192.168.0.92","TCP","1494","443  >  65184 [ACK] Seq=1281820 Ack=616 Win=250 Len=1428 TSval=1209924885 TSecr=4265718617 [TCP segment of a reassembled PDU]"
"1026","2.411905","70.186.28.136","192.168.0.92","TCP","1494","443  >  65184 [ACK] Seq=1283248 Ack=616 Win=250 Len=1428 TSval=1209924885 TSecr=4265718617 [TCP segment of a reassembled PDU]"
"1027","2.411905","70.186.28.136","192.168.0.92","TCP","1494","443  >  65184 [ACK] Seq=1284676 Ack=616 Win=250 Len=1428 TSval=1209924885 TSecr=4265718617 [TCP segment of a reassembled PDU]"
"1028","2.411906","70.186.28.136","192.168.0.92","TCP","1494","443  >  65184 [ACK] Seq=1286104 Ack=616 Win=250 Len=1428 TSval=1209924885 TSecr=4265718617 [TCP segment of a reassembled PDU]"
"1029","2.411907","70.186.28.136","192.168.0.92","TCP","1494","443  >  65184 [ACK] Seq=1287532 Ack=616 Win=250 Len=1428 TSval=1209924885 TSecr=4265718617 [TCP segment of a reassembled PDU]"
"1030","2.411908","70.186.28.136","192.168.0.92","TCP","1494","443  >  65184 [ACK] Seq=1288960 Ack=616 Win=250 Len=1428 TSval=1209924885 TSecr=4265718617 [TCP segment of a reassembled PDU]"
"1031","2.411909","70.186.28.136","192.168.0.92","TCP","1494","443  >  65184 [ACK] Seq=1290388 Ack=616 Win=250 Len=1428 TSval=1209924885 TSecr=4265718617 [TCP segment of a reassembled PDU]"
"1032","2.411910","70.186.28.136","192.168.0.92","TCP","1494","443  >  65184 [ACK] Seq=1291816 Ack=616 Win=250 Len=1428 TSval=1209924885 TSecr=4265718617 [TCP segment of a reassembled PDU]"
"1033","2.411911","70.186.28.136","192.168.0.92","TCP","1494","443  >  65184 [ACK] Seq=1293244 Ack=616 Win=250 Len=1428 TSval=1209924885 TSecr=4265718617 [TCP segment of a reassembled PDU]"
"1034","2.411916","70.186.28.136","192.168.0.92","TCP","1494","443  >  65184 [ACK] Seq=1294672 Ack=616 Win=250 Len=1428 TSval=1209924885 TSecr=4265718617 [TCP segment of a reassembled PDU]"
"1035","2.411918","70.186.28.136","192.168.0.92","TLSv1.2","1494","Application Data"
"1036","2.411919","70.186.28.136","192.168.0.92","TCP","1494","443  >  65184 [ACK] Seq=1297528 Ack=616 Win=250 Len=1428 TSval=1209924885 TSecr=4265718617 [TCP segment of a reassembled PDU]"
"1037","2.411920","70.186.28.136","192.168.0.92","TCP","1494","443  >  65184 [ACK] Seq=1298956 Ack=616 Win=250 Len=1428 TSval=1209924885 TSecr=4265718617 [TCP segment of a reassembled PDU]"
"1038","2.411921","70.186.28.136","192.168.0.92","TCP","1494","443  >  65184 [ACK] Seq=1300384 Ack=616 Win=250 Len=1428 TSval=1209924885 TSecr=4265718617 [TCP segment of a reassembled PDU]"
"1039","2.411922","70.186.28.136","192.168.0.92","TCP","1494","443  >  65184 [ACK] Seq=1301812 Ack=616 Win=250 Len=1428 TSval=1209924885 TSecr=4265718617 [TCP segment of a reassembled PDU]"
"1040","2.411923","70.186.28.136","192.168.0.92","TCP","1494","443  >  65184 [ACK] Seq=1303240 Ack=616 Win=250 Len=1428 TSval=1209924885 TSecr=4265718617 [TCP segment of a reassembled PDU]"
"1041","2.411923","70.186.28.136","192.168.0.92","TCP","1494","443  >  65184 [ACK] Seq=1304668 Ack=616 Win=250 Len=1428 TSval=1209924885 TSecr=4265718617 [TCP segment of a reassembled PDU]"
"1042","2.411925","70.186.28.136","192.168.0.92","TCP","1494","443  >  65184 [ACK] Seq=1306096 Ack=616 Win=250 Len=1428 TSval=1209924885 TSecr=4265718617 [TCP segment of a reassembled PDU]"
"1043","2.411925","70.186.28.136","192.168.0.92","TCP","1494","443  >  65184 [ACK] Seq=1307524 Ack=616 Win=250 Len=1428 TSval=1209924885 TSecr=4265718617 [TCP segment of a reassembled PDU]"
"1044","2.411926","70.186.28.136","192.168.0.92","TCP","1494","443  >  65184 [ACK] Seq=1308952 Ack=616 Win=250 Len=1428 TSval=1209924885 TSecr=4265718617 [TCP segment of a reassembled PDU]"
"1045","2.411927","70.186.28.136","192.168.0.92","TCP","1494","443  >  65184 [ACK] Seq=1310380 Ack=616 Win=250 Len=1428 TSval=1209924885 TSecr=4265718617 [TCP segment of a reassembled PDU]"
"1046","2.411928","70.186.28.136","192.168.0.92","TLSv1.2","1494","Application Data"
"1047","2.411929","70.186.28.136","192.168.0.92","TCP","1494","443  >  65184 [ACK] Seq=1313236 Ack=616 Win=250 Len=1428 TSval=1209924885 TSecr=4265718617 [TCP segment of a reassembled PDU]"
"1048","2.411930","70.186.28.136","192.168.0.92","TCP","1494","443  >  65184 [ACK] Seq=1314664 Ack=616 Win=250 Len=1428 TSval=1209924885 TSecr=4265718617 [TCP segment of a reassembled PDU]"
"1049","2.411931","70.186.28.136","192.168.0.92","TCP","1494","443  >  65184 [ACK] Seq=1316092 Ack=616 Win=250 Len=1428 TSval=1209924885 TSecr=4265718617 [TCP segment of a reassembled PDU]"
"1050","2.411932","70.186.28.136","192.168.0.92","TCP","1494","443  >  65184 [ACK] Seq=1317520 Ack=616 Win=250 Len=1428 TSval=1209924885 TSecr=4265718617 [TCP segment of a reassembled PDU]"
"1051","2.411933","70.186.28.136","192.168.0.92","TCP","1494","443  >  65184 [ACK] Seq=1318948 Ack=616 Win=250 Len=1428 TSval=1209924885 TSecr=4265718617 [TCP segment of a reassembled PDU]"
"1052","2.411934","70.186.28.136","192.168.0.92","TCP","1494","443  >  65184 [ACK] Seq=1320376 Ack=616 Win=250 Len=1428 TSval=1209924885 TSecr=4265718617 [TCP segment of a reassembled PDU]"
"1053","2.411934","70.186.28.136","192.168.0.92","TCP","1494","443  >  65184 [ACK] Seq=1321804 Ack=616 Win=250 Len=1428 TSval=1209924885 TSecr=4265718617 [TCP segment of a reassembled PDU]"
"1054","2.411935","70.186.28.136","192.168.0.92","TCP","1494","443  >  65184 [ACK] Seq=1323232 Ack=616 Win=250 Len=1428 TSval=1209924885 TSecr=4265718617 [TCP segment of a reassembled PDU]"
"1055","2.411936","70.186.28.136","192.168.0.92","TCP","1494","443  >  65184 [ACK] Seq=1324660 Ack=616 Win=250 Len=1428 TSval=1209924885 TSecr=4265718617 [TCP segment of a reassembled PDU]"
"1056","2.411937","70.186.28.136","192.168.0.92","TCP","1494","443  >  65184 [ACK] Seq=1326088 Ack=616 Win=250 Len=1428 TSval=1209924885 TSecr=4265718617 [TCP segment of a reassembled PDU]"
"1057","2.412040","70.186.28.136","192.168.0.92","TCP","1494","443  >  65184 [ACK] Seq=1327516 Ack=616 Win=250 Len=1428 TSval=1209924885 TSecr=4265718617 [TCP segment of a reassembled PDU]"
"1058","2.412041","70.186.28.136","192.168.0.92","TLSv1.2","1494","Application Data"
"1059","2.412042","70.186.28.136","192.168.0.92","TCP","1494","443  >  65184 [ACK] Seq=1330372 Ack=616 Win=250 Len=1428 TSval=1209924885 TSecr=4265718617 [TCP segment of a reassembled PDU]"
"1060","2.412043","70.186.28.136","192.168.0.92","TCP","1494","443  >  65184 [ACK] Seq=1331800 Ack=616 Win=250 Len=1428 TSval=1209924885 TSecr=4265718617 [TCP segment of a reassembled PDU]"
"1061","2.412044","70.186.28.136","192.168.0.92","TCP","1494","443  >  65184 [ACK] Seq=1333228 Ack=616 Win=250 Len=1428 TSval=1209924885 TSecr=4265718617 [TCP segment of a reassembled PDU]"
"1062","2.412044","70.186.28.136","192.168.0.92","TCP","1494","443  >  65184 [ACK] Seq=1334656 Ack=616 Win=250 Len=1428 TSval=1209924885 TSecr=4265718617 [TCP segment of a reassembled PDU]"
"1063","2.412045","70.186.28.136","192.168.0.92","TCP","1494","443  >  65184 [ACK] Seq=1336084 Ack=616 Win=250 Len=1428 TSval=1209924885 TSecr=4265718617 [TCP segment of a reassembled PDU]"
"1064","2.412046","70.186.28.136","192.168.0.92","TCP","1494","443  >  65184 [ACK] Seq=1337512 Ack=616 Win=250 Len=1428 TSval=1209924885 TSecr=4265718617 [TCP segment of a reassembled PDU]"
"1065","2.412047","70.186.28.136","192.168.0.92","TCP","1494","443  >  65184 [ACK] Seq=1338940 Ack=616 Win=250 Len=1428 TSval=1209924885 TSecr=4265718617 [TCP segment of a reassembled PDU]"
"1066","2.412048","70.186.28.136","192.168.0.92","TCP","1494","443  >  65184 [ACK] Seq=1340368 Ack=616 Win=250 Len=1428 TSval=1209924885 TSecr=4265718617 [TCP segment of a reassembled PDU]"
"1067","2.412049","70.186.28.136","192.168.0.92","TCP","1494","443  >  65184 [ACK] Seq=1341796 Ack=616 Win=250 Len=1428 TSval=1209924885 TSecr=4265718617 [TCP segment of a reassembled PDU]"
"1068","2.412050","70.186.28.136","192.168.0.92","TCP","1494","443  >  65184 [PSH, ACK] Seq=1343224 Ack=616 Win=250 Len=1428 TSval=1209924885 TSecr=4265718617 [TCP segment of a reassembled PDU]"
"1069","2.412051","70.186.28.136","192.168.0.92","TLSv1.2","1494","Application Data"
"1070","2.412051","70.186.28.136","192.168.0.92","TCP","1494","443  >  65184 [ACK] Seq=1346080 Ack=616 Win=250 Len=1428 TSval=1209924885 TSecr=4265718617 [TCP segment of a reassembled PDU]"
"1071","2.412052","70.186.28.136","192.168.0.92","TCP","1494","443  >  65184 [ACK] Seq=1347508 Ack=616 Win=250 Len=1428 TSval=1209924885 TSecr=4265718617 [TCP segment of a reassembled PDU]"
"1072","2.412053","70.186.28.136","192.168.0.92","TCP","1494","443  >  65184 [ACK] Seq=1348936 Ack=616 Win=250 Len=1428 TSval=1209924885 TSecr=4265718617 [TCP segment of a reassembled PDU]"
"1073","2.412054","70.186.28.136","192.168.0.92","TCP","1494","443  >  65184 [ACK] Seq=1350364 Ack=616 Win=250 Len=1428 TSval=1209924885 TSecr=4265718617 [TCP segment of a reassembled PDU]"
"1074","2.412055","70.186.28.136","192.168.0.92","TCP","1494","443  >  65184 [ACK] Seq=1351792 Ack=616 Win=250 Len=1428 TSval=1209924885 TSecr=4265718617 [TCP segment of a reassembled PDU]"
"1075","2.412056","70.186.28.136","192.168.0.92","TCP","1494","443  >  65184 [ACK] Seq=1353220 Ack=616 Win=250 Len=1428 TSval=1209924885 TSecr=4265718617 [TCP segment of a reassembled PDU]"
"1076","2.412057","70.186.28.136","192.168.0.92","TCP","1494","443  >  65184 [ACK] Seq=1354648 Ack=616 Win=250 Len=1428 TSval=1209924885 TSecr=4265718617 [TCP segment of a reassembled PDU]"
"1077","2.412058","70.186.28.136","192.168.0.92","TCP","1494","443  >  65184 [ACK] Seq=1356076 Ack=616 Win=250 Len=1428 TSval=1209924885 TSecr=4265718617 [TCP segment of a reassembled PDU]"
"1078","2.412059","70.186.28.136","192.168.0.92","TCP","1494","443  >  65184 [ACK] Seq=1357504 Ack=616 Win=250 Len=1428 TSval=1209924885 TSecr=4265718617 [TCP segment of a reassembled PDU]"
"1079","2.412060","70.186.28.136","192.168.0.92","TCP","1494","443  >  65184 [ACK] Seq=1358932 Ack=616 Win=250 Len=1428 TSval=1209924885 TSecr=4265718617 [TCP segment of a reassembled PDU]"
"1080","2.412061","70.186.28.136","192.168.0.92","TCP","1494","443  >  65184 [ACK] Seq=1360360 Ack=616 Win=250 Len=1428 TSval=1209924885 TSecr=4265718617 [TCP segment of a reassembled PDU]"
"1081","2.412062","70.186.28.136","192.168.0.92","TLSv1.2","1494","Application Data"
"1082","2.412063","70.186.28.136","192.168.0.92","TCP","1494","443  >  65184 [ACK] Seq=1363216 Ack=616 Win=250 Len=1428 TSval=1209924885 TSecr=4265718617 [TCP segment of a reassembled PDU]"
"1083","2.412064","70.186.28.136","192.168.0.92","TCP","1494","443  >  65184 [ACK] Seq=1364644 Ack=616 Win=250 Len=1428 TSval=1209924885 TSecr=4265718617 [TCP segment of a reassembled PDU]"
"1084","2.412065","70.186.28.136","192.168.0.92","TCP","1494","443  >  65184 [ACK] Seq=1366072 Ack=616 Win=250 Len=1428 TSval=1209924885 TSecr=4265718617 [TCP segment of a reassembled PDU]"
"1085","2.412065","70.186.28.136","192.168.0.92","TCP","1494","443  >  65184 [ACK] Seq=1367500 Ack=616 Win=250 Len=1428 TSval=1209924885 TSecr=4265718617 [TCP segment of a reassembled PDU]"
"1086","2.412066","70.186.28.136","192.168.0.92","TCP","1494","443  >  65184 [ACK] Seq=1368928 Ack=616 Win=250 Len=1428 TSval=1209924885 TSecr=4265718617 [TCP segment of a reassembled PDU]"
"1087","2.412067","70.186.28.136","192.168.0.92","TCP","1494","443  >  65184 [ACK] Seq=1370356 Ack=616 Win=250 Len=1428 TSval=1209924885 TSecr=4265718617 [TCP segment of a reassembled PDU]"
"1088","2.412105","192.168.0.92","70.186.28.136","TCP","66","65184  >  443 [ACK] Seq=616 Ack=1327516 Win=65535 Len=0 TSval=4265718663 TSecr=1209924885"
"1089","2.412142","192.168.0.92","70.186.28.136","TCP","66","65184  >  443 [ACK] Seq=616 Ack=1371784 Win=65535 Len=0 TSval=4265718663 TSecr=1209924885"
"1090","2.412685","70.186.28.136","192.168.0.92","TCP","1494","443  >  65184 [ACK] Seq=1371784 Ack=616 Win=250 Len=1428 TSval=1209924885 TSecr=4265718617 [TCP segment of a reassembled PDU]"
"1091","2.412686","70.186.28.136","192.168.0.92","TCP","1494","443  >  65184 [ACK] Seq=1373212 Ack=616 Win=250 Len=1428 TSval=1209924885 TSecr=4265718617 [TCP segment of a reassembled PDU]"
"1092","2.412687","70.186.28.136","192.168.0.92","TCP","1494","443  >  65184 [ACK] Seq=1374640 Ack=616 Win=250 Len=1428 TSval=1209924885 TSecr=4265718617 [TCP segment of a reassembled PDU]"
"1093","2.412688","70.186.28.136","192.168.0.92","TCP","1494","443  >  65184 [ACK] Seq=1376068 Ack=616 Win=250 Len=1428 TSval=1209924885 TSecr=4265718617 [TCP segment of a reassembled PDU]"
"1094","2.412689","70.186.28.136","192.168.0.92","TLSv1.2","1494","Application Data"
"1095","2.412689","70.186.28.136","192.168.0.92","TCP","1494","443  >  65184 [ACK] Seq=1378924 Ack=616 Win=250 Len=1428 TSval=1209924885 TSecr=4265718617 [TCP segment of a reassembled PDU]"
"1096","2.412690","70.186.28.136","192.168.0.92","TCP","1494","443  >  65184 [ACK] Seq=1380352 Ack=616 Win=250 Len=1428 TSval=1209924885 TSecr=4265718617 [TCP segment of a reassembled PDU]"
"1097","2.412691","70.186.28.136","192.168.0.92","TCP","1494","443  >  65184 [ACK] Seq=1381780 Ack=616 Win=250 Len=1428 TSval=1209924885 TSecr=4265718617 [TCP segment of a reassembled PDU]"
"1098","2.412692","70.186.28.136","192.168.0.92","TCP","1494","443  >  65184 [ACK] Seq=1383208 Ack=616 Win=250 Len=1428 TSval=1209924885 TSecr=4265718617 [TCP segment of a reassembled PDU]"
"1099","2.412693","70.186.28.136","192.168.0.92","TCP","1494","443  >  65184 [ACK] Seq=1384636 Ack=616 Win=250 Len=1428 TSval=1209924885 TSecr=4265718617 [TCP segment of a reassembled PDU]"
"1100","2.412694","70.186.28.136","192.168.0.92","TCP","1494","443  >  65184 [ACK] Seq=1386064 Ack=616 Win=250 Len=1428 TSval=1209924885 TSecr=4265718617 [TCP segment of a reassembled PDU]"
"1101","2.412694","70.186.28.136","192.168.0.92","TCP","1494","443  >  65184 [ACK] Seq=1387492 Ack=616 Win=250 Len=1428 TSval=1209924885 TSecr=4265718617 [TCP segment of a reassembled PDU]"
"1102","2.412695","70.186.28.136","192.168.0.92","TCP","1494","443  >  65184 [ACK] Seq=1388920 Ack=616 Win=250 Len=1428 TSval=1209924885 TSecr=4265718617 [TCP segment of a reassembled PDU]"
"1103","2.412696","70.186.28.136","192.168.0.92","TCP","1494","443  >  65184 [ACK] Seq=1390348 Ack=616 Win=250 Len=1428 TSval=1209924885 TSecr=4265718617 [TCP segment of a reassembled PDU]"
"1104","2.412697","70.186.28.136","192.168.0.92","TCP","1494","443  >  65184 [ACK] Seq=1391776 Ack=616 Win=250 Len=1428 TSval=1209924885 TSecr=4265718617 [TCP segment of a reassembled PDU]"
"1105","2.412698","70.186.28.136","192.168.0.92","TCP","1494","443  >  65184 [ACK] Seq=1393204 Ack=616 Win=250 Len=1428 TSval=1209924885 TSecr=4265718617 [TCP segment of a reassembled PDU]"
"1106","2.412699","70.186.28.136","192.168.0.92","TLSv1.2","1494","Application Data"
"1107","2.412700","70.186.28.136","192.168.0.92","TCP","1494","443  >  65184 [ACK] Seq=1396060 Ack=616 Win=250 Len=1428 TSval=1209924885 TSecr=4265718617 [TCP segment of a reassembled PDU]"
"1108","2.412701","70.186.28.136","192.168.0.92","TCP","1494","443  >  65184 [ACK] Seq=1397488 Ack=616 Win=250 Len=1428 TSval=1209924885 TSecr=4265718617 [TCP segment of a reassembled PDU]"
"1109","2.412701","70.186.28.136","192.168.0.92","TCP","1494","443  >  65184 [ACK] Seq=1398916 Ack=616 Win=250 Len=1428 TSval=1209924885 TSecr=4265718617 [TCP segment of a reassembled PDU]"
"1110","2.412702","70.186.28.136","192.168.0.92","TCP","1494","443  >  65184 [ACK] Seq=1400344 Ack=616 Win=250 Len=1428 TSval=1209924885 TSecr=4265718617 [TCP segment of a reassembled PDU]"
"1111","2.412703","70.186.28.136","192.168.0.92","TCP","1494","443  >  65184 [ACK] Seq=1401772 Ack=616 Win=250 Len=1428 TSval=1209924885 TSecr=4265718617 [TCP segment of a reassembled PDU]"
"1112","2.412704","70.186.28.136","192.168.0.92","TCP","1494","443  >  65184 [ACK] Seq=1403200 Ack=616 Win=250 Len=1428 TSval=1209924885 TSecr=4265718617 [TCP segment of a reassembled PDU]"
"1113","2.412705","70.186.28.136","192.168.0.92","TCP","1494","443  >  65184 [ACK] Seq=1404628 Ack=616 Win=250 Len=1428 TSval=1209924885 TSecr=4265718617 [TCP segment of a reassembled PDU]"
"1114","2.412706","70.186.28.136","192.168.0.92","TCP","1494","443  >  65184 [ACK] Seq=1406056 Ack=616 Win=250 Len=1428 TSval=1209924885 TSecr=4265718617 [TCP segment of a reassembled PDU]"
"1115","2.412707","70.186.28.136","192.168.0.92","TCP","1494","443  >  65184 [PSH, ACK] Seq=1407484 Ack=616 Win=250 Len=1428 TSval=1209924885 TSecr=4265718617 [TCP segment of a reassembled PDU]"
"1116","2.412708","70.186.28.136","192.168.0.92","TCP","1494","443  >  65184 [ACK] Seq=1408912 Ack=616 Win=250 Len=1428 TSval=1209924886 TSecr=4265718643 [TCP segment of a reassembled PDU]"
"1117","2.412709","70.186.28.136","192.168.0.92","TLSv1.2","1494","Application Data"
"1118","2.412709","70.186.28.136","192.168.0.92","TCP","1494","443  >  65184 [ACK] Seq=1411768 Ack=616 Win=250 Len=1428 TSval=1209924886 TSecr=4265718643 [TCP segment of a reassembled PDU]"
"1119","2.412710","70.186.28.136","192.168.0.92","TCP","1494","443  >  65184 [ACK] Seq=1413196 Ack=616 Win=250 Len=1428 TSval=1209924886 TSecr=4265718643 [TCP segment of a reassembled PDU]"
"1120","2.412711","70.186.28.136","192.168.0.92","TCP","1494","443  >  65184 [ACK] Seq=1414624 Ack=616 Win=250 Len=1428 TSval=1209924886 TSecr=4265718643 [TCP segment of a reassembled PDU]"
"1121","2.412712","70.186.28.136","192.168.0.92","TCP","1494","443  >  65184 [ACK] Seq=1416052 Ack=616 Win=250 Len=1428 TSval=1209924886 TSecr=4265718643 [TCP segment of a reassembled PDU]"
"1122","2.412827","192.168.0.92","70.186.28.136","TCP","66","65184  >  443 [ACK] Seq=616 Ack=1417480 Win=65535 Len=0 TSval=4265718663 TSecr=1209924885"
"1123","2.413456","70.186.28.136","192.168.0.92","TCP","1494","443  >  65184 [ACK] Seq=1417480 Ack=616 Win=250 Len=1428 TSval=1209924886 TSecr=4265718643 [TCP segment of a reassembled PDU]"
"1124","2.413457","70.186.28.136","192.168.0.92","TCP","1494","443  >  65184 [ACK] Seq=1418908 Ack=616 Win=250 Len=1428 TSval=1209924886 TSecr=4265718643 [TCP segment of a reassembled PDU]"
"1125","2.413459","70.186.28.136","192.168.0.92","TCP","1494","443  >  65184 [ACK] Seq=1420336 Ack=616 Win=250 Len=1428 TSval=1209924886 TSecr=4265718643 [TCP segment of a reassembled PDU]"
"1126","2.413459","70.186.28.136","192.168.0.92","TCP","1494","443  >  65184 [ACK] Seq=1421764 Ack=616 Win=250 Len=1428 TSval=1209924886 TSecr=4265718643 [TCP segment of a reassembled PDU]"
"1127","2.413460","70.186.28.136","192.168.0.92","TCP","1494","443  >  65184 [ACK] Seq=1423192 Ack=616 Win=250 Len=1428 TSval=1209924886 TSecr=4265718643 [TCP segment of a reassembled PDU]"
"1128","2.413461","70.186.28.136","192.168.0.92","TCP","1494","443  >  65184 [ACK] Seq=1424620 Ack=616 Win=250 Len=1428 TSval=1209924886 TSecr=4265718643 [TCP segment of a reassembled PDU]"
"1129","2.413462","70.186.28.136","192.168.0.92","TCP","1494","443  >  65184 [ACK] Seq=1426048 Ack=616 Win=250 Len=1428 TSval=1209924886 TSecr=4265718643 [TCP segment of a reassembled PDU]"
"1130","2.413463","70.186.28.136","192.168.0.92","TLSv1.2","1494","Application Data"
"1131","2.413464","70.186.28.136","192.168.0.92","TCP","1494","443  >  65184 [ACK] Seq=1428904 Ack=616 Win=250 Len=1428 TSval=1209924886 TSecr=4265718643 [TCP segment of a reassembled PDU]"
"1132","2.413465","70.186.28.136","192.168.0.92","TCP","1494","443  >  65184 [ACK] Seq=1430332 Ack=616 Win=250 Len=1428 TSval=1209924886 TSecr=4265718643 [TCP segment of a reassembled PDU]"
"1133","2.413466","70.186.28.136","192.168.0.92","TCP","1494","443  >  65184 [ACK] Seq=1431760 Ack=616 Win=250 Len=1428 TSval=1209924886 TSecr=4265718643 [TCP segment of a reassembled PDU]"
"1134","2.413466","70.186.28.136","192.168.0.92","TCP","1494","443  >  65184 [ACK] Seq=1433188 Ack=616 Win=250 Len=1428 TSval=1209924886 TSecr=4265718643 [TCP segment of a reassembled PDU]"
"1135","2.413467","70.186.28.136","192.168.0.92","TCP","1494","443  >  65184 [ACK] Seq=1434616 Ack=616 Win=250 Len=1428 TSval=1209924886 TSecr=4265718643 [TCP segment of a reassembled PDU]"
"1136","2.413468","70.186.28.136","192.168.0.92","TCP","1494","443  >  65184 [ACK] Seq=1436044 Ack=616 Win=250 Len=1428 TSval=1209924886 TSecr=4265718643 [TCP segment of a reassembled PDU]"
"1137","2.413469","70.186.28.136","192.168.0.92","TCP","1494","443  >  65184 [ACK] Seq=1437472 Ack=616 Win=250 Len=1428 TSval=1209924886 TSecr=4265718643 [TCP segment of a reassembled PDU]"
"1138","2.413470","70.186.28.136","192.168.0.92","TCP","1494","443  >  65184 [ACK] Seq=1438900 Ack=616 Win=250 Len=1428 TSval=1209924886 TSecr=4265718643 [TCP segment of a reassembled PDU]"
"1139","2.413470","70.186.28.136","192.168.0.92","TCP","1494","443  >  65184 [ACK] Seq=1440328 Ack=616 Win=250 Len=1428 TSval=1209924886 TSecr=4265718643 [TCP segment of a reassembled PDU]"
"1140","2.413472","70.186.28.136","192.168.0.92","TCP","1494","443  >  65184 [ACK] Seq=1441756 Ack=616 Win=250 Len=1428 TSval=1209924886 TSecr=4265718643 [TCP segment of a reassembled PDU]"
"1141","2.413473","70.186.28.136","192.168.0.92","TLSv1.2","1494","Application Data"
"1142","2.413473","70.186.28.136","192.168.0.92","TCP","1494","443  >  65184 [ACK] Seq=1444612 Ack=616 Win=250 Len=1428 TSval=1209924886 TSecr=4265718643 [TCP segment of a reassembled PDU]"
"1143","2.413474","70.186.28.136","192.168.0.92","TCP","1494","443  >  65184 [ACK] Seq=1446040 Ack=616 Win=250 Len=1428 TSval=1209924886 TSecr=4265718643 [TCP segment of a reassembled PDU]"
"1144","2.413475","70.186.28.136","192.168.0.92","TCP","1494","443  >  65184 [ACK] Seq=1447468 Ack=616 Win=250 Len=1428 TSval=1209924886 TSecr=4265718643 [TCP segment of a reassembled PDU]"
"1145","2.413476","70.186.28.136","192.168.0.92","TCP","1494","443  >  65184 [ACK] Seq=1448896 Ack=616 Win=250 Len=1428 TSval=1209924886 TSecr=4265718643 [TCP segment of a reassembled PDU]"
"1146","2.413477","70.186.28.136","192.168.0.92","TCP","1494","443  >  65184 [ACK] Seq=1450324 Ack=616 Win=250 Len=1428 TSval=1209924886 TSecr=4265718643 [TCP segment of a reassembled PDU]"
"1147","2.413567","192.168.0.92","70.186.28.136","TCP","66","65184  >  443 [ACK] Seq=616 Ack=1451752 Win=65535 Len=0 TSval=4265718665 TSecr=1209924886"
"1148","2.414631","70.186.28.136","192.168.0.92","TCP","1494","443  >  65184 [ACK] Seq=1451752 Ack=616 Win=250 Len=1428 TSval=1209924886 TSecr=4265718643 [TCP segment of a reassembled PDU]"
"1149","2.414632","70.186.28.136","192.168.0.92","TCP","1494","443  >  65184 [ACK] Seq=1453180 Ack=616 Win=250 Len=1428 TSval=1209924886 TSecr=4265718643 [TCP segment of a reassembled PDU]"
"1150","2.414633","70.186.28.136","192.168.0.92","TCP","1494","443  >  65184 [ACK] Seq=1454608 Ack=616 Win=250 Len=1428 TSval=1209924886 TSecr=4265718643 [TCP segment of a reassembled PDU]"
"1151","2.414635","70.186.28.136","192.168.0.92","TCP","1494","443  >  65184 [ACK] Seq=1456036 Ack=616 Win=250 Len=1428 TSval=1209924886 TSecr=4265718643 [TCP segment of a reassembled PDU]"
"1152","2.414636","70.186.28.136","192.168.0.92","TCP","1494","443  >  65184 [ACK] Seq=1457464 Ack=616 Win=250 Len=1428 TSval=1209924886 TSecr=4265718643 [TCP segment of a reassembled PDU]"
"1153","2.414637","70.186.28.136","192.168.0.92","TCP","1494","443  >  65184 [ACK] Seq=1458892 Ack=616 Win=250 Len=1428 TSval=1209924886 TSecr=4265718643 [TCP segment of a reassembled PDU]"
"1154","2.414638","70.186.28.136","192.168.0.92","TLSv1.2","1494","Application Data"
"1155","2.414639","70.186.28.136","192.168.0.92","TCP","1494","443  >  65184 [ACK] Seq=1461748 Ack=616 Win=250 Len=1428 TSval=1209924886 TSecr=4265718643 [TCP segment of a reassembled PDU]"
"1156","2.414645","70.186.28.136","192.168.0.92","TCP","1494","443  >  65184 [ACK] Seq=1463176 Ack=616 Win=250 Len=1428 TSval=1209924886 TSecr=4265718643 [TCP segment of a reassembled PDU]"
"1157","2.414646","70.186.28.136","192.168.0.92","TCP","1494","443  >  65184 [ACK] Seq=1464604 Ack=616 Win=250 Len=1428 TSval=1209924886 TSecr=4265718643 [TCP segment of a reassembled PDU]"
"1158","2.414648","70.186.28.136","192.168.0.92","TCP","1494","443  >  65184 [ACK] Seq=1466032 Ack=616 Win=250 Len=1428 TSval=1209924886 TSecr=4265718643 [TCP segment of a reassembled PDU]"
"1159","2.414649","70.186.28.136","192.168.0.92","TCP","1494","443  >  65184 [ACK] Seq=1467460 Ack=616 Win=250 Len=1428 TSval=1209924886 TSecr=4265718643 [TCP segment of a reassembled PDU]"
"1160","2.414650","70.186.28.136","192.168.0.92","TCP","1494","443  >  65184 [ACK] Seq=1468888 Ack=616 Win=250 Len=1428 TSval=1209924886 TSecr=4265718643 [TCP segment of a reassembled PDU]"
"1161","2.414651","70.186.28.136","192.168.0.92","TCP","1494","443  >  65184 [ACK] Seq=1470316 Ack=616 Win=250 Len=1428 TSval=1209924886 TSecr=4265718643 [TCP segment of a reassembled PDU]"
"1162","2.414652","70.186.28.136","192.168.0.92","TCP","1494","443  >  65184 [PSH, ACK] Seq=1471744 Ack=616 Win=250 Len=1428 TSval=1209924886 TSecr=4265718643 [TCP segment of a reassembled PDU]"
"1163","2.414653","70.186.28.136","192.168.0.92","TCP","1494","443  >  65184 [ACK] Seq=1473172 Ack=616 Win=250 Len=1428 TSval=1209924887 TSecr=4265718643 [TCP segment of a reassembled PDU]"
"1164","2.414655","70.186.28.136","192.168.0.92","TCP","1494","443  >  65184 [ACK] Seq=1474600 Ack=616 Win=250 Len=1428 TSval=1209924887 TSecr=4265718643 [TCP segment of a reassembled PDU]"
"1165","2.414656","70.186.28.136","192.168.0.92","TLSv1.2","1494","Application Data"
"1166","2.414657","70.186.28.136","192.168.0.92","TCP","1494","443  >  65184 [ACK] Seq=1477456 Ack=616 Win=250 Len=1428 TSval=1209924887 TSecr=4265718643 [TCP segment of a reassembled PDU]"
"1167","2.414658","70.186.28.136","192.168.0.92","TCP","1494","443  >  65184 [ACK] Seq=1478884 Ack=616 Win=250 Len=1428 TSval=1209924887 TSecr=4265718643 [TCP segment of a reassembled PDU]"
"1168","2.414660","70.186.28.136","192.168.0.92","TCP","1494","443  >  65184 [ACK] Seq=1480312 Ack=616 Win=250 Len=1428 TSval=1209924887 TSecr=4265718643 [TCP segment of a reassembled PDU]"
"1169","2.414661","70.186.28.136","192.168.0.92","TCP","1494","443  >  65184 [ACK] Seq=1481740 Ack=616 Win=250 Len=1428 TSval=1209924887 TSecr=4265718643 [TCP segment of a reassembled PDU]"
"1170","2.414662","70.186.28.136","192.168.0.92","TCP","1494","443  >  65184 [ACK] Seq=1483168 Ack=616 Win=250 Len=1428 TSval=1209924887 TSecr=4265718643 [TCP segment of a reassembled PDU]"
"1171","2.414663","70.186.28.136","192.168.0.92","TCP","1494","443  >  65184 [ACK] Seq=1484596 Ack=616 Win=250 Len=1428 TSval=1209924887 TSecr=4265718643 [TCP segment of a reassembled PDU]"
"1172","2.414664","70.186.28.136","192.168.0.92","TCP","1494","443  >  65184 [ACK] Seq=1486024 Ack=616 Win=250 Len=1428 TSval=1209924887 TSecr=4265718643 [TCP segment of a reassembled PDU]"
"1173","2.414665","70.186.28.136","192.168.0.92","TCP","1494","443  >  65184 [ACK] Seq=1487452 Ack=616 Win=250 Len=1428 TSval=1209924887 TSecr=4265718643 [TCP segment of a reassembled PDU]"
"1174","2.414666","70.186.28.136","192.168.0.92","TCP","1494","443  >  65184 [ACK] Seq=1488880 Ack=616 Win=250 Len=1428 TSval=1209924887 TSecr=4265718643 [TCP segment of a reassembled PDU]"
"1175","2.414667","70.186.28.136","192.168.0.92","TCP","1494","443  >  65184 [ACK] Seq=1490308 Ack=616 Win=250 Len=1428 TSval=1209924887 TSecr=4265718643 [TCP segment of a reassembled PDU]"
"1176","2.414668","70.186.28.136","192.168.0.92","TCP","1494","443  >  65184 [ACK] Seq=1491736 Ack=616 Win=250 Len=1428 TSval=1209924887 TSecr=4265718643 [TCP segment of a reassembled PDU]"
"1177","2.414669","70.186.28.136","192.168.0.92","TLSv1.2","1494","Application Data"
"1178","2.414671","70.186.28.136","192.168.0.92","TCP","1494","443  >  65184 [ACK] Seq=1494592 Ack=616 Win=250 Len=1428 TSval=1209924887 TSecr=4265718643 [TCP segment of a reassembled PDU]"
"1179","2.414672","70.186.28.136","192.168.0.92","TCP","1494","443  >  65184 [ACK] Seq=1496020 Ack=616 Win=250 Len=1428 TSval=1209924887 TSecr=4265718643 [TCP segment of a reassembled PDU]"
"1180","2.414770","192.168.0.92","70.186.28.136","TCP","66","65184  >  443 [ACK] Seq=616 Ack=1497448 Win=65535 Len=0 TSval=4265718666 TSecr=1209924886"
"1181","2.414979","70.186.28.136","192.168.0.92","TCP","1494","443  >  65184 [ACK] Seq=1497448 Ack=616 Win=250 Len=1428 TSval=1209924887 TSecr=4265718643 [TCP segment of a reassembled PDU]"
"1182","2.414980","70.186.28.136","192.168.0.92","TCP","1494","443  >  65184 [ACK] Seq=1498876 Ack=616 Win=250 Len=1428 TSval=1209924887 TSecr=4265718643 [TCP segment of a reassembled PDU]"
"1183","2.414982","70.186.28.136","192.168.0.92","TCP","1494","443  >  65184 [ACK] Seq=1500304 Ack=616 Win=250 Len=1428 TSval=1209924887 TSecr=4265718643 [TCP segment of a reassembled PDU]"
"1184","2.414983","70.186.28.136","192.168.0.92","TCP","1494","443  >  65184 [ACK] Seq=1501732 Ack=616 Win=250 Len=1428 TSval=1209924887 TSecr=4265718643 [TCP segment of a reassembled PDU]"
"1185","2.414984","70.186.28.136","192.168.0.92","TCP","1494","443  >  65184 [ACK] Seq=1503160 Ack=616 Win=250 Len=1428 TSval=1209924887 TSecr=4265718643 [TCP segment of a reassembled PDU]"
"1186","2.414985","70.186.28.136","192.168.0.92","TCP","1494","443  >  65184 [ACK] Seq=1504588 Ack=616 Win=250 Len=1428 TSval=1209924887 TSecr=4265718643 [TCP segment of a reassembled PDU]"
"1187","2.414986","70.186.28.136","192.168.0.92","TCP","1494","443  >  65184 [ACK] Seq=1506016 Ack=616 Win=250 Len=1428 TSval=1209924887 TSecr=4265718643 [TCP segment of a reassembled PDU]"
"1188","2.414988","70.186.28.136","192.168.0.92","TCP","1494","443  >  65184 [ACK] Seq=1507444 Ack=616 Win=250 Len=1428 TSval=1209924887 TSecr=4265718643 [TCP segment of a reassembled PDU]"
"1189","2.414989","70.186.28.136","192.168.0.92","TLSv1.2","1494","Application Data"
"1190","2.414990","70.186.28.136","192.168.0.92","TCP","1494","443  >  65184 [ACK] Seq=1510300 Ack=616 Win=250 Len=1428 TSval=1209924887 TSecr=4265718643 [TCP segment of a reassembled PDU]"
"1191","2.414992","70.186.28.136","192.168.0.92","TCP","1494","443  >  65184 [ACK] Seq=1511728 Ack=616 Win=250 Len=1428 TSval=1209924887 TSecr=4265718643 [TCP segment of a reassembled PDU]"
"1192","2.414993","70.186.28.136","192.168.0.92","TCP","1494","443  >  65184 [ACK] Seq=1513156 Ack=616 Win=250 Len=1428 TSval=1209924887 TSecr=4265718643 [TCP segment of a reassembled PDU]"
"1193","2.414994","70.186.28.136","192.168.0.92","TCP","1494","443  >  65184 [ACK] Seq=1514584 Ack=616 Win=250 Len=1428 TSval=1209924887 TSecr=4265718643 [TCP segment of a reassembled PDU]"
"1194","2.414995","70.186.28.136","192.168.0.92","TCP","1494","443  >  65184 [ACK] Seq=1516012 Ack=616 Win=250 Len=1428 TSval=1209924887 TSecr=4265718643 [TCP segment of a reassembled PDU]"
"1195","2.414996","70.186.28.136","192.168.0.92","TCP","1494","443  >  65184 [ACK] Seq=1517440 Ack=616 Win=250 Len=1428 TSval=1209924887 TSecr=4265718643 [TCP segment of a reassembled PDU]"
"1196","2.414997","70.186.28.136","192.168.0.92","TCP","1494","443  >  65184 [ACK] Seq=1518868 Ack=616 Win=250 Len=1428 TSval=1209924887 TSecr=4265718643 [TCP segment of a reassembled PDU]"
"1197","2.414998","70.186.28.136","192.168.0.92","TCP","1494","443  >  65184 [ACK] Seq=1520296 Ack=616 Win=250 Len=1428 TSval=1209924887 TSecr=4265718643 [TCP segment of a reassembled PDU]"
"1198","2.415000","70.186.28.136","192.168.0.92","TCP","1494","443  >  65184 [ACK] Seq=1521724 Ack=616 Win=250 Len=1428 TSval=1209924887 TSecr=4265718643 [TCP segment of a reassembled PDU]"
"1199","2.415001","70.186.28.136","192.168.0.92","TCP","1494","443  >  65184 [ACK] Seq=1523152 Ack=616 Win=250 Len=1428 TSval=1209924887 TSecr=4265718643 [TCP segment of a reassembled PDU]"
"1200","2.415002","70.186.28.136","192.168.0.92","TCP","1494","443  >  65184 [ACK] Seq=1524580 Ack=616 Win=250 Len=1428 TSval=1209924887 TSecr=4265718643 [TCP segment of a reassembled PDU]"
"1201","2.415003","70.186.28.136","192.168.0.92","TLSv1.2","1494","Application Data"
"1202","2.415004","70.186.28.136","192.168.0.92","TCP","1494","443  >  65184 [ACK] Seq=1527436 Ack=616 Win=250 Len=1428 TSval=1209924887 TSecr=4265718643 [TCP segment of a reassembled PDU]"
"1203","2.415005","70.186.28.136","192.168.0.92","TCP","1494","443  >  65184 [ACK] Seq=1528864 Ack=616 Win=250 Len=1428 TSval=1209924887 TSecr=4265718643 [TCP segment of a reassembled PDU]"
"1204","2.415007","70.186.28.136","192.168.0.92","TCP","1494","443  >  65184 [ACK] Seq=1530292 Ack=616 Win=250 Len=1428 TSval=1209924887 TSecr=4265718643 [TCP segment of a reassembled PDU]"
"1205","2.415007","70.186.28.136","192.168.0.92","TCP","1494","443  >  65184 [ACK] Seq=1531720 Ack=616 Win=250 Len=1428 TSval=1209924887 TSecr=4265718643 [TCP segment of a reassembled PDU]"
"1206","2.415008","70.186.28.136","192.168.0.92","TCP","1494","443  >  65184 [ACK] Seq=1533148 Ack=616 Win=250 Len=1428 TSval=1209924887 TSecr=4265718643 [TCP segment of a reassembled PDU]"
"1207","2.415010","70.186.28.136","192.168.0.92","TCP","1494","443  >  65184 [ACK] Seq=1534576 Ack=616 Win=250 Len=1428 TSval=1209924887 TSecr=4265718643 [TCP segment of a reassembled PDU]"
"1208","2.415010","70.186.28.136","192.168.0.92","TCP","1494","443  >  65184 [PSH, ACK] Seq=1536004 Ack=616 Win=250 Len=1428 TSval=1209924887 TSecr=4265718643 [TCP segment of a reassembled PDU]"
"1209","2.415011","70.186.28.136","192.168.0.92","TCP","1494","443  >  65184 [ACK] Seq=1537432 Ack=616 Win=250 Len=1428 TSval=1209924888 TSecr=4265718643 [TCP segment of a reassembled PDU]"
"1210","2.415013","70.186.28.136","192.168.0.92","TCP","1494","443  >  65184 [ACK] Seq=1538860 Ack=616 Win=250 Len=1428 TSval=1209924888 TSecr=4265718643 [TCP segment of a reassembled PDU]"
"1211","2.415014","70.186.28.136","192.168.0.92","TCP","1494","443  >  65184 [ACK] Seq=1540288 Ack=616 Win=250 Len=1428 TSval=1209924888 TSecr=4265718643 [TCP segment of a reassembled PDU]"
"1212","2.415015","70.186.28.136","192.168.0.92","TLSv1.2","1494","Application Data"
"1213","2.415109","192.168.0.92","70.186.28.136","TCP","66","65184  >  443 [ACK] Seq=616 Ack=1543144 Win=65535 Len=0 TSval=4265718666 TSecr=1209924887"
"1214","2.415680","70.186.28.136","192.168.0.92","TCP","1494","443  >  65184 [ACK] Seq=1543144 Ack=616 Win=250 Len=1428 TSval=1209924888 TSecr=4265718643 [TCP segment of a reassembled PDU]"
"1215","2.415681","70.186.28.136","192.168.0.92","TCP","1494","443  >  65184 [ACK] Seq=1544572 Ack=616 Win=250 Len=1428 TSval=1209924888 TSecr=4265718643 [TCP segment of a reassembled PDU]"
"1216","2.415682","70.186.28.136","192.168.0.92","TCP","1494","443  >  65184 [ACK] Seq=1546000 Ack=616 Win=250 Len=1428 TSval=1209924888 TSecr=4265718643 [TCP segment of a reassembled PDU]"
"1217","2.415683","70.186.28.136","192.168.0.92","TCP","1494","443  >  65184 [ACK] Seq=1547428 Ack=616 Win=250 Len=1428 TSval=1209924888 TSecr=4265718643 [TCP segment of a reassembled PDU]"
"1218","2.415684","70.186.28.136","192.168.0.92","TCP","1494","443  >  65184 [ACK] Seq=1548856 Ack=616 Win=250 Len=1428 TSval=1209924888 TSecr=4265718643 [TCP segment of a reassembled PDU]"
"1219","2.415685","70.186.28.136","192.168.0.92","TCP","1494","443  >  65184 [ACK] Seq=1550284 Ack=616 Win=250 Len=1428 TSval=1209924888 TSecr=4265718643 [TCP segment of a reassembled PDU]"
"1220","2.415686","70.186.28.136","192.168.0.92","TCP","1494","443  >  65184 [ACK] Seq=1551712 Ack=616 Win=250 Len=1428 TSval=1209924888 TSecr=4265718643 [TCP segment of a reassembled PDU]"
"1221","2.415687","70.186.28.136","192.168.0.92","TCP","1494","443  >  65184 [ACK] Seq=1553140 Ack=616 Win=250 Len=1428 TSval=1209924888 TSecr=4265718643 [TCP segment of a reassembled PDU]"
"1222","2.415688","70.186.28.136","192.168.0.92","TCP","1494","443  >  65184 [ACK] Seq=1554568 Ack=616 Win=250 Len=1428 TSval=1209924888 TSecr=4265718643 [TCP segment of a reassembled PDU]"
"1223","2.415690","70.186.28.136","192.168.0.92","TCP","1494","443  >  65184 [ACK] Seq=1555996 Ack=616 Win=250 Len=1428 TSval=1209924888 TSecr=4265718643 [TCP segment of a reassembled PDU]"
"1224","2.415691","70.186.28.136","192.168.0.92","TCP","1494","443  >  65184 [ACK] Seq=1557424 Ack=616 Win=250 Len=1428 TSval=1209924888 TSecr=4265718643 [TCP segment of a reassembled PDU]"
"1225","2.415692","70.186.28.136","192.168.0.92","TLSv1.2","1494","Application Data"
"1226","2.415693","70.186.28.136","192.168.0.92","TCP","1494","443  >  65184 [ACK] Seq=1560280 Ack=616 Win=250 Len=1428 TSval=1209924888 TSecr=4265718643 [TCP segment of a reassembled PDU]"
"1227","2.415694","70.186.28.136","192.168.0.92","TCP","1494","443  >  65184 [ACK] Seq=1561708 Ack=616 Win=250 Len=1428 TSval=1209924888 TSecr=4265718643 [TCP segment of a reassembled PDU]"
"1228","2.415696","70.186.28.136","192.168.0.92","TCP","1494","443  >  65184 [ACK] Seq=1563136 Ack=616 Win=250 Len=1428 TSval=1209924888 TSecr=4265718643 [TCP segment of a reassembled PDU]"
"1229","2.415697","70.186.28.136","192.168.0.92","TCP","1494","443  >  65184 [ACK] Seq=1564564 Ack=616 Win=250 Len=1428 TSval=1209924888 TSecr=4265718643 [TCP segment of a reassembled PDU]"
"1230","2.415698","70.186.28.136","192.168.0.92","TCP","1494","443  >  65184 [ACK] Seq=1565992 Ack=616 Win=250 Len=1428 TSval=1209924888 TSecr=4265718643 [TCP segment of a reassembled PDU]"
"1231","2.415700","70.186.28.136","192.168.0.92","TCP","1494","443  >  65184 [ACK] Seq=1567420 Ack=616 Win=250 Len=1428 TSval=1209924888 TSecr=4265718643 [TCP segment of a reassembled PDU]"
"1232","2.415701","70.186.28.136","192.168.0.92","TCP","1494","443  >  65184 [ACK] Seq=1568848 Ack=616 Win=250 Len=1428 TSval=1209924888 TSecr=4265718643 [TCP segment of a reassembled PDU]"
"1233","2.415702","70.186.28.136","192.168.0.92","TCP","1494","443  >  65184 [ACK] Seq=1570276 Ack=616 Win=250 Len=1428 TSval=1209924888 TSecr=4265718643 [TCP segment of a reassembled PDU]"
"1234","2.415703","70.186.28.136","192.168.0.92","TCP","1494","443  >  65184 [ACK] Seq=1571704 Ack=616 Win=250 Len=1428 TSval=1209924888 TSecr=4265718643 [TCP segment of a reassembled PDU]"
"1235","2.415707","70.186.28.136","192.168.0.92","TCP","1494","443  >  65184 [ACK] Seq=1573132 Ack=616 Win=250 Len=1428 TSval=1209924888 TSecr=4265718643 [TCP segment of a reassembled PDU]"
"1236","2.415708","70.186.28.136","192.168.0.92","TLSv1.2","1494","Application Data"
"1237","2.415709","70.186.28.136","192.168.0.92","TCP","1494","443  >  65184 [ACK] Seq=1575988 Ack=616 Win=250 Len=1428 TSval=1209924888 TSecr=4265718643 [TCP segment of a reassembled PDU]"
"1238","2.415710","70.186.28.136","192.168.0.92","TCP","1494","443  >  65184 [ACK] Seq=1577416 Ack=616 Win=250 Len=1428 TSval=1209924888 TSecr=4265718643 [TCP segment of a reassembled PDU]"
"1239","2.415712","70.186.28.136","192.168.0.92","TCP","1494","443  >  65184 [ACK] Seq=1578844 Ack=616 Win=250 Len=1428 TSval=1209924888 TSecr=4265718643 [TCP segment of a reassembled PDU]"
"1240","2.415713","70.186.28.136","192.168.0.92","TCP","1494","443  >  65184 [ACK] Seq=1580272 Ack=616 Win=250 Len=1428 TSval=1209924888 TSecr=4265718643 [TCP segment of a reassembled PDU]"
"1241","2.415714","70.186.28.136","192.168.0.92","TCP","1494","443  >  65184 [ACK] Seq=1581700 Ack=616 Win=250 Len=1428 TSval=1209924888 TSecr=4265718643 [TCP segment of a reassembled PDU]"
"1242","2.415715","70.186.28.136","192.168.0.92","TCP","1494","443  >  65184 [ACK] Seq=1583128 Ack=616 Win=250 Len=1428 TSval=1209924888 TSecr=4265718643 [TCP segment of a reassembled PDU]"
"1243","2.415716","70.186.28.136","192.168.0.92","TCP","1494","443  >  65184 [ACK] Seq=1584556 Ack=616 Win=250 Len=1428 TSval=1209924888 TSecr=4265718643 [TCP segment of a reassembled PDU]"
"1244","2.415717","70.186.28.136","192.168.0.92","TCP","1494","443  >  65184 [ACK] Seq=1585984 Ack=616 Win=250 Len=1428 TSval=1209924888 TSecr=4265718643 [TCP segment of a reassembled PDU]"
"1245","2.415718","70.186.28.136","192.168.0.92","TCP","1494","443  >  65184 [ACK] Seq=1587412 Ack=616 Win=250 Len=1428 TSval=1209924888 TSecr=4265718643 [TCP segment of a reassembled PDU]"
"1246","2.415720","70.186.28.136","192.168.0.92","TCP","1494","443  >  65184 [ACK] Seq=1588840 Ack=616 Win=250 Len=1428 TSval=1209924888 TSecr=4265718643 [TCP segment of a reassembled PDU]"
"1247","2.415720","70.186.28.136","192.168.0.92","TCP","1494","443  >  65184 [ACK] Seq=1590268 Ack=616 Win=250 Len=1428 TSval=1209924888 TSecr=4265718643 [TCP segment of a reassembled PDU]"
"1248","2.415721","70.186.28.136","192.168.0.92","TLSv1.2","1494","Application Data"
"1249","2.415726","70.186.28.136","192.168.0.92","TCP","1494","443  >  65184 [ACK] Seq=1593124 Ack=616 Win=250 Len=1428 TSval=1209924888 TSecr=4265718643 [TCP segment of a reassembled PDU]"
"1250","2.415727","70.186.28.136","192.168.0.92","TCP","1494","443  >  65184 [ACK] Seq=1594552 Ack=616 Win=250 Len=1428 TSval=1209924888 TSecr=4265718643 [TCP segment of a reassembled PDU]"
"1251","2.415728","70.186.28.136","192.168.0.92","TCP","1494","443  >  65184 [ACK] Seq=1595980 Ack=616 Win=250 Len=1428 TSval=1209924888 TSecr=4265718643 [TCP segment of a reassembled PDU]"
"1252","2.415729","70.186.28.136","192.168.0.92","TCP","1494","443  >  65184 [ACK] Seq=1597408 Ack=616 Win=250 Len=1428 TSval=1209924888 TSecr=4265718643 [TCP segment of a reassembled PDU]"
"1253","2.415731","70.186.28.136","192.168.0.92","TCP","1494","443  >  65184 [ACK] Seq=1598836 Ack=616 Win=250 Len=1428 TSval=1209924888 TSecr=4265718643 [TCP segment of a reassembled PDU]"
"1254","2.415985","192.168.0.92","70.186.28.136","TCP","66","65184  >  443 [ACK] Seq=616 Ack=1600264 Win=65535 Len=0 TSval=4265718667 TSecr=1209924888"
"1255","2.418545","70.186.28.136","192.168.0.92","TCP","1494","443  >  65184 [PSH, ACK] Seq=1600264 Ack=616 Win=250 Len=1428 TSval=1209924888 TSecr=4265718643 [TCP segment of a reassembled PDU]"
"1256","2.418662","70.186.28.136","192.168.0.92","TCP","1494","443  >  65184 [ACK] Seq=1601692 Ack=616 Win=250 Len=1428 TSval=1209924889 TSecr=4265718643 [TCP segment of a reassembled PDU]"
"1257","2.418664","70.186.28.136","192.168.0.92","TCP","1494","443  >  65184 [ACK] Seq=1603120 Ack=616 Win=250 Len=1428 TSval=1209924889 TSecr=4265718643 [TCP segment of a reassembled PDU]"
"1258","2.418666","70.186.28.136","192.168.0.92","TCP","1494","443  >  65184 [ACK] Seq=1604548 Ack=616 Win=250 Len=1428 TSval=1209924889 TSecr=4265718643 [TCP segment of a reassembled PDU]"
"1259","2.418670","70.186.28.136","192.168.0.92","TCP","1494","443  >  65184 [ACK] Seq=1605976 Ack=616 Win=250 Len=1428 TSval=1209924889 TSecr=4265718643 [TCP segment of a reassembled PDU]"
"1260","2.418672","70.186.28.136","192.168.0.92","TLSv1.2","1494","Application Data"
"1261","2.418673","70.186.28.136","192.168.0.92","TCP","1494","443  >  65184 [ACK] Seq=1608832 Ack=616 Win=250 Len=1428 TSval=1209924889 TSecr=4265718643 [TCP segment of a reassembled PDU]"
"1262","2.418675","70.186.28.136","192.168.0.92","TCP","1494","443  >  65184 [ACK] Seq=1610260 Ack=616 Win=250 Len=1428 TSval=1209924889 TSecr=4265718643 [TCP segment of a reassembled PDU]"
"1263","2.418677","70.186.28.136","192.168.0.92","TCP","1494","443  >  65184 [ACK] Seq=1611688 Ack=616 Win=250 Len=1428 TSval=1209924889 TSecr=4265718643 [TCP segment of a reassembled PDU]"
"1264","2.418678","70.186.28.136","192.168.0.92","TCP","1494","443  >  65184 [ACK] Seq=1613116 Ack=616 Win=250 Len=1428 TSval=1209924889 TSecr=4265718643 [TCP segment of a reassembled PDU]"
"1265","2.418680","70.186.28.136","192.168.0.92","TCP","1494","443  >  65184 [ACK] Seq=1614544 Ack=616 Win=250 Len=1428 TSval=1209924889 TSecr=4265718643 [TCP segment of a reassembled PDU]"
"1266","2.418685","70.186.28.136","192.168.0.92","TCP","1494","443  >  65184 [ACK] Seq=1615972 Ack=616 Win=250 Len=1428 TSval=1209924889 TSecr=4265718643 [TCP segment of a reassembled PDU]"
"1267","2.418687","70.186.28.136","192.168.0.92","TCP","1494","443  >  65184 [ACK] Seq=1617400 Ack=616 Win=250 Len=1428 TSval=1209924889 TSecr=4265718643 [TCP segment of a reassembled PDU]"
"1268","2.418689","70.186.28.136","192.168.0.92","TCP","1494","443  >  65184 [ACK] Seq=1618828 Ack=616 Win=250 Len=1428 TSval=1209924889 TSecr=4265718643 [TCP segment of a reassembled PDU]"
"1269","2.418690","70.186.28.136","192.168.0.92","TCP","1494","443  >  65184 [ACK] Seq=1620256 Ack=616 Win=250 Len=1428 TSval=1209924889 TSecr=4265718643 [TCP segment of a reassembled PDU]"
"1270","2.418692","70.186.28.136","192.168.0.92","TCP","1494","443  >  65184 [ACK] Seq=1621684 Ack=616 Win=250 Len=1428 TSval=1209924889 TSecr=4265718643 [TCP segment of a reassembled PDU]"
"1271","2.418693","70.186.28.136","192.168.0.92","TCP","1494","443  >  65184 [ACK] Seq=1623112 Ack=616 Win=250 Len=1428 TSval=1209924889 TSecr=4265718643 [TCP segment of a reassembled PDU]"
"1272","2.418694","70.186.28.136","192.168.0.92","TLSv1.2","1494","Application Data"
"1273","2.418695","70.186.28.136","192.168.0.92","TCP","1494","443  >  65184 [ACK] Seq=1625968 Ack=616 Win=250 Len=1428 TSval=1209924889 TSecr=4265718643 [TCP segment of a reassembled PDU]"
"1274","2.418696","70.186.28.136","192.168.0.92","TCP","1494","443  >  65184 [ACK] Seq=1627396 Ack=616 Win=250 Len=1428 TSval=1209924889 TSecr=4265718643 [TCP segment of a reassembled PDU]"
"1275","2.418701","70.186.28.136","192.168.0.92","TCP","1494","443  >  65184 [ACK] Seq=1628824 Ack=616 Win=250 Len=1428 TSval=1209924889 TSecr=4265718643 [TCP segment of a reassembled PDU]"
"1276","2.418703","70.186.28.136","192.168.0.92","TCP","1494","443  >  65184 [ACK] Seq=1630252 Ack=616 Win=250 Len=1428 TSval=1209924889 TSecr=4265718643 [TCP segment of a reassembled PDU]"
"1277","2.418703","70.186.28.136","192.168.0.92","TCP","1494","443  >  65184 [ACK] Seq=1631680 Ack=616 Win=250 Len=1428 TSval=1209924889 TSecr=4265718643 [TCP segment of a reassembled PDU]"
"1278","2.418705","70.186.28.136","192.168.0.92","TCP","1494","443  >  65184 [ACK] Seq=1633108 Ack=616 Win=250 Len=1428 TSval=1209924889 TSecr=4265718643 [TCP segment of a reassembled PDU]"
"1279","2.418706","70.186.28.136","192.168.0.92","TCP","1494","443  >  65184 [ACK] Seq=1634536 Ack=616 Win=250 Len=1428 TSval=1209924889 TSecr=4265718643 [TCP segment of a reassembled PDU]"
"1280","2.418708","70.186.28.136","192.168.0.92","TCP","1494","443  >  65184 [ACK] Seq=1635964 Ack=616 Win=250 Len=1428 TSval=1209924889 TSecr=4265718643 [TCP segment of a reassembled PDU]"
"1281","2.418709","70.186.28.136","192.168.0.92","TCP","1494","443  >  65184 [ACK] Seq=1637392 Ack=616 Win=250 Len=1428 TSval=1209924889 TSecr=4265718643 [TCP segment of a reassembled PDU]"
"1282","2.418710","70.186.28.136","192.168.0.92","TCP","1494","443  >  65184 [ACK] Seq=1638820 Ack=616 Win=250 Len=1428 TSval=1209924889 TSecr=4265718643 [TCP segment of a reassembled PDU]"
"1283","2.418711","70.186.28.136","192.168.0.92","TLSv1.2","1494","Application Data"
"1284","2.418713","70.186.28.136","192.168.0.92","TCP","1494","443  >  65184 [ACK] Seq=1641676 Ack=616 Win=250 Len=1428 TSval=1209924889 TSecr=4265718643 [TCP segment of a reassembled PDU]"
"1285","2.418714","70.186.28.136","192.168.0.92","TCP","1494","443  >  65184 [ACK] Seq=1643104 Ack=616 Win=250 Len=1428 TSval=1209924889 TSecr=4265718643 [TCP segment of a reassembled PDU]"
"1286","2.418715","70.186.28.136","192.168.0.92","TCP","1494","443  >  65184 [ACK] Seq=1644532 Ack=616 Win=250 Len=1428 TSval=1209924889 TSecr=4265718643 [TCP segment of a reassembled PDU]"
"1287","2.418717","70.186.28.136","192.168.0.92","TCP","1494","443  >  65184 [ACK] Seq=1645960 Ack=616 Win=250 Len=1428 TSval=1209924889 TSecr=4265718643 [TCP segment of a reassembled PDU]"
"1288","2.418771","192.168.0.92","70.186.28.136","TCP","66","65184  >  443 [ACK] Seq=616 Ack=1601692 Win=65535 Len=0 TSval=4265718670 TSecr=1209924888"
"1289","2.418819","192.168.0.92","70.186.28.136","TCP","66","65184  >  443 [ACK] Seq=616 Ack=1647388 Win=65535 Len=0 TSval=4265718670 TSecr=1209924889"
"1290","2.419651","70.186.28.136","192.168.0.92","TCP","1494","443  >  65184 [ACK] Seq=1647388 Ack=616 Win=250 Len=1428 TSval=1209924889 TSecr=4265718643 [TCP segment of a reassembled PDU]"
"1291","2.419653","70.186.28.136","192.168.0.92","TCP","1494","443  >  65184 [ACK] Seq=1648816 Ack=616 Win=250 Len=1428 TSval=1209924889 TSecr=4265718643 [TCP segment of a reassembled PDU]"
"1292","2.419654","70.186.28.136","192.168.0.92","TCP","1494","443  >  65184 [ACK] Seq=1650244 Ack=616 Win=250 Len=1428 TSval=1209924889 TSecr=4265718643 [TCP segment of a reassembled PDU]"
"1293","2.419655","70.186.28.136","192.168.0.92","TCP","1494","443  >  65184 [ACK] Seq=1651672 Ack=616 Win=250 Len=1428 TSval=1209924889 TSecr=4265718643 [TCP segment of a reassembled PDU]"
"1294","2.419656","70.186.28.136","192.168.0.92","TCP","1494","443  >  65184 [ACK] Seq=1653100 Ack=616 Win=250 Len=1428 TSval=1209924889 TSecr=4265718643 [TCP segment of a reassembled PDU]"
"1295","2.419657","70.186.28.136","192.168.0.92","TCP","1494","443  >  65184 [ACK] Seq=1654528 Ack=616 Win=250 Len=1428 TSval=1209924889 TSecr=4265718643 [TCP segment of a reassembled PDU]"
"1296","2.419658","70.186.28.136","192.168.0.92","TCP","1494","443  >  65184 [ACK] Seq=1655956 Ack=616 Win=250 Len=1428 TSval=1209924889 TSecr=4265718643 [TCP segment of a reassembled PDU]"
"1297","2.419660","70.186.28.136","192.168.0.92","TLSv1.2","1494","Application Data"
"1298","2.419661","70.186.28.136","192.168.0.92","TCP","1494","443  >  65184 [ACK] Seq=1658812 Ack=616 Win=250 Len=1428 TSval=1209924889 TSecr=4265718643 [TCP segment of a reassembled PDU]"
"1299","2.419662","70.186.28.136","192.168.0.92","TCP","1494","443  >  65184 [ACK] Seq=1660240 Ack=616 Win=250 Len=1428 TSval=1209924889 TSecr=4265718643 [TCP segment of a reassembled PDU]"
"1300","2.419663","70.186.28.136","192.168.0.92","TCP","1494","443  >  65184 [ACK] Seq=1661668 Ack=616 Win=250 Len=1428 TSval=1209924889 TSecr=4265718643 [TCP segment of a reassembled PDU]"
"1301","2.419665","70.186.28.136","192.168.0.92","TCP","1494","443  >  65184 [ACK] Seq=1663096 Ack=616 Win=250 Len=1428 TSval=1209924889 TSecr=4265718643 [TCP segment of a reassembled PDU]"
"1302","2.419666","70.186.28.136","192.168.0.92","TCP","1494","443  >  65184 [PSH, ACK] Seq=1664524 Ack=616 Win=250 Len=1428 TSval=1209924889 TSecr=4265718643 [TCP segment of a reassembled PDU]"
"1303","2.419667","70.186.28.136","192.168.0.92","TCP","1494","443  >  65184 [ACK] Seq=1665952 Ack=616 Win=250 Len=1428 TSval=1209924890 TSecr=4265718643 [TCP segment of a reassembled PDU]"
"1304","2.419668","70.186.28.136","192.168.0.92","TCP","1494","443  >  65184 [ACK] Seq=1667380 Ack=616 Win=250 Len=1428 TSval=1209924890 TSecr=4265718643 [TCP segment of a reassembled PDU]"
"1305","2.419669","70.186.28.136","192.168.0.92","TCP","1494","443  >  65184 [ACK] Seq=1668808 Ack=616 Win=250 Len=1428 TSval=1209924890 TSecr=4265718643 [TCP segment of a reassembled PDU]"
"1306","2.419670","70.186.28.136","192.168.0.92","TCP","1494","443  >  65184 [ACK] Seq=1670236 Ack=616 Win=250 Len=1428 TSval=1209924890 TSecr=4265718643 [TCP segment of a reassembled PDU]"
"1307","2.419671","70.186.28.136","192.168.0.92","TCP","1494","443  >  65184 [ACK] Seq=1671664 Ack=616 Win=250 Len=1428 TSval=1209924890 TSecr=4265718643 [TCP segment of a reassembled PDU]"
"1308","2.419672","70.186.28.136","192.168.0.92","TLSv1.2","1494","Application Data"
"1309","2.419673","70.186.28.136","192.168.0.92","TCP","1494","443  >  65184 [ACK] Seq=1674520 Ack=616 Win=250 Len=1428 TSval=1209924890 TSecr=4265718643 [TCP segment of a reassembled PDU]"
"1310","2.419674","70.186.28.136","192.168.0.92","TCP","1494","443  >  65184 [ACK] Seq=1675948 Ack=616 Win=250 Len=1428 TSval=1209924890 TSecr=4265718643 [TCP segment of a reassembled PDU]"
"1311","2.419676","70.186.28.136","192.168.0.92","TCP","1494","443  >  65184 [ACK] Seq=1677376 Ack=616 Win=250 Len=1428 TSval=1209924890 TSecr=4265718643 [TCP segment of a reassembled PDU]"
"1312","2.419677","70.186.28.136","192.168.0.92","TCP","1494","443  >  65184 [ACK] Seq=1678804 Ack=616 Win=250 Len=1428 TSval=1209924890 TSecr=4265718643 [TCP segment of a reassembled PDU]"
"1313","2.419678","70.186.28.136","192.168.0.92","TCP","1494","443  >  65184 [ACK] Seq=1680232 Ack=616 Win=250 Len=1428 TSval=1209924890 TSecr=4265718643 [TCP segment of a reassembled PDU]"
"1314","2.419680","70.186.28.136","192.168.0.92","TCP","1494","443  >  65184 [ACK] Seq=1681660 Ack=616 Win=250 Len=1428 TSval=1209924890 TSecr=4265718643 [TCP segment of a reassembled PDU]"
"1315","2.419681","70.186.28.136","192.168.0.92","TCP","1494","443  >  65184 [ACK] Seq=1683088 Ack=616 Win=250 Len=1428 TSval=1209924890 TSecr=4265718643 [TCP segment of a reassembled PDU]"
"1316","2.419681","70.186.28.136","192.168.0.92","TCP","1494","443  >  65184 [ACK] Seq=1684516 Ack=616 Win=250 Len=1428 TSval=1209924890 TSecr=4265718643 [TCP segment of a reassembled PDU]"
