"No.","Time","Source","Destination","Protocol","Length","Info"
"6","0.094872","100.86.171.196","204.79.197.200","TCP","1494","64559  >  443 [ACK] Seq=1 Ack=1 Win=53281 Len=1440 [TCP segment of a reassembled PDU]"
"7","0.094874","100.86.171.196","204.79.197.200","TCP","1494","64559  >  443 [ACK] Seq=1441 Ack=1 Win=53281 Len=1440 [TCP segment of a reassembled PDU]"
"8","0.094876","100.86.171.196","204.79.197.200","TCP","1494","64559  >  443 [ACK] Seq=2881 Ack=1 Win=53281 Len=1440 [TCP segment of a reassembled PDU]"
"9","0.094878","100.86.171.196","204.79.197.200","TCP","1494","64559  >  443 [ACK] Seq=4321 Ack=1 Win=53281 Len=1440 [TCP segment of a reassembled PDU]"
"10","0.094879","100.86.171.196","204.79.197.200","TCP","1494","64559  >  443 [ACK] Seq=5761 Ack=1 Win=53281 Len=1440 [TCP segment of a reassembled PDU]"
"11","0.094880","100.86.171.196","204.79.197.200","TCP","1494","64559  >  443 [ACK] Seq=7201 Ack=1 Win=53281 Len=1440 [TCP segment of a reassembled PDU]"
"12","0.094881","100.86.171.196","204.79.197.200","TCP","1494","64559  >  443 [ACK] Seq=8641 Ack=1 Win=53281 Len=1440 [TCP segment of a reassembled PDU]"
"13","0.094882","100.86.171.196","204.79.197.200","TCP","1494","64559  >  443 [ACK] Seq=10081 Ack=1 Win=53281 Len=1440 [TCP segment of a reassembled PDU]"
"14","0.094883","100.86.171.196","204.79.197.200","TCP","1494","64559  >  443 [ACK] Seq=11521 Ack=1 Win=53281 Len=1440 [TCP segment of a reassembled PDU]"
"15","0.094884","100.86.171.196","204.79.197.200","TCP","1494","64559  >  443 [ACK] Seq=12961 Ack=1 Win=53281 Len=1440 [TCP segment of a reassembled PDU]"
"16","0.094885","100.86.171.196","204.79.197.200","TCP","1494","64559  >  443 [ACK] Seq=14401 Ack=1 Win=53281 Len=1440 [TCP segment of a reassembled PDU]"
"17","0.094922","100.86.171.196","204.79.197.200","TLSv1.2","627","Application Data"
"18","0.094972","100.86.171.196","204.79.197.200","TLSv1.2","275","Application Data"
"21","0.108151","204.79.197.200","100.86.171.196","TCP","56","443  >  64559 [ACK] Seq=1 Ack=2881 Win=16385 Len=0"
"22","0.108153","204.79.197.200","100.86.171.196","TCP","56","443  >  64559 [ACK] Seq=1 Ack=5761 Win=16385 Len=0"
"23","0.108153","204.79.197.200","100.86.171.196","TCP","56","443  >  64559 [ACK] Seq=1 Ack=16635 Win=16384 Len=0"
"24","0.115877","204.79.197.200","100.86.171.196","TLSv1.2","200","Application Data"
"25","0.115982","100.86.171.196","204.79.197.200","TCP","54","64559  >  443 [ACK] Seq=16635 Ack=147 Win=53278 Len=0"
"26","0.124445","100.86.171.196","204.79.197.200","TLSv1.2","135","Application Data"
"27","0.126708","100.86.171.196","204.79.197.200","TCP","1494","64559  >  443 [ACK] Seq=16716 Ack=147 Win=53281 Len=1440 [TCP segment of a reassembled PDU]"
"28","0.126709","100.86.171.196","204.79.197.200","TCP","1494","64559  >  443 [ACK] Seq=18156 Ack=147 Win=53281 Len=1440 [TCP segment of a reassembled PDU]"
"29","0.126724","100.86.171.196","204.79.197.200","TLSv1.2","410","Application Data"
"30","0.128224","204.79.197.200","100.86.171.196","TLSv1.2","492","Application Data, Application Data, Application Data"
"31","0.128285","100.86.171.196","204.79.197.200","TCP","54","64559  >  443 [ACK] Seq=19952 Ack=585 Win=53274 Len=0"
"32","0.137206","204.79.197.200","100.86.171.196","TLSv1.2","311","Application Data"
"33","0.137306","100.86.171.196","204.79.197.200","TCP","54","64559  >  443 [ACK] Seq=19952 Ack=842 Win=53276 Len=0"
"34","0.138533","204.79.197.200","100.86.171.196","TCP","56","443  >  64559 [ACK] Seq=842 Ack=19952 Win=16385 Len=0"
"35","0.188228","204.79.197.200","100.86.171.196","TCP","1514","443  >  64559 [ACK] Seq=842 Ack=19952 Win=16385 Len=1460 [TCP segment of a reassembled PDU]"
"36","0.188229","204.79.197.200","100.86.171.196","TLSv1.2","1473","Application Data"
"37","0.188230","204.79.197.200","100.86.171.196","TLSv1.2","147","Application Data"
"38","0.188332","100.86.171.196","204.79.197.200","TCP","54","64559  >  443 [ACK] Seq=19952 Ack=3814 Win=53234 Len=0"
"39","0.188454","100.86.171.196","204.79.197.200","TCP","54","[TCP Window Update] 64559  >  443 [ACK] Seq=19952 Ack=3814 Win=53281 Len=0"
"40","0.190507","204.79.197.200","100.86.171.196","TCP","1514","443  >  64559 [ACK] Seq=3814 Ack=19952 Win=16385 Len=1460 [TCP segment of a reassembled PDU]"
"41","0.190508","204.79.197.200","100.86.171.196","TCP","1514","443  >  64559 [ACK] Seq=5274 Ack=19952 Win=16385 Len=1460 [TCP segment of a reassembled PDU]"
"42","0.190509","204.79.197.200","100.86.171.196","TLSv1.2","1268","Application Data"
"43","0.190510","204.79.197.200","100.86.171.196","TCP","1514","443  >  64559 [ACK] Seq=7948 Ack=19952 Win=16385 Len=1460 [TCP segment of a reassembled PDU]"
"44","0.190511","204.79.197.200","100.86.171.196","TCP","1514","443  >  64559 [ACK] Seq=9408 Ack=19952 Win=16385 Len=1460 [TCP segment of a reassembled PDU]"
"45","0.190511","204.79.197.200","100.86.171.196","TLSv1.2","1268","Application Data"
"46","0.190512","204.79.197.200","100.86.171.196","TCP","1514","443  >  64559 [ACK] Seq=12082 Ack=19952 Win=16385 Len=1460 [TCP segment of a reassembled PDU]"
"47","0.190513","204.79.197.200","100.86.171.196","TCP","1514","443  >  64559 [ACK] Seq=13542 Ack=19952 Win=16385 Len=1460 [TCP segment of a reassembled PDU]"
"48","0.190513","204.79.197.200","100.86.171.196","TLSv1.2","1268","Application Data"
"49","0.190516","204.79.197.200","100.86.171.196","TCP","1514","443  >  64559 [ACK] Seq=16216 Ack=19952 Win=16385 Len=1460 [TCP segment of a reassembled PDU]"
"50","0.190517","204.79.197.200","100.86.171.196","TCP","1514","443  >  64559 [ACK] Seq=17676 Ack=19952 Win=16385 Len=1460 [TCP segment of a reassembled PDU]"
"51","0.190518","204.79.197.200","100.86.171.196","TLSv1.2","1268","Application Data"
"52","0.190519","204.79.197.200","100.86.171.196","TCP","1514","443  >  64559 [ACK] Seq=20350 Ack=19952 Win=16385 Len=1460 [TCP segment of a reassembled PDU]"
"53","0.190520","204.79.197.200","100.86.171.196","TCP","1514","443  >  64559 [ACK] Seq=21810 Ack=19952 Win=16385 Len=1460 [TCP segment of a reassembled PDU]"
"54","0.190521","204.79.197.200","100.86.171.196","TLSv1.2","1268","Application Data"
"55","0.190521","204.79.197.200","100.86.171.196","TCP","1514","443  >  64559 [ACK] Seq=24484 Ack=19952 Win=16385 Len=1460 [TCP segment of a reassembled PDU]"
"56","0.190522","204.79.197.200","100.86.171.196","TCP","1514","443  >  64559 [ACK] Seq=25944 Ack=19952 Win=16385 Len=1460 [TCP segment of a reassembled PDU]"
"57","0.190523","204.79.197.200","100.86.171.196","TLSv1.2","1268","Application Data"
"58","0.190524","204.79.197.200","100.86.171.196","TCP","1514","443  >  64559 [ACK] Seq=28618 Ack=19952 Win=16385 Len=1460 [TCP segment of a reassembled PDU]"
"59","0.190524","204.79.197.200","100.86.171.196","TCP","1514","443  >  64559 [ACK] Seq=30078 Ack=19952 Win=16385 Len=1460 [TCP segment of a reassembled PDU]"
"60","0.190525","204.79.197.200","100.86.171.196","TLSv1.2","1268","Application Data"
"61","0.190526","204.79.197.200","100.86.171.196","TCP","1514","443  >  64559 [ACK] Seq=32752 Ack=19952 Win=16385 Len=1460 [TCP segment of a reassembled PDU]"
"62","0.190527","204.79.197.200","100.86.171.196","TCP","1514","443  >  64559 [ACK] Seq=34212 Ack=19952 Win=16385 Len=1460 [TCP segment of a reassembled PDU]"
"63","0.190528","204.79.197.200","100.86.171.196","TLSv1.2","1268","Application Data"
"64","0.190529","204.79.197.200","100.86.171.196","TCP","1514","443  >  64559 [ACK] Seq=36886 Ack=19952 Win=16385 Len=1460 [TCP segment of a reassembled PDU]"
"65","0.190529","204.79.197.200","100.86.171.196","TLSv1.2","1168","Application Data"
"66","0.190949","100.86.171.196","204.79.197.200","TCP","54","64559  >  443 [ACK] Seq=19952 Ack=39460 Win=53281 Len=0"
"67","0.201924","100.86.171.196","204.79.197.200","TCP","1494","64559  >  443 [ACK] Seq=19952 Ack=39460 Win=53281 Len=1440 [TCP segment of a reassembled PDU]"
"68","0.201926","100.86.171.196","204.79.197.200","TCP","1494","64559  >  443 [ACK] Seq=21392 Ack=39460 Win=53281 Len=1440 [TCP segment of a reassembled PDU]"
"69","0.201948","100.86.171.196","204.79.197.200","TLSv1.2","172","Application Data"
"70","0.202175","100.86.171.196","204.79.197.200","TLSv1.2","725","Application Data"
"71","0.206710","100.86.171.196","204.79.197.200","TCP","1494","64559  >  443 [ACK] Seq=23621 Ack=39460 Win=53281 Len=1440 [TCP segment of a reassembled PDU]"
"72","0.206713","100.86.171.196","204.79.197.200","TCP","1494","64559  >  443 [ACK] Seq=25061 Ack=39460 Win=53281 Len=1440 [TCP segment of a reassembled PDU]"
"73","0.206731","100.86.171.196","204.79.197.200","TLSv1.2","324","Application Data"
"74","0.207000","100.86.171.196","204.79.197.200","TLSv1.2","506","Application Data"
"75","0.214023","204.79.197.200","100.86.171.196","TCP","56","443  >  64559 [ACK] Seq=39460 Ack=22950 Win=16385 Len=0"
"76","0.214024","204.79.197.200","100.86.171.196","TCP","56","443  >  64559 [ACK] Seq=39460 Ack=23621 Win=16382 Len=0"
"77","0.218759","204.79.197.200","100.86.171.196","TCP","56","443  >  64559 [ACK] Seq=39460 Ack=26771 Win=16385 Len=0"
"78","0.218779","204.79.197.200","100.86.171.196","TCP","56","443  >  64559 [ACK] Seq=39460 Ack=27223 Win=16383 Len=0"
"79","0.221683","204.79.197.200","100.86.171.196","TLSv1.2","199","Application Data"
"80","0.221780","100.86.171.196","204.79.197.200","TCP","54","64559  >  443 [ACK] Seq=27223 Ack=39605 Win=53278 Len=0"
"81","0.234524","204.79.197.200","100.86.171.196","TLSv1.2","199","Application Data"
"82","0.234613","100.86.171.196","204.79.197.200","TCP","54","64559  >  443 [ACK] Seq=27223 Ack=39750 Win=53278 Len=0"
"91","0.466840","100.86.171.196","204.79.197.200","TCP","1494","64559  >  443 [ACK] Seq=27223 Ack=39750 Win=53281 Len=1440 [TCP segment of a reassembled PDU]"
"92","0.466843","100.86.171.196","204.79.197.200","TCP","1494","64559  >  443 [ACK] Seq=28663 Ack=39750 Win=53281 Len=1440 [TCP segment of a reassembled PDU]"
"93","0.466873","100.86.171.196","204.79.197.200","TLSv1.2","480","Application Data"
"94","0.481369","204.79.197.200","100.86.171.196","TCP","56","443  >  64559 [ACK] Seq=39750 Ack=28663 Win=16385 Len=0"
"95","0.481371","204.79.197.200","100.86.171.196","TCP","56","443  >  64559 [ACK] Seq=39750 Ack=30529 Win=16385 Len=0"
"96","0.486711","204.79.197.200","100.86.171.196","TCP","1514","443  >  64559 [ACK] Seq=39750 Ack=30529 Win=16385 Len=1460 [TCP segment of a reassembled PDU]"
"97","0.486712","204.79.197.200","100.86.171.196","TCP","1514","443  >  64559 [ACK] Seq=41210 Ack=30529 Win=16385 Len=1460 [TCP segment of a reassembled PDU]"
"98","0.486713","204.79.197.200","100.86.171.196","TCP","1514","443  >  64559 [ACK] Seq=42670 Ack=30529 Win=16385 Len=1460 [TCP segment of a reassembled PDU]"
"99","0.486876","100.86.171.196","204.79.197.200","TCP","54","64559  >  443 [ACK] Seq=30529 Ack=44130 Win=53212 Len=0"
"100","0.486979","100.86.171.196","204.79.197.200","TCP","54","[TCP Window Update] 64559  >  443 [ACK] Seq=30529 Ack=44130 Win=53281 Len=0"
"101","0.488491","204.79.197.200","100.86.171.196","TCP","1514","443  >  64559 [ACK] Seq=44130 Ack=30529 Win=16385 Len=1460 [TCP segment of a reassembled PDU]"
"102","0.488493","204.79.197.200","100.86.171.196","TCP","1514","443  >  64559 [ACK] Seq=45590 Ack=30529 Win=16385 Len=1460 [TCP segment of a reassembled PDU]"
"103","0.488494","204.79.197.200","100.86.171.196","TCP","1514","443  >  64559 [ACK] Seq=47050 Ack=30529 Win=16385 Len=1460 [TCP segment of a reassembled PDU]"
"104","0.488495","204.79.197.200","100.86.171.196","TLSv1.2","1021","Application Data"
"105","0.488496","204.79.197.200","100.86.171.196","TLSv1.2","92","Application Data"
"106","0.488574","100.86.171.196","204.79.197.200","TCP","54","64559  >  443 [ACK] Seq=30529 Ack=49515 Win=53196 Len=0"
"107","0.488655","100.86.171.196","204.79.197.200","TCP","54","[TCP Window Update] 64559  >  443 [ACK] Seq=30529 Ack=49515 Win=53281 Len=0"
"136","0.619187","204.79.197.200","100.86.171.196","TCP","1514","443  >  64559 [ACK] Seq=49515 Ack=30529 Win=16385 Len=1460 [TCP segment of a reassembled PDU]"
"137","0.619189","204.79.197.200","100.86.171.196","TCP","1514","443  >  64559 [ACK] Seq=50975 Ack=30529 Win=16385 Len=1460 [TCP segment of a reassembled PDU]"
"138","0.619190","204.79.197.200","100.86.171.196","TLSv1.2","1211","Application Data"
"139","0.619286","100.86.171.196","204.79.197.200","TCP","54","64559  >  443 [ACK] Seq=30529 Ack=53592 Win=53217 Len=0"
"140","0.619380","100.86.171.196","204.79.197.200","TCP","54","[TCP Window Update] 64559  >  443 [ACK] Seq=30529 Ack=53592 Win=53281 Len=0"
"141","0.622045","204.79.197.200","100.86.171.196","TLSv1.2","142","Application Data"
"142","0.622045","204.79.197.200","100.86.171.196","TCP","1514","443  >  64559 [ACK] Seq=53680 Ack=30529 Win=16385 Len=1460 [TCP segment of a reassembled PDU]"
"143","0.622050","204.79.197.200","100.86.171.196","TCP","1514","443  >  64559 [ACK] Seq=55140 Ack=30529 Win=16385 Len=1460 [TCP segment of a reassembled PDU]"
"144","0.622051","204.79.197.200","100.86.171.196","TLSv1.2","1268","Application Data"
"145","0.622052","204.79.197.200","100.86.171.196","TCP","1514","443  >  64559 [ACK] Seq=57814 Ack=30529 Win=16385 Len=1460 [TCP segment of a reassembled PDU]"
"146","0.622054","204.79.197.200","100.86.171.196","TCP","1514","443  >  64559 [ACK] Seq=59274 Ack=30529 Win=16385 Len=1460 [TCP segment of a reassembled PDU]"
"147","0.622055","204.79.197.200","100.86.171.196","TLSv1.2","1268","Application Data"
"148","0.622056","204.79.197.200","100.86.171.196","TCP","1514","443  >  64559 [ACK] Seq=61948 Ack=30529 Win=16385 Len=1460 [TCP segment of a reassembled PDU]"
"149","0.622057","204.79.197.200","100.86.171.196","TCP","1514","443  >  64559 [ACK] Seq=63408 Ack=30529 Win=16385 Len=1460 [TCP segment of a reassembled PDU]"
"150","0.622058","204.79.197.200","100.86.171.196","TLSv1.2","1268","Application Data"
"151","0.622059","204.79.197.200","100.86.171.196","TCP","1514","443  >  64559 [ACK] Seq=66082 Ack=30529 Win=16385 Len=1460 [TCP segment of a reassembled PDU]"
"152","0.622060","204.79.197.200","100.86.171.196","TCP","1514","443  >  64559 [ACK] Seq=67542 Ack=30529 Win=16385 Len=1460 [TCP segment of a reassembled PDU]"
"153","0.622061","204.79.197.200","100.86.171.196","TLSv1.2","1268","Application Data"
"154","0.622062","204.79.197.200","100.86.171.196","TCP","1514","443  >  64559 [ACK] Seq=70216 Ack=30529 Win=16385 Len=1460 [TCP segment of a reassembled PDU]"
"155","0.622063","204.79.197.200","100.86.171.196","TCP","1514","443  >  64559 [ACK] Seq=71676 Ack=30529 Win=16385 Len=1460 [TCP segment of a reassembled PDU]"
"156","0.622064","204.79.197.200","100.86.171.196","TLSv1.2","1268","Application Data"
"157","0.622066","204.79.197.200","100.86.171.196","TCP","1514","443  >  64559 [ACK] Seq=74350 Ack=30529 Win=16385 Len=1460 [TCP segment of a reassembled PDU]"
"158","0.622067","204.79.197.200","100.86.171.196","TCP","1514","443  >  64559 [ACK] Seq=75810 Ack=30529 Win=16385 Len=1460 [TCP segment of a reassembled PDU]"
"159","0.622067","204.79.197.200","100.86.171.196","TLSv1.2","1268","Application Data"
"160","0.622069","204.79.197.200","100.86.171.196","TCP","1514","443  >  64559 [ACK] Seq=78484 Ack=30529 Win=16385 Len=1460 [TCP segment of a reassembled PDU]"
"161","0.622070","204.79.197.200","100.86.171.196","TCP","1514","443  >  64559 [ACK] Seq=79944 Ack=30529 Win=16385 Len=1460 [TCP segment of a reassembled PDU]"
"162","0.622071","204.79.197.200","100.86.171.196","TLSv1.2","1268","Application Data"
"163","0.622072","204.79.197.200","100.86.171.196","TCP","1514","443  >  64559 [ACK] Seq=82618 Ack=30529 Win=16385 Len=1460 [TCP segment of a reassembled PDU]"
"164","0.622073","204.79.197.200","100.86.171.196","TCP","1514","443  >  64559 [ACK] Seq=84078 Ack=30529 Win=16385 Len=1460 [TCP segment of a reassembled PDU]"
"165","0.622074","204.79.197.200","100.86.171.196","TLSv1.2","1268","Application Data"
"166","0.622076","204.79.197.200","100.86.171.196","TCP","1514","443  >  64559 [ACK] Seq=86752 Ack=30529 Win=16385 Len=1460 [TCP segment of a reassembled PDU]"
"167","0.622077","204.79.197.200","100.86.171.196","TCP","1514","443  >  64559 [ACK] Seq=88212 Ack=30529 Win=16385 Len=1460 [TCP segment of a reassembled PDU]"
"168","0.622078","204.79.197.200","100.86.171.196","TLSv1.2","1268","Application Data"
"169","0.622079","204.79.197.200","100.86.171.196","TCP","1514","443  >  64559 [ACK] Seq=90886 Ack=30529 Win=16385 Len=1460 [TCP segment of a reassembled PDU]"
"170","0.622080","204.79.197.200","100.86.171.196","TCP","1514","443  >  64559 [ACK] Seq=92346 Ack=30529 Win=16385 Len=1460 [TCP segment of a reassembled PDU]"
"171","0.622081","204.79.197.200","100.86.171.196","TLSv1.2","1268","Application Data"
"172","0.622082","204.79.197.200","100.86.171.196","TCP","1514","443  >  64559 [ACK] Seq=95020 Ack=30529 Win=16385 Len=1460 [TCP segment of a reassembled PDU]"
"173","0.622083","204.79.197.200","100.86.171.196","TCP","1514","443  >  64559 [ACK] Seq=96480 Ack=30529 Win=16385 Len=1460 [TCP segment of a reassembled PDU]"
"174","0.622084","204.79.197.200","100.86.171.196","TLSv1.2","1268","Application Data"
"175","0.622185","100.86.171.196","204.79.197.200","TCP","54","64559  >  443 [ACK] Seq=30529 Ack=69002 Win=53040 Len=0"
"176","0.622213","100.86.171.196","204.79.197.200","TCP","54","64559  >  443 [ACK] Seq=30529 Ack=84078 Win=52804 Len=0"
"177","0.622224","100.86.171.196","204.79.197.200","TCP","54","64559  >  443 [ACK] Seq=30529 Ack=96480 Win=52610 Len=0"
"178","0.622235","100.86.171.196","204.79.197.200","TCP","54","[TCP Window Update] 64559  >  443 [ACK] Seq=30529 Ack=96480 Win=53281 Len=0"
"179","0.622246","100.86.171.196","204.79.197.200","TCP","54","64559  >  443 [ACK] Seq=30529 Ack=99154 Win=53239 Len=0"
"180","0.623241","204.79.197.200","100.86.171.196","TCP","1514","443  >  64559 [ACK] Seq=99154 Ack=30529 Win=16385 Len=1460 [TCP segment of a reassembled PDU]"
"181","0.623242","204.79.197.200","100.86.171.196","TCP","1514","443  >  64559 [ACK] Seq=100614 Ack=30529 Win=16385 Len=1460 [TCP segment of a reassembled PDU]"
"182","0.623242","204.79.197.200","100.86.171.196","TLSv1.2","1268","Application Data"
"183","0.623243","204.79.197.200","100.86.171.196","TCP","1514","443  >  64559 [ACK] Seq=103288 Ack=30529 Win=16385 Len=1460 [TCP segment of a reassembled PDU]"
"184","0.623244","204.79.197.200","100.86.171.196","TCP","1514","443  >  64559 [ACK] Seq=104748 Ack=30529 Win=16385 Len=1460 [TCP segment of a reassembled PDU]"
"185","0.623244","204.79.197.200","100.86.171.196","TLSv1.2","1268","Application Data"
"186","0.623245","204.79.197.200","100.86.171.196","TCP","1514","443  >  64559 [ACK] Seq=107422 Ack=30529 Win=16385 Len=1460 [TCP segment of a reassembled PDU]"
"187","0.623246","204.79.197.200","100.86.171.196","TCP","1514","443  >  64559 [ACK] Seq=108882 Ack=30529 Win=16385 Len=1460 [TCP segment of a reassembled PDU]"
"188","0.623246","204.79.197.200","100.86.171.196","TLSv1.2","1268","Application Data"
"189","0.623247","204.79.197.200","100.86.171.196","TCP","1514","443  >  64559 [ACK] Seq=111556 Ack=30529 Win=16385 Len=1460 [TCP segment of a reassembled PDU]"
"190","0.623271","100.86.171.196","204.79.197.200","TCP","54","64559  >  443 [ACK] Seq=30529 Ack=113016 Win=53064 Len=0"
"191","0.623317","100.86.171.196","204.79.197.200","TCP","54","[TCP Window Update] 64559  >  443 [ACK] Seq=30529 Ack=113016 Win=53281 Len=0"
"192","0.624918","204.79.197.200","100.86.171.196","TCP","1514","443  >  64559 [ACK] Seq=113016 Ack=30529 Win=16385 Len=1460 [TCP segment of a reassembled PDU]"
"193","0.624919","204.79.197.200","100.86.171.196","TLSv1.2","1268","Application Data"
"194","0.624919","204.79.197.200","100.86.171.196","TCP","1514","443  >  64559 [ACK] Seq=115690 Ack=30529 Win=16385 Len=1460 [TCP segment of a reassembled PDU]"
"195","0.624920","204.79.197.200","100.86.171.196","TCP","1514","443  >  64559 [ACK] Seq=117150 Ack=30529 Win=16385 Len=1460 [TCP segment of a reassembled PDU]"
"196","0.624921","204.79.197.200","100.86.171.196","TLSv1.2","1268","Application Data"
"197","0.624922","204.79.197.200","100.86.171.196","TCP","1514","443  >  64559 [ACK] Seq=119824 Ack=30529 Win=16385 Len=1460 [TCP segment of a reassembled PDU]"
"198","0.624922","204.79.197.200","100.86.171.196","TCP","1514","443  >  64559 [ACK] Seq=121284 Ack=30529 Win=16385 Len=1460 [TCP segment of a reassembled PDU]"
"199","0.624923","204.79.197.200","100.86.171.196","TLSv1.2","1268","Application Data"
"200","0.624924","204.79.197.200","100.86.171.196","TCP","1514","443  >  64559 [ACK] Seq=123958 Ack=30529 Win=16385 Len=1460 [TCP segment of a reassembled PDU]"
"201","0.624924","204.79.197.200","100.86.171.196","TCP","1514","443  >  64559 [ACK] Seq=125418 Ack=30529 Win=16385 Len=1460 [TCP segment of a reassembled PDU]"
"202","0.624925","204.79.197.200","100.86.171.196","TLSv1.2","1268","Application Data"
"203","0.624926","204.79.197.200","100.86.171.196","TCP","1514","443  >  64559 [ACK] Seq=128092 Ack=30529 Win=16385 Len=1460 [TCP segment of a reassembled PDU]"
"204","0.624926","204.79.197.200","100.86.171.196","TCP","1514","443  >  64559 [ACK] Seq=129552 Ack=30529 Win=16385 Len=1460 [TCP segment of a reassembled PDU]"
"205","0.624927","204.79.197.200","100.86.171.196","TCP","1514","[TCP Previous segment not captured] 443  >  64559 [ACK] Seq=132226 Ack=30529 Win=16385 Len=1460 [TCP segment of a reassembled PDU]"
"206","0.624927","204.79.197.200","100.86.171.196","TCP","1514","443  >  64559 [ACK] Seq=133686 Ack=30529 Win=16385 Len=1460 [TCP segment of a reassembled PDU]"
"207","0.624928","204.79.197.200","100.86.171.196","TLSv1.2","1268","Application Data"
"208","0.624929","204.79.197.200","100.86.171.196","TCP","1514","443  >  64559 [ACK] Seq=136360 Ack=30529 Win=16385 Len=1460 [TCP segment of a reassembled PDU]"
"209","0.624929","204.79.197.200","100.86.171.196","TCP","1514","443  >  64559 [ACK] Seq=137820 Ack=30529 Win=16385 Len=1460 [TCP segment of a reassembled PDU]"
"210","0.624930","204.79.197.200","100.86.171.196","TLSv1.2","1268","Application Data"
"211","0.624931","204.79.197.200","100.86.171.196","TCP","1514","443  >  64559 [ACK] Seq=140494 Ack=30529 Win=16385 Len=1460 [TCP segment of a reassembled PDU]"
"212","0.624931","204.79.197.200","100.86.171.196","TCP","1514","443  >  64559 [ACK] Seq=141954 Ack=30529 Win=16385 Len=1460 [TCP segment of a reassembled PDU]"
"213","0.624932","204.79.197.200","100.86.171.196","TLSv1.2","1268","Application Data"
"214","0.624933","204.79.197.200","100.86.171.196","TCP","1514","443  >  64559 [ACK] Seq=144628 Ack=30529 Win=16385 Len=1460 [TCP segment of a reassembled PDU]"
"215","0.624934","204.79.197.200","100.86.171.196","TCP","1514","443  >  64559 [ACK] Seq=146088 Ack=30529 Win=16385 Len=1460 [TCP segment of a reassembled PDU]"
"216","0.624934","204.79.197.200","100.86.171.196","TLSv1.2","1268","Application Data"
"217","0.624935","204.79.197.200","100.86.171.196","TCP","1514","443  >  64559 [ACK] Seq=148762 Ack=30529 Win=16385 Len=1460 [TCP segment of a reassembled PDU]"
"218","0.624936","204.79.197.200","100.86.171.196","TCP","1514","443  >  64559 [ACK] Seq=150222 Ack=30529 Win=16385 Len=1460 [TCP segment of a reassembled PDU]"
"219","0.624936","204.79.197.200","100.86.171.196","TLSv1.2","1268","Application Data"
"220","0.624937","204.79.197.200","100.86.171.196","TCP","1514","443  >  64559 [ACK] Seq=152896 Ack=30529 Win=16385 Len=1460 [TCP segment of a reassembled PDU]"
"221","0.624938","204.79.197.200","100.86.171.196","TCP","1514","443  >  64559 [ACK] Seq=154356 Ack=30529 Win=16385 Len=1460 [TCP segment of a reassembled PDU]"
"222","0.624939","204.79.197.200","100.86.171.196","TLSv1.2","1268","Application Data"
"223","0.624939","204.79.197.200","100.86.171.196","TCP","1514","443  >  64559 [ACK] Seq=157030 Ack=30529 Win=16385 Len=1460 [TCP segment of a reassembled PDU]"
"224","0.624995","100.86.171.196","204.79.197.200","TCP","54","64559  >  443 [ACK] Seq=30529 Ack=131012 Win=52999 Len=0"
"225","0.625009","100.86.171.196","204.79.197.200","TCP","66","[TCP Dup ACK 224#1] 64559  >  443 [ACK] Seq=30529 Ack=131012 Win=52999 Len=0 SLE=132226 SRE=147548"
"226","0.625022","100.86.171.196","204.79.197.200","TCP","66","[TCP Dup ACK 224#2] 64559  >  443 [ACK] Seq=30529 Ack=131012 Win=52999 Len=0 SLE=132226 SRE=158490"
"227","0.625031","100.86.171.196","204.79.197.200","TCP","66","[TCP Window Update] 64559  >  443 [ACK] Seq=30529 Ack=131012 Win=53281 Len=0 SLE=132226 SRE=158490"
"228","0.626957","204.79.197.200","100.86.171.196","TCP","1514","443  >  64559 [ACK] Seq=158490 Ack=30529 Win=16385 Len=1460 [TCP segment of a reassembled PDU]"
"229","0.626958","204.79.197.200","100.86.171.196","TLSv1.2","1268","Application Data"
"230","0.626959","204.79.197.200","100.86.171.196","TCP","1514","443  >  64559 [ACK] Seq=161164 Ack=30529 Win=16385 Len=1460 [TCP segment of a reassembled PDU]"
"231","0.626960","204.79.197.200","100.86.171.196","TCP","1514","443  >  64559 [ACK] Seq=162624 Ack=30529 Win=16385 Len=1460 [TCP segment of a reassembled PDU]"
"232","0.626960","204.79.197.200","100.86.171.196","TLSv1.2","1268","Application Data"
"233","0.626961","204.79.197.200","100.86.171.196","TCP","1514","443  >  64559 [ACK] Seq=165298 Ack=30529 Win=16385 Len=1460 [TCP segment of a reassembled PDU]"
"234","0.626962","204.79.197.200","100.86.171.196","TCP","1514","443  >  64559 [ACK] Seq=166758 Ack=30529 Win=16385 Len=1460 [TCP segment of a reassembled PDU]"
"235","0.626962","204.79.197.200","100.86.171.196","TLSv1.2","1268","Application Data"
"236","0.626963","204.79.197.200","100.86.171.196","TCP","1514","443  >  64559 [ACK] Seq=169432 Ack=30529 Win=16385 Len=1460 [TCP segment of a reassembled PDU]"
"237","0.626964","204.79.197.200","100.86.171.196","TCP","1514","443  >  64559 [ACK] Seq=170892 Ack=30529 Win=16385 Len=1460 [TCP segment of a reassembled PDU]"
"238","0.626964","204.79.197.200","100.86.171.196","TLSv1.2","1268","Application Data"
"239","0.626965","204.79.197.200","100.86.171.196","TCP","1514","443  >  64559 [ACK] Seq=173566 Ack=30529 Win=16385 Len=1460 [TCP segment of a reassembled PDU]"
"240","0.626966","204.79.197.200","100.86.171.196","TCP","1514","443  >  64559 [ACK] Seq=175026 Ack=30529 Win=16385 Len=1460 [TCP segment of a reassembled PDU]"
"241","0.626966","204.79.197.200","100.86.171.196","TLSv1.2","1268","Application Data"
"242","0.626967","204.79.197.200","100.86.171.196","TCP","1514","443  >  64559 [ACK] Seq=177700 Ack=30529 Win=16385 Len=1460 [TCP segment of a reassembled PDU]"
"243","0.626967","204.79.197.200","100.86.171.196","TCP","1514","443  >  64559 [ACK] Seq=179160 Ack=30529 Win=16385 Len=1460 [TCP segment of a reassembled PDU]"
"244","0.626968","204.79.197.200","100.86.171.196","TLSv1.2","1268","Application Data"
"245","0.626969","204.79.197.200","100.86.171.196","TCP","1514","443  >  64559 [ACK] Seq=181834 Ack=30529 Win=16385 Len=1460 [TCP segment of a reassembled PDU]"
"246","0.626969","204.79.197.200","100.86.171.196","TCP","1514","443  >  64559 [ACK] Seq=183294 Ack=30529 Win=16385 Len=1460 [TCP segment of a reassembled PDU]"
"247","0.626970","204.79.197.200","100.86.171.196","TLSv1.2","1268","Application Data"
"248","0.626971","204.79.197.200","100.86.171.196","TCP","1514","443  >  64559 [ACK] Seq=185968 Ack=30529 Win=16385 Len=1460 [TCP segment of a reassembled PDU]"
"249","0.626972","204.79.197.200","100.86.171.196","TCP","1514","443  >  64559 [ACK] Seq=187428 Ack=30529 Win=16385 Len=1460 [TCP segment of a reassembled PDU]"
"250","0.626972","204.79.197.200","100.86.171.196","TLSv1.2","1268","Application Data"
"251","0.626973","204.79.197.200","100.86.171.196","TCP","1514","443  >  64559 [ACK] Seq=190102 Ack=30529 Win=16385 Len=1460 [TCP segment of a reassembled PDU]"
"252","0.626974","204.79.197.200","100.86.171.196","TCP","1514","443  >  64559 [ACK] Seq=191562 Ack=30529 Win=16385 Len=1460 [TCP segment of a reassembled PDU]"
"253","0.626974","204.79.197.200","100.86.171.196","TLSv1.2","496","Application Data"
"254","0.627008","100.86.171.196","204.79.197.200","TCP","66","[TCP Dup ACK 224#3] 64559  >  443 [ACK] Seq=30529 Ack=131012 Win=53281 Len=0 SLE=132226 SRE=173566"
"255","0.627019","100.86.171.196","204.79.197.200","TCP","66","[TCP Dup ACK 224#4] 64559  >  443 [ACK] Seq=30529 Ack=131012 Win=53281 Len=0 SLE=132226 SRE=188888"
"256","0.627032","100.86.171.196","204.79.197.200","TCP","66","[TCP Dup ACK 224#5] 64559  >  443 [ACK] Seq=30529 Ack=131012 Win=53281 Len=0 SLE=132226 SRE=193464"
"257","0.634553","100.86.171.196","204.79.197.200","TCP","1494","64559  >  443 [ACK] Seq=30529 Ack=131012 Win=53281 Len=1428 SLE=132226 SRE=193464 [TCP segment of a reassembled PDU]"
"258","0.634573","100.86.171.196","204.79.197.200","TCP","1494","64559  >  443 [ACK] Seq=31957 Ack=131012 Win=53281 Len=1428 SLE=132226 SRE=193464 [TCP segment of a reassembled PDU]"
"259","0.634579","100.86.171.196","204.79.197.200","TLSv1.2","210","Application Data"
"260","0.635343","204.79.197.200","100.86.171.196","TCP","1514","443  >  64559 [ACK] Seq=193464 Ack=30529 Win=16385 Len=1460 [TCP segment of a reassembled PDU]"
"261","0.635344","204.79.197.200","100.86.171.196","TLSv1.2","1001","Application Data"
"262","0.635345","204.79.197.200","100.86.171.196","TCP","1514","443  >  64559 [ACK] Seq=195871 Ack=30529 Win=16385 Len=1460 [TCP segment of a reassembled PDU]"
"263","0.635346","204.79.197.200","100.86.171.196","TLSv1.2","297","Application Data"
"264","0.635347","204.79.197.200","100.86.171.196","TLSv1.2","982","Application Data"
"265","0.635428","100.86.171.196","204.79.197.200","TCP","66","[TCP Dup ACK 224#6] 64559  >  443 [ACK] Seq=33529 Ack=131012 Win=53281 Len=0 SLE=132226 SRE=198502"
"266","0.637273","100.86.171.196","204.79.197.200","TCP","1494","64559  >  443 [ACK] Seq=33529 Ack=131012 Win=53281 Len=1428 SLE=132226 SRE=198502 [TCP segment of a reassembled PDU]"
"267","0.637283","100.86.171.196","204.79.197.200","TCP","1494","64559  >  443 [ACK] Seq=34957 Ack=131012 Win=53281 Len=1428 SLE=132226 SRE=198502 [TCP segment of a reassembled PDU]"
"268","0.637288","100.86.171.196","204.79.197.200","TLSv1.2","448","Application Data"
"269","0.637415","204.79.197.200","100.86.171.196","TCP","1514","443  >  64559 [ACK] Seq=198502 Ack=30529 Win=16385 Len=1460 [TCP segment of a reassembled PDU]"
"270","0.637416","204.79.197.200","100.86.171.196","TCP","1514","443  >  64559 [ACK] Seq=199962 Ack=30529 Win=16385 Len=1460 [TCP segment of a reassembled PDU]"
"271","0.637417","204.79.197.200","100.86.171.196","TLSv1.2","902","Application Data"
"272","0.637477","100.86.171.196","204.79.197.200","TCP","66","[TCP Dup ACK 224#7] 64559  >  443 [ACK] Seq=36767 Ack=131012 Win=53281 Len=0 SLE=132226 SRE=202270"
"273","0.639370","204.79.197.200","100.86.171.196","TLSv1.2","1514","[TCP Fast Retransmission] , Application Data"
"274","0.639437","100.86.171.196","204.79.197.200","TCP","66","64559  >  443 [ACK] Seq=36767 Ack=202270 Win=52167 Len=0 SLE=132226 SRE=132472"
"275","0.639523","100.86.171.196","204.79.197.200","TCP","54","[TCP Window Update] 64559  >  443 [ACK] Seq=36767 Ack=202270 Win=53281 Len=0"
"276","0.643541","204.79.197.200","100.86.171.196","TLSv1.2","120","Application Data"
"277","0.643542","204.79.197.200","100.86.171.196","TLSv1.2","92","Application Data"
"278","0.643606","100.86.171.196","204.79.197.200","TCP","54","64559  >  443 [ACK] Seq=36767 Ack=202336 Win=53279 Len=0"
"279","0.643645","100.86.171.196","204.79.197.200","TCP","54","64559  >  443 [ACK] Seq=36767 Ack=202374 Win=53279 Len=0"
"280","0.647258","204.79.197.200","100.86.171.196","TCP","56","443  >  64559 [ACK] Seq=202374 Ack=31957 Win=16379 Len=0"
"281","0.647259","204.79.197.200","100.86.171.196","TCP","56","443  >  64559 [ACK] Seq=202374 Ack=33529 Win=16385 Len=0"
"282","0.650278","204.79.197.200","100.86.171.196","TCP","56","443  >  64559 [ACK] Seq=202374 Ack=34957 Win=16379 Len=0"
"283","0.650278","204.79.197.200","100.86.171.196","TCP","56","443  >  64559 [ACK] Seq=202374 Ack=36767 Win=16385 Len=0"
"284","0.650279","204.79.197.200","100.86.171.196","TCP","1514","443  >  64559 [ACK] Seq=202374 Ack=36767 Win=16385 Len=1460 [TCP segment of a reassembled PDU]"
"285","0.650361","100.86.171.196","204.79.197.200","TCP","54","64559  >  443 [ACK] Seq=36767 Ack=203834 Win=53258 Len=0"
"286","0.651394","204.79.197.200","100.86.171.196","TLSv1.2","991","Application Data"
"287","0.651395","204.79.197.200","100.86.171.196","TLSv1.2","92","Application Data"
"288","0.651442","100.86.171.196","204.79.197.200","TCP","54","64559  >  443 [ACK] Seq=36767 Ack=204809 Win=53265 Len=0"
"289","0.653074","100.86.171.196","204.79.197.200","TCP","1494","64559  >  443 [ACK] Seq=36767 Ack=204809 Win=53281 Len=1440 [TCP segment of a reassembled PDU]"
"290","0.653076","100.86.171.196","204.79.197.200","TCP","1494","64559  >  443 [ACK] Seq=38207 Ack=204809 Win=53281 Len=1440 [TCP segment of a reassembled PDU]"
"291","0.653091","100.86.171.196","204.79.197.200","TLSv1.2","480","Application Data"
"292","0.657090","204.79.197.200","100.86.171.196","TCP","1514","443  >  64559 [ACK] Seq=204809 Ack=36767 Win=16385 Len=1460 [TCP segment of a reassembled PDU]"
"293","0.657092","204.79.197.200","100.86.171.196","TCP","1514","443  >  64559 [ACK] Seq=206269 Ack=36767 Win=16385 Len=1460 [TCP segment of a reassembled PDU]"
"294","0.657093","204.79.197.200","100.86.171.196","TCP","1514","443  >  64559 [ACK] Seq=207729 Ack=36767 Win=16385 Len=1460 [TCP segment of a reassembled PDU]"
"295","0.657157","100.86.171.196","204.79.197.200","TCP","54","64559  >  443 [ACK] Seq=40073 Ack=209189 Win=53212 Len=0"
"296","0.657207","100.86.171.196","204.79.197.200","TCP","54","[TCP Window Update] 64559  >  443 [ACK] Seq=40073 Ack=209189 Win=53281 Len=0"
"297","0.660849","204.79.197.200","100.86.171.196","TCP","1514","443  >  64559 [ACK] Seq=209189 Ack=36767 Win=16385 Len=1460 [TCP segment of a reassembled PDU]"
"298","0.660850","204.79.197.200","100.86.171.196","TCP","1514","443  >  64559 [ACK] Seq=210649 Ack=36767 Win=16385 Len=1460 [TCP segment of a reassembled PDU]"
"299","0.660851","204.79.197.200","100.86.171.196","TCP","1514","443  >  64559 [ACK] Seq=212109 Ack=36767 Win=16385 Len=1460 [TCP segment of a reassembled PDU]"
"300","0.660852","204.79.197.200","100.86.171.196","TLSv1.2","172","Application Data"
"301","0.660900","100.86.171.196","204.79.197.200","TCP","54","64559  >  443 [ACK] Seq=40073 Ack=213687 Win=53210 Len=0"
"302","0.660948","100.86.171.196","204.79.197.200","TCP","54","[TCP Window Update] 64559  >  443 [ACK] Seq=40073 Ack=213687 Win=53281 Len=0"
"303","0.664638","204.79.197.200","100.86.171.196","TLSv1.2","92","Application Data"
"304","0.664708","100.86.171.196","204.79.197.200","TCP","54","64559  >  443 [ACK] Seq=40073 Ack=213725 Win=53280 Len=0"
"305","0.669651","204.79.197.200","100.86.171.196","TCP","56","443  >  64559 [ACK] Seq=213725 Ack=40073 Win=16385 Len=0"
"306","0.674092","204.79.197.200","100.86.171.196","TLSv1.2","1023","Application Data"
"307","0.674146","100.86.171.196","204.79.197.200","TCP","54","64559  >  443 [ACK] Seq=40073 Ack=214694 Win=53265 Len=0"
"308","0.675677","204.79.197.200","100.86.171.196","TLSv1.2","92","Application Data"
"309","0.675701","100.86.171.196","204.79.197.200","TCP","54","64559  >  443 [ACK] Seq=40073 Ack=214732 Win=53280 Len=0"
"310","0.771707","100.86.171.196","204.79.197.200","TCP","1494","64559  >  443 [ACK] Seq=40073 Ack=214732 Win=53281 Len=1440 [TCP segment of a reassembled PDU]"
"311","0.771709","100.86.171.196","204.79.197.200","TCP","1494","64559  >  443 [ACK] Seq=41513 Ack=214732 Win=53281 Len=1440 [TCP segment of a reassembled PDU]"
"312","0.771737","100.86.171.196","204.79.197.200","TLSv1.2","479","Application Data"
"313","0.785297","204.79.197.200","100.86.171.196","TCP","56","443  >  64559 [ACK] Seq=214732 Ack=43378 Win=16385 Len=0"
"314","0.789693","204.79.197.200","100.86.171.196","TLSv1.2","1420","Application Data"
"315","0.789694","204.79.197.200","100.86.171.196","TLSv1.2","92","Application Data"
"316","0.789784","100.86.171.196","204.79.197.200","TCP","54","64559  >  443 [ACK] Seq=43378 Ack=216136 Win=53259 Len=0"
"317","0.869244","100.86.171.196","204.79.197.200","TCP","1494","64559  >  443 [ACK] Seq=43378 Ack=216136 Win=53281 Len=1440 [TCP segment of a reassembled PDU]"
"318","0.869247","100.86.171.196","204.79.197.200","TCP","1494","64559  >  443 [ACK] Seq=44818 Ack=216136 Win=53281 Len=1440 [TCP segment of a reassembled PDU]"
"319","0.869275","100.86.171.196","204.79.197.200","TLSv1.2","655","Application Data"
"320","0.875915","100.86.171.196","204.79.197.200","TCP","1494","64559  >  443 [ACK] Seq=46859 Ack=216136 Win=53281 Len=1440 [TCP segment of a reassembled PDU]"
"321","0.875917","100.86.171.196","204.79.197.200","TCP","1494","64559  >  443 [ACK] Seq=48299 Ack=216136 Win=53281 Len=1440 [TCP segment of a reassembled PDU]"
"322","0.875948","100.86.171.196","204.79.197.200","TLSv1.2","178","Application Data"
"323","0.878207","100.86.171.196","204.79.197.200","TLSv1.2","437","Application Data"
"324","0.881238","204.79.197.200","100.86.171.196","TCP","56","443  >  64559 [ACK] Seq=216136 Ack=46859 Win=16385 Len=0"
"325","0.888136","204.79.197.200","100.86.171.196","TCP","56","443  >  64559 [ACK] Seq=216136 Ack=49863 Win=16385 Len=0"
"326","0.888137","204.79.197.200","100.86.171.196","TLSv1.2","216","Application Data"
"327","0.888231","100.86.171.196","204.79.197.200","TCP","54","64559  >  443 [ACK] Seq=50246 Ack=216298 Win=53278 Len=0"
"328","0.890083","204.79.197.200","100.86.171.196","TCP","56","443  >  64559 [ACK] Seq=216298 Ack=50246 Win=16383 Len=0"
"329","0.900681","204.79.197.200","100.86.171.196","TLSv1.2","200","Application Data"
"330","0.900774","100.86.171.196","204.79.197.200","TCP","54","64559  >  443 [ACK] Seq=50246 Ack=216444 Win=53278 Len=0"
"331","0.903784","100.86.171.196","204.79.197.200","TCP","1494","64559  >  443 [ACK] Seq=50246 Ack=216444 Win=53281 Len=1440 [TCP segment of a reassembled PDU]"
"332","0.903787","100.86.171.196","204.79.197.200","TCP","1494","64559  >  443 [ACK] Seq=51686 Ack=216444 Win=53281 Len=1440 [TCP segment of a reassembled PDU]"
"333","0.903899","100.86.171.196","204.79.197.200","TLSv1.2","572","Application Data"
"343","0.917709","204.79.197.200","100.86.171.196","TCP","56","443  >  64559 [ACK] Seq=216444 Ack=53644 Win=16385 Len=0"
"352","0.924505","204.79.197.200","100.86.171.196","TLSv1.2","200","Application Data"
"353","0.924534","100.86.171.196","204.79.197.200","TCP","54","64559  >  443 [ACK] Seq=53644 Ack=216590 Win=53278 Len=0"
"487","1.000986","100.86.171.196","204.79.197.200","TCP","1494","64559  >  443 [ACK] Seq=53644 Ack=216590 Win=53281 Len=1440 [TCP segment of a reassembled PDU]"
"488","1.000988","100.86.171.196","204.79.197.200","TCP","1494","64559  >  443 [ACK] Seq=55084 Ack=216590 Win=53281 Len=1440 [TCP segment of a reassembled PDU]"
"489","1.001007","100.86.171.196","204.79.197.200","TLSv1.2","385","Application Data"
"499","1.013312","100.86.171.196","204.79.197.200","TCP","1494","64559  >  443 [ACK] Seq=56855 Ack=216590 Win=53281 Len=1440 [TCP segment of a reassembled PDU]"
"500","1.013315","100.86.171.196","204.79.197.200","TCP","1494","64559  >  443 [ACK] Seq=58295 Ack=216590 Win=53281 Len=1440 [TCP segment of a reassembled PDU]"
"501","1.013344","100.86.171.196","204.79.197.200","TLSv1.2","385","Application Data"
"506","1.015484","204.79.197.200","100.86.171.196","TCP","56","443  >  64559 [ACK] Seq=216590 Ack=56855 Win=16385 Len=0"
"530","1.017543","204.79.197.200","100.86.171.196","TCP","1514","443  >  64559 [ACK] Seq=216590 Ack=56855 Win=16385 Len=1460 [TCP segment of a reassembled PDU]"
"531","1.017568","100.86.171.196","204.79.197.200","TCP","54","64559  >  443 [ACK] Seq=60066 Ack=218050 Win=53258 Len=0"
"533","1.020649","204.79.197.200","100.86.171.196","TCP","1514","443  >  64559 [ACK] Seq=218050 Ack=56855 Win=16385 Len=1460 [TCP segment of a reassembled PDU]"
"534","1.020650","204.79.197.200","100.86.171.196","TLSv1.2","318","Application Data"
