"No.","Time","Source","Destination","Protocol","Length","Info"
"2","0.000096","100.86.171.196","204.79.197.200","TCP","1494","64559  >  443 [ACK] Seq=1 Ack=1 Win=65535 Len=1440 [TCP segment of a reassembled PDU]"
"3","0.000100","100.86.171.196","204.79.197.200","TCP","1494","64559  >  443 [ACK] Seq=1441 Ack=1 Win=65535 Len=1440 [TCP segment of a reassembled PDU]"
"4","0.000103","100.86.171.196","204.79.197.200","TLSv1.2","1035","Application Data"
"6","0.019025","204.79.197.200","100.86.171.196","TCP","56","443  >  64559 [ACK] Seq=1 Ack=1441 Win=16379 Len=0"
"7","0.019027","204.79.197.200","100.86.171.196","TCP","56","443  >  64559 [ACK] Seq=1 Ack=3862 Win=16381 Len=0"
"8","0.027243","204.79.197.200","100.86.171.196","TLSv1.2","200","Application Data"
"9","0.027440","100.86.171.196","204.79.197.200","TCP","54","64559  >  443 [ACK] Seq=3862 Ack=147 Win=65532 Len=0"
"45","2.004409","100.86.171.196","204.79.197.200","TCP","1494","64559  >  443 [ACK] Seq=3862 Ack=147 Win=65535 Len=1440 [TCP segment of a reassembled PDU]"
"46","2.004411","100.86.171.196","204.79.197.200","TCP","1494","64559  >  443 [ACK] Seq=5302 Ack=147 Win=65535 Len=1440 [TCP segment of a reassembled PDU]"
"47","2.004435","100.86.171.196","204.79.197.200","TLSv1.2","990","Application Data"
"49","2.023173","204.79.197.200","100.86.171.196","TCP","56","443  >  64559 [ACK] Seq=147 Ack=7678 Win=16385 Len=0"
"50","2.031063","204.79.197.200","100.86.171.196","TLSv1.2","200","Application Data"
"51","2.031163","100.86.171.196","204.79.197.200","TCP","54","64559  >  443 [ACK] Seq=7678 Ack=293 Win=65532 Len=0"
"53","2.157399","100.86.171.196","204.79.197.200","TCP","1494","64559  >  443 [ACK] Seq=7678 Ack=293 Win=65535 Len=1440 [TCP segment of a reassembled PDU]"
"54","2.157402","100.86.171.196","204.79.197.200","TCP","1494","64559  >  443 [ACK] Seq=9118 Ack=293 Win=65535 Len=1440 [TCP segment of a reassembled PDU]"
"55","2.157427","100.86.171.196","204.79.197.200","TLSv1.2","430","Application Data"
"56","2.170865","204.79.197.200","100.86.171.196","TCP","56","443  >  64559 [ACK] Seq=293 Ack=10934 Win=16385 Len=0"
"57","2.198752","204.79.197.200","100.86.171.196","TLSv1.2","1313","Application Data"
"58","2.198753","204.79.197.200","100.86.171.196","TLSv1.2","92","Application Data"
"59","2.198838","100.86.171.196","204.79.197.200","TCP","54","64559  >  443 [ACK] Seq=10934 Ack=1590 Win=65514 Len=0"
"60","2.206449","100.86.171.196","204.79.197.200","TCP","1494","64559  >  443 [ACK] Seq=10934 Ack=1590 Win=65535 Len=1440 [TCP segment of a reassembled PDU]"
"61","2.206451","100.86.171.196","204.79.197.200","TCP","1494","64559  >  443 [ACK] Seq=12374 Ack=1590 Win=65535 Len=1440 [TCP segment of a reassembled PDU]"
"62","2.206481","100.86.171.196","204.79.197.200","TLSv1.2","171","Application Data"
"65","2.210833","100.86.171.196","204.79.197.200","TCP","1494","64559  >  443 [ACK] Seq=13931 Ack=1590 Win=65535 Len=1440 [TCP segment of a reassembled PDU]"
"66","2.210834","100.86.171.196","204.79.197.200","TCP","1494","64559  >  443 [ACK] Seq=15371 Ack=1590 Win=65535 Len=1440 [TCP segment of a reassembled PDU]"
"67","2.210844","100.86.171.196","204.79.197.200","TLSv1.2","419","Application Data"
"68","2.214101","100.86.171.196","204.79.197.200","TCP","1494","64559  >  443 [ACK] Seq=17176 Ack=1590 Win=65535 Len=1440 [TCP segment of a reassembled PDU]"
"69","2.214102","100.86.171.196","204.79.197.200","TCP","1494","64559  >  443 [ACK] Seq=18616 Ack=1590 Win=65535 Len=1440 [TCP segment of a reassembled PDU]"
"70","2.214121","100.86.171.196","204.79.197.200","TLSv1.2","419","Application Data"
"71","2.218708","204.79.197.200","100.86.171.196","TCP","56","443  >  64559 [ACK] Seq=1590 Ack=13931 Win=16385 Len=0"
"72","2.222575","204.79.197.200","100.86.171.196","TLSv1.2","1149","Application Data"
"73","2.222576","204.79.197.200","100.86.171.196","TLSv1.2","92","Application Data"
"74","2.222652","100.86.171.196","204.79.197.200","TCP","54","64559  >  443 [ACK] Seq=20421 Ack=2723 Win=65517 Len=0"
"75","2.226653","204.79.197.200","100.86.171.196","TCP","56","443  >  64559 [ACK] Seq=2723 Ack=20421 Win=16385 Len=0"
"76","2.230928","204.79.197.200","100.86.171.196","TCP","1514","443  >  64559 [ACK] Seq=2723 Ack=20421 Win=16385 Len=1460 [TCP segment of a reassembled PDU]"
"77","2.230930","204.79.197.200","100.86.171.196","TLSv1.2","200","Application Data"
"78","2.230931","204.79.197.200","100.86.171.196","TCP","1514","443  >  64559 [ACK] Seq=4329 Ack=20421 Win=16385 Len=1460 [TCP segment of a reassembled PDU]"
"79","2.231025","100.86.171.196","204.79.197.200","TCP","54","64559  >  443 [ACK] Seq=20421 Ack=5789 Win=65487 Len=0"
"80","2.231135","100.86.171.196","204.79.197.200","TCP","54","[TCP Window Update] 64559  >  443 [ACK] Seq=20421 Ack=5789 Win=65535 Len=0"
"81","2.232135","204.79.197.200","100.86.171.196","TCP","1514","443  >  64559 [ACK] Seq=5789 Ack=20421 Win=16385 Len=1460 [TCP segment of a reassembled PDU]"
"82","2.232136","204.79.197.200","100.86.171.196","TCP","1514","443  >  64559 [ACK] Seq=7249 Ack=20421 Win=16385 Len=1460 [TCP segment of a reassembled PDU]"
"83","2.232141","204.79.197.200","100.86.171.196","TLSv1.2","1010","Application Data"
"84","2.232142","204.79.197.200","100.86.171.196","TLSv1.2","92","Application Data"
"85","2.232142","204.79.197.200","100.86.171.196","TLSv1.2","92","Application Data"
"86","2.232206","100.86.171.196","204.79.197.200","TCP","54","64559  >  443 [ACK] Seq=20421 Ack=9741 Win=65473 Len=0"
"87","2.232266","100.86.171.196","204.79.197.200","TCP","54","[TCP Window Update] 64559  >  443 [ACK] Seq=20421 Ack=9741 Win=65535 Len=0"
"170","3.349183","100.86.171.196","204.79.197.200","TCP","1494","64559  >  443 [ACK] Seq=20421 Ack=9741 Win=65535 Len=1440 [TCP segment of a reassembled PDU]"
"171","3.349186","100.86.171.196","204.79.197.200","TCP","1494","64559  >  443 [ACK] Seq=21861 Ack=9741 Win=65535 Len=1440 [TCP segment of a reassembled PDU]"
"172","3.349188","100.86.171.196","204.79.197.200","TCP","1494","64559  >  443 [ACK] Seq=23301 Ack=9741 Win=65535 Len=1440 [TCP segment of a reassembled PDU]"
"173","3.349230","100.86.171.196","204.79.197.200","TLSv1.2","390","Application Data"
"174","3.355724","100.86.171.196","204.79.197.200","TCP","1494","64559  >  443 [ACK] Seq=25077 Ack=9741 Win=65535 Len=1440 [TCP segment of a reassembled PDU]"
"175","3.355727","100.86.171.196","204.79.197.200","TCP","1494","64559  >  443 [ACK] Seq=26517 Ack=9741 Win=65535 Len=1440 [TCP segment of a reassembled PDU]"
"176","3.355762","100.86.171.196","204.79.197.200","TLSv1.2","590","Application Data"
"177","3.363943","204.79.197.200","100.86.171.196","TCP","56","443  >  64559 [ACK] Seq=9741 Ack=23301 Win=16385 Len=0"
"178","3.363945","204.79.197.200","100.86.171.196","TCP","56","443  >  64559 [ACK] Seq=9741 Ack=25077 Win=16385 Len=0"
"179","3.369302","204.79.197.200","100.86.171.196","TCP","56","443  >  64559 [ACK] Seq=9741 Ack=28493 Win=16385 Len=0"
"180","3.371818","100.86.171.196","204.79.197.200","TCP","1494","64559  >  443 [ACK] Seq=28493 Ack=9741 Win=65535 Len=1440 [TCP segment of a reassembled PDU]"
"181","3.371820","100.86.171.196","204.79.197.200","TCP","1494","64559  >  443 [ACK] Seq=29933 Ack=9741 Win=65535 Len=1440 [TCP segment of a reassembled PDU]"
"182","3.371821","100.86.171.196","204.79.197.200","TCP","1494","64559  >  443 [ACK] Seq=31373 Ack=9741 Win=65535 Len=1440 [TCP segment of a reassembled PDU]"
"183","3.371842","100.86.171.196","204.79.197.200","TLSv1.2","147","Application Data"
"184","3.372753","204.79.197.200","100.86.171.196","TLSv1.2","216","Application Data"
"185","3.372828","100.86.171.196","204.79.197.200","TCP","54","64559  >  443 [ACK] Seq=32906 Ack=9903 Win=65532 Len=0"
"187","3.393208","100.86.171.196","204.79.197.200","TCP","1494","64559  >  443 [ACK] Seq=32906 Ack=9903 Win=65535 Len=1440 [TCP segment of a reassembled PDU]"
"188","3.393211","100.86.171.196","204.79.197.200","TCP","1494","64559  >  443 [ACK] Seq=34346 Ack=9903 Win=65535 Len=1440 [TCP segment of a reassembled PDU]"
"189","3.393213","100.86.171.196","204.79.197.200","TCP","1494","64559  >  443 [ACK] Seq=35786 Ack=9903 Win=65535 Len=1440 [TCP segment of a reassembled PDU]"
"190","3.393250","100.86.171.196","204.79.197.200","TLSv1.2","311","Application Data"
"194","3.406252","204.79.197.200","100.86.171.196","TLSv1.2","200","[TCP Previous segment not captured] , Application Data"
"195","3.406374","100.86.171.196","204.79.197.200","TCP","66","[TCP Dup ACK 185#1] 64559  >  443 [ACK] Seq=37483 Ack=9903 Win=65535 Len=0 SLE=10049 SRE=10195"
"207","3.418625","204.79.197.200","100.86.171.196","TCP","491","[TCP Retransmission] 443  >  64559 [PSH, ACK, CWR] Seq=9903 Ack=37483 Win=16385 Len=437"
"208","3.418723","100.86.171.196","204.79.197.200","TCP","66","64559  >  443 [ACK] Seq=37483 Ack=10340 Win=65528 Len=0 SLE=10049 SRE=10195"
"238","4.425798","100.86.171.196","204.79.197.200","TCP","1494","64559  >  443 [ACK] Seq=37483 Ack=10340 Win=65535 Len=1440 [TCP segment of a reassembled PDU]"
"239","4.425801","100.86.171.196","204.79.197.200","TCP","1494","64559  >  443 [ACK] Seq=38923 Ack=10340 Win=65535 Len=1440 [TCP segment of a reassembled PDU]"
"240","4.425802","100.86.171.196","204.79.197.200","TCP","1494","64559  >  443 [ACK] Seq=40363 Ack=10340 Win=65535 Len=1440 [TCP segment of a reassembled PDU]"
"241","4.425829","100.86.171.196","204.79.197.200","TLSv1.2","300","Application Data"
"242","4.431407","100.86.171.196","204.79.197.200","TCP","1494","64559  >  443 [ACK] Seq=42049 Ack=10340 Win=65535 Len=1440 [TCP segment of a reassembled PDU]"
"243","4.431409","100.86.171.196","204.79.197.200","TCP","1494","64559  >  443 [ACK] Seq=43489 Ack=10340 Win=65535 Len=1440 [TCP segment of a reassembled PDU]"
"244","4.431411","100.86.171.196","204.79.197.200","TCP","1494","64559  >  443 [ACK] Seq=44929 Ack=10340 Win=65535 Len=1440 [TCP segment of a reassembled PDU]"
"245","4.431436","100.86.171.196","204.79.197.200","TLSv1.2","297","Application Data"
"246","4.443353","204.79.197.200","100.86.171.196","TCP","56","443  >  64559 [ACK] Seq=10340 Ack=38923 Win=16379 Len=0"
"247","4.443355","204.79.197.200","100.86.171.196","TCP","56","443  >  64559 [ACK] Seq=10340 Ack=40363 Win=16385 Len=0"
"248","4.443356","204.79.197.200","100.86.171.196","TCP","56","443  >  64559 [ACK] Seq=10340 Ack=42049 Win=16385 Len=0"
"249","4.444618","204.79.197.200","100.86.171.196","TCP","56","443  >  64559 [ACK] Seq=10340 Ack=43489 Win=16379 Len=0"
"250","4.444619","204.79.197.200","100.86.171.196","TCP","56","443  >  64559 [ACK] Seq=10340 Ack=46612 Win=16385 Len=0"
"253","4.451264","204.79.197.200","100.86.171.196","TLSv1.2","200","Application Data"
"254","4.451356","100.86.171.196","204.79.197.200","TCP","54","64559  >  443 [ACK] Seq=46612 Ack=10486 Win=65532 Len=0"
"257","4.463434","204.79.197.200","100.86.171.196","TLSv1.2","200","Application Data"
"258","4.463523","100.86.171.196","204.79.197.200","TCP","54","64559  >  443 [ACK] Seq=46612 Ack=10632 Win=65532 Len=0"
"354","5.474107","100.86.171.196","204.79.197.200","TCP","1494","64559  >  443 [ACK] Seq=46612 Ack=10632 Win=65535 Len=1440 [TCP segment of a reassembled PDU]"
"355","5.474109","100.86.171.196","204.79.197.200","TCP","1494","64559  >  443 [ACK] Seq=48052 Ack=10632 Win=65535 Len=1440 [TCP segment of a reassembled PDU]"
"356","5.474136","100.86.171.196","204.79.197.200","TLSv1.2","167","Application Data"
"357","5.474912","100.86.171.196","204.79.197.200","TCP","1494","64559  >  443 [ACK] Seq=49605 Ack=10632 Win=65535 Len=1440 [TCP segment of a reassembled PDU]"
"358","5.474919","100.86.171.196","204.79.197.200","TLSv1.2","711","Application Data"
"360","5.492694","204.79.197.200","100.86.171.196","TCP","56","443  >  64559 [ACK] Seq=10632 Ack=49605 Win=16385 Len=0"
"361","5.492696","204.79.197.200","100.86.171.196","TCP","56","443  >  64559 [ACK] Seq=10632 Ack=51702 Win=16385 Len=0"
"362","5.500334","204.79.197.200","100.86.171.196","TLSv1.2","199","Application Data"
"363","5.500425","100.86.171.196","204.79.197.200","TCP","54","64559  >  443 [ACK] Seq=51702 Ack=10777 Win=65532 Len=0"
"393","6.439099","100.86.171.196","204.79.197.200","TCP","1494","64559  >  443 [ACK] Seq=51702 Ack=10777 Win=65535 Len=1440 [TCP segment of a reassembled PDU]"
"394","6.439100","100.86.171.196","204.79.197.200","TCP","1494","64559  >  443 [ACK] Seq=53142 Ack=10777 Win=65535 Len=1440 [TCP segment of a reassembled PDU]"
"395","6.439102","100.86.171.196","204.79.197.200","TCP","1494","64559  >  443 [ACK] Seq=54582 Ack=10777 Win=65535 Len=1440 [TCP segment of a reassembled PDU]"
"396","6.439131","100.86.171.196","204.79.197.200","TLSv1.2","462","Application Data"
"397","6.457677","204.79.197.200","100.86.171.196","TCP","56","443  >  64559 [ACK] Seq=10777 Ack=56022 Win=16385 Len=0"
"398","6.457678","204.79.197.200","100.86.171.196","TCP","56","443  >  64559 [ACK] Seq=10777 Ack=56430 Win=16383 Len=0"
"399","6.466404","204.79.197.200","100.86.171.196","TLSv1.2","199","Application Data"
"400","6.466491","100.86.171.196","204.79.197.200","TCP","54","64559  >  443 [ACK] Seq=56430 Ack=10922 Win=65532 Len=0"
"404","7.296288","100.86.171.196","204.79.197.200","TCP","1494","64559  >  443 [ACK] Seq=56430 Ack=10922 Win=65535 Len=1440 [TCP segment of a reassembled PDU]"
"405","7.296290","100.86.171.196","204.79.197.200","TCP","1494","64559  >  443 [ACK] Seq=57870 Ack=10922 Win=65535 Len=1440 [TCP segment of a reassembled PDU]"
"406","7.296291","100.86.171.196","204.79.197.200","TCP","1494","64559  >  443 [ACK] Seq=59310 Ack=10922 Win=65535 Len=1440 [TCP segment of a reassembled PDU]"
"407","7.296318","100.86.171.196","204.79.197.200","TLSv1.2","469","Application Data"
"408","7.317371","204.79.197.200","100.86.171.196","TCP","56","443  >  64559 [ACK] Seq=10922 Ack=57870 Win=16385 Len=0"
"409","7.317372","204.79.197.200","100.86.171.196","TCP","56","443  >  64559 [ACK] Seq=10922 Ack=61165 Win=16383 Len=0"
"410","7.325830","204.79.197.200","100.86.171.196","TLSv1.2","200","Application Data"
"411","7.325929","100.86.171.196","204.79.197.200","TCP","54","64559  >  443 [ACK] Seq=61165 Ack=11068 Win=65532 Len=0"
"415","9.307745","100.86.171.196","204.79.197.200","TCP","1494","64559  >  443 [ACK] Seq=61165 Ack=11068 Win=65535 Len=1440 [TCP segment of a reassembled PDU]"
"416","9.307748","100.86.171.196","204.79.197.200","TCP","1494","64559  >  443 [ACK] Seq=62605 Ack=11068 Win=65535 Len=1440 [TCP segment of a reassembled PDU]"
"417","9.307795","100.86.171.196","204.79.197.200","TLSv1.2","1252","Application Data"
"418","9.328125","204.79.197.200","100.86.171.196","TCP","56","443  >  64559 [ACK] Seq=11068 Ack=65243 Win=16385 Len=0"
"419","9.336376","204.79.197.200","100.86.171.196","TLSv1.2","200","Application Data"
"420","9.336523","100.86.171.196","204.79.197.200","TCP","54","64559  >  443 [ACK] Seq=65243 Ack=11214 Win=65532 Len=0"
