"No.","Time","Source","Destination","Protocol","Length","Info"
"62","3.664175","192.168.0.92","146.75.31.5","TLSv1.2","941","Application Data"
"63","3.696282","146.75.31.5","192.168.0.92","TCP","66","443  >  55371 [ACK] Seq=1 Ack=876 Win=338 Len=0 TSval=2256605694 TSecr=1528395197"
"66","3.696284","146.75.31.5","192.168.0.92","TLSv1.2","1225","Application Data"
"67","3.696285","146.75.31.5","192.168.0.92","TCP","1510","443  >  55371 [ACK] Seq=1160 Ack=876 Win=338 Len=1444 TSval=2256605696 TSecr=1528395197 [TCP segment of a reassembled PDU]"
"69","3.696468","192.168.0.92","146.75.31.5","TCP","66","55371  >  443 [ACK] Seq=876 Ack=2604 Win=15446 Len=0 TSval=1528395229 TSecr=2256605696"
"70","3.697521","146.75.31.5","192.168.0.92","TCP","1510","443  >  55371 [ACK] Seq=2604 Ack=876 Win=338 Len=1444 TSval=2256605696 TSecr=1528395197 [TCP segment of a reassembled PDU]"
"71","3.697523","146.75.31.5","192.168.0.92","TCP","1510","443  >  55371 [ACK] Seq=4048 Ack=876 Win=338 Len=1444 TSval=2256605696 TSecr=1528395197 [TCP segment of a reassembled PDU]"
"72","3.697524","146.75.31.5","192.168.0.92","TCP","1510","443  >  55371 [ACK] Seq=5492 Ack=876 Win=338 Len=1444 TSval=2256605696 TSecr=1528395197 [TCP segment of a reassembled PDU]"
"73","3.697525","146.75.31.5","192.168.0.92","TCP","1510","443  >  55371 [ACK] Seq=6936 Ack=876 Win=338 Len=1444 TSval=2256605696 TSecr=1528395197 [TCP segment of a reassembled PDU]"
"74","3.697526","146.75.31.5","192.168.0.92","TCP","1510","443  >  55371 [ACK] Seq=8380 Ack=876 Win=338 Len=1444 TSval=2256605696 TSecr=1528395197 [TCP segment of a reassembled PDU]"
"75","3.697527","146.75.31.5","192.168.0.92","TCP","1510","443  >  55371 [ACK] Seq=9824 Ack=876 Win=338 Len=1444 TSval=2256605696 TSecr=1528395197 [TCP segment of a reassembled PDU]"
"76","3.697528","146.75.31.5","192.168.0.92","TCP","1510","443  >  55371 [ACK] Seq=11268 Ack=876 Win=338 Len=1444 TSval=2256605696 TSecr=1528395197 [TCP segment of a reassembled PDU]"
"77","3.697529","146.75.31.5","192.168.0.92","TCP","1510","443  >  55371 [ACK] Seq=12712 Ack=876 Win=338 Len=1444 TSval=2256605696 TSecr=1528395197 [TCP segment of a reassembled PDU]"
"78","3.697530","146.75.31.5","192.168.0.92","TCP","1510","443  >  55371 [ACK] Seq=14156 Ack=876 Win=338 Len=1444 TSval=2256605696 TSecr=1528395197 [TCP segment of a reassembled PDU]"
"79","3.697531","146.75.31.5","192.168.0.92","TCP","1510","443  >  55371 [ACK] Seq=15600 Ack=876 Win=338 Len=1444 TSval=2256605696 TSecr=1528395197 [TCP segment of a reassembled PDU]"
"80","3.697533","146.75.31.5","192.168.0.92","TLSv1.2","1510","Application Data"
"81","3.697534","146.75.31.5","192.168.0.92","TCP","1510","443  >  55371 [ACK] Seq=18488 Ack=876 Win=338 Len=1444 TSval=2256605696 TSecr=1528395197 [TCP segment of a reassembled PDU]"
"82","3.697535","146.75.31.5","192.168.0.92","TCP","1510","443  >  55371 [ACK] Seq=19932 Ack=876 Win=338 Len=1444 TSval=2256605696 TSecr=1528395197 [TCP segment of a reassembled PDU]"
"83","3.697536","146.75.31.5","192.168.0.92","TCP","1510","443  >  55371 [ACK] Seq=21376 Ack=876 Win=338 Len=1444 TSval=2256605696 TSecr=1528395197 [TCP segment of a reassembled PDU]"
"84","3.697537","146.75.31.5","192.168.0.92","TCP","1510","443  >  55371 [ACK] Seq=22820 Ack=876 Win=338 Len=1444 TSval=2256605696 TSecr=1528395197 [TCP segment of a reassembled PDU]"
"85","3.697538","146.75.31.5","192.168.0.92","TCP","1510","443  >  55371 [ACK] Seq=24264 Ack=876 Win=338 Len=1444 TSval=2256605696 TSecr=1528395197 [TCP segment of a reassembled PDU]"
"86","3.697538","146.75.31.5","192.168.0.92","TCP","1510","443  >  55371 [ACK] Seq=25708 Ack=876 Win=338 Len=1444 TSval=2256605696 TSecr=1528395197 [TCP segment of a reassembled PDU]"
"87","3.697539","146.75.31.5","192.168.0.92","TCP","1510","443  >  55371 [ACK] Seq=27152 Ack=876 Win=338 Len=1444 TSval=2256605696 TSecr=1528395197 [TCP segment of a reassembled PDU]"
"88","3.697541","146.75.31.5","192.168.0.92","TCP","1510","443  >  55371 [ACK] Seq=28596 Ack=876 Win=338 Len=1444 TSval=2256605696 TSecr=1528395197 [TCP segment of a reassembled PDU]"
"89","3.697542","146.75.31.5","192.168.0.92","TCP","1510","443  >  55371 [ACK] Seq=30040 Ack=876 Win=338 Len=1444 TSval=2256605696 TSecr=1528395197 [TCP segment of a reassembled PDU]"
"90","3.697543","146.75.31.5","192.168.0.92","TCP","1510","443  >  55371 [ACK] Seq=31484 Ack=876 Win=338 Len=1444 TSval=2256605696 TSecr=1528395197 [TCP segment of a reassembled PDU]"
"91","3.697544","146.75.31.5","192.168.0.92","TLSv1.2","1510","Application Data"
"92","3.697545","146.75.31.5","192.168.0.92","TCP","1510","443  >  55371 [ACK] Seq=34372 Ack=876 Win=338 Len=1444 TSval=2256605696 TSecr=1528395197 [TCP segment of a reassembled PDU]"
"93","3.697546","146.75.31.5","192.168.0.92","TCP","1510","443  >  55371 [ACK] Seq=35816 Ack=876 Win=338 Len=1444 TSval=2256605696 TSecr=1528395197 [TCP segment of a reassembled PDU]"
"94","3.697547","146.75.31.5","192.168.0.92","TCP","1510","443  >  55371 [ACK] Seq=37260 Ack=876 Win=338 Len=1444 TSval=2256605696 TSecr=1528395197 [TCP segment of a reassembled PDU]"
"95","3.697548","146.75.31.5","192.168.0.92","TCP","1510","443  >  55371 [ACK] Seq=38704 Ack=876 Win=338 Len=1444 TSval=2256605696 TSecr=1528395197 [TCP segment of a reassembled PDU]"
"96","3.697549","146.75.31.5","192.168.0.92","TCP","1510","443  >  55371 [ACK] Seq=40148 Ack=876 Win=338 Len=1444 TSval=2256605696 TSecr=1528395197 [TCP segment of a reassembled PDU]"
"97","3.697550","146.75.31.5","192.168.0.92","TCP","1510","443  >  55371 [ACK] Seq=41592 Ack=876 Win=338 Len=1444 TSval=2256605696 TSecr=1528395197 [TCP segment of a reassembled PDU]"
"98","3.697551","146.75.31.5","192.168.0.92","TCP","1510","443  >  55371 [ACK] Seq=43036 Ack=876 Win=338 Len=1444 TSval=2256605696 TSecr=1528395197 [TCP segment of a reassembled PDU]"
"99","3.697552","146.75.31.5","192.168.0.92","TCP","1510","443  >  55371 [ACK] Seq=44480 Ack=876 Win=338 Len=1444 TSval=2256605696 TSecr=1528395197 [TCP segment of a reassembled PDU]"
"100","3.697553","146.75.31.5","192.168.0.92","TCP","1510","443  >  55371 [ACK] Seq=45924 Ack=876 Win=338 Len=1444 TSval=2256605696 TSecr=1528395197 [TCP segment of a reassembled PDU]"
"101","3.697553","146.75.31.5","192.168.0.92","TCP","1510","443  >  55371 [PSH, ACK] Seq=47368 Ack=876 Win=338 Len=1444 TSval=2256605696 TSecr=1528395197 [TCP segment of a reassembled PDU]"
"102","3.697555","146.75.31.5","192.168.0.92","TCP","1510","443  >  55371 [ACK] Seq=48812 Ack=876 Win=338 Len=1444 TSval=2256605696 TSecr=1528395197 [TCP segment of a reassembled PDU]"
"103","3.697556","146.75.31.5","192.168.0.92","TLSv1.2","1510","Application Data"
"104","3.697557","146.75.31.5","192.168.0.92","TCP","1510","443  >  55371 [ACK] Seq=51700 Ack=876 Win=338 Len=1444 TSval=2256605696 TSecr=1528395197 [TCP segment of a reassembled PDU]"
"105","3.697676","192.168.0.92","146.75.31.5","TCP","66","55371  >  443 [ACK] Seq=876 Ack=18488 Win=15239 Len=0 TSval=1528395231 TSecr=2256605696"
"106","3.697722","192.168.0.92","146.75.31.5","TCP","66","55371  >  443 [ACK] Seq=876 Ack=34372 Win=14990 Len=0 TSval=1528395231 TSecr=2256605696"
"107","3.697760","192.168.0.92","146.75.31.5","TCP","66","[TCP Window Update] 55371  >  443 [ACK] Seq=876 Ack=34372 Win=15487 Len=0 TSval=1528395231 TSecr=2256605696"
"108","3.697781","192.168.0.92","146.75.31.5","TCP","66","55371  >  443 [ACK] Seq=876 Ack=48812 Win=15261 Len=0 TSval=1528395231 TSecr=2256605696"
"109","3.697785","192.168.0.92","146.75.31.5","TCP","66","55371  >  443 [ACK] Seq=876 Ack=53144 Win=15193 Len=0 TSval=1528395231 TSecr=2256605696"
"110","3.697841","192.168.0.92","146.75.31.5","TCP","66","[TCP Window Update] 55371  >  443 [ACK] Seq=876 Ack=53144 Win=15487 Len=0 TSval=1528395231 TSecr=2256605696"
"111","3.698545","146.75.31.5","192.168.0.92","TCP","1510","443  >  55371 [ACK] Seq=53144 Ack=876 Win=338 Len=1444 TSval=2256605696 TSecr=1528395197 [TCP segment of a reassembled PDU]"
"112","3.698546","146.75.31.5","192.168.0.92","TCP","1510","443  >  55371 [ACK] Seq=54588 Ack=876 Win=338 Len=1444 TSval=2256605696 TSecr=1528395197 [TCP segment of a reassembled PDU]"
"113","3.698547","146.75.31.5","192.168.0.92","TCP","1510","443  >  55371 [ACK] Seq=56032 Ack=876 Win=338 Len=1444 TSval=2256605696 TSecr=1528395197 [TCP segment of a reassembled PDU]"
"114","3.698548","146.75.31.5","192.168.0.92","TCP","1510","443  >  55371 [ACK] Seq=57476 Ack=876 Win=338 Len=1444 TSval=2256605696 TSecr=1528395197 [TCP segment of a reassembled PDU]"
"115","3.698549","146.75.31.5","192.168.0.92","TCP","1510","443  >  55371 [ACK] Seq=58920 Ack=876 Win=338 Len=1444 TSval=2256605696 TSecr=1528395197 [TCP segment of a reassembled PDU]"
"116","3.698550","146.75.31.5","192.168.0.92","TCP","1510","443  >  55371 [ACK] Seq=60364 Ack=876 Win=338 Len=1444 TSval=2256605696 TSecr=1528395197 [TCP segment of a reassembled PDU]"
"117","3.698552","146.75.31.5","192.168.0.92","TCP","1510","443  >  55371 [ACK] Seq=61808 Ack=876 Win=338 Len=1444 TSval=2256605696 TSecr=1528395197 [TCP segment of a reassembled PDU]"
"118","3.698559","146.75.31.5","192.168.0.92","TCP","1510","443  >  55371 [ACK] Seq=63252 Ack=876 Win=338 Len=1444 TSval=2256605696 TSecr=1528395197 [TCP segment of a reassembled PDU]"
"119","3.698560","146.75.31.5","192.168.0.92","TCP","1510","443  >  55371 [ACK] Seq=64696 Ack=876 Win=338 Len=1444 TSval=2256605696 TSecr=1528395197 [TCP segment of a reassembled PDU]"
"120","3.698561","146.75.31.5","192.168.0.92","TLSv1.2","1510","Application Data, Application Data"
"121","3.698563","146.75.31.5","192.168.0.92","TCP","1510","443  >  55371 [ACK] Seq=67584 Ack=876 Win=338 Len=1444 TSval=2256605696 TSecr=1528395197 [TCP segment of a reassembled PDU]"
"122","3.698563","146.75.31.5","192.168.0.92","TCP","1510","443  >  55371 [ACK] Seq=69028 Ack=876 Win=338 Len=1444 TSval=2256605696 TSecr=1528395197 [TCP segment of a reassembled PDU]"
"123","3.698564","146.75.31.5","192.168.0.92","TCP","1510","443  >  55371 [ACK] Seq=70472 Ack=876 Win=338 Len=1444 TSval=2256605696 TSecr=1528395197 [TCP segment of a reassembled PDU]"
"124","3.698565","146.75.31.5","192.168.0.92","TCP","1510","443  >  55371 [ACK] Seq=71916 Ack=876 Win=338 Len=1444 TSval=2256605696 TSecr=1528395197 [TCP segment of a reassembled PDU]"
"125","3.698566","146.75.31.5","192.168.0.92","TCP","1510","443  >  55371 [ACK] Seq=73360 Ack=876 Win=338 Len=1444 TSval=2256605696 TSecr=1528395197 [TCP segment of a reassembled PDU]"
"126","3.698568","146.75.31.5","192.168.0.92","TCP","1510","443  >  55371 [ACK] Seq=74804 Ack=876 Win=338 Len=1444 TSval=2256605696 TSecr=1528395197 [TCP segment of a reassembled PDU]"
"127","3.698568","146.75.31.5","192.168.0.92","TCP","1510","443  >  55371 [ACK] Seq=76248 Ack=876 Win=338 Len=1444 TSval=2256605696 TSecr=1528395197 [TCP segment of a reassembled PDU]"
"128","3.698569","146.75.31.5","192.168.0.92","TCP","1510","443  >  55371 [ACK] Seq=77692 Ack=876 Win=338 Len=1444 TSval=2256605696 TSecr=1528395197 [TCP segment of a reassembled PDU]"
"129","3.698570","146.75.31.5","192.168.0.92","TCP","1510","443  >  55371 [ACK] Seq=79136 Ack=876 Win=338 Len=1444 TSval=2256605696 TSecr=1528395197 [TCP segment of a reassembled PDU]"
"130","3.698571","146.75.31.5","192.168.0.92","TCP","1510","443  >  55371 [ACK] Seq=80580 Ack=876 Win=338 Len=1444 TSval=2256605696 TSecr=1528395197 [TCP segment of a reassembled PDU]"
"131","3.698641","192.168.0.92","146.75.31.5","TCP","66","55371  >  443 [ACK] Seq=876 Ack=69028 Win=15239 Len=0 TSval=1528395231 TSecr=2256605696"
"132","3.698665","192.168.0.92","146.75.31.5","TCP","66","55371  >  443 [ACK] Seq=876 Ack=82024 Win=15036 Len=0 TSval=1528395232 TSecr=2256605696"
"133","3.699268","146.75.31.5","192.168.0.92","TLSv1.2","1510","Application Data"
"134","3.699270","146.75.31.5","192.168.0.92","TCP","1510","443  >  55371 [ACK] Seq=83468 Ack=876 Win=338 Len=1444 TSval=2256605696 TSecr=1528395197 [TCP segment of a reassembled PDU]"
"135","3.699270","146.75.31.5","192.168.0.92","TCP","1510","443  >  55371 [ACK] Seq=84912 Ack=876 Win=338 Len=1444 TSval=2256605696 TSecr=1528395197 [TCP segment of a reassembled PDU]"
"136","3.699271","146.75.31.5","192.168.0.92","TCP","1510","443  >  55371 [ACK] Seq=86356 Ack=876 Win=338 Len=1444 TSval=2256605696 TSecr=1528395197 [TCP segment of a reassembled PDU]"
"137","3.699272","146.75.31.5","192.168.0.92","TCP","1510","443  >  55371 [ACK] Seq=87800 Ack=876 Win=338 Len=1444 TSval=2256605696 TSecr=1528395197 [TCP segment of a reassembled PDU]"
"138","3.699273","146.75.31.5","192.168.0.92","TCP","1510","443  >  55371 [ACK] Seq=89244 Ack=876 Win=338 Len=1444 TSval=2256605696 TSecr=1528395197 [TCP segment of a reassembled PDU]"
"139","3.699274","146.75.31.5","192.168.0.92","TCP","1510","443  >  55371 [ACK] Seq=90688 Ack=876 Win=338 Len=1444 TSval=2256605696 TSecr=1528395197 [TCP segment of a reassembled PDU]"
"140","3.699275","146.75.31.5","192.168.0.92","TCP","1510","443  >  55371 [ACK] Seq=92132 Ack=876 Win=338 Len=1444 TSval=2256605696 TSecr=1528395197 [TCP segment of a reassembled PDU]"
"141","3.699276","146.75.31.5","192.168.0.92","TCP","1510","443  >  55371 [ACK] Seq=93576 Ack=876 Win=338 Len=1444 TSval=2256605696 TSecr=1528395197 [TCP segment of a reassembled PDU]"
"142","3.699277","146.75.31.5","192.168.0.92","TCP","1510","443  >  55371 [PSH, ACK] Seq=95020 Ack=876 Win=338 Len=1444 TSval=2256605696 TSecr=1528395197 [TCP segment of a reassembled PDU]"
"143","3.699277","146.75.31.5","192.168.0.92","TCP","1510","443  >  55371 [ACK] Seq=96464 Ack=876 Win=338 Len=1444 TSval=2256605697 TSecr=1528395197 [TCP segment of a reassembled PDU]"
"144","3.699278","146.75.31.5","192.168.0.92","TCP","1510","443  >  55371 [ACK] Seq=97908 Ack=876 Win=338 Len=1444 TSval=2256605697 TSecr=1528395197 [TCP segment of a reassembled PDU]"
"145","3.699279","146.75.31.5","192.168.0.92","TLSv1.2","1510","Application Data"
"146","3.699280","146.75.31.5","192.168.0.92","TCP","1510","443  >  55371 [ACK] Seq=100796 Ack=876 Win=338 Len=1444 TSval=2256605697 TSecr=1528395197 [TCP segment of a reassembled PDU]"
"147","3.699281","146.75.31.5","192.168.0.92","TCP","1510","443  >  55371 [ACK] Seq=102240 Ack=876 Win=338 Len=1444 TSval=2256605697 TSecr=1528395197 [TCP segment of a reassembled PDU]"
"148","3.699281","146.75.31.5","192.168.0.92","TCP","1510","443  >  55371 [ACK] Seq=103684 Ack=876 Win=338 Len=1444 TSval=2256605697 TSecr=1528395197 [TCP segment of a reassembled PDU]"
"149","3.699282","146.75.31.5","192.168.0.92","TCP","1510","443  >  55371 [ACK] Seq=105128 Ack=876 Win=338 Len=1444 TSval=2256605697 TSecr=1528395197 [TCP segment of a reassembled PDU]"
"150","3.699284","146.75.31.5","192.168.0.92","TCP","1510","443  >  55371 [ACK] Seq=106572 Ack=876 Win=338 Len=1444 TSval=2256605697 TSecr=1528395197 [TCP segment of a reassembled PDU]"
"151","3.699284","146.75.31.5","192.168.0.92","TCP","1510","443  >  55371 [ACK] Seq=108016 Ack=876 Win=338 Len=1444 TSval=2256605697 TSecr=1528395197 [TCP segment of a reassembled PDU]"
"152","3.699285","146.75.31.5","192.168.0.92","TCP","1510","443  >  55371 [ACK] Seq=109460 Ack=876 Win=338 Len=1444 TSval=2256605697 TSecr=1528395197 [TCP segment of a reassembled PDU]"
"153","3.699286","146.75.31.5","192.168.0.92","TCP","1510","443  >  55371 [ACK] Seq=110904 Ack=876 Win=338 Len=1444 TSval=2256605697 TSecr=1528395197 [TCP segment of a reassembled PDU]"
"154","3.699287","146.75.31.5","192.168.0.92","TCP","1510","443  >  55371 [ACK] Seq=112348 Ack=876 Win=338 Len=1444 TSval=2256605697 TSecr=1528395197 [TCP segment of a reassembled PDU]"
"155","3.699288","146.75.31.5","192.168.0.92","TCP","1510","443  >  55371 [ACK] Seq=113792 Ack=876 Win=338 Len=1444 TSval=2256605697 TSecr=1528395197 [TCP segment of a reassembled PDU]"
"156","3.699289","146.75.31.5","192.168.0.92","TLSv1.2","1510","Application Data"
"157","3.699290","146.75.31.5","192.168.0.92","TCP","1510","443  >  55371 [ACK] Seq=116680 Ack=876 Win=338 Len=1444 TSval=2256605697 TSecr=1528395197 [TCP segment of a reassembled PDU]"
"158","3.699291","146.75.31.5","192.168.0.92","TCP","1510","443  >  55371 [ACK] Seq=118124 Ack=876 Win=338 Len=1444 TSval=2256605697 TSecr=1528395197 [TCP segment of a reassembled PDU]"
"159","3.699292","146.75.31.5","192.168.0.92","TCP","1510","443  >  55371 [ACK] Seq=119568 Ack=876 Win=338 Len=1444 TSval=2256605697 TSecr=1528395197 [TCP segment of a reassembled PDU]"
"160","3.699293","146.75.31.5","192.168.0.92","TCP","1510","443  >  55371 [ACK] Seq=121012 Ack=876 Win=338 Len=1444 TSval=2256605697 TSecr=1528395197 [TCP segment of a reassembled PDU]"
"161","3.699294","146.75.31.5","192.168.0.92","TCP","1510","443  >  55371 [ACK] Seq=122456 Ack=876 Win=338 Len=1444 TSval=2256605697 TSecr=1528395197 [TCP segment of a reassembled PDU]"
"162","3.699295","146.75.31.5","192.168.0.92","TCP","1510","443  >  55371 [ACK] Seq=123900 Ack=876 Win=338 Len=1444 TSval=2256605697 TSecr=1528395197 [TCP segment of a reassembled PDU]"
"163","3.699295","146.75.31.5","192.168.0.92","TCP","1510","443  >  55371 [ACK] Seq=125344 Ack=876 Win=338 Len=1444 TSval=2256605697 TSecr=1528395197 [TCP segment of a reassembled PDU]"
"164","3.699296","146.75.31.5","192.168.0.92","TCP","1510","443  >  55371 [ACK] Seq=126788 Ack=876 Win=338 Len=1444 TSval=2256605697 TSecr=1528395197 [TCP segment of a reassembled PDU]"
"165","3.699389","192.168.0.92","146.75.31.5","TCP","66","55371  >  443 [ACK] Seq=876 Ack=97908 Win=14787 Len=0 TSval=1528395232 TSecr=2256605697"
"166","3.699416","192.168.0.92","146.75.31.5","TCP","66","55371  >  443 [ACK] Seq=876 Ack=113792 Win=14539 Len=0 TSval=1528395232 TSecr=2256605697"
"167","3.699427","192.168.0.92","146.75.31.5","TCP","66","55371  >  443 [ACK] Seq=876 Ack=128232 Win=14314 Len=0 TSval=1528395232 TSecr=2256605697"
"168","3.699681","192.168.0.92","146.75.31.5","TCP","66","[TCP Window Update] 55371  >  443 [ACK] Seq=876 Ack=128232 Win=15487 Len=0 TSval=1528395232 TSecr=2256605697"
"169","3.700484","146.75.31.5","192.168.0.92","TCP","1510","443  >  55371 [ACK] Seq=128232 Ack=876 Win=338 Len=1444 TSval=2256605697 TSecr=1528395197 [TCP segment of a reassembled PDU]"
"170","3.700485","146.75.31.5","192.168.0.92","TCP","1510","443  >  55371 [ACK] Seq=129676 Ack=876 Win=338 Len=1444 TSval=2256605697 TSecr=1528395197 [TCP segment of a reassembled PDU]"
"171","3.700486","146.75.31.5","192.168.0.92","TLSv1.2","1470","Application Data, Application Data"
"172","3.700487","146.75.31.5","192.168.0.92","TCP","1510","443  >  55371 [ACK] Seq=132524 Ack=876 Win=338 Len=1444 TSval=2256605698 TSecr=1528395197 [TCP segment of a reassembled PDU]"
"173","3.700566","192.168.0.92","146.75.31.5","TCP","66","55371  >  443 [ACK] Seq=876 Ack=133968 Win=15397 Len=0 TSval=1528395234 TSecr=2256605698"
"174","3.700647","192.168.0.92","146.75.31.5","TCP","66","[TCP Window Update] 55371  >  443 [ACK] Seq=876 Ack=133968 Win=15487 Len=0 TSval=1528395234 TSecr=2256605698"
"175","3.702005","146.75.31.5","192.168.0.92","TCP","1510","443  >  55371 [ACK] Seq=133968 Ack=876 Win=338 Len=1444 TSval=2256605698 TSecr=1528395197 [TCP segment of a reassembled PDU]"
"176","3.702006","146.75.31.5","192.168.0.92","TCP","1510","443  >  55371 [ACK] Seq=135412 Ack=876 Win=338 Len=1444 TSval=2256605698 TSecr=1528395197 [TCP segment of a reassembled PDU]"
"177","3.702007","146.75.31.5","192.168.0.92","TCP","1510","443  >  55371 [ACK] Seq=136856 Ack=876 Win=338 Len=1444 TSval=2256605698 TSecr=1528395197 [TCP segment of a reassembled PDU]"
"178","3.702008","146.75.31.5","192.168.0.92","TCP","1510","443  >  55371 [ACK] Seq=138300 Ack=876 Win=338 Len=1444 TSval=2256605698 TSecr=1528395197 [TCP segment of a reassembled PDU]"
"179","3.702009","146.75.31.5","192.168.0.92","TCP","1510","443  >  55371 [ACK] Seq=139744 Ack=876 Win=338 Len=1444 TSval=2256605698 TSecr=1528395197 [TCP segment of a reassembled PDU]"
"180","3.702010","146.75.31.5","192.168.0.92","TCP","1510","443  >  55371 [ACK] Seq=141188 Ack=876 Win=338 Len=1444 TSval=2256605698 TSecr=1528395197 [TCP segment of a reassembled PDU]"
"181","3.702011","146.75.31.5","192.168.0.92","TCP","1510","443  >  55371 [ACK] Seq=142632 Ack=876 Win=338 Len=1444 TSval=2256605698 TSecr=1528395197 [TCP segment of a reassembled PDU]"
"182","3.702012","146.75.31.5","192.168.0.92","TCP","1510","443  >  55371 [ACK] Seq=144076 Ack=876 Win=338 Len=1444 TSval=2256605698 TSecr=1528395197 [TCP segment of a reassembled PDU]"
"183","3.702012","146.75.31.5","192.168.0.92","TCP","1510","443  >  55371 [ACK] Seq=145520 Ack=876 Win=338 Len=1444 TSval=2256605698 TSecr=1528395197 [TCP segment of a reassembled PDU]"
"184","3.702013","146.75.31.5","192.168.0.92","TCP","1510","443  >  55371 [ACK] Seq=146964 Ack=876 Win=338 Len=1444 TSval=2256605698 TSecr=1528395197 [TCP segment of a reassembled PDU]"
"185","3.702014","146.75.31.5","192.168.0.92","TLSv1.2","1510","Application Data"
"186","3.702015","146.75.31.5","192.168.0.92","TCP","1510","443  >  55371 [ACK] Seq=149852 Ack=876 Win=338 Len=1444 TSval=2256605698 TSecr=1528395197 [TCP segment of a reassembled PDU]"
"187","3.702016","146.75.31.5","192.168.0.92","TCP","1510","443  >  55371 [ACK] Seq=151296 Ack=876 Win=338 Len=1444 TSval=2256605698 TSecr=1528395197 [TCP segment of a reassembled PDU]"
"188","3.702016","146.75.31.5","192.168.0.92","TCP","1510","443  >  55371 [ACK] Seq=152740 Ack=876 Win=338 Len=1444 TSval=2256605698 TSecr=1528395197 [TCP segment of a reassembled PDU]"
"189","3.702017","146.75.31.5","192.168.0.92","TCP","1510","443  >  55371 [ACK] Seq=154184 Ack=876 Win=338 Len=1444 TSval=2256605698 TSecr=1528395197 [TCP segment of a reassembled PDU]"
"190","3.702018","146.75.31.5","192.168.0.92","TCP","1510","443  >  55371 [ACK] Seq=155628 Ack=876 Win=338 Len=1444 TSval=2256605698 TSecr=1528395197 [TCP segment of a reassembled PDU]"
"191","3.702019","146.75.31.5","192.168.0.92","TCP","1510","443  >  55371 [ACK] Seq=157072 Ack=876 Win=338 Len=1444 TSval=2256605698 TSecr=1528395197 [TCP segment of a reassembled PDU]"
"192","3.702020","146.75.31.5","192.168.0.92","TCP","1510","443  >  55371 [ACK] Seq=158516 Ack=876 Win=338 Len=1444 TSval=2256605698 TSecr=1528395197 [TCP segment of a reassembled PDU]"
"193","3.702021","146.75.31.5","192.168.0.92","TCP","1510","443  >  55371 [ACK] Seq=159960 Ack=876 Win=338 Len=1444 TSval=2256605698 TSecr=1528395197 [TCP segment of a reassembled PDU]"
"194","3.702022","146.75.31.5","192.168.0.92","TCP","1510","443  >  55371 [ACK] Seq=161404 Ack=876 Win=338 Len=1444 TSval=2256605698 TSecr=1528395197 [TCP segment of a reassembled PDU]"
"195","3.702022","146.75.31.5","192.168.0.92","TCP","1510","443  >  55371 [ACK] Seq=162848 Ack=876 Win=338 Len=1444 TSval=2256605698 TSecr=1528395197 [TCP segment of a reassembled PDU]"
"196","3.702023","146.75.31.5","192.168.0.92","TLSv1.2","1510","Application Data"
"197","3.702024","146.75.31.5","192.168.0.92","TCP","1510","443  >  55371 [ACK] Seq=165736 Ack=876 Win=338 Len=1444 TSval=2256605698 TSecr=1528395197 [TCP segment of a reassembled PDU]"
"198","3.702025","146.75.31.5","192.168.0.92","TCP","1510","443  >  55371 [ACK] Seq=167180 Ack=876 Win=338 Len=1444 TSval=2256605698 TSecr=1528395197 [TCP segment of a reassembled PDU]"
"199","3.702026","146.75.31.5","192.168.0.92","TCP","1510","443  >  55371 [ACK] Seq=168624 Ack=876 Win=338 Len=1444 TSval=2256605698 TSecr=1528395197 [TCP segment of a reassembled PDU]"
"200","3.702027","146.75.31.5","192.168.0.92","TCP","1510","443  >  55371 [ACK] Seq=170068 Ack=876 Win=338 Len=1444 TSval=2256605698 TSecr=1528395197 [TCP segment of a reassembled PDU]"
"201","3.702027","146.75.31.5","192.168.0.92","TCP","1510","443  >  55371 [ACK] Seq=171512 Ack=876 Win=338 Len=1444 TSval=2256605698 TSecr=1528395197 [TCP segment of a reassembled PDU]"
"202","3.702028","146.75.31.5","192.168.0.92","TCP","1510","443  >  55371 [ACK] Seq=172956 Ack=876 Win=338 Len=1444 TSval=2256605698 TSecr=1528395197 [TCP segment of a reassembled PDU]"
"203","3.702029","146.75.31.5","192.168.0.92","TCP","1510","443  >  55371 [ACK] Seq=174400 Ack=876 Win=338 Len=1444 TSval=2256605698 TSecr=1528395197 [TCP segment of a reassembled PDU]"
"204","3.702030","146.75.31.5","192.168.0.92","TCP","1510","443  >  55371 [ACK] Seq=175844 Ack=876 Win=338 Len=1444 TSval=2256605698 TSecr=1528395197 [TCP segment of a reassembled PDU]"
"205","3.702031","146.75.31.5","192.168.0.92","TCP","1510","443  >  55371 [ACK] Seq=177288 Ack=876 Win=338 Len=1444 TSval=2256605698 TSecr=1528395197 [TCP segment of a reassembled PDU]"
"206","3.702031","146.75.31.5","192.168.0.92","TCP","1510","443  >  55371 [PSH, ACK] Seq=178732 Ack=876 Win=338 Len=1444 TSval=2256605698 TSecr=1528395197 [TCP segment of a reassembled PDU]"
"207","3.702099","192.168.0.92","146.75.31.5","TCP","66","55371  >  443 [ACK] Seq=876 Ack=149852 Win=15239 Len=0 TSval=1528395235 TSecr=2256605698"
"208","3.702124","192.168.0.92","146.75.31.5","TCP","66","55371  >  443 [ACK] Seq=876 Ack=165736 Win=14990 Len=0 TSval=1528395235 TSecr=2256605698"
"209","3.702140","192.168.0.92","146.75.31.5","TCP","66","[TCP Window Update] 55371  >  443 [ACK] Seq=876 Ack=165736 Win=15487 Len=0 TSval=1528395235 TSecr=2256605698"
"210","3.702150","192.168.0.92","146.75.31.5","TCP","66","55371  >  443 [ACK] Seq=876 Ack=180176 Win=15261 Len=0 TSval=1528395235 TSecr=2256605698"
"211","3.702178","192.168.0.92","146.75.31.5","TCP","66","[TCP Window Update] 55371  >  443 [ACK] Seq=876 Ack=180176 Win=15487 Len=0 TSval=1528395235 TSecr=2256605698"
"212","3.703085","146.75.31.5","192.168.0.92","TCP","1510","443  >  55371 [ACK] Seq=180176 Ack=876 Win=338 Len=1444 TSval=2256605699 TSecr=1528395197 [TCP segment of a reassembled PDU]"
"213","3.703086","146.75.31.5","192.168.0.92","TLSv1.2","1510","Application Data"
"214","3.703087","146.75.31.5","192.168.0.92","TCP","1510","443  >  55371 [ACK] Seq=183064 Ack=876 Win=338 Len=1444 TSval=2256605699 TSecr=1528395197 [TCP segment of a reassembled PDU]"
"215","3.703088","146.75.31.5","192.168.0.92","TCP","1510","443  >  55371 [ACK] Seq=184508 Ack=876 Win=338 Len=1444 TSval=2256605699 TSecr=1528395197 [TCP segment of a reassembled PDU]"
"216","3.703089","146.75.31.5","192.168.0.92","TCP","1510","443  >  55371 [ACK] Seq=185952 Ack=876 Win=338 Len=1444 TSval=2256605699 TSecr=1528395197 [TCP segment of a reassembled PDU]"
"217","3.703089","146.75.31.5","192.168.0.92","TCP","1510","443  >  55371 [ACK] Seq=187396 Ack=876 Win=338 Len=1444 TSval=2256605699 TSecr=1528395197 [TCP segment of a reassembled PDU]"
"218","3.703090","146.75.31.5","192.168.0.92","TCP","1510","443  >  55371 [ACK] Seq=188840 Ack=876 Win=338 Len=1444 TSval=2256605699 TSecr=1528395197 [TCP segment of a reassembled PDU]"
"219","3.703091","146.75.31.5","192.168.0.92","TCP","1510","443  >  55371 [ACK] Seq=190284 Ack=876 Win=338 Len=1444 TSval=2256605699 TSecr=1528395197 [TCP segment of a reassembled PDU]"
"220","3.703091","146.75.31.5","192.168.0.92","TCP","1510","443  >  55371 [ACK] Seq=191728 Ack=876 Win=338 Len=1444 TSval=2256605699 TSecr=1528395197 [TCP segment of a reassembled PDU]"
"221","3.703092","146.75.31.5","192.168.0.92","TCP","1510","443  >  55371 [ACK] Seq=193172 Ack=876 Win=338 Len=1444 TSval=2256605699 TSecr=1528395197 [TCP segment of a reassembled PDU]"
"222","3.703093","146.75.31.5","192.168.0.92","TCP","1510","443  >  55371 [ACK] Seq=194616 Ack=876 Win=338 Len=1444 TSval=2256605699 TSecr=1528395197 [TCP segment of a reassembled PDU]"
"223","3.703094","146.75.31.5","192.168.0.92","TCP","1510","443  >  55371 [ACK] Seq=196060 Ack=876 Win=338 Len=1444 TSval=2256605699 TSecr=1528395197 [TCP segment of a reassembled PDU]"
"224","3.703095","146.75.31.5","192.168.0.92","TLSv1.2","1510","Application Data, Application Data"
"225","3.703095","146.75.31.5","192.168.0.92","TCP","1510","443  >  55371 [ACK] Seq=198948 Ack=876 Win=338 Len=1444 TSval=2256605699 TSecr=1528395197 [TCP segment of a reassembled PDU]"
"226","3.703096","146.75.31.5","192.168.0.92","TCP","1510","443  >  55371 [ACK] Seq=200392 Ack=876 Win=338 Len=1444 TSval=2256605699 TSecr=1528395197 [TCP segment of a reassembled PDU]"
"227","3.703096","146.75.31.5","192.168.0.92","TCP","1510","443  >  55371 [ACK] Seq=201836 Ack=876 Win=338 Len=1444 TSval=2256605699 TSecr=1528395197 [TCP segment of a reassembled PDU]"
"228","3.703097","146.75.31.5","192.168.0.92","TCP","1510","443  >  55371 [ACK] Seq=203280 Ack=876 Win=338 Len=1444 TSval=2256605699 TSecr=1528395197 [TCP segment of a reassembled PDU]"
"229","3.703098","146.75.31.5","192.168.0.92","TCP","1510","443  >  55371 [ACK] Seq=204724 Ack=876 Win=338 Len=1444 TSval=2256605699 TSecr=1528395197 [TCP segment of a reassembled PDU]"
"230","3.703099","146.75.31.5","192.168.0.92","TCP","1510","443  >  55371 [ACK] Seq=206168 Ack=876 Win=338 Len=1444 TSval=2256605699 TSecr=1528395197 [TCP segment of a reassembled PDU]"
"231","3.703100","146.75.31.5","192.168.0.92","TCP","1510","443  >  55371 [ACK] Seq=207612 Ack=876 Win=338 Len=1444 TSval=2256605699 TSecr=1528395197 [TCP segment of a reassembled PDU]"
"232","3.703100","146.75.31.5","192.168.0.92","TCP","1510","443  >  55371 [ACK] Seq=209056 Ack=876 Win=338 Len=1444 TSval=2256605699 TSecr=1528395197 [TCP segment of a reassembled PDU]"
"233","3.703101","146.75.31.5","192.168.0.92","TCP","1510","443  >  55371 [ACK] Seq=210500 Ack=876 Win=338 Len=1444 TSval=2256605699 TSecr=1528395197 [TCP segment of a reassembled PDU]"
"234","3.703102","146.75.31.5","192.168.0.92","TCP","1510","443  >  55371 [ACK] Seq=211944 Ack=876 Win=338 Len=1444 TSval=2256605699 TSecr=1528395197 [TCP segment of a reassembled PDU]"
"235","3.703103","146.75.31.5","192.168.0.92","TLSv1.2","1510","Application Data"
"236","3.703104","146.75.31.5","192.168.0.92","TCP","1510","443  >  55371 [ACK] Seq=214832 Ack=876 Win=338 Len=1444 TSval=2256605699 TSecr=1528395197 [TCP segment of a reassembled PDU]"
"237","3.703104","146.75.31.5","192.168.0.92","TCP","1510","443  >  55371 [ACK] Seq=216276 Ack=876 Win=338 Len=1444 TSval=2256605699 TSecr=1528395197 [TCP segment of a reassembled PDU]"
"238","3.703105","146.75.31.5","192.168.0.92","TCP","1510","443  >  55371 [ACK] Seq=217720 Ack=876 Win=338 Len=1444 TSval=2256605699 TSecr=1528395197 [TCP segment of a reassembled PDU]"
"239","3.703106","146.75.31.5","192.168.0.92","TCP","1510","443  >  55371 [ACK] Seq=219164 Ack=876 Win=338 Len=1444 TSval=2256605699 TSecr=1528395197 [TCP segment of a reassembled PDU]"
"240","3.703107","146.75.31.5","192.168.0.92","TCP","1510","443  >  55371 [ACK] Seq=220608 Ack=876 Win=338 Len=1444 TSval=2256605699 TSecr=1528395197 [TCP segment of a reassembled PDU]"
"241","3.703107","146.75.31.5","192.168.0.92","TCP","1510","443  >  55371 [ACK] Seq=222052 Ack=876 Win=338 Len=1444 TSval=2256605699 TSecr=1528395197 [TCP segment of a reassembled PDU]"
"242","3.703108","146.75.31.5","192.168.0.92","TCP","1510","443  >  55371 [ACK] Seq=223496 Ack=876 Win=338 Len=1444 TSval=2256605699 TSecr=1528395197 [TCP segment of a reassembled PDU]"
"243","3.703109","146.75.31.5","192.168.0.92","TCP","1510","443  >  55371 [ACK] Seq=224940 Ack=876 Win=338 Len=1444 TSval=2256605699 TSecr=1528395197 [TCP segment of a reassembled PDU]"
"244","3.703109","146.75.31.5","192.168.0.92","TCP","1510","443  >  55371 [PSH, ACK] Seq=226384 Ack=876 Win=338 Len=1444 TSval=2256605699 TSecr=1528395197 [TCP segment of a reassembled PDU]"
"245","3.703110","146.75.31.5","192.168.0.92","TCP","1510","443  >  55371 [ACK] Seq=227828 Ack=876 Win=338 Len=1444 TSval=2256605700 TSecr=1528395197 [TCP segment of a reassembled PDU]"
"246","3.703111","146.75.31.5","192.168.0.92","TCP","1510","443  >  55371 [ACK] Seq=229272 Ack=876 Win=338 Len=1444 TSval=2256605700 TSecr=1528395197 [TCP segment of a reassembled PDU]"
"247","3.703111","146.75.31.5","192.168.0.92","TLSv1.2","1510","Application Data"
"248","3.703412","192.168.0.92","146.75.31.5","TCP","66","55371  >  443 [ACK] Seq=876 Ack=232160 Win=15487 Len=0 TSval=1528395236 TSecr=2256605699"
"249","3.704025","146.75.31.5","192.168.0.92","TCP","1510","443  >  55371 [ACK] Seq=232160 Ack=876 Win=338 Len=1444 TSval=2256605700 TSecr=1528395197 [TCP segment of a reassembled PDU]"
"250","3.704026","146.75.31.5","192.168.0.92","TCP","1510","443  >  55371 [ACK] Seq=233604 Ack=876 Win=338 Len=1444 TSval=2256605700 TSecr=1528395197 [TCP segment of a reassembled PDU]"
"251","3.704026","146.75.31.5","192.168.0.92","TCP","1510","443  >  55371 [ACK] Seq=235048 Ack=876 Win=338 Len=1444 TSval=2256605700 TSecr=1528395197 [TCP segment of a reassembled PDU]"
"252","3.704027","146.75.31.5","192.168.0.92","TCP","1510","443  >  55371 [ACK] Seq=236492 Ack=876 Win=338 Len=1444 TSval=2256605700 TSecr=1528395197 [TCP segment of a reassembled PDU]"
"253","3.704028","146.75.31.5","192.168.0.92","TCP","1510","443  >  55371 [ACK] Seq=237936 Ack=876 Win=338 Len=1444 TSval=2256605700 TSecr=1528395197 [TCP segment of a reassembled PDU]"
"254","3.704029","146.75.31.5","192.168.0.92","TCP","1510","443  >  55371 [ACK] Seq=239380 Ack=876 Win=338 Len=1444 TSval=2256605700 TSecr=1528395197 [TCP segment of a reassembled PDU]"
"255","3.704029","146.75.31.5","192.168.0.92","TCP","1510","443  >  55371 [ACK] Seq=240824 Ack=876 Win=338 Len=1444 TSval=2256605700 TSecr=1528395197 [TCP segment of a reassembled PDU]"
"256","3.704030","146.75.31.5","192.168.0.92","TCP","1510","443  >  55371 [ACK] Seq=242268 Ack=876 Win=338 Len=1444 TSval=2256605700 TSecr=1528395197 [TCP segment of a reassembled PDU]"
"257","3.704031","146.75.31.5","192.168.0.92","TCP","1510","443  >  55371 [ACK] Seq=243712 Ack=876 Win=338 Len=1444 TSval=2256605700 TSecr=1528395197 [TCP segment of a reassembled PDU]"
"258","3.704032","146.75.31.5","192.168.0.92","TCP","1510","443  >  55371 [ACK] Seq=245156 Ack=876 Win=338 Len=1444 TSval=2256605700 TSecr=1528395197 [TCP segment of a reassembled PDU]"
"259","3.704033","146.75.31.5","192.168.0.92","TLSv1.2","1510","Application Data"
"260","3.704033","146.75.31.5","192.168.0.92","TCP","1510","443  >  55371 [ACK] Seq=248044 Ack=876 Win=338 Len=1444 TSval=2256605700 TSecr=1528395197 [TCP segment of a reassembled PDU]"
"261","3.704034","146.75.31.5","192.168.0.92","TCP","1510","443  >  55371 [ACK] Seq=249488 Ack=876 Win=338 Len=1444 TSval=2256605700 TSecr=1528395197 [TCP segment of a reassembled PDU]"
"262","3.704035","146.75.31.5","192.168.0.92","TCP","1510","443  >  55371 [ACK] Seq=250932 Ack=876 Win=338 Len=1444 TSval=2256605700 TSecr=1528395197 [TCP segment of a reassembled PDU]"
"263","3.704036","146.75.31.5","192.168.0.92","TCP","1510","443  >  55371 [ACK] Seq=252376 Ack=876 Win=338 Len=1444 TSval=2256605700 TSecr=1528395197 [TCP segment of a reassembled PDU]"
"264","3.704037","146.75.31.5","192.168.0.92","TCP","1510","443  >  55371 [ACK] Seq=253820 Ack=876 Win=338 Len=1444 TSval=2256605700 TSecr=1528395197 [TCP segment of a reassembled PDU]"
"265","3.704037","146.75.31.5","192.168.0.92","TCP","1510","443  >  55371 [ACK] Seq=255264 Ack=876 Win=338 Len=1444 TSval=2256605700 TSecr=1528395197 [TCP segment of a reassembled PDU]"
"266","3.704038","146.75.31.5","192.168.0.92","TCP","1510","443  >  55371 [ACK] Seq=256708 Ack=876 Win=338 Len=1444 TSval=2256605700 TSecr=1528395197 [TCP segment of a reassembled PDU]"
"267","3.704039","146.75.31.5","192.168.0.92","TCP","1510","443  >  55371 [ACK] Seq=258152 Ack=876 Win=338 Len=1444 TSval=2256605700 TSecr=1528395197 [TCP segment of a reassembled PDU]"
"268","3.704039","146.75.31.5","192.168.0.92","TCP","1510","443  >  55371 [ACK] Seq=259596 Ack=876 Win=338 Len=1444 TSval=2256605700 TSecr=1528395197 [TCP segment of a reassembled PDU]"
"269","3.704040","146.75.31.5","192.168.0.92","TCP","1510","443  >  55371 [ACK] Seq=261040 Ack=876 Win=338 Len=1444 TSval=2256605700 TSecr=1528395197 [TCP segment of a reassembled PDU]"
"270","3.704041","146.75.31.5","192.168.0.92","TLSv1.2","1510","Application Data, Application Data"
"271","3.704042","146.75.31.5","192.168.0.92","TCP","1510","443  >  55371 [ACK] Seq=263928 Ack=876 Win=338 Len=1444 TSval=2256605700 TSecr=1528395197 [TCP segment of a reassembled PDU]"
"272","3.704042","146.75.31.5","192.168.0.92","TCP","1510","443  >  55371 [ACK] Seq=265372 Ack=876 Win=338 Len=1444 TSval=2256605700 TSecr=1528395197 [TCP segment of a reassembled PDU]"
"273","3.704043","146.75.31.5","192.168.0.92","TCP","1510","443  >  55371 [ACK] Seq=266816 Ack=876 Win=338 Len=1444 TSval=2256605700 TSecr=1528395197 [TCP segment of a reassembled PDU]"
"274","3.704044","146.75.31.5","192.168.0.92","TCP","1510","443  >  55371 [ACK] Seq=268260 Ack=876 Win=338 Len=1444 TSval=2256605700 TSecr=1528395197 [TCP segment of a reassembled PDU]"
"275","3.704045","146.75.31.5","192.168.0.92","TCP","1510","443  >  55371 [ACK] Seq=269704 Ack=876 Win=338 Len=1444 TSval=2256605700 TSecr=1528395197 [TCP segment of a reassembled PDU]"
"276","3.704045","146.75.31.5","192.168.0.92","TCP","1510","443  >  55371 [ACK] Seq=271148 Ack=876 Win=338 Len=1444 TSval=2256605700 TSecr=1528395197 [TCP segment of a reassembled PDU]"
"277","3.704046","146.75.31.5","192.168.0.92","TCP","1510","443  >  55371 [ACK] Seq=272592 Ack=876 Win=338 Len=1444 TSval=2256605700 TSecr=1528395197 [TCP segment of a reassembled PDU]"
"278","3.704047","146.75.31.5","192.168.0.92","TCP","1510","443  >  55371 [PSH, ACK] Seq=274036 Ack=876 Win=338 Len=1444 TSval=2256605700 TSecr=1528395197 [TCP segment of a reassembled PDU]"
"279","3.704048","146.75.31.5","192.168.0.92","TCP","1510","443  >  55371 [ACK] Seq=275480 Ack=876 Win=338 Len=1444 TSval=2256605701 TSecr=1528395197 [TCP segment of a reassembled PDU]"
"280","3.704049","146.75.31.5","192.168.0.92","TCP","1510","443  >  55371 [ACK] Seq=276924 Ack=876 Win=338 Len=1444 TSval=2256605701 TSecr=1528395197 [TCP segment of a reassembled PDU]"
"281","3.704049","146.75.31.5","192.168.0.92","TCP","1510","443  >  55371 [ACK] Seq=278368 Ack=876 Win=338 Len=1444 TSval=2256605701 TSecr=1528395197 [TCP segment of a reassembled PDU]"
"282","3.704050","146.75.31.5","192.168.0.92","TLSv1.2","1510","Application Data"
"283","3.704051","146.75.31.5","192.168.0.92","TCP","1510","443  >  55371 [ACK] Seq=281256 Ack=876 Win=338 Len=1444 TSval=2256605701 TSecr=1528395197 [TCP segment of a reassembled PDU]"
"284","3.704051","146.75.31.5","192.168.0.92","TCP","1510","443  >  55371 [ACK] Seq=282700 Ack=876 Win=338 Len=1444 TSval=2256605701 TSecr=1528395197 [TCP segment of a reassembled PDU]"
"285","3.704052","146.75.31.5","192.168.0.92","TCP","1510","443  >  55371 [ACK] Seq=284144 Ack=876 Win=338 Len=1444 TSval=2256605701 TSecr=1528395197 [TCP segment of a reassembled PDU]"
"286","3.704053","146.75.31.5","192.168.0.92","TCP","1510","443  >  55371 [ACK] Seq=285588 Ack=876 Win=338 Len=1444 TSval=2256605701 TSecr=1528395197 [TCP segment of a reassembled PDU]"
"287","3.704053","146.75.31.5","192.168.0.92","TCP","1510","443  >  55371 [ACK] Seq=287032 Ack=876 Win=338 Len=1444 TSval=2256605701 TSecr=1528395197 [TCP segment of a reassembled PDU]"
"288","3.704054","146.75.31.5","192.168.0.92","TCP","1510","443  >  55371 [ACK] Seq=288476 Ack=876 Win=338 Len=1444 TSval=2256605701 TSecr=1528395197 [TCP segment of a reassembled PDU]"
"289","3.704055","146.75.31.5","192.168.0.92","TCP","1510","443  >  55371 [ACK] Seq=289920 Ack=876 Win=338 Len=1444 TSval=2256605701 TSecr=1528395197 [TCP segment of a reassembled PDU]"
"290","3.704056","146.75.31.5","192.168.0.92","TCP","1510","443  >  55371 [PSH, ACK] Seq=291364 Ack=876 Win=338 Len=1444 TSval=2256605701 TSecr=1528395197 [TCP segment of a reassembled PDU]"
"291","3.704057","146.75.31.5","192.168.0.92","TCP","1510","443  >  55371 [ACK] Seq=292808 Ack=876 Win=338 Len=1444 TSval=2256605701 TSecr=1528395197 [TCP segment of a reassembled PDU]"
"292","3.704057","146.75.31.5","192.168.0.92","TCP","1510","443  >  55371 [ACK] Seq=294252 Ack=876 Win=338 Len=1444 TSval=2256605701 TSecr=1528395197 [TCP segment of a reassembled PDU]"
"293","3.704058","146.75.31.5","192.168.0.92","TLSv1.2","1510","Application Data"
