"No.","Time","Source","Destination","Protocol","Length","Info"
"7","0.322410","162.159.130.234","192.168.0.92","TLSv1.2","282","Application Data"
"8","0.322609","192.168.0.92","162.159.130.234","TCP","66","64024  >  443 [ACK] Seq=1 Ack=217 Win=2048 Len=0 TSval=785853777 TSecr=4164019577"
"25","1.424595","192.168.0.92","162.159.130.232","TLSv1.2","299","Application Data"
"26","1.424824","192.168.0.92","162.159.128.233","TLSv1.2","250","Application Data"
"27","1.425165","192.168.0.92","162.159.128.233","TLSv1.2","130","Application Data"
"30","1.449797","162.159.130.232","192.168.0.92","TCP","66","443  >  64116 [ACK] Seq=1 Ack=234 Win=7 Len=0 TSval=934208919 TSecr=1801705493"
"31","1.449798","162.159.128.233","192.168.0.92","TCP","66","443  >  64115 [ACK] Seq=1 Ack=185 Win=7 Len=0 TSval=1288211170 TSecr=1061865737"
"32","1.449798","162.159.128.233","192.168.0.92","TCP","66","443  >  64115 [ACK] Seq=1 Ack=249 Win=7 Len=0 TSval=1288211170 TSecr=1061865737"
"33","1.499994","162.159.128.233","192.168.0.92","TLSv1.2","552","Application Data"
"34","1.499995","162.159.128.233","192.168.0.92","TLSv1.2","111","Application Data"
"35","1.499996","162.159.128.233","192.168.0.92","TLSv1.2","97","Application Data"
"36","1.500108","192.168.0.92","162.159.128.233","TCP","66","64115  >  443 [ACK] Seq=249 Ack=563 Win=2039 Len=0 TSval=1061865812 TSecr=1288211220"
"37","1.508298","162.159.130.234","192.168.0.92","TLSv1.2","147","Application Data"
"38","1.508485","192.168.0.92","162.159.130.234","TCP","66","64024  >  443 [ACK] Seq=1 Ack=298 Win=2048 Len=0 TSval=785854963 TSecr=4164020818"
"39","1.513294","192.168.0.92","162.159.130.234","TLSv1.2","111","Application Data"
"40","1.550322","162.159.130.234","192.168.0.92","TLSv1.2","111","Application Data"
"41","1.550419","192.168.0.92","162.159.130.234","TCP","66","64024  >  443 [ACK] Seq=46 Ack=343 Win=2047 Len=0 TSval=785855005 TSecr=4164020863"
"42","1.555469","162.159.130.232","192.168.0.92","TLSv1.2","389","Application Data"
"43","1.555558","192.168.0.92","162.159.130.232","TCP","66","64116  >  443 [ACK] Seq=234 Ack=324 Win=22689 Len=0 TSval=1801705624 TSecr=934209026"
"44","1.557436","162.159.130.232","192.168.0.92","TCP","1514","443  >  64116 [ACK] Seq=324 Ack=234 Win=8 Len=1448 TSval=934209026 TSecr=1801705493 [TCP segment of a reassembled PDU]"
"45","1.557437","162.159.130.232","192.168.0.92","TCP","1514","443  >  64116 [ACK] Seq=1772 Ack=234 Win=8 Len=1448 TSval=934209026 TSecr=1801705493 [TCP segment of a reassembled PDU]"
"46","1.557438","162.159.130.232","192.168.0.92","TCP","1514","443  >  64116 [ACK] Seq=3220 Ack=234 Win=8 Len=1448 TSval=934209026 TSecr=1801705493 [TCP segment of a reassembled PDU]"
"47","1.557487","192.168.0.92","162.159.130.232","TCP","66","64116  >  443 [ACK] Seq=234 Ack=4668 Win=22626 Len=0 TSval=1801705626 TSecr=934209026"
"48","1.557574","192.168.0.92","162.159.130.232","TCP","66","[TCP Window Update] 64116  >  443 [ACK] Seq=234 Ack=4668 Win=22694 Len=0 TSval=1801705626 TSecr=934209026"
"49","1.558876","162.159.130.232","192.168.0.92","TCP","1514","443  >  64116 [ACK] Seq=4668 Ack=234 Win=8 Len=1448 TSval=934209026 TSecr=1801705493 [TCP segment of a reassembled PDU]"
"50","1.558877","162.159.130.232","192.168.0.92","TCP","1514","443  >  64116 [ACK] Seq=6116 Ack=234 Win=8 Len=1448 TSval=934209026 TSecr=1801705493 [TCP segment of a reassembled PDU]"
"51","1.558877","162.159.130.232","192.168.0.92","TCP","1514","443  >  64116 [ACK] Seq=7564 Ack=234 Win=8 Len=1448 TSval=934209026 TSecr=1801705493 [TCP segment of a reassembled PDU]"
"52","1.558878","162.159.130.232","192.168.0.92","TCP","1514","443  >  64116 [ACK] Seq=9012 Ack=234 Win=8 Len=1448 TSval=934209026 TSecr=1801705493 [TCP segment of a reassembled PDU]"
"53","1.558879","162.159.130.232","192.168.0.92","TCP","1514","443  >  64116 [ACK] Seq=10460 Ack=234 Win=8 Len=1448 TSval=934209026 TSecr=1801705493 [TCP segment of a reassembled PDU]"
"54","1.558880","162.159.130.232","192.168.0.92","TCP","1514","443  >  64116 [ACK] Seq=11908 Ack=234 Win=8 Len=1448 TSval=934209026 TSecr=1801705493 [TCP segment of a reassembled PDU]"
"55","1.558881","162.159.130.232","192.168.0.92","TCP","1514","443  >  64116 [ACK] Seq=13356 Ack=234 Win=8 Len=1448 TSval=934209026 TSecr=1801705493 [TCP segment of a reassembled PDU]"
"56","1.558881","162.159.130.232","192.168.0.92","TCP","1514","443  >  64116 [ACK] Seq=14804 Ack=234 Win=8 Len=1448 TSval=934209026 TSecr=1801705493 [TCP segment of a reassembled PDU]"
"57","1.558882","162.159.130.232","192.168.0.92","TLSv1.2","544","Application Data"
"58","1.558883","162.159.130.232","192.168.0.92","TCP","1514","443  >  64116 [ACK] Seq=16730 Ack=234 Win=8 Len=1448 TSval=934209027 TSecr=1801705493 [TCP segment of a reassembled PDU]"
"59","1.558883","162.159.130.232","192.168.0.92","TLSv1.2","818","Application Data"
"60","1.558884","162.159.130.232","192.168.0.92","TLSv1.2","97","Application Data"
"61","1.558941","192.168.0.92","162.159.130.232","TCP","66","64116  >  443 [ACK] Seq=234 Ack=18961 Win=22471 Len=0 TSval=1801705627 TSecr=934209027"
"62","1.558994","192.168.0.92","162.159.130.232","TCP","66","[TCP Window Update] 64116  >  443 [ACK] Seq=234 Ack=18961 Win=22694 Len=0 TSval=1801705627 TSecr=934209027"
"63","1.704613","162.159.130.234","192.168.0.92","TLSv1.2","350","Application Data"
"64","1.704820","192.168.0.92","162.159.130.234","TCP","66","64024  >  443 [ACK] Seq=46 Ack=627 Win=2048 Len=0 TSval=785855159 TSecr=4164021015"
"70","3.394621","162.159.130.234","192.168.0.92","TLSv1.2","145","Application Data"
"71","3.394850","192.168.0.92","162.159.130.234","TCP","66","64024  >  443 [ACK] Seq=46 Ack=706 Win=2048 Len=0 TSval=785856849 TSecr=4164022696"
"72","3.913547","192.168.0.92","162.159.128.233","TLSv1.2","232","Application Data"
"73","3.913796","192.168.0.92","162.159.128.233","TLSv1.2","200","Application Data"
"74","3.937703","162.159.128.233","192.168.0.92","TCP","66","443  >  64115 [ACK] Seq=563 Ack=415 Win=7 Len=0 TSval=1288213658 TSecr=1061868226"
"75","3.937704","162.159.128.233","192.168.0.92","TCP","66","443  >  64115 [ACK] Seq=563 Ack=549 Win=7 Len=0 TSval=1288213658 TSecr=1061868226"
"76","4.096375","162.159.130.234","192.168.0.92","TLSv1.2","215","Application Data"
"77","4.096629","192.168.0.92","162.159.130.234","TCP","66","64024  >  443 [ACK] Seq=46 Ack=855 Win=2048 Len=0 TSval=785857551 TSecr=4164023409"
"78","4.124556","162.159.130.234","192.168.0.92","TLSv1.2","272","Application Data"
"79","4.124708","192.168.0.92","162.159.130.234","TCP","66","64024  >  443 [ACK] Seq=46 Ack=1061 Win=2048 Len=0 TSval=785857579 TSecr=4164023432"
"80","4.130057","162.159.128.233","192.168.0.92","TLSv1.2","376","Application Data"
"81","4.130059","162.159.128.233","192.168.0.92","TLSv1.2","460","Application Data"
"82","4.130060","162.159.128.233","192.168.0.92","TLSv1.2","97","Application Data"
"83","4.130167","192.168.0.92","162.159.128.233","TCP","66","64115  >  443 [ACK] Seq=549 Ack=1298 Win=2036 Len=0 TSval=1061868443 TSecr=1288213848"
"85","4.726390","162.159.130.234","192.168.0.92","TLSv1.2","156","Application Data"
"86","4.726529","192.168.0.92","162.159.130.234","TCP","66","64024  >  443 [ACK] Seq=46 Ack=1151 Win=2048 Len=0 TSval=785858181 TSecr=4164023977"
"91","5.012069","192.168.0.92","162.159.135.233","TCP","78","64153  >  443 [SYN] Seq=0 Win=65535 Len=0 MSS=1460 WS=64 TSval=1259126517 TSecr=0 SACK_PERM"
"92","5.030987","162.159.135.233","192.168.0.92","TCP","74","443  >  64153 [SYN, ACK] Seq=0 Ack=1 Win=65160 Len=0 MSS=1400 SACK_PERM TSval=1895257724 TSecr=1259126517 WS=8192"
"93","5.031093","192.168.0.92","162.159.135.233","TCP","66","64153  >  443 [ACK] Seq=1 Ack=1 Win=131840 Len=0 TSval=1259126537 TSecr=1895257724"
"94","5.031360","192.168.0.92","162.159.135.233","TLSv1.3","583","Client Hello (SNI=cdn.discordapp.com)"
"95","5.049913","162.159.135.233","192.168.0.92","TCP","66","443  >  64153 [ACK] Seq=1 Ack=518 Win=57344 Len=0 TSval=1895257748 TSecr=1259126537"
"96","5.049915","162.159.135.233","192.168.0.92","TCP","66","[TCP Dup ACK 95#1] 443  >  64153 [ACK] Seq=1 Ack=518 Win=57344 Len=0 TSval=1895257748 TSecr=1259126537"
"97","5.049916","162.159.135.233","192.168.0.92","TLSv1.3","1514","Server Hello, Change Cipher Spec"
"98","5.049917","162.159.135.233","192.168.0.92","TLSv1.3","1499","Application Data"
"99","5.050017","192.168.0.92","162.159.135.233","TCP","66","64153  >  443 [ACK] Seq=518 Ack=2882 Win=128960 Len=0 TSval=1259126555 TSecr=1895257749"
"100","5.056333","192.168.0.92","162.159.135.233","TLSv1.3","130","Change Cipher Spec, Application Data"
"101","5.058312","192.168.0.92","162.159.135.233","TLSv1.3","791","Application Data"
"102","5.072125","162.159.135.233","192.168.0.92","TLSv1.3","594","Application Data, Application Data"
"103","5.072223","192.168.0.92","162.159.135.233","TCP","66","64153  >  443 [ACK] Seq=1307 Ack=3410 Win=130496 Len=0 TSval=1259126578 TSecr=1895257770"
"104","5.072652","192.168.0.92","162.159.135.233","TLSv1.3","97","Application Data"
"105","5.077163","162.159.135.233","192.168.0.92","TLSv1.3","97","Application Data"
"106","5.077249","192.168.0.92","162.159.135.233","TCP","66","64153  >  443 [ACK] Seq=1338 Ack=3441 Win=131008 Len=0 TSval=1259126583 TSecr=1895257776"
"107","5.124846","192.168.0.92","162.159.128.233","TLSv1.2","233","Application Data"
"108","5.126633","162.159.135.233","192.168.0.92","TCP","66","443  >  64153 [ACK] Seq=3441 Ack=1338 Win=65536 Len=0 TSval=1895257825 TSecr=1259126578"
"109","5.139104","162.159.128.233","192.168.0.92","TCP","66","443  >  64115 [ACK] Seq=1298 Ack=716 Win=7 Len=0 TSval=1288214861 TSecr=1061869437"
"110","5.142539","192.168.0.92","162.159.130.234","TLSv1.2","198","Application Data"
"111","5.144728","162.159.135.233","192.168.0.92","TLSv1.3","859","Application Data"
"112","5.144813","192.168.0.92","162.159.135.233","TCP","66","64153  >  443 [ACK] Seq=1338 Ack=4234 Win=130240 Len=0 TSval=1259126650 TSecr=1895257843"
"113","5.146347","162.159.135.233","192.168.0.92","TLSv1.3","1457","Application Data"
"114","5.146391","192.168.0.92","162.159.135.233","TCP","66","64153  >  443 [ACK] Seq=1338 Ack=5625 Win=129664 Len=0 TSval=1259126652 TSecr=1895257843"
"115","5.147664","162.159.135.233","192.168.0.92","TLSv1.3","1457","Application Data"
"116","5.147665","162.159.135.233","192.168.0.92","TLSv1.3","1457","Application Data"
"117","5.147665","162.159.135.233","192.168.0.92","TLSv1.3","1457","Application Data"
"118","5.147666","162.159.135.233","192.168.0.92","TLSv1.3","120","Application Data"
"119","5.147667","162.159.135.233","192.168.0.92","TLSv1.3","97","Application Data"
"120","5.147697","192.168.0.92","162.159.135.233","TCP","66","64153  >  443 [ACK] Seq=1338 Ack=9883 Win=126784 Len=0 TSval=1259126653 TSecr=1895257843"
"121","5.149253","192.168.0.92","162.159.135.233","TCP","66","[TCP Window Update] 64153  >  443 [ACK] Seq=1338 Ack=9883 Win=131072 Len=0 TSval=1259126655 TSecr=1895257843"
"122","5.153948","162.159.135.233","192.168.0.92","TLSv1.3","578","Application Data"
"123","5.154036","192.168.0.92","162.159.135.233","TCP","66","64153  >  443 [ACK] Seq=1338 Ack=10395 Win=130560 Len=0 TSval=1259126659 TSecr=1895257853"
"124","5.155311","162.159.135.233","192.168.0.92","TLSv1.3","1457","Application Data"
"125","5.155313","162.159.135.233","192.168.0.92","TLSv1.3","1457","Application Data"
"126","5.155338","192.168.0.92","162.159.135.233","TCP","66","64153  >  443 [ACK] Seq=1338 Ack=13177 Win=128256 Len=0 TSval=1259126661 TSecr=1895257853"
"127","5.155419","192.168.0.92","162.159.135.233","TCP","66","[TCP Window Update] 64153  >  443 [ACK] Seq=1338 Ack=13177 Win=131072 Len=0 TSval=1259126661 TSecr=1895257853"
"128","5.156003","162.159.135.233","192.168.0.92","TLSv1.3","1514","Application Data"
"129","5.156004","162.159.135.233","192.168.0.92","TLSv1.3","859","Application Data"
"130","5.156005","162.159.135.233","192.168.0.92","TLSv1.3","97","Application Data"
"131","5.156035","192.168.0.92","162.159.135.233","TCP","66","64153  >  443 [ACK] Seq=1338 Ack=15449 Win=128768 Len=0 TSval=1259126661 TSecr=1895257853"
"132","5.181673","162.159.130.234","192.168.0.92","TLSv1.2","146","Application Data"
"133","5.181794","192.168.0.92","162.159.130.234","TCP","66","64024  >  443 [ACK] Seq=178 Ack=1231 Win=2046 Len=0 TSval=785858636 TSecr=4164024494"
"135","5.293664","192.168.0.92","162.159.130.234","TLSv1.2","142","Application Data"
"136","5.326508","162.159.130.234","192.168.0.92","TLSv1.2","154","Application Data"
"137","5.326606","192.168.0.92","162.159.130.234","TCP","66","64024  >  443 [ACK] Seq=254 Ack=1319 Win=2046 Len=0 TSval=785858781 TSecr=4164024639"
"139","5.347845","192.168.0.92","162.159.128.233","TLSv1.2","313","Application Data"
"140","5.363599","162.159.128.233","192.168.0.92","TCP","66","443  >  64115 [ACK] Seq=1298 Ack=963 Win=7 Len=0 TSval=1288215084 TSecr=1061869660"
"141","5.380161","162.159.128.233","192.168.0.92","TLSv1.2","537","Application Data"
"142","5.380163","162.159.128.233","192.168.0.92","TLSv1.2","99","Application Data"
"143","5.380163","162.159.128.233","192.168.0.92","TLSv1.2","1457","Application Data"
"144","5.380165","162.159.128.233","192.168.0.92","TLSv1.2","1514","Application Data"
"145","5.380263","192.168.0.92","162.159.128.233","TCP","66","64115  >  443 [ACK] Seq=963 Ack=4641 Win=1995 Len=0 TSval=1061869693 TSecr=1288215102"
"146","5.381289","162.159.128.233","192.168.0.92","TLSv1.2","780","Application Data"
"147","5.381291","162.159.128.233","192.168.0.92","TLSv1.2","129","Application Data, Application Data"
"148","5.381385","192.168.0.92","162.159.128.233","TCP","66","64115  >  443 [ACK] Seq=963 Ack=5418 Win=1983 Len=0 TSval=1061869694 TSecr=1288215102"
"149","5.382643","192.168.0.92","162.159.128.233","TCP","66","[TCP Window Update] 64115  >  443 [ACK] Seq=963 Ack=5418 Win=2048 Len=0 TSval=1061869695 TSecr=1288215102"
"150","5.425869","192.168.0.92","162.159.128.233","TLSv1.2","231","Application Data"
"151","5.447278","192.168.0.92","162.159.128.233","TLSv1.2","161","Application Data"
"152","5.466787","162.159.128.233","192.168.0.92","TCP","66","443  >  64115 [ACK] Seq=5418 Ack=1223 Win=8 Len=0 TSval=1288215188 TSecr=1061869738"
"153","5.481870","162.159.128.233","192.168.0.92","TLSv1.2","407","Application Data"
"154","5.481871","162.159.128.233","192.168.0.92","TLSv1.2","99","Application Data"
"155","5.481871","162.159.128.233","192.168.0.92","TCP","1514","443  >  64115 [ACK] Seq=5792 Ack=1223 Win=8 Len=1448 TSval=1288215204 TSecr=1061869738 [TCP segment of a reassembled PDU]"
"156","5.481964","192.168.0.92","162.159.128.233","TCP","66","64115  >  443 [ACK] Seq=1223 Ack=7240 Win=2019 Len=0 TSval=1061869794 TSecr=1288215204"
"157","5.483880","162.159.128.233","192.168.0.92","TCP","1514","443  >  64115 [ACK] Seq=7240 Ack=1223 Win=8 Len=1448 TSval=1288215204 TSecr=1061869738 [TCP segment of a reassembled PDU]"
"158","5.483880","162.159.128.233","192.168.0.92","TLSv1.2","1421","Application Data"
"159","5.483881","162.159.128.233","192.168.0.92","TLSv1.2","814","Application Data"
"160","5.483882","162.159.128.233","192.168.0.92","TLSv1.2","129","Application Data, Application Data"
"161","5.483908","192.168.0.92","162.159.128.233","TCP","66","64115  >  443 [ACK] Seq=1223 Ack=10854 Win=1991 Len=0 TSval=1061869796 TSecr=1288215204"
"162","5.483997","192.168.0.92","162.159.128.233","TCP","66","[TCP Window Update] 64115  >  443 [ACK] Seq=1223 Ack=10854 Win=2048 Len=0 TSval=1061869796 TSecr=1288215204"
"163","5.496429","162.159.128.233","192.168.0.92","TLSv1.2","330","Application Data"
"164","5.496510","192.168.0.92","162.159.128.233","TCP","66","64115  >  443 [ACK] Seq=1223 Ack=11118 Win=2043 Len=0 TSval=1061869809 TSecr=1288215218"
"165","5.499538","162.159.128.233","192.168.0.92","TCP","1514","443  >  64115 [ACK] Seq=11118 Ack=1223 Win=8 Len=1448 TSval=1288215218 TSecr=1061869738 [TCP segment of a reassembled PDU]"
"166","5.499539","162.159.128.233","192.168.0.92","TCP","1514","443  >  64115 [ACK] Seq=12566 Ack=1223 Win=8 Len=1448 TSval=1288215218 TSecr=1061869738 [TCP segment of a reassembled PDU]"
"167","5.499540","162.159.128.233","192.168.0.92","TLSv1.2","1421","Application Data"
"168","5.499540","162.159.128.233","192.168.0.92","TCP","1514","443  >  64115 [ACK] Seq=15369 Ack=1223 Win=8 Len=1448 TSval=1288215218 TSecr=1061869738 [TCP segment of a reassembled PDU]"
"169","5.499541","162.159.128.233","192.168.0.92","TLSv1.2","191","Application Data"
"170","5.499542","162.159.128.233","192.168.0.92","TCP","1514","443  >  64115 [ACK] Seq=16942 Ack=1223 Win=8 Len=1448 TSval=1288215221 TSecr=1061869796 [TCP segment of a reassembled PDU]"
"171","5.499542","162.159.128.233","192.168.0.92","TCP","1514","443  >  64115 [ACK] Seq=18390 Ack=1223 Win=8 Len=1448 TSval=1288215221 TSecr=1061869796 [TCP segment of a reassembled PDU]"
"172","5.499543","162.159.128.233","192.168.0.92","TLSv1.2","1421","Application Data"
"173","5.499614","192.168.0.92","162.159.128.233","TCP","66","64115  >  443 [ACK] Seq=1223 Ack=21193 Win=1890 Len=0 TSval=1061869812 TSecr=1288215221"
"174","5.499726","192.168.0.92","162.159.128.233","TCP","66","[TCP Window Update] 64115  >  443 [ACK] Seq=1223 Ack=21193 Win=2048 Len=0 TSval=1061869812 TSecr=1288215221"
"175","5.502942","162.159.128.233","192.168.0.92","TCP","1514","443  >  64115 [ACK] Seq=21193 Ack=1223 Win=8 Len=1448 TSval=1288215221 TSecr=1061869796 [TCP segment of a reassembled PDU]"
"176","5.502943","162.159.128.233","192.168.0.92","TCP","1514","443  >  64115 [ACK] Seq=22641 Ack=1223 Win=8 Len=1448 TSval=1288215221 TSecr=1061869796 [TCP segment of a reassembled PDU]"
"177","5.502944","162.159.128.233","192.168.0.92","TLSv1.2","1154","Application Data"
"178","5.502945","162.159.128.233","192.168.0.92","TCP","1514","443  >  64115 [ACK] Seq=25177 Ack=1223 Win=8 Len=1448 TSval=1288215222 TSecr=1061869796 [TCP segment of a reassembled PDU]"
"179","5.502946","162.159.128.233","192.168.0.92","TLSv1.2","159","Application Data"
"180","5.502946","162.159.128.233","192.168.0.92","TLSv1.2","98","Application Data"
"181","5.502947","162.159.128.233","192.168.0.92","TLSv1.2","97","Application Data"
"182","5.503037","192.168.0.92","162.159.128.233","TCP","66","64115  >  443 [ACK] Seq=1223 Ack=26781 Win=1960 Len=0 TSval=1061869815 TSecr=1288215222"
"183","5.503150","192.168.0.92","162.159.128.233","TCP","66","[TCP Window Update] 64115  >  443 [ACK] Seq=1223 Ack=26781 Win=2048 Len=0 TSval=1061869815 TSecr=1288215222"
"184","5.557765","192.168.0.92","162.159.135.233","TLSv1.3","292","Application Data"
"185","5.561526","192.168.0.92","162.159.135.233","TLSv1.3","169","Application Data"
"186","5.565623","192.168.0.92","162.159.135.233","TLSv1.3","193","Application Data"
"187","5.569949","192.168.0.92","162.159.135.233","TLSv1.3","169","Application Data"
"188","5.571870","162.159.135.233","192.168.0.92","TCP","66","443  >  64153 [ACK] Seq=15449 Ack=1564 Win=57344 Len=0 TSval=1895258272 TSecr=1259127063"
"189","5.579191","162.159.135.233","192.168.0.92","TCP","66","443  >  64153 [ACK] Seq=15449 Ack=1667 Win=57344 Len=0 TSval=1895258278 TSecr=1259127067"
"190","5.579192","162.159.135.233","192.168.0.92","TCP","66","443  >  64153 [ACK] Seq=15449 Ack=1794 Win=57344 Len=0 TSval=1895258280 TSecr=1259127071"
"191","5.579193","162.159.135.233","192.168.0.92","TCP","66","443  >  64153 [ACK] Seq=15449 Ack=1897 Win=57344 Len=0 TSval=1895258280 TSecr=1259127075"
"192","5.582220","162.159.128.233","192.168.0.92","TLSv1.2","331","Application Data"
"193","5.582221","162.159.128.233","192.168.0.92","TLSv1.2","193","Application Data, Application Data"
"194","5.582309","192.168.0.92","162.159.128.233","TCP","66","64115  >  443 [ACK] Seq=1223 Ack=27173 Win=2041 Len=0 TSval=1061869895 TSecr=1288215304"
"195","5.601726","192.168.0.92","162.159.135.233","TLSv1.3","169","Application Data"
"196","5.605140","192.168.0.92","162.159.135.233","TLSv1.3","169","Application Data"
"197","5.609978","192.168.0.92","162.159.135.233","TLSv1.3","192","Application Data"
"198","5.613077","192.168.0.92","162.159.135.233","TLSv1.3","170","Application Data"
"199","5.616556","162.159.135.233","192.168.0.92","TCP","66","443  >  64153 [ACK] Seq=15449 Ack=2000 Win=57344 Len=0 TSval=1895258316 TSecr=1259127107"
"200","5.616558","162.159.135.233","192.168.0.92","TCP","66","443  >  64153 [ACK] Seq=15449 Ack=2103 Win=57344 Len=0 TSval=1895258316 TSecr=1259127111"
"201","5.617314","192.168.0.92","162.159.135.233","TLSv1.3","169","Application Data"
"202","5.621189","162.159.135.233","192.168.0.92","TCP","66","443  >  64153 [ACK] Seq=15449 Ack=2229 Win=57344 Len=0 TSval=1895258320 TSecr=1259127115"
"203","5.621465","192.168.0.92","162.159.135.233","TLSv1.3","193","Application Data"
"204","5.625324","192.168.0.92","162.159.135.233","TLSv1.3","194","Application Data"
"205","5.626876","162.159.135.233","192.168.0.92","TCP","66","443  >  64153 [ACK] Seq=15449 Ack=2333 Win=57344 Len=0 TSval=1895258326 TSecr=1259127119"
"206","5.626877","162.159.135.233","192.168.0.92","TCP","66","443  >  64153 [ACK] Seq=15449 Ack=2436 Win=57344 Len=0 TSval=1895258326 TSecr=1259127122"
"207","5.628942","192.168.0.92","162.159.135.233","TLSv1.3","169","Application Data"
"208","5.631303","162.159.135.233","192.168.0.92","TLSv1.3","432","Application Data"
"209","5.631372","192.168.0.92","162.159.135.233","TCP","66","64153  >  443 [ACK] Seq=2794 Ack=15815 Win=130688 Len=0 TSval=1259127137 TSecr=1895258331"
"210","5.633010","162.159.135.233","192.168.0.92","TLSv1.3","1457","Application Data"
"211","5.633011","162.159.135.233","192.168.0.92","TLSv1.3","1457","Application Data"
"212","5.633012","162.159.135.233","192.168.0.92","TLSv1.3","1514","Application Data"
"213","5.633013","162.159.135.233","192.168.0.92","TLSv1.3","1400","Application Data"
"214","5.633013","162.159.135.233","192.168.0.92","TLSv1.3","1514","Application Data"
"215","5.633014","162.159.135.233","192.168.0.92","TLSv1.3","1514","Application Data"
"216","5.633015","162.159.135.233","192.168.0.92","TLSv1.3","1343","Application Data"
"217","5.633016","162.159.135.233","192.168.0.92","TLSv1.3","1514","Application Data"
"218","5.633017","162.159.135.233","192.168.0.92","TLSv1.3","1400","Application Data"
"219","5.633017","162.159.135.233","192.168.0.92","TLSv1.3","1514","Application Data"
"220","5.633018","162.159.135.233","192.168.0.92","TLSv1.3","1514","Application Data"
"221","5.633019","162.159.135.233","192.168.0.92","TLSv1.3","1514","Application Data"
"222","5.633019","162.159.135.233","192.168.0.92","TLSv1.3","1514","Application Data"
"223","5.633020","162.159.135.233","192.168.0.92","TLSv1.3","1514","Application Data"
"224","5.633021","162.159.135.233","192.168.0.92","TLSv1.3","1172","Application Data"
"225","5.633022","162.159.135.233","192.168.0.92","TLSv1.3","1514","Application Data"
"226","5.633022","162.159.135.233","192.168.0.92","TLSv1.3","1514","Application Data"
"227","5.633023","162.159.135.233","192.168.0.92","TLSv1.3","1514","Application Data"
"228","5.633024","162.159.135.233","192.168.0.92","TLSv1.3","1514","Application Data"
"229","5.633024","162.159.135.233","192.168.0.92","TLSv1.3","1514","Application Data"
"230","5.633025","162.159.135.233","192.168.0.92","TLSv1.3","1514","Application Data"
"231","5.633026","162.159.135.233","192.168.0.92","TLSv1.3","1514","Application Data"
"232","5.633026","162.159.135.233","192.168.0.92","TLSv1.3","1421","Application Data, Application Data"
"233","5.633027","162.159.135.233","192.168.0.92","TLSv1.3","1514","Application Data"
"234","5.633028","162.159.135.233","192.168.0.92","TCP","1514","443  >  64153 [ACK] Seq=49619 Ack=2436 Win=65536 Len=1448 TSval=1895258332 TSecr=1259127122 [TCP segment of a reassembled PDU]"
"235","5.633028","162.159.135.233","192.168.0.92","TCP","1514","443  >  64153 [ACK] Seq=51067 Ack=2436 Win=65536 Len=1448 TSval=1895258332 TSecr=1259127122 [TCP segment of a reassembled PDU]"
"236","5.633029","162.159.135.233","192.168.0.92","TLSv1.3","1514","Application Data"
"237","5.633030","162.159.135.233","192.168.0.92","TCP","1514","443  >  64153 [ACK] Seq=53963 Ack=2436 Win=65536 Len=1448 TSval=1895258332 TSecr=1259127122 [TCP segment of a reassembled PDU]"
"238","5.633031","162.159.135.233","192.168.0.92","TCP","1514","443  >  64153 [ACK] Seq=55411 Ack=2436 Win=65536 Len=1448 TSval=1895258332 TSecr=1259127122 [TCP segment of a reassembled PDU]"
"239","5.633031","162.159.135.233","192.168.0.92","TLSv1.3","1514","Application Data"
"240","5.633032","162.159.135.233","192.168.0.92","TCP","1514","443  >  64153 [ACK] Seq=58307 Ack=2436 Win=65536 Len=1448 TSval=1895258332 TSecr=1259127122 [TCP segment of a reassembled PDU]"
"241","5.633033","162.159.135.233","192.168.0.92","TCP","1514","443  >  64153 [ACK] Seq=59755 Ack=2436 Win=65536 Len=1448 TSval=1895258332 TSecr=1259127122 [TCP segment of a reassembled PDU]"
"242","5.633033","162.159.135.233","192.168.0.92","TLSv1.3","1514","Application Data"
"243","5.633034","162.159.135.233","192.168.0.92","TCP","1514","443  >  64153 [ACK] Seq=62651 Ack=2436 Win=65536 Len=1448 TSval=1895258332 TSecr=1259127122 [TCP segment of a reassembled PDU]"
"244","5.633035","162.159.135.233","192.168.0.92","TCP","1514","443  >  64153 [ACK] Seq=64099 Ack=2436 Win=65536 Len=1448 TSval=1895258332 TSecr=1259127122 [TCP segment of a reassembled PDU]"
"245","5.633036","162.159.135.233","192.168.0.92","TLSv1.3","1514","Application Data"
"246","5.633036","162.159.135.233","192.168.0.92","TCP","1514","443  >  64153 [ACK] Seq=66995 Ack=2436 Win=65536 Len=1448 TSval=1895258332 TSecr=1259127122 [TCP segment of a reassembled PDU]"
"247","5.633037","162.159.135.233","192.168.0.92","TCP","1514","443  >  64153 [ACK] Seq=68443 Ack=2436 Win=65536 Len=1448 TSval=1895258332 TSecr=1259127122 [TCP segment of a reassembled PDU]"
"248","5.633038","162.159.135.233","192.168.0.92","TLSv1.3","1514","Application Data"
"249","5.633039","162.159.135.233","192.168.0.92","TCP","1514","443  >  64153 [ACK] Seq=71339 Ack=2436 Win=65536 Len=1448 TSval=1895258332 TSecr=1259127122 [TCP segment of a reassembled PDU]"
"250","5.633039","162.159.135.233","192.168.0.92","TCP","1514","443  >  64153 [ACK] Seq=72787 Ack=2436 Win=65536 Len=1448 TSval=1895258332 TSecr=1259127122 [TCP segment of a reassembled PDU]"
"251","5.633040","162.159.135.233","192.168.0.92","TLSv1.3","899","Application Data"
"252","5.633040","162.159.135.233","192.168.0.92","TCP","1514","443  >  64153 [ACK] Seq=75068 Ack=2436 Win=65536 Len=1448 TSval=1895258332 TSecr=1259127122 [TCP segment of a reassembled PDU]"
"253","5.633041","162.159.135.233","192.168.0.92","TCP","1514","443  >  64153 [ACK] Seq=76516 Ack=2436 Win=65536 Len=1448 TSval=1895258332 TSecr=1259127122 [TCP segment of a reassembled PDU]"
"254","5.633042","162.159.135.233","192.168.0.92","TLSv1.3","1514","Application Data"
"255","5.633139","192.168.0.92","162.159.135.233","TCP","66","64153  >  443 [ACK] Seq=2794 Ack=31230 Win=115648 Len=0 TSval=1259127139 TSecr=1895258331"
"256","5.633162","192.168.0.92","162.159.135.233","TCP","66","64153  >  443 [ACK] Seq=2794 Ack=46816 Win=100032 Len=0 TSval=1259127139 TSecr=1895258331"
"257","5.633173","192.168.0.92","162.159.135.233","TCP","66","64153  >  443 [ACK] Seq=2794 Ack=61203 Win=85632 Len=0 TSval=1259127139 TSecr=1895258332"
"258","5.633184","192.168.0.92","162.159.135.233","TCP","66","64153  >  443 [ACK] Seq=2794 Ack=76516 Win=70336 Len=0 TSval=1259127139 TSecr=1895258332"
"259","5.633193","192.168.0.92","162.159.135.233","TCP","66","64153  >  443 [ACK] Seq=2794 Ack=79412 Win=67456 Len=0 TSval=1259127139 TSecr=1895258332"
"260","5.633437","192.168.0.92","162.159.135.233","TLSv1.3","169","Application Data"
"261","5.633481","192.168.0.92","162.159.135.233","TCP","66","[TCP Window Update] 64153  >  443 [ACK] Seq=2897 Ack=79412 Win=131072 Len=0 TSval=1259127139 TSecr=1895258332"
"262","5.635177","162.159.135.233","192.168.0.92","TCP","1514","443  >  64153 [ACK] Seq=79412 Ack=2436 Win=65536 Len=1448 TSval=1895258332 TSecr=1259127122 [TCP segment of a reassembled PDU]"
"263","5.635178","162.159.135.233","192.168.0.92","TLSv1.3","1514","Application Data"
"264","5.635178","162.159.135.233","192.168.0.92","TCP","1514","443  >  64153 [ACK] Seq=82308 Ack=2436 Win=65536 Len=1448 TSval=1895258332 TSecr=1259127122 [TCP segment of a reassembled PDU]"
"265","5.635179","162.159.135.233","192.168.0.92","TCP","1514","443  >  64153 [ACK] Seq=83756 Ack=2436 Win=65536 Len=1448 TSval=1895258332 TSecr=1259127122 [TCP segment of a reassembled PDU]"
"266","5.635180","162.159.135.233","192.168.0.92","TLSv1.3","1514","Application Data"
"267","5.635181","162.159.135.233","192.168.0.92","TCP","1514","443  >  64153 [ACK] Seq=86652 Ack=2436 Win=65536 Len=1448 TSval=1895258332 TSecr=1259127122 [TCP segment of a reassembled PDU]"
"268","5.635182","162.159.135.233","192.168.0.92","TCP","1514","443  >  64153 [ACK] Seq=88100 Ack=2436 Win=65536 Len=1448 TSval=1895258332 TSecr=1259127122 [TCP segment of a reassembled PDU]"
"269","5.635182","162.159.135.233","192.168.0.92","TLSv1.3","1514","Application Data"
"270","5.635183","162.159.135.233","192.168.0.92","TCP","1514","443  >  64153 [ACK] Seq=90996 Ack=2436 Win=65536 Len=1448 TSval=1895258332 TSecr=1259127122 [TCP segment of a reassembled PDU]"
"271","5.635183","162.159.135.233","192.168.0.92","TCP","1514","443  >  64153 [ACK] Seq=92444 Ack=2436 Win=65536 Len=1448 TSval=1895258332 TSecr=1259127122 [TCP segment of a reassembled PDU]"
"272","5.635184","162.159.135.233","192.168.0.92","TLSv1.3","1514","Application Data"
"273","5.635185","162.159.135.233","192.168.0.92","TCP","1514","443  >  64153 [ACK] Seq=95340 Ack=2436 Win=65536 Len=1448 TSval=1895258332 TSecr=1259127122 [TCP segment of a reassembled PDU]"
"274","5.635186","162.159.135.233","192.168.0.92","TLSv1.3","1514","Application Data"
"275","5.635186","162.159.135.233","192.168.0.92","TCP","1514","443  >  64153 [ACK] Seq=98236 Ack=2436 Win=65536 Len=1448 TSval=1895258332 TSecr=1259127122 [TCP segment of a reassembled PDU]"
"276","5.635187","162.159.135.233","192.168.0.92","TCP","1514","443  >  64153 [ACK] Seq=99684 Ack=2436 Win=65536 Len=1448 TSval=1895258332 TSecr=1259127122 [TCP segment of a reassembled PDU]"
"277","5.635188","162.159.135.233","192.168.0.92","TLSv1.3","1514","Application Data"
"278","5.635188","162.159.135.233","192.168.0.92","TCP","1514","443  >  64153 [ACK] Seq=102580 Ack=2436 Win=65536 Len=1448 TSval=1895258332 TSecr=1259127122 [TCP segment of a reassembled PDU]"
"279","5.635189","162.159.135.233","192.168.0.92","TCP","1514","443  >  64153 [ACK] Seq=104028 Ack=2436 Win=65536 Len=1448 TSval=1895258332 TSecr=1259127122 [TCP segment of a reassembled PDU]"
"280","5.635190","162.159.135.233","192.168.0.92","TLSv1.3","1514","Application Data"
"281","5.635190","162.159.135.233","192.168.0.92","TCP","1514","443  >  64153 [ACK] Seq=106924 Ack=2436 Win=65536 Len=1448 TSval=1895258332 TSecr=1259127122 [TCP segment of a reassembled PDU]"
"282","5.635191","162.159.135.233","192.168.0.92","TCP","1514","443  >  64153 [ACK] Seq=108372 Ack=2436 Win=65536 Len=1448 TSval=1895258332 TSecr=1259127122 [TCP segment of a reassembled PDU]"
"283","5.635192","162.159.135.233","192.168.0.92","TLSv1.3","1176","Application Data"
"284","5.635193","162.159.135.233","192.168.0.92","TCP","1514","443  >  64153 [ACK] Seq=110930 Ack=2436 Win=65536 Len=1448 TSval=1895258333 TSecr=1259127122 [TCP segment of a reassembled PDU]"
"285","5.635193","162.159.135.233","192.168.0.92","TCP","1514","443  >  64153 [ACK] Seq=112378 Ack=2436 Win=65536 Len=1448 TSval=1895258333 TSecr=1259127122 [TCP segment of a reassembled PDU]"
"286","5.635194","162.159.135.233","192.168.0.92","TLSv1.3","1514","Application Data"
"287","5.635195","162.159.135.233","192.168.0.92","TCP","1514","443  >  64153 [ACK] Seq=115274 Ack=2436 Win=65536 Len=1448 TSval=1895258333 TSecr=1259127122 [TCP segment of a reassembled PDU]"
"288","5.635196","162.159.135.233","192.168.0.92","TCP","1514","443  >  64153 [ACK] Seq=116722 Ack=2436 Win=65536 Len=1448 TSval=1895258333 TSecr=1259127122 [TCP segment of a reassembled PDU]"
"289","5.635196","162.159.135.233","192.168.0.92","TLSv1.3","1514","Application Data"
"290","5.635197","162.159.135.233","192.168.0.92","TCP","1514","443  >  64153 [ACK] Seq=119618 Ack=2436 Win=65536 Len=1448 TSval=1895258333 TSecr=1259127122 [TCP segment of a reassembled PDU]"
"291","5.635198","162.159.135.233","192.168.0.92","TLSv1.3","948","Application Data, Application Data"
"292","5.635243","192.168.0.92","162.159.135.233","TCP","66","64153  >  443 [ACK] Seq=2897 Ack=95340 Win=115136 Len=0 TSval=1259127141 TSecr=1895258332"
"293","5.635252","192.168.0.92","162.159.135.233","TCP","66","64153  >  443 [ACK] Seq=2897 Ack=110930 Win=99520 Len=0 TSval=1259127141 TSecr=1895258332"
"294","5.635259","192.168.0.92","162.159.135.233","TCP","66","64153  >  443 [ACK] Seq=2897 Ack=121948 Win=88512 Len=0 TSval=1259127141 TSecr=1895258333"
"295","5.635286","192.168.0.92","162.159.135.233","TCP","66","[TCP Window Update] 64153  >  443 [ACK] Seq=2897 Ack=121948 Win=131072 Len=0 TSval=1259127141 TSecr=1895258333"
"296","5.636850","192.168.0.92","162.159.135.233","TLSv1.3","169","Application Data"
"297","5.641015","162.159.135.233","192.168.0.92","TCP","66","443  >  64153 [ACK] Seq=121948 Ack=2794 Win=65536 Len=0 TSval=1895258340 TSecr=1259127127"
"298","5.641016","162.159.135.233","192.168.0.92","TLSv1.3","379","Application Data"
"299","5.641098","192.168.0.92","162.159.135.233","TCP","66","64153  >  443 [ACK] Seq=3000 Ack=122261 Win=130752 Len=0 TSval=1259127147 TSecr=1895258341"
"300","5.641448","192.168.0.92","162.159.128.233","TLSv1.2","156","Application Data"
"301","5.645084","192.168.0.92","162.159.135.233","TLSv1.3","169","Application Data"
"302","5.648750","162.159.135.233","192.168.0.92","TCP","1514","443  >  64153 [ACK] Seq=122261 Ack=2794 Win=65536 Len=1448 TSval=1895258348 TSecr=1259127139 [TCP segment of a reassembled PDU]"
"303","5.648751","162.159.135.233","192.168.0.92","TCP","1514","443  >  64153 [ACK] Seq=123709 Ack=2794 Win=65536 Len=1448 TSval=1895258348 TSecr=1259127139 [TCP segment of a reassembled PDU]"
"304","5.648752","162.159.135.233","192.168.0.92","TLSv1.3","1514","Application Data"
"305","5.648753","162.159.135.233","192.168.0.92","TLSv1.3","1273","Application Data, Application Data"
"306","5.648832","192.168.0.92","162.159.135.233","TCP","66","64153  >  443 [ACK] Seq=3103 Ack=127812 Win=441984 Len=0 TSval=1259127154 TSecr=1895258348"
"307","5.649344","192.168.0.92","162.159.135.233","TLSv1.3","169","Application Data"
"308","5.649386","192.168.0.92","162.159.135.233","TCP","66","[TCP Window Update] 64153  >  443 [ACK] Seq=3206 Ack=127812 Win=447488 Len=0 TSval=1259127154 TSecr=1895258348"
"309","5.650454","162.159.135.233","192.168.0.92","TLSv1.3","381","Application Data"
"310","5.650503","192.168.0.92","162.159.135.233","TCP","66","64153  >  443 [ACK] Seq=3206 Ack=128127 Win=447168 Len=0 TSval=1259127156 TSecr=1895258350"
"311","5.652405","162.159.135.233","192.168.0.92","TCP","1514","443  >  64153 [ACK] Seq=128127 Ack=2897 Win=65536 Len=1448 TSval=1895258350 TSecr=1259127139 [TCP segment of a reassembled PDU]"
"312","5.652406","162.159.135.233","192.168.0.92","TCP","1514","443  >  64153 [ACK] Seq=129575 Ack=2897 Win=65536 Len=1448 TSval=1895258350 TSecr=1259127139 [TCP segment of a reassembled PDU]"
"313","5.652407","162.159.135.233","192.168.0.92","TLSv1.3","689","Application Data"
"314","5.652407","162.159.135.233","192.168.0.92","TLSv1.3","147","Application Data"
"315","5.652408","162.159.135.233","192.168.0.92","TLSv1.3","97","Application Data"
"316","5.652434","192.168.0.92","162.159.135.233","TCP","66","64153  >  443 [ACK] Seq=3206 Ack=131758 Win=443904 Len=0 TSval=1259127158 TSecr=1895258350"
"317","5.652613","192.168.0.92","162.159.135.233","TLSv1.3","170","Application Data"
"318","5.652644","192.168.0.92","162.159.135.233","TCP","66","[TCP Window Update] 64153  >  443 [ACK] Seq=3310 Ack=131758 Win=447488 Len=0 TSval=1259127158 TSecr=1895258350"
"319","5.657004","192.168.0.92","162.159.135.233","TLSv1.3","169","Application Data"
"320","5.660404","162.159.135.233","192.168.0.92","TCP","66","443  >  64153 [ACK] Seq=131758 Ack=3103 Win=65536 Len=0 TSval=1895258360 TSecr=1259127142"
"321","5.665012","162.159.135.233","192.168.0.92","TCP","66","443  >  64153 [ACK] Seq=131758 Ack=3310 Win=65536 Len=0 TSval=1895258364 TSecr=1259127142"
"322","5.670346","162.159.135.233","192.168.0.92","TLSv1.3","419","Application Data"
"323","5.670439","192.168.0.92","162.159.135.233","TCP","66","64153  >  443 [ACK] Seq=3413 Ack=132111 Win=447168 Len=0 TSval=1259127176 TSecr=1895258368"
"324","5.672928","162.159.135.233","192.168.0.92","TCP","1514","443  >  64153 [ACK] Seq=132111 Ack=3413 Win=65536 Len=1448 TSval=1895258368 TSecr=1259127162 [TCP segment of a reassembled PDU]"
"325","5.672930","162.159.135.233","192.168.0.92","TCP","1514","443  >  64153 [ACK] Seq=133559 Ack=3413 Win=65536 Len=1448 TSval=1895258368 TSecr=1259127162 [TCP segment of a reassembled PDU]"
"326","5.672930","162.159.135.233","192.168.0.92","TLSv1.3","1421","Application Data"
"327","5.672931","162.159.135.233","192.168.0.92","TCP","1514","443  >  64153 [ACK] Seq=136362 Ack=3413 Win=65536 Len=1448 TSval=1895258368 TSecr=1259127162 [TCP segment of a reassembled PDU]"
"328","5.672932","162.159.135.233","192.168.0.92","TCP","1514","443  >  64153 [ACK] Seq=137810 Ack=3413 Win=65536 Len=1448 TSval=1895258368 TSecr=1259127162 [TCP segment of a reassembled PDU]"
"329","5.672933","162.159.135.233","192.168.0.92","TLSv1.3","1514","Application Data"
"330","5.672934","162.159.135.233","192.168.0.92","TCP","1514","443  >  64153 [ACK] Seq=140706 Ack=3413 Win=65536 Len=1448 TSval=1895258368 TSecr=1259127162 [TCP segment of a reassembled PDU]"
"331","5.672935","162.159.135.233","192.168.0.92","TCP","1514","443  >  64153 [ACK] Seq=142154 Ack=3413 Win=65536 Len=1448 TSval=1895258368 TSecr=1259127162 [TCP segment of a reassembled PDU]"
"332","5.672935","162.159.135.233","192.168.0.92","TLSv1.3","1328","Application Data"
"333","5.672936","162.159.135.233","192.168.0.92","TCP","1514","443  >  64153 [ACK] Seq=144864 Ack=3413 Win=65536 Len=1448 TSval=1895258368 TSecr=1259127162 [TCP segment of a reassembled PDU]"
"334","5.672937","162.159.135.233","192.168.0.92","TCP","1514","443  >  64153 [ACK] Seq=146312 Ack=3413 Win=65536 Len=1448 TSval=1895258368 TSecr=1259127162 [TCP segment of a reassembled PDU]"
"335","5.672938","162.159.135.233","192.168.0.92","TLSv1.3","1514","Application Data"
"336","5.672939","162.159.135.233","192.168.0.92","TCP","1514","443  >  64153 [ACK] Seq=149208 Ack=3413 Win=65536 Len=1448 TSval=1895258368 TSecr=1259127162 [TCP segment of a reassembled PDU]"
"337","5.672939","162.159.135.233","192.168.0.92","TCP","1514","443  >  64153 [ACK] Seq=150656 Ack=3413 Win=65536 Len=1448 TSval=1895258368 TSecr=1259127162 [TCP segment of a reassembled PDU]"
"338","5.672940","162.159.135.233","192.168.0.92","TLSv1.3","1514","Application Data"
"339","5.672941","162.159.135.233","192.168.0.92","TCP","1514","443  >  64153 [ACK] Seq=153552 Ack=3413 Win=65536 Len=1448 TSval=1895258368 TSecr=1259127162 [TCP segment of a reassembled PDU]"
"340","5.672942","162.159.135.233","192.168.0.92","TCP","1514","443  >  64153 [ACK] Seq=155000 Ack=3413 Win=65536 Len=1448 TSval=1895258368 TSecr=1259127162 [TCP segment of a reassembled PDU]"
"341","5.672943","162.159.135.233","192.168.0.92","TLSv1.3","1514","Application Data"
"342","5.672944","162.159.135.233","192.168.0.92","TCP","1514","443  >  64153 [ACK] Seq=157896 Ack=3413 Win=65536 Len=1448 TSval=1895258368 TSecr=1259127162 [TCP segment of a reassembled PDU]"
"343","5.672944","162.159.135.233","192.168.0.92","TCP","1514","443  >  64153 [ACK] Seq=159344 Ack=3413 Win=65536 Len=1448 TSval=1895258368 TSecr=1259127162 [TCP segment of a reassembled PDU]"
"344","5.672945","162.159.135.233","192.168.0.92","TLSv1.3","893","Application Data"
