"No.","Time","Source","Destination","Protocol","Length","Info"
"1","0.000000","192.168.0.200","162.159.128.232","TCP","55","64611  >  443 [ACK] Seq=1 Ack=1 Win=1028 Len=1 [TCP segment of a reassembled PDU]"
"2","0.011650","162.159.128.232","192.168.0.200","TCP","66","443  >  64611 [ACK] Seq=1 Ack=2 Win=8 Len=0 SLE=1 SRE=2"
"3","2.063298","192.168.0.200","162.159.128.232","TLSv1.2","256","Ignored Unknown Record"
"4","2.063309","192.168.0.200","162.159.128.232","TLSv1.2","93","Application Data"
"5","2.078550","162.159.128.232","192.168.0.200","TCP","60","443  >  64611 [ACK] Seq=1 Ack=204 Win=7 Len=0"
"6","2.078550","162.159.128.232","192.168.0.200","TCP","60","443  >  64611 [ACK] Seq=1 Ack=243 Win=7 Len=0"
"7","2.078550","162.159.128.232","192.168.0.200","TLSv1.2","93","Application Data"
"8","2.125240","192.168.0.200","162.159.128.232","TCP","54","64611  >  443 [ACK] Seq=243 Ack=40 Win=1027 Len=0"
"9","4.492766","162.159.128.232","192.168.0.200","TLSv1.2","384","Application Data"
"10","4.492801","162.159.128.232","192.168.0.200","TCP","1514","443  >  64611 [ACK] Seq=370 Ack=243 Win=8 Len=1460 [TCP segment of a reassembled PDU]"
"11","4.492876","192.168.0.200","162.159.128.232","TCP","54","64611  >  443 [ACK] Seq=243 Ack=1830 Win=1028 Len=0"
"12","4.494099","162.159.128.232","192.168.0.200","TCP","1514","443  >  64611 [ACK] Seq=1830 Ack=243 Win=8 Len=1460 [TCP segment of a reassembled PDU]"
"13","4.494099","162.159.128.232","192.168.0.200","TCP","1514","443  >  64611 [ACK] Seq=3290 Ack=243 Win=8 Len=1460 [TCP segment of a reassembled PDU]"
"14","4.494099","162.159.128.232","192.168.0.200","TCP","1514","443  >  64611 [ACK] Seq=4750 Ack=243 Win=8 Len=1460 [TCP segment of a reassembled PDU]"
"15","4.494149","162.159.128.232","192.168.0.200","TCP","1514","443  >  64611 [ACK] Seq=6210 Ack=243 Win=8 Len=1460 [TCP segment of a reassembled PDU]"
"16","4.494171","192.168.0.200","162.159.128.232","TCP","54","64611  >  443 [ACK] Seq=243 Ack=6210 Win=1028 Len=0"
"17","4.494214","192.168.0.200","162.159.128.232","TCP","54","64611  >  443 [ACK] Seq=243 Ack=7670 Win=1028 Len=0"
"18","4.495605","162.159.128.232","192.168.0.200","TCP","1514","443  >  64611 [ACK] Seq=7670 Ack=243 Win=8 Len=1460 [TCP segment of a reassembled PDU]"
"19","4.495605","162.159.128.232","192.168.0.200","TCP","1514","443  >  64611 [ACK] Seq=9130 Ack=243 Win=8 Len=1460 [TCP segment of a reassembled PDU]"
"20","4.495605","162.159.128.232","192.168.0.200","TCP","1514","443  >  64611 [ACK] Seq=10590 Ack=243 Win=8 Len=1460 [TCP segment of a reassembled PDU]"
"21","4.495605","162.159.128.232","192.168.0.200","TCP","1514","443  >  64611 [ACK] Seq=12050 Ack=243 Win=8 Len=1460 [TCP segment of a reassembled PDU]"
"22","4.495605","162.159.128.232","192.168.0.200","TCP","1514","443  >  64611 [ACK] Seq=13510 Ack=243 Win=8 Len=1460 [TCP segment of a reassembled PDU]"
"23","4.495706","162.159.128.232","192.168.0.200","TCP","1514","443  >  64611 [ACK] Seq=14970 Ack=243 Win=8 Len=1460 [TCP segment of a reassembled PDU]"
"24","4.495706","162.159.128.232","192.168.0.200","TLSv1.2","400","Application Data"
"25","4.495706","162.159.128.232","192.168.0.200","TCP","1514","443  >  64611 [ACK] Seq=16776 Ack=243 Win=8 Len=1460 [TCP segment of a reassembled PDU]"
"26","4.495706","162.159.128.232","192.168.0.200","TCP","1514","443  >  64611 [ACK] Seq=18236 Ack=243 Win=8 Len=1460 [TCP segment of a reassembled PDU]"
"27","4.495706","162.159.128.232","192.168.0.200","TCP","1514","443  >  64611 [ACK] Seq=19696 Ack=243 Win=8 Len=1460 [TCP segment of a reassembled PDU]"
"28","4.495713","192.168.0.200","162.159.128.232","TCP","54","64611  >  443 [ACK] Seq=243 Ack=14970 Win=1028 Len=0"
"29","4.495706","162.159.128.232","192.168.0.200","TCP","1514","443  >  64611 [ACK] Seq=21156 Ack=243 Win=8 Len=1460 [TCP segment of a reassembled PDU]"
"30","4.495706","162.159.128.232","192.168.0.200","TCP","1514","443  >  64611 [ACK] Seq=22616 Ack=243 Win=8 Len=1460 [TCP segment of a reassembled PDU]"
"31","4.495706","162.159.128.232","192.168.0.200","TCP","1514","443  >  64611 [ACK] Seq=24076 Ack=243 Win=8 Len=1460 [TCP segment of a reassembled PDU]"
"32","4.495706","162.159.128.232","192.168.0.200","TCP","1514","443  >  64611 [ACK] Seq=25536 Ack=243 Win=8 Len=1460 [TCP segment of a reassembled PDU]"
"33","4.495706","162.159.128.232","192.168.0.200","TCP","1514","443  >  64611 [ACK] Seq=26996 Ack=243 Win=8 Len=1460 [TCP segment of a reassembled PDU]"
"34","4.495754","192.168.0.200","162.159.128.232","TCP","54","64611  >  443 [ACK] Seq=243 Ack=28456 Win=1028 Len=0"
"35","4.495788","162.159.128.232","192.168.0.200","TCP","1514","443  >  64611 [ACK] Seq=28456 Ack=243 Win=8 Len=1460 [TCP segment of a reassembled PDU]"
"36","4.495788","162.159.128.232","192.168.0.200","TCP","1514","443  >  64611 [ACK] Seq=29916 Ack=243 Win=8 Len=1460 [TCP segment of a reassembled PDU]"
"37","4.495788","162.159.128.232","192.168.0.200","TCP","1514","443  >  64611 [ACK] Seq=31376 Ack=243 Win=8 Len=1460 [TCP segment of a reassembled PDU]"
"38","4.495788","162.159.128.232","192.168.0.200","TLSv1.2","400","Application Data"
"39","4.495788","162.159.128.232","192.168.0.200","TLSv1.2","1514","Application Data"
"40","4.495788","162.159.128.232","192.168.0.200","TCP","1514","443  >  64611 [ACK] Seq=34642 Ack=243 Win=8 Len=1460 [TCP segment of a reassembled PDU]"
"41","4.495788","162.159.128.232","192.168.0.200","TCP","1514","443  >  64611 [ACK] Seq=36102 Ack=243 Win=8 Len=1460 [TCP segment of a reassembled PDU]"
"42","4.495830","192.168.0.200","162.159.128.232","TCP","54","64611  >  443 [ACK] Seq=243 Ack=37562 Win=1028 Len=0"
"43","4.495940","162.159.128.232","192.168.0.200","TCP","1514","443  >  64611 [ACK] Seq=37562 Ack=243 Win=8 Len=1460 [TCP segment of a reassembled PDU]"
"44","4.495940","162.159.128.232","192.168.0.200","TCP","1514","443  >  64611 [ACK] Seq=39022 Ack=243 Win=8 Len=1460 [TCP segment of a reassembled PDU]"
"45","4.495940","162.159.128.232","192.168.0.200","TCP","1514","443  >  64611 [ACK] Seq=40482 Ack=243 Win=8 Len=1460 [TCP segment of a reassembled PDU]"
"46","4.495940","162.159.128.232","192.168.0.200","TCP","1514","443  >  64611 [ACK] Seq=41942 Ack=243 Win=8 Len=1460 [TCP segment of a reassembled PDU]"
"47","4.495940","162.159.128.232","192.168.0.200","TCP","1514","443  >  64611 [ACK] Seq=43402 Ack=243 Win=8 Len=1460 [TCP segment of a reassembled PDU]"
"48","4.495940","162.159.128.232","192.168.0.200","TCP","1514","443  >  64611 [ACK] Seq=44862 Ack=243 Win=8 Len=1460 [TCP segment of a reassembled PDU]"
"49","4.495940","162.159.128.232","192.168.0.200","TCP","1514","443  >  64611 [ACK] Seq=46322 Ack=243 Win=8 Len=1460 [TCP segment of a reassembled PDU]"
"50","4.495940","162.159.128.232","192.168.0.200","TCP","1514","443  >  64611 [ACK] Seq=47782 Ack=243 Win=8 Len=1460 [TCP segment of a reassembled PDU]"
"51","4.495940","162.159.128.232","192.168.0.200","TLSv1.2","458","Application Data"
"52","4.495940","162.159.128.232","192.168.0.200","TCP","1514","443  >  64611 [ACK] Seq=49646 Ack=243 Win=8 Len=1460 [TCP segment of a reassembled PDU]"
"53","4.496015","192.168.0.200","162.159.128.232","TCP","54","64611  >  443 [ACK] Seq=243 Ack=51106 Win=1028 Len=0"
"54","4.496391","162.159.128.232","192.168.0.200","TCP","1514","443  >  64611 [ACK] Seq=51106 Ack=243 Win=8 Len=1460 [TCP segment of a reassembled PDU]"
"55","4.496391","162.159.128.232","192.168.0.200","TCP","1514","443  >  64611 [ACK] Seq=52566 Ack=243 Win=8 Len=1460 [TCP segment of a reassembled PDU]"
"56","4.496391","162.159.128.232","192.168.0.200","TCP","1514","443  >  64611 [ACK] Seq=54026 Ack=243 Win=8 Len=1460 [TCP segment of a reassembled PDU]"
"57","4.496429","192.168.0.200","162.159.128.232","TCP","54","64611  >  443 [ACK] Seq=243 Ack=55486 Win=1028 Len=0"
"58","4.496565","162.159.128.232","192.168.0.200","TCP","1514","443  >  64611 [ACK] Seq=55486 Ack=243 Win=8 Len=1460 [TCP segment of a reassembled PDU]"
"59","4.496565","162.159.128.232","192.168.0.200","TCP","1514","443  >  64611 [ACK] Seq=56946 Ack=243 Win=8 Len=1460 [TCP segment of a reassembled PDU]"
"60","4.496565","162.159.128.232","192.168.0.200","TCP","1514","443  >  64611 [ACK] Seq=58406 Ack=243 Win=8 Len=1460 [TCP segment of a reassembled PDU]"
"61","4.496565","162.159.128.232","192.168.0.200","TCP","1514","443  >  64611 [ACK] Seq=59866 Ack=243 Win=8 Len=1460 [TCP segment of a reassembled PDU]"
"62","4.496565","162.159.128.232","192.168.0.200","TCP","1514","443  >  64611 [ACK] Seq=61326 Ack=243 Win=8 Len=1460 [TCP segment of a reassembled PDU]"
"63","4.496565","162.159.128.232","192.168.0.200","TCP","1514","443  >  64611 [ACK] Seq=62786 Ack=243 Win=8 Len=1460 [TCP segment of a reassembled PDU]"
"64","4.496565","162.159.128.232","192.168.0.200","TCP","1514","443  >  64611 [ACK] Seq=64246 Ack=243 Win=8 Len=1460 [TCP segment of a reassembled PDU]"
"65","4.496565","162.159.128.232","192.168.0.200","TLSv1.2","458","Application Data, Application Data"
"66","4.496565","162.159.128.232","192.168.0.200","TCP","1514","443  >  64611 [ACK] Seq=66110 Ack=243 Win=8 Len=1460 [TCP segment of a reassembled PDU]"
"67","4.496565","162.159.128.232","192.168.0.200","TCP","1514","443  >  64611 [ACK] Seq=67570 Ack=243 Win=8 Len=1460 [TCP segment of a reassembled PDU]"
"68","4.496565","162.159.128.232","192.168.0.200","TCP","1514","443  >  64611 [ACK] Seq=69030 Ack=243 Win=8 Len=1460 [TCP segment of a reassembled PDU]"
"69","4.496565","162.159.128.232","192.168.0.200","TCP","1514","443  >  64611 [ACK] Seq=70490 Ack=243 Win=8 Len=1460 [TCP segment of a reassembled PDU]"
"70","4.496565","162.159.128.232","192.168.0.200","TCP","1514","443  >  64611 [ACK] Seq=71950 Ack=243 Win=8 Len=1460 [TCP segment of a reassembled PDU]"
"71","4.496565","162.159.128.232","192.168.0.200","TCP","1514","443  >  64611 [ACK] Seq=73410 Ack=243 Win=8 Len=1460 [TCP segment of a reassembled PDU]"
"72","4.496635","162.159.128.232","192.168.0.200","TCP","1514","443  >  64611 [ACK] Seq=74870 Ack=243 Win=8 Len=1460 [TCP segment of a reassembled PDU]"
"73","4.496635","162.159.128.232","192.168.0.200","TCP","1514","443  >  64611 [ACK] Seq=76330 Ack=243 Win=8 Len=1460 [TCP segment of a reassembled PDU]"
"74","4.496635","162.159.128.232","192.168.0.200","TCP","1514","443  >  64611 [ACK] Seq=77790 Ack=243 Win=8 Len=1460 [TCP segment of a reassembled PDU]"
"75","4.496653","192.168.0.200","162.159.128.232","TCP","54","64611  >  443 [ACK] Seq=243 Ack=74870 Win=1028 Len=0"
"76","4.496674","192.168.0.200","162.159.128.232","TCP","54","64611  >  443 [ACK] Seq=243 Ack=79250 Win=1028 Len=0"
"77","4.496776","192.168.0.200","162.159.128.232","TLSv1.2","89","Application Data"
"78","4.499181","162.159.128.232","192.168.0.200","TCP","1514","443  >  64611 [ACK] Seq=79250 Ack=243 Win=8 Len=1460 [TCP segment of a reassembled PDU]"
"79","4.499181","162.159.128.232","192.168.0.200","TCP","1514","443  >  64611 [ACK] Seq=80710 Ack=243 Win=8 Len=1460 [TCP segment of a reassembled PDU]"
"80","4.499181","162.159.128.232","192.168.0.200","TLSv1.2","1514","Application Data"
"81","4.499181","162.159.128.232","192.168.0.200","TCP","1514","443  >  64611 [ACK] Seq=83630 Ack=243 Win=8 Len=1460 [TCP segment of a reassembled PDU]"
"82","4.499289","192.168.0.200","162.159.128.232","TCP","54","64611  >  443 [ACK] Seq=278 Ack=85090 Win=1028 Len=0"
"83","4.499290","162.159.128.232","192.168.0.200","TCP","1514","443  >  64611 [ACK] Seq=85090 Ack=243 Win=8 Len=1460 [TCP segment of a reassembled PDU]"
"84","4.499290","162.159.128.232","192.168.0.200","TCP","1514","443  >  64611 [ACK] Seq=86550 Ack=243 Win=8 Len=1460 [TCP segment of a reassembled PDU]"
"85","4.499290","162.159.128.232","192.168.0.200","TCP","1514","443  >  64611 [ACK] Seq=88010 Ack=243 Win=8 Len=1460 [TCP segment of a reassembled PDU]"
"86","4.499290","162.159.128.232","192.168.0.200","TCP","1514","443  >  64611 [ACK] Seq=89470 Ack=243 Win=8 Len=1460 [TCP segment of a reassembled PDU]"
"87","4.499290","162.159.128.232","192.168.0.200","TCP","1514","443  >  64611 [ACK] Seq=90930 Ack=243 Win=8 Len=1460 [TCP segment of a reassembled PDU]"
"88","4.499290","162.159.128.232","192.168.0.200","TCP","1514","443  >  64611 [ACK] Seq=92390 Ack=243 Win=8 Len=1460 [TCP segment of a reassembled PDU]"
"89","4.499290","162.159.128.232","192.168.0.200","TCP","1514","443  >  64611 [ACK] Seq=93850 Ack=243 Win=8 Len=1460 [TCP segment of a reassembled PDU]"
"90","4.499290","162.159.128.232","192.168.0.200","TCP","1514","443  >  64611 [ACK] Seq=95310 Ack=243 Win=8 Len=1460 [TCP segment of a reassembled PDU]"
"91","4.499290","162.159.128.232","192.168.0.200","TCP","1514","443  >  64611 [ACK] Seq=96770 Ack=243 Win=8 Len=1460 [TCP segment of a reassembled PDU]"
"92","4.499384","192.168.0.200","162.159.128.232","TCP","54","64611  >  443 [ACK] Seq=278 Ack=98230 Win=1028 Len=0"
"93","4.499438","162.159.128.232","192.168.0.200","TLSv1.2","1514","Application Data, Application Data"
"94","4.499438","162.159.128.232","192.168.0.200","TCP","1514","443  >  64611 [ACK] Seq=99690 Ack=243 Win=8 Len=1460 [TCP segment of a reassembled PDU]"
"95","4.499438","162.159.128.232","192.168.0.200","TCP","1514","443  >  64611 [ACK] Seq=101150 Ack=243 Win=8 Len=1460 [TCP segment of a reassembled PDU]"
"96","4.499438","162.159.128.232","192.168.0.200","TCP","1514","443  >  64611 [ACK] Seq=102610 Ack=243 Win=8 Len=1460 [TCP segment of a reassembled PDU]"
"97","4.499438","162.159.128.232","192.168.0.200","TCP","1514","443  >  64611 [ACK] Seq=104070 Ack=243 Win=8 Len=1460 [TCP segment of a reassembled PDU]"
"98","4.499438","162.159.128.232","192.168.0.200","TCP","1514","443  >  64611 [ACK] Seq=105530 Ack=243 Win=8 Len=1460 [TCP segment of a reassembled PDU]"
"99","4.499438","162.159.128.232","192.168.0.200","TCP","1514","443  >  64611 [ACK] Seq=106990 Ack=243 Win=8 Len=1460 [TCP segment of a reassembled PDU]"
"100","4.499438","162.159.128.232","192.168.0.200","TCP","1514","443  >  64611 [ACK] Seq=108450 Ack=243 Win=8 Len=1460 [TCP segment of a reassembled PDU]"
"101","4.499438","162.159.128.232","192.168.0.200","TCP","1514","443  >  64611 [ACK] Seq=109910 Ack=243 Win=8 Len=1460 [TCP segment of a reassembled PDU]"
"102","4.499438","162.159.128.232","192.168.0.200","TCP","1514","443  >  64611 [ACK] Seq=111370 Ack=243 Win=8 Len=1460 [TCP segment of a reassembled PDU]"
"103","4.499438","162.159.128.232","192.168.0.200","TCP","1514","443  >  64611 [ACK] Seq=112830 Ack=243 Win=8 Len=1460 [TCP segment of a reassembled PDU]"
"104","4.499438","162.159.128.232","192.168.0.200","TLSv1.2","1150","Application Data"
"105","4.499496","192.168.0.200","162.159.128.232","TCP","54","64611  >  443 [ACK] Seq=278 Ack=115386 Win=1028 Len=0"
"106","4.499585","162.159.128.232","192.168.0.200","TCP","1514","443  >  64611 [ACK] Seq=115386 Ack=243 Win=8 Len=1460 [TCP segment of a reassembled PDU]"
"107","4.499585","162.159.128.232","192.168.0.200","TCP","1514","443  >  64611 [ACK] Seq=116846 Ack=243 Win=8 Len=1460 [TCP segment of a reassembled PDU]"
"108","4.499585","162.159.128.232","192.168.0.200","TCP","1514","443  >  64611 [ACK] Seq=118306 Ack=243 Win=8 Len=1460 [TCP segment of a reassembled PDU]"
"109","4.499585","162.159.128.232","192.168.0.200","TCP","1514","443  >  64611 [ACK] Seq=119766 Ack=243 Win=8 Len=1460 [TCP segment of a reassembled PDU]"
"110","4.499585","162.159.128.232","192.168.0.200","TCP","1514","443  >  64611 [ACK] Seq=121226 Ack=243 Win=8 Len=1460 [TCP segment of a reassembled PDU]"
"111","4.499585","162.159.128.232","192.168.0.200","TCP","1514","443  >  64611 [ACK] Seq=122686 Ack=243 Win=8 Len=1460 [TCP segment of a reassembled PDU]"
"112","4.499585","162.159.128.232","192.168.0.200","TCP","1514","443  >  64611 [ACK] Seq=124146 Ack=243 Win=8 Len=1460 [TCP segment of a reassembled PDU]"
"113","4.499585","162.159.128.232","192.168.0.200","TCP","1514","443  >  64611 [ACK] Seq=125606 Ack=243 Win=8 Len=1460 [TCP segment of a reassembled PDU]"
"114","4.499621","192.168.0.200","162.159.128.232","TCP","54","64611  >  443 [ACK] Seq=278 Ack=127066 Win=1028 Len=0"
"115","4.499962","162.159.128.232","192.168.0.200","TCP","1514","443  >  64611 [ACK] Seq=127066 Ack=243 Win=8 Len=1460 [TCP segment of a reassembled PDU]"
"116","4.499962","162.159.128.232","192.168.0.200","TCP","1514","443  >  64611 [ACK] Seq=128526 Ack=243 Win=8 Len=1460 [TCP segment of a reassembled PDU]"
"117","4.499962","162.159.128.232","192.168.0.200","TCP","1514","443  >  64611 [ACK] Seq=129986 Ack=243 Win=8 Len=1460 [TCP segment of a reassembled PDU]"
"118","4.499962","162.159.128.232","192.168.0.200","TLSv1.2","1514","Application Data, Application Data"
"119","4.499962","162.159.128.232","192.168.0.200","TCP","1514","443  >  64611 [ACK] Seq=132906 Ack=243 Win=8 Len=1460 [TCP segment of a reassembled PDU]"
"120","4.499962","162.159.128.232","192.168.0.200","TCP","1514","443  >  64611 [ACK] Seq=134366 Ack=243 Win=8 Len=1460 [TCP segment of a reassembled PDU]"
"121","4.499962","162.159.128.232","192.168.0.200","TCP","1514","443  >  64611 [ACK] Seq=135826 Ack=243 Win=8 Len=1460 [TCP segment of a reassembled PDU]"
"122","4.499962","162.159.128.232","192.168.0.200","TCP","1514","443  >  64611 [ACK] Seq=137286 Ack=243 Win=8 Len=1460 [TCP segment of a reassembled PDU]"
"123","4.499962","162.159.128.232","192.168.0.200","TCP","1514","443  >  64611 [ACK] Seq=138746 Ack=243 Win=8 Len=1460 [TCP segment of a reassembled PDU]"
"124","4.499962","162.159.128.232","192.168.0.200","TCP","1514","443  >  64611 [ACK] Seq=140206 Ack=243 Win=8 Len=1460 [TCP segment of a reassembled PDU]"
"125","4.499962","162.159.128.232","192.168.0.200","TCP","1514","443  >  64611 [ACK] Seq=141666 Ack=243 Win=8 Len=1460 [TCP segment of a reassembled PDU]"
"126","4.499962","162.159.128.232","192.168.0.200","TCP","1514","443  >  64611 [ACK] Seq=143126 Ack=243 Win=8 Len=1460 [TCP segment of a reassembled PDU]"
"127","4.499962","162.159.128.232","192.168.0.200","TCP","1514","443  >  64611 [ACK] Seq=144586 Ack=243 Win=8 Len=1460 [TCP segment of a reassembled PDU]"
"128","4.499962","162.159.128.232","192.168.0.200","TCP","1514","443  >  64611 [ACK] Seq=146046 Ack=243 Win=8 Len=1460 [TCP segment of a reassembled PDU]"
"129","4.499962","162.159.128.232","192.168.0.200","TLSv1.2","1514","Application Data"
"130","4.499962","162.159.128.232","192.168.0.200","TCP","1514","443  >  64611 [ACK] Seq=148966 Ack=243 Win=8 Len=1460 [TCP segment of a reassembled PDU]"
"131","4.499962","162.159.128.232","192.168.0.200","TCP","1514","443  >  64611 [ACK] Seq=150426 Ack=243 Win=8 Len=1460 [TCP segment of a reassembled PDU]"
"132","4.499962","162.159.128.232","192.168.0.200","TCP","1514","443  >  64611 [ACK] Seq=151886 Ack=243 Win=8 Len=1460 [TCP segment of a reassembled PDU]"
"133","4.499962","162.159.128.232","192.168.0.200","TCP","1514","443  >  64611 [ACK] Seq=153346 Ack=243 Win=8 Len=1460 [TCP segment of a reassembled PDU]"
"134","4.499962","162.159.128.232","192.168.0.200","TCP","1514","443  >  64611 [ACK] Seq=154806 Ack=243 Win=8 Len=1460 [TCP segment of a reassembled PDU]"
"135","4.499962","162.159.128.232","192.168.0.200","TCP","1514","443  >  64611 [ACK] Seq=156266 Ack=243 Win=8 Len=1460 [TCP segment of a reassembled PDU]"
"136","4.499962","162.159.128.232","192.168.0.200","TCP","1514","443  >  64611 [ACK] Seq=157726 Ack=243 Win=8 Len=1460 [TCP segment of a reassembled PDU]"
"137","4.499962","162.159.128.232","192.168.0.200","TCP","1514","443  >  64611 [ACK] Seq=159186 Ack=243 Win=8 Len=1460 [TCP segment of a reassembled PDU]"
"138","4.499962","162.159.128.232","192.168.0.200","TCP","1514","443  >  64611 [ACK] Seq=160646 Ack=243 Win=8 Len=1460 [TCP segment of a reassembled PDU]"
"139","4.499962","162.159.128.232","192.168.0.200","TCP","1514","443  >  64611 [ACK] Seq=162106 Ack=243 Win=8 Len=1460 [TCP segment of a reassembled PDU]"
"140","4.499962","162.159.128.232","192.168.0.200","TLSv1.2","1514","Application Data, Application Data"
"141","4.499962","162.159.128.232","192.168.0.200","TCP","1514","443  >  64611 [ACK] Seq=165026 Ack=243 Win=8 Len=1460 [TCP segment of a reassembled PDU]"
"142","4.499962","162.159.128.232","192.168.0.200","TCP","1514","443  >  64611 [ACK] Seq=166486 Ack=243 Win=8 Len=1460 [TCP segment of a reassembled PDU]"
"143","4.499962","162.159.128.232","192.168.0.200","TCP","1514","443  >  64611 [ACK] Seq=167946 Ack=243 Win=8 Len=1460 [TCP segment of a reassembled PDU]"
"144","4.500112","162.159.128.232","192.168.0.200","TCP","1514","443  >  64611 [ACK] Seq=169406 Ack=243 Win=8 Len=1460 [TCP segment of a reassembled PDU]"
"145","4.500112","162.159.128.232","192.168.0.200","TCP","1514","443  >  64611 [ACK] Seq=170866 Ack=243 Win=8 Len=1460 [TCP segment of a reassembled PDU]"
"146","4.500114","192.168.0.200","162.159.128.232","TCP","54","64611  >  443 [ACK] Seq=278 Ack=169406 Win=1028 Len=0"
"147","4.500112","162.159.128.232","192.168.0.200","TCP","1514","443  >  64611 [ACK] Seq=172326 Ack=243 Win=8 Len=1460 [TCP segment of a reassembled PDU]"
"148","4.500112","162.159.128.232","192.168.0.200","TCP","1514","443  >  64611 [ACK] Seq=173786 Ack=243 Win=8 Len=1460 [TCP segment of a reassembled PDU]"
"149","4.500112","162.159.128.232","192.168.0.200","TCP","1514","443  >  64611 [ACK] Seq=175246 Ack=243 Win=8 Len=1460 [TCP segment of a reassembled PDU]"
"150","4.500112","162.159.128.232","192.168.0.200","TCP","1514","443  >  64611 [ACK] Seq=176706 Ack=243 Win=8 Len=1460 [TCP segment of a reassembled PDU]"
"151","4.500112","162.159.128.232","192.168.0.200","TCP","1514","443  >  64611 [PSH, ACK] Seq=178166 Ack=243 Win=8 Len=1460 [TCP segment of a reassembled PDU]"
"152","4.500112","162.159.128.232","192.168.0.200","TCP","1514","443  >  64611 [ACK] Seq=179626 Ack=243 Win=8 Len=1460 [TCP segment of a reassembled PDU]"
"153","4.500112","162.159.128.232","192.168.0.200","TLSv1.2","1514","Application Data"
"154","4.500112","162.159.128.232","192.168.0.200","TCP","1514","443  >  64611 [ACK] Seq=182546 Ack=243 Win=8 Len=1460 [TCP segment of a reassembled PDU]"
"155","4.500112","162.159.128.232","192.168.0.200","TCP","1514","443  >  64611 [ACK] Seq=184006 Ack=243 Win=8 Len=1460 [TCP segment of a reassembled PDU]"
"156","4.500112","162.159.128.232","192.168.0.200","TCP","1514","443  >  64611 [ACK] Seq=185466 Ack=243 Win=8 Len=1460 [TCP segment of a reassembled PDU]"
"157","4.500173","192.168.0.200","162.159.128.232","TCP","54","64611  >  443 [ACK] Seq=278 Ack=186926 Win=1028 Len=0"
"158","4.500226","162.159.128.232","192.168.0.200","TLSv1.2","884","Application Data, Application Data"
"159","4.546667","192.168.0.200","162.159.128.232","TCP","54","64611  >  443 [ACK] Seq=278 Ack=187756 Win=1024 Len=0"
"160","4.556939","162.159.128.232","192.168.0.200","TCP","60","443  >  64611 [ACK] Seq=187756 Ack=278 Win=8 Len=0"
"161","20.284411","192.168.0.200","162.159.128.232","TLSv1.2","93","[TCP Previous segment not captured] , Application Data"
"162","20.284411","192.168.0.200","162.159.128.232","TCP","258","[TCP Out-Of-Order] 64611  >  443 [PSH, ACK] Seq=278 Ack=187756 Win=1024 Len=204"
"163","20.301969","162.159.128.232","192.168.0.200","TCP","60","443  >  64611 [ACK] Seq=187756 Ack=482 Win=7 Len=0"
"164","20.302833","162.159.128.232","192.168.0.200","TCP","60","443  >  64611 [ACK] Seq=187756 Ack=521 Win=7 Len=0"
"165","20.302833","162.159.128.232","192.168.0.200","TLSv1.2","93","Application Data"
"166","20.351132","192.168.0.200","162.159.128.232","TCP","54","64611  >  443 [ACK] Seq=521 Ack=187795 Win=1024 Len=0"
"167","20.585127","162.159.128.232","192.168.0.200","TLSv1.2","582","Application Data"
"168","20.589569","162.159.128.232","192.168.0.200","TCP","1514","443  >  64611 [ACK] Seq=188323 Ack=521 Win=8 Len=1460 [TCP segment of a reassembled PDU]"
"169","20.589640","192.168.0.200","162.159.128.232","TCP","54","64611  >  443 [ACK] Seq=521 Ack=189783 Win=1028 Len=0"
"170","20.589645","162.159.128.232","192.168.0.200","TCP","1514","443  >  64611 [ACK] Seq=189783 Ack=521 Win=8 Len=1460 [TCP segment of a reassembled PDU]"
"171","20.589645","162.159.128.232","192.168.0.200","TCP","1514","443  >  64611 [ACK] Seq=191243 Ack=521 Win=8 Len=1460 [TCP segment of a reassembled PDU]"
"172","20.589645","162.159.128.232","192.168.0.200","TCP","1514","443  >  64611 [ACK] Seq=192703 Ack=521 Win=8 Len=1460 [TCP segment of a reassembled PDU]"
"173","20.589645","162.159.128.232","192.168.0.200","TCP","1514","443  >  64611 [ACK] Seq=194163 Ack=521 Win=8 Len=1460 [TCP segment of a reassembled PDU]"
"174","20.589712","192.168.0.200","162.159.128.232","TCP","54","64611  >  443 [ACK] Seq=521 Ack=195623 Win=1028 Len=0"
"175","20.589723","162.159.128.232","192.168.0.200","TCP","1514","443  >  64611 [ACK] Seq=195623 Ack=521 Win=8 Len=1460 [TCP segment of a reassembled PDU]"
"176","20.589723","162.159.128.232","192.168.0.200","TCP","1514","443  >  64611 [ACK] Seq=197083 Ack=521 Win=8 Len=1460 [TCP segment of a reassembled PDU]"
"177","20.589723","162.159.128.232","192.168.0.200","TCP","1514","443  >  64611 [ACK] Seq=198543 Ack=521 Win=8 Len=1460 [TCP segment of a reassembled PDU]"
"178","20.589723","162.159.128.232","192.168.0.200","TCP","1514","443  >  64611 [ACK] Seq=200003 Ack=521 Win=8 Len=1460 [TCP segment of a reassembled PDU]"
"179","20.589760","192.168.0.200","162.159.128.232","TCP","54","64611  >  443 [ACK] Seq=521 Ack=201463 Win=1028 Len=0"
"180","20.589864","162.159.128.232","192.168.0.200","TCP","1514","443  >  64611 [ACK] Seq=201463 Ack=521 Win=8 Len=1460 [TCP segment of a reassembled PDU]"
"181","20.589864","162.159.128.232","192.168.0.200","TCP","1514","443  >  64611 [ACK] Seq=202923 Ack=521 Win=8 Len=1460 [TCP segment of a reassembled PDU]"
"182","20.589864","162.159.128.232","192.168.0.200","TLSv1.2","400","Application Data"
"183","20.589864","162.159.128.232","192.168.0.200","TCP","1514","443  >  64611 [ACK] Seq=204729 Ack=521 Win=8 Len=1460 [TCP segment of a reassembled PDU]"
"184","20.589864","162.159.128.232","192.168.0.200","TCP","1514","443  >  64611 [ACK] Seq=206189 Ack=521 Win=8 Len=1460 [TCP segment of a reassembled PDU]"
"185","20.589864","162.159.128.232","192.168.0.200","TCP","1514","443  >  64611 [ACK] Seq=207649 Ack=521 Win=8 Len=1460 [TCP segment of a reassembled PDU]"
"186","20.589864","162.159.128.232","192.168.0.200","TCP","1514","443  >  64611 [ACK] Seq=209109 Ack=521 Win=8 Len=1460 [TCP segment of a reassembled PDU]"
"187","20.589864","162.159.128.232","192.168.0.200","TCP","1514","443  >  64611 [ACK] Seq=210569 Ack=521 Win=8 Len=1460 [TCP segment of a reassembled PDU]"
"188","20.589864","162.159.128.232","192.168.0.200","TCP","1514","443  >  64611 [ACK] Seq=212029 Ack=521 Win=8 Len=1460 [TCP segment of a reassembled PDU]"
"189","20.589912","192.168.0.200","162.159.128.232","TCP","54","64611  >  443 [ACK] Seq=521 Ack=213489 Win=1028 Len=0"
"190","20.592722","162.159.128.232","192.168.0.200","TCP","1514","443  >  64611 [ACK] Seq=213489 Ack=521 Win=8 Len=1460 [TCP segment of a reassembled PDU]"
"191","20.592831","192.168.0.200","162.159.128.232","TCP","54","64611  >  443 [ACK] Seq=521 Ack=214949 Win=1028 Len=0"
"192","20.592852","162.159.128.232","192.168.0.200","TCP","1514","443  >  64611 [ACK] Seq=214949 Ack=521 Win=8 Len=1460 [TCP segment of a reassembled PDU]"
"193","20.592852","162.159.128.232","192.168.0.200","TCP","1514","443  >  64611 [ACK] Seq=216409 Ack=521 Win=8 Len=1460 [TCP segment of a reassembled PDU]"
"194","20.592852","162.159.128.232","192.168.0.200","TCP","1514","443  >  64611 [ACK] Seq=217869 Ack=521 Win=8 Len=1460 [TCP segment of a reassembled PDU]"
"195","20.592852","162.159.128.232","192.168.0.200","TCP","1514","443  >  64611 [ACK] Seq=219329 Ack=521 Win=8 Len=1460 [TCP segment of a reassembled PDU]"
"196","20.592852","162.159.128.232","192.168.0.200","TLSv1.2","400","Application Data"
"197","20.592852","162.159.128.232","192.168.0.200","TLSv1.2","1514","Application Data"
"198","20.592852","162.159.128.232","192.168.0.200","TCP","1514","443  >  64611 [ACK] Seq=222595 Ack=521 Win=8 Len=1460 [TCP segment of a reassembled PDU]"
"199","20.592852","162.159.128.232","192.168.0.200","TCP","1514","443  >  64611 [ACK] Seq=224055 Ack=521 Win=8 Len=1460 [TCP segment of a reassembled PDU]"
"200","20.592852","162.159.128.232","192.168.0.200","TCP","1514","443  >  64611 [ACK] Seq=225515 Ack=521 Win=8 Len=1460 [TCP segment of a reassembled PDU]"
"201","20.592930","162.159.128.232","192.168.0.200","TCP","1514","443  >  64611 [ACK] Seq=226975 Ack=521 Win=8 Len=1460 [TCP segment of a reassembled PDU]"
"202","20.592930","162.159.128.232","192.168.0.200","TCP","1514","443  >  64611 [ACK] Seq=228435 Ack=521 Win=8 Len=1460 [TCP segment of a reassembled PDU]"
"203","20.592930","162.159.128.232","192.168.0.200","TCP","1514","443  >  64611 [ACK] Seq=229895 Ack=521 Win=8 Len=1460 [TCP segment of a reassembled PDU]"
"204","20.592930","162.159.128.232","192.168.0.200","TCP","1514","443  >  64611 [ACK] Seq=231355 Ack=521 Win=8 Len=1460 [TCP segment of a reassembled PDU]"
"205","20.592935","192.168.0.200","162.159.128.232","TCP","54","64611  >  443 [ACK] Seq=521 Ack=226975 Win=1028 Len=0"
"206","20.592930","162.159.128.232","192.168.0.200","TCP","1514","443  >  64611 [ACK] Seq=232815 Ack=521 Win=8 Len=1460 [TCP segment of a reassembled PDU]"
"207","20.592935","192.168.0.200","162.159.128.232","TLSv1.2","89","Application Data"
"208","20.593004","192.168.0.200","162.159.128.232","TCP","54","64611  >  443 [ACK] Seq=556 Ack=234275 Win=1028 Len=0"
"209","20.593062","162.159.128.232","192.168.0.200","TCP","1514","443  >  64611 [ACK] Seq=234275 Ack=521 Win=8 Len=1460 [TCP segment of a reassembled PDU]"
"210","20.593062","162.159.128.232","192.168.0.200","TCP","1514","443  >  64611 [ACK] Seq=235735 Ack=521 Win=8 Len=1460 [TCP segment of a reassembled PDU]"
"211","20.593062","162.159.128.232","192.168.0.200","TLSv1.2","458","Application Data"
"212","20.593062","162.159.128.232","192.168.0.200","TCP","1514","443  >  64611 [ACK] Seq=237599 Ack=521 Win=8 Len=1460 [TCP segment of a reassembled PDU]"
"213","20.593062","162.159.128.232","192.168.0.200","TCP","1514","443  >  64611 [ACK] Seq=239059 Ack=521 Win=8 Len=1460 [TCP segment of a reassembled PDU]"
"214","20.593062","162.159.128.232","192.168.0.200","TCP","1514","443  >  64611 [ACK] Seq=240519 Ack=521 Win=8 Len=1460 [TCP segment of a reassembled PDU]"
"215","20.593062","162.159.128.232","192.168.0.200","TCP","1514","443  >  64611 [ACK] Seq=241979 Ack=521 Win=8 Len=1460 [TCP segment of a reassembled PDU]"
"216","20.593062","162.159.128.232","192.168.0.200","TCP","1514","443  >  64611 [ACK] Seq=243439 Ack=521 Win=8 Len=1460 [TCP segment of a reassembled PDU]"
"217","20.593099","192.168.0.200","162.159.128.232","TCP","54","64611  >  443 [ACK] Seq=556 Ack=244899 Win=1028 Len=0"
"218","20.593193","162.159.128.232","192.168.0.200","TCP","1514","443  >  64611 [ACK] Seq=244899 Ack=521 Win=8 Len=1460 [TCP segment of a reassembled PDU]"
"219","20.593193","162.159.128.232","192.168.0.200","TCP","1514","443  >  64611 [ACK] Seq=246359 Ack=521 Win=8 Len=1460 [TCP segment of a reassembled PDU]"
"220","20.593193","162.159.128.232","192.168.0.200","TCP","1514","443  >  64611 [ACK] Seq=247819 Ack=521 Win=8 Len=1460 [TCP segment of a reassembled PDU]"
"221","20.593193","162.159.128.232","192.168.0.200","TCP","1514","443  >  64611 [ACK] Seq=249279 Ack=521 Win=8 Len=1460 [TCP segment of a reassembled PDU]"
"222","20.593193","162.159.128.232","192.168.0.200","TCP","1514","443  >  64611 [ACK] Seq=250739 Ack=521 Win=8 Len=1460 [TCP segment of a reassembled PDU]"
"223","20.593193","162.159.128.232","192.168.0.200","TCP","1514","443  >  64611 [ACK] Seq=252199 Ack=521 Win=8 Len=1460 [TCP segment of a reassembled PDU]"
"224","20.593193","162.159.128.232","192.168.0.200","TLSv1.2","1514","Application Data, Application Data"
"225","20.593193","162.159.128.232","192.168.0.200","TCP","1514","443  >  64611 [ACK] Seq=255119 Ack=521 Win=8 Len=1460 [TCP segment of a reassembled PDU]"
"226","20.593252","192.168.0.200","162.159.128.232","TCP","54","64611  >  443 [ACK] Seq=556 Ack=256579 Win=1028 Len=0"
"227","20.593325","162.159.128.232","192.168.0.200","TCP","1514","443  >  64611 [ACK] Seq=256579 Ack=521 Win=8 Len=1460 [TCP segment of a reassembled PDU]"
"228","20.593325","162.159.128.232","192.168.0.200","TCP","1514","443  >  64611 [ACK] Seq=258039 Ack=521 Win=8 Len=1460 [TCP segment of a reassembled PDU]"
"229","20.593325","162.159.128.232","192.168.0.200","TCP","1514","443  >  64611 [ACK] Seq=259499 Ack=521 Win=8 Len=1460 [TCP segment of a reassembled PDU]"
"230","20.593325","162.159.128.232","192.168.0.200","TCP","1514","443  >  64611 [ACK] Seq=260959 Ack=521 Win=8 Len=1460 [TCP segment of a reassembled PDU]"
"231","20.593325","162.159.128.232","192.168.0.200","TCP","1514","443  >  64611 [ACK] Seq=262419 Ack=521 Win=8 Len=1460 [TCP segment of a reassembled PDU]"
"232","20.593325","162.159.128.232","192.168.0.200","TCP","1514","443  >  64611 [ACK] Seq=263879 Ack=521 Win=8 Len=1460 [TCP segment of a reassembled PDU]"
"233","20.593373","192.168.0.200","162.159.128.232","TCP","54","64611  >  443 [ACK] Seq=556 Ack=265339 Win=1028 Len=0"
"234","20.593459","162.159.128.232","192.168.0.200","TCP","1514","443  >  64611 [ACK] Seq=265339 Ack=521 Win=8 Len=1460 [TCP segment of a reassembled PDU]"
"235","20.593459","162.159.128.232","192.168.0.200","TCP","1514","443  >  64611 [ACK] Seq=266799 Ack=521 Win=8 Len=1460 [TCP segment of a reassembled PDU]"
"236","20.593459","162.159.128.232","192.168.0.200","TCP","1514","443  >  64611 [ACK] Seq=268259 Ack=521 Win=8 Len=1460 [TCP segment of a reassembled PDU]"
"237","20.593459","162.159.128.232","192.168.0.200","TLSv1.2","1514","Application Data"
"238","20.593459","162.159.128.232","192.168.0.200","TCP","1514","443  >  64611 [ACK] Seq=271179 Ack=521 Win=8 Len=1460 [TCP segment of a reassembled PDU]"
"239","20.593459","162.159.128.232","192.168.0.200","TCP","1514","443  >  64611 [ACK] Seq=272639 Ack=521 Win=8 Len=1460 [TCP segment of a reassembled PDU]"
"240","20.593459","162.159.128.232","192.168.0.200","TCP","1514","443  >  64611 [ACK] Seq=274099 Ack=521 Win=8 Len=1460 [TCP segment of a reassembled PDU]"
"241","20.593534","192.168.0.200","162.159.128.232","TCP","54","64611  >  443 [ACK] Seq=556 Ack=275559 Win=1028 Len=0"
"242","20.593596","162.159.128.232","192.168.0.200","TCP","1514","443  >  64611 [ACK] Seq=275559 Ack=521 Win=8 Len=1460 [TCP segment of a reassembled PDU]"
"243","20.593596","162.159.128.232","192.168.0.200","TCP","1514","443  >  64611 [ACK] Seq=277019 Ack=521 Win=8 Len=1460 [TCP segment of a reassembled PDU]"
"244","20.593596","162.159.128.232","192.168.0.200","TCP","1514","443  >  64611 [ACK] Seq=278479 Ack=521 Win=8 Len=1460 [TCP segment of a reassembled PDU]"
"245","20.593596","162.159.128.232","192.168.0.200","TCP","1514","443  >  64611 [ACK] Seq=279939 Ack=521 Win=8 Len=1460 [TCP segment of a reassembled PDU]"
"246","20.593596","162.159.128.232","192.168.0.200","TCP","1514","443  >  64611 [ACK] Seq=281399 Ack=521 Win=8 Len=1460 [TCP segment of a reassembled PDU]"
"247","20.593596","162.159.128.232","192.168.0.200","TCP","1514","443  >  64611 [ACK] Seq=282859 Ack=521 Win=8 Len=1460 [TCP segment of a reassembled PDU]"
"248","20.593596","162.159.128.232","192.168.0.200","TCP","1514","443  >  64611 [ACK] Seq=284319 Ack=521 Win=8 Len=1460 [TCP segment of a reassembled PDU]"
"249","20.593596","162.159.128.232","192.168.0.200","TLSv1.2","1150","Application Data"
"250","20.593665","192.168.0.200","162.159.128.232","TCP","54","64611  >  443 [ACK] Seq=556 Ack=286875 Win=1028 Len=0"
"251","20.593728","162.159.128.232","192.168.0.200","TLSv1.2","1514","Application Data"
"252","20.593728","162.159.128.232","192.168.0.200","TCP","1514","443  >  64611 [ACK] Seq=288335 Ack=521 Win=8 Len=1460 [TCP segment of a reassembled PDU]"
"253","20.593728","162.159.128.232","192.168.0.200","TCP","1514","443  >  64611 [ACK] Seq=289795 Ack=521 Win=8 Len=1460 [TCP segment of a reassembled PDU]"
"254","20.593728","162.159.128.232","192.168.0.200","TCP","1514","443  >  64611 [ACK] Seq=291255 Ack=521 Win=8 Len=1460 [TCP segment of a reassembled PDU]"
"255","20.593728","162.159.128.232","192.168.0.200","TCP","1514","443  >  64611 [ACK] Seq=292715 Ack=521 Win=8 Len=1460 [TCP segment of a reassembled PDU]"
"256","20.593728","162.159.128.232","192.168.0.200","TCP","1514","443  >  64611 [ACK] Seq=294175 Ack=521 Win=8 Len=1460 [TCP segment of a reassembled PDU]"
"257","20.593728","162.159.128.232","192.168.0.200","TCP","1514","443  >  64611 [ACK] Seq=295635 Ack=521 Win=8 Len=1460 [TCP segment of a reassembled PDU]"
"258","20.593728","162.159.128.232","192.168.0.200","TCP","1514","443  >  64611 [ACK] Seq=297095 Ack=521 Win=8 Len=1460 [TCP segment of a reassembled PDU]"
"259","20.593728","162.159.128.232","192.168.0.200","TCP","1514","443  >  64611 [ACK] Seq=298555 Ack=521 Win=8 Len=1460 [TCP segment of a reassembled PDU]"
"260","20.593728","162.159.128.232","192.168.0.200","TCP","1514","443  >  64611 [ACK] Seq=300015 Ack=521 Win=8 Len=1460 [TCP segment of a reassembled PDU]"
"261","20.593728","162.159.128.232","192.168.0.200","TLSv1.2","665","Application Data, Application Data"
"262","20.593797","192.168.0.200","162.159.128.232","TCP","54","64611  >  443 [ACK] Seq=556 Ack=302086 Win=1028 Len=0"
"263","20.647632","162.159.128.232","192.168.0.200","TCP","60","443  >  64611 [ACK] Seq=302086 Ack=556 Win=8 Len=0"
"264","23.514007","192.168.0.200","162.159.128.232","TLSv1.2","258","Application Data"
"265","23.527288","162.159.128.232","192.168.0.200","TCP","60","443  >  64611 [ACK] Seq=302086 Ack=760 Win=7 Len=0"
"266","23.745527","162.159.128.232","192.168.0.200","TLSv1.2","416","Application Data"
"267","23.745577","162.159.128.232","192.168.0.200","TCP","1514","443  >  64611 [ACK] Seq=302448 Ack=760 Win=8 Len=1460 [TCP segment of a reassembled PDU]"
"268","23.745577","162.159.128.232","192.168.0.200","TCP","1514","443  >  64611 [ACK] Seq=303908 Ack=760 Win=8 Len=1460 [TCP segment of a reassembled PDU]"
"269","23.745577","162.159.128.232","192.168.0.200","TLSv1.2","623","Application Data"
"270","23.745577","162.159.128.232","192.168.0.200","TCP","1514","443  >  64611 [ACK] Seq=305937 Ack=760 Win=8 Len=1460 [TCP segment of a reassembled PDU]"
"271","23.745622","162.159.128.232","192.168.0.200","TCP","1514","443  >  64611 [ACK] Seq=307397 Ack=760 Win=8 Len=1460 [TCP segment of a reassembled PDU]"
"272","23.745622","162.159.128.232","192.168.0.200","TCP","1514","443  >  64611 [ACK] Seq=308857 Ack=760 Win=8 Len=1460 [TCP segment of a reassembled PDU]"
"273","23.745622","162.159.128.232","192.168.0.200","TCP","1514","443  >  64611 [ACK] Seq=310317 Ack=760 Win=8 Len=1460 [TCP segment of a reassembled PDU]"
"274","23.745622","162.159.128.232","192.168.0.200","TCP","1514","443  >  64611 [ACK] Seq=311777 Ack=760 Win=8 Len=1460 [TCP segment of a reassembled PDU]"
"275","23.745661","192.168.0.200","162.159.128.232","TCP","54","64611  >  443 [ACK] Seq=760 Ack=307397 Win=1028 Len=0"
"276","23.745703","192.168.0.200","162.159.128.232","TCP","54","64611  >  443 [ACK] Seq=760 Ack=313237 Win=1028 Len=0"
"277","23.745983","162.159.128.232","192.168.0.200","TCP","1514","443  >  64611 [ACK] Seq=313237 Ack=760 Win=8 Len=1460 [TCP segment of a reassembled PDU]"
"278","23.745983","162.159.128.232","192.168.0.200","TCP","1514","443  >  64611 [ACK] Seq=314697 Ack=760 Win=8 Len=1460 [TCP segment of a reassembled PDU]"
"279","23.746120","162.159.128.232","192.168.0.200","TCP","1514","443  >  64611 [ACK] Seq=316157 Ack=760 Win=8 Len=1460 [TCP segment of a reassembled PDU]"
"280","23.746120","162.159.128.232","192.168.0.200","TCP","1514","443  >  64611 [ACK] Seq=317617 Ack=760 Win=8 Len=1460 [TCP segment of a reassembled PDU]"
"281","23.746120","162.159.128.232","192.168.0.200","TCP","1514","443  >  64611 [ACK] Seq=319077 Ack=760 Win=8 Len=1460 [TCP segment of a reassembled PDU]"
"282","23.746120","162.159.128.232","192.168.0.200","TCP","1514","443  >  64611 [ACK] Seq=320537 Ack=760 Win=8 Len=1460 [TCP segment of a reassembled PDU]"
"283","23.746120","162.159.128.232","192.168.0.200","TLSv1.2","400","Application Data"
"284","23.746120","162.159.128.232","192.168.0.200","TCP","1514","443  >  64611 [ACK] Seq=322343 Ack=760 Win=8 Len=1460 [TCP segment of a reassembled PDU]"
"285","23.746133","192.168.0.200","162.159.128.232","TCP","54","64611  >  443 [ACK] Seq=760 Ack=316157 Win=1028 Len=0"
"286","23.746177","192.168.0.200","162.159.128.232","TCP","54","64611  >  443 [ACK] Seq=760 Ack=323803 Win=1028 Len=0"
"287","23.746347","162.159.128.232","192.168.0.200","TCP","1514","443  >  64611 [ACK] Seq=323803 Ack=760 Win=8 Len=1460 [TCP segment of a reassembled PDU]"
"288","23.746392","192.168.0.200","162.159.128.232","TCP","54","64611  >  443 [ACK] Seq=760 Ack=325263 Win=1028 Len=0"
"289","23.746481","162.159.128.232","192.168.0.200","TCP","1514","443  >  64611 [ACK] Seq=325263 Ack=760 Win=8 Len=1460 [TCP segment of a reassembled PDU]"
"290","23.746481","162.159.128.232","192.168.0.200","TCP","1514","443  >  64611 [ACK] Seq=326723 Ack=760 Win=8 Len=1460 [TCP segment of a reassembled PDU]"
"291","23.746481","162.159.128.232","192.168.0.200","TCP","1514","443  >  64611 [ACK] Seq=328183 Ack=760 Win=8 Len=1460 [TCP segment of a reassembled PDU]"
"292","23.746481","162.159.128.232","192.168.0.200","TCP","1514","443  >  64611 [ACK] Seq=329643 Ack=760 Win=8 Len=1460 [TCP segment of a reassembled PDU]"
"293","23.746481","162.159.128.232","192.168.0.200","TCP","1514","443  >  64611 [ACK] Seq=331103 Ack=760 Win=8 Len=1460 [TCP segment of a reassembled PDU]"
"294","23.746481","162.159.128.232","192.168.0.200","TCP","1514","443  >  64611 [ACK] Seq=332563 Ack=760 Win=8 Len=1460 [TCP segment of a reassembled PDU]"
"295","23.746481","162.159.128.232","192.168.0.200","TCP","1514","443  >  64611 [ACK] Seq=334023 Ack=760 Win=8 Len=1460 [TCP segment of a reassembled PDU]"
"296","23.746481","162.159.128.232","192.168.0.200","TCP","1514","443  >  64611 [ACK] Seq=335483 Ack=760 Win=8 Len=1460 [TCP segment of a reassembled PDU]"
"297","23.746481","162.159.128.232","192.168.0.200","TCP","1514","443  >  64611 [ACK] Seq=336943 Ack=760 Win=8 Len=1460 [TCP segment of a reassembled PDU]"
"298","23.746481","162.159.128.232","192.168.0.200","TLSv1.2","400","Application Data"
"299","23.746481","162.159.128.232","192.168.0.200","TLSv1.2","1514","Application Data"
"300","23.746541","192.168.0.200","162.159.128.232","TCP","54","64611  >  443 [ACK] Seq=760 Ack=340209 Win=1028 Len=0"
"301","23.746556","162.159.128.232","192.168.0.200","TCP","1514","443  >  64611 [ACK] Seq=340209 Ack=760 Win=8 Len=1460 [TCP segment of a reassembled PDU]"
"302","23.746556","162.159.128.232","192.168.0.200","TCP","1514","443  >  64611 [ACK] Seq=341669 Ack=760 Win=8 Len=1460 [TCP segment of a reassembled PDU]"
"303","23.746556","162.159.128.232","192.168.0.200","TCP","1514","443  >  64611 [ACK] Seq=343129 Ack=760 Win=8 Len=1460 [TCP segment of a reassembled PDU]"
"304","23.746556","162.159.128.232","192.168.0.200","TCP","1514","443  >  64611 [ACK] Seq=344589 Ack=760 Win=8 Len=1460 [TCP segment of a reassembled PDU]"
"305","23.746556","162.159.128.232","192.168.0.200","TCP","1514","443  >  64611 [ACK] Seq=346049 Ack=760 Win=8 Len=1460 [TCP segment of a reassembled PDU]"
"306","23.746556","162.159.128.232","192.168.0.200","TCP","1514","443  >  64611 [ACK] Seq=347509 Ack=760 Win=8 Len=1460 [TCP segment of a reassembled PDU]"
"307","23.746556","162.159.128.232","192.168.0.200","TCP","1514","443  >  64611 [ACK] Seq=348969 Ack=760 Win=8 Len=1460 [TCP segment of a reassembled PDU]"
"308","23.746596","192.168.0.200","162.159.128.232","TCP","54","64611  >  443 [ACK] Seq=760 Ack=350429 Win=1028 Len=0"
"309","23.746687","162.159.128.232","192.168.0.200","TCP","1514","443  >  64611 [ACK] Seq=350429 Ack=760 Win=8 Len=1460 [TCP segment of a reassembled PDU]"
"310","23.746687","162.159.128.232","192.168.0.200","TCP","1514","443  >  64611 [ACK] Seq=351889 Ack=760 Win=8 Len=1460 [TCP segment of a reassembled PDU]"
"311","23.746687","162.159.128.232","192.168.0.200","TCP","1514","443  >  64611 [ACK] Seq=353349 Ack=760 Win=8 Len=1460 [TCP segment of a reassembled PDU]"
"312","23.746687","162.159.128.232","192.168.0.200","TLSv1.2","458","Application Data"
"313","23.746687","162.159.128.232","192.168.0.200","TCP","1514","443  >  64611 [ACK] Seq=355213 Ack=760 Win=8 Len=1460 [TCP segment of a reassembled PDU]"
"314","23.746687","162.159.128.232","192.168.0.200","TCP","1514","443  >  64611 [ACK] Seq=356673 Ack=760 Win=8 Len=1460 [TCP segment of a reassembled PDU]"
"315","23.746687","162.159.128.232","192.168.0.200","TCP","1514","443  >  64611 [ACK] Seq=358133 Ack=760 Win=8 Len=1460 [TCP segment of a reassembled PDU]"
"316","23.746687","162.159.128.232","192.168.0.200","TCP","1514","443  >  64611 [ACK] Seq=359593 Ack=760 Win=8 Len=1460 [TCP segment of a reassembled PDU]"
"317","23.746687","162.159.128.232","192.168.0.200","TCP","1514","443  >  64611 [ACK] Seq=361053 Ack=760 Win=8 Len=1460 [TCP segment of a reassembled PDU]"
"318","23.746687","162.159.128.232","192.168.0.200","TCP","1514","443  >  64611 [ACK] Seq=362513 Ack=760 Win=8 Len=1460 [TCP segment of a reassembled PDU]"
"319","23.746687","162.159.128.232","192.168.0.200","TCP","1514","443  >  64611 [ACK] Seq=363973 Ack=760 Win=8 Len=1460 [TCP segment of a reassembled PDU]"
"320","23.746749","192.168.0.200","162.159.128.232","TCP","54","64611  >  443 [ACK] Seq=760 Ack=365433 Win=1028 Len=0"
"321","23.746818","162.159.128.232","192.168.0.200","TCP","1514","443  >  64611 [ACK] Seq=365433 Ack=760 Win=8 Len=1460 [TCP segment of a reassembled PDU]"
"322","23.746818","162.159.128.232","192.168.0.200","TCP","1514","443  >  64611 [ACK] Seq=366893 Ack=760 Win=8 Len=1460 [TCP segment of a reassembled PDU]"
"323","23.746853","192.168.0.200","162.159.128.232","TCP","54","64611  >  443 [ACK] Seq=760 Ack=368353 Win=1028 Len=0"
"324","23.746952","162.159.128.232","192.168.0.200","TCP","1514","443  >  64611 [ACK] Seq=368353 Ack=760 Win=8 Len=1460 [TCP segment of a reassembled PDU]"
"325","23.746952","162.159.128.232","192.168.0.200","TCP","1514","443  >  64611 [ACK] Seq=369813 Ack=760 Win=8 Len=1460 [TCP segment of a reassembled PDU]"
"326","23.746952","162.159.128.232","192.168.0.200","TLSv1.2","1514","Application Data, Application Data"
"327","23.746952","162.159.128.232","192.168.0.200","TCP","1514","443  >  64611 [ACK] Seq=372733 Ack=760 Win=8 Len=1460 [TCP segment of a reassembled PDU]"
"328","23.746952","162.159.128.232","192.168.0.200","TCP","1514","443  >  64611 [ACK] Seq=374193 Ack=760 Win=8 Len=1460 [TCP segment of a reassembled PDU]"
"329","23.746952","162.159.128.232","192.168.0.200","TCP","1514","443  >  64611 [ACK] Seq=375653 Ack=760 Win=8 Len=1460 [TCP segment of a reassembled PDU]"
"330","23.746989","192.168.0.200","162.159.128.232","TCP","54","64611  >  443 [ACK] Seq=760 Ack=377113 Win=1028 Len=0"
"331","23.747030","162.159.128.232","192.168.0.200","TCP","1514","443  >  64611 [ACK] Seq=377113 Ack=760 Win=8 Len=1460 [TCP segment of a reassembled PDU]"
"332","23.747030","162.159.128.232","192.168.0.200","TCP","1514","443  >  64611 [ACK] Seq=378573 Ack=760 Win=8 Len=1460 [TCP segment of a reassembled PDU]"
"333","23.747030","162.159.128.232","192.168.0.200","TCP","1514","443  >  64611 [ACK] Seq=380033 Ack=760 Win=8 Len=1460 [TCP segment of a reassembled PDU]"
"334","23.747030","162.159.128.232","192.168.0.200","TCP","1514","443  >  64611 [ACK] Seq=381493 Ack=760 Win=8 Len=1460 [TCP segment of a reassembled PDU]"
"335","23.747030","162.159.128.232","192.168.0.200","TCP","1514","443  >  64611 [ACK] Seq=382953 Ack=760 Win=8 Len=1460 [TCP segment of a reassembled PDU]"
"336","23.747030","162.159.128.232","192.168.0.200","TCP","1514","443  >  64611 [ACK] Seq=384413 Ack=760 Win=8 Len=1460 [TCP segment of a reassembled PDU]"
"337","23.747072","192.168.0.200","162.159.128.232","TCP","54","64611  >  443 [ACK] Seq=760 Ack=385873 Win=1028 Len=0"
"338","23.747188","162.159.128.232","192.168.0.200","TCP","1514","443  >  64611 [ACK] Seq=385873 Ack=760 Win=8 Len=1460 [TCP segment of a reassembled PDU]"
"339","23.747188","162.159.128.232","192.168.0.200","TLSv1.2","1514","Application Data"
"340","23.747188","162.159.128.232","192.168.0.200","TCP","1514","443  >  64611 [ACK] Seq=388793 Ack=760 Win=8 Len=1460 [TCP segment of a reassembled PDU]"
"341","23.747308","192.168.0.200","162.159.128.232","TCP","54","64611  >  443 [ACK] Seq=760 Ack=390253 Win=1028 Len=0"
"342","23.747326","162.159.128.232","192.168.0.200","TCP","1514","443  >  64611 [ACK] Seq=390253 Ack=760 Win=8 Len=1460 [TCP segment of a reassembled PDU]"
"343","23.747326","162.159.128.232","192.168.0.200","TCP","1514","443  >  64611 [ACK] Seq=391713 Ack=760 Win=8 Len=1460 [TCP segment of a reassembled PDU]"
"344","23.747326","162.159.128.232","192.168.0.200","TCP","1514","443  >  64611 [ACK] Seq=393173 Ack=760 Win=8 Len=1460 [TCP segment of a reassembled PDU]"
"345","23.747326","162.159.128.232","192.168.0.200","TLSv1.2","1448","Application Data"
"346","23.747326","162.159.128.232","192.168.0.200","TCP","1514","443  >  64611 [ACK] Seq=396027 Ack=760 Win=8 Len=1460 [TCP segment of a reassembled PDU]"
"347","23.747326","162.159.128.232","192.168.0.200","TCP","1514","443  >  64611 [ACK] Seq=397487 Ack=760 Win=8 Len=1460 [TCP segment of a reassembled PDU]"
"348","23.747326","162.159.128.232","192.168.0.200","TCP","1514","443  >  64611 [ACK] Seq=398947 Ack=760 Win=8 Len=1460 [TCP segment of a reassembled PDU]"
"349","23.747397","192.168.0.200","162.159.128.232","TCP","54","64611  >  443 [ACK] Seq=760 Ack=400407 Win=1028 Len=0"
"350","23.747403","162.159.128.232","192.168.0.200","TCP","1514","443  >  64611 [ACK] Seq=400407 Ack=760 Win=8 Len=1460 [TCP segment of a reassembled PDU]"
"351","23.747403","162.159.128.232","192.168.0.200","TCP","1514","443  >  64611 [ACK] Seq=401867 Ack=760 Win=8 Len=1460 [TCP segment of a reassembled PDU]"
"352","23.747403","162.159.128.232","192.168.0.200","TCP","1514","443  >  64611 [ACK] Seq=403327 Ack=760 Win=8 Len=1460 [TCP segment of a reassembled PDU]"
"353","23.747403","162.159.128.232","192.168.0.200","TCP","1514","443  >  64611 [ACK] Seq=404787 Ack=760 Win=8 Len=1460 [TCP segment of a reassembled PDU]"
"354","23.747403","162.159.128.232","192.168.0.200","TCP","1514","443  >  64611 [ACK] Seq=406247 Ack=760 Win=8 Len=1460 [TCP segment of a reassembled PDU]"
"355","23.747403","162.159.128.232","192.168.0.200","TCP","1514","443  >  64611 [ACK] Seq=407707 Ack=760 Win=8 Len=1460 [TCP segment of a reassembled PDU]"
"356","23.747403","162.159.128.232","192.168.0.200","TCP","1514","443  >  64611 [ACK] Seq=409167 Ack=760 Win=8 Len=1460 [TCP segment of a reassembled PDU]"
"357","23.747403","162.159.128.232","192.168.0.200","TCP","1514","443  >  64611 [ACK] Seq=410627 Ack=760 Win=8 Len=1460 [TCP segment of a reassembled PDU]"
"358","23.747478","192.168.0.200","162.159.128.232","TCP","54","64611  >  443 [ACK] Seq=760 Ack=412087 Win=1028 Len=0"
"359","23.747534","162.159.128.232","192.168.0.200","TLSv1.2","1514","Application Data, Application Data"
"360","23.747534","162.159.128.232","192.168.0.200","TCP","1514","443  >  64611 [ACK] Seq=413547 Ack=760 Win=8 Len=1460 [TCP segment of a reassembled PDU]"
"361","23.747534","162.159.128.232","192.168.0.200","TCP","1514","443  >  64611 [ACK] Seq=415007 Ack=760 Win=8 Len=1460 [TCP segment of a reassembled PDU]"
"362","23.747534","162.159.128.232","192.168.0.200","TCP","1514","443  >  64611 [ACK] Seq=416467 Ack=760 Win=8 Len=1460 [TCP segment of a reassembled PDU]"
"363","23.747534","162.159.128.232","192.168.0.200","TCP","1514","443  >  64611 [ACK] Seq=417927 Ack=760 Win=8 Len=1460 [TCP segment of a reassembled PDU]"
"364","23.747534","162.159.128.232","192.168.0.200","TCP","1514","443  >  64611 [ACK] Seq=419387 Ack=760 Win=8 Len=1460 [TCP segment of a reassembled PDU]"
"365","23.747534","162.159.128.232","192.168.0.200","TCP","1514","443  >  64611 [ACK] Seq=420847 Ack=760 Win=8 Len=1460 [TCP segment of a reassembled PDU]"
"366","23.747534","162.159.128.232","192.168.0.200","TCP","1514","443  >  64611 [ACK] Seq=422307 Ack=760 Win=8 Len=1460 [TCP segment of a reassembled PDU]"
"367","23.747534","162.159.128.232","192.168.0.200","TLSv1.2","1088","Application Data"
"368","23.747534","162.159.128.232","192.168.0.200","TCP","1514","443  >  64611 [ACK] Seq=424801 Ack=760 Win=8 Len=1460 [TCP segment of a reassembled PDU]"
"369","23.747534","162.159.128.232","192.168.0.200","TCP","1514","443  >  64611 [ACK] Seq=426261 Ack=760 Win=8 Len=1460 [TCP segment of a reassembled PDU]"
"370","23.747638","192.168.0.200","162.159.128.232","TCP","54","64611  >  443 [ACK] Seq=760 Ack=427721 Win=1028 Len=0"
"371","23.747689","162.159.128.232","192.168.0.200","TCP","1514","443  >  64611 [ACK] Seq=427721 Ack=760 Win=8 Len=1460 [TCP segment of a reassembled PDU]"
"372","23.747689","162.159.128.232","192.168.0.200","TCP","1514","443  >  64611 [ACK] Seq=429181 Ack=760 Win=8 Len=1460 [TCP segment of a reassembled PDU]"
"373","23.747689","162.159.128.232","192.168.0.200","TCP","1514","443  >  64611 [ACK] Seq=430641 Ack=760 Win=8 Len=1460 [TCP segment of a reassembled PDU]"
"374","23.747689","162.159.128.232","192.168.0.200","TCP","1514","443  >  64611 [ACK] Seq=432101 Ack=760 Win=8 Len=1460 [TCP segment of a reassembled PDU]"
"375","23.747689","162.159.128.232","192.168.0.200","TCP","1514","443  >  64611 [ACK] Seq=433561 Ack=760 Win=8 Len=1460 [TCP segment of a reassembled PDU]"
"376","23.747689","162.159.128.232","192.168.0.200","TCP","1514","443  >  64611 [ACK] Seq=435021 Ack=760 Win=8 Len=1460 [TCP segment of a reassembled PDU]"
"377","23.747689","162.159.128.232","192.168.0.200","TCP","1514","443  >  64611 [ACK] Seq=436481 Ack=760 Win=8 Len=1460 [TCP segment of a reassembled PDU]"
"378","23.747689","162.159.128.232","192.168.0.200","TCP","1514","443  >  64611 [ACK] Seq=437941 Ack=760 Win=8 Len=1460 [TCP segment of a reassembled PDU]"
"379","23.747689","162.159.128.232","192.168.0.200","TCP","1514","443  >  64611 [ACK] Seq=439401 Ack=760 Win=8 Len=1460 [TCP segment of a reassembled PDU]"
"380","23.747689","162.159.128.232","192.168.0.200","TLSv1.2","1514","Application Data"
"381","23.747689","162.159.128.232","192.168.0.200","TCP","1514","443  >  64611 [ACK] Seq=442321 Ack=760 Win=8 Len=1460 [TCP segment of a reassembled PDU]"
"382","23.747689","162.159.128.232","192.168.0.200","TCP","1514","443  >  64611 [ACK] Seq=443781 Ack=760 Win=8 Len=1460 [TCP segment of a reassembled PDU]"
"383","23.747689","162.159.128.232","192.168.0.200","TLSv1.2","1514","Application Data"
"384","23.747739","192.168.0.200","162.159.128.232","TCP","54","64611  >  443 [ACK] Seq=760 Ack=446701 Win=1028 Len=0"
"385","23.748054","162.159.128.232","192.168.0.200","TCP","1514","443  >  64611 [ACK] Seq=446701 Ack=760 Win=8 Len=1460 [TCP segment of a reassembled PDU]"
"386","23.748054","162.159.128.232","192.168.0.200","TCP","1514","443  >  64611 [ACK] Seq=448161 Ack=760 Win=8 Len=1460 [TCP segment of a reassembled PDU]"
"387","23.748054","162.159.128.232","192.168.0.200","TCP","1514","443  >  64611 [ACK] Seq=449621 Ack=760 Win=8 Len=1460 [TCP segment of a reassembled PDU]"
"388","23.748054","162.159.128.232","192.168.0.200","TCP","1514","443  >  64611 [ACK] Seq=451081 Ack=760 Win=8 Len=1460 [TCP segment of a reassembled PDU]"
"389","23.748054","162.159.128.232","192.168.0.200","TCP","1514","443  >  64611 [ACK] Seq=452541 Ack=760 Win=8 Len=1460 [TCP segment of a reassembled PDU]"
"390","23.748054","162.159.128.232","192.168.0.200","TCP","1514","443  >  64611 [ACK] Seq=454001 Ack=760 Win=8 Len=1460 [TCP segment of a reassembled PDU]"
"391","23.748054","162.159.128.232","192.168.0.200","TCP","1514","443  >  64611 [ACK] Seq=455461 Ack=760 Win=8 Len=1460 [TCP segment of a reassembled PDU]"
"392","23.748054","162.159.128.232","192.168.0.200","TLSv1.2","1514","Application Data"
"393","23.748054","162.159.128.232","192.168.0.200","TCP","1514","443  >  64611 [ACK] Seq=458381 Ack=760 Win=8 Len=1460 [TCP segment of a reassembled PDU]"
"394","23.748054","162.159.128.232","192.168.0.200","TCP","1514","443  >  64611 [ACK] Seq=459841 Ack=760 Win=8 Len=1460 [TCP segment of a reassembled PDU]"
"395","23.748054","162.159.128.232","192.168.0.200","TCP","1514","443  >  64611 [ACK] Seq=461301 Ack=760 Win=8 Len=1460 [TCP segment of a reassembled PDU]"
"396","23.748054","162.159.128.232","192.168.0.200","TCP","1514","443  >  64611 [ACK] Seq=462761 Ack=760 Win=8 Len=1460 [TCP segment of a reassembled PDU]"
"397","23.748054","162.159.128.232","192.168.0.200","TCP","1514","443  >  64611 [ACK] Seq=464221 Ack=760 Win=8 Len=1460 [TCP segment of a reassembled PDU]"
"398","23.748054","162.159.128.232","192.168.0.200","TLSv1.2","1514","Application Data"
"399","23.748054","162.159.128.232","192.168.0.200","TLSv1.2","891","Application Data, Application Data"
"400","23.748153","192.168.0.200","162.159.128.232","TCP","54","64611  >  443 [ACK] Seq=760 Ack=467978 Win=1028 Len=0"
