"No.","Time","Source","Destination","Protocol","Length","Info"
"8","1.330808","162.159.130.234","192.168.0.92","TLSv1.2","178","Application Data"
"9","1.330952","192.168.0.92","162.159.130.234","TCP","66","64024  >  443 [ACK] Seq=1 Ack=113 Win=2048 Len=0 TSval=785801656 TSecr=4163967455"
"11","1.519804","192.168.0.92","162.159.128.233","TLSv1.2","250","Application Data"
"12","1.520598","192.168.0.92","162.159.128.233","TLSv1.2","130","Application Data"
"13","1.520802","192.168.0.92","162.159.128.233","TLSv1.2","97","Application Data"
"14","1.543258","162.159.128.233","192.168.0.92","TCP","66","443  >  64115 [ACK] Seq=1 Ack=185 Win=7 Len=0 TSval=1288158136 TSecr=1061812703"
"15","1.543259","162.159.128.233","192.168.0.92","TCP","66","443  >  64115 [ACK] Seq=1 Ack=249 Win=7 Len=0 TSval=1288158136 TSecr=1061812703"
"16","1.543259","162.159.128.233","192.168.0.92","TCP","66","443  >  64115 [ACK] Seq=1 Ack=280 Win=7 Len=0 TSval=1288158136 TSecr=1061812704"
"17","1.565662","162.159.130.234","192.168.0.92","TLSv1.2","379","Application Data"
"18","1.565870","192.168.0.92","162.159.130.234","TCP","66","64024  >  443 [ACK] Seq=1 Ack=426 Win=2048 Len=0 TSval=785801891 TSecr=4163967749"
"19","1.586483","162.159.128.233","192.168.0.92","TLSv1.2","352","Application Data"
"20","1.586484","162.159.128.233","192.168.0.92","TLSv1.2","111","Application Data"
"21","1.586484","162.159.128.233","192.168.0.92","TLSv1.2","97","Application Data"
"22","1.586590","192.168.0.92","162.159.128.233","TCP","66","64115  >  443 [ACK] Seq=280 Ack=363 Win=2042 Len=0 TSval=1061812770 TSecr=1288158179"
"23","1.591748","162.159.130.234","192.168.0.92","TLSv1.2","169","Application Data"
"24","1.591887","192.168.0.92","162.159.130.234","TCP","66","64024  >  443 [ACK] Seq=1 Ack=529 Win=2048 Len=0 TSval=785801917 TSecr=4163967776"
"27","1.903514","162.159.130.234","192.168.0.92","TLSv1.2","118","Application Data"
"29","1.903698","192.168.0.92","162.159.130.234","TCP","66","64024  >  443 [ACK] Seq=1 Ack=581 Win=2048 Len=0 TSval=785802229 TSecr=4163968064"
"37","2.764452","162.159.130.234","192.168.0.92","TLSv1.2","290","Application Data"
"42","2.764694","192.168.0.92","162.159.130.234","TCP","66","64024  >  443 [ACK] Seq=1 Ack=805 Win=2048 Len=0 TSval=785803090 TSecr=4163968844"
"48","3.172128","162.159.130.234","192.168.0.92","TLSv1.2","112","Application Data"
"49","3.172296","192.168.0.92","162.159.130.234","TCP","66","64024  >  443 [ACK] Seq=1 Ack=851 Win=2048 Len=0 TSval=785803498 TSecr=4163969272"
"50","3.248064","162.159.130.234","192.168.0.92","TLSv1.2","117","Application Data"
"51","3.248232","192.168.0.92","162.159.130.234","TCP","66","64024  >  443 [ACK] Seq=1 Ack=902 Win=2048 Len=0 TSval=785803573 TSecr=4163969432"
"52","3.305084","192.168.0.92","162.159.128.233","TLSv1.2","246","Application Data"
"54","3.324357","162.159.128.233","192.168.0.92","TCP","66","443  >  64115 [ACK] Seq=363 Ack=460 Win=7 Len=0 TSval=1288159916 TSecr=1061814488"
"55","3.411305","162.159.128.233","192.168.0.92","TLSv1.2","365","Application Data"
"56","3.411306","162.159.128.233","192.168.0.92","TLSv1.2","1457","Application Data"
"57","3.411307","162.159.128.233","192.168.0.92","TLSv1.2","1514","Application Data"
"58","3.411407","192.168.0.92","162.159.128.233","TCP","66","64115  >  443 [ACK] Seq=460 Ack=3501 Win=1998 Len=0 TSval=1061814595 TSecr=1288160005"
"59","3.411593","192.168.0.92","162.159.128.233","TCP","66","[TCP Window Update] 64115  >  443 [ACK] Seq=460 Ack=3501 Win=2048 Len=0 TSval=1061814595 TSecr=1288160005"
"60","3.415053","162.159.128.233","192.168.0.92","TLSv1.2","1400","Application Data"
"61","3.415056","162.159.128.233","192.168.0.92","TLSv1.2","1514","Application Data"
"62","3.415057","162.159.128.233","192.168.0.92","TLSv1.2","1271","Application Data"
"63","3.415058","162.159.128.233","192.168.0.92","TLSv1.2","97","Application Data"
"64","3.415191","192.168.0.92","162.159.128.233","TCP","66","64115  >  443 [ACK] Seq=460 Ack=7519 Win=1985 Len=0 TSval=1061814599 TSecr=1288160005"
"65","3.415350","192.168.0.92","162.159.128.233","TCP","66","[TCP Window Update] 64115  >  443 [ACK] Seq=460 Ack=7519 Win=2048 Len=0 TSval=1061814599 TSecr=1288160005"
"66","3.683729","162.159.130.234","192.168.0.92","TLSv1.2","284","Application Data"
"68","3.683779","162.159.130.234","192.168.0.92","TLSv1.2","112","Application Data"
"69","3.683982","192.168.0.92","162.159.130.234","TCP","66","64024  >  443 [ACK] Seq=1 Ack=1166 Win=2048 Len=0 TSval=785804009 TSecr=4163969818"
"77","4.330148","192.168.0.92","162.159.128.233","TLSv1.2","215","Application Data"
"78","4.331077","192.168.0.92","162.159.128.233","TLSv1.2","136","Application Data"
"79","4.348286","162.159.128.233","192.168.0.92","TCP","66","443  >  64115 [ACK] Seq=7519 Ack=609 Win=7 Len=0 TSval=1288160938 TSecr=1061815514"
"80","4.348294","162.159.128.233","192.168.0.92","TCP","66","443  >  64115 [ACK] Seq=7519 Ack=679 Win=7 Len=0 TSval=1288160938 TSecr=1061815514"
"81","4.364808","192.168.0.92","162.159.128.233","TLSv1.2","233","Application Data"
"82","4.365071","192.168.0.92","162.159.128.233","TLSv1.2","260","Application Data"
"83","4.380924","162.159.128.233","192.168.0.92","TCP","66","443  >  64115 [ACK] Seq=7519 Ack=846 Win=7 Len=0 TSval=1288160974 TSecr=1061815548"
"84","4.380925","162.159.128.233","192.168.0.92","TCP","66","443  >  64115 [ACK] Seq=7519 Ack=1040 Win=7 Len=0 TSval=1288160974 TSecr=1061815548"
"85","4.390531","162.159.130.234","192.168.0.92","TLSv1.2","125","Application Data"
"86","4.390641","192.168.0.92","162.159.130.234","TCP","66","64024  >  443 [ACK] Seq=1 Ack=1225 Win=2048 Len=0 TSval=785804716 TSecr=4163970575"
"87","4.446025","162.159.128.233","192.168.0.92","TLSv1.2","359","Application Data"
"88","4.446139","192.168.0.92","162.159.128.233","TCP","66","64115  >  443 [ACK] Seq=1040 Ack=7812 Win=2043 Len=0 TSval=1061815629 TSecr=1288161038"
"89","4.501357","162.159.130.234","192.168.0.92","TLSv1.2","439","Application Data"
"90","4.501495","192.168.0.92","162.159.130.234","TCP","66","64024  >  443 [ACK] Seq=1 Ack=1598 Win=2048 Len=0 TSval=785804827 TSecr=4163970672"
"91","4.510508","162.159.128.233","192.168.0.92","TLSv1.2","413","Application Data"
"92","4.510509","162.159.128.233","192.168.0.92","TLSv1.2","778","Application Data"
"93","4.510510","162.159.128.233","192.168.0.92","TLSv1.2","97","Application Data"
"94","4.510590","192.168.0.92","162.159.128.233","TCP","66","64115  >  443 [ACK] Seq=1040 Ack=8902 Win=2030 Len=0 TSval=1061815694 TSecr=1288161103"
"95","4.518514","162.159.130.234","192.168.0.92","TLSv1.2","113","Application Data"
"96","4.518658","192.168.0.92","162.159.130.234","TCP","66","64024  >  443 [ACK] Seq=1 Ack=1645 Win=2048 Len=0 TSval=785804844 TSecr=4163970703"
"97","4.527247","162.159.130.234","192.168.0.92","TLSv1.2","297","Application Data"
"98","4.527404","192.168.0.92","162.159.130.234","TCP","66","64024  >  443 [ACK] Seq=1 Ack=1876 Win=2048 Len=0 TSval=785804853 TSecr=4163970712"
"99","4.541383","162.159.130.234","192.168.0.92","TLSv1.2","279","Application Data"
"100","4.541517","192.168.0.92","162.159.130.234","TCP","66","64024  >  443 [ACK] Seq=1 Ack=2089 Win=2048 Len=0 TSval=785804867 TSecr=4163970726"
"102","4.631633","162.159.130.234","192.168.0.92","TLSv1.2","340","Application Data"
"103","4.631785","192.168.0.92","162.159.130.234","TCP","66","64024  >  443 [ACK] Seq=1 Ack=2363 Win=2048 Len=0 TSval=785804957 TSecr=4163970816"
"105","5.118650","162.159.130.234","192.168.0.92","TLSv1.2","113","Application Data"
"106","5.118810","192.168.0.92","162.159.130.234","TCP","66","64024  >  443 [ACK] Seq=1 Ack=2410 Win=2048 Len=0 TSval=785805444 TSecr=4163971207"
"109","5.628712","162.159.130.234","192.168.0.92","TLSv1.2","117","Application Data"
"110","5.628891","192.168.0.92","162.159.130.234","TCP","66","64024  >  443 [ACK] Seq=1 Ack=2461 Win=2048 Len=0 TSval=785805954 TSecr=4163971770"
"111","5.705680","162.159.130.234","192.168.0.92","TLSv1.2","213","Application Data"
"112","5.705813","192.168.0.92","162.159.130.234","TCP","66","64024  >  443 [ACK] Seq=1 Ack=2608 Win=2048 Len=0 TSval=785806031 TSecr=4163971888"
"113","5.748309","162.159.130.234","192.168.0.92","TLSv1.2","126","Application Data"
"114","5.748430","192.168.0.92","162.159.130.234","TCP","66","64024  >  443 [ACK] Seq=1 Ack=2668 Win=2048 Len=0 TSval=785806074 TSecr=4163971933"
"116","5.821524","162.159.130.234","192.168.0.92","TLSv1.2","112","Application Data"
"117","5.821668","192.168.0.92","162.159.130.234","TCP","66","64024  >  443 [ACK] Seq=1 Ack=2714 Win=2048 Len=0 TSval=785806147 TSecr=4163972006"
"118","5.825094","162.159.130.234","192.168.0.92","TLSv1.2","116","Application Data"
"119","5.825559","192.168.0.92","162.159.130.234","TCP","66","64024  >  443 [ACK] Seq=1 Ack=2764 Win=2048 Len=0 TSval=785806151 TSecr=4163972010"
"126","6.357767","162.159.130.234","192.168.0.92","TLSv1.2","233","Application Data"
"127","6.357902","192.168.0.92","162.159.130.234","TCP","66","64024  >  443 [ACK] Seq=1 Ack=2931 Win=2048 Len=0 TSval=785806683 TSecr=4163972542"
"128","6.533691","192.168.0.92","162.159.128.232","TLSv1.2","230","Application Data"
"129","6.563937","162.159.128.232","192.168.0.92","TLSv1.2","224","Application Data"
"130","6.563938","162.159.128.232","192.168.0.92","TLSv1.2","130","Application Data, Application Data"
"131","6.564037","192.168.0.92","162.159.128.232","TCP","66","64118  >  443 [ACK] Seq=165 Ack=223 Win=9830 Len=0 TSval=2629030212 TSecr=3702279749"
"132","6.573037","192.168.0.92","162.159.128.232","TLSv1.2","212","Application Data"
"133","6.602504","162.159.128.232","192.168.0.92","TLSv1.2","158","Application Data"
"134","6.602506","162.159.128.232","192.168.0.92","TCP","1514","443  >  64118 [ACK] Seq=315 Ack=311 Win=8 Len=1448 TSval=3702279783 TSecr=2629030221 [TCP segment of a reassembled PDU]"
"135","6.602507","162.159.128.232","192.168.0.92","TCP","1514","443  >  64118 [ACK] Seq=1763 Ack=311 Win=8 Len=1448 TSval=3702279783 TSecr=2629030221 [TCP segment of a reassembled PDU]"
"136","6.602508","162.159.128.232","192.168.0.92","TCP","1514","443  >  64118 [ACK] Seq=3211 Ack=311 Win=8 Len=1448 TSval=3702279783 TSecr=2629030221 [TCP segment of a reassembled PDU]"
"137","6.602510","162.159.128.232","192.168.0.92","TCP","1514","443  >  64118 [ACK] Seq=4659 Ack=311 Win=8 Len=1448 TSval=3702279783 TSecr=2629030221 [TCP segment of a reassembled PDU]"
"138","6.602511","162.159.128.232","192.168.0.92","TCP","1514","443  >  64118 [ACK] Seq=6107 Ack=311 Win=8 Len=1448 TSval=3702279783 TSecr=2629030221 [TCP segment of a reassembled PDU]"
"139","6.602512","162.159.128.232","192.168.0.92","TCP","1514","443  >  64118 [ACK] Seq=7555 Ack=311 Win=8 Len=1448 TSval=3702279783 TSecr=2629030221 [TCP segment of a reassembled PDU]"
"140","6.602513","162.159.128.232","192.168.0.92","TCP","1514","443  >  64118 [ACK] Seq=9003 Ack=311 Win=8 Len=1448 TSval=3702279783 TSecr=2629030221 [TCP segment of a reassembled PDU]"
"141","6.602514","162.159.128.232","192.168.0.92","TCP","1514","443  >  64118 [ACK] Seq=10451 Ack=311 Win=8 Len=1448 TSval=3702279783 TSecr=2629030221 [TCP segment of a reassembled PDU]"
"142","6.602515","162.159.128.232","192.168.0.92","TCP","1514","443  >  64118 [ACK] Seq=11899 Ack=311 Win=8 Len=1448 TSval=3702279783 TSecr=2629030221 [TCP segment of a reassembled PDU]"
"143","6.602516","162.159.128.232","192.168.0.92","TCP","1514","443  >  64118 [ACK] Seq=13347 Ack=311 Win=8 Len=1448 TSval=3702279783 TSecr=2629030221 [TCP segment of a reassembled PDU]"
"144","6.602517","162.159.128.232","192.168.0.92","TCP","1514","443  >  64118 [ACK] Seq=14795 Ack=311 Win=8 Len=1448 TSval=3702279783 TSecr=2629030221 [TCP segment of a reassembled PDU]"
"145","6.602518","162.159.128.232","192.168.0.92","TLSv1.2","544","Application Data"
"146","6.602519","162.159.128.232","192.168.0.92","TCP","1514","443  >  64118 [ACK] Seq=16721 Ack=311 Win=8 Len=1448 TSval=3702279783 TSecr=2629030221 [TCP segment of a reassembled PDU]"
"147","6.602520","162.159.128.232","192.168.0.92","TCP","1514","443  >  64118 [ACK] Seq=18169 Ack=311 Win=8 Len=1448 TSval=3702279783 TSecr=2629030221 [TCP segment of a reassembled PDU]"
"148","6.602521","162.159.128.232","192.168.0.92","TCP","1514","443  >  64118 [ACK] Seq=19617 Ack=311 Win=8 Len=1448 TSval=3702279783 TSecr=2629030221 [TCP segment of a reassembled PDU]"
"149","6.602522","162.159.128.232","192.168.0.92","TCP","1514","443  >  64118 [ACK] Seq=21065 Ack=311 Win=8 Len=1448 TSval=3702279783 TSecr=2629030221 [TCP segment of a reassembled PDU]"
"150","6.602523","162.159.128.232","192.168.0.92","TCP","1514","443  >  64118 [ACK] Seq=22513 Ack=311 Win=8 Len=1448 TSval=3702279783 TSecr=2629030221 [TCP segment of a reassembled PDU]"
"151","6.602524","162.159.128.232","192.168.0.92","TCP","1514","443  >  64118 [ACK] Seq=23961 Ack=311 Win=8 Len=1448 TSval=3702279783 TSecr=2629030221 [TCP segment of a reassembled PDU]"
"152","6.602525","162.159.128.232","192.168.0.92","TCP","1514","443  >  64118 [ACK] Seq=25409 Ack=311 Win=8 Len=1448 TSval=3702279783 TSecr=2629030221 [TCP segment of a reassembled PDU]"
"153","6.602526","162.159.128.232","192.168.0.92","TCP","1514","443  >  64118 [ACK] Seq=26857 Ack=311 Win=8 Len=1448 TSval=3702279783 TSecr=2629030221 [TCP segment of a reassembled PDU]"
"154","6.602527","162.159.128.232","192.168.0.92","TCP","1514","443  >  64118 [ACK] Seq=28305 Ack=311 Win=8 Len=1448 TSval=3702279783 TSecr=2629030221 [TCP segment of a reassembled PDU]"
"155","6.602529","162.159.128.232","192.168.0.92","TCP","1514","443  >  64118 [ACK] Seq=29753 Ack=311 Win=8 Len=1448 TSval=3702279783 TSecr=2629030221 [TCP segment of a reassembled PDU]"
"156","6.602530","162.159.128.232","192.168.0.92","TCP","1514","443  >  64118 [ACK] Seq=31201 Ack=311 Win=8 Len=1448 TSval=3702279783 TSecr=2629030221 [TCP segment of a reassembled PDU]"
"157","6.602531","162.159.128.232","192.168.0.92","TLSv1.2","602","Application Data, Application Data"
"158","6.602531","162.159.128.232","192.168.0.92","TCP","1514","443  >  64118 [ACK] Seq=33185 Ack=311 Win=8 Len=1448 TSval=3702279784 TSecr=2629030221 [TCP segment of a reassembled PDU]"
"159","6.602532","162.159.128.232","192.168.0.92","TCP","1514","443  >  64118 [ACK] Seq=34633 Ack=311 Win=8 Len=1448 TSval=3702279784 TSecr=2629030221 [TCP segment of a reassembled PDU]"
"160","6.602533","162.159.128.232","192.168.0.92","TCP","1514","443  >  64118 [ACK] Seq=36081 Ack=311 Win=8 Len=1448 TSval=3702279784 TSecr=2629030221 [TCP segment of a reassembled PDU]"
"161","6.602534","162.159.128.232","192.168.0.92","TCP","1514","443  >  64118 [ACK] Seq=37529 Ack=311 Win=8 Len=1448 TSval=3702279784 TSecr=2629030221 [TCP segment of a reassembled PDU]"
"162","6.602535","162.159.128.232","192.168.0.92","TCP","1514","443  >  64118 [ACK] Seq=38977 Ack=311 Win=8 Len=1448 TSval=3702279784 TSecr=2629030221 [TCP segment of a reassembled PDU]"
"163","6.602536","162.159.128.232","192.168.0.92","TCP","1514","443  >  64118 [ACK] Seq=40425 Ack=311 Win=8 Len=1448 TSval=3702279784 TSecr=2629030221 [TCP segment of a reassembled PDU]"
"164","6.602538","162.159.128.232","192.168.0.92","TCP","1514","443  >  64118 [ACK] Seq=41873 Ack=311 Win=8 Len=1448 TSval=3702279784 TSecr=2629030221 [TCP segment of a reassembled PDU]"
"165","6.602539","162.159.128.232","192.168.0.92","TCP","1514","443  >  64118 [ACK] Seq=43321 Ack=311 Win=8 Len=1448 TSval=3702279784 TSecr=2629030221 [TCP segment of a reassembled PDU]"
"166","6.602539","162.159.128.232","192.168.0.92","TCP","1514","443  >  64118 [ACK] Seq=44769 Ack=311 Win=8 Len=1448 TSval=3702279784 TSecr=2629030221 [TCP segment of a reassembled PDU]"
"167","6.602541","162.159.128.232","192.168.0.92","TCP","1514","443  >  64118 [ACK] Seq=46217 Ack=311 Win=8 Len=1448 TSval=3702279784 TSecr=2629030221 [TCP segment of a reassembled PDU]"
"168","6.602542","162.159.128.232","192.168.0.92","TCP","1514","443  >  64118 [ACK] Seq=47665 Ack=311 Win=8 Len=1448 TSval=3702279784 TSecr=2629030221 [TCP segment of a reassembled PDU]"
"169","6.602543","162.159.128.232","192.168.0.92","TLSv1.2","1514","Application Data"
"170","6.602544","162.159.128.232","192.168.0.92","TCP","1514","443  >  64118 [ACK] Seq=50561 Ack=311 Win=8 Len=1448 TSval=3702279784 TSecr=2629030221 [TCP segment of a reassembled PDU]"
"171","6.602545","162.159.128.232","192.168.0.92","TCP","1514","443  >  64118 [ACK] Seq=52009 Ack=311 Win=8 Len=1448 TSval=3702279784 TSecr=2629030221 [TCP segment of a reassembled PDU]"
"172","6.602681","192.168.0.92","162.159.128.232","TCP","66","64118  >  443 [ACK] Seq=311 Ack=16243 Win=9583 Len=0 TSval=2629030251 TSecr=3702279783"
"173","6.602761","162.159.128.232","192.168.0.92","TCP","1514","443  >  64118 [ACK] Seq=53457 Ack=311 Win=8 Len=1448 TSval=3702279784 TSecr=2629030221 [TCP segment of a reassembled PDU]"
"174","6.602762","162.159.128.232","192.168.0.92","TCP","1514","443  >  64118 [ACK] Seq=54905 Ack=311 Win=8 Len=1448 TSval=3702279784 TSecr=2629030221 [TCP segment of a reassembled PDU]"
"175","6.602763","162.159.128.232","192.168.0.92","TCP","1514","443  >  64118 [ACK] Seq=56353 Ack=311 Win=8 Len=1448 TSval=3702279784 TSecr=2629030221 [TCP segment of a reassembled PDU]"
"176","6.602764","162.159.128.232","192.168.0.92","TCP","1514","443  >  64118 [ACK] Seq=57801 Ack=311 Win=8 Len=1448 TSval=3702279784 TSecr=2629030221 [TCP segment of a reassembled PDU]"
"177","6.602765","162.159.128.232","192.168.0.92","TCP","1514","443  >  64118 [ACK] Seq=59249 Ack=311 Win=8 Len=1448 TSval=3702279784 TSecr=2629030221 [TCP segment of a reassembled PDU]"
"178","6.602766","162.159.128.232","192.168.0.92","TCP","1514","443  >  64118 [ACK] Seq=60697 Ack=311 Win=8 Len=1448 TSval=3702279784 TSecr=2629030221 [TCP segment of a reassembled PDU]"
"179","6.602767","162.159.128.232","192.168.0.92","TCP","1514","443  >  64118 [ACK] Seq=62145 Ack=311 Win=8 Len=1448 TSval=3702279784 TSecr=2629030221 [TCP segment of a reassembled PDU]"
"180","6.602768","162.159.128.232","192.168.0.92","TCP","1514","443  >  64118 [ACK] Seq=63593 Ack=311 Win=8 Len=1448 TSval=3702279784 TSecr=2629030221 [TCP segment of a reassembled PDU]"
"181","6.602769","162.159.128.232","192.168.0.92","TLSv1.2","1022","Application Data"
"182","6.602770","162.159.128.232","192.168.0.92","TLSv1.2","1514","Application Data"
"183","6.602771","162.159.128.232","192.168.0.92","TCP","1514","443  >  64118 [ACK] Seq=67445 Ack=311 Win=8 Len=1448 TSval=3702279784 TSecr=2629030221 [TCP segment of a reassembled PDU]"
"184","6.602772","162.159.128.232","192.168.0.92","TCP","1514","443  >  64118 [ACK] Seq=68893 Ack=311 Win=8 Len=1448 TSval=3702279784 TSecr=2629030221 [TCP segment of a reassembled PDU]"
"185","6.602773","162.159.128.232","192.168.0.92","TCP","1514","443  >  64118 [ACK] Seq=70341 Ack=311 Win=8 Len=1448 TSval=3702279784 TSecr=2629030221 [TCP segment of a reassembled PDU]"
"186","6.602774","162.159.128.232","192.168.0.92","TCP","1514","443  >  64118 [ACK] Seq=71789 Ack=311 Win=8 Len=1448 TSval=3702279784 TSecr=2629030221 [TCP segment of a reassembled PDU]"
"187","6.602775","162.159.128.232","192.168.0.92","TCP","1514","443  >  64118 [ACK] Seq=73237 Ack=311 Win=8 Len=1448 TSval=3702279784 TSecr=2629030221 [TCP segment of a reassembled PDU]"
"188","6.602776","162.159.128.232","192.168.0.92","TCP","1514","443  >  64118 [ACK] Seq=74685 Ack=311 Win=8 Len=1448 TSval=3702279784 TSecr=2629030221 [TCP segment of a reassembled PDU]"
"189","6.602777","162.159.128.232","192.168.0.92","TCP","1514","443  >  64118 [ACK] Seq=76133 Ack=311 Win=8 Len=1448 TSval=3702279784 TSecr=2629030221 [TCP segment of a reassembled PDU]"
"190","6.602778","162.159.128.232","192.168.0.92","TCP","1514","443  >  64118 [ACK] Seq=77581 Ack=311 Win=8 Len=1448 TSval=3702279784 TSecr=2629030221 [TCP segment of a reassembled PDU]"
"191","6.602779","162.159.128.232","192.168.0.92","TCP","1514","443  >  64118 [ACK] Seq=79029 Ack=311 Win=8 Len=1448 TSval=3702279784 TSecr=2629030221 [TCP segment of a reassembled PDU]"
"192","6.602780","162.159.128.232","192.168.0.92","TCP","1514","443  >  64118 [ACK] Seq=80477 Ack=311 Win=8 Len=1448 TSval=3702279784 TSecr=2629030221 [TCP segment of a reassembled PDU]"
"193","6.602781","162.159.128.232","192.168.0.92","TLSv1.2","1514","Application Data"
"194","6.602782","162.159.128.232","192.168.0.92","TCP","1514","443  >  64118 [ACK] Seq=83373 Ack=311 Win=8 Len=1448 TSval=3702279784 TSecr=2629030221 [TCP segment of a reassembled PDU]"
"195","6.602783","162.159.128.232","192.168.0.92","TCP","1514","443  >  64118 [ACK] Seq=84821 Ack=311 Win=8 Len=1448 TSval=3702279784 TSecr=2629030221 [TCP segment of a reassembled PDU]"
"196","6.602784","162.159.128.232","192.168.0.92","TCP","1514","443  >  64118 [ACK] Seq=86269 Ack=311 Win=8 Len=1448 TSval=3702279784 TSecr=2629030221 [TCP segment of a reassembled PDU]"
"197","6.602785","162.159.128.232","192.168.0.92","TCP","1514","443  >  64118 [ACK] Seq=87717 Ack=311 Win=8 Len=1448 TSval=3702279784 TSecr=2629030221 [TCP segment of a reassembled PDU]"
"198","6.602786","162.159.128.232","192.168.0.92","TCP","1514","443  >  64118 [ACK] Seq=89165 Ack=311 Win=8 Len=1448 TSval=3702279784 TSecr=2629030221 [TCP segment of a reassembled PDU]"
"199","6.602787","162.159.128.232","192.168.0.92","TCP","1514","443  >  64118 [ACK] Seq=90613 Ack=311 Win=8 Len=1448 TSval=3702279784 TSecr=2629030221 [TCP segment of a reassembled PDU]"
"200","6.602788","162.159.128.232","192.168.0.92","TCP","1514","443  >  64118 [ACK] Seq=92061 Ack=311 Win=8 Len=1448 TSval=3702279784 TSecr=2629030221 [TCP segment of a reassembled PDU]"
"201","6.602789","162.159.128.232","192.168.0.92","TCP","1514","443  >  64118 [ACK] Seq=93509 Ack=311 Win=8 Len=1448 TSval=3702279784 TSecr=2629030221 [TCP segment of a reassembled PDU]"
"202","6.602790","162.159.128.232","192.168.0.92","TCP","1514","443  >  64118 [ACK] Seq=94957 Ack=311 Win=8 Len=1448 TSval=3702279784 TSecr=2629030221 [TCP segment of a reassembled PDU]"
"203","6.602791","162.159.128.232","192.168.0.92","TCP","1514","443  >  64118 [ACK] Seq=96405 Ack=311 Win=8 Len=1448 TSval=3702279784 TSecr=2629030221 [TCP segment of a reassembled PDU]"
"204","6.602791","162.159.128.232","192.168.0.92","TLSv1.2","1514","Application Data, Application Data"
"205","6.602835","192.168.0.92","162.159.128.232","TCP","66","64118  >  443 [ACK] Seq=311 Ack=53457 Win=9002 Len=0 TSval=2629030251 TSecr=3702279784"
"206","6.602856","192.168.0.92","162.159.128.232","TCP","66","64118  >  443 [ACK] Seq=311 Ack=68893 Win=9434 Len=0 TSval=2629030251 TSecr=3702279784"
"207","6.602880","192.168.0.92","162.159.128.232","TCP","66","64118  >  443 [ACK] Seq=311 Ack=84821 Win=9185 Len=0 TSval=2629030251 TSecr=3702279784"
"208","6.602898","192.168.0.92","162.159.128.232","TCP","66","64118  >  443 [ACK] Seq=311 Ack=99301 Win=8959 Len=0 TSval=2629030251 TSecr=3702279784"
"209","6.603546","162.159.128.232","192.168.0.92","TCP","1514","443  >  64118 [ACK] Seq=99301 Ack=311 Win=8 Len=1448 TSval=3702279784 TSecr=2629030221 [TCP segment of a reassembled PDU]"
"210","6.603547","162.159.128.232","192.168.0.92","TCP","1514","443  >  64118 [ACK] Seq=100749 Ack=311 Win=8 Len=1448 TSval=3702279784 TSecr=2629030221 [TCP segment of a reassembled PDU]"
"211","6.603548","162.159.128.232","192.168.0.92","TCP","1514","443  >  64118 [ACK] Seq=102197 Ack=311 Win=8 Len=1448 TSval=3702279784 TSecr=2629030221 [TCP segment of a reassembled PDU]"
"212","6.603549","162.159.128.232","192.168.0.92","TCP","1514","443  >  64118 [ACK] Seq=103645 Ack=311 Win=8 Len=1448 TSval=3702279784 TSecr=2629030221 [TCP segment of a reassembled PDU]"
"213","6.603549","162.159.128.232","192.168.0.92","TCP","1514","443  >  64118 [ACK] Seq=105093 Ack=311 Win=8 Len=1448 TSval=3702279784 TSecr=2629030221 [TCP segment of a reassembled PDU]"
"214","6.603550","162.159.128.232","192.168.0.92","TCP","1514","443  >  64118 [ACK] Seq=106541 Ack=311 Win=8 Len=1448 TSval=3702279784 TSecr=2629030221 [TCP segment of a reassembled PDU]"
"215","6.603551","162.159.128.232","192.168.0.92","TCP","1514","443  >  64118 [ACK] Seq=107989 Ack=311 Win=8 Len=1448 TSval=3702279784 TSecr=2629030221 [TCP segment of a reassembled PDU]"
"216","6.603552","162.159.128.232","192.168.0.92","TCP","1514","443  >  64118 [ACK] Seq=109437 Ack=311 Win=8 Len=1448 TSval=3702279784 TSecr=2629030221 [TCP segment of a reassembled PDU]"
"217","6.603553","162.159.128.232","192.168.0.92","TCP","1514","443  >  64118 [ACK] Seq=110885 Ack=311 Win=8 Len=1448 TSval=3702279784 TSecr=2629030221 [TCP segment of a reassembled PDU]"
"218","6.603554","162.159.128.232","192.168.0.92","TCP","1514","443  >  64118 [ACK] Seq=112333 Ack=311 Win=8 Len=1448 TSval=3702279784 TSecr=2629030221 [TCP segment of a reassembled PDU]"
"219","6.603555","162.159.128.232","192.168.0.92","TCP","1514","443  >  64118 [ACK] Seq=113781 Ack=311 Win=8 Len=1448 TSval=3702279784 TSecr=2629030221 [TCP segment of a reassembled PDU]"
"220","6.603556","162.159.128.232","192.168.0.92","TLSv1.2","1514","Application Data"
"221","6.603557","162.159.128.232","192.168.0.92","TCP","1514","443  >  64118 [ACK] Seq=116677 Ack=311 Win=8 Len=1448 TSval=3702279784 TSecr=2629030221 [TCP segment of a reassembled PDU]"
"222","6.603558","162.159.128.232","192.168.0.92","TCP","1514","443  >  64118 [ACK] Seq=118125 Ack=311 Win=8 Len=1448 TSval=3702279784 TSecr=2629030221 [TCP segment of a reassembled PDU]"
"223","6.603559","162.159.128.232","192.168.0.92","TCP","1514","443  >  64118 [ACK] Seq=119573 Ack=311 Win=8 Len=1448 TSval=3702279784 TSecr=2629030221 [TCP segment of a reassembled PDU]"
"224","6.603560","162.159.128.232","192.168.0.92","TCP","1514","443  >  64118 [ACK] Seq=121021 Ack=311 Win=8 Len=1448 TSval=3702279784 TSecr=2629030221 [TCP segment of a reassembled PDU]"
"225","6.603561","162.159.128.232","192.168.0.92","TCP","1514","443  >  64118 [PSH, ACK] Seq=122469 Ack=311 Win=8 Len=1448 TSval=3702279784 TSecr=2629030221 [TCP segment of a reassembled PDU]"
"226","6.603562","162.159.128.232","192.168.0.92","TCP","1514","443  >  64118 [ACK] Seq=123917 Ack=311 Win=8 Len=1448 TSval=3702279785 TSecr=2629030221 [TCP segment of a reassembled PDU]"
"227","6.603562","162.159.128.232","192.168.0.92","TCP","1514","443  >  64118 [ACK] Seq=125365 Ack=311 Win=8 Len=1448 TSval=3702279785 TSecr=2629030221 [TCP segment of a reassembled PDU]"
"228","6.603563","162.159.128.232","192.168.0.92","TCP","1514","443  >  64118 [ACK] Seq=126813 Ack=311 Win=8 Len=1448 TSval=3702279785 TSecr=2629030221 [TCP segment of a reassembled PDU]"
"229","6.603564","162.159.128.232","192.168.0.92","TCP","1514","443  >  64118 [ACK] Seq=128261 Ack=311 Win=8 Len=1448 TSval=3702279785 TSecr=2629030221 [TCP segment of a reassembled PDU]"
"230","6.603565","162.159.128.232","192.168.0.92","TCP","1514","443  >  64118 [ACK] Seq=129709 Ack=311 Win=8 Len=1448 TSval=3702279785 TSecr=2629030221 [TCP segment of a reassembled PDU]"
"231","6.603566","162.159.128.232","192.168.0.92","TLSv1.2","1514","Application Data, Application Data"
"232","6.603567","162.159.128.232","192.168.0.92","TCP","1514","443  >  64118 [ACK] Seq=132605 Ack=311 Win=8 Len=1448 TSval=3702279785 TSecr=2629030221 [TCP segment of a reassembled PDU]"
"233","6.603568","162.159.128.232","192.168.0.92","TCP","1514","443  >  64118 [ACK] Seq=134053 Ack=311 Win=8 Len=1448 TSval=3702279785 TSecr=2629030221 [TCP segment of a reassembled PDU]"
"234","6.603569","162.159.128.232","192.168.0.92","TCP","1514","443  >  64118 [ACK] Seq=135501 Ack=311 Win=8 Len=1448 TSval=3702279785 TSecr=2629030221 [TCP segment of a reassembled PDU]"
"235","6.603569","162.159.128.232","192.168.0.92","TCP","1514","443  >  64118 [ACK] Seq=136949 Ack=311 Win=8 Len=1448 TSval=3702279785 TSecr=2629030221 [TCP segment of a reassembled PDU]"
"236","6.603570","162.159.128.232","192.168.0.92","TCP","1514","443  >  64118 [ACK] Seq=138397 Ack=311 Win=8 Len=1448 TSval=3702279785 TSecr=2629030221 [TCP segment of a reassembled PDU]"
"237","6.603571","162.159.128.232","192.168.0.92","TCP","1514","443  >  64118 [ACK] Seq=139845 Ack=311 Win=8 Len=1448 TSval=3702279785 TSecr=2629030221 [TCP segment of a reassembled PDU]"
"238","6.603572","162.159.128.232","192.168.0.92","TCP","1514","443  >  64118 [ACK] Seq=141293 Ack=311 Win=8 Len=1448 TSval=3702279785 TSecr=2629030221 [TCP segment of a reassembled PDU]"
"239","6.603573","162.159.128.232","192.168.0.92","TCP","1514","443  >  64118 [ACK] Seq=142741 Ack=311 Win=8 Len=1448 TSval=3702279785 TSecr=2629030221 [TCP segment of a reassembled PDU]"
"240","6.603574","162.159.128.232","192.168.0.92","TCP","1514","443  >  64118 [ACK] Seq=144189 Ack=311 Win=8 Len=1448 TSval=3702279785 TSecr=2629030221 [TCP segment of a reassembled PDU]"
"241","6.603649","162.159.128.232","192.168.0.92","TCP","1514","443  >  64118 [ACK] Seq=145637 Ack=311 Win=8 Len=1448 TSval=3702279785 TSecr=2629030221 [TCP segment of a reassembled PDU]"
"242","6.603649","162.159.128.232","192.168.0.92","TLSv1.2","1514","Application Data"
"243","6.603650","162.159.128.232","192.168.0.92","TCP","1514","443  >  64118 [ACK] Seq=148533 Ack=311 Win=8 Len=1448 TSval=3702279785 TSecr=2629030221 [TCP segment of a reassembled PDU]"
"244","6.603651","162.159.128.232","192.168.0.92","TCP","1514","443  >  64118 [ACK] Seq=149981 Ack=311 Win=8 Len=1448 TSval=3702279785 TSecr=2629030221 [TCP segment of a reassembled PDU]"
"245","6.603652","162.159.128.232","192.168.0.92","TCP","1514","443  >  64118 [ACK] Seq=151429 Ack=311 Win=8 Len=1448 TSval=3702279785 TSecr=2629030221 [TCP segment of a reassembled PDU]"
"246","6.603653","162.159.128.232","192.168.0.92","TCP","1514","443  >  64118 [ACK] Seq=152877 Ack=311 Win=8 Len=1448 TSval=3702279785 TSecr=2629030221 [TCP segment of a reassembled PDU]"
"247","6.603654","162.159.128.232","192.168.0.92","TCP","1514","443  >  64118 [ACK] Seq=154325 Ack=311 Win=8 Len=1448 TSval=3702279785 TSecr=2629030221 [TCP segment of a reassembled PDU]"
"248","6.603655","162.159.128.232","192.168.0.92","TCP","1514","443  >  64118 [ACK] Seq=155773 Ack=311 Win=8 Len=1448 TSval=3702279785 TSecr=2629030221 [TCP segment of a reassembled PDU]"
"249","6.603656","162.159.128.232","192.168.0.92","TCP","1514","443  >  64118 [ACK] Seq=157221 Ack=311 Win=8 Len=1448 TSval=3702279785 TSecr=2629030221 [TCP segment of a reassembled PDU]"
"250","6.603657","162.159.128.232","192.168.0.92","TCP","1514","443  >  64118 [ACK] Seq=158669 Ack=311 Win=8 Len=1448 TSval=3702279785 TSecr=2629030221 [TCP segment of a reassembled PDU]"
"251","6.603658","162.159.128.232","192.168.0.92","TCP","1514","443  >  64118 [ACK] Seq=160117 Ack=311 Win=8 Len=1448 TSval=3702279785 TSecr=2629030221 [TCP segment of a reassembled PDU]"
"252","6.603659","162.159.128.232","192.168.0.92","TCP","1514","443  >  64118 [ACK] Seq=161565 Ack=311 Win=8 Len=1448 TSval=3702279785 TSecr=2629030221 [TCP segment of a reassembled PDU]"
"253","6.603661","162.159.128.232","192.168.0.92","TCP","1514","443  >  64118 [ACK] Seq=163013 Ack=311 Win=8 Len=1448 TSval=3702279785 TSecr=2629030221 [TCP segment of a reassembled PDU]"
"254","6.603662","162.159.128.232","192.168.0.92","TLSv1.2","1514","Application Data, Application Data"
"255","6.603663","162.159.128.232","192.168.0.92","TCP","1514","443  >  64118 [ACK] Seq=165909 Ack=311 Win=8 Len=1448 TSval=3702279785 TSecr=2629030221 [TCP segment of a reassembled PDU]"
"256","6.603664","162.159.128.232","192.168.0.92","TCP","1514","443  >  64118 [ACK] Seq=167357 Ack=311 Win=8 Len=1448 TSval=3702279785 TSecr=2629030221 [TCP segment of a reassembled PDU]"
"257","6.603665","162.159.128.232","192.168.0.92","TCP","1514","443  >  64118 [ACK] Seq=168805 Ack=311 Win=8 Len=1448 TSval=3702279785 TSecr=2629030221 [TCP segment of a reassembled PDU]"
"258","6.603666","162.159.128.232","192.168.0.92","TCP","1514","443  >  64118 [ACK] Seq=170253 Ack=311 Win=8 Len=1448 TSval=3702279785 TSecr=2629030221 [TCP segment of a reassembled PDU]"
"259","6.603667","162.159.128.232","192.168.0.92","TCP","1514","443  >  64118 [ACK] Seq=171701 Ack=311 Win=8 Len=1448 TSval=3702279785 TSecr=2629030221 [TCP segment of a reassembled PDU]"
"260","6.603668","162.159.128.232","192.168.0.92","TCP","1514","443  >  64118 [ACK] Seq=173149 Ack=311 Win=8 Len=1448 TSval=3702279785 TSecr=2629030221 [TCP segment of a reassembled PDU]"
"261","6.603669","162.159.128.232","192.168.0.92","TCP","1514","443  >  64118 [ACK] Seq=174597 Ack=311 Win=8 Len=1448 TSval=3702279785 TSecr=2629030221 [TCP segment of a reassembled PDU]"
"262","6.603669","162.159.128.232","192.168.0.92","TCP","1514","443  >  64118 [ACK] Seq=176045 Ack=311 Win=8 Len=1448 TSval=3702279785 TSecr=2629030221 [TCP segment of a reassembled PDU]"
"263","6.603671","162.159.128.232","192.168.0.92","TCP","1514","443  >  64118 [ACK] Seq=177493 Ack=311 Win=8 Len=1448 TSval=3702279785 TSecr=2629030221 [TCP segment of a reassembled PDU]"
"264","6.603672","162.159.128.232","192.168.0.92","TCP","1514","443  >  64118 [ACK] Seq=178941 Ack=311 Win=8 Len=1448 TSval=3702279785 TSecr=2629030221 [TCP segment of a reassembled PDU]"
"265","6.603673","162.159.128.232","192.168.0.92","TLSv1.2","1514","Application Data"
"266","6.603674","162.159.128.232","192.168.0.92","TCP","1514","443  >  64118 [ACK] Seq=181837 Ack=311 Win=8 Len=1448 TSval=3702279786 TSecr=2629030221 [TCP segment of a reassembled PDU]"
"267","6.603921","192.168.0.92","162.159.128.232","TCP","66","64118  >  443 [ACK] Seq=311 Ack=183285 Win=9833 Len=0 TSval=2629030252 TSecr=3702279786"
"268","6.607253","162.159.128.232","192.168.0.92","TCP","1514","443  >  64118 [ACK] Seq=183285 Ack=311 Win=8 Len=1448 TSval=3702279786 TSecr=2629030221 [TCP segment of a reassembled PDU]"
"269","6.607254","162.159.128.232","192.168.0.92","TCP","1514","443  >  64118 [ACK] Seq=184733 Ack=311 Win=8 Len=1448 TSval=3702279786 TSecr=2629030221 [TCP segment of a reassembled PDU]"
"270","6.607255","162.159.128.232","192.168.0.92","TCP","1514","443  >  64118 [ACK] Seq=186181 Ack=311 Win=8 Len=1448 TSval=3702279786 TSecr=2629030221 [TCP segment of a reassembled PDU]"
"271","6.607256","162.159.128.232","192.168.0.92","TCP","1514","443  >  64118 [ACK] Seq=187629 Ack=311 Win=8 Len=1448 TSval=3702279786 TSecr=2629030221 [TCP segment of a reassembled PDU]"
"272","6.607257","162.159.128.232","192.168.0.92","TCP","1514","443  >  64118 [ACK] Seq=189077 Ack=311 Win=8 Len=1448 TSval=3702279786 TSecr=2629030221 [TCP segment of a reassembled PDU]"
"273","6.607259","162.159.128.232","192.168.0.92","TCP","1514","443  >  64118 [ACK] Seq=190525 Ack=311 Win=8 Len=1448 TSval=3702279786 TSecr=2629030221 [TCP segment of a reassembled PDU]"
"274","6.607260","162.159.128.232","192.168.0.92","TCP","1514","443  >  64118 [ACK] Seq=191973 Ack=311 Win=8 Len=1448 TSval=3702279786 TSecr=2629030221 [TCP segment of a reassembled PDU]"
"275","6.607261","162.159.128.232","192.168.0.92","TCP","1514","443  >  64118 [ACK] Seq=193421 Ack=311 Win=8 Len=1448 TSval=3702279786 TSecr=2629030221 [TCP segment of a reassembled PDU]"
"276","6.607262","162.159.128.232","192.168.0.92","TCP","1514","443  >  64118 [ACK] Seq=194869 Ack=311 Win=8 Len=1448 TSval=3702279786 TSecr=2629030221 [TCP segment of a reassembled PDU]"
"277","6.607263","162.159.128.232","192.168.0.92","TLSv1.2","1514","Application Data, Application Data"
"278","6.607264","162.159.128.232","192.168.0.92","TCP","1514","443  >  64118 [ACK] Seq=197765 Ack=311 Win=8 Len=1448 TSval=3702279786 TSecr=2629030221 [TCP segment of a reassembled PDU]"
"279","6.607265","162.159.128.232","192.168.0.92","TCP","1514","443  >  64118 [ACK] Seq=199213 Ack=311 Win=8 Len=1448 TSval=3702279786 TSecr=2629030221 [TCP segment of a reassembled PDU]"
"280","6.607266","162.159.128.232","192.168.0.92","TCP","1514","443  >  64118 [ACK] Seq=200661 Ack=311 Win=8 Len=1448 TSval=3702279786 TSecr=2629030221 [TCP segment of a reassembled PDU]"
"281","6.607267","162.159.128.232","192.168.0.92","TCP","1514","443  >  64118 [ACK] Seq=202109 Ack=311 Win=8 Len=1448 TSval=3702279786 TSecr=2629030221 [TCP segment of a reassembled PDU]"
"282","6.607268","162.159.128.232","192.168.0.92","TCP","1514","443  >  64118 [ACK] Seq=203557 Ack=311 Win=8 Len=1448 TSval=3702279786 TSecr=2629030221 [TCP segment of a reassembled PDU]"
"283","6.607269","162.159.128.232","192.168.0.92","TCP","1514","443  >  64118 [ACK] Seq=205005 Ack=311 Win=8 Len=1448 TSval=3702279786 TSecr=2629030221 [TCP segment of a reassembled PDU]"
"284","6.607270","162.159.128.232","192.168.0.92","TCP","1514","443  >  64118 [ACK] Seq=206453 Ack=311 Win=8 Len=1448 TSval=3702279786 TSecr=2629030221 [TCP segment of a reassembled PDU]"
"285","6.607270","162.159.128.232","192.168.0.92","TCP","1514","443  >  64118 [ACK] Seq=207901 Ack=311 Win=8 Len=1448 TSval=3702279786 TSecr=2629030221 [TCP segment of a reassembled PDU]"
"286","6.607271","162.159.128.232","192.168.0.92","TCP","1514","443  >  64118 [ACK] Seq=209349 Ack=311 Win=8 Len=1448 TSval=3702279786 TSecr=2629030221 [TCP segment of a reassembled PDU]"
"287","6.607272","162.159.128.232","192.168.0.92","TCP","1514","443  >  64118 [ACK] Seq=210797 Ack=311 Win=8 Len=1448 TSval=3702279786 TSecr=2629030221 [TCP segment of a reassembled PDU]"
"288","6.607273","162.159.128.232","192.168.0.92","TCP","1514","443  >  64118 [ACK] Seq=212245 Ack=311 Win=8 Len=1448 TSval=3702279786 TSecr=2629030221 [TCP segment of a reassembled PDU]"
"289","6.607274","162.159.128.232","192.168.0.92","TLSv1.2","1514","Application Data"
"290","6.607275","162.159.128.232","192.168.0.92","TCP","1514","443  >  64118 [ACK] Seq=215141 Ack=311 Win=8 Len=1448 TSval=3702279786 TSecr=2629030221 [TCP segment of a reassembled PDU]"
"291","6.607276","162.159.128.232","192.168.0.92","TCP","1514","443  >  64118 [ACK] Seq=216589 Ack=311 Win=8 Len=1448 TSval=3702279786 TSecr=2629030221 [TCP segment of a reassembled PDU]"
"292","6.607277","162.159.128.232","192.168.0.92","TCP","1514","443  >  64118 [ACK] Seq=218037 Ack=311 Win=8 Len=1448 TSval=3702279786 TSecr=2629030221 [TCP segment of a reassembled PDU]"
"293","6.607278","162.159.128.232","192.168.0.92","TCP","1514","443  >  64118 [ACK] Seq=219485 Ack=311 Win=8 Len=1448 TSval=3702279786 TSecr=2629030221 [TCP segment of a reassembled PDU]"
"294","6.607279","162.159.128.232","192.168.0.92","TLSv1.2","682","Application Data, Application Data"
"295","6.607346","192.168.0.92","162.159.128.232","TCP","66","64118  >  443 [ACK] Seq=311 Ack=199213 Win=9584 Len=0 TSval=2629030256 TSecr=3702279786"
"296","6.607398","192.168.0.92","162.159.128.232","TCP","66","64118  >  443 [ACK] Seq=311 Ack=215141 Win=9336 Len=0 TSval=2629030256 TSecr=3702279786"
"297","6.607422","192.168.0.92","162.159.128.232","TCP","66","64118  >  443 [ACK] Seq=311 Ack=221549 Win=9833 Len=0 TSval=2629030256 TSecr=3702279786"
"299","6.782438","162.159.130.234","192.168.0.92","TLSv1.2","110","Application Data"
"300","6.782568","192.168.0.92","162.159.130.234","TCP","66","64024  >  443 [ACK] Seq=1 Ack=2975 Win=2048 Len=0 TSval=785807108 TSecr=4163972967"
"301","6.937259","162.159.130.234","192.168.0.92","TLSv1.2","214","Application Data"
"302","6.937371","192.168.0.92","162.159.130.234","TCP","66","64024  >  443 [ACK] Seq=1 Ack=3123 Win=2048 Len=0 TSval=785807263 TSecr=4163973122"
"303","7.164718","162.159.130.234","192.168.0.92","TLSv1.2","112","Application Data"
"304","7.164847","192.168.0.92","162.159.130.234","TCP","66","64024  >  443 [ACK] Seq=1 Ack=3169 Win=2048 Len=0 TSval=785807490 TSecr=4163973339"
"307","7.498708","162.159.130.234","192.168.0.92","TLSv1.2","109","Application Data"
"308","7.498865","192.168.0.92","162.159.130.234","TCP","66","64024  >  443 [ACK] Seq=1 Ack=3212 Win=2048 Len=0 TSval=785807824 TSecr=4163973683"
"309","7.883621","162.159.130.234","192.168.0.92","TLSv1.2","118","Application Data"
"310","7.883623","162.159.130.234","192.168.0.92","TLSv1.2","287","Application Data"
"311","7.884052","192.168.0.92","162.159.130.234","TCP","66","64024  >  443 [ACK] Seq=1 Ack=3485 Win=2048 Len=0 TSval=785808209 TSecr=4163974043"
"312","8.087010","162.159.130.234","192.168.0.92","TLSv1.2","292","Application Data"
"313","8.087171","192.168.0.92","162.159.130.234","TCP","66","64024  >  443 [ACK] Seq=1 Ack=3711 Win=2048 Len=0 TSval=785808413 TSecr=4163974243"
"317","8.348248","162.159.130.234","192.168.0.92","TLSv1.2","112","Application Data"
"318","8.348444","192.168.0.92","162.159.130.234","TCP","66","64024  >  443 [ACK] Seq=1 Ack=3757 Win=2048 Len=0 TSval=785808674 TSecr=4163974529"
"319","8.804951","162.159.130.234","192.168.0.92","TLSv1.2","112","Application Data"
"320","8.805088","192.168.0.92","162.159.130.234","TCP","66","64024  >  443 [ACK] Seq=1 Ack=3803 Win=2048 Len=0 TSval=785809131 TSecr=4163974962"
"321","8.963608","162.159.130.234","192.168.0.92","TLSv1.2","119","Application Data"
"322","8.963731","192.168.0.92","162.159.130.234","TCP","66","64024  >  443 [ACK] Seq=1 Ack=3856 Win=2048 Len=0 TSval=785809289 TSecr=4163975148"
"331","9.277898","162.159.130.234","192.168.0.92","TLSv1.2","151","Application Data"
"332","9.278057","192.168.0.92","162.159.130.234","TCP","66","64024  >  443 [ACK] Seq=1 Ack=3941 Win=2048 Len=0 TSval=785809603 TSecr=4163975462"
"334","9.937816","162.159.130.234","192.168.0.92","TLSv1.2","115","Application Data"
"335","9.938096","192.168.0.92","162.159.130.234","TCP","66","64024  >  443 [ACK] Seq=1 Ack=3990 Win=2048 Len=0 TSval=785810263 TSecr=4163976069"
"338","10.809411","162.159.130.234","192.168.0.92","TLSv1.2","225","Application Data"
"339","10.809635","192.168.0.92","162.159.130.234","TCP","66","64024  >  443 [ACK] Seq=1 Ack=4149 Win=2048 Len=0 TSval=785811135 TSecr=4163976941"
"342","11.059216","162.159.130.234","192.168.0.92","TLSv1.2","141","Application Data"
"343","11.059347","192.168.0.92","162.159.130.234","TCP","66","64024  >  443 [ACK] Seq=1 Ack=4224 Win=2048 Len=0 TSval=785811385 TSecr=4163977239"
"345","11.744853","162.159.130.234","192.168.0.92","TLSv1.2","268","Application Data"
"346","11.745082","192.168.0.92","162.159.130.234","TCP","66","64024  >  443 [ACK] Seq=1 Ack=4426 Win=2048 Len=0 TSval=785812070 TSecr=4163977927"
"348","12.285652","162.159.130.234","192.168.0.92","TLSv1.2","206","Application Data"
"349","12.285926","192.168.0.92","162.159.130.234","TCP","66","64024  >  443 [ACK] Seq=1 Ack=4566 Win=2048 Len=0 TSval=785812611 TSecr=4163978455"
"351","12.694938","162.159.130.234","192.168.0.92","TLSv1.2","116","Application Data"
"352","12.694940","162.159.130.234","192.168.0.92","TLSv1.2","237","Application Data"
"353","12.702132","192.168.0.92","162.159.130.234","TCP","66","64024  >  443 [ACK] Seq=1 Ack=4787 Win=2048 Len=0 TSval=785813028 TSecr=4163978867"
"361","13.336398","162.159.130.234","192.168.0.92","TLSv1.2","112","Application Data"
"362","13.336579","192.168.0.92","162.159.130.234","TCP","66","64024  >  443 [ACK] Seq=1 Ack=4833 Win=2048 Len=0 TSval=785813662 TSecr=4163979521"
"363","13.347536","192.168.0.92","162.159.130.234","TLSv1.2","111","Application Data"
"364","13.383693","162.159.130.234","192.168.0.92","TLSv1.2","115","Application Data"
"365","13.383802","192.168.0.92","162.159.130.234","TCP","66","64024  >  443 [ACK] Seq=46 Ack=4882 Win=2047 Len=0 TSval=785813709 TSecr=4163979566"
"366","13.386544","162.159.130.234","192.168.0.92","TLSv1.2","113","Application Data"
"367","13.386626","192.168.0.92","162.159.130.234","TCP","66","64024  >  443 [ACK] Seq=46 Ack=4929 Win=2047 Len=0 TSval=785813712 TSecr=4163979571"
"371","14.129208","162.159.130.234","192.168.0.92","TLSv1.2","298","Application Data"
"372","14.138145","192.168.0.92","162.159.130.234","TCP","66","64024  >  443 [ACK] Seq=46 Ack=5161 Win=2048 Len=0 TSval=785814464 TSecr=4163980314"
"376","14.518109","162.159.130.234","192.168.0.92","TLSv1.2","279","Application Data"
"377","14.518273","192.168.0.92","162.159.130.234","TCP","66","64024  >  443 [ACK] Seq=46 Ack=5374 Win=2048 Len=0 TSval=785814844 TSecr=4163980702"
"379","14.845821","162.159.130.234","192.168.0.92","TLSv1.2","250","Application Data"
"380","14.845821","162.159.130.234","192.168.0.92","TLSv1.2","115","Application Data"
"381","14.846157","192.168.0.92","162.159.130.234","TCP","66","64024  >  443 [ACK] Seq=46 Ack=5607 Win=2048 Len=0 TSval=785815172 TSecr=4163981016"
"385","15.358349","162.159.130.234","192.168.0.92","TLSv1.2","113","Application Data"
"386","15.358561","192.168.0.92","162.159.130.234","TCP","66","64024  >  443 [ACK] Seq=46 Ack=5654 Win=2048 Len=0 TSval=785815684 TSecr=4163981441"
"445","16.046238","162.159.130.234","192.168.0.92","TLSv1.2","289","Application Data"
"446","16.046510","192.168.0.92","162.159.130.234","TCP","66","64024  >  443 [ACK] Seq=46 Ack=5877 Win=2048 Len=0 TSval=785816372 TSecr=4163982231"
"450","16.484240","162.159.130.234","192.168.0.92","TLSv1.2","392","Application Data"
"451","16.484609","192.168.0.92","162.159.130.234","TCP","66","64024  >  443 [ACK] Seq=46 Ack=6203 Win=2048 Len=0 TSval=785816810 TSecr=4163982585"
"452","16.680799","162.159.130.234","192.168.0.92","TLSv1.2","113","Application Data"
"453","16.681114","192.168.0.92","162.159.130.234","TCP","66","64024  >  443 [ACK] Seq=46 Ack=6250 Win=2048 Len=0 TSval=785817007 TSecr=4163982864"
"454","16.724015","162.159.130.234","192.168.0.92","TLSv1.2","287","Application Data"
"455","16.724352","192.168.0.92","162.159.130.234","TCP","66","64024  >  443 [ACK] Seq=46 Ack=6471 Win=2048 Len=0 TSval=785817050 TSecr=4163982909"
"456","16.890676","162.159.130.234","192.168.0.92","TLSv1.2","112","Application Data"
"457","16.890878","192.168.0.92","162.159.130.234","TCP","66","64024  >  443 [ACK] Seq=46 Ack=6517 Win=2048 Len=0 TSval=785817216 TSecr=4163983074"
"506","17.283067","162.159.130.234","192.168.0.92","TLSv1.2","128","Application Data"
"507","17.283258","192.168.0.92","162.159.130.234","TCP","66","64024  >  443 [ACK] Seq=46 Ack=6579 Win=2048 Len=0 TSval=785817609 TSecr=4163983467"
"508","17.414293","162.159.130.234","192.168.0.92","TLSv1.2","109","Application Data"
"509","17.414449","192.168.0.92","162.159.130.234","TCP","66","64024  >  443 [ACK] Seq=46 Ack=6622 Win=2048 Len=0 TSval=785817740 TSecr=4163983599"
"510","17.532776","162.159.130.234","192.168.0.92","TLSv1.2","138","Application Data"
"511","17.533044","192.168.0.92","162.159.130.234","TCP","66","64024  >  443 [ACK] Seq=46 Ack=6694 Win=2048 Len=0 TSval=785817859 TSecr=4163983717"
"512","17.816422","162.159.130.234","192.168.0.92","TLSv1.2","213","Application Data"
"513","17.816593","192.168.0.92","162.159.130.234","TCP","66","64024  >  443 [ACK] Seq=46 Ack=6841 Win=2048 Len=0 TSval=785818142 TSecr=4163983943"
"514","18.122431","162.159.130.234","192.168.0.92","TLSv1.2","112","Application Data"
"515","18.122711","192.168.0.92","162.159.130.234","TCP","66","64024  >  443 [ACK] Seq=46 Ack=6887 Win=2048 Len=0 TSval=785818448 TSecr=4163984269"
"516","18.532719","162.159.130.234","192.168.0.92","TLSv1.2","129","Application Data"
"517","18.532923","192.168.0.92","162.159.130.234","TCP","66","64024  >  443 [ACK] Seq=46 Ack=6950 Win=2048 Len=0 TSval=785818859 TSecr=4163984609"
"526","18.655395","162.159.130.234","192.168.0.92","TLSv1.2","205","Application Data"
"527","18.655603","192.168.0.92","162.159.130.234","TCP","66","64024  >  443 [ACK] Seq=46 Ack=7089 Win=2048 Len=0 TSval=785818981 TSecr=4163984839"
"532","19.350450","162.159.130.234","192.168.0.92","TLSv1.2","113","Application Data"
"533","19.350653","192.168.0.92","162.159.130.234","TCP","66","64024  >  443 [ACK] Seq=46 Ack=7136 Win=2048 Len=0 TSval=785819676 TSecr=4163985471"
"534","19.530144","162.159.130.234","192.168.0.92","TLSv1.2","116","Application Data"
"535","19.530330","192.168.0.92","162.159.130.234","TCP","66","64024  >  443 [ACK] Seq=46 Ack=7186 Win=2048 Len=0 TSval=785819856 TSecr=4163985715"
"537","20.560165","162.159.130.234","192.168.0.92","TLSv1.2","527","Application Data"
"538","20.560315","192.168.0.92","162.159.130.234","TCP","66","64024  >  443 [ACK] Seq=46 Ack=7647 Win=2048 Len=0 TSval=785820886 TSecr=4163986743"
"544","20.691456","192.168.0.92","162.159.130.232","TLSv1.2","299","Application Data"
"545","20.706734","162.159.130.232","192.168.0.92","TCP","66","443  >  64116 [ACK] Seq=1 Ack=234 Win=7 Len=0 TSval=934175049 TSecr=1801671631"
"548","20.791412","162.159.130.232","192.168.0.92","TLSv1.2","428","Application Data"
"549","20.791413","162.159.130.232","192.168.0.92","TCP","1514","443  >  64116 [ACK] Seq=363 Ack=234 Win=8 Len=1448 TSval=934175131 TSecr=1801671631 [TCP segment of a reassembled PDU]"
"550","20.791414","162.159.130.232","192.168.0.92","TCP","1514","443  >  64116 [ACK] Seq=1811 Ack=234 Win=8 Len=1448 TSval=934175131 TSecr=1801671631 [TCP segment of a reassembled PDU]"
"551","20.791415","162.159.130.232","192.168.0.92","TCP","1514","443  >  64116 [ACK] Seq=3259 Ack=234 Win=8 Len=1448 TSval=934175131 TSecr=1801671631 [TCP segment of a reassembled PDU]"
"552","20.791415","162.159.130.232","192.168.0.92","TCP","1514","443  >  64116 [ACK] Seq=4707 Ack=234 Win=8 Len=1448 TSval=934175131 TSecr=1801671631 [TCP segment of a reassembled PDU]"
"553","20.791416","162.159.130.232","192.168.0.92","TCP","1514","443  >  64116 [ACK] Seq=6155 Ack=234 Win=8 Len=1448 TSval=934175131 TSecr=1801671631 [TCP segment of a reassembled PDU]"
"554","20.791417","162.159.130.232","192.168.0.92","TCP","1514","443  >  64116 [ACK] Seq=7603 Ack=234 Win=8 Len=1448 TSval=934175131 TSecr=1801671631 [TCP segment of a reassembled PDU]"
"555","20.791418","162.159.130.232","192.168.0.92","TCP","1514","443  >  64116 [ACK] Seq=9051 Ack=234 Win=8 Len=1448 TSval=934175131 TSecr=1801671631 [TCP segment of a reassembled PDU]"
"556","20.791419","162.159.130.232","192.168.0.92","TCP","1514","443  >  64116 [ACK] Seq=10499 Ack=234 Win=8 Len=1448 TSval=934175131 TSecr=1801671631 [TCP segment of a reassembled PDU]"
"557","20.791419","162.159.130.232","192.168.0.92","TCP","1514","443  >  64116 [ACK] Seq=11947 Ack=234 Win=8 Len=1448 TSval=934175131 TSecr=1801671631 [TCP segment of a reassembled PDU]"
"558","20.791420","162.159.130.232","192.168.0.92","TCP","1514","443  >  64116 [ACK] Seq=13395 Ack=234 Win=8 Len=1448 TSval=934175131 TSecr=1801671631 [TCP segment of a reassembled PDU]"
"559","20.791421","162.159.130.232","192.168.0.92","TCP","1514","443  >  64116 [ACK] Seq=14843 Ack=234 Win=8 Len=1448 TSval=934175131 TSecr=1801671631 [TCP segment of a reassembled PDU]"
"560","20.791422","162.159.130.232","192.168.0.92","TLSv1.2","544","Application Data"
"561","20.791422","162.159.130.232","192.168.0.92","TCP","1514","443  >  64116 [ACK] Seq=16769 Ack=234 Win=8 Len=1448 TSval=934175131 TSecr=1801671631 [TCP segment of a reassembled PDU]"
"562","20.791423","162.159.130.232","192.168.0.92","TLSv1.2","818","Application Data"
"563","20.791424","162.159.130.232","192.168.0.92","TLSv1.2","97","Application Data"
"564","20.791554","192.168.0.92","162.159.130.232","TCP","66","64116  >  443 [ACK] Seq=234 Ack=16291 Win=22439 Len=0 TSval=1801671731 TSecr=934175131"
"565","20.791591","192.168.0.92","162.159.130.232","TCP","66","64116  >  443 [ACK] Seq=234 Ack=19000 Win=22397 Len=0 TSval=1801671731 TSecr=934175131"
"566","20.791689","192.168.0.92","162.159.130.232","TCP","66","[TCP Window Update] 64116  >  443 [ACK] Seq=234 Ack=19000 Win=22694 Len=0 TSval=1801671731 TSecr=934175131"
"570","21.297347","162.159.130.234","192.168.0.92","TLSv1.2","444","Application Data"
"571","21.297348","162.159.130.234","192.168.0.92","TLSv1.2","406","Application Data"
"572","21.297555","192.168.0.92","162.159.130.234","TCP","66","64024  >  443 [ACK] Seq=46 Ack=8365 Win=2048 Len=0 TSval=785821623 TSecr=4163987421"
"573","21.604568","162.159.130.234","192.168.0.92","TLSv1.2","151","Application Data"
"576","21.604845","192.168.0.92","162.159.130.234","TCP","66","64024  >  443 [ACK] Seq=46 Ack=8450 Win=2048 Len=0 TSval=785821930 TSecr=4163987682"
"622","23.755280","162.159.130.234","192.168.0.92","TLSv1.2","299","Application Data"
"623","23.755571","192.168.0.92","162.159.130.234","TCP","66","64024  >  443 [ACK] Seq=46 Ack=8683 Win=2048 Len=0 TSval=785824081 TSecr=4163989927"
"628","25.290607","162.159.130.234","192.168.0.92","TLSv1.2","172","Application Data"
"629","25.290827","192.168.0.92","162.159.130.234","TCP","66","64024  >  443 [ACK] Seq=46 Ack=8789 Win=2048 Len=0 TSval=785825617 TSecr=4163991441"
"631","25.803837","162.159.130.234","192.168.0.92","TLSv1.2","120","Application Data"
"632","25.804075","192.168.0.92","162.159.130.234","TCP","66","64024  >  443 [ACK] Seq=46 Ack=8843 Win=2048 Len=0 TSval=785826130 TSecr=4163991963"
"634","26.726499","162.159.130.234","192.168.0.92","TLSv1.2","529","Application Data"
"635","26.726789","192.168.0.92","162.159.130.234","TCP","66","64024  >  443 [ACK] Seq=46 Ack=9306 Win=2048 Len=0 TSval=785827052 TSecr=4163992821"
"636","26.844858","162.159.130.234","192.168.0.92","TLSv1.2","118","Application Data"
"637","26.845071","192.168.0.92","162.159.130.234","TCP","66","64024  >  443 [ACK] Seq=46 Ack=9358 Win=2048 Len=0 TSval=785827171 TSecr=4163993029"
"639","27.441935","162.159.130.234","192.168.0.92","TLSv1.2","143","Application Data"
"640","27.442243","192.168.0.92","162.159.130.234","TCP","66","64024  >  443 [ACK] Seq=46 Ack=9435 Win=2048 Len=0 TSval=785827768 TSecr=4163993571"
"641","27.851052","162.159.130.234","192.168.0.92","TLSv1.2","391","Application Data"
"642","27.851190","192.168.0.92","162.159.130.234","TCP","66","64024  >  443 [ACK] Seq=46 Ack=9760 Win=2048 Len=0 TSval=785828177 TSecr=4163993950"
"644","28.782607","162.159.130.234","192.168.0.92","TLSv1.2","115","Application Data"
"646","28.782883","192.168.0.92","162.159.130.234","TCP","66","64024  >  443 [ACK] Seq=46 Ack=9809 Win=2048 Len=0 TSval=785829109 TSecr=4163994925"
"663","29.296903","162.159.130.234","192.168.0.92","TLSv1.2","271","Application Data"
"664","29.297139","192.168.0.92","162.159.130.234","TCP","66","64024  >  443 [ACK] Seq=46 Ack=10014 Win=2048 Len=0 TSval=785829623 TSecr=4163995481"
"666","29.683509","162.159.130.234","192.168.0.92","TLSv1.2","127","Application Data"
"667","29.683719","192.168.0.92","162.159.130.234","TCP","66","64024  >  443 [ACK] Seq=46 Ack=10075 Win=2048 Len=0 TSval=785830010 TSecr=4163995854"
"669","30.001607","162.159.130.234","192.168.0.92","TLSv1.2","223","Application Data"
"670","30.001877","192.168.0.92","162.159.130.234","TCP","66","64024  >  443 [ACK] Seq=46 Ack=10232 Win=2048 Len=0 TSval=785830328 TSecr=4163996109"
"671","30.315514","162.159.130.234","192.168.0.92","TLSv1.2","124","Application Data"
"672","30.315661","192.168.0.92","162.159.130.234","TCP","66","64024  >  443 [ACK] Seq=46 Ack=10290 Win=2048 Len=0 TSval=785830642 TSecr=4163996415"
"675","30.812254","162.159.130.234","192.168.0.92","TLSv1.2","128","Application Data"
"676","30.812604","192.168.0.92","162.159.130.234","TCP","66","64024  >  443 [ACK] Seq=46 Ack=10352 Win=2048 Len=0 TSval=785831138 TSecr=4163996987"
