"No.","Time","Source","Destination","Protocol","Length","Info"
"1000","2.270064","23.48.104.108","192.168.0.104","TCP","1514","443  >  49525 [ACK] Seq=941230 Ack=138306 Win=214144 Len=1448 TSval=3563222260 TSecr=4133353728 [TCP segment of a reassembled PDU]"
"1001","2.270065","23.48.104.108","192.168.0.104","TCP","1514","443  >  49525 [ACK] Seq=942678 Ack=138306 Win=214144 Len=1448 TSval=3563222260 TSecr=4133353728 [TCP segment of a reassembled PDU]"
"1002","2.270065","23.48.104.108","192.168.0.104","TCP","1514","443  >  49525 [ACK] Seq=944126 Ack=138306 Win=214144 Len=1448 TSval=3563222260 TSecr=4133353728 [TCP segment of a reassembled PDU]"
"1003","2.270066","23.48.104.108","192.168.0.104","TCP","1514","443  >  49525 [ACK] Seq=945574 Ack=138306 Win=214144 Len=1448 TSval=3563222260 TSecr=4133353728 [TCP segment of a reassembled PDU]"
"1004","2.270066","23.48.104.108","192.168.0.104","TCP","1514","443  >  49525 [ACK] Seq=947022 Ack=138306 Win=214144 Len=1448 TSval=3563222260 TSecr=4133353728 [TCP segment of a reassembled PDU]"
"1005","2.270067","23.48.104.108","192.168.0.104","TCP","1514","443  >  49525 [ACK] Seq=948470 Ack=138306 Win=214144 Len=1448 TSval=3563222260 TSecr=4133353728 [TCP segment of a reassembled PDU]"
"1006","2.270067","23.48.104.108","192.168.0.104","TCP","1514","443  >  49525 [ACK] Seq=949918 Ack=138306 Win=214144 Len=1448 TSval=3563222260 TSecr=4133353728 [TCP segment of a reassembled PDU]"
"1007","2.270067","23.48.104.108","192.168.0.104","TCP","1514","443  >  49525 [ACK] Seq=951366 Ack=138306 Win=214144 Len=1448 TSval=3563222260 TSecr=4133353728 [TCP segment of a reassembled PDU]"
"1008","2.270068","23.48.104.108","192.168.0.104","TCP","1514","443  >  49525 [ACK] Seq=952814 Ack=138306 Win=214144 Len=1448 TSval=3563222260 TSecr=4133353728 [TCP segment of a reassembled PDU]"
"1009","2.270068","23.48.104.108","192.168.0.104","TCP","1514","443  >  49525 [ACK] Seq=954262 Ack=138306 Win=214144 Len=1448 TSval=3563222260 TSecr=4133353728 [TCP segment of a reassembled PDU]"
"1010","2.270214","192.168.0.104","23.48.104.108","TCP","66","49525  >  443 [ACK] Seq=138306 Ack=955710 Win=840576 Len=0 TSval=4133353770 TSecr=3563222260"
"1011","2.278339","23.48.104.108","192.168.0.104","TLSv1.3","544","Application Data"
"1012","2.278340","23.48.104.108","192.168.0.104","TLSv1.3","1514","Application Data"
"1013","2.278341","23.48.104.108","192.168.0.104","TCP","1514","443  >  49525 [ACK] Seq=957636 Ack=138306 Win=214144 Len=1448 TSval=3563222260 TSecr=4133353728 [TCP segment of a reassembled PDU]"
"1014","2.278341","23.48.104.108","192.168.0.104","TCP","1514","443  >  49525 [ACK] Seq=959084 Ack=138306 Win=214144 Len=1448 TSval=3563222260 TSecr=4133353728 [TCP segment of a reassembled PDU]"
"1015","2.278341","23.48.104.108","192.168.0.104","TCP","1514","443  >  49525 [ACK] Seq=960532 Ack=138306 Win=214144 Len=1448 TSval=3563222260 TSecr=4133353728 [TCP segment of a reassembled PDU]"
"1016","2.278342","23.48.104.108","192.168.0.104","TCP","1514","443  >  49525 [ACK] Seq=961980 Ack=138306 Win=214144 Len=1448 TSval=3563222260 TSecr=4133353728 [TCP segment of a reassembled PDU]"
"1017","2.278343","23.48.104.108","192.168.0.104","TLSv1.3","1512","Application Data"
"1018","2.278343","23.48.104.108","192.168.0.104","TCP","1514","443  >  49525 [ACK] Seq=964874 Ack=138306 Win=214144 Len=1448 TSval=3563222261 TSecr=4133353728 [TCP segment of a reassembled PDU]"
"1019","2.278344","23.48.104.108","192.168.0.104","TCP","1514","443  >  49525 [ACK] Seq=966322 Ack=138306 Win=214144 Len=1448 TSval=3563222261 TSecr=4133353728 [TCP segment of a reassembled PDU]"
"1020","2.278344","23.48.104.108","192.168.0.104","TCP","1514","443  >  49525 [ACK] Seq=967770 Ack=138306 Win=214144 Len=1448 TSval=3563222261 TSecr=4133353728 [TCP segment of a reassembled PDU]"
"1021","2.278344","23.48.104.108","192.168.0.104","TCP","1514","443  >  49525 [ACK] Seq=969218 Ack=138306 Win=214144 Len=1448 TSval=3563222261 TSecr=4133353728 [TCP segment of a reassembled PDU]"
"1022","2.278345","23.48.104.108","192.168.0.104","TCP","1514","443  >  49525 [ACK] Seq=970666 Ack=138306 Win=214144 Len=1448 TSval=3563222261 TSecr=4133353728 [TCP segment of a reassembled PDU]"
"1023","2.278345","23.48.104.108","192.168.0.104","TCP","1514","443  >  49525 [ACK] Seq=972114 Ack=138306 Win=214144 Len=1448 TSval=3563222261 TSecr=4133353728 [TCP segment of a reassembled PDU]"
"1024","2.278346","23.48.104.108","192.168.0.104","TCP","1514","443  >  49525 [ACK] Seq=973562 Ack=138306 Win=214144 Len=1448 TSval=3563222261 TSecr=4133353728 [TCP segment of a reassembled PDU]"
"1025","2.278346","23.48.104.108","192.168.0.104","TCP","1514","443  >  49525 [ACK] Seq=975010 Ack=138306 Win=214144 Len=1448 TSval=3563222261 TSecr=4133353728 [TCP segment of a reassembled PDU]"
"1026","2.278347","23.48.104.108","192.168.0.104","TCP","1514","443  >  49525 [ACK] Seq=976458 Ack=138306 Win=214144 Len=1448 TSval=3563222261 TSecr=4133353728 [TCP segment of a reassembled PDU]"
"1027","2.278347","23.48.104.108","192.168.0.104","TCP","1514","443  >  49525 [ACK] Seq=977906 Ack=138306 Win=214144 Len=1448 TSval=3563222261 TSecr=4133353728 [TCP segment of a reassembled PDU]"
"1028","2.278347","23.48.104.108","192.168.0.104","TCP","1514","443  >  49525 [ACK] Seq=979354 Ack=138306 Win=214144 Len=1448 TSval=3563222261 TSecr=4133353728 [TCP segment of a reassembled PDU]"
"1029","2.278348","23.48.104.108","192.168.0.104","TLSv1.3","544","Application Data"
"1030","2.278348","23.48.104.108","192.168.0.104","TLSv1.3","97","Application Data"
"1031","2.278349","23.48.104.108","192.168.0.104","TCP","1514","443  >  49525 [ACK] Seq=981311 Ack=138306 Win=214144 Len=1448 TSval=3563222261 TSecr=4133353728 [TCP segment of a reassembled PDU]"
"1032","2.278349","23.48.104.108","192.168.0.104","TCP","1514","443  >  49525 [ACK] Seq=982759 Ack=138306 Win=214144 Len=1448 TSval=3563222261 TSecr=4133353728 [TCP segment of a reassembled PDU]"
"1033","2.278349","23.48.104.108","192.168.0.104","TCP","1514","443  >  49525 [ACK] Seq=984207 Ack=138306 Win=214144 Len=1448 TSval=3563222261 TSecr=4133353728 [TCP segment of a reassembled PDU]"
"1034","2.278350","23.48.104.108","192.168.0.104","TCP","1514","443  >  49525 [ACK] Seq=985655 Ack=138306 Win=214144 Len=1448 TSval=3563222261 TSecr=4133353728 [TCP segment of a reassembled PDU]"
"1035","2.278350","23.48.104.108","192.168.0.104","TCP","1514","443  >  49525 [ACK] Seq=987103 Ack=138306 Win=214144 Len=1448 TSval=3563222261 TSecr=4133353728 [TCP segment of a reassembled PDU]"
"1036","2.278351","23.48.104.108","192.168.0.104","TCP","1514","443  >  49525 [ACK] Seq=988551 Ack=138306 Win=214144 Len=1448 TSval=3563222261 TSecr=4133353728 [TCP segment of a reassembled PDU]"
"1037","2.278351","23.48.104.108","192.168.0.104","TCP","1514","443  >  49525 [ACK] Seq=989999 Ack=138306 Win=214144 Len=1448 TSval=3563222261 TSecr=4133353728 [TCP segment of a reassembled PDU]"
"1038","2.278352","23.48.104.108","192.168.0.104","TCP","1514","443  >  49525 [ACK] Seq=991447 Ack=138306 Win=214144 Len=1448 TSval=3563222261 TSecr=4133353728 [TCP segment of a reassembled PDU]"
"1039","2.278352","23.48.104.108","192.168.0.104","TCP","1514","443  >  49525 [ACK] Seq=992895 Ack=138306 Win=214144 Len=1448 TSval=3563222261 TSecr=4133353728 [TCP segment of a reassembled PDU]"
"1040","2.278353","23.48.104.108","192.168.0.104","TCP","1514","443  >  49525 [ACK] Seq=994343 Ack=138306 Win=214144 Len=1448 TSval=3563222261 TSecr=4133353728 [TCP segment of a reassembled PDU]"
"1041","2.278353","23.48.104.108","192.168.0.104","TCP","1514","443  >  49525 [ACK] Seq=995791 Ack=138306 Win=214144 Len=1448 TSval=3563222261 TSecr=4133353728 [TCP segment of a reassembled PDU]"
"1042","2.278353","23.48.104.108","192.168.0.104","TLSv1.3","544","Application Data"
"1043","2.278354","23.48.104.108","192.168.0.104","TLSv1.3","1514","Application Data"
"1044","2.278355","23.48.104.108","192.168.0.104","TCP","1514","443  >  49525 [ACK] Seq=999165 Ack=138306 Win=214144 Len=1448 TSval=3563222262 TSecr=4133353728 [TCP segment of a reassembled PDU]"
"1045","2.278424","23.48.104.108","192.168.0.104","TCP","1514","443  >  49525 [ACK] Seq=1000613 Ack=138306 Win=214144 Len=1448 TSval=3563222262 TSecr=4133353728 [TCP segment of a reassembled PDU]"
"1046","2.278424","23.48.104.108","192.168.0.104","TLSv1.3","1514","Application Data"
"1047","2.278425","23.48.104.108","192.168.0.104","TCP","1514","443  >  49525 [ACK] Seq=1003509 Ack=138306 Win=214144 Len=1448 TSval=3563222262 TSecr=4133353728 [TCP segment of a reassembled PDU]"
"1048","2.278425","23.48.104.108","192.168.0.104","TCP","1514","443  >  49525 [ACK] Seq=1004957 Ack=138306 Win=214144 Len=1448 TSval=3563222262 TSecr=4133353728 [TCP segment of a reassembled PDU]"
"1049","2.278426","23.48.104.108","192.168.0.104","TCP","1514","443  >  49525 [ACK] Seq=1006405 Ack=138306 Win=214144 Len=1448 TSval=3563222262 TSecr=4133353728 [TCP segment of a reassembled PDU]"
"1050","2.278426","23.48.104.108","192.168.0.104","TCP","1514","443  >  49525 [ACK] Seq=1007853 Ack=138306 Win=214144 Len=1448 TSval=3563222262 TSecr=4133353728 [TCP segment of a reassembled PDU]"
"1051","2.278427","23.48.104.108","192.168.0.104","TCP","1514","443  >  49525 [ACK] Seq=1009301 Ack=138306 Win=214144 Len=1448 TSval=3563222262 TSecr=4133353728 [TCP segment of a reassembled PDU]"
"1052","2.278427","23.48.104.108","192.168.0.104","TCP","1514","443  >  49525 [ACK] Seq=1010749 Ack=138306 Win=214144 Len=1448 TSval=3563222262 TSecr=4133353728 [TCP segment of a reassembled PDU]"
"1053","2.278427","23.48.104.108","192.168.0.104","TCP","1514","443  >  49525 [ACK] Seq=1012197 Ack=138306 Win=214144 Len=1448 TSval=3563222262 TSecr=4133353728 [TCP segment of a reassembled PDU]"
"1054","2.278428","23.48.104.108","192.168.0.104","TCP","1514","443  >  49525 [ACK] Seq=1013645 Ack=138306 Win=214144 Len=1448 TSval=3563222262 TSecr=4133353728 [TCP segment of a reassembled PDU]"
"1055","2.278428","23.48.104.108","192.168.0.104","TCP","1514","443  >  49525 [ACK] Seq=1015093 Ack=138306 Win=214144 Len=1448 TSval=3563222262 TSecr=4133353728 [TCP segment of a reassembled PDU]"
"1056","2.278429","23.48.104.108","192.168.0.104","TCP","1514","443  >  49525 [ACK] Seq=1016541 Ack=138306 Win=214144 Len=1448 TSval=3563222262 TSecr=4133353728 [TCP segment of a reassembled PDU]"
"1057","2.278429","23.48.104.108","192.168.0.104","TLSv1.3","1148","Application Data"
"1058","2.278430","23.48.104.108","192.168.0.104","TLSv1.3","1514","Application Data"
"1059","2.278430","23.48.104.108","192.168.0.104","TCP","1514","443  >  49525 [ACK] Seq=1020519 Ack=138306 Win=214144 Len=1448 TSval=3563222263 TSecr=4133353728 [TCP segment of a reassembled PDU]"
"1060","2.278430","23.48.104.108","192.168.0.104","TCP","1514","443  >  49525 [ACK] Seq=1021967 Ack=138306 Win=214144 Len=1448 TSval=3563222263 TSecr=4133353728 [TCP segment of a reassembled PDU]"
"1061","2.278431","23.48.104.108","192.168.0.104","TCP","1514","443  >  49525 [ACK] Seq=1023415 Ack=138306 Win=214144 Len=1448 TSval=3563222263 TSecr=4133353728 [TCP segment of a reassembled PDU]"
"1062","2.278431","23.48.104.108","192.168.0.104","TCP","1514","443  >  49525 [ACK] Seq=1024863 Ack=138306 Win=214144 Len=1448 TSval=3563222263 TSecr=4133353728 [TCP segment of a reassembled PDU]"
"1063","2.278432","23.48.104.108","192.168.0.104","TLSv1.3","1481","Application Data"
"1064","2.278432","23.48.104.108","192.168.0.104","TCP","1514","443  >  49525 [ACK] Seq=1027726 Ack=138306 Win=214144 Len=1448 TSval=3563222263 TSecr=4133353728 [TCP segment of a reassembled PDU]"
"1065","2.278432","23.48.104.108","192.168.0.104","TCP","1514","443  >  49525 [ACK] Seq=1029174 Ack=138306 Win=214144 Len=1448 TSval=3563222263 TSecr=4133353728 [TCP segment of a reassembled PDU]"
"1066","2.278433","23.48.104.108","192.168.0.104","TCP","1514","443  >  49525 [ACK] Seq=1030622 Ack=138306 Win=214144 Len=1448 TSval=3563222263 TSecr=4133353728 [TCP segment of a reassembled PDU]"
"1067","2.278433","23.48.104.108","192.168.0.104","TCP","1514","443  >  49525 [ACK] Seq=1032070 Ack=138306 Win=214144 Len=1448 TSval=3563222263 TSecr=4133353728 [TCP segment of a reassembled PDU]"
"1068","2.278434","23.48.104.108","192.168.0.104","TCP","1514","443  >  49525 [ACK] Seq=1033518 Ack=138306 Win=214144 Len=1448 TSval=3563222263 TSecr=4133353728 [TCP segment of a reassembled PDU]"
"1069","2.279066","192.168.0.104","23.48.104.108","TCP","66","49525  >  443 [ACK] Seq=138306 Ack=1034966 Win=840576 Len=0 TSval=4133353778 TSecr=3563222261"
"1070","2.279171","23.48.104.108","192.168.0.104","TCP","1514","443  >  49525 [ACK] Seq=1034966 Ack=138306 Win=214144 Len=1448 TSval=3563222263 TSecr=4133353728 [TCP segment of a reassembled PDU]"
"1071","2.279171","23.48.104.108","192.168.0.104","TCP","1514","443  >  49525 [ACK] Seq=1036414 Ack=138306 Win=214144 Len=1448 TSval=3563222263 TSecr=4133353728 [TCP segment of a reassembled PDU]"
"1072","2.279358","192.168.0.104","23.48.104.108","TCP","66","49525  >  443 [ACK] Seq=138306 Ack=1037862 Win=840576 Len=0 TSval=4133353778 TSecr=3563222263"
"1073","2.279781","23.48.104.108","192.168.0.104","TCP","1514","443  >  49525 [ACK] Seq=1037862 Ack=138306 Win=214144 Len=1448 TSval=3563222263 TSecr=4133353728 [TCP segment of a reassembled PDU]"
"1074","2.279781","23.48.104.108","192.168.0.104","TCP","1514","443  >  49525 [ACK] Seq=1039310 Ack=138306 Win=214144 Len=1448 TSval=3563222263 TSecr=4133353728 [TCP segment of a reassembled PDU]"
"1075","2.279782","23.48.104.108","192.168.0.104","TCP","1514","443  >  49525 [ACK] Seq=1040758 Ack=138306 Win=214144 Len=1448 TSval=3563222263 TSecr=4133353728 [TCP segment of a reassembled PDU]"
"1076","2.279782","23.48.104.108","192.168.0.104","TCP","1514","443  >  49525 [ACK] Seq=1042206 Ack=138306 Win=214144 Len=1448 TSval=3563222263 TSecr=4133353728 [TCP segment of a reassembled PDU]"
"1077","2.279783","23.48.104.108","192.168.0.104","TLSv1.3","544","Application Data"
"1078","2.279783","23.48.104.108","192.168.0.104","TLSv1.3","97","Application Data"
"1079","2.279889","192.168.0.104","23.48.104.108","TCP","66","49525  >  443 [ACK] Seq=138306 Ack=1044163 Win=840576 Len=0 TSval=4133353779 TSecr=3563222263"
"1080","2.280343","23.48.104.108","192.168.0.104","TCP","1514","443  >  49525 [ACK] Seq=1044163 Ack=138306 Win=214144 Len=1448 TSval=3563222266 TSecr=4133353728 [TCP segment of a reassembled PDU]"
"1081","2.280344","23.48.104.108","192.168.0.104","TCP","1514","443  >  49525 [ACK] Seq=1045611 Ack=138306 Win=214144 Len=1448 TSval=3563222266 TSecr=4133353728 [TCP segment of a reassembled PDU]"
"1082","2.280344","23.48.104.108","192.168.0.104","TCP","1514","443  >  49525 [ACK] Seq=1047059 Ack=138306 Win=214144 Len=1448 TSval=3563222266 TSecr=4133353728 [TCP segment of a reassembled PDU]"
"1083","2.280345","23.48.104.108","192.168.0.104","TCP","1514","443  >  49525 [ACK] Seq=1048507 Ack=138306 Win=214144 Len=1448 TSval=3563222266 TSecr=4133353728 [TCP segment of a reassembled PDU]"
"1084","2.280345","23.48.104.108","192.168.0.104","TCP","1514","443  >  49525 [ACK] Seq=1049955 Ack=138306 Win=214144 Len=1448 TSval=3563222266 TSecr=4133353728 [TCP segment of a reassembled PDU]"
"1085","2.280345","23.48.104.108","192.168.0.104","TCP","1514","443  >  49525 [ACK] Seq=1051403 Ack=138306 Win=214144 Len=1448 TSval=3563222266 TSecr=4133353728 [TCP segment of a reassembled PDU]"
"1086","2.280346","23.48.104.108","192.168.0.104","TLSv1.3","1353","Application Data"
"1087","2.280346","23.48.104.108","192.168.0.104","TCP","1514","443  >  49525 [ACK] Seq=1054138 Ack=138306 Win=214144 Len=1448 TSval=3563222267 TSecr=4133353728 [TCP segment of a reassembled PDU]"
"1088","2.280346","23.48.104.108","192.168.0.104","TCP","1514","443  >  49525 [ACK] Seq=1055586 Ack=138306 Win=214144 Len=1448 TSval=3563222267 TSecr=4133353728 [TCP segment of a reassembled PDU]"
"1089","2.280347","23.48.104.108","192.168.0.104","TCP","1514","443  >  49525 [ACK] Seq=1057034 Ack=138306 Win=214144 Len=1448 TSval=3563222267 TSecr=4133353728 [TCP segment of a reassembled PDU]"
"1090","2.280347","23.48.104.108","192.168.0.104","TCP","1514","443  >  49525 [ACK] Seq=1058482 Ack=138306 Win=214144 Len=1448 TSval=3563222267 TSecr=4133353728 [TCP segment of a reassembled PDU]"
"1091","2.280348","23.48.104.108","192.168.0.104","TCP","1514","443  >  49525 [ACK] Seq=1059930 Ack=138306 Win=214144 Len=1448 TSval=3563222267 TSecr=4133353728 [TCP segment of a reassembled PDU]"
"1092","2.280348","23.48.104.108","192.168.0.104","TCP","1514","443  >  49525 [ACK] Seq=1061378 Ack=138306 Win=214144 Len=1448 TSval=3563222267 TSecr=4133353728 [TCP segment of a reassembled PDU]"
"1093","2.280348","23.48.104.108","192.168.0.104","TCP","1514","443  >  49525 [ACK] Seq=1062826 Ack=138306 Win=214144 Len=1448 TSval=3563222267 TSecr=4133353728 [TCP segment of a reassembled PDU]"
"1094","2.280349","23.48.104.108","192.168.0.104","TCP","1514","443  >  49525 [ACK] Seq=1064274 Ack=138306 Win=214144 Len=1448 TSval=3563222267 TSecr=4133353728 [TCP segment of a reassembled PDU]"
"1095","2.280349","23.48.104.108","192.168.0.104","TCP","1514","443  >  49525 [ACK] Seq=1065722 Ack=138306 Win=214144 Len=1448 TSval=3563222267 TSecr=4133353728 [TCP segment of a reassembled PDU]"
"1096","2.280350","23.48.104.108","192.168.0.104","TCP","1514","443  >  49525 [ACK] Seq=1067170 Ack=138306 Win=214144 Len=1448 TSval=3563222267 TSecr=4133353728 [TCP segment of a reassembled PDU]"
"1097","2.280350","23.48.104.108","192.168.0.104","TCP","1514","443  >  49525 [ACK] Seq=1068618 Ack=138306 Win=214144 Len=1448 TSval=3563222267 TSecr=4133353728 [TCP segment of a reassembled PDU]"
"1098","2.280350","23.48.104.108","192.168.0.104","TLSv1.3","544","Application Data"
"1099","2.280351","23.48.104.108","192.168.0.104","TLSv1.3","97","Application Data"
"1100","2.280351","23.48.104.108","192.168.0.104","TCP","1514","443  >  49525 [ACK] Seq=1070575 Ack=138306 Win=214144 Len=1448 TSval=3563222269 TSecr=4133353728 [TCP segment of a reassembled PDU]"
"1101","2.280351","23.48.104.108","192.168.0.104","TCP","1514","443  >  49525 [ACK] Seq=1072023 Ack=138306 Win=214144 Len=1448 TSval=3563222269 TSecr=4133353728 [TCP segment of a reassembled PDU]"
"1102","2.280352","23.48.104.108","192.168.0.104","TCP","1514","443  >  49525 [ACK] Seq=1073471 Ack=138306 Win=214144 Len=1448 TSval=3563222269 TSecr=4133353728 [TCP segment of a reassembled PDU]"
"1103","2.280352","23.48.104.108","192.168.0.104","TCP","1514","443  >  49525 [ACK] Seq=1074919 Ack=138306 Win=214144 Len=1448 TSval=3563222269 TSecr=4133353728 [TCP segment of a reassembled PDU]"
"1104","2.280352","23.48.104.108","192.168.0.104","TCP","1514","443  >  49525 [ACK] Seq=1076367 Ack=138306 Win=214144 Len=1448 TSval=3563222269 TSecr=4133353728 [TCP segment of a reassembled PDU]"
"1105","2.280353","23.48.104.108","192.168.0.104","TCP","1514","443  >  49525 [ACK] Seq=1077815 Ack=138306 Win=214144 Len=1448 TSval=3563222269 TSecr=4133353728 [TCP segment of a reassembled PDU]"
"1106","2.280353","23.48.104.108","192.168.0.104","TCP","1514","443  >  49525 [ACK] Seq=1079263 Ack=138306 Win=214144 Len=1448 TSval=3563222269 TSecr=4133353728 [TCP segment of a reassembled PDU]"
"1107","2.280354","23.48.104.108","192.168.0.104","TLSv1.3","528","Application Data"
"1108","2.280354","23.48.104.108","192.168.0.104","TCP","1514","443  >  49525 [ACK] Seq=1081173 Ack=138306 Win=214144 Len=1448 TSval=3563222269 TSecr=4133353728 [TCP segment of a reassembled PDU]"
"1109","2.280354","23.48.104.108","192.168.0.104","TCP","1514","443  >  49525 [ACK] Seq=1082621 Ack=138306 Win=214144 Len=1448 TSval=3563222269 TSecr=4133353728 [TCP segment of a reassembled PDU]"
"1110","2.280355","23.48.104.108","192.168.0.104","TCP","1514","443  >  49525 [ACK] Seq=1084069 Ack=138306 Win=214144 Len=1448 TSval=3563222269 TSecr=4133353728 [TCP segment of a reassembled PDU]"
"1111","2.280355","23.48.104.108","192.168.0.104","TCP","1514","443  >  49525 [ACK] Seq=1085517 Ack=138306 Win=214144 Len=1448 TSval=3563222269 TSecr=4133353728 [TCP segment of a reassembled PDU]"
"1112","2.280356","23.48.104.108","192.168.0.104","TCP","1514","443  >  49525 [ACK] Seq=1086965 Ack=138306 Win=214144 Len=1448 TSval=3563222269 TSecr=4133353728 [TCP segment of a reassembled PDU]"
"1113","2.280494","192.168.0.104","23.48.104.108","TCP","66","49525  >  443 [ACK] Seq=138306 Ack=1088413 Win=840576 Len=0 TSval=4133353779 TSecr=3563222267"
"1114","2.280593","23.48.104.108","192.168.0.104","TCP","1514","443  >  49525 [ACK] Seq=1088413 Ack=138306 Win=214144 Len=1448 TSval=3563222269 TSecr=4133353728 [TCP segment of a reassembled PDU]"
"1115","2.280594","23.48.104.108","192.168.0.104","TCP","1514","443  >  49525 [ACK] Seq=1089861 Ack=138306 Win=214144 Len=1448 TSval=3563222269 TSecr=4133353728 [TCP segment of a reassembled PDU]"
"1116","2.280594","23.48.104.108","192.168.0.104","TCP","1514","443  >  49525 [ACK] Seq=1091309 Ack=138306 Win=214144 Len=1448 TSval=3563222269 TSecr=4133353728 [TCP segment of a reassembled PDU]"
"1117","2.280595","23.48.104.108","192.168.0.104","TCP","1514","443  >  49525 [ACK] Seq=1092757 Ack=138306 Win=214144 Len=1448 TSval=3563222269 TSecr=4133353728 [TCP segment of a reassembled PDU]"
"1118","2.280595","23.48.104.108","192.168.0.104","TLSv1.3","1272","Application Data"
"1119","2.280595","23.48.104.108","192.168.0.104","TLSv1.3","105","Application Data"
"1120","2.280596","23.48.104.108","192.168.0.104","TLSv1.3","97","Application Data"
"1121","2.280991","192.168.0.104","23.48.104.108","TCP","66","49525  >  443 [ACK] Seq=138306 Ack=1095481 Win=840576 Len=0 TSval=4133353781 TSecr=3563222270"
"1122","2.336297","192.168.0.104","23.48.104.108","TCP","1514","49525  >  443 [ACK] Seq=138306 Ack=1095481 Win=840576 Len=1448 TSval=4133353836 TSecr=3563222270 [TCP segment of a reassembled PDU]"
"1123","2.336307","192.168.0.104","23.48.104.108","TCP","1514","49525  >  443 [ACK] Seq=139754 Ack=1095481 Win=840576 Len=1448 TSval=4133353836 TSecr=3563222270 [TCP segment of a reassembled PDU]"
"1124","2.336310","192.168.0.104","23.48.104.108","TCP","1514","49525  >  443 [ACK] Seq=141202 Ack=1095481 Win=840576 Len=1448 TSval=4133353836 TSecr=3563222270 [TCP segment of a reassembled PDU]"
"1125","2.336351","192.168.0.104","23.48.104.108","TLSv1.3","1345","Application Data"
"1126","2.336444","192.168.0.104","23.48.104.108","TCP","1514","49525  >  443 [ACK] Seq=143929 Ack=1095481 Win=840576 Len=1448 TSval=4133353836 TSecr=3563222270 [TCP segment of a reassembled PDU]"
"1127","2.336448","192.168.0.104","23.48.104.108","TCP","1514","49525  >  443 [ACK] Seq=145377 Ack=1095481 Win=840576 Len=1448 TSval=4133353836 TSecr=3563222270 [TCP segment of a reassembled PDU]"
"1128","2.336465","192.168.0.104","23.48.104.108","TLSv1.3","881","Application Data"
"1129","2.350992","23.48.104.108","192.168.0.104","TLSv1.3","294","Application Data"
"1130","2.351234","192.168.0.104","23.48.104.108","TCP","66","49525  >  443 [ACK] Seq=147640 Ack=1095709 Win=840576 Len=0 TSval=4133353851 TSecr=3563222345"
"1131","2.352844","23.48.104.108","192.168.0.104","TCP","1514","443  >  49525 [ACK] Seq=1095709 Ack=138306 Win=214144 Len=1448 TSval=3563222345 TSecr=4133353781 [TCP segment of a reassembled PDU]"
"1132","2.352845","23.48.104.108","192.168.0.104","TCP","1514","443  >  49525 [ACK] Seq=1097157 Ack=138306 Win=214144 Len=1448 TSval=3563222345 TSecr=4133353781 [TCP segment of a reassembled PDU]"
"1133","2.352845","23.48.104.108","192.168.0.104","TCP","1514","443  >  49525 [ACK] Seq=1098605 Ack=138306 Win=214144 Len=1448 TSval=3563222345 TSecr=4133353781 [TCP segment of a reassembled PDU]"
"1134","2.352846","23.48.104.108","192.168.0.104","TCP","1514","443  >  49525 [ACK] Seq=1100053 Ack=138306 Win=214144 Len=1448 TSval=3563222345 TSecr=4133353781 [TCP segment of a reassembled PDU]"
"1135","2.352846","23.48.104.108","192.168.0.104","TCP","1514","443  >  49525 [ACK] Seq=1101501 Ack=138306 Win=214144 Len=1448 TSval=3563222345 TSecr=4133353781 [TCP segment of a reassembled PDU]"
"1136","2.352847","23.48.104.108","192.168.0.104","TCP","1514","443  >  49525 [ACK] Seq=1102949 Ack=138306 Win=214144 Len=1448 TSval=3563222345 TSecr=4133353781 [TCP segment of a reassembled PDU]"
"1137","2.352847","23.48.104.108","192.168.0.104","TCP","1514","443  >  49525 [ACK] Seq=1104397 Ack=138306 Win=214144 Len=1448 TSval=3563222345 TSecr=4133353781 [TCP segment of a reassembled PDU]"
"1138","2.352847","23.48.104.108","192.168.0.104","TCP","1514","443  >  49525 [ACK] Seq=1105845 Ack=138306 Win=214144 Len=1448 TSval=3563222345 TSecr=4133353781 [TCP segment of a reassembled PDU]"
"1139","2.352848","23.48.104.108","192.168.0.104","TCP","1514","443  >  49525 [ACK] Seq=1107293 Ack=138306 Win=214144 Len=1448 TSval=3563222345 TSecr=4133353781 [TCP segment of a reassembled PDU]"
"1140","2.352848","23.48.104.108","192.168.0.104","TCP","1514","443  >  49525 [ACK] Seq=1108741 Ack=138306 Win=214144 Len=1448 TSval=3563222345 TSecr=4133353781 [TCP segment of a reassembled PDU]"
"1141","2.352848","23.48.104.108","192.168.0.104","TCP","1514","443  >  49525 [ACK] Seq=1110189 Ack=138306 Win=214144 Len=1448 TSval=3563222345 TSecr=4133353781 [TCP segment of a reassembled PDU]"
"1142","2.352849","23.48.104.108","192.168.0.104","TLSv1.3","544","Application Data"
"1143","2.352849","23.48.104.108","192.168.0.104","TLSv1.3","97","Application Data"
"1144","2.352849","23.48.104.108","192.168.0.104","TCP","1514","443  >  49525 [ACK] Seq=1112146 Ack=138306 Win=214144 Len=1448 TSval=3563222346 TSecr=4133353781 [TCP segment of a reassembled PDU]"
"1145","2.352850","23.48.104.108","192.168.0.104","TCP","1514","443  >  49525 [ACK] Seq=1113594 Ack=138306 Win=214144 Len=1448 TSval=3563222346 TSecr=4133353781 [TCP segment of a reassembled PDU]"
"1146","2.352850","23.48.104.108","192.168.0.104","TCP","1514","443  >  49525 [ACK] Seq=1115042 Ack=138306 Win=214144 Len=1448 TSval=3563222346 TSecr=4133353781 [TCP segment of a reassembled PDU]"
"1147","2.352851","23.48.104.108","192.168.0.104","TCP","1514","443  >  49525 [ACK] Seq=1116490 Ack=138306 Win=214144 Len=1448 TSval=3563222346 TSecr=4133353781 [TCP segment of a reassembled PDU]"
"1148","2.352991","192.168.0.104","23.48.104.108","TCP","66","49525  >  443 [ACK] Seq=147640 Ack=1117938 Win=840576 Len=0 TSval=4133353853 TSecr=3563222345"
"1149","2.353602","23.48.104.108","192.168.0.104","TCP","1514","443  >  49525 [ACK] Seq=1117938 Ack=138306 Win=214144 Len=1448 TSval=3563222346 TSecr=4133353781 [TCP segment of a reassembled PDU]"
"1150","2.353603","23.48.104.108","192.168.0.104","TCP","1514","443  >  49525 [ACK] Seq=1119386 Ack=138306 Win=214144 Len=1448 TSval=3563222346 TSecr=4133353781 [TCP segment of a reassembled PDU]"
"1151","2.353603","23.48.104.108","192.168.0.104","TCP","1514","443  >  49525 [ACK] Seq=1120834 Ack=138306 Win=214144 Len=1448 TSval=3563222346 TSecr=4133353781 [TCP segment of a reassembled PDU]"
"1152","2.353603","23.48.104.108","192.168.0.104","TCP","1514","443  >  49525 [ACK] Seq=1122282 Ack=138306 Win=214144 Len=1448 TSval=3563222346 TSecr=4133353781 [TCP segment of a reassembled PDU]"
"1153","2.353604","23.48.104.108","192.168.0.104","TCP","1514","443  >  49525 [ACK] Seq=1123730 Ack=138306 Win=214144 Len=1448 TSval=3563222346 TSecr=4133353781 [TCP segment of a reassembled PDU]"
"1154","2.353604","23.48.104.108","192.168.0.104","TCP","1514","443  >  49525 [ACK] Seq=1125178 Ack=138306 Win=214144 Len=1448 TSval=3563222346 TSecr=4133353781 [TCP segment of a reassembled PDU]"
"1155","2.353605","23.48.104.108","192.168.0.104","TCP","1514","443  >  49525 [ACK] Seq=1126626 Ack=138306 Win=214144 Len=1448 TSval=3563222346 TSecr=4133353781 [TCP segment of a reassembled PDU]"
"1156","2.353605","23.48.104.108","192.168.0.104","TLSv1.3","544","Application Data"
"1157","2.353606","23.48.104.108","192.168.0.104","TLSv1.3","1514","Application Data"
"1158","2.353606","23.48.104.108","192.168.0.104","TCP","1514","443  >  49525 [ACK] Seq=1130000 Ack=138306 Win=214144 Len=1448 TSval=3563222346 TSecr=4133353781 [TCP segment of a reassembled PDU]"
"1159","2.353607","23.48.104.108","192.168.0.104","TCP","1514","443  >  49525 [ACK] Seq=1131448 Ack=138306 Win=214144 Len=1448 TSval=3563222346 TSecr=4133353781 [TCP segment of a reassembled PDU]"
"1160","2.353607","23.48.104.108","192.168.0.104","TCP","1514","443  >  49525 [ACK] Seq=1132896 Ack=138306 Win=214144 Len=1448 TSval=3563222346 TSecr=4133353781 [TCP segment of a reassembled PDU]"
"1161","2.353607","23.48.104.108","192.168.0.104","TLSv1.3","1479","Application Data"
"1162","2.353863","192.168.0.104","23.48.104.108","TCP","66","49525  >  443 [ACK] Seq=147640 Ack=1135757 Win=840576 Len=0 TSval=4133353853 TSecr=3563222346"
"1163","2.354532","23.48.104.108","192.168.0.104","TLSv1.3","592","Application Data"
"1164","2.355127","23.48.104.108","192.168.0.104","TLSv1.3","588","Application Data"
"1165","2.355172","192.168.0.104","23.48.104.108","TCP","66","49525  >  443 [ACK] Seq=147640 Ack=1136283 Win=840576 Len=0 TSval=4133353855 TSecr=3563222349"
"1166","2.356672","192.168.0.104","23.48.104.108","TCP","66","49525  >  443 [ACK] Seq=147640 Ack=1136805 Win=840576 Len=0 TSval=4133353856 TSecr=3563222349"
"1167","2.359636","23.48.104.108","192.168.0.104","TCP","66","443  >  49525 [ACK] Seq=1136805 Ack=141202 Win=219904 Len=0 TSval=3563222354 TSecr=4133353836"
"1168","2.360324","23.48.104.108","192.168.0.104","TCP","66","443  >  49525 [ACK] Seq=1136805 Ack=143929 Win=225664 Len=0 TSval=3563222354 TSecr=4133353836"
"1169","2.361184","23.48.104.108","192.168.0.104","TCP","66","443  >  49525 [ACK] Seq=1136805 Ack=146825 Win=231552 Len=0 TSval=3563222355 TSecr=4133353836"
"1170","2.381378","23.48.104.108","192.168.0.104","TLSv1.3","644","Application Data"
"1171","2.381378","23.48.104.108","192.168.0.104","TCP","1514","443  >  49525 [ACK] Seq=1137383 Ack=147640 Win=234368 Len=1448 TSval=3563222371 TSecr=4133353836 [TCP segment of a reassembled PDU]"
"1172","2.381379","23.48.104.108","192.168.0.104","TCP","1514","443  >  49525 [ACK] Seq=1138831 Ack=147640 Win=234368 Len=1448 TSval=3563222371 TSecr=4133353836 [TCP segment of a reassembled PDU]"
"1173","2.381379","23.48.104.108","192.168.0.104","TCP","1514","443  >  49525 [ACK] Seq=1140279 Ack=147640 Win=234368 Len=1448 TSval=3563222371 TSecr=4133353836 [TCP segment of a reassembled PDU]"
"1174","2.381379","23.48.104.108","192.168.0.104","TCP","1514","443  >  49525 [ACK] Seq=1141727 Ack=147640 Win=234368 Len=1448 TSval=3563222371 TSecr=4133353836 [TCP segment of a reassembled PDU]"
"1175","2.381380","23.48.104.108","192.168.0.104","TCP","1514","443  >  49525 [ACK] Seq=1143175 Ack=147640 Win=234368 Len=1448 TSval=3563222371 TSecr=4133353836 [TCP segment of a reassembled PDU]"
"1176","2.381380","23.48.104.108","192.168.0.104","TCP","1514","443  >  49525 [ACK] Seq=1144623 Ack=147640 Win=234368 Len=1448 TSval=3563222371 TSecr=4133353836 [TCP segment of a reassembled PDU]"
"1177","2.381381","23.48.104.108","192.168.0.104","TLSv1.3","682","Application Data"
"1178","2.381381","23.48.104.108","192.168.0.104","TLSv1.3","97","Application Data"
"1179","2.381491","192.168.0.104","23.48.104.108","TCP","66","49525  >  443 [ACK] Seq=147640 Ack=1146718 Win=830656 Len=0 TSval=4133353881 TSecr=3563222374"
"1180","2.381789","192.168.0.104","23.48.104.108","TCP","66","[TCP Window Update] 49525  >  443 [ACK] Seq=147640 Ack=1146718 Win=840576 Len=0 TSval=4133353881 TSecr=3563222374"
"1181","2.403507","23.48.104.108","192.168.0.104","TCP","1514","443  >  49525 [ACK] Seq=1146718 Ack=147640 Win=234368 Len=1448 TSval=3563222395 TSecr=4133353881 [TCP segment of a reassembled PDU]"
"1182","2.403508","23.48.104.108","192.168.0.104","TCP","1514","443  >  49525 [ACK] Seq=1148166 Ack=147640 Win=234368 Len=1448 TSval=3563222395 TSecr=4133353881 [TCP segment of a reassembled PDU]"
"1183","2.403509","23.48.104.108","192.168.0.104","TCP","1514","443  >  49525 [ACK] Seq=1149614 Ack=147640 Win=234368 Len=1448 TSval=3563222395 TSecr=4133353881 [TCP segment of a reassembled PDU]"
"1184","2.403509","23.48.104.108","192.168.0.104","TCP","1514","443  >  49525 [ACK] Seq=1151062 Ack=147640 Win=234368 Len=1448 TSval=3563222395 TSecr=4133353881 [TCP segment of a reassembled PDU]"
"1185","2.403510","23.48.104.108","192.168.0.104","TCP","1514","443  >  49525 [ACK] Seq=1152510 Ack=147640 Win=234368 Len=1448 TSval=3563222395 TSecr=4133353881 [TCP segment of a reassembled PDU]"
"1186","2.403510","23.48.104.108","192.168.0.104","TCP","1514","443  >  49525 [ACK] Seq=1153958 Ack=147640 Win=234368 Len=1448 TSval=3563222395 TSecr=4133353881 [TCP segment of a reassembled PDU]"
"1187","2.403511","23.48.104.108","192.168.0.104","TCP","1514","443  >  49525 [ACK] Seq=1155406 Ack=147640 Win=234368 Len=1448 TSval=3563222395 TSecr=4133353881 [TCP segment of a reassembled PDU]"
"1188","2.403511","23.48.104.108","192.168.0.104","TCP","1514","443  >  49525 [ACK] Seq=1156854 Ack=147640 Win=234368 Len=1448 TSval=3563222395 TSecr=4133353881 [TCP segment of a reassembled PDU]"
"1189","2.403512","23.48.104.108","192.168.0.104","TCP","1514","443  >  49525 [ACK] Seq=1158302 Ack=147640 Win=234368 Len=1448 TSval=3563222395 TSecr=4133353881 [TCP segment of a reassembled PDU]"
"1190","2.403512","23.48.104.108","192.168.0.104","TCP","1514","443  >  49525 [ACK] Seq=1159750 Ack=147640 Win=234368 Len=1448 TSval=3563222395 TSecr=4133353881 [TCP segment of a reassembled PDU]"
"1191","2.403513","23.48.104.108","192.168.0.104","TCP","1514","443  >  49525 [ACK] Seq=1161198 Ack=147640 Win=234368 Len=1448 TSval=3563222395 TSecr=4133353881 [TCP segment of a reassembled PDU]"
"1192","2.403513","23.48.104.108","192.168.0.104","TLSv1.3","544","Application Data"
"1193","2.403513","23.48.104.108","192.168.0.104","TLSv1.3","97","Application Data"
"1194","2.404221","192.168.0.104","23.48.104.108","TCP","66","49525  >  443 [ACK] Seq=147640 Ack=1163155 Win=840576 Len=0 TSval=4133353903 TSecr=3563222395"
"1195","2.414048","23.48.104.108","192.168.0.104","TCP","1514","443  >  49525 [ACK] Seq=1163155 Ack=147640 Win=234368 Len=1448 TSval=3563222406 TSecr=4133353881 [TCP segment of a reassembled PDU]"
"1196","2.414048","23.48.104.108","192.168.0.104","TCP","1514","443  >  49525 [ACK] Seq=1164603 Ack=147640 Win=234368 Len=1448 TSval=3563222406 TSecr=4133353881 [TCP segment of a reassembled PDU]"
"1197","2.414049","23.48.104.108","192.168.0.104","TCP","1514","443  >  49525 [ACK] Seq=1166051 Ack=147640 Win=234368 Len=1448 TSval=3563222406 TSecr=4133353881 [TCP segment of a reassembled PDU]"
"1198","2.414049","23.48.104.108","192.168.0.104","TCP","1514","443  >  49525 [ACK] Seq=1167499 Ack=147640 Win=234368 Len=1448 TSval=3563222406 TSecr=4133353881 [TCP segment of a reassembled PDU]"
"1199","2.414049","23.48.104.108","192.168.0.104","TCP","1514","443  >  49525 [ACK] Seq=1168947 Ack=147640 Win=234368 Len=1448 TSval=3563222406 TSecr=4133353881 [TCP segment of a reassembled PDU]"
"1200","2.414050","23.48.104.108","192.168.0.104","TCP","1514","443  >  49525 [ACK] Seq=1170395 Ack=147640 Win=234368 Len=1448 TSval=3563222406 TSecr=4133353881 [TCP segment of a reassembled PDU]"
"1201","2.414050","23.48.104.108","192.168.0.104","TCP","1514","443  >  49525 [ACK] Seq=1171843 Ack=147640 Win=234368 Len=1448 TSval=3563222406 TSecr=4133353881 [TCP segment of a reassembled PDU]"
"1202","2.414050","23.48.104.108","192.168.0.104","TLSv1.3","708","Application Data"
"1203","2.414756","192.168.0.104","23.48.104.108","TCP","66","49525  >  443 [ACK] Seq=147640 Ack=1173933 Win=840576 Len=0 TSval=4133353914 TSecr=3563222406"
"1204","2.440969","23.48.104.108","192.168.0.104","TCP","1514","443  >  49525 [ACK] Seq=1173933 Ack=147640 Win=234368 Len=1448 TSval=3563222431 TSecr=4133353914 [TCP segment of a reassembled PDU]"
"1205","2.442901","23.48.104.108","192.168.0.104","TCP","1514","443  >  49525 [ACK] Seq=1175381 Ack=147640 Win=234368 Len=1448 TSval=3563222431 TSecr=4133353914 [TCP segment of a reassembled PDU]"
"1206","2.442902","23.48.104.108","192.168.0.104","TCP","1514","443  >  49525 [ACK] Seq=1176829 Ack=147640 Win=234368 Len=1448 TSval=3563222431 TSecr=4133353914 [TCP segment of a reassembled PDU]"
"1207","2.442902","23.48.104.108","192.168.0.104","TCP","1514","443  >  49525 [ACK] Seq=1178277 Ack=147640 Win=234368 Len=1448 TSval=3563222431 TSecr=4133353914 [TCP segment of a reassembled PDU]"
"1208","2.442903","23.48.104.108","192.168.0.104","TCP","1514","443  >  49525 [ACK] Seq=1179725 Ack=147640 Win=234368 Len=1448 TSval=3563222431 TSecr=4133353914 [TCP segment of a reassembled PDU]"
"1209","2.442903","23.48.104.108","192.168.0.104","TCP","1514","443  >  49525 [ACK] Seq=1181173 Ack=147640 Win=234368 Len=1448 TSval=3563222431 TSecr=4133353914 [TCP segment of a reassembled PDU]"
"1210","2.442904","23.48.104.108","192.168.0.104","TCP","1514","443  >  49525 [ACK] Seq=1182621 Ack=147640 Win=234368 Len=1448 TSval=3563222431 TSecr=4133353914 [TCP segment of a reassembled PDU]"
"1211","2.442904","23.48.104.108","192.168.0.104","TCP","1514","443  >  49525 [ACK] Seq=1184069 Ack=147640 Win=234368 Len=1448 TSval=3563222431 TSecr=4133353914 [TCP segment of a reassembled PDU]"
"1212","2.442905","23.48.104.108","192.168.0.104","TCP","1514","443  >  49525 [ACK] Seq=1185517 Ack=147640 Win=234368 Len=1448 TSval=3563222431 TSecr=4133353914 [TCP segment of a reassembled PDU]"
"1213","2.442905","23.48.104.108","192.168.0.104","TCP","1514","443  >  49525 [ACK] Seq=1186965 Ack=147640 Win=234368 Len=1448 TSval=3563222431 TSecr=4133353914 [TCP segment of a reassembled PDU]"
"1214","2.442906","23.48.104.108","192.168.0.104","TCP","1514","443  >  49525 [ACK] Seq=1188413 Ack=147640 Win=234368 Len=1448 TSval=3563222431 TSecr=4133353914 [TCP segment of a reassembled PDU]"
"1215","2.442906","23.48.104.108","192.168.0.104","TLSv1.3","544","Application Data"
"1216","2.442906","23.48.104.108","192.168.0.104","TLSv1.3","97","Application Data"
"1217","2.452368","192.168.0.104","23.48.104.108","TCP","66","49525  >  443 [ACK] Seq=147640 Ack=1190370 Win=840576 Len=0 TSval=4133353952 TSecr=3563222431"
"1218","2.461498","23.48.104.108","192.168.0.104","TCP","1514","443  >  49525 [ACK] Seq=1190370 Ack=147640 Win=234368 Len=1448 TSval=3563222452 TSecr=4133353914 [TCP segment of a reassembled PDU]"
"1219","2.461499","23.48.104.108","192.168.0.104","TCP","1514","443  >  49525 [ACK] Seq=1191818 Ack=147640 Win=234368 Len=1448 TSval=3563222452 TSecr=4133353914 [TCP segment of a reassembled PDU]"
"1220","2.461499","23.48.104.108","192.168.0.104","TCP","1514","443  >  49525 [ACK] Seq=1193266 Ack=147640 Win=234368 Len=1448 TSval=3563222452 TSecr=4133353914 [TCP segment of a reassembled PDU]"
"1221","2.461500","23.48.104.108","192.168.0.104","TCP","1514","443  >  49525 [ACK] Seq=1194714 Ack=147640 Win=234368 Len=1448 TSval=3563222452 TSecr=4133353914 [TCP segment of a reassembled PDU]"
"1222","2.461500","23.48.104.108","192.168.0.104","TCP","1514","443  >  49525 [ACK] Seq=1196162 Ack=147640 Win=234368 Len=1448 TSval=3563222452 TSecr=4133353914 [TCP segment of a reassembled PDU]"
"1223","2.461501","23.48.104.108","192.168.0.104","TLSv1.3","1311","Application Data"
"1224","2.474330","23.48.104.108","192.168.0.104","TCP","1514","443  >  49525 [ACK] Seq=1198855 Ack=147640 Win=234368 Len=1448 TSval=3563222467 TSecr=4133353952 [TCP segment of a reassembled PDU]"
"1225","2.474331","23.48.104.108","192.168.0.104","TCP","1514","443  >  49525 [ACK] Seq=1200303 Ack=147640 Win=234368 Len=1448 TSval=3563222467 TSecr=4133353952 [TCP segment of a reassembled PDU]"
"1226","2.474331","23.48.104.108","192.168.0.104","TCP","1514","443  >  49525 [ACK] Seq=1201751 Ack=147640 Win=234368 Len=1448 TSval=3563222467 TSecr=4133353952 [TCP segment of a reassembled PDU]"
"1227","2.474331","23.48.104.108","192.168.0.104","TCP","1514","443  >  49525 [ACK] Seq=1203199 Ack=147640 Win=234368 Len=1448 TSval=3563222467 TSecr=4133353952 [TCP segment of a reassembled PDU]"
