"No.","Time","Source","Destination","Protocol","Length","Info"
"1","0.000000","31.25.11.55","192.168.0.200","TCP","60","25565  >  64008 [ACK] Seq=1 Ack=1 Win=23 Len=0"
"2","0.002232","31.25.11.55","192.168.0.200","TCP","1514","25565  >  64008 [PSH, ACK] Seq=1 Ack=1 Win=23 Len=1460"
"3","0.002695","31.25.11.55","192.168.0.200","TCP","1454","25565  >  64008 [PSH, ACK] Seq=1461 Ack=1 Win=23 Len=1400"
"4","0.002791","192.168.0.200","31.25.11.55","TCP","54","64008  >  25565 [ACK] Seq=1 Ack=2861 Win=1026 Len=0"
"5","0.028327","192.168.0.200","31.25.11.55","TCP","82","64008  >  25565 [PSH, ACK] Seq=1 Ack=2861 Win=1026 Len=28"
"6","0.090335","31.25.11.55","192.168.0.200","TCP","60","25565  >  64008 [ACK] Seq=2861 Ack=29 Win=23 Len=0"
"7","0.102033","31.25.11.55","192.168.0.200","TCP","1514","25565  >  64008 [PSH, ACK] Seq=2861 Ack=29 Win=23 Len=1460"
"8","0.102395","31.25.11.55","192.168.0.200","TCP","1454","25565  >  64008 [PSH, ACK] Seq=4321 Ack=29 Win=23 Len=1400"
"9","0.102471","192.168.0.200","31.25.11.55","TCP","54","64008  >  25565 [ACK] Seq=29 Ack=5721 Win=1026 Len=0"
"10","0.202519","31.25.11.55","192.168.0.200","TCP","1514","25565  >  64008 [PSH, ACK] Seq=5721 Ack=29 Win=23 Len=1460"
"11","0.202557","31.25.11.55","192.168.0.200","TCP","1454","25565  >  64008 [PSH, ACK] Seq=7181 Ack=29 Win=23 Len=1400"
"12","0.202622","192.168.0.200","31.25.11.55","TCP","54","64008  >  25565 [ACK] Seq=29 Ack=8581 Win=1026 Len=0"
"13","0.302254","31.25.11.55","192.168.0.200","TCP","1514","25565  >  64008 [PSH, ACK] Seq=8581 Ack=29 Win=23 Len=1460"
"14","0.302898","31.25.11.55","192.168.0.200","TCP","1454","25565  >  64008 [PSH, ACK] Seq=10041 Ack=29 Win=23 Len=1400"
"15","0.302993","192.168.0.200","31.25.11.55","TCP","54","64008  >  25565 [ACK] Seq=29 Ack=11441 Win=1026 Len=0"
"16","0.403849","31.25.11.55","192.168.0.200","TCP","1514","25565  >  64008 [PSH, ACK] Seq=11441 Ack=29 Win=23 Len=1460"
"17","0.404102","31.25.11.55","192.168.0.200","TCP","1454","25565  >  64008 [PSH, ACK] Seq=12901 Ack=29 Win=23 Len=1400"
"18","0.404184","192.168.0.200","31.25.11.55","TCP","54","64008  >  25565 [ACK] Seq=29 Ack=14301 Win=1026 Len=0"
"19","0.506992","31.25.11.55","192.168.0.200","TCP","1514","25565  >  64008 [PSH, ACK] Seq=14301 Ack=29 Win=23 Len=1460"
"20","0.506992","31.25.11.55","192.168.0.200","TCP","1454","25565  >  64008 [PSH, ACK] Seq=15761 Ack=29 Win=23 Len=1400"
"21","0.507103","192.168.0.200","31.25.11.55","TCP","54","64008  >  25565 [ACK] Seq=29 Ack=17161 Win=1026 Len=0"
"22","0.602954","31.25.11.55","192.168.0.200","TCP","1514","25565  >  64008 [PSH, ACK] Seq=17161 Ack=29 Win=23 Len=1460"
"23","0.602954","31.25.11.55","192.168.0.200","TCP","1454","25565  >  64008 [PSH, ACK] Seq=18621 Ack=29 Win=23 Len=1400"
"24","0.603282","192.168.0.200","31.25.11.55","TCP","54","64008  >  25565 [ACK] Seq=29 Ack=20021 Win=1026 Len=0"
"25","0.703346","31.25.11.55","192.168.0.200","TCP","1514","25565  >  64008 [PSH, ACK] Seq=20021 Ack=29 Win=23 Len=1460"
"26","0.703654","31.25.11.55","192.168.0.200","TCP","1454","25565  >  64008 [PSH, ACK] Seq=21481 Ack=29 Win=23 Len=1400"
"27","0.703724","192.168.0.200","31.25.11.55","TCP","54","64008  >  25565 [ACK] Seq=29 Ack=22881 Win=1026 Len=0"
"28","0.725125","192.168.0.200","31.25.11.55","TCP","90","64008  >  25565 [PSH, ACK] Seq=29 Ack=22881 Win=1026 Len=36"
"29","0.744546","31.25.11.55","192.168.0.200","TCP","60","25565  >  64008 [ACK] Seq=22881 Ack=65 Win=23 Len=0"
"30","0.751277","31.25.11.55","192.168.0.200","TCP","73","25565  >  64008 [PSH, ACK] Seq=22881 Ack=65 Win=23 Len=19"
"31","0.775191","192.168.0.200","31.25.11.55","TCP","90","64008  >  25565 [PSH, ACK] Seq=65 Ack=22900 Win=1026 Len=36"
"32","0.801905","31.25.11.55","192.168.0.200","TCP","1514","25565  >  64008 [PSH, ACK] Seq=22900 Ack=101 Win=23 Len=1460"
"33","0.803030","31.25.11.55","192.168.0.200","TCP","1454","25565  >  64008 [PSH, ACK] Seq=24360 Ack=101 Win=23 Len=1400"
"34","0.803131","192.168.0.200","31.25.11.55","TCP","54","64008  >  25565 [ACK] Seq=101 Ack=25760 Win=1026 Len=0"
"35","0.826428","192.168.0.200","31.25.11.55","TCP","90","[TCP Previous segment not captured] 64008  >  25565 [PSH, ACK] Seq=108 Ack=25760 Win=1026 Len=36"
"36","0.826535","192.168.0.200","31.25.11.55","TCP","61","[TCP Out-Of-Order] 64008  >  25565 [PSH, ACK] Seq=101 Ack=25760 Win=1026 Len=7"
"37","0.846997","31.25.11.55","192.168.0.200","TCP","66","[TCP Window Update] 25565  >  64008 [ACK] Seq=25760 Ack=101 Win=24 Len=0 SLE=108 SRE=144"
"38","0.848648","31.25.11.55","192.168.0.200","TCP","60","25565  >  64008 [ACK] Seq=25760 Ack=144 Win=24 Len=0"
"39","0.877132","192.168.0.200","31.25.11.55","TCP","90","64008  >  25565 [PSH, ACK] Seq=144 Ack=25760 Win=1026 Len=36"
"40","0.904352","31.25.11.55","192.168.0.200","TCP","1514","25565  >  64008 [PSH, ACK] Seq=25760 Ack=180 Win=24 Len=1460"
"41","0.905359","31.25.11.55","192.168.0.200","TCP","1454","25565  >  64008 [PSH, ACK] Seq=27220 Ack=180 Win=24 Len=1400"
"42","0.905463","192.168.0.200","31.25.11.55","TCP","54","64008  >  25565 [ACK] Seq=180 Ack=28620 Win=1026 Len=0"
"43","0.929418","192.168.0.200","31.25.11.55","TCP","82","64008  >  25565 [PSH, ACK] Seq=180 Ack=28620 Win=1026 Len=28"
"44","0.940651","169.254.243.145","239.255.255.250","SSDP","223","M-SEARCH * HTTP/1.1 "
"45","0.952031","31.25.11.55","192.168.0.200","TCP","63","25565  >  64008 [PSH, ACK] Seq=28620 Ack=208 Win=24 Len=9"
"46","0.974935","192.168.0.200","31.25.11.55","TCP","82","64008  >  25565 [PSH, ACK] Seq=208 Ack=28629 Win=1026 Len=28"
"47","1.002091","31.25.11.55","192.168.0.200","TCP","1514","25565  >  64008 [PSH, ACK] Seq=28629 Ack=236 Win=24 Len=1460"
"48","1.003617","31.25.11.55","192.168.0.200","TCP","1454","25565  >  64008 [PSH, ACK] Seq=30089 Ack=236 Win=24 Len=1400"
"49","1.003721","192.168.0.200","31.25.11.55","TCP","54","64008  >  25565 [ACK] Seq=236 Ack=31489 Win=1026 Len=0"
"50","1.026094","192.168.0.200","31.25.11.55","TCP","82","64008  >  25565 [PSH, ACK] Seq=236 Ack=31489 Win=1026 Len=28"
"51","1.089729","31.25.11.55","192.168.0.200","TCP","60","25565  >  64008 [ACK] Seq=31489 Ack=264 Win=24 Len=0"
"52","1.102684","31.25.11.55","192.168.0.200","TCP","1514","25565  >  64008 [PSH, ACK] Seq=31489 Ack=264 Win=24 Len=1460"
"53","1.102928","31.25.11.55","192.168.0.200","TCP","1454","25565  >  64008 [PSH, ACK] Seq=32949 Ack=264 Win=24 Len=1400"
"54","1.102994","192.168.0.200","31.25.11.55","TCP","54","64008  >  25565 [ACK] Seq=264 Ack=34349 Win=1026 Len=0"
"55","1.112216","192.168.0.200","31.25.11.55","TCP","82","64008  >  25565 [PSH, ACK] Seq=264 Ack=34349 Win=1026 Len=28"
"56","1.128149","192.168.0.200","31.25.11.55","TCP","82","64008  >  25565 [PSH, ACK] Seq=292 Ack=34349 Win=1026 Len=28"
"57","1.132397","31.25.11.55","192.168.0.200","TCP","60","25565  >  64008 [ACK] Seq=34349 Ack=292 Win=24 Len=0"
"58","1.133996","31.25.11.55","192.168.0.200","TCP","87","25565  >  64008 [PSH, ACK] Seq=34349 Ack=292 Win=24 Len=33"
"59","1.134458","31.25.11.55","192.168.0.200","TCP","131","25565  >  64008 [PSH, ACK] Seq=34382 Ack=292 Win=24 Len=77"
"60","1.134458","31.25.11.55","192.168.0.200","TCP","175","25565  >  64008 [PSH, ACK] Seq=34459 Ack=292 Win=24 Len=121"
"61","1.134571","192.168.0.200","31.25.11.55","TCP","54","64008  >  25565 [ACK] Seq=320 Ack=34580 Win=1025 Len=0"
"62","1.134764","31.25.11.55","192.168.0.200","TCP","89","25565  >  64008 [PSH, ACK] Seq=34580 Ack=292 Win=24 Len=35"
"63","1.134808","192.168.0.200","31.25.11.55","TCP","54","64008  >  25565 [ACK] Seq=320 Ack=34615 Win=1025 Len=0"
"64","1.155033","31.25.11.55","192.168.0.200","TCP","1514","25565  >  64008 [PSH, ACK] Seq=34615 Ack=320 Win=24 Len=1460"
"65","1.155085","31.25.11.55","192.168.0.200","TCP","1514","25565  >  64008 [PSH, ACK] Seq=36075 Ack=320 Win=24 Len=1460"
"66","1.155085","31.25.11.55","192.168.0.200","TCP","1514","25565  >  64008 [ACK] Seq=37535 Ack=320 Win=24 Len=1460"
"67","1.155180","192.168.0.200","31.25.11.55","TCP","54","64008  >  25565 [ACK] Seq=320 Ack=38995 Win=1026 Len=0"
"68","1.155627","31.25.11.55","192.168.0.200","TCP","1514","25565  >  64008 [PSH, ACK] Seq=38995 Ack=320 Win=24 Len=1460"
"69","1.155669","31.25.11.55","192.168.0.200","TCP","1514","25565  >  64008 [ACK] Seq=40455 Ack=320 Win=24 Len=1460"
"70","1.155669","31.25.11.55","192.168.0.200","TCP","1514","25565  >  64008 [ACK] Seq=41915 Ack=320 Win=24 Len=1460"
"71","1.155669","31.25.11.55","192.168.0.200","TCP","1514","25565  >  64008 [ACK] Seq=43375 Ack=320 Win=24 Len=1460"
"72","1.155698","192.168.0.200","31.25.11.55","TCP","54","64008  >  25565 [ACK] Seq=320 Ack=40455 Win=1026 Len=0"
"73","1.155723","192.168.0.200","31.25.11.55","TCP","54","64008  >  25565 [ACK] Seq=320 Ack=44835 Win=1026 Len=0"
"74","1.156038","31.25.11.55","192.168.0.200","TCP","1099","25565  >  64008 [PSH, ACK] Seq=44835 Ack=320 Win=24 Len=1045"
"75","1.156129","192.168.0.200","31.25.11.55","TCP","54","64008  >  25565 [ACK] Seq=320 Ack=45880 Win=1022 Len=0"
"76","1.178271","192.168.0.200","31.25.11.55","TCP","82","64008  >  25565 [PSH, ACK] Seq=320 Ack=45880 Win=1022 Len=28"
"77","1.204294","31.25.11.55","192.168.0.200","TCP","1514","25565  >  64008 [PSH, ACK] Seq=45880 Ack=348 Win=24 Len=1460"
"78","1.204351","31.25.11.55","192.168.0.200","TCP","1514","25565  >  64008 [PSH, ACK] Seq=47340 Ack=348 Win=24 Len=1460"
"79","1.204565","192.168.0.200","31.25.11.55","TCP","54","64008  >  25565 [ACK] Seq=348 Ack=48800 Win=1026 Len=0"
"80","1.204668","31.25.11.55","192.168.0.200","TCP","1514","25565  >  64008 [ACK] Seq=48800 Ack=348 Win=24 Len=1460"
"81","1.204668","31.25.11.55","192.168.0.200","TCP","375","25565  >  64008 [PSH, ACK] Seq=50260 Ack=348 Win=24 Len=321"
"82","1.204738","192.168.0.200","31.25.11.55","TCP","54","64008  >  25565 [ACK] Seq=348 Ack=50581 Win=1026 Len=0"
"83","1.206534","31.25.11.55","192.168.0.200","TCP","1514","25565  >  64008 [PSH, ACK] Seq=50581 Ack=348 Win=24 Len=1460"
"84","1.207052","31.25.11.55","192.168.0.200","TCP","1514","25565  >  64008 [ACK] Seq=52041 Ack=348 Win=24 Len=1460"
"85","1.207090","31.25.11.55","192.168.0.200","TCP","1514","25565  >  64008 [PSH, ACK] Seq=53501 Ack=348 Win=24 Len=1460"
"86","1.207090","31.25.11.55","192.168.0.200","TCP","1514","25565  >  64008 [ACK] Seq=54961 Ack=348 Win=24 Len=1460"
"87","1.208276","192.168.0.200","31.25.11.55","TCP","54","64008  >  25565 [ACK] Seq=348 Ack=53501 Win=1026 Len=0"
"88","1.208320","192.168.0.200","31.25.11.55","TCP","54","64008  >  25565 [ACK] Seq=348 Ack=56421 Win=1026 Len=0"
"89","1.208538","31.25.11.55","192.168.0.200","TCP","1514","25565  >  64008 [ACK] Seq=56421 Ack=348 Win=24 Len=1460"
"90","1.208566","31.25.11.55","192.168.0.200","TCP","1514","25565  >  64008 [PSH, ACK] Seq=57881 Ack=348 Win=24 Len=1460"
"91","1.208694","192.168.0.200","31.25.11.55","TCP","54","64008  >  25565 [ACK] Seq=348 Ack=59341 Win=1026 Len=0"
"92","1.209557","31.25.11.55","192.168.0.200","TCP","1514","25565  >  64008 [ACK] Seq=59341 Ack=348 Win=24 Len=1460"
"93","1.209594","31.25.11.55","192.168.0.200","TCP","1514","25565  >  64008 [PSH, ACK] Seq=60801 Ack=348 Win=24 Len=1460"
"94","1.209594","31.25.11.55","192.168.0.200","TCP","1514","25565  >  64008 [ACK] Seq=62261 Ack=348 Win=24 Len=1460"
"95","1.209594","31.25.11.55","192.168.0.200","TCP","1514","25565  >  64008 [ACK] Seq=63721 Ack=348 Win=24 Len=1460"
"96","1.209855","192.168.0.200","31.25.11.55","TCP","54","64008  >  25565 [ACK] Seq=348 Ack=65181 Win=1026 Len=0"
"97","1.210241","31.25.11.55","192.168.0.200","TCP","1514","25565  >  64008 [ACK] Seq=65181 Ack=348 Win=24 Len=1460"
"98","1.210263","31.25.11.55","192.168.0.200","TCP","1514","25565  >  64008 [ACK] Seq=66641 Ack=348 Win=24 Len=1460"
"99","1.210263","31.25.11.55","192.168.0.200","TCP","414","25565  >  64008 [PSH, ACK] Seq=68101 Ack=348 Win=24 Len=360"
"100","1.211118","192.168.0.200","31.25.11.55","TCP","54","64008  >  25565 [ACK] Seq=348 Ack=68461 Win=1026 Len=0"
"101","1.228021","192.168.0.200","31.25.11.55","TCP","82","64008  >  25565 [PSH, ACK] Seq=348 Ack=68461 Win=1026 Len=28"
"102","1.255570","31.25.11.55","192.168.0.200","TCP","1514","25565  >  64008 [PSH, ACK] Seq=68461 Ack=348 Win=24 Len=1460"
"103","1.255635","31.25.11.55","192.168.0.200","TCP","1514","25565  >  64008 [ACK] Seq=69921 Ack=348 Win=24 Len=1460"
"104","1.255664","192.168.0.200","31.25.11.55","TCP","54","64008  >  25565 [ACK] Seq=376 Ack=69921 Win=1026 Len=0"
"105","1.255677","192.168.0.200","31.25.11.55","TCP","54","64008  >  25565 [ACK] Seq=376 Ack=71381 Win=1026 Len=0"
"106","1.256856","31.25.11.55","192.168.0.200","TCP","1514","25565  >  64008 [PSH, ACK] Seq=71381 Ack=348 Win=24 Len=1460"
"107","1.256923","31.25.11.55","192.168.0.200","TCP","1514","25565  >  64008 [ACK] Seq=72841 Ack=348 Win=24 Len=1460"
"108","1.256923","31.25.11.55","192.168.0.200","TCP","1514","25565  >  64008 [ACK] Seq=74301 Ack=348 Win=24 Len=1460"
"109","1.256923","31.25.11.55","192.168.0.200","TCP","1514","25565  >  64008 [ACK] Seq=75761 Ack=348 Win=24 Len=1460"
"110","1.256923","31.25.11.55","192.168.0.200","TCP","1514","25565  >  64008 [PSH, ACK] Seq=77221 Ack=348 Win=24 Len=1460"
"111","1.256923","31.25.11.55","192.168.0.200","TCP","1132","25565  >  64008 [PSH, ACK] Seq=78681 Ack=348 Win=24 Len=1078"
"112","1.257059","192.168.0.200","31.25.11.55","TCP","54","64008  >  25565 [ACK] Seq=376 Ack=72841 Win=1026 Len=0"
"113","1.257199","192.168.0.200","31.25.11.55","TCP","54","64008  >  25565 [ACK] Seq=376 Ack=79759 Win=1026 Len=0"
"114","1.282599","192.168.0.200","31.25.11.55","TCP","82","64008  >  25565 [PSH, ACK] Seq=376 Ack=79759 Win=1026 Len=28"
"115","1.297424","31.25.11.55","192.168.0.200","TCP","60","25565  >  64008 [ACK] Seq=79759 Ack=376 Win=24 Len=0"
"116","1.301416","31.25.11.55","192.168.0.200","TCP","60","25565  >  64008 [ACK] Seq=79759 Ack=404 Win=24 Len=0"
"117","1.306669","31.25.11.55","192.168.0.200","TCP","1514","25565  >  64008 [PSH, ACK] Seq=79759 Ack=404 Win=24 Len=1460"
"118","1.308068","31.25.11.55","192.168.0.200","TCP","1514","25565  >  64008 [ACK] Seq=81219 Ack=404 Win=24 Len=1460"
"119","1.308131","31.25.11.55","192.168.0.200","TCP","1514","25565  >  64008 [PSH, ACK] Seq=82679 Ack=404 Win=24 Len=1460"
"120","1.308131","31.25.11.55","192.168.0.200","TCP","1514","25565  >  64008 [ACK] Seq=84139 Ack=404 Win=24 Len=1460"
"121","1.308131","31.25.11.55","192.168.0.200","TCP","1514","25565  >  64008 [ACK] Seq=85599 Ack=404 Win=24 Len=1460"
"122","1.308131","31.25.11.55","192.168.0.200","TCP","1514","25565  >  64008 [ACK] Seq=87059 Ack=404 Win=24 Len=1460"
"123","1.308131","31.25.11.55","192.168.0.200","TCP","1514","25565  >  64008 [PSH, ACK] Seq=88519 Ack=404 Win=24 Len=1460"
"124","1.308131","31.25.11.55","192.168.0.200","TCP","1514","25565  >  64008 [ACK] Seq=89979 Ack=404 Win=24 Len=1460"
"125","1.308167","192.168.0.200","31.25.11.55","TCP","54","64008  >  25565 [ACK] Seq=404 Ack=82679 Win=1026 Len=0"
"126","1.308213","192.168.0.200","31.25.11.55","TCP","54","64008  >  25565 [ACK] Seq=404 Ack=91439 Win=1026 Len=0"
"127","1.309581","31.25.11.55","192.168.0.200","TCP","1514","25565  >  64008 [ACK] Seq=91439 Ack=404 Win=24 Len=1460"
"128","1.309612","31.25.11.55","192.168.0.200","TCP","1514","25565  >  64008 [ACK] Seq=92899 Ack=404 Win=24 Len=1460"
"129","1.309612","31.25.11.55","192.168.0.200","TCP","1514","25565  >  64008 [ACK] Seq=94359 Ack=404 Win=24 Len=1460"
"130","1.309612","31.25.11.55","192.168.0.200","TCP","1514","25565  >  64008 [ACK] Seq=95819 Ack=404 Win=24 Len=1460"
"131","1.309679","192.168.0.200","31.25.11.55","TCP","54","64008  >  25565 [ACK] Seq=404 Ack=97279 Win=1026 Len=0"
"132","1.311172","31.25.11.55","192.168.0.200","TCP","1514","25565  >  64008 [PSH, ACK] Seq=97279 Ack=404 Win=24 Len=1460"
"133","1.311202","31.25.11.55","192.168.0.200","TCP","1514","25565  >  64008 [ACK] Seq=98739 Ack=404 Win=24 Len=1460"
"134","1.311202","31.25.11.55","192.168.0.200","TCP","1514","25565  >  64008 [ACK] Seq=100199 Ack=404 Win=24 Len=1460"
"135","1.311202","31.25.11.55","192.168.0.200","TCP","1514","25565  >  64008 [ACK] Seq=101659 Ack=404 Win=24 Len=1460"
"136","1.311235","31.25.11.55","192.168.0.200","TCP","1514","25565  >  64008 [ACK] Seq=103119 Ack=404 Win=24 Len=1460"
"137","1.311235","31.25.11.55","192.168.0.200","TCP","1514","25565  >  64008 [ACK] Seq=104579 Ack=404 Win=24 Len=1460"
"138","1.311235","31.25.11.55","192.168.0.200","TCP","1514","25565  >  64008 [ACK] Seq=106039 Ack=404 Win=24 Len=1460"
"139","1.311253","31.25.11.55","192.168.0.200","TCP","1514","25565  >  64008 [PSH, ACK] Seq=107499 Ack=404 Win=24 Len=1460"
"140","1.311276","192.168.0.200","31.25.11.55","TCP","54","64008  >  25565 [ACK] Seq=404 Ack=107499 Win=1026 Len=0"
"141","1.311276","192.168.0.200","31.25.11.55","TCP","54","64008  >  25565 [ACK] Seq=404 Ack=103119 Win=1026 Len=0"
"142","1.311291","192.168.0.200","31.25.11.55","TCP","54","64008  >  25565 [ACK] Seq=404 Ack=108959 Win=1026 Len=0"
"143","1.311991","31.25.11.55","192.168.0.200","TCP","991","25565  >  64008 [PSH, ACK] Seq=108959 Ack=404 Win=24 Len=937"
"144","1.328176","192.168.0.200","31.25.11.55","TCP","82","64008  >  25565 [PSH, ACK] Seq=404 Ack=109896 Win=1022 Len=28"
"145","1.355017","31.25.11.55","192.168.0.200","TCP","1514","25565  >  64008 [PSH, ACK] Seq=109896 Ack=432 Win=24 Len=1460"
"146","1.355154","31.25.11.55","192.168.0.200","TCP","1514","25565  >  64008 [ACK] Seq=111356 Ack=432 Win=24 Len=1460"
"147","1.355224","192.168.0.200","31.25.11.55","TCP","54","64008  >  25565 [ACK] Seq=432 Ack=112816 Win=1026 Len=0"
"148","1.357845","31.25.11.55","192.168.0.200","TCP","1514","25565  >  64008 [PSH, ACK] Seq=112816 Ack=432 Win=24 Len=1460"
"149","1.358501","31.25.11.55","192.168.0.200","TCP","1514","25565  >  64008 [ACK] Seq=114276 Ack=432 Win=24 Len=1460"
"150","1.358553","31.25.11.55","192.168.0.200","TCP","1514","25565  >  64008 [ACK] Seq=115736 Ack=432 Win=24 Len=1460"
"151","1.358553","31.25.11.55","192.168.0.200","TCP","1514","25565  >  64008 [ACK] Seq=117196 Ack=432 Win=24 Len=1460"
"152","1.358553","31.25.11.55","192.168.0.200","TCP","1514","25565  >  64008 [PSH, ACK] Seq=118656 Ack=432 Win=24 Len=1460"
"153","1.358591","192.168.0.200","31.25.11.55","TCP","54","64008  >  25565 [ACK] Seq=432 Ack=115736 Win=1026 Len=0"
"154","1.358653","192.168.0.200","31.25.11.55","TCP","54","64008  >  25565 [ACK] Seq=432 Ack=120116 Win=1026 Len=0"
"155","1.360115","31.25.11.55","192.168.0.200","TCP","1514","25565  >  64008 [ACK] Seq=120116 Ack=432 Win=24 Len=1460"
"156","1.360164","31.25.11.55","192.168.0.200","TCP","1514","25565  >  64008 [ACK] Seq=121576 Ack=432 Win=24 Len=1460"
"157","1.360164","31.25.11.55","192.168.0.200","TCP","1514","25565  >  64008 [PSH, ACK] Seq=123036 Ack=432 Win=24 Len=1460"
"158","1.360164","31.25.11.55","192.168.0.200","TCP","1514","25565  >  64008 [ACK] Seq=124496 Ack=432 Win=24 Len=1460"
"159","1.360164","31.25.11.55","192.168.0.200","TCP","1514","25565  >  64008 [ACK] Seq=125956 Ack=432 Win=24 Len=1460"
"160","1.360164","31.25.11.55","192.168.0.200","TCP","610","25565  >  64008 [PSH, ACK] Seq=127416 Ack=432 Win=24 Len=556"
"161","1.360192","192.168.0.200","31.25.11.55","TCP","54","64008  >  25565 [ACK] Seq=432 Ack=121576 Win=1026 Len=0"
"162","1.360216","192.168.0.200","31.25.11.55","TCP","54","64008  >  25565 [ACK] Seq=432 Ack=127972 Win=1026 Len=0"
"163","1.376964","192.168.0.200","31.25.11.55","TCP","82","64008  >  25565 [PSH, ACK] Seq=432 Ack=127972 Win=1026 Len=28"
"164","1.393371","192.168.0.200","162.254.199.181","TLSv1.2","108","Application Data"
"165","1.404026","31.25.11.55","192.168.0.200","TCP","1514","25565  >  64008 [PSH, ACK] Seq=127972 Ack=460 Win=24 Len=1460"
"166","1.404026","31.25.11.55","192.168.0.200","TCP","1514","25565  >  64008 [ACK] Seq=129432 Ack=460 Win=24 Len=1460"
"167","1.404127","192.168.0.200","31.25.11.55","TCP","54","64008  >  25565 [ACK] Seq=460 Ack=130892 Win=1026 Len=0"
"168","1.404253","31.25.11.55","192.168.0.200","TCP","1514","25565  >  64008 [PSH, ACK] Seq=130892 Ack=460 Win=24 Len=1460"
"169","1.404265","31.25.11.55","192.168.0.200","TCP","1514","25565  >  64008 [ACK] Seq=132352 Ack=460 Win=24 Len=1460"
"170","1.404280","31.25.11.55","192.168.0.200","TCP","1514","25565  >  64008 [ACK] Seq=133812 Ack=460 Win=24 Len=1460"
"171","1.404286","31.25.11.55","192.168.0.200","TCP","1514","25565  >  64008 [PSH, ACK] Seq=135272 Ack=460 Win=24 Len=1460"
"172","1.404292","192.168.0.200","31.25.11.55","TCP","54","64008  >  25565 [ACK] Seq=460 Ack=133812 Win=1026 Len=0"
"173","1.404314","192.168.0.200","31.25.11.55","TCP","54","64008  >  25565 [ACK] Seq=460 Ack=136732 Win=1026 Len=0"
"174","1.404648","31.25.11.55","192.168.0.200","TCP","907","25565  >  64008 [PSH, ACK] Seq=136732 Ack=460 Win=24 Len=853"
"175","1.406012","31.25.11.55","192.168.0.200","TCP","1514","25565  >  64008 [PSH, ACK] Seq=137585 Ack=460 Win=24 Len=1460"
"176","1.406125","192.168.0.200","31.25.11.55","TCP","54","64008  >  25565 [ACK] Seq=460 Ack=139045 Win=1026 Len=0"
"177","1.406476","31.25.11.55","192.168.0.200","TCP","1514","25565  >  64008 [ACK] Seq=139045 Ack=460 Win=24 Len=1460"
"178","1.406499","31.25.11.55","192.168.0.200","TCP","1514","25565  >  64008 [PSH, ACK] Seq=140505 Ack=460 Win=24 Len=1460"
"179","1.406549","192.168.0.200","31.25.11.55","TCP","54","64008  >  25565 [ACK] Seq=460 Ack=141965 Win=1026 Len=0"
"180","1.406964","31.25.11.55","192.168.0.200","TCP","1514","25565  >  64008 [ACK] Seq=141965 Ack=460 Win=24 Len=1460"
"181","1.406984","31.25.11.55","192.168.0.200","TCP","1514","25565  >  64008 [ACK] Seq=143425 Ack=460 Win=24 Len=1460"
"182","1.406984","31.25.11.55","192.168.0.200","TCP","1514","25565  >  64008 [PSH, ACK] Seq=144885 Ack=460 Win=24 Len=1460"
"183","1.407046","192.168.0.200","31.25.11.55","TCP","54","64008  >  25565 [ACK] Seq=460 Ack=146345 Win=1026 Len=0"
"184","1.409548","31.25.11.55","192.168.0.200","TCP","1514","25565  >  64008 [ACK] Seq=146345 Ack=460 Win=24 Len=1460"
"185","1.409611","31.25.11.55","192.168.0.200","TCP","1514","25565  >  64008 [ACK] Seq=147805 Ack=460 Win=24 Len=1460"
"186","1.409611","31.25.11.55","192.168.0.200","TCP","1514","25565  >  64008 [ACK] Seq=149265 Ack=460 Win=24 Len=1460"
"187","1.409611","31.25.11.55","192.168.0.200","TCP","1086","25565  >  64008 [PSH, ACK] Seq=150725 Ack=460 Win=24 Len=1032"
"188","1.409649","192.168.0.200","31.25.11.55","TCP","54","64008  >  25565 [ACK] Seq=460 Ack=147805 Win=1026 Len=0"
"189","1.409664","192.168.0.200","31.25.11.55","TCP","54","64008  >  25565 [ACK] Seq=460 Ack=151757 Win=1026 Len=0"
"190","1.427889","192.168.0.200","31.25.11.55","TCP","82","64008  >  25565 [PSH, ACK] Seq=460 Ack=151757 Win=1026 Len=28"
"191","1.453866","31.25.11.55","192.168.0.200","TCP","1514","25565  >  64008 [PSH, ACK] Seq=151757 Ack=488 Win=24 Len=1460"
"192","1.454281","31.25.11.55","192.168.0.200","TCP","1514","25565  >  64008 [ACK] Seq=153217 Ack=488 Win=24 Len=1460"
"193","1.454326","31.25.11.55","192.168.0.200","TCP","1514","25565  >  64008 [PSH, ACK] Seq=154677 Ack=488 Win=24 Len=1460"
"194","1.454326","31.25.11.55","192.168.0.200","TCP","626","25565  >  64008 [PSH, ACK] Seq=156137 Ack=488 Win=24 Len=572"
"195","1.454366","192.168.0.200","31.25.11.55","TCP","54","64008  >  25565 [ACK] Seq=488 Ack=154677 Win=1026 Len=0"
"196","1.454499","192.168.0.200","31.25.11.55","TCP","54","64008  >  25565 [ACK] Seq=488 Ack=156709 Win=1026 Len=0"
"197","1.471177","192.168.0.200","172.253.63.188","TCP","55","54886  >  5228 [ACK] Seq=1 Ack=1 Win=1021 Len=1"
"198","1.472738","162.254.199.181","192.168.0.200","TCP","60","27019  >  49657 [ACK] Seq=1 Ack=55 Win=1024 Len=0"
"199","1.475664","192.168.0.200","31.25.11.55","TCP","82","64008  >  25565 [PSH, ACK] Seq=488 Ack=156709 Win=1026 Len=28"
"200","1.492106","172.253.63.188","192.168.0.200","TCP","66","5228  >  54886 [ACK] Seq=1 Ack=2 Win=265 Len=0 SLE=1 SRE=2"
"201","1.503676","31.25.11.55","192.168.0.200","TCP","1514","25565  >  64008 [PSH, ACK] Seq=156709 Ack=516 Win=24 Len=1460"
"202","1.503716","31.25.11.55","192.168.0.200","TCP","1454","25565  >  64008 [PSH, ACK] Seq=158169 Ack=516 Win=24 Len=1400"
"203","1.503801","192.168.0.200","31.25.11.55","TCP","54","64008  >  25565 [ACK] Seq=516 Ack=159569 Win=1026 Len=0"
"204","1.528144","192.168.0.200","31.25.11.55","TCP","82","64008  >  25565 [PSH, ACK] Seq=516 Ack=159569 Win=1026 Len=28"
"205","1.580121","192.168.0.200","31.25.11.55","TCP","82","64008  >  25565 [PSH, ACK] Seq=544 Ack=159569 Win=1026 Len=28"
"206","1.593820","31.25.11.55","192.168.0.200","TCP","60","25565  >  64008 [ACK] Seq=159569 Ack=544 Win=24 Len=0"
"207","1.599676","31.25.11.55","192.168.0.200","TCP","60","25565  >  64008 [ACK] Seq=159569 Ack=572 Win=24 Len=0"
"208","1.602527","31.25.11.55","192.168.0.200","TCP","1514","25565  >  64008 [PSH, ACK] Seq=159569 Ack=572 Win=24 Len=1460"
"209","1.602870","31.25.11.55","192.168.0.200","TCP","1454","25565  >  64008 [PSH, ACK] Seq=161029 Ack=572 Win=24 Len=1400"
"210","1.602990","192.168.0.200","31.25.11.55","TCP","54","64008  >  25565 [ACK] Seq=572 Ack=162429 Win=1026 Len=0"
"211","1.629435","192.168.0.200","31.25.11.55","TCP","82","64008  >  25565 [PSH, ACK] Seq=572 Ack=162429 Win=1026 Len=28"
"212","1.675291","192.168.0.200","31.25.11.55","TCP","82","64008  >  25565 [PSH, ACK] Seq=600 Ack=162429 Win=1026 Len=28"
"213","1.689695","31.25.11.55","192.168.0.200","TCP","60","25565  >  64008 [ACK] Seq=162429 Ack=600 Win=24 Len=0"
"214","1.696159","31.25.11.55","192.168.0.200","TCP","60","25565  >  64008 [ACK] Seq=162429 Ack=628 Win=24 Len=0"
"215","1.702972","31.25.11.55","192.168.0.200","TCP","1514","25565  >  64008 [PSH, ACK] Seq=162429 Ack=628 Win=24 Len=1460"
"216","1.703364","31.25.11.55","192.168.0.200","TCP","1465","25565  >  64008 [PSH, ACK] Seq=163889 Ack=628 Win=24 Len=1411"
"217","1.703440","192.168.0.200","31.25.11.55","TCP","54","64008  >  25565 [ACK] Seq=628 Ack=165300 Win=1026 Len=0"
"218","1.725183","192.168.0.200","31.25.11.55","TCP","82","64008  >  25565 [PSH, ACK] Seq=628 Ack=165300 Win=1026 Len=28"
"219","1.751694","31.25.11.55","192.168.0.200","TCP","73","25565  >  64008 [PSH, ACK] Seq=165300 Ack=656 Win=24 Len=19"
"220","1.775798","192.168.0.200","31.25.11.55","TCP","82","64008  >  25565 [PSH, ACK] Seq=656 Ack=165319 Win=1026 Len=28"
"221","1.804098","31.25.11.55","192.168.0.200","TCP","1514","25565  >  64008 [PSH, ACK] Seq=165319 Ack=684 Win=24 Len=1460"
"222","1.804098","31.25.11.55","192.168.0.200","TCP","1454","25565  >  64008 [PSH, ACK] Seq=166779 Ack=684 Win=24 Len=1400"
"223","1.804212","192.168.0.200","31.25.11.55","TCP","54","64008  >  25565 [ACK] Seq=684 Ack=168179 Win=1026 Len=0"
"224","1.825444","192.168.0.200","31.25.11.55","TCP","90","64008  >  25565 [PSH, ACK] Seq=684 Ack=168179 Win=1026 Len=36"
"225","1.880132","192.168.0.200","31.25.11.55","TCP","90","64008  >  25565 [PSH, ACK] Seq=720 Ack=168179 Win=1026 Len=36"
"226","1.885004","31.25.11.55","192.168.0.200","TCP","60","25565  >  64008 [ACK] Seq=168179 Ack=720 Win=24 Len=0"
"227","1.899225","31.25.11.55","192.168.0.200","TCP","60","25565  >  64008 [ACK] Seq=168179 Ack=756 Win=24 Len=0"
"228","1.904713","31.25.11.55","192.168.0.200","TCP","1514","25565  >  64008 [PSH, ACK] Seq=168179 Ack=756 Win=24 Len=1460"
"229","1.907757","31.25.11.55","192.168.0.200","TCP","1454","25565  >  64008 [PSH, ACK] Seq=169639 Ack=756 Win=24 Len=1400"
"230","1.907967","192.168.0.200","31.25.11.55","TCP","54","64008  >  25565 [ACK] Seq=756 Ack=171039 Win=1026 Len=0"
"231","1.925573","192.168.0.200","31.25.11.55","TCP","90","64008  >  25565 [PSH, ACK] Seq=756 Ack=171039 Win=1026 Len=36"
"232","1.936789","192.168.0.129","192.168.0.255","UDP","310","34775  >  20002 Len=268"
"233","1.977166","192.168.0.200","31.25.11.55","TCP","90","64008  >  25565 [PSH, ACK] Seq=792 Ack=171039 Win=1026 Len=36"
"234","1.989431","31.25.11.55","192.168.0.200","TCP","60","25565  >  64008 [ACK] Seq=171039 Ack=792 Win=24 Len=0"
"235","2.000527","31.25.11.55","192.168.0.200","TCP","60","25565  >  64008 [ACK] Seq=171039 Ack=828 Win=24 Len=0"
"236","2.002252","31.25.11.55","192.168.0.200","TCP","1514","25565  >  64008 [PSH, ACK] Seq=171039 Ack=828 Win=24 Len=1460"
"237","2.002826","31.25.11.55","192.168.0.200","TCP","1454","25565  >  64008 [PSH, ACK] Seq=172499 Ack=828 Win=24 Len=1400"
"238","2.002902","192.168.0.200","31.25.11.55","TCP","54","64008  >  25565 [ACK] Seq=828 Ack=173899 Win=1026 Len=0"
"239","2.026573","192.168.0.200","31.25.11.55","TCP","90","64008  >  25565 [PSH, ACK] Seq=828 Ack=173899 Win=1026 Len=36"
"240","2.036254","31.25.11.55","192.168.0.200","TCP","87","25565  >  64008 [PSH, ACK] Seq=173899 Ack=828 Win=24 Len=33"
"241","2.036649","31.25.11.55","192.168.0.200","TCP","98","25565  >  64008 [PSH, ACK] Seq=173932 Ack=828 Win=24 Len=44"
"242","2.036649","31.25.11.55","192.168.0.200","TCP","131","25565  >  64008 [PSH, ACK] Seq=173976 Ack=828 Win=24 Len=77"
"243","2.036649","31.25.11.55","192.168.0.200","TCP","98","25565  >  64008 [PSH, ACK] Seq=174053 Ack=828 Win=24 Len=44"
"244","2.036649","31.25.11.55","192.168.0.200","TCP","122","25565  >  64008 [PSH, ACK] Seq=174097 Ack=828 Win=24 Len=68"
"245","2.036736","192.168.0.200","31.25.11.55","TCP","54","64008  >  25565 [ACK] Seq=864 Ack=174165 Win=1025 Len=0"
"246","2.056468","31.25.11.55","192.168.0.200","TCP","1514","25565  >  64008 [PSH, ACK] Seq=174165 Ack=864 Win=24 Len=1460"
"247","2.056579","192.168.0.200","31.25.11.55","TCP","54","64008  >  25565 [ACK] Seq=864 Ack=175625 Win=1026 Len=0"
"248","2.056857","31.25.11.55","192.168.0.200","TCP","1514","25565  >  64008 [PSH, ACK] Seq=175625 Ack=864 Win=24 Len=1460"
"249","2.056874","31.25.11.55","192.168.0.200","TCP","1514","25565  >  64008 [ACK] Seq=177085 Ack=864 Win=24 Len=1460"
"250","2.056894","31.25.11.55","192.168.0.200","TCP","1514","25565  >  64008 [PSH, ACK] Seq=178545 Ack=864 Win=24 Len=1460"
"251","2.057155","192.168.0.200","31.25.11.55","TCP","54","64008  >  25565 [ACK] Seq=864 Ack=178545 Win=1026 Len=0"
"252","2.057376","31.25.11.55","192.168.0.200","TCP","1514","25565  >  64008 [ACK] Seq=180005 Ack=864 Win=24 Len=1460"
"253","2.057400","31.25.11.55","192.168.0.200","TCP","1514","25565  >  64008 [ACK] Seq=181465 Ack=864 Win=24 Len=1460"
"254","2.057400","31.25.11.55","192.168.0.200","TCP","1514","25565  >  64008 [ACK] Seq=182925 Ack=864 Win=24 Len=1460"
"255","2.057421","31.25.11.55","192.168.0.200","TCP","1514","25565  >  64008 [PSH, ACK] Seq=184385 Ack=864 Win=24 Len=1460"
"256","2.057423","192.168.0.200","31.25.11.55","TCP","54","64008  >  25565 [ACK] Seq=864 Ack=181465 Win=1026 Len=0"
"257","2.057985","192.168.0.200","31.25.11.55","TCP","54","64008  >  25565 [ACK] Seq=864 Ack=184385 Win=1026 Len=0"
"258","2.058352","31.25.11.55","192.168.0.200","TCP","1514","25565  >  64008 [ACK] Seq=185845 Ack=864 Win=24 Len=1460"
"259","2.058392","31.25.11.55","192.168.0.200","TCP","1514","25565  >  64008 [ACK] Seq=187305 Ack=864 Win=24 Len=1460"
"260","2.058392","31.25.11.55","192.168.0.200","TCP","1514","25565  >  64008 [ACK] Seq=188765 Ack=864 Win=24 Len=1460"
"261","2.058392","31.25.11.55","192.168.0.200","TCP","1514","25565  >  64008 [ACK] Seq=190225 Ack=864 Win=24 Len=1460"
"262","2.058572","192.168.0.200","31.25.11.55","TCP","54","64008  >  25565 [ACK] Seq=864 Ack=187305 Win=1026 Len=0"
"263","2.058606","192.168.0.200","31.25.11.55","TCP","54","64008  >  25565 [ACK] Seq=864 Ack=191685 Win=1026 Len=0"
"264","2.059109","31.25.11.55","192.168.0.200","TCP","1514","25565  >  64008 [ACK] Seq=191685 Ack=864 Win=24 Len=1460"
"265","2.059163","31.25.11.55","192.168.0.200","TCP","1514","25565  >  64008 [ACK] Seq=193145 Ack=864 Win=24 Len=1460"
"266","2.059163","31.25.11.55","192.168.0.200","TCP","1514","25565  >  64008 [PSH, ACK] Seq=194605 Ack=864 Win=24 Len=1460"
"267","2.059289","192.168.0.200","31.25.11.55","TCP","54","64008  >  25565 [ACK] Seq=864 Ack=193145 Win=1026 Len=0"
"268","2.059293","192.168.0.200","31.25.11.55","TCP","54","64008  >  25565 [ACK] Seq=864 Ack=196065 Win=1026 Len=0"
"269","2.059536","31.25.11.55","192.168.0.200","TCP","1514","25565  >  64008 [ACK] Seq=196065 Ack=864 Win=24 Len=1460"
"270","2.059536","31.25.11.55","192.168.0.200","TCP","566","25565  >  64008 [PSH, ACK] Seq=197525 Ack=864 Win=24 Len=512"
"271","2.059630","192.168.0.200","31.25.11.55","TCP","54","64008  >  25565 [ACK] Seq=864 Ack=198037 Win=1026 Len=0"
"272","2.075847","192.168.0.200","31.25.11.55","TCP","90","64008  >  25565 [PSH, ACK] Seq=864 Ack=198037 Win=1026 Len=36"
"273","2.107622","31.25.11.55","192.168.0.200","TCP","1514","25565  >  64008 [PSH, ACK] Seq=198037 Ack=900 Win=24 Len=1460"
"274","2.107682","31.25.11.55","192.168.0.200","TCP","1514","25565  >  64008 [ACK] Seq=199497 Ack=900 Win=24 Len=1460"
"275","2.107760","192.168.0.200","31.25.11.55","TCP","54","64008  >  25565 [ACK] Seq=900 Ack=200957 Win=1026 Len=0"
"276","2.112073","31.25.11.55","192.168.0.200","TCP","1514","25565  >  64008 [PSH, ACK] Seq=200957 Ack=900 Win=24 Len=1460"
"277","2.112111","31.25.11.55","192.168.0.200","TCP","1514","25565  >  64008 [ACK] Seq=202417 Ack=900 Win=24 Len=1460"
"278","2.112111","31.25.11.55","192.168.0.200","TCP","1514","25565  >  64008 [PSH, ACK] Seq=203877 Ack=900 Win=24 Len=1460"
"279","2.112111","31.25.11.55","192.168.0.200","TCP","1514","25565  >  64008 [ACK] Seq=205337 Ack=900 Win=24 Len=1460"
"280","2.112111","31.25.11.55","192.168.0.200","TCP","1514","25565  >  64008 [ACK] Seq=206797 Ack=900 Win=24 Len=1460"
"281","2.112148","31.25.11.55","192.168.0.200","TCP","1514","25565  >  64008 [ACK] Seq=208257 Ack=900 Win=24 Len=1460"
"282","2.112148","31.25.11.55","192.168.0.200","TCP","1514","25565  >  64008 [ACK] Seq=209717 Ack=900 Win=24 Len=1460"
"283","2.112148","31.25.11.55","192.168.0.200","TCP","1514","25565  >  64008 [PSH, ACK] Seq=211177 Ack=900 Win=24 Len=1460"
"284","2.112168","31.25.11.55","192.168.0.200","TCP","1514","25565  >  64008 [ACK] Seq=212637 Ack=900 Win=24 Len=1460"
"285","2.112174","31.25.11.55","192.168.0.200","TCP","1514","25565  >  64008 [ACK] Seq=214097 Ack=900 Win=24 Len=1460"
"286","2.112185","192.168.0.200","31.25.11.55","TCP","54","64008  >  25565 [ACK] Seq=900 Ack=208257 Win=1026 Len=0"
"287","2.112187","31.25.11.55","192.168.0.200","TCP","1514","25565  >  64008 [ACK] Seq=215557 Ack=900 Win=24 Len=1460"
"288","2.112187","31.25.11.55","192.168.0.200","TCP","214","25565  >  64008 [PSH, ACK] Seq=217017 Ack=900 Win=24 Len=160"
"289","2.112190","192.168.0.200","31.25.11.55","TCP","54","64008  >  25565 [ACK] Seq=900 Ack=212637 Win=1026 Len=0"
"290","2.112210","192.168.0.200","31.25.11.55","TCP","54","64008  >  25565 [ACK] Seq=900 Ack=215557 Win=1026 Len=0"
"291","2.112221","192.168.0.200","31.25.11.55","TCP","54","64008  >  25565 [ACK] Seq=900 Ack=217177 Win=1026 Len=0"
"292","2.124977","192.168.0.200","31.25.11.55","TCP","61","64008  >  25565 [PSH, ACK] Seq=900 Ack=217177 Win=1026 Len=7"
"293","2.125012","192.168.0.200","31.25.11.55","TCP","90","64008  >  25565 [PSH, ACK] Seq=907 Ack=217177 Win=1026 Len=36"
"294","2.145525","31.25.11.55","192.168.0.200","TCP","60","25565  >  64008 [ACK] Seq=217177 Ack=943 Win=24 Len=0"
"295","2.152954","31.25.11.55","192.168.0.200","TCP","1514","25565  >  64008 [PSH, ACK] Seq=217177 Ack=943 Win=24 Len=1460"
"296","2.153510","31.25.11.55","192.168.0.200","TCP","1514","25565  >  64008 [ACK] Seq=218637 Ack=943 Win=24 Len=1460"
"297","2.153555","31.25.11.55","192.168.0.200","TCP","1514","25565  >  64008 [PSH, ACK] Seq=220097 Ack=943 Win=24 Len=1460"
"298","2.153607","192.168.0.200","31.25.11.55","TCP","54","64008  >  25565 [ACK] Seq=943 Ack=220097 Win=1026 Len=0"
"299","2.153862","31.25.11.55","192.168.0.200","TCP","1514","25565  >  64008 [PSH, ACK] Seq=221557 Ack=943 Win=24 Len=1460"
"300","2.153891","31.25.11.55","192.168.0.200","TCP","1514","25565  >  64008 [ACK] Seq=223017 Ack=943 Win=24 Len=1460"
"301","2.153891","31.25.11.55","192.168.0.200","TCP","242","25565  >  64008 [PSH, ACK] Seq=224477 Ack=943 Win=24 Len=188"
"302","2.153918","192.168.0.200","31.25.11.55","TCP","54","64008  >  25565 [ACK] Seq=943 Ack=223017 Win=1026 Len=0"
"303","2.153934","192.168.0.200","31.25.11.55","TCP","54","64008  >  25565 [ACK] Seq=943 Ack=224665 Win=1026 Len=0"
"304","2.180222","192.168.0.200","31.25.11.55","TCP","90","64008  >  25565 [PSH, ACK] Seq=943 Ack=224665 Win=1026 Len=36"
"305","2.203003","31.25.11.55","192.168.0.200","TCP","1514","25565  >  64008 [PSH, ACK] Seq=224665 Ack=979 Win=24 Len=1460"
"306","2.203374","31.25.11.55","192.168.0.200","TCP","1514","25565  >  64008 [ACK] Seq=226125 Ack=979 Win=24 Len=1460"
"307","2.203374","31.25.11.55","192.168.0.200","TCP","874","25565  >  64008 [PSH, ACK] Seq=227585 Ack=979 Win=24 Len=820"
"308","2.203441","192.168.0.200","31.25.11.55","TCP","54","64008  >  25565 [ACK] Seq=979 Ack=228405 Win=1026 Len=0"
"309","2.225490","192.168.0.200","31.25.11.55","TCP","90","64008  >  25565 [PSH, ACK] Seq=979 Ack=228405 Win=1026 Len=36"
"310","2.255430","31.25.11.55","192.168.0.200","TCP","1514","25565  >  64008 [PSH, ACK] Seq=228405 Ack=1015 Win=24 Len=1460"
"311","2.256123","31.25.11.55","192.168.0.200","TCP","1514","25565  >  64008 [ACK] Seq=229865 Ack=1015 Win=24 Len=1460"
"312","2.256207","192.168.0.200","31.25.11.55","TCP","54","64008  >  25565 [ACK] Seq=1015 Ack=231325 Win=1026 Len=0"
"313","2.256527","31.25.11.55","192.168.0.200","TCP","1514","25565  >  64008 [PSH, ACK] Seq=231325 Ack=1015 Win=24 Len=1460"
"314","2.256544","31.25.11.55","192.168.0.200","TCP","1514","25565  >  64008 [ACK] Seq=232785 Ack=1015 Win=24 Len=1460"
"315","2.256562","31.25.11.55","192.168.0.200","TCP","1514","25565  >  64008 [ACK] Seq=234245 Ack=1015 Win=24 Len=1460"
"316","2.256562","31.25.11.55","192.168.0.200","TCP","1514","25565  >  64008 [ACK] Seq=235705 Ack=1015 Win=24 Len=1460"
"317","2.256577","31.25.11.55","192.168.0.200","TCP","1514","25565  >  64008 [PSH, ACK] Seq=237165 Ack=1015 Win=24 Len=1460"
"318","2.256583","192.168.0.200","31.25.11.55","TCP","54","64008  >  25565 [ACK] Seq=1015 Ack=234245 Win=1026 Len=0"
"319","2.256598","192.168.0.200","31.25.11.55","TCP","54","64008  >  25565 [ACK] Seq=1015 Ack=237165 Win=1026 Len=0"
"320","2.257066","31.25.11.55","192.168.0.200","TCP","1514","25565  >  64008 [ACK] Seq=238625 Ack=1015 Win=24 Len=1460"
"321","2.257113","31.25.11.55","192.168.0.200","TCP","1514","25565  >  64008 [ACK] Seq=240085 Ack=1015 Win=24 Len=1460"
"322","2.257278","192.168.0.200","31.25.11.55","TCP","54","64008  >  25565 [ACK] Seq=1015 Ack=240085 Win=1026 Len=0"
"323","2.257473","31.25.11.55","192.168.0.200","TCP","1514","25565  >  64008 [ACK] Seq=241545 Ack=1015 Win=24 Len=1460"
"324","2.257501","31.25.11.55","192.168.0.200","TCP","1514","25565  >  64008 [ACK] Seq=243005 Ack=1015 Win=24 Len=1460"
"325","2.257501","31.25.11.55","192.168.0.200","TCP","1514","25565  >  64008 [ACK] Seq=244465 Ack=1015 Win=24 Len=1460"
"326","2.257519","192.168.0.200","31.25.11.55","TCP","54","64008  >  25565 [ACK] Seq=1015 Ack=243005 Win=1026 Len=0"
"327","2.257523","31.25.11.55","192.168.0.200","TCP","1514","25565  >  64008 [PSH, ACK] Seq=245925 Ack=1015 Win=24 Len=1460"
"328","2.257523","31.25.11.55","192.168.0.200","TCP","1514","25565  >  64008 [ACK] Seq=247385 Ack=1015 Win=24 Len=1460"
"329","2.257544","192.168.0.200","31.25.11.55","TCP","54","64008  >  25565 [ACK] Seq=1015 Ack=245925 Win=1026 Len=0"
"330","2.257567","192.168.0.200","31.25.11.55","TCP","54","64008  >  25565 [ACK] Seq=1015 Ack=248845 Win=1026 Len=0"
"331","2.257812","31.25.11.55","192.168.0.200","TCP","1514","25565  >  64008 [ACK] Seq=248845 Ack=1015 Win=24 Len=1460"
"332","2.257828","31.25.11.55","192.168.0.200","TCP","1027","25565  >  64008 [PSH, ACK] Seq=250305 Ack=1015 Win=24 Len=973"
"333","2.257890","192.168.0.200","31.25.11.55","TCP","54","64008  >  25565 [ACK] Seq=1015 Ack=251278 Win=1026 Len=0"
"334","2.278299","192.168.0.200","31.25.11.55","TCP","90","64008  >  25565 [PSH, ACK] Seq=1015 Ack=251278 Win=1026 Len=36"
"335","2.304076","31.25.11.55","192.168.0.200","TCP","1514","25565  >  64008 [PSH, ACK] Seq=251278 Ack=1051 Win=24 Len=1460"
"336","2.304127","31.25.11.55","192.168.0.200","TCP","1514","25565  >  64008 [ACK] Seq=252738 Ack=1051 Win=24 Len=1460"
"337","2.304204","192.168.0.200","31.25.11.55","TCP","54","64008  >  25565 [ACK] Seq=1051 Ack=254198 Win=1026 Len=0"
"338","2.305579","31.25.11.55","192.168.0.200","TCP","1514","25565  >  64008 [PSH, ACK] Seq=254198 Ack=1051 Win=24 Len=1460"
"339","2.305606","31.25.11.55","192.168.0.200","TCP","1514","25565  >  64008 [ACK] Seq=255658 Ack=1051 Win=24 Len=1460"
"340","2.305606","31.25.11.55","192.168.0.200","TCP","1514","25565  >  64008 [ACK] Seq=257118 Ack=1051 Win=24 Len=1460"
"341","2.305665","192.168.0.200","31.25.11.55","TCP","54","64008  >  25565 [ACK] Seq=1051 Ack=258578 Win=1026 Len=0"
"342","2.306328","31.25.11.55","192.168.0.200","TCP","1514","25565  >  64008 [ACK] Seq=258578 Ack=1051 Win=24 Len=1460"
"343","2.306328","31.25.11.55","192.168.0.200","TCP","611","25565  >  64008 [PSH, ACK] Seq=260038 Ack=1051 Win=24 Len=557"
"344","2.306390","192.168.0.200","31.25.11.55","TCP","54","64008  >  25565 [ACK] Seq=1051 Ack=260595 Win=1026 Len=0"
"345","2.329689","192.168.0.200","31.25.11.55","TCP","82","64008  >  25565 [PSH, ACK] Seq=1051 Ack=260595 Win=1026 Len=28"
"346","2.375119","192.168.0.200","31.25.11.55","TCP","82","64008  >  25565 [PSH, ACK] Seq=1079 Ack=260595 Win=1026 Len=28"
"347","2.393049","31.25.11.55","192.168.0.200","TCP","60","25565  >  64008 [ACK] Seq=260595 Ack=1107 Win=24 Len=0"
"348","2.402827","31.25.11.55","192.168.0.200","TCP","1514","25565  >  64008 [PSH, ACK] Seq=260595 Ack=1107 Win=24 Len=1460"
"349","2.404050","31.25.11.55","192.168.0.200","TCP","1454","25565  >  64008 [PSH, ACK] Seq=262055 Ack=1107 Win=24 Len=1400"
"350","2.404129","192.168.0.200","31.25.11.55","TCP","54","64008  >  25565 [ACK] Seq=1107 Ack=263455 Win=1026 Len=0"
"351","2.424984","192.168.0.200","31.25.11.55","TCP","82","64008  >  25565 [PSH, ACK] Seq=1107 Ack=263455 Win=1026 Len=28"
"352","2.475898","192.168.0.200","31.25.11.55","TCP","82","64008  >  25565 [PSH, ACK] Seq=1135 Ack=263455 Win=1026 Len=28"
"353","2.490064","31.25.11.55","192.168.0.200","TCP","60","25565  >  64008 [ACK] Seq=263455 Ack=1135 Win=24 Len=0"
"354","2.495321","31.25.11.55","192.168.0.200","TCP","60","25565  >  64008 [ACK] Seq=263455 Ack=1163 Win=24 Len=0"
"355","2.503104","31.25.11.55","192.168.0.200","TCP","1514","25565  >  64008 [PSH, ACK] Seq=263455 Ack=1163 Win=24 Len=1460"
"356","2.503432","31.25.11.55","192.168.0.200","TCP","1454","25565  >  64008 [PSH, ACK] Seq=264915 Ack=1163 Win=24 Len=1400"
"357","2.503520","192.168.0.200","31.25.11.55","TCP","54","64008  >  25565 [ACK] Seq=1163 Ack=266315 Win=1026 Len=0"
"358","2.530187","192.168.0.200","31.25.11.55","TCP","82","64008  >  25565 [PSH, ACK] Seq=1163 Ack=266315 Win=1026 Len=28"
"359","2.575723","192.168.0.200","31.25.11.55","TCP","82","64008  >  25565 [PSH, ACK] Seq=1191 Ack=266315 Win=1026 Len=28"
"360","2.593352","31.25.11.55","192.168.0.200","TCP","60","25565  >  64008 [ACK] Seq=266315 Ack=1191 Win=24 Len=0"
"361","2.595502","31.25.11.55","192.168.0.200","TCP","60","25565  >  64008 [ACK] Seq=266315 Ack=1219 Win=24 Len=0"
"362","2.603041","31.25.11.55","192.168.0.200","TCP","1514","25565  >  64008 [PSH, ACK] Seq=266315 Ack=1219 Win=24 Len=1460"
"363","2.603503","31.25.11.55","192.168.0.200","TCP","1454","25565  >  64008 [PSH, ACK] Seq=267775 Ack=1219 Win=24 Len=1400"
"364","2.603586","192.168.0.200","31.25.11.55","TCP","54","64008  >  25565 [ACK] Seq=1219 Ack=269175 Win=1026 Len=0"
"365","2.625402","192.168.0.200","31.25.11.55","TCP","82","64008  >  25565 [PSH, ACK] Seq=1219 Ack=269175 Win=1026 Len=28"
"366","2.676509","192.168.0.200","31.25.11.55","TCP","82","64008  >  25565 [PSH, ACK] Seq=1247 Ack=269175 Win=1026 Len=28"
"367","2.685794","31.25.11.55","192.168.0.200","TCP","60","25565  >  64008 [ACK] Seq=269175 Ack=1247 Win=24 Len=0"
"368","2.694574","31.25.11.55","192.168.0.200","TCP","60","25565  >  64008 [ACK] Seq=269175 Ack=1275 Win=24 Len=0"
"369","2.702817","31.25.11.55","192.168.0.200","TCP","1514","25565  >  64008 [PSH, ACK] Seq=269175 Ack=1275 Win=24 Len=1460"
"370","2.702817","31.25.11.55","192.168.0.200","TCP","1454","25565  >  64008 [PSH, ACK] Seq=270635 Ack=1275 Win=24 Len=1400"
"371","2.702942","192.168.0.200","31.25.11.55","TCP","54","64008  >  25565 [ACK] Seq=1275 Ack=272035 Win=1026 Len=0"
"372","2.726176","192.168.0.200","31.25.11.55","TCP","82","64008  >  25565 [PSH, ACK] Seq=1275 Ack=272035 Win=1026 Len=28"
"373","2.751457","31.25.11.55","192.168.0.200","TCP","73","25565  >  64008 [PSH, ACK] Seq=272035 Ack=1303 Win=24 Len=19"
"374","2.776315","192.168.0.200","31.25.11.55","TCP","82","64008  >  25565 [PSH, ACK] Seq=1303 Ack=272054 Win=1026 Len=28"
"375","2.801538","31.25.11.55","192.168.0.200","TCP","1514","25565  >  64008 [PSH, ACK] Seq=272054 Ack=1331 Win=24 Len=1460"
"376","2.801831","31.25.11.55","192.168.0.200","TCP","1454","25565  >  64008 [PSH, ACK] Seq=273514 Ack=1331 Win=24 Len=1400"
"377","2.801905","192.168.0.200","31.25.11.55","TCP","54","64008  >  25565 [ACK] Seq=1331 Ack=274914 Win=1026 Len=0"
"378","2.829811","192.168.0.200","31.25.11.55","TCP","82","64008  >  25565 [PSH, ACK] Seq=1331 Ack=274914 Win=1026 Len=28"
"379","2.879463","192.168.0.200","31.25.11.55","TCP","82","64008  >  25565 [PSH, ACK] Seq=1359 Ack=274914 Win=1026 Len=28"
"380","2.889254","31.25.11.55","192.168.0.200","TCP","60","25565  >  64008 [ACK] Seq=274914 Ack=1359 Win=24 Len=0"
"381","2.899712","31.25.11.55","192.168.0.200","TCP","60","25565  >  64008 [ACK] Seq=274914 Ack=1387 Win=24 Len=0"
"382","2.902523","31.25.11.55","192.168.0.200","TCP","1514","25565  >  64008 [PSH, ACK] Seq=274914 Ack=1387 Win=24 Len=1460"
"383","2.903456","31.25.11.55","192.168.0.200","TCP","1454","25565  >  64008 [PSH, ACK] Seq=276374 Ack=1387 Win=24 Len=1400"
"384","2.903548","192.168.0.200","31.25.11.55","TCP","54","64008  >  25565 [ACK] Seq=1387 Ack=277774 Win=1026 Len=0"
"385","2.926016","192.168.0.200","31.25.11.55","TCP","82","64008  >  25565 [PSH, ACK] Seq=1387 Ack=277774 Win=1026 Len=28"
"386","2.975749","192.168.0.200","31.25.11.55","TCP","82","64008  >  25565 [PSH, ACK] Seq=1415 Ack=277774 Win=1026 Len=28"
"387","2.984832","31.25.11.55","192.168.0.200","TCP","60","25565  >  64008 [ACK] Seq=277774 Ack=1415 Win=24 Len=0"
"388","2.994565","31.25.11.55","192.168.0.200","TCP","60","25565  >  64008 [ACK] Seq=277774 Ack=1443 Win=24 Len=0"
"389","3.002147","31.25.11.55","192.168.0.200","TCP","1514","25565  >  64008 [PSH, ACK] Seq=277774 Ack=1443 Win=24 Len=1460"
"390","3.002478","31.25.11.55","192.168.0.200","TCP","1454","25565  >  64008 [PSH, ACK] Seq=279234 Ack=1443 Win=24 Len=1400"
"391","3.002544","192.168.0.200","31.25.11.55","TCP","54","64008  >  25565 [ACK] Seq=1443 Ack=280634 Win=1026 Len=0"
"392","3.025656","192.168.0.200","31.25.11.55","TCP","82","64008  >  25565 [PSH, ACK] Seq=1443 Ack=280634 Win=1026 Len=28"
"393","3.077784","192.168.0.200","31.25.11.55","TCP","82","64008  >  25565 [PSH, ACK] Seq=1471 Ack=280634 Win=1026 Len=28"
"394","3.089816","31.25.11.55","192.168.0.200","TCP","60","25565  >  64008 [ACK] Seq=280634 Ack=1471 Win=24 Len=0"
"395","3.096028","31.25.11.55","192.168.0.200","TCP","60","25565  >  64008 [ACK] Seq=280634 Ack=1499 Win=24 Len=0"
"396","3.101997","31.25.11.55","192.168.0.200","TCP","1514","25565  >  64008 [PSH, ACK] Seq=280634 Ack=1499 Win=24 Len=1460"
"397","3.102403","31.25.11.55","192.168.0.200","TCP","1454","25565  >  64008 [PSH, ACK] Seq=282094 Ack=1499 Win=24 Len=1400"
"398","3.102519","192.168.0.200","31.25.11.55","TCP","54","64008  >  25565 [ACK] Seq=1499 Ack=283494 Win=1026 Len=0"
"399","3.126099","192.168.0.200","31.25.11.55","TCP","82","64008  >  25565 [PSH, ACK] Seq=1499 Ack=283494 Win=1026 Len=28"
"400","3.175118","192.168.0.200","31.25.11.55","TCP","82","64008  >  25565 [PSH, ACK] Seq=1527 Ack=283494 Win=1026 Len=28"
"401","3.189147","31.25.11.55","192.168.0.200","TCP","60","25565  >  64008 [ACK] Seq=283494 Ack=1527 Win=24 Len=0"
"402","3.193556","31.25.11.55","192.168.0.200","TCP","60","25565  >  64008 [ACK] Seq=283494 Ack=1555 Win=24 Len=0"
"403","3.203367","31.25.11.55","192.168.0.200","TCP","1514","25565  >  64008 [PSH, ACK] Seq=283494 Ack=1555 Win=24 Len=1460"
"404","3.203410","31.25.11.55","192.168.0.200","TCP","1454","25565  >  64008 [PSH, ACK] Seq=284954 Ack=1555 Win=24 Len=1400"
"405","3.203519","192.168.0.200","31.25.11.55","TCP","54","64008  >  25565 [ACK] Seq=1555 Ack=286354 Win=1026 Len=0"
"406","3.225939","192.168.0.200","31.25.11.55","TCP","82","64008  >  25565 [PSH, ACK] Seq=1555 Ack=286354 Win=1026 Len=28"
"407","3.251819","31.25.11.55","192.168.0.200","TCP","301","25565  >  64008 [PSH, ACK] Seq=286354 Ack=1583 Win=24 Len=247"
"408","3.252084","31.25.11.55","192.168.0.200","TCP","717","25565  >  64008 [PSH, ACK] Seq=286601 Ack=1583 Win=24 Len=663"
"409","3.252084","31.25.11.55","192.168.0.200","TCP","385","25565  >  64008 [PSH, ACK] Seq=287264 Ack=1583 Win=24 Len=331"
"410","3.252084","31.25.11.55","192.168.0.200","TCP","301","25565  >  64008 [PSH, ACK] Seq=287595 Ack=1583 Win=24 Len=247"
"411","3.252157","192.168.0.200","31.25.11.55","TCP","54","64008  >  25565 [ACK] Seq=1583 Ack=287842 Win=1026 Len=0"
"412","3.305335","31.25.11.55","192.168.0.200","TCP","1514","25565  >  64008 [PSH, ACK] Seq=287842 Ack=1583 Win=24 Len=1460"
"413","3.306421","31.25.11.55","192.168.0.200","TCP","1454","25565  >  64008 [PSH, ACK] Seq=289302 Ack=1583 Win=24 Len=1400"
"414","3.306508","192.168.0.200","31.25.11.55","TCP","54","64008  >  25565 [ACK] Seq=1583 Ack=290702 Win=1026 Len=0"
"415","3.317110","192.168.0.200","31.25.11.55","TCP","82","64008  >  25565 [PSH, ACK] Seq=1583 Ack=290702 Win=1026 Len=28"
"416","3.328505","192.168.0.200","31.25.11.55","TCP","82","64008  >  25565 [PSH, ACK] Seq=1611 Ack=290702 Win=1026 Len=28"
"417","3.348198","31.25.11.55","192.168.0.200","TCP","60","25565  >  64008 [ACK] Seq=290702 Ack=1639 Win=24 Len=0"
"418","3.377059","192.168.0.200","31.25.11.55","TCP","82","64008  >  25565 [PSH, ACK] Seq=1639 Ack=290702 Win=1026 Len=28"
"419","3.402983","31.25.11.55","192.168.0.200","TCP","1514","25565  >  64008 [PSH, ACK] Seq=290702 Ack=1667 Win=24 Len=1460"
"420","3.403913","31.25.11.55","192.168.0.200","TCP","1454","25565  >  64008 [PSH, ACK] Seq=292162 Ack=1667 Win=24 Len=1400"
"421","3.404011","192.168.0.200","31.25.11.55","TCP","54","64008  >  25565 [ACK] Seq=1667 Ack=293562 Win=1026 Len=0"
"422","3.427778","192.168.0.200","31.25.11.55","TCP","82","64008  >  25565 [PSH, ACK] Seq=1667 Ack=293562 Win=1026 Len=28"
"423","3.477719","192.168.0.200","31.25.11.55","TCP","82","64008  >  25565 [PSH, ACK] Seq=1695 Ack=293562 Win=1026 Len=28"
"424","3.490123","31.25.11.55","192.168.0.200","TCP","60","25565  >  64008 [ACK] Seq=293562 Ack=1695 Win=24 Len=0"
"425","3.499943","31.25.11.55","192.168.0.200","TCP","60","25565  >  64008 [ACK] Seq=293562 Ack=1723 Win=24 Len=0"
"426","3.502489","31.25.11.55","192.168.0.200","TCP","1514","25565  >  64008 [PSH, ACK] Seq=293562 Ack=1723 Win=24 Len=1460"
"427","3.504113","31.25.11.55","192.168.0.200","TCP","1454","25565  >  64008 [PSH, ACK] Seq=295022 Ack=1723 Win=24 Len=1400"
"428","3.504225","192.168.0.200","31.25.11.55","TCP","54","64008  >  25565 [ACK] Seq=1723 Ack=296422 Win=1026 Len=0"
"429","3.529155","192.168.0.200","31.25.11.55","TCP","82","64008  >  25565 [PSH, ACK] Seq=1723 Ack=296422 Win=1026 Len=28"
"430","3.575579","192.168.0.200","31.25.11.55","TCP","82","64008  >  25565 [PSH, ACK] Seq=1751 Ack=296422 Win=1026 Len=28"
"431","3.593497","31.25.11.55","192.168.0.200","TCP","60","25565  >  64008 [ACK] Seq=296422 Ack=1751 Win=24 Len=0"
"432","3.595411","31.25.11.55","192.168.0.200","TCP","60","25565  >  64008 [ACK] Seq=296422 Ack=1779 Win=24 Len=0"
"433","3.601961","31.25.11.55","192.168.0.200","TCP","1514","25565  >  64008 [PSH, ACK] Seq=296422 Ack=1779 Win=24 Len=1460"
"434","3.602255","31.25.11.55","192.168.0.200","TCP","1454","25565  >  64008 [PSH, ACK] Seq=297882 Ack=1779 Win=24 Len=1400"
"435","3.602364","192.168.0.200","31.25.11.55","TCP","54","64008  >  25565 [ACK] Seq=1779 Ack=299282 Win=1026 Len=0"
"436","3.627487","192.168.0.200","31.25.11.55","TCP","82","64008  >  25565 [PSH, ACK] Seq=1779 Ack=299282 Win=1026 Len=28"
"437","3.677605","192.168.0.200","31.25.11.55","TCP","82","64008  >  25565 [PSH, ACK] Seq=1807 Ack=299282 Win=1026 Len=28"
"438","3.689726","31.25.11.55","192.168.0.200","TCP","60","25565  >  64008 [ACK] Seq=299282 Ack=1807 Win=24 Len=0"
"439","3.704559","31.25.11.55","192.168.0.200","TCP","1514","25565  >  64008 [PSH, ACK] Seq=299282 Ack=1807 Win=24 Len=1460"
"440","3.704667","192.168.0.200","31.25.11.55","TCP","54","64008  >  25565 [ACK] Seq=1835 Ack=300742 Win=1026 Len=0"
"441","3.704808","31.25.11.55","192.168.0.200","TCP","1454","25565  >  64008 [PSH, ACK] Seq=300742 Ack=1807 Win=24 Len=1400"
"442","3.704874","192.168.0.200","31.25.11.55","TCP","54","64008  >  25565 [ACK] Seq=1835 Ack=302142 Win=1021 Len=0"
"443","3.714843","31.25.11.55","192.168.0.200","TCP","60","25565  >  64008 [ACK] Seq=302142 Ack=1835 Win=24 Len=0"
"444","3.728417","192.168.0.200","31.25.11.55","TCP","82","64008  >  25565 [PSH, ACK] Seq=1835 Ack=302142 Win=1021 Len=28"
"445","3.749825","31.25.11.55","192.168.0.200","TCP","60","25565  >  64008 [ACK] Seq=302142 Ack=1863 Win=24 Len=0"
"446","3.751634","31.25.11.55","192.168.0.200","TCP","467","25565  >  64008 [PSH, ACK] Seq=302142 Ack=1863 Win=24 Len=413"
"447","3.756573","162.159.135.234","192.168.0.200","TLSv1.2","533","Application Data"
"448","3.757011","162.159.135.234","192.168.0.200","TLSv1.2","106","Application Data"
"449","3.757116","192.168.0.200","162.159.135.234","TCP","54","49605  >  443 [ACK] Seq=1 Ack=532 Win=1023 Len=0"
"450","3.757276","162.159.135.234","192.168.0.200","TLSv1.2","106","Application Data"
"451","3.757276","162.159.135.234","192.168.0.200","TLSv1.2","105","Application Data"
"452","3.757350","192.168.0.200","162.159.135.234","TCP","54","49605  >  443 [ACK] Seq=1 Ack=635 Win=1022 Len=0"
"453","3.759917","162.159.135.234","192.168.0.200","TLSv1.2","107","Application Data"
"454","3.771079","162.159.135.234","192.168.0.200","TLSv1.2","168","Application Data"
"455","3.771207","192.168.0.200","162.159.135.234","TCP","54","49605  >  443 [ACK] Seq=1 Ack=802 Win=1028 Len=0"
"456","3.777678","192.168.0.200","31.25.11.55","TCP","82","64008  >  25565 [PSH, ACK] Seq=1863 Ack=302555 Win=1026 Len=28"
"457","3.802626","31.25.11.55","192.168.0.200","TCP","1514","25565  >  64008 [PSH, ACK] Seq=302555 Ack=1891 Win=24 Len=1460"
"458","3.802877","31.25.11.55","192.168.0.200","TCP","1454","25565  >  64008 [PSH, ACK] Seq=304015 Ack=1891 Win=24 Len=1400"
"459","3.802987","192.168.0.200","31.25.11.55","TCP","54","64008  >  25565 [ACK] Seq=1891 Ack=305415 Win=1026 Len=0"
"460","3.809522","162.159.135.234","192.168.0.200","TLSv1.2","142","Application Data"
"461","3.809522","162.159.135.234","192.168.0.200","TLSv1.2","97","Application Data"
"462","3.809615","192.168.0.200","162.159.135.234","TCP","54","49605  >  443 [ACK] Seq=1 Ack=933 Win=1027 Len=0"
"463","3.812644","162.159.135.234","192.168.0.200","TLSv1.2","118","Application Data"
"464","3.827192","192.168.0.200","31.25.11.55","TCP","82","64008  >  25565 [PSH, ACK] Seq=1891 Ack=305415 Win=1026 Len=28"
"465","3.827862","192.168.0.200","8.8.4.4","TLSv1.2","93","Application Data"
"466","3.827862","192.168.0.200","8.8.4.4","TCP","242","[TCP Out-Of-Order] 49604  >  443 [PSH, ACK] Seq=4294967109 Ack=1 Win=1025 Len=188"
"467","3.827886","192.168.0.200","8.8.4.4","TLSv1.2","242","Application Data"
"468","3.827893","192.168.0.200","8.8.4.4","TLSv1.2","242","Application Data"
"469","3.833170","162.159.135.234","192.168.0.200","TLSv1.2","97","Application Data"
"470","3.833275","192.168.0.200","162.159.135.234","TCP","54","49605  >  443 [ACK] Seq=1 Ack=1040 Win=1027 Len=0"
"471","3.835648","162.159.135.234","192.168.0.200","TLSv1.2","97","Application Data"
"472","3.853034","8.8.4.4","192.168.0.200","TCP","60","443  >  49604 [ACK] Seq=1 Ack=1 Win=297 Len=0"
"473","3.853336","8.8.4.4","192.168.0.200","TCP","60","443  >  49604 [ACK] Seq=1 Ack=40 Win=297 Len=0"
"474","3.853336","8.8.4.4","192.168.0.200","TLSv1.2","93","Application Data"
"475","3.853835","8.8.4.4","192.168.0.200","TCP","60","443  >  49604 [ACK] Seq=40 Ack=416 Win=314 Len=0"
"476","3.855227","8.8.4.4","192.168.0.200","TLSv1.2","160","Application Data"
"477","3.855469","8.8.4.4","192.168.0.200","TLSv1.2","553","Application Data"
"478","3.855471","192.168.0.200","8.8.4.4","TCP","54","49604  >  443 [ACK] Seq=416 Ack=146 Win=1025 Len=0"
"479","3.856019","8.8.4.4","192.168.0.200","TLSv1.2","124","Application Data, Application Data"
"480","3.856019","8.8.4.4","192.168.0.200","TLSv1.2","137","Application Data"
"481","3.856150","192.168.0.200","8.8.4.4","TCP","54","49604  >  443 [ACK] Seq=416 Ack=798 Win=1022 Len=0"
"482","3.856151","8.8.4.4","192.168.0.200","TLSv1.2","553","Application Data"
"483","3.856151","8.8.4.4","192.168.0.200","TLSv1.2","85","Application Data"
"484","3.856280","192.168.0.200","8.8.4.4","TCP","54","49604  >  443 [ACK] Seq=416 Ack=1328 Win=1020 Len=0"
"485","3.856399","192.168.0.200","8.8.4.4","TLSv1.2","89","Application Data"
"486","3.856413","192.168.0.200","8.8.4.4","TLSv1.2","93","Application Data"
"487","3.875858","8.8.4.4","192.168.0.200","TCP","60","443  >  49604 [ACK] Seq=1328 Ack=451 Win=314 Len=0"
"488","3.876475","192.168.0.200","31.25.11.55","TCP","82","64008  >  25565 [PSH, ACK] Seq=1919 Ack=305415 Win=1026 Len=28"
"489","3.878013","8.8.4.4","192.168.0.200","TCP","60","[TCP Dup ACK 487#1] 443  >  49604 [ACK] Seq=1328 Ack=451 Win=314 Len=0"
"490","3.883038","192.168.0.200","162.159.135.234","TCP","54","49605  >  443 [ACK] Seq=1 Ack=1083 Win=1027 Len=0"
"491","3.886104","8.8.4.4","192.168.0.200","TCP","60","443  >  49604 [ACK] Seq=1328 Ack=490 Win=314 Len=0"
"492","3.889905","31.25.11.55","192.168.0.200","TCP","60","25565  >  64008 [ACK] Seq=305415 Ack=1919 Win=24 Len=0"
"493","3.895545","31.25.11.55","192.168.0.200","TCP","60","25565  >  64008 [ACK] Seq=305415 Ack=1947 Win=24 Len=0"
"494","3.902084","31.25.11.55","192.168.0.200","TCP","1514","25565  >  64008 [PSH, ACK] Seq=305415 Ack=1947 Win=24 Len=1460"
"495","3.902958","31.25.11.55","192.168.0.200","TCP","1454","25565  >  64008 [PSH, ACK] Seq=306875 Ack=1947 Win=24 Len=1400"
"496","3.903021","192.168.0.200","31.25.11.55","TCP","54","64008  >  25565 [ACK] Seq=1947 Ack=308275 Win=1026 Len=0"
"497","3.928344","192.168.0.200","31.25.11.55","TCP","82","64008  >  25565 [PSH, ACK] Seq=1947 Ack=308275 Win=1026 Len=28"
"498","3.928964","8.8.4.4","192.168.0.200","TLSv1.2","137","Application Data"
"499","3.931399","8.8.4.4","192.168.0.200","TLSv1.2","553","Application Data"
"500","3.931399","8.8.4.4","192.168.0.200","TLSv1.2","85","Application Data"
"501","3.931399","8.8.4.4","192.168.0.200","TLSv1.2","93","Application Data"
"502","3.931502","192.168.0.200","8.8.4.4","TCP","54","49604  >  443 [ACK] Seq=490 Ack=1980 Win=1025 Len=0"
"503","3.931692","192.168.0.200","8.8.4.4","TLSv1.2","93","Application Data"
"504","3.931857","192.168.0.200","8.8.4.4","TCP","54","49606  >  443 [FIN, ACK] Seq=1 Ack=1 Win=1020 Len=0"
"505","3.953226","8.8.4.4","192.168.0.200","TCP","60","443  >  49606 [FIN, ACK] Seq=1 Ack=2 Win=265 Len=0"
"506","3.953336","192.168.0.200","8.8.4.4","TCP","54","49606  >  443 [ACK] Seq=2 Ack=2 Win=1020 Len=0"
"507","3.953349","8.8.4.4","192.168.0.200","TCP","60","443  >  49604 [ACK] Seq=1980 Ack=529 Win=314 Len=0"
"508","3.977625","192.168.0.200","31.25.11.55","TCP","82","64008  >  25565 [PSH, ACK] Seq=1975 Ack=308275 Win=1026 Len=28"
"509","3.997335","31.25.11.55","192.168.0.200","TCP","60","25565  >  64008 [ACK] Seq=308275 Ack=2003 Win=24 Len=0"
"510","4.001929","31.25.11.55","192.168.0.200","TCP","1514","25565  >  64008 [PSH, ACK] Seq=308275 Ack=2003 Win=24 Len=1460"
"511","4.002216","31.25.11.55","192.168.0.200","TCP","1454","25565  >  64008 [PSH, ACK] Seq=309735 Ack=2003 Win=24 Len=1400"
"512","4.002283","192.168.0.200","31.25.11.55","TCP","54","64008  >  25565 [ACK] Seq=2003 Ack=311135 Win=1026 Len=0"
"513","4.029147","192.168.0.200","31.25.11.55","TCP","82","64008  >  25565 [PSH, ACK] Seq=2003 Ack=311135 Win=1026 Len=28"
"514","4.077515","192.168.0.200","31.25.11.55","TCP","82","64008  >  25565 [PSH, ACK] Seq=2031 Ack=311135 Win=1026 Len=28"
"515","4.090558","31.25.11.55","192.168.0.200","TCP","60","25565  >  64008 [ACK] Seq=311135 Ack=2031 Win=24 Len=0"
"516","4.096661","31.25.11.55","192.168.0.200","TCP","60","25565  >  64008 [ACK] Seq=311135 Ack=2059 Win=24 Len=0"
"517","4.102515","31.25.11.55","192.168.0.200","TCP","1514","25565  >  64008 [PSH, ACK] Seq=311135 Ack=2059 Win=24 Len=1460"
"518","4.102515","31.25.11.55","192.168.0.200","TCP","1454","25565  >  64008 [PSH, ACK] Seq=312595 Ack=2059 Win=24 Len=1400"
"519","4.102614","192.168.0.200","31.25.11.55","TCP","54","64008  >  25565 [ACK] Seq=2059 Ack=313995 Win=1026 Len=0"
"520","4.127686","192.168.0.200","31.25.11.55","TCP","82","64008  >  25565 [PSH, ACK] Seq=2059 Ack=313995 Win=1026 Len=28"
"521","4.175855","192.168.0.200","31.25.11.55","TCP","82","64008  >  25565 [PSH, ACK] Seq=2087 Ack=313995 Win=1026 Len=28"
"522","4.194134","31.25.11.55","192.168.0.200","TCP","60","25565  >  64008 [ACK] Seq=313995 Ack=2087 Win=24 Len=0"
"523","4.195438","31.25.11.55","192.168.0.200","TCP","60","25565  >  64008 [ACK] Seq=313995 Ack=2115 Win=24 Len=0"
"524","4.202527","31.25.11.55","192.168.0.200","TCP","1514","25565  >  64008 [PSH, ACK] Seq=313995 Ack=2115 Win=24 Len=1460"
"525","4.202527","31.25.11.55","192.168.0.200","TCP","1454","25565  >  64008 [PSH, ACK] Seq=315455 Ack=2115 Win=24 Len=1400"
"526","4.202632","192.168.0.200","31.25.11.55","TCP","54","64008  >  25565 [ACK] Seq=2115 Ack=316855 Win=1026 Len=0"
"527","4.227648","192.168.0.200","31.25.11.55","TCP","82","64008  >  25565 [PSH, ACK] Seq=2115 Ack=316855 Win=1026 Len=28"
"528","4.237975","192.168.0.200","23.38.126.40","TCP","66","49643  >  443 [SYN] Seq=0 Win=64240 Len=0 MSS=1460 WS=256 SACK_PERM"
"529","4.257373","23.38.126.40","192.168.0.200","TCP","66","443  >  49643 [SYN, ACK] Seq=0 Ack=1 Win=64240 Len=0 MSS=1460 SACK_PERM WS=128"
"530","4.257498","192.168.0.200","23.38.126.40","TCP","54","49643  >  443 [ACK] Seq=1 Ack=1 Win=262656 Len=0"
"531","4.257776","192.168.0.200","23.38.126.40","TLSv1.3","647","Client Hello (SNI=i.scdn.co)"
"532","4.275775","192.168.0.200","31.25.11.55","TCP","82","64008  >  25565 [PSH, ACK] Seq=2143 Ack=316855 Win=1026 Len=28"
"533","4.278711","23.38.126.40","192.168.0.200","TCP","60","443  >  49643 [ACK] Seq=1 Ack=594 Win=64128 Len=0"
"534","4.289061","31.25.11.55","192.168.0.200","TCP","60","25565  >  64008 [ACK] Seq=316855 Ack=2143 Win=24 Len=0"
"535","4.296082","23.38.126.40","192.168.0.200","TLSv1.3","1514","Server Hello, Change Cipher Spec, Application Data"
"536","4.296196","23.38.126.40","192.168.0.200","TCP","1514","443  >  49643 [PSH, ACK] Seq=1461 Ack=594 Win=64128 Len=1460 [TCP segment of a reassembled PDU]"
"537","4.296196","23.38.126.40","192.168.0.200","TLSv1.3","762","Application Data, Application Data, Application Data"
"538","4.296196","31.25.11.55","192.168.0.200","TCP","60","25565  >  64008 [ACK] Seq=316855 Ack=2171 Win=24 Len=0"
"539","4.296291","192.168.0.200","23.38.126.40","TCP","54","49643  >  443 [ACK] Seq=594 Ack=3629 Win=262656 Len=0"
"540","4.297286","192.168.0.200","23.38.126.40","TLSv1.3","134","Change Cipher Spec, Application Data"
"541","4.297384","192.168.0.200","23.38.126.40","TLSv1.3","146","Application Data"
"542","4.297476","192.168.0.200","23.38.126.40","TLSv1.3","477","Application Data"
"543","4.302581","31.25.11.55","192.168.0.200","TCP","1514","25565  >  64008 [PSH, ACK] Seq=316855 Ack=2171 Win=24 Len=1460"
"544","4.302581","31.25.11.55","192.168.0.200","TCP","1454","25565  >  64008 [PSH, ACK] Seq=318315 Ack=2171 Win=24 Len=1400"
"545","4.302690","192.168.0.200","31.25.11.55","TCP","54","64008  >  25565 [ACK] Seq=2171 Ack=319715 Win=1026 Len=0"
"546","4.311129","23.38.126.40","192.168.0.200","TCP","60","443  >  49643 [ACK] Seq=3629 Ack=674 Win=64128 Len=0"
"547","4.311438","23.38.126.40","192.168.0.200","TCP","60","[TCP Dup ACK 546#1] 443  >  49643 [ACK] Seq=3629 Ack=674 Win=64128 Len=0"
"548","4.311889","23.38.126.40","192.168.0.200","TCP","60","443  >  49643 [ACK] Seq=3629 Ack=766 Win=64128 Len=0"
"549","4.312272","23.38.126.40","192.168.0.200","TLSv1.3","325","Application Data"
"550","4.312731","23.38.126.40","192.168.0.200","TLSv1.3","325","Application Data"
"551","4.312731","23.38.126.40","192.168.0.200","TLSv1.3","115","Application Data"
"552","4.312802","192.168.0.200","23.38.126.40","TCP","54","49643  >  443 [ACK] Seq=1189 Ack=4232 Win=262144 Len=0"
"553","4.312856","192.168.0.200","23.38.126.40","TLSv1.3","85","Application Data"
"554","4.313165","23.38.126.40","192.168.0.200","TLSv1.3","85","Application Data"
"555","4.315900","23.38.126.40","192.168.0.200","TCP","60","443  >  49643 [ACK] Seq=4263 Ack=1189 Win=64128 Len=0"
"556","4.318827","23.38.126.40","192.168.0.200","TLSv1.3","350","Application Data"
"557","4.318930","192.168.0.200","23.38.126.40","TCP","54","49643  >  443 [ACK] Seq=1220 Ack=4559 Win=261632 Len=0"
"558","4.319136","23.38.126.40","192.168.0.200","TCP","1514","443  >  49643 [ACK] Seq=4559 Ack=1189 Win=64128 Len=1460 [TCP segment of a reassembled PDU]"
"559","4.319136","23.38.126.40","192.168.0.200","TCP","1514","443  >  49643 [ACK] Seq=6019 Ack=1189 Win=64128 Len=1460 [TCP segment of a reassembled PDU]"
"560","4.319136","23.38.126.40","192.168.0.200","TCP","1514","443  >  49643 [ACK] Seq=7479 Ack=1189 Win=64128 Len=1460 [TCP segment of a reassembled PDU]"
"561","4.319209","192.168.0.200","23.38.126.40","TCP","54","49643  >  443 [ACK] Seq=1220 Ack=8939 Win=262656 Len=0"
"562","4.319697","23.38.126.40","192.168.0.200","TLSv1.3","1514","[TCP Previous segment not captured] , Application Data"
"563","4.319697","23.38.126.40","192.168.0.200","TCP","1514","443  >  49643 [ACK] Seq=22425 Ack=1189 Win=64128 Len=1460 [TCP segment of a reassembled PDU]"
"564","4.319697","23.38.126.40","192.168.0.200","TCP","1514","443  >  49643 [ACK] Seq=23885 Ack=1189 Win=64128 Len=1460 [TCP segment of a reassembled PDU]"
"565","4.319697","23.38.126.40","192.168.0.200","TCP","1514","443  >  49643 [ACK] Seq=25345 Ack=1189 Win=64128 Len=1460 [TCP segment of a reassembled PDU]"
"566","4.319741","23.38.126.40","192.168.0.200","TCP","1514","443  >  49643 [ACK] Seq=26805 Ack=1189 Win=64128 Len=1460 [TCP segment of a reassembled PDU]"
"567","4.319741","23.38.126.40","192.168.0.200","TCP","1514","443  >  49643 [PSH, ACK] Seq=28265 Ack=1189 Win=64128 Len=1460 [TCP segment of a reassembled PDU]"
"568","4.319741","23.38.126.40","192.168.0.200","TCP","1514","[TCP Out-Of-Order] 443  >  49643 [ACK] Seq=8939 Ack=1189 Win=64128 Len=1460 [TCP segment of a reassembled PDU]"
"569","4.319741","23.38.126.40","192.168.0.200","TCP","1514","[TCP Out-Of-Order] 443  >  49643 [ACK] Seq=10399 Ack=1189 Win=64128 Len=1460 [TCP segment of a reassembled PDU]"
"570","4.319755","192.168.0.200","23.38.126.40","TCP","66","[TCP Dup ACK 561#1] 49643  >  443 [ACK] Seq=1220 Ack=8939 Win=262656 Len=0 SLE=20965 SRE=25345"
"571","4.319776","192.168.0.200","23.38.126.40","TCP","66","[TCP Dup ACK 561#2] 49643  >  443 [ACK] Seq=1220 Ack=8939 Win=262656 Len=0 SLE=20965 SRE=23885"
"572","4.319780","192.168.0.200","23.38.126.40","TCP","66","[TCP Dup ACK 561#3] 49643  >  443 [ACK] Seq=1220 Ack=8939 Win=262656 Len=0 SLE=20965 SRE=22425"
"573","4.319784","192.168.0.200","23.38.126.40","TCP","66","[TCP Dup ACK 561#4] 49643  >  443 [ACK] Seq=1220 Ack=8939 Win=262656 Len=0 SLE=20965 SRE=26805"
"574","4.319795","192.168.0.200","23.38.126.40","TCP","66","[TCP Dup ACK 561#5] 49643  >  443 [ACK] Seq=1220 Ack=8939 Win=262656 Len=0 SLE=20965 SRE=28265"
"575","4.319812","192.168.0.200","23.38.126.40","TCP","66","[TCP Dup ACK 561#6] 49643  >  443 [ACK] Seq=1220 Ack=8939 Win=262656 Len=0 SLE=20965 SRE=29725"
"576","4.319826","192.168.0.200","23.38.126.40","TCP","66","49643  >  443 [ACK] Seq=1220 Ack=10399 Win=262656 Len=0 SLE=20965 SRE=29725"
"577","4.319833","192.168.0.200","23.38.126.40","TCP","66","49643  >  443 [ACK] Seq=1220 Ack=11859 Win=262656 Len=0 SLE=20965 SRE=29725"
"578","4.320119","23.38.126.40","192.168.0.200","TCP","1514","[TCP Out-Of-Order] 443  >  49643 [PSH, ACK] Seq=11859 Ack=1189 Win=64128 Len=1460 [TCP segment of a reassembled PDU]"
"579","4.320119","23.38.126.40","192.168.0.200","TCP","1514","443  >  49643 [ACK] Seq=29725 Ack=1189 Win=64128 Len=1460 [TCP segment of a reassembled PDU]"
"580","4.320119","23.38.126.40","192.168.0.200","TCP","1514","443  >  49643 [ACK] Seq=31185 Ack=1189 Win=64128 Len=1460 [TCP segment of a reassembled PDU]"
"581","4.320151","23.38.126.40","192.168.0.200","TCP","1514","[TCP Out-Of-Order] 443  >  49643 [ACK] Seq=13319 Ack=1189 Win=64128 Len=1460 [TCP segment of a reassembled PDU]"
"582","4.320151","23.38.126.40","192.168.0.200","TCP","1514","[TCP Out-Of-Order] 443  >  49643 [ACK] Seq=14779 Ack=1189 Win=64128 Len=1460 [TCP segment of a reassembled PDU]"
"583","4.320151","23.38.126.40","192.168.0.200","TCP","1514","[TCP Out-Of-Order] 443  >  49643 [ACK] Seq=16239 Ack=1189 Win=64128 Len=1460 [TCP segment of a reassembled PDU]"
"584","4.320160","192.168.0.200","23.38.126.40","TCP","66","49643  >  443 [ACK] Seq=1220 Ack=13319 Win=262656 Len=0 SLE=20965 SRE=32645"
"585","4.320180","192.168.0.200","23.38.126.40","TCP","66","49643  >  443 [ACK] Seq=1220 Ack=16239 Win=262656 Len=0 SLE=20965 SRE=32645"
"586","4.320189","192.168.0.200","23.38.126.40","TCP","66","49643  >  443 [ACK] Seq=1220 Ack=17699 Win=262656 Len=0 SLE=20965 SRE=32645"
"587","4.320189","192.168.0.200","23.38.126.40","TCP","66","49643  >  443 [ACK] Seq=1220 Ack=13319 Win=262656 Len=0 SLE=20965 SRE=29725"
"588","4.320189","192.168.0.200","23.38.126.40","TCP","66","[TCP Dup ACK 587#1] 49643  >  443 [ACK] Seq=1220 Ack=13319 Win=262656 Len=0 SLE=20965 SRE=31185"
"589","4.320198","192.168.0.200","23.38.126.40","TCP","66","49643  >  443 [ACK] Seq=1220 Ack=14779 Win=262656 Len=0 SLE=20965 SRE=32645"
"590","4.320623","23.38.126.40","192.168.0.200","TCP","1514","443  >  49643 [ACK] Seq=32645 Ack=1189 Win=64128 Len=1460 [TCP segment of a reassembled PDU]"
"591","4.320642","23.38.126.40","192.168.0.200","TCP","1514","443  >  49643 [ACK] Seq=34105 Ack=1189 Win=64128 Len=1460 [TCP segment of a reassembled PDU]"
"592","4.320642","23.38.126.40","192.168.0.200","TCP","1514","[TCP Out-Of-Order] 443  >  49643 [ACK] Seq=17699 Ack=1189 Win=64128 Len=1460 [TCP segment of a reassembled PDU]"
"593","4.320646","192.168.0.200","23.38.126.40","TCP","66","49643  >  443 [ACK] Seq=1220 Ack=17699 Win=262656 Len=0 SLE=20965 SRE=34105"
"594","4.320661","23.38.126.40","192.168.0.200","TCP","1514","443  >  49643 [ACK] Seq=35565 Ack=1189 Win=64128 Len=1460 [TCP segment of a reassembled PDU]"
"595","4.320672","192.168.0.200","23.38.126.40","TCP","66","[TCP Dup ACK 593#1] 49643  >  443 [ACK] Seq=1220 Ack=17699 Win=262656 Len=0 SLE=20965 SRE=35565"
"596","4.320679","192.168.0.200","23.38.126.40","TCP","66","49643  >  443 [ACK] Seq=1220 Ack=19159 Win=262656 Len=0 SLE=20965 SRE=35565"
"597","4.320689","23.38.126.40","192.168.0.200","TLSv1.3","1514","Application Data, Application Data"
"598","4.320689","23.38.126.40","192.168.0.200","TCP","1514","[TCP Out-Of-Order] 443  >  49643 [ACK] Seq=19159 Ack=1189 Win=64128 Len=1460 [TCP segment of a reassembled PDU]"
"599","4.320689","23.38.126.40","192.168.0.200","TCP","400","[TCP Out-Of-Order] 443  >  49643 [PSH, ACK] Seq=20619 Ack=1189 Win=64128 Len=346"
"600","4.320710","192.168.0.200","23.38.126.40","TCP","66","[TCP Dup ACK 596#1] 49643  >  443 [ACK] Seq=1220 Ack=19159 Win=262656 Len=0 SLE=20965 SRE=37025"
"601","4.320713","192.168.0.200","23.38.126.40","TCP","66","[TCP Dup ACK 596#2] 49643  >  443 [ACK] Seq=1220 Ack=19159 Win=262656 Len=0 SLE=20965 SRE=38485"
"602","4.320733","192.168.0.200","23.38.126.40","TCP","54","49643  >  443 [ACK] Seq=1220 Ack=38485 Win=262656 Len=0"
"603","4.320748","192.168.0.200","23.38.126.40","TCP","66","49643  >  443 [ACK] Seq=1220 Ack=20619 Win=262656 Len=0 SLE=20965 SRE=38485"
"604","4.320938","23.38.126.40","192.168.0.200","TCP","1514","443  >  49643 [ACK] Seq=38485 Ack=1189 Win=64128 Len=1460 [TCP segment of a reassembled PDU]"
"605","4.320955","23.38.126.40","192.168.0.200","TCP","1514","443  >  49643 [ACK] Seq=39945 Ack=1189 Win=64128 Len=1460 [TCP segment of a reassembled PDU]"
"606","4.320977","192.168.0.200","23.38.126.40","TCP","54","49643  >  443 [ACK] Seq=1220 Ack=41405 Win=262656 Len=0"
"607","4.321004","192.168.0.200","23.38.126.40","TCP","54","49643  >  443 [ACK] Seq=1220 Ack=39945 Win=262656 Len=0"
"608","4.321340","23.38.126.40","192.168.0.200","TCP","1514","443  >  49643 [ACK] Seq=41405 Ack=1189 Win=64128 Len=1460 [TCP segment of a reassembled PDU]"
"609","4.321362","23.38.126.40","192.168.0.200","TCP","1514","443  >  49643 [ACK] Seq=42865 Ack=1189 Win=64128 Len=1460 [TCP segment of a reassembled PDU]"
"610","4.321362","23.38.126.40","192.168.0.200","TCP","1514","443  >  49643 [ACK] Seq=44325 Ack=1189 Win=64128 Len=1460 [TCP segment of a reassembled PDU]"
"611","4.321373","192.168.0.200","23.38.126.40","TCP","54","49643  >  443 [ACK] Seq=1220 Ack=42865 Win=262656 Len=0"
"612","4.321376","23.38.126.40","192.168.0.200","TCP","1514","443  >  49643 [PSH, ACK] Seq=45785 Ack=1189 Win=64128 Len=1460 [TCP segment of a reassembled PDU]"
"613","4.321397","192.168.0.200","23.38.126.40","TCP","54","49643  >  443 [ACK] Seq=1220 Ack=47245 Win=262656 Len=0"
"614","4.321416","192.168.0.200","23.38.126.40","TCP","54","49643  >  443 [ACK] Seq=1220 Ack=45785 Win=262656 Len=0"
"615","4.322504","23.38.126.40","192.168.0.200","TCP","1514","443  >  49643 [ACK] Seq=47245 Ack=1189 Win=64128 Len=1460 [TCP segment of a reassembled PDU]"
"616","4.322534","23.38.126.40","192.168.0.200","TCP","1514","443  >  49643 [ACK] Seq=48705 Ack=1189 Win=64128 Len=1460 [TCP segment of a reassembled PDU]"
"617","4.322570","192.168.0.200","23.38.126.40","TCP","54","49643  >  443 [ACK] Seq=1220 Ack=50165 Win=262656 Len=0"
"618","4.322570","192.168.0.200","23.38.126.40","TCP","54","49643  >  443 [ACK] Seq=1220 Ack=48705 Win=262656 Len=0"
"619","4.323984","23.38.126.40","192.168.0.200","TCP","1514","443  >  49643 [ACK] Seq=50165 Ack=1189 Win=64128 Len=1460 [TCP segment of a reassembled PDU]"
"620","4.323984","23.38.126.40","192.168.0.200","TCP","1514","443  >  49643 [ACK] Seq=51625 Ack=1189 Win=64128 Len=1460 [TCP segment of a reassembled PDU]"
"621","4.324033","23.38.126.40","192.168.0.200","TLSv1.3","1514","Application Data, Application Data"
"622","4.324033","23.38.126.40","192.168.0.200","TCP","1514","443  >  49643 [PSH, ACK] Seq=54545 Ack=1189 Win=64128 Len=1460 [TCP segment of a reassembled PDU]"
"623","4.324033","23.38.126.40","192.168.0.200","TCP","1514","443  >  49643 [ACK] Seq=56005 Ack=1189 Win=64128 Len=1460 [TCP segment of a reassembled PDU]"
"624","4.324089","192.168.0.200","23.38.126.40","TCP","54","49643  >  443 [ACK] Seq=1220 Ack=53085 Win=262656 Len=0"
"625","4.324120","192.168.0.200","23.38.126.40","TCP","54","49643  >  443 [ACK] Seq=1220 Ack=57465 Win=262656 Len=0"
"626","4.324672","23.38.126.40","192.168.0.200","TCP","1514","443  >  49643 [ACK] Seq=57465 Ack=1189 Win=64128 Len=1460 [TCP segment of a reassembled PDU]"
"627","4.324723","23.38.126.40","192.168.0.200","TCP","1514","443  >  49643 [ACK] Seq=58925 Ack=1189 Win=64128 Len=1460 [TCP segment of a reassembled PDU]"
"628","4.324723","23.38.126.40","192.168.0.200","TCP","1514","443  >  49643 [ACK] Seq=60385 Ack=1189 Win=64128 Len=1460 [TCP segment of a reassembled PDU]"
"629","4.324745","23.38.126.40","192.168.0.200","TCP","1514","443  >  49643 [PSH, ACK] Seq=61845 Ack=1189 Win=64128 Len=1460 [TCP segment of a reassembled PDU]"
"630","4.324817","192.168.0.200","23.38.126.40","TCP","54","49643  >  443 [ACK] Seq=1220 Ack=58925 Win=262656 Len=0"
"631","4.324878","192.168.0.200","23.38.126.40","TCP","54","49643  >  443 [ACK] Seq=1220 Ack=63305 Win=262656 Len=0"
"632","4.324879","192.168.0.200","23.38.126.40","TCP","54","49643  >  443 [ACK] Seq=1220 Ack=61845 Win=262656 Len=0"
"633","4.325828","192.168.0.200","31.25.11.55","TCP","82","64008  >  25565 [PSH, ACK] Seq=2171 Ack=319715 Win=1026 Len=28"
"634","4.328533","23.38.126.40","192.168.0.200","TCP","1514","443  >  49643 [ACK] Seq=63305 Ack=1189 Win=64128 Len=1460 [TCP segment of a reassembled PDU]"
"635","4.328658","192.168.0.200","23.38.126.40","TCP","54","49643  >  443 [ACK] Seq=1220 Ack=64765 Win=262656 Len=0"
"636","4.330406","23.38.126.40","192.168.0.200","TCP","1514","443  >  49643 [ACK] Seq=64765 Ack=1189 Win=64128 Len=1460 [TCP segment of a reassembled PDU]"
"637","4.330406","23.38.126.40","192.168.0.200","TCP","1514","443  >  49643 [ACK] Seq=66225 Ack=1189 Win=64128 Len=1460 [TCP segment of a reassembled PDU]"
"638","4.330406","23.38.126.40","192.168.0.200","TCP","1514","443  >  49643 [ACK] Seq=67685 Ack=1189 Win=64128 Len=1460 [TCP segment of a reassembled PDU]"
"639","4.330461","23.38.126.40","192.168.0.200","TLSv1.3","1514","Application Data, Application Data"
"640","4.330461","23.38.126.40","192.168.0.200","TCP","1514","443  >  49643 [PSH, ACK] Seq=70605 Ack=1189 Win=64128 Len=1460 [TCP segment of a reassembled PDU]"
"641","4.330461","23.38.126.40","192.168.0.200","TCP","60","443  >  49643 [ACK] Seq=72065 Ack=1220 Win=64128 Len=0"
"642","4.330516","192.168.0.200","23.38.126.40","TCP","54","49643  >  443 [ACK] Seq=1220 Ack=72065 Win=262656 Len=0"
"643","4.330517","192.168.0.200","23.38.126.40","TCP","54","49643  >  443 [ACK] Seq=1220 Ack=69145 Win=262656 Len=0"
"644","4.336344","23.38.126.40","192.168.0.200","TCP","1514","443  >  49643 [ACK] Seq=72065 Ack=1220 Win=64128 Len=1460 [TCP segment of a reassembled PDU]"
"645","4.336344","23.38.126.40","192.168.0.200","TCP","1514","443  >  49643 [ACK] Seq=73525 Ack=1220 Win=64128 Len=1460 [TCP segment of a reassembled PDU]"
"646","4.336344","23.38.126.40","192.168.0.200","TCP","1514","443  >  49643 [ACK] Seq=74985 Ack=1220 Win=64128 Len=1460 [TCP segment of a reassembled PDU]"
"647","4.336445","192.168.0.200","23.38.126.40","TCP","54","49643  >  443 [ACK] Seq=1220 Ack=76445 Win=262656 Len=0"
"648","4.337152","23.38.126.40","192.168.0.200","TCP","1514","443  >  49643 [PSH, ACK] Seq=76445 Ack=1220 Win=64128 Len=1460 [TCP segment of a reassembled PDU]"
"649","4.337152","23.38.126.40","192.168.0.200","TCP","1514","443  >  49643 [ACK] Seq=77905 Ack=1220 Win=64128 Len=1460 [TCP segment of a reassembled PDU]"
"650","4.337178","23.38.126.40","192.168.0.200","TCP","1514","443  >  49643 [ACK] Seq=79365 Ack=1220 Win=64128 Len=1460 [TCP segment of a reassembled PDU]"
"651","4.337178","23.38.126.40","192.168.0.200","TCP","1514","443  >  49643 [ACK] Seq=80825 Ack=1220 Win=64128 Len=1460 [TCP segment of a reassembled PDU]"
"652","4.337192","23.38.126.40","192.168.0.200","TCP","1514","443  >  49643 [ACK] Seq=82285 Ack=1220 Win=64128 Len=1460 [TCP segment of a reassembled PDU]"
"653","4.337204","23.38.126.40","192.168.0.200","TCP","1514","443  >  49643 [ACK] Seq=83745 Ack=1220 Win=64128 Len=1460 [TCP segment of a reassembled PDU]"
"654","4.337223","192.168.0.200","23.38.126.40","TCP","54","49643  >  443 [ACK] Seq=1220 Ack=79365 Win=262656 Len=0"
"655","4.337234","192.168.0.200","23.38.126.40","TCP","54","49643  >  443 [ACK] Seq=1220 Ack=82285 Win=262656 Len=0"
"656","4.337235","192.168.0.200","23.38.126.40","TCP","54","49643  >  443 [ACK] Seq=1220 Ack=83745 Win=262656 Len=0"
"657","4.338250","23.38.126.40","192.168.0.200","TCP","1514","443  >  49643 [PSH, ACK] Seq=85205 Ack=1220 Win=64128 Len=1460 [TCP segment of a reassembled PDU]"
"658","4.338250","23.38.126.40","192.168.0.200","TLSv1.3","1514","Application Data, Application Data"
"659","4.338250","23.38.126.40","192.168.0.200","TCP","1514","443  >  49643 [ACK] Seq=88125 Ack=1220 Win=64128 Len=1460 [TCP segment of a reassembled PDU]"
"660","4.338328","192.168.0.200","23.38.126.40","TCP","54","49643  >  443 [ACK] Seq=1220 Ack=89585 Win=262656 Len=0"
"661","4.338947","23.38.126.40","192.168.0.200","TCP","1514","443  >  49643 [ACK] Seq=89585 Ack=1220 Win=64128 Len=1460 [TCP segment of a reassembled PDU]"
"662","4.338959","23.38.126.40","192.168.0.200","TCP","1514","443  >  49643 [ACK] Seq=91045 Ack=1220 Win=64128 Len=1460 [TCP segment of a reassembled PDU]"
"663","4.338975","23.38.126.40","192.168.0.200","TCP","1514","443  >  49643 [ACK] Seq=92505 Ack=1220 Win=64128 Len=1460 [TCP segment of a reassembled PDU]"
"664","4.338979","23.38.126.40","192.168.0.200","TCP","1514","443  >  49643 [PSH, ACK] Seq=93965 Ack=1220 Win=64128 Len=1460 [TCP segment of a reassembled PDU]"
"665","4.338991","23.38.126.40","192.168.0.200","TCP","1514","443  >  49643 [ACK] Seq=95425 Ack=1220 Win=64128 Len=1460 [TCP segment of a reassembled PDU]"
"666","4.339003","23.38.126.40","192.168.0.200","TCP","1514","443  >  49643 [ACK] Seq=96885 Ack=1220 Win=64128 Len=1460 [TCP segment of a reassembled PDU]"
"667","4.339016","23.38.126.40","192.168.0.200","TCP","1514","443  >  49643 [ACK] Seq=98345 Ack=1220 Win=64128 Len=1460 [TCP segment of a reassembled PDU]"
"668","4.339027","192.168.0.200","23.38.126.40","TCP","54","49643  >  443 [ACK] Seq=1220 Ack=92505 Win=262656 Len=0"
"669","4.339032","23.38.126.40","192.168.0.200","TCP","1514","443  >  49643 [ACK] Seq=99805 Ack=1220 Win=64128 Len=1460 [TCP segment of a reassembled PDU]"
"670","4.339036","192.168.0.200","23.38.126.40","TCP","54","49643  >  443 [ACK] Seq=1220 Ack=95425 Win=262656 Len=0"
"671","4.339044","23.38.126.40","192.168.0.200","TCP","1514","443  >  49643 [ACK] Seq=101265 Ack=1220 Win=64128 Len=1460 [TCP segment of a reassembled PDU]"
"672","4.339062","192.168.0.200","23.38.126.40","TCP","54","49643  >  443 [ACK] Seq=1220 Ack=98345 Win=262656 Len=0"
"673","4.339066","192.168.0.200","23.38.126.40","TCP","54","49643  >  443 [ACK] Seq=1220 Ack=101265 Win=262656 Len=0"
"674","4.340086","23.38.126.40","192.168.0.200","TLSv1.3","1514","Application Data, Application Data"
"675","4.340086","23.38.126.40","192.168.0.200","TLSv1.3","907","Application Data"
"676","4.340152","192.168.0.200","23.38.126.40","TCP","54","49643  >  443 [ACK] Seq=1220 Ack=105038 Win=262656 Len=0"
"677","4.377956","192.168.0.200","31.25.11.55","TCP","82","64008  >  25565 [PSH, ACK] Seq=2199 Ack=319715 Win=1026 Len=28"
"678","4.385244","31.25.11.55","192.168.0.200","TCP","60","25565  >  64008 [ACK] Seq=319715 Ack=2199 Win=24 Len=0"
"679","4.397371","31.25.11.55","192.168.0.200","TCP","60","25565  >  64008 [ACK] Seq=319715 Ack=2227 Win=24 Len=0"
"680","4.402697","31.25.11.55","192.168.0.200","TCP","1514","25565  >  64008 [PSH, ACK] Seq=319715 Ack=2227 Win=24 Len=1460"
"681","4.402985","31.25.11.55","192.168.0.200","TCP","1454","25565  >  64008 [PSH, ACK] Seq=321175 Ack=2227 Win=24 Len=1400"
"682","4.403073","192.168.0.200","31.25.11.55","TCP","54","64008  >  25565 [ACK] Seq=2227 Ack=322575 Win=1026 Len=0"
"683","4.428576","192.168.0.200","31.25.11.55","TCP","82","64008  >  25565 [PSH, ACK] Seq=2227 Ack=322575 Win=1026 Len=28"
"684","4.478627","192.168.0.200","31.25.11.55","TCP","82","64008  >  25565 [PSH, ACK] Seq=2255 Ack=322575 Win=1026 Len=28"
"685","4.488965","31.25.11.55","192.168.0.200","TCP","60","25565  >  64008 [ACK] Seq=322575 Ack=2255 Win=24 Len=0"
"686","4.499688","31.25.11.55","192.168.0.200","TCP","60","25565  >  64008 [ACK] Seq=322575 Ack=2283 Win=24 Len=0"
"687","4.499804","192.168.0.200","23.38.126.40","TCP","66","49644  >  443 [SYN] Seq=0 Win=64240 Len=0 MSS=1460 WS=256 SACK_PERM"
"688","4.501931","31.25.11.55","192.168.0.200","TCP","1514","25565  >  64008 [PSH, ACK] Seq=322575 Ack=2283 Win=24 Len=1460"
"689","4.502518","31.25.11.55","192.168.0.200","TCP","1454","25565  >  64008 [PSH, ACK] Seq=324035 Ack=2283 Win=24 Len=1400"
"690","4.502601","192.168.0.200","31.25.11.55","TCP","54","64008  >  25565 [ACK] Seq=2283 Ack=325435 Win=1026 Len=0"
"691","4.517605","23.38.126.40","192.168.0.200","TCP","66","443  >  49644 [SYN, ACK] Seq=0 Ack=1 Win=64240 Len=0 MSS=1460 SACK_PERM WS=128"
"692","4.517723","192.168.0.200","23.38.126.40","TCP","54","49644  >  443 [ACK] Seq=1 Ack=1 Win=262656 Len=0"
"693","4.517953","192.168.0.200","23.38.126.40","TLSv1.3","870","Client Hello (SNI=i.scdn.co)"
"694","4.529322","192.168.0.200","31.25.11.55","TCP","82","64008  >  25565 [PSH, ACK] Seq=2283 Ack=325435 Win=1026 Len=28"
"695","4.534457","23.38.126.40","192.168.0.200","TCP","60","443  >  49644 [ACK] Seq=1 Ack=817 Win=64128 Len=0"
"696","4.534610","23.38.126.40","192.168.0.200","TLSv1.3","318","Server Hello, Change Cipher Spec, Application Data, Application Data"
"697","4.534894","192.168.0.200","23.38.126.40","TLSv1.3","134","Change Cipher Spec, Application Data"
"698","4.551150","23.38.126.40","192.168.0.200","TCP","60","443  >  49644 [ACK] Seq=265 Ack=897 Win=64128 Len=0"
"699","4.551354","23.38.126.40","192.168.0.200","TLSv1.3","325","Application Data"
"700","4.578029","192.168.0.200","31.25.11.55","TCP","82","64008  >  25565 [PSH, ACK] Seq=2311 Ack=325435 Win=1026 Len=28"
"701","4.588742","31.25.11.55","192.168.0.200","TCP","60","25565  >  64008 [ACK] Seq=325435 Ack=2311 Win=24 Len=0"
"702","4.595589","31.25.11.55","192.168.0.200","TCP","60","25565  >  64008 [ACK] Seq=325435 Ack=2339 Win=24 Len=0"
"703","4.603383","31.25.11.55","192.168.0.200","TCP","1514","25565  >  64008 [PSH, ACK] Seq=325435 Ack=2339 Win=24 Len=1460"
"704","4.604045","31.25.11.55","192.168.0.200","TCP","1454","25565  >  64008 [PSH, ACK] Seq=326895 Ack=2339 Win=24 Len=1400"
"705","4.604149","192.168.0.200","31.25.11.55","TCP","54","64008  >  25565 [ACK] Seq=2339 Ack=328295 Win=1026 Len=0"
"706","4.605995","192.168.0.200","23.38.126.40","TCP","54","49644  >  443 [ACK] Seq=897 Ack=536 Win=262144 Len=0"
"707","4.625268","192.168.0.200","31.25.11.55","TCP","82","64008  >  25565 [PSH, ACK] Seq=2339 Ack=328295 Win=1026 Len=28"
"708","4.676619","192.168.0.200","31.25.11.55","TCP","82","64008  >  25565 [PSH, ACK] Seq=2367 Ack=328295 Win=1026 Len=28"
"709","4.685700","31.25.11.55","192.168.0.200","TCP","60","25565  >  64008 [ACK] Seq=328295 Ack=2367 Win=24 Len=0"
"710","4.702325","31.25.11.55","192.168.0.200","TCP","1514","25565  >  64008 [PSH, ACK] Seq=328295 Ack=2367 Win=24 Len=1460"
"711","4.702429","192.168.0.200","31.25.11.55","TCP","54","64008  >  25565 [ACK] Seq=2395 Ack=329755 Win=1026 Len=0"
"712","4.703245","31.25.11.55","192.168.0.200","TCP","1465","25565  >  64008 [PSH, ACK] Seq=329755 Ack=2367 Win=24 Len=1411"
"713","4.703245","31.25.11.55","192.168.0.200","TCP","60","25565  >  64008 [ACK] Seq=331166 Ack=2395 Win=24 Len=0"
"714","4.703318","192.168.0.200","31.25.11.55","TCP","54","64008  >  25565 [ACK] Seq=2395 Ack=331166 Win=1021 Len=0"
"715","4.728157","192.168.0.200","31.25.11.55","TCP","82","64008  >  25565 [PSH, ACK] Seq=2395 Ack=331166 Win=1021 Len=28"
"716","4.747251","31.25.11.55","192.168.0.200","TCP","60","25565  >  64008 [ACK] Seq=331166 Ack=2423 Win=24 Len=0"
"717","4.754272","31.25.11.55","192.168.0.200","TCP","73","25565  >  64008 [PSH, ACK] Seq=331166 Ack=2423 Win=24 Len=19"
"718","4.776044","192.168.0.200","31.25.11.55","TCP","82","64008  >  25565 [PSH, ACK] Seq=2423 Ack=331185 Win=1020 Len=28"
"719","4.802635","31.25.11.55","192.168.0.200","TCP","1514","25565  >  64008 [PSH, ACK] Seq=331185 Ack=2451 Win=24 Len=1460"
"720","4.802975","31.25.11.55","192.168.0.200","TCP","1454","25565  >  64008 [PSH, ACK] Seq=332645 Ack=2451 Win=24 Len=1400"
"721","4.803070","192.168.0.200","31.25.11.55","TCP","54","64008  >  25565 [ACK] Seq=2451 Ack=334045 Win=1026 Len=0"
"722","4.828236","192.168.0.200","31.25.11.55","TCP","82","64008  >  25565 [PSH, ACK] Seq=2451 Ack=334045 Win=1026 Len=28"
"723","4.874851","192.168.0.200","31.25.11.55","TCP","82","64008  >  25565 [PSH, ACK] Seq=2479 Ack=334045 Win=1026 Len=28"
"724","4.892948","31.25.11.55","192.168.0.200","TCP","60","25565  >  64008 [ACK] Seq=334045 Ack=2479 Win=24 Len=0"
"725","4.894763","31.25.11.55","192.168.0.200","TCP","60","25565  >  64008 [ACK] Seq=334045 Ack=2507 Win=24 Len=0"
"726","4.902225","31.25.11.55","192.168.0.200","TCP","1514","25565  >  64008 [PSH, ACK] Seq=334045 Ack=2507 Win=24 Len=1460"
"727","4.903282","31.25.11.55","192.168.0.200","TCP","1454","25565  >  64008 [PSH, ACK] Seq=335505 Ack=2507 Win=24 Len=1400"
"728","4.903393","192.168.0.200","31.25.11.55","TCP","54","64008  >  25565 [ACK] Seq=2507 Ack=336905 Win=1026 Len=0"
"729","4.926930","192.168.0.200","31.25.11.55","TCP","82","64008  >  25565 [PSH, ACK] Seq=2507 Ack=336905 Win=1026 Len=28"
"730","4.988855","31.25.11.55","192.168.0.200","TCP","60","25565  >  64008 [ACK] Seq=336905 Ack=2535 Win=24 Len=0"
"731","5.004118","31.25.11.55","192.168.0.200","TCP","1514","25565  >  64008 [PSH, ACK] Seq=336905 Ack=2535 Win=24 Len=1460"
"732","5.004118","31.25.11.55","192.168.0.200","TCP","1454","25565  >  64008 [PSH, ACK] Seq=338365 Ack=2535 Win=24 Len=1400"
"733","5.004221","192.168.0.200","31.25.11.55","TCP","54","64008  >  25565 [ACK] Seq=2535 Ack=339765 Win=1026 Len=0"
"734","5.102441","31.25.11.55","192.168.0.200","TCP","1514","25565  >  64008 [PSH, ACK] Seq=339765 Ack=2535 Win=24 Len=1460"
"735","5.102441","31.25.11.55","192.168.0.200","TCP","1454","25565  >  64008 [PSH, ACK] Seq=341225 Ack=2535 Win=24 Len=1400"
"736","5.102535","192.168.0.200","31.25.11.55","TCP","54","64008  >  25565 [ACK] Seq=2535 Ack=342625 Win=1026 Len=0"
"737","5.203752","31.25.11.55","192.168.0.200","TCP","1514","25565  >  64008 [PSH, ACK] Seq=342625 Ack=2535 Win=24 Len=1460"
