No.,Time,Source,Destination,Protocol,Length,Info
1,0,15.235.119.117,100.86.104.173,TCP,115,"25565  >  51527 [PSH, ACK] Seq=1 Ack=1 Win=501 Len=61"
2,0.00281,15.235.119.117,100.86.104.173,TCP,87,"25565  >  51527 [PSH, ACK] Seq=62 Ack=1 Win=501 Len=33"
3,0.002931,100.86.104.173,15.235.119.117,TCP,54,51527  >  25565 [ACK] Seq=1 Ack=95 Win=511 Len=0
4,0.099665,15.235.119.117,100.86.104.173,TCP,88,"25565  >  51527 [PSH, ACK] Seq=95 Ack=1 Win=501 Len=34"
5,0.151061,100.86.104.173,15.235.119.117,TCP,54,51527  >  25565 [ACK] Seq=1 Ack=129 Win=511 Len=0
6,0.160245,15.235.119.117,100.86.104.173,TCP,972,"25565  >  51527 [PSH, ACK] Seq=129 Ack=1 Win=501 Len=918"
7,0.162604,15.235.119.117,100.86.104.173,TCP,382,"25565  >  51527 [PSH, ACK] Seq=1047 Ack=1 Win=501 Len=328"
8,0.162604,15.235.119.117,100.86.104.173,TCP,186,"25565  >  51527 [PSH, ACK] Seq=1375 Ack=1 Win=501 Len=132"
9,0.162714,100.86.104.173,15.235.119.117,TCP,54,51527  >  25565 [ACK] Seq=1 Ack=1507 Win=512 Len=0
11,0.202525,15.235.119.117,100.86.104.173,TCP,335,"25565  >  51527 [PSH, ACK] Seq=1507 Ack=1 Win=501 Len=281"
12,0.202654,100.86.104.173,15.235.119.117,TCP,54,51527  >  25565 [ACK] Seq=1 Ack=1788 Win=511 Len=0
15,0.250513,15.235.119.117,100.86.104.173,TCP,318,"25565  >  51527 [PSH, ACK] Seq=1788 Ack=1 Win=501 Len=264"
17,0.291051,100.86.104.173,15.235.119.117,TCP,54,51527  >  25565 [ACK] Seq=1 Ack=2052 Win=510 Len=0
18,0.301652,15.235.119.117,100.86.104.173,TCP,531,"25565  >  51527 [PSH, ACK] Seq=2052 Ack=1 Win=501 Len=477"
19,0.308651,15.235.119.117,100.86.104.173,TCP,60,"25565  >  51527 [PSH, ACK] Seq=2529 Ack=1 Win=501 Len=6"
20,0.308789,100.86.104.173,15.235.119.117,TCP,54,51527  >  25565 [ACK] Seq=1 Ack=2535 Win=508 Len=0
21,0.349477,15.235.119.117,100.86.104.173,TCP,113,"25565  >  51527 [PSH, ACK] Seq=2535 Ack=1 Win=501 Len=59"
22,0.399229,100.86.104.173,15.235.119.117,TCP,54,51527  >  25565 [ACK] Seq=1 Ack=2594 Win=507 Len=0
23,0.402388,15.235.119.117,100.86.104.173,TCP,119,"25565  >  51527 [PSH, ACK] Seq=2594 Ack=1 Win=501 Len=65"
24,0.446441,100.86.104.173,15.235.119.117,TCP,54,51527  >  25565 [ACK] Seq=1 Ack=2659 Win=507 Len=0
25,0.450667,15.235.119.117,100.86.104.173,TCP,250,"25565  >  51527 [PSH, ACK] Seq=2659 Ack=1 Win=501 Len=196"
26,0.452392,15.235.119.117,100.86.104.173,TCP,79,"25565  >  51527 [PSH, ACK] Seq=2855 Ack=1 Win=501 Len=25"
27,0.452458,100.86.104.173,15.235.119.117,TCP,54,51527  >  25565 [ACK] Seq=1 Ack=2880 Win=506 Len=0
28,0.475516,100.86.104.173,15.235.119.117,TCP,82,"51527  >  25565 [PSH, ACK] Seq=1 Ack=2880 Win=506 Len=28"
29,0.499406,15.235.119.117,100.86.104.173,TCP,99,"25565  >  51527 [PSH, ACK] Seq=2880 Ack=1 Win=501 Len=45"
30,0.499524,100.86.104.173,15.235.119.117,TCP,54,51527  >  25565 [ACK] Seq=29 Ack=2925 Win=512 Len=0
31,0.500913,15.235.119.117,100.86.104.173,TCP,113,"25565  >  51527 [PSH, ACK] Seq=2925 Ack=29 Win=501 Len=59"
32,0.500959,100.86.104.173,15.235.119.117,TCP,54,51527  >  25565 [ACK] Seq=29 Ack=2984 Win=511 Len=0
33,0.544899,15.235.119.117,100.86.104.173,TCP,60,"25565  >  51527 [PSH, ACK] Seq=2984 Ack=29 Win=501 Len=6"
34,0.549413,15.235.119.117,100.86.104.173,TCP,79,"25565  >  51527 [PSH, ACK] Seq=2990 Ack=29 Win=501 Len=25"
35,0.549491,100.86.104.173,15.235.119.117,TCP,54,51527  >  25565 [ACK] Seq=29 Ack=3015 Win=511 Len=0
36,0.604169,15.235.119.117,100.86.104.173,TCP,99,"25565  >  51527 [PSH, ACK] Seq=3015 Ack=29 Win=501 Len=45"
37,0.647611,100.86.104.173,15.235.119.117,TCP,54,51527  >  25565 [ACK] Seq=29 Ack=3060 Win=511 Len=0
38,0.650574,15.235.119.117,100.86.104.173,TCP,79,"25565  >  51527 [PSH, ACK] Seq=3060 Ack=29 Win=501 Len=25"
39,0.693385,100.86.104.173,15.235.119.117,TCP,54,51527  >  25565 [ACK] Seq=29 Ack=3085 Win=511 Len=0
40,0.699338,15.235.119.117,100.86.104.173,TCP,186,"25565  >  51527 [PSH, ACK] Seq=3085 Ack=29 Win=501 Len=132"
41,0.740556,100.86.104.173,15.235.119.117,TCP,54,51527  >  25565 [ACK] Seq=29 Ack=3217 Win=511 Len=0
42,0.746213,15.235.119.117,100.86.104.173,TCP,60,"25565  >  51527 [PSH, ACK] Seq=3217 Ack=29 Win=501 Len=6"
43,0.752627,15.235.119.117,100.86.104.173,TCP,90,"25565  >  51527 [PSH, ACK] Seq=3223 Ack=29 Win=501 Len=36"
44,0.752791,100.86.104.173,15.235.119.117,TCP,54,51527  >  25565 [ACK] Seq=29 Ack=3259 Win=510 Len=0
45,0.753139,100.86.104.173,15.235.119.117,TCP,65,"51527  >  25565 [PSH, ACK] Seq=29 Ack=3259 Win=510 Len=11"
46,0.803439,15.235.119.117,100.86.104.173,TCP,105,"25565  >  51527 [PSH, ACK] Seq=3259 Ack=40 Win=501 Len=51"
47,0.850124,15.235.119.117,100.86.104.173,TCP,79,"25565  >  51527 [PSH, ACK] Seq=3310 Ack=40 Win=501 Len=25"
48,0.850381,100.86.104.173,15.235.119.117,TCP,54,51527  >  25565 [ACK] Seq=40 Ack=3335 Win=510 Len=0
49,0.901371,15.235.119.117,100.86.104.173,TCP,91,"25565  >  51527 [PSH, ACK] Seq=3335 Ack=40 Win=501 Len=37"
50,0.945183,100.86.104.173,15.235.119.117,TCP,54,51527  >  25565 [ACK] Seq=40 Ack=3372 Win=510 Len=0
51,0.954408,15.235.119.117,100.86.104.173,TCP,79,"25565  >  51527 [PSH, ACK] Seq=3372 Ack=40 Win=501 Len=25"
52,1.002422,15.235.119.117,100.86.104.173,TCP,193,"25565  >  51527 [PSH, ACK] Seq=3397 Ack=40 Win=501 Len=139"
53,1.002548,100.86.104.173,15.235.119.117,TCP,54,51527  >  25565 [ACK] Seq=40 Ack=3536 Win=509 Len=0
54,1.04962,15.235.119.117,100.86.104.173,TCP,79,"25565  >  51527 [PSH, ACK] Seq=3536 Ack=40 Win=501 Len=25"
55,1.1004,15.235.119.117,100.86.104.173,TCP,103,"25565  >  51527 [PSH, ACK] Seq=3561 Ack=40 Win=501 Len=49"
56,1.100517,100.86.104.173,15.235.119.117,TCP,54,51527  >  25565 [ACK] Seq=40 Ack=3610 Win=509 Len=0
57,1.157006,15.235.119.117,100.86.104.173,TCP,79,"25565  >  51527 [PSH, ACK] Seq=3610 Ack=40 Win=501 Len=25"
59,1.199029,15.235.119.117,100.86.104.173,TCP,89,"25565  >  51527 [PSH, ACK] Seq=3635 Ack=40 Win=501 Len=35"
60,1.199108,100.86.104.173,15.235.119.117,TCP,54,51527  >  25565 [ACK] Seq=40 Ack=3670 Win=509 Len=0
63,1.249381,15.235.119.117,100.86.104.173,TCP,77,"25565  >  51527 [PSH, ACK] Seq=3670 Ack=40 Win=501 Len=23"
64,1.299247,15.235.119.117,100.86.104.173,TCP,97,"25565  >  51527 [PSH, ACK] Seq=3693 Ack=40 Win=501 Len=43"
65,1.299355,100.86.104.173,15.235.119.117,TCP,54,51527  >  25565 [ACK] Seq=40 Ack=3736 Win=509 Len=0
66,1.326125,100.86.104.173,15.235.119.117,TCP,66,"51527  >  25565 [PSH, ACK] Seq=40 Ack=3736 Win=509 Len=12"
67,1.350164,15.235.119.117,100.86.104.173,TCP,98,"25565  >  51527 [PSH, ACK] Seq=3736 Ack=40 Win=501 Len=44"
68,1.376016,100.86.104.173,15.235.119.117,TCP,66,"51527  >  25565 [PSH, ACK] Seq=52 Ack=3780 Win=508 Len=12"
69,1.400129,15.235.119.117,100.86.104.173,TCP,204,"25565  >  51527 [PSH, ACK] Seq=3780 Ack=52 Win=501 Len=150"
70,1.426578,100.86.104.173,15.235.119.117,TCP,66,"51527  >  25565 [PSH, ACK] Seq=64 Ack=3930 Win=508 Len=12"
71,1.460085,15.235.119.117,100.86.104.173,TCP,56,25565  >  51527 [ACK] Seq=3930 Ack=76 Win=501 Len=0
72,1.479614,100.86.104.173,15.235.119.117,TCP,90,"51527  >  25565 [PSH, ACK] Seq=76 Ack=3930 Win=508 Len=36"
73,1.506979,15.235.119.117,100.86.104.173,TCP,66,"25565  >  51527 [PSH, ACK] Seq=3930 Ack=76 Win=501 Len=12"
74,1.526698,100.86.104.173,15.235.119.117,TCP,90,"51527  >  25565 [PSH, ACK] Seq=112 Ack=3942 Win=508 Len=36"
75,1.558088,15.235.119.117,100.86.104.173,TCP,56,25565  >  51527 [ACK] Seq=3942 Ack=148 Win=501 Len=0
76,1.57644,100.86.104.173,15.235.119.117,TCP,90,"51527  >  25565 [PSH, ACK] Seq=148 Ack=3942 Win=508 Len=36"
77,1.600121,15.235.119.117,100.86.104.173,TCP,117,"25565  >  51527 [PSH, ACK] Seq=3942 Ack=148 Win=501 Len=63"
78,1.601648,15.235.119.117,100.86.104.173,TCP,87,"25565  >  51527 [PSH, ACK] Seq=4005 Ack=184 Win=501 Len=33"
79,1.601776,100.86.104.173,15.235.119.117,TCP,54,51527  >  25565 [ACK] Seq=184 Ack=4038 Win=507 Len=0
88,1.626254,100.86.104.173,15.235.119.117,TCP,90,"51527  >  25565 [PSH, ACK] Seq=184 Ack=4038 Win=507 Len=36"
106,1.649933,15.235.119.117,100.86.104.173,TCP,87,"25565  >  51527 [PSH, ACK] Seq=4038 Ack=184 Win=501 Len=33"
107,1.651559,15.235.119.117,100.86.104.173,TCP,65,"25565  >  51527 [PSH, ACK] Seq=4071 Ack=220 Win=501 Len=11"
108,1.651689,100.86.104.173,15.235.119.117,TCP,54,51527  >  25565 [ACK] Seq=220 Ack=4082 Win=507 Len=0
109,1.651891,15.235.119.117,100.86.104.173,TCP,76,"25565  >  51527 [PSH, ACK] Seq=4082 Ack=220 Win=501 Len=22"
110,1.651891,15.235.119.117,100.86.104.173,TCP,87,"25565  >  51527 [PSH, ACK] Seq=4104 Ack=220 Win=501 Len=33"
111,1.651891,15.235.119.117,100.86.104.173,TCP,65,"25565  >  51527 [PSH, ACK] Seq=4137 Ack=220 Win=501 Len=11"
112,1.651891,15.235.119.117,100.86.104.173,TCP,65,"25565  >  51527 [PSH, ACK] Seq=4148 Ack=220 Win=501 Len=11"
113,1.651977,100.86.104.173,15.235.119.117,TCP,54,51527  >  25565 [ACK] Seq=220 Ack=4159 Win=507 Len=0
114,1.653052,15.235.119.117,100.86.104.173,TCP,76,"25565  >  51527 [PSH, ACK] Seq=4159 Ack=220 Win=501 Len=22"
117,1.675411,15.235.119.117,100.86.104.173,TCP,250,"25565  >  51527 [PSH, ACK] Seq=4181 Ack=220 Win=501 Len=196"
118,1.675567,100.86.104.173,15.235.119.117,TCP,54,51527  >  25565 [ACK] Seq=220 Ack=4377 Win=512 Len=0
119,1.677735,100.86.104.173,15.235.119.117,TCP,90,"51527  >  25565 [PSH, ACK] Seq=220 Ack=4377 Win=512 Len=36"
122,1.703745,15.235.119.117,100.86.104.173,TCP,1464,25565  >  51527 [ACK] Seq=4377 Ack=220 Win=501 Len=1410
123,1.703745,15.235.119.117,100.86.104.173,TCP,1464,"25565  >  51527 [PSH, ACK] Seq=5787 Ack=220 Win=501 Len=1410"
124,1.703745,15.235.119.117,100.86.104.173,TCP,1464,25565  >  51527 [ACK] Seq=7197 Ack=220 Win=501 Len=1410
125,1.703745,15.235.119.117,100.86.104.173,TCP,638,"25565  >  51527 [PSH, ACK] Seq=8607 Ack=220 Win=501 Len=584"
126,1.703745,15.235.119.117,100.86.104.173,TCP,1464,25565  >  51527 [ACK] Seq=9191 Ack=220 Win=501 Len=1410
127,1.703745,15.235.119.117,100.86.104.173,TCP,1464,"25565  >  51527 [PSH, ACK] Seq=10601 Ack=220 Win=501 Len=1410"
128,1.703745,15.235.119.117,100.86.104.173,TCP,1464,25565  >  51527 [ACK] Seq=12011 Ack=220 Win=501 Len=1410
129,1.703745,15.235.119.117,100.86.104.173,TCP,1464,"25565  >  51527 [PSH, ACK] Seq=13421 Ack=220 Win=501 Len=1410"
130,1.703745,15.235.119.117,100.86.104.173,TCP,1464,25565  >  51527 [ACK] Seq=14831 Ack=220 Win=501 Len=1410
131,1.703745,15.235.119.117,100.86.104.173,TCP,1464,"25565  >  51527 [PSH, ACK] Seq=16241 Ack=220 Win=501 Len=1410"
132,1.704296,100.86.104.173,15.235.119.117,TCP,54,51527  >  25565 [ACK] Seq=256 Ack=17651 Win=512 Len=0
133,1.72955,15.235.119.117,100.86.104.173,TCP,1464,25565  >  51527 [ACK] Seq=17651 Ack=256 Win=501 Len=1410
134,1.729743,15.235.119.117,100.86.104.173,TCP,1464,"25565  >  51527 [PSH, ACK] Seq=19061 Ack=256 Win=501 Len=1410"
135,1.729743,15.235.119.117,100.86.104.173,TCP,1464,25565  >  51527 [ACK] Seq=20471 Ack=256 Win=501 Len=1410
136,1.729904,100.86.104.173,15.235.119.117,TCP,54,51527  >  25565 [ACK] Seq=256 Ack=21881 Win=512 Len=0
137,1.731537,100.86.104.173,15.235.119.117,TCP,90,"51527  >  25565 [PSH, ACK] Seq=256 Ack=21881 Win=512 Len=36"
138,1.732726,15.235.119.117,100.86.104.173,TCP,1464,"25565  >  51527 [PSH, ACK] Seq=21881 Ack=256 Win=501 Len=1410"
139,1.732726,15.235.119.117,100.86.104.173,TCP,235,"25565  >  51527 [PSH, ACK] Seq=23291 Ack=256 Win=501 Len=181"
140,1.732884,100.86.104.173,15.235.119.117,TCP,54,51527  >  25565 [ACK] Seq=292 Ack=23472 Win=512 Len=0
141,1.761058,15.235.119.117,100.86.104.173,TCP,1464,25565  >  51527 [ACK] Seq=23472 Ack=256 Win=501 Len=1410
142,1.761372,100.86.104.173,15.235.119.117,TCP,54,51527  >  25565 [ACK] Seq=292 Ack=24882 Win=512 Len=0
143,1.761615,15.235.119.117,100.86.104.173,TCP,1464,"25565  >  51527 [PSH, ACK] Seq=24882 Ack=256 Win=501 Len=1410"
144,1.761615,15.235.119.117,100.86.104.173,TCP,1078,"25565  >  51527 [PSH, ACK] Seq=26292 Ack=256 Win=501 Len=1024"
145,1.76191,100.86.104.173,15.235.119.117,TCP,54,51527  >  25565 [ACK] Seq=292 Ack=27316 Win=512 Len=0
146,1.762594,15.235.119.117,100.86.104.173,TCP,1464,25565  >  51527 [ACK] Seq=27316 Ack=256 Win=501 Len=1410
147,1.762594,15.235.119.117,100.86.104.173,TCP,1464,"25565  >  51527 [PSH, ACK] Seq=28726 Ack=256 Win=501 Len=1410"
148,1.762594,15.235.119.117,100.86.104.173,TCP,1464,25565  >  51527 [ACK] Seq=30136 Ack=256 Win=501 Len=1410
149,1.762594,15.235.119.117,100.86.104.173,TCP,1464,"25565  >  51527 [PSH, ACK] Seq=31546 Ack=256 Win=501 Len=1410"
150,1.762594,15.235.119.117,100.86.104.173,TCP,1464,25565  >  51527 [ACK] Seq=32956 Ack=256 Win=501 Len=1410
151,1.762594,15.235.119.117,100.86.104.173,TCP,1464,"25565  >  51527 [PSH, ACK] Seq=34366 Ack=256 Win=501 Len=1410"
152,1.762963,100.86.104.173,15.235.119.117,TCP,54,51527  >  25565 [ACK] Seq=292 Ack=35776 Win=512 Len=0
153,1.768808,15.235.119.117,100.86.104.173,TCP,1139,"25565  >  51527 [PSH, ACK] Seq=35776 Ack=256 Win=501 Len=1085"
154,1.769096,100.86.104.173,15.235.119.117,TCP,54,51527  >  25565 [ACK] Seq=292 Ack=36861 Win=507 Len=0
155,1.794821,15.235.119.117,100.86.104.173,TCP,56,25565  >  51527 [ACK] Seq=36861 Ack=292 Win=501 Len=0
156,1.799584,100.86.104.173,15.235.119.117,TCP,90,"51527  >  25565 [PSH, ACK] Seq=292 Ack=36861 Win=507 Len=36"
157,1.801936,15.235.119.117,100.86.104.173,TCP,1464,25565  >  51527 [ACK] Seq=36861 Ack=292 Win=501 Len=1410
158,1.801936,15.235.119.117,100.86.104.173,TCP,1464,"25565  >  51527 [PSH, ACK] Seq=38271 Ack=292 Win=501 Len=1410"
159,1.801936,15.235.119.117,100.86.104.173,TCP,1464,25565  >  51527 [ACK] Seq=39681 Ack=292 Win=501 Len=1410
160,1.802249,100.86.104.173,15.235.119.117,TCP,54,51527  >  25565 [ACK] Seq=328 Ack=41091 Win=512 Len=0
161,1.804731,15.235.119.117,100.86.104.173,TCP,1464,"25565  >  51527 [PSH, ACK] Seq=41091 Ack=292 Win=501 Len=1410"
162,1.804731,15.235.119.117,100.86.104.173,TCP,1464,25565  >  51527 [ACK] Seq=42501 Ack=292 Win=501 Len=1410
163,1.804731,15.235.119.117,100.86.104.173,TCP,1464,"25565  >  51527 [PSH, ACK] Seq=43911 Ack=292 Win=501 Len=1410"
164,1.804731,15.235.119.117,100.86.104.173,TCP,1464,25565  >  51527 [ACK] Seq=45321 Ack=292 Win=501 Len=1410
165,1.804731,15.235.119.117,100.86.104.173,TCP,1464,"25565  >  51527 [PSH, ACK] Seq=46731 Ack=292 Win=501 Len=1410"
166,1.804731,15.235.119.117,100.86.104.173,TCP,1464,25565  >  51527 [ACK] Seq=48141 Ack=292 Win=501 Len=1410
167,1.805073,100.86.104.173,15.235.119.117,TCP,54,51527  >  25565 [ACK] Seq=328 Ack=49551 Win=512 Len=0
168,1.805504,15.235.119.117,100.86.104.173,TCP,1464,"25565  >  51527 [PSH, ACK] Seq=49551 Ack=292 Win=501 Len=1410"
169,1.805504,15.235.119.117,100.86.104.173,TCP,785,"25565  >  51527 [PSH, ACK] Seq=50961 Ack=292 Win=501 Len=731"
170,1.805755,100.86.104.173,15.235.119.117,TCP,54,51527  >  25565 [ACK] Seq=328 Ack=51692 Win=512 Len=0
171,1.837379,100.86.104.173,15.235.119.117,TCP,82,"51527  >  25565 [PSH, ACK] Seq=328 Ack=51692 Win=512 Len=28"
172,1.850914,15.235.119.117,100.86.104.173,TCP,1464,25565  >  51527 [ACK] Seq=51692 Ack=328 Win=501 Len=1410
173,1.851237,100.86.104.173,15.235.119.117,TCP,54,51527  >  25565 [ACK] Seq=356 Ack=53102 Win=512 Len=0
174,1.85149,15.235.119.117,100.86.104.173,TCP,1464,"25565  >  51527 [PSH, ACK] Seq=53102 Ack=328 Win=501 Len=1410"
175,1.85149,15.235.119.117,100.86.104.173,TCP,1464,25565  >  51527 [ACK] Seq=54512 Ack=328 Win=501 Len=1410
176,1.851816,100.86.104.173,15.235.119.117,TCP,54,51527  >  25565 [ACK] Seq=356 Ack=55922 Win=512 Len=0
177,1.852559,15.235.119.117,100.86.104.173,TCP,1464,"25565  >  51527 [PSH, ACK] Seq=55922 Ack=328 Win=501 Len=1410"
178,1.852559,15.235.119.117,100.86.104.173,TCP,1464,25565  >  51527 [ACK] Seq=57332 Ack=328 Win=501 Len=1410
179,1.852559,15.235.119.117,100.86.104.173,TCP,1464,"25565  >  51527 [PSH, ACK] Seq=58742 Ack=328 Win=501 Len=1410"
180,1.852559,15.235.119.117,100.86.104.173,TCP,1464,25565  >  51527 [ACK] Seq=60152 Ack=328 Win=501 Len=1410
181,1.852559,15.235.119.117,100.86.104.173,TCP,1464,"25565  >  51527 [PSH, ACK] Seq=61562 Ack=328 Win=501 Len=1410"
182,1.852559,15.235.119.117,100.86.104.173,TCP,1464,25565  >  51527 [ACK] Seq=62972 Ack=328 Win=501 Len=1410
183,1.852559,15.235.119.117,100.86.104.173,TCP,1464,"25565  >  51527 [PSH, ACK] Seq=64382 Ack=328 Win=501 Len=1410"
184,1.852559,15.235.119.117,100.86.104.173,TCP,1464,25565  >  51527 [ACK] Seq=65792 Ack=328 Win=501 Len=1410
185,1.852934,100.86.104.173,15.235.119.117,TCP,54,51527  >  25565 [ACK] Seq=356 Ack=67202 Win=512 Len=0
186,1.854785,15.235.119.117,100.86.104.173,TCP,928,"25565  >  51527 [PSH, ACK] Seq=67202 Ack=328 Win=501 Len=874"
187,1.854785,15.235.119.117,100.86.104.173,TCP,823,"25565  >  51527 [PSH, ACK] Seq=68076 Ack=328 Win=501 Len=769"
188,1.854955,100.86.104.173,15.235.119.117,TCP,54,51527  >  25565 [ACK] Seq=356 Ack=68845 Win=512 Len=0
200,1.899154,100.86.104.173,15.235.119.117,TCP,82,"51527  >  25565 [PSH, ACK] Seq=356 Ack=68845 Win=512 Len=28"
201,1.902903,15.235.119.117,100.86.104.173,TCP,1464,25565  >  51527 [ACK] Seq=68845 Ack=356 Win=501 Len=1410
202,1.903128,100.86.104.173,15.235.119.117,TCP,54,51527  >  25565 [ACK] Seq=384 Ack=70255 Win=512 Len=0
203,1.903287,15.235.119.117,100.86.104.173,TCP,1464,"25565  >  51527 [PSH, ACK] Seq=70255 Ack=356 Win=501 Len=1410"
204,1.903287,15.235.119.117,100.86.104.173,TCP,1464,25565  >  51527 [ACK] Seq=71665 Ack=356 Win=501 Len=1410
205,1.903531,100.86.104.173,15.235.119.117,TCP,54,51527  >  25565 [ACK] Seq=384 Ack=73075 Win=512 Len=0
206,1.9088,15.235.119.117,100.86.104.173,TCP,1464,"25565  >  51527 [PSH, ACK] Seq=73075 Ack=356 Win=501 Len=1410"
207,1.9088,15.235.119.117,100.86.104.173,TCP,1464,25565  >  51527 [ACK] Seq=74485 Ack=356 Win=501 Len=1410
208,1.9088,15.235.119.117,100.86.104.173,TCP,628,"25565  >  51527 [PSH, ACK] Seq=75895 Ack=356 Win=501 Len=574"
209,1.9088,15.235.119.117,100.86.104.173,TCP,1464,25565  >  51527 [ACK] Seq=76469 Ack=356 Win=501 Len=1410
210,1.908975,100.86.104.173,15.235.119.117,TCP,54,51527  >  25565 [ACK] Seq=384 Ack=77879 Win=512 Len=0
211,1.911571,15.235.119.117,100.86.104.173,TCP,1464,"25565  >  51527 [PSH, ACK] Seq=77879 Ack=356 Win=501 Len=1410"
212,1.911571,15.235.119.117,100.86.104.173,TCP,1464,25565  >  51527 [ACK] Seq=79289 Ack=356 Win=501 Len=1410
213,1.911571,15.235.119.117,100.86.104.173,TCP,1464,"25565  >  51527 [PSH, ACK] Seq=80699 Ack=356 Win=501 Len=1410"
214,1.911571,15.235.119.117,100.86.104.173,TCP,1464,25565  >  51527 [ACK] Seq=82109 Ack=356 Win=501 Len=1410
215,1.911571,15.235.119.117,100.86.104.173,TCP,228,"25565  >  51527 [PSH, ACK] Seq=83519 Ack=356 Win=501 Len=174"
216,1.912147,100.86.104.173,15.235.119.117,TCP,54,51527  >  25565 [ACK] Seq=384 Ack=83693 Win=512 Len=0
220,1.942589,100.86.104.173,15.235.119.117,TCP,82,"51527  >  25565 [PSH, ACK] Seq=384 Ack=83693 Win=512 Len=28"
221,1.9573,15.235.119.117,100.86.104.173,TCP,1464,25565  >  51527 [ACK] Seq=83693 Ack=384 Win=501 Len=1410
222,1.9573,15.235.119.117,100.86.104.173,TCP,1437,"25565  >  51527 [PSH, ACK] Seq=85103 Ack=384 Win=501 Len=1383"
223,1.9573,15.235.119.117,100.86.104.173,TCP,1464,25565  >  51527 [ACK] Seq=86486 Ack=384 Win=501 Len=1410
224,1.9573,15.235.119.117,100.86.104.173,TCP,1464,"25565  >  51527 [PSH, ACK] Seq=87896 Ack=384 Win=501 Len=1410"
225,1.9573,15.235.119.117,100.86.104.173,TCP,1464,25565  >  51527 [ACK] Seq=89306 Ack=384 Win=501 Len=1410
226,1.9573,15.235.119.117,100.86.104.173,TCP,1464,"25565  >  51527 [PSH, ACK] Seq=90716 Ack=384 Win=501 Len=1410"
227,1.9573,15.235.119.117,100.86.104.173,TCP,1464,25565  >  51527 [ACK] Seq=92126 Ack=384 Win=501 Len=1410
228,1.9573,15.235.119.117,100.86.104.173,TCP,847,"25565  >  51527 [PSH, ACK] Seq=93536 Ack=384 Win=501 Len=793"
229,1.957983,100.86.104.173,15.235.119.117,TCP,54,51527  >  25565 [ACK] Seq=412 Ack=94329 Win=512 Len=0
230,1.992598,100.86.104.173,15.235.119.117,TCP,82,"51527  >  25565 [PSH, ACK] Seq=412 Ack=94329 Win=512 Len=28"
231,1.999076,15.235.119.117,100.86.104.173,TCP,924,"25565  >  51527 [PSH, ACK] Seq=94329 Ack=412 Win=501 Len=870"
232,2.001983,15.235.119.117,100.86.104.173,TCP,1464,25565  >  51527 [ACK] Seq=95199 Ack=412 Win=501 Len=1410
233,2.002323,100.86.104.173,15.235.119.117,TCP,54,51527  >  25565 [ACK] Seq=440 Ack=96609 Win=512 Len=0
234,2.007661,15.235.119.117,100.86.104.173,TCP,1464,"25565  >  51527 [PSH, ACK] Seq=96609 Ack=412 Win=501 Len=1410"
235,2.007661,15.235.119.117,100.86.104.173,TCP,1464,25565  >  51527 [ACK] Seq=98019 Ack=412 Win=501 Len=1410
236,2.007661,15.235.119.117,100.86.104.173,TCP,1464,"25565  >  51527 [PSH, ACK] Seq=99429 Ack=412 Win=501 Len=1410"
237,2.007661,15.235.119.117,100.86.104.173,TCP,1464,25565  >  51527 [ACK] Seq=100839 Ack=412 Win=501 Len=1410
238,2.007661,15.235.119.117,100.86.104.173,TCP,1464,"25565  >  51527 [PSH, ACK] Seq=102249 Ack=412 Win=501 Len=1410"
239,2.007661,15.235.119.117,100.86.104.173,TCP,1464,25565  >  51527 [ACK] Seq=103659 Ack=412 Win=501 Len=1410
240,2.007661,15.235.119.117,100.86.104.173,TCP,1464,"25565  >  51527 [PSH, ACK] Seq=105069 Ack=412 Win=501 Len=1410"
241,2.007661,15.235.119.117,100.86.104.173,TCP,1464,25565  >  51527 [ACK] Seq=106479 Ack=412 Win=501 Len=1410
242,2.007661,15.235.119.117,100.86.104.173,TCP,1464,"25565  >  51527 [PSH, ACK] Seq=107889 Ack=412 Win=501 Len=1410"
243,2.007661,15.235.119.117,100.86.104.173,TCP,1464,25565  >  51527 [ACK] Seq=109299 Ack=412 Win=501 Len=1410
244,2.007991,100.86.104.173,15.235.119.117,TCP,54,51527  >  25565 [ACK] Seq=440 Ack=110709 Win=512 Len=0
245,2.011286,15.235.119.117,100.86.104.173,TCP,928,"25565  >  51527 [PSH, ACK] Seq=110709 Ack=412 Win=501 Len=874"
246,2.011286,15.235.119.117,100.86.104.173,TCP,1464,25565  >  51527 [ACK] Seq=111583 Ack=412 Win=501 Len=1410
247,2.011375,100.86.104.173,15.235.119.117,TCP,54,51527  >  25565 [ACK] Seq=440 Ack=112993 Win=512 Len=0
248,2.030647,15.235.119.117,100.86.104.173,TCP,1464,25565  >  51527 [ACK] Seq=112993 Ack=440 Win=501 Len=1410
249,2.030647,15.235.119.117,100.86.104.173,TCP,127,"25565  >  51527 [PSH, ACK] Seq=114403 Ack=440 Win=501 Len=73"
250,2.030901,100.86.104.173,15.235.119.117,TCP,54,51527  >  25565 [ACK] Seq=440 Ack=114476 Win=512 Len=0
251,2.042801,100.86.104.173,15.235.119.117,TCP,82,"51527  >  25565 [PSH, ACK] Seq=440 Ack=114476 Win=512 Len=28"
252,2.052079,15.235.119.117,100.86.104.173,TCP,1464,25565  >  51527 [ACK] Seq=114476 Ack=440 Win=501 Len=1410
253,2.052079,15.235.119.117,100.86.104.173,TCP,1464,"25565  >  51527 [PSH, ACK] Seq=115886 Ack=440 Win=501 Len=1410"
254,2.052079,15.235.119.117,100.86.104.173,TCP,1464,25565  >  51527 [ACK] Seq=117296 Ack=440 Win=501 Len=1410
255,2.052079,15.235.119.117,100.86.104.173,TCP,519,"25565  >  51527 [PSH, ACK] Seq=118706 Ack=440 Win=501 Len=465"
256,2.052301,100.86.104.173,15.235.119.117,TCP,54,51527  >  25565 [ACK] Seq=468 Ack=119171 Win=512 Len=0
257,2.096655,100.86.104.173,15.235.119.117,TCP,82,"51527  >  25565 [PSH, ACK] Seq=468 Ack=119171 Win=512 Len=28"
258,2.100291,15.235.119.117,100.86.104.173,TCP,66,"25565  >  51527 [PSH, ACK] Seq=119171 Ack=468 Win=501 Len=12"
259,2.140906,100.86.104.173,15.235.119.117,TCP,54,51527  >  25565 [ACK] Seq=496 Ack=119183 Win=512 Len=0
260,2.14285,100.86.104.173,15.235.119.117,TCP,82,"51527  >  25565 [PSH, ACK] Seq=496 Ack=119183 Win=512 Len=28"
261,2.165351,15.235.119.117,100.86.104.173,TCP,56,25565  >  51527 [ACK] Seq=119183 Ack=496 Win=501 Len=0
262,2.166717,15.235.119.117,100.86.104.173,TCP,56,25565  >  51527 [ACK] Seq=119183 Ack=524 Win=501 Len=0
263,2.175966,100.86.104.173,15.235.119.117,TCP,82,"51527  >  25565 [PSH, ACK] Seq=524 Ack=119183 Win=512 Len=28"
264,2.204764,15.235.119.117,100.86.104.173,TCP,66,"25565  >  51527 [PSH, ACK] Seq=119183 Ack=524 Win=501 Len=12"
265,2.204764,15.235.119.117,100.86.104.173,TCP,56,25565  >  51527 [ACK] Seq=119195 Ack=552 Win=501 Len=0
266,2.22577,100.86.104.173,15.235.119.117,TCP,82,"51527  >  25565 [PSH, ACK] Seq=552 Ack=119195 Win=512 Len=28"
267,2.249384,15.235.119.117,100.86.104.173,TCP,141,"25565  >  51527 [PSH, ACK] Seq=119195 Ack=552 Win=501 Len=87"
268,2.257104,15.235.119.117,100.86.104.173,TCP,56,25565  >  51527 [ACK] Seq=119282 Ack=580 Win=501 Len=0
269,2.27604,100.86.104.173,15.235.119.117,TCP,82,"51527  >  25565 [PSH, ACK] Seq=580 Ack=119282 Win=511 Len=28"
272,2.299117,15.235.119.117,100.86.104.173,TCP,66,"25565  >  51527 [PSH, ACK] Seq=119282 Ack=580 Win=501 Len=12"
273,2.302906,15.235.119.117,100.86.104.173,TCP,56,25565  >  51527 [ACK] Seq=119294 Ack=608 Win=501 Len=0
274,2.326679,100.86.104.173,15.235.119.117,TCP,82,"51527  >  25565 [PSH, ACK] Seq=608 Ack=119294 Win=511 Len=28"
276,2.349192,15.235.119.117,100.86.104.173,TCP,73,"25565  >  51527 [PSH, ACK] Seq=119294 Ack=608 Win=501 Len=19"
277,2.350982,15.235.119.117,100.86.104.173,TCP,56,25565  >  51527 [ACK] Seq=119313 Ack=636 Win=501 Len=0
278,2.375082,100.86.104.173,15.235.119.117,TCP,82,"51527  >  25565 [PSH, ACK] Seq=636 Ack=119313 Win=511 Len=28"
279,2.399479,15.235.119.117,100.86.104.173,TCP,80,"25565  >  51527 [PSH, ACK] Seq=119313 Ack=636 Win=501 Len=26"
280,2.404344,15.235.119.117,100.86.104.173,TCP,56,25565  >  51527 [ACK] Seq=119339 Ack=664 Win=501 Len=0
281,2.425949,100.86.104.173,15.235.119.117,TCP,82,"51527  >  25565 [PSH, ACK] Seq=664 Ack=119339 Win=511 Len=28"
282,2.449943,15.235.119.117,100.86.104.173,TCP,56,25565  >  51527 [ACK] Seq=119339 Ack=692 Win=501 Len=0
283,2.475953,100.86.104.173,15.235.119.117,TCP,82,"51527  >  25565 [PSH, ACK] Seq=692 Ack=119339 Win=511 Len=28"
284,2.499552,15.235.119.117,100.86.104.173,TCP,88,"25565  >  51527 [PSH, ACK] Seq=119339 Ack=692 Win=501 Len=34"
285,2.502452,15.235.119.117,100.86.104.173,TCP,56,25565  >  51527 [ACK] Seq=119373 Ack=720 Win=501 Len=0
286,2.525535,100.86.104.173,15.235.119.117,TCP,82,"51527  >  25565 [PSH, ACK] Seq=720 Ack=119373 Win=511 Len=28"
287,2.551283,15.235.119.117,100.86.104.173,TCP,142,"25565  >  51527 [PSH, ACK] Seq=119373 Ack=720 Win=501 Len=88"
288,2.551283,15.235.119.117,100.86.104.173,TCP,56,25565  >  51527 [ACK] Seq=119461 Ack=748 Win=501 Len=0
289,2.575373,100.86.104.173,15.235.119.117,TCP,82,"51527  >  25565 [PSH, ACK] Seq=748 Ack=119461 Win=511 Len=28"
290,2.602658,15.235.119.117,100.86.104.173,TCP,56,25565  >  51527 [ACK] Seq=119461 Ack=776 Win=501 Len=0
291,2.602658,15.235.119.117,100.86.104.173,TCP,102,"25565  >  51527 [PSH, ACK] Seq=119461 Ack=776 Win=501 Len=48"
292,2.62583,100.86.104.173,15.235.119.117,TCP,82,"51527  >  25565 [PSH, ACK] Seq=776 Ack=119509 Win=510 Len=28"
293,2.651422,15.235.119.117,100.86.104.173,TCP,56,25565  >  51527 [ACK] Seq=119509 Ack=804 Win=501 Len=0
296,2.700097,15.235.119.117,100.86.104.173,TCP,96,"25565  >  51527 [PSH, ACK] Seq=119509 Ack=804 Win=501 Len=42"
298,2.749569,100.86.104.173,15.235.119.117,TCP,54,51527  >  25565 [ACK] Seq=804 Ack=119551 Win=510 Len=0
299,2.799704,15.235.119.117,100.86.104.173,TCP,88,"25565  >  51527 [PSH, ACK] Seq=119551 Ack=804 Win=501 Len=34"
300,2.842744,100.86.104.173,15.235.119.117,TCP,54,51527  >  25565 [ACK] Seq=804 Ack=119585 Win=510 Len=0
301,2.900978,15.235.119.117,100.86.104.173,TCP,74,"25565  >  51527 [PSH, ACK] Seq=119585 Ack=804 Win=501 Len=20"
302,2.952067,15.235.119.117,100.86.104.173,TCP,141,"25565  >  51527 [PSH, ACK] Seq=119605 Ack=804 Win=501 Len=87"
303,2.952269,100.86.104.173,15.235.119.117,TCP,54,51527  >  25565 [ACK] Seq=804 Ack=119692 Win=510 Len=0
304,3.000094,15.235.119.117,100.86.104.173,TCP,74,"25565  >  51527 [PSH, ACK] Seq=119692 Ack=804 Win=501 Len=20"
305,3.045277,100.86.104.173,15.235.119.117,TCP,54,51527  >  25565 [ACK] Seq=804 Ack=119712 Win=510 Len=0
306,3.076475,100.86.104.173,15.235.119.117,TCP,66,"51527  >  25565 [PSH, ACK] Seq=804 Ack=119712 Win=510 Len=12"
307,3.099589,15.235.119.117,100.86.104.173,TCP,74,"25565  >  51527 [PSH, ACK] Seq=119712 Ack=804 Win=501 Len=20"
308,3.100381,15.235.119.117,100.86.104.173,TCP,56,25565  >  51527 [ACK] Seq=119732 Ack=816 Win=501 Len=0
309,3.125523,100.86.104.173,15.235.119.117,TCP,66,"51527  >  25565 [PSH, ACK] Seq=816 Ack=119732 Win=510 Len=12"
310,3.149627,15.235.119.117,100.86.104.173,TCP,56,25565  >  51527 [ACK] Seq=119732 Ack=828 Win=501 Len=0
311,3.176602,100.86.104.173,15.235.119.117,TCP,66,"51527  >  25565 [PSH, ACK] Seq=828 Ack=119732 Win=510 Len=12"
312,3.20098,15.235.119.117,100.86.104.173,TCP,86,"25565  >  51527 [PSH, ACK] Seq=119732 Ack=828 Win=501 Len=32"
313,3.20098,15.235.119.117,100.86.104.173,TCP,56,25565  >  51527 [ACK] Seq=119764 Ack=840 Win=501 Len=0
314,3.225096,100.86.104.173,15.235.119.117,TCP,66,"51527  >  25565 [PSH, ACK] Seq=840 Ack=119764 Win=509 Len=12"
315,3.253244,15.235.119.117,100.86.104.173,TCP,56,25565  >  51527 [ACK] Seq=119764 Ack=852 Win=501 Len=0
316,3.27527,100.86.104.173,15.235.119.117,TCP,66,"51527  >  25565 [PSH, ACK] Seq=852 Ack=119764 Win=509 Len=12"
317,3.29937,15.235.119.117,100.86.104.173,TCP,56,25565  >  51527 [ACK] Seq=119764 Ack=864 Win=501 Len=0
318,3.300049,15.235.119.117,100.86.104.173,TCP,250,"25565  >  51527 [PSH, ACK] Seq=119764 Ack=864 Win=501 Len=196"
319,3.34306,100.86.104.173,15.235.119.117,TCP,54,51527  >  25565 [ACK] Seq=864 Ack=119960 Win=509 Len=0
320,3.350561,15.235.119.117,100.86.104.173,TCP,337,"25565  >  51527 [PSH, ACK] Seq=119960 Ack=864 Win=501 Len=283"
321,3.376481,100.86.104.173,15.235.119.117,TCP,82,"51527  >  25565 [PSH, ACK] Seq=864 Ack=120243 Win=508 Len=28"
322,3.402395,15.235.119.117,100.86.104.173,TCP,166,"25565  >  51527 [PSH, ACK] Seq=120243 Ack=864 Win=501 Len=112"
323,3.425286,100.86.104.173,15.235.119.117,TCP,82,"51527  >  25565 [PSH, ACK] Seq=892 Ack=120355 Win=507 Len=28"
324,3.442431,15.235.119.117,100.86.104.173,TCP,56,25565  >  51527 [ACK] Seq=120355 Ack=892 Win=501 Len=0
325,3.450967,15.235.119.117,100.86.104.173,TCP,56,25565  >  51527 [ACK] Seq=120355 Ack=920 Win=501 Len=0
326,3.47522,100.86.104.173,15.235.119.117,TCP,82,"51527  >  25565 [PSH, ACK] Seq=920 Ack=120355 Win=507 Len=28"
327,3.502903,15.235.119.117,100.86.104.173,TCP,56,25565  >  51527 [ACK] Seq=120355 Ack=948 Win=501 Len=0
328,3.503368,15.235.119.117,100.86.104.173,TCP,66,"25565  >  51527 [PSH, ACK] Seq=120355 Ack=948 Win=501 Len=12"
329,3.525238,100.86.104.173,15.235.119.117,TCP,82,"51527  >  25565 [PSH, ACK] Seq=948 Ack=120367 Win=507 Len=28"
330,3.5493,15.235.119.117,100.86.104.173,TCP,56,25565  >  51527 [ACK] Seq=120367 Ack=976 Win=501 Len=0
331,3.549903,15.235.119.117,100.86.104.173,TCP,75,"25565  >  51527 [PSH, ACK] Seq=120367 Ack=976 Win=501 Len=21"
332,3.551492,15.235.119.117,100.86.104.173,TCP,87,"25565  >  51527 [PSH, ACK] Seq=120388 Ack=976 Win=501 Len=33"
333,3.551591,100.86.104.173,15.235.119.117,TCP,54,51527  >  25565 [ACK] Seq=976 Ack=120421 Win=507 Len=0
334,3.575245,100.86.104.173,15.235.119.117,TCP,82,"51527  >  25565 [PSH, ACK] Seq=976 Ack=120421 Win=507 Len=28"
335,3.599974,15.235.119.117,100.86.104.173,TCP,66,"25565  >  51527 [PSH, ACK] Seq=120421 Ack=976 Win=501 Len=12"
336,3.599974,15.235.119.117,100.86.104.173,TCP,56,25565  >  51527 [ACK] Seq=120433 Ack=1004 Win=501 Len=0
337,3.625567,100.86.104.173,15.235.119.117,TCP,82,"51527  >  25565 [PSH, ACK] Seq=1004 Ack=120433 Win=507 Len=28"
338,3.671716,15.235.119.117,100.86.104.173,TCP,56,25565  >  51527 [ACK] Seq=120433 Ack=1032 Win=501 Len=0
339,3.675693,100.86.104.173,15.235.119.117,TCP,82,"51527  >  25565 [PSH, ACK] Seq=1032 Ack=120433 Win=507 Len=28"
340,3.707964,15.235.119.117,100.86.104.173,TCP,66,"25565  >  51527 [PSH, ACK] Seq=120433 Ack=1032 Win=501 Len=12"
341,3.72515,100.86.104.173,15.235.119.117,TCP,82,"51527  >  25565 [PSH, ACK] Seq=1060 Ack=120445 Win=507 Len=28"
342,3.749858,15.235.119.117,100.86.104.173,TCP,56,25565  >  51527 [ACK] Seq=120445 Ack=1088 Win=501 Len=0
343,3.776062,100.86.104.173,15.235.119.117,TCP,82,"51527  >  25565 [PSH, ACK] Seq=1088 Ack=120445 Win=507 Len=28"
344,3.799547,15.235.119.117,100.86.104.173,TCP,235,"25565  >  51527 [PSH, ACK] Seq=120445 Ack=1088 Win=501 Len=181"
345,3.799651,100.86.104.173,15.235.119.117,TCP,54,51527  >  25565 [ACK] Seq=1116 Ack=120626 Win=512 Len=0
350,3.825895,100.86.104.173,15.235.119.117,TCP,82,"51527  >  25565 [PSH, ACK] Seq=1116 Ack=120626 Win=512 Len=28"
353,3.851117,15.235.119.117,100.86.104.173,TCP,56,25565  >  51527 [ACK] Seq=120626 Ack=1144 Win=501 Len=0
354,3.875099,100.86.104.173,15.235.119.117,TCP,82,"51527  >  25565 [PSH, ACK] Seq=1144 Ack=120626 Win=512 Len=28"
355,3.90007,15.235.119.117,100.86.104.173,TCP,66,"25565  >  51527 [PSH, ACK] Seq=120626 Ack=1172 Win=501 Len=12"
356,3.925325,100.86.104.173,15.235.119.117,TCP,82,"51527  >  25565 [PSH, ACK] Seq=1172 Ack=120638 Win=512 Len=28"
357,3.975804,100.86.104.173,15.235.119.117,TCP,82,"51527  >  25565 [PSH, ACK] Seq=1200 Ack=120638 Win=512 Len=28"
358,3.999506,15.235.119.117,100.86.104.173,TCP,66,"25565  >  51527 [PSH, ACK] Seq=120638 Ack=1200 Win=501 Len=12"
359,4.025242,100.86.104.173,15.235.119.117,TCP,82,"51527  >  25565 [PSH, ACK] Seq=1228 Ack=120650 Win=512 Len=28"
360,4.050208,15.235.119.117,100.86.104.173,TCP,56,25565  >  51527 [ACK] Seq=120650 Ack=1256 Win=501 Len=0
361,4.075885,100.86.104.173,15.235.119.117,TCP,82,"51527  >  25565 [PSH, ACK] Seq=1256 Ack=120650 Win=512 Len=28"
362,4.101227,15.235.119.117,100.86.104.173,TCP,154,"25565  >  51527 [PSH, ACK] Seq=120650 Ack=1256 Win=501 Len=100"
363,4.125794,100.86.104.173,15.235.119.117,TCP,82,"51527  >  25565 [PSH, ACK] Seq=1284 Ack=120750 Win=511 Len=28"
364,4.145445,15.235.119.117,100.86.104.173,TCP,56,25565  >  51527 [ACK] Seq=120750 Ack=1284 Win=501 Len=0
365,4.149452,15.235.119.117,100.86.104.173,TCP,56,25565  >  51527 [ACK] Seq=120750 Ack=1312 Win=501 Len=0
366,4.175814,100.86.104.173,15.235.119.117,TCP,82,"51527  >  25565 [PSH, ACK] Seq=1312 Ack=120750 Win=511 Len=28"
367,4.201739,15.235.119.117,100.86.104.173,TCP,66,"25565  >  51527 [PSH, ACK] Seq=120750 Ack=1312 Win=501 Len=12"
368,4.203473,15.235.119.117,100.86.104.173,TCP,56,25565  >  51527 [ACK] Seq=120762 Ack=1340 Win=501 Len=0
369,4.225273,100.86.104.173,15.235.119.117,TCP,82,"51527  >  25565 [PSH, ACK] Seq=1340 Ack=120762 Win=511 Len=28"
370,4.252035,15.235.119.117,100.86.104.173,TCP,56,25565  >  51527 [ACK] Seq=120762 Ack=1368 Win=501 Len=0
371,4.275687,100.86.104.173,15.235.119.117,TCP,82,"51527  >  25565 [PSH, ACK] Seq=1368 Ack=120762 Win=511 Len=28"
372,4.301135,15.235.119.117,100.86.104.173,TCP,66,"25565  >  51527 [PSH, ACK] Seq=120762 Ack=1368 Win=501 Len=12"
373,4.301135,15.235.119.117,100.86.104.173,TCP,56,25565  >  51527 [ACK] Seq=120774 Ack=1396 Win=501 Len=0
374,4.325814,100.86.104.173,15.235.119.117,TCP,82,"51527  >  25565 [PSH, ACK] Seq=1396 Ack=120774 Win=511 Len=28"
375,4.349464,15.235.119.117,100.86.104.173,TCP,73,"25565  >  51527 [PSH, ACK] Seq=120774 Ack=1396 Win=501 Len=19"
376,4.351617,15.235.119.117,100.86.104.173,TCP,56,25565  >  51527 [ACK] Seq=120793 Ack=1424 Win=501 Len=0
377,4.375869,100.86.104.173,15.235.119.117,TCP,82,"51527  >  25565 [PSH, ACK] Seq=1424 Ack=120793 Win=511 Len=28"
378,4.40054,15.235.119.117,100.86.104.173,TCP,100,"25565  >  51527 [PSH, ACK] Seq=120793 Ack=1424 Win=501 Len=46"
379,4.400644,15.235.119.117,100.86.104.173,TCP,56,25565  >  51527 [ACK] Seq=120839 Ack=1452 Win=501 Len=0
380,4.425235,100.86.104.173,15.235.119.117,TCP,82,"51527  >  25565 [PSH, ACK] Seq=1452 Ack=120839 Win=511 Len=28"
381,4.449316,15.235.119.117,100.86.104.173,TCP,56,25565  >  51527 [ACK] Seq=120839 Ack=1480 Win=501 Len=0
382,4.475254,100.86.104.173,15.235.119.117,TCP,82,"51527  >  25565 [PSH, ACK] Seq=1480 Ack=120839 Win=511 Len=28"
383,4.500369,15.235.119.117,100.86.104.173,TCP,153,"25565  >  51527 [PSH, ACK] Seq=120839 Ack=1480 Win=501 Len=99"
384,4.500961,15.235.119.117,100.86.104.173,TCP,56,25565  >  51527 [ACK] Seq=120938 Ack=1508 Win=501 Len=0
385,4.526486,100.86.104.173,15.235.119.117,TCP,82,"51527  >  25565 [PSH, ACK] Seq=1508 Ack=120938 Win=511 Len=28"
386,4.552091,15.235.119.117,100.86.104.173,TCP,56,25565  >  51527 [ACK] Seq=120938 Ack=1536 Win=501 Len=0
387,4.575306,100.86.104.173,15.235.119.117,TCP,82,"51527  >  25565 [PSH, ACK] Seq=1536 Ack=120938 Win=511 Len=28"
388,4.599725,15.235.119.117,100.86.104.173,TCP,56,25565  >  51527 [ACK] Seq=120938 Ack=1564 Win=501 Len=0
389,4.600081,15.235.119.117,100.86.104.173,TCP,66,"25565  >  51527 [PSH, ACK] Seq=120938 Ack=1564 Win=501 Len=12"
390,4.606867,15.235.119.117,100.86.104.173,TCP,104,"25565  >  51527 [PSH, ACK] Seq=120950 Ack=1564 Win=501 Len=50"
391,4.606951,100.86.104.173,15.235.119.117,TCP,54,51527  >  25565 [ACK] Seq=1564 Ack=121000 Win=510 Len=0
392,4.625723,100.86.104.173,15.235.119.117,TCP,82,"51527  >  25565 [PSH, ACK] Seq=1564 Ack=121000 Win=510 Len=28"
393,4.651123,15.235.119.117,100.86.104.173,TCP,76,"25565  >  51527 [PSH, ACK] Seq=121000 Ack=1564 Win=501 Len=22"
394,4.656386,15.235.119.117,100.86.104.173,TCP,56,25565  >  51527 [ACK] Seq=121022 Ack=1592 Win=501 Len=0
395,4.675449,100.86.104.173,15.235.119.117,TCP,82,"51527  >  25565 [PSH, ACK] Seq=1592 Ack=121022 Win=510 Len=28"
396,4.700184,15.235.119.117,100.86.104.173,TCP,119,"25565  >  51527 [PSH, ACK] Seq=121022 Ack=1592 Win=501 Len=65"
397,4.700706,15.235.119.117,100.86.104.173,TCP,56,25565  >  51527 [ACK] Seq=121087 Ack=1620 Win=501 Len=0
398,4.725281,100.86.104.173,15.235.119.117,TCP,82,"51527  >  25565 [PSH, ACK] Seq=1620 Ack=121087 Win=510 Len=28"
399,4.759448,15.235.119.117,100.86.104.173,TCP,65,"25565  >  51527 [PSH, ACK] Seq=121087 Ack=1620 Win=501 Len=11"
400,4.759448,15.235.119.117,100.86.104.173,TCP,56,25565  >  51527 [ACK] Seq=121098 Ack=1648 Win=501 Len=0
401,4.774986,100.86.104.173,15.235.119.117,TCP,82,"51527  >  25565 [PSH, ACK] Seq=1648 Ack=121098 Win=510 Len=28"
402,4.798845,15.235.119.117,100.86.104.173,TCP,56,25565  >  51527 [ACK] Seq=121098 Ack=1676 Win=501 Len=0
403,4.825729,100.86.104.173,15.235.119.117,TCP,82,"51527  >  25565 [PSH, ACK] Seq=1676 Ack=121098 Win=510 Len=28"
404,4.850966,15.235.119.117,100.86.104.173,TCP,230,"25565  >  51527 [PSH, ACK] Seq=121098 Ack=1676 Win=501 Len=176"
405,4.85382,15.235.119.117,100.86.104.173,TCP,56,25565  >  51527 [ACK] Seq=121274 Ack=1704 Win=501 Len=0
406,4.876213,100.86.104.173,15.235.119.117,TCP,82,"51527  >  25565 [PSH, ACK] Seq=1704 Ack=121274 Win=509 Len=28"
407,4.9015,15.235.119.117,100.86.104.173,TCP,330,"25565  >  51527 [PSH, ACK] Seq=121274 Ack=1704 Win=501 Len=276"
408,4.90845,15.235.119.117,100.86.104.173,TCP,56,25565  >  51527 [ACK] Seq=121550 Ack=1732 Win=501 Len=0
409,4.925938,100.86.104.173,15.235.119.117,TCP,82,"51527  >  25565 [PSH, ACK] Seq=1732 Ack=121550 Win=508 Len=28"
410,4.950179,15.235.119.117,100.86.104.173,TCP,142,"25565  >  51527 [PSH, ACK] Seq=121550 Ack=1732 Win=501 Len=88"
411,4.95347,15.235.119.117,100.86.104.173,TCP,56,25565  >  51527 [ACK] Seq=121638 Ack=1760 Win=501 Len=0
412,4.975094,100.86.104.173,15.235.119.117,TCP,82,"51527  >  25565 [PSH, ACK] Seq=1760 Ack=121638 Win=508 Len=28"
413,5.000109,15.235.119.117,100.86.104.173,TCP,56,25565  >  51527 [ACK] Seq=121638 Ack=1788 Win=501 Len=0
414,5.026618,100.86.104.173,15.235.119.117,TCP,82,"51527  >  25565 [PSH, ACK] Seq=1788 Ack=121638 Win=508 Len=28"
415,5.053944,15.235.119.117,100.86.104.173,TCP,56,25565  >  51527 [ACK] Seq=121638 Ack=1816 Win=501 Len=0
416,5.07514,100.86.104.173,15.235.119.117,TCP,82,"51527  >  25565 [PSH, ACK] Seq=1816 Ack=121638 Win=508 Len=28"
417,5.100254,15.235.119.117,100.86.104.173,TCP,56,25565  >  51527 [ACK] Seq=121638 Ack=1844 Win=501 Len=0
418,5.126019,100.86.104.173,15.235.119.117,TCP,82,"51527  >  25565 [PSH, ACK] Seq=1844 Ack=121638 Win=508 Len=28"
419,5.149826,15.235.119.117,100.86.104.173,TCP,56,25565  >  51527 [ACK] Seq=121638 Ack=1872 Win=501 Len=0
420,5.175614,100.86.104.173,15.235.119.117,TCP,82,"51527  >  25565 [PSH, ACK] Seq=1872 Ack=121638 Win=508 Len=28"
421,5.200621,15.235.119.117,100.86.104.173,TCP,56,25565  >  51527 [ACK] Seq=121638 Ack=1900 Win=501 Len=0
422,5.22495,100.86.104.173,15.235.119.117,TCP,82,"51527  >  25565 [PSH, ACK] Seq=1900 Ack=121638 Win=508 Len=28"
423,5.252174,15.235.119.117,100.86.104.173,TCP,56,25565  >  51527 [ACK] Seq=121638 Ack=1928 Win=501 Len=0
424,5.275382,100.86.104.173,15.235.119.117,TCP,82,"51527  >  25565 [PSH, ACK] Seq=1928 Ack=121638 Win=508 Len=28"
425,5.301336,15.235.119.117,100.86.104.173,TCP,56,25565  >  51527 [ACK] Seq=121638 Ack=1956 Win=501 Len=0
426,5.325254,100.86.104.173,15.235.119.117,TCP,82,"51527  >  25565 [PSH, ACK] Seq=1956 Ack=121638 Win=508 Len=28"
