"No.","Time","Source","Destination","Protocol","Length","Info"
"1","0.000000","104.234.169.167","192.168.0.200","TCP","86","25565  >  50356 [PSH, ACK] Seq=1 Ack=1 Win=501 Len=32"
"2","0.000000","104.234.169.167","192.168.0.200","TCP","295","25565  >  50356 [PSH, ACK] Seq=33 Ack=1 Win=501 Len=241"
"3","0.000000","104.234.169.167","192.168.0.200","TCP","327","25565  >  50356 [PSH, ACK] Seq=274 Ack=1 Win=501 Len=273"
"4","0.000337","104.234.169.167","192.168.0.200","TCP","329","25565  >  50356 [PSH, ACK] Seq=547 Ack=1 Win=501 Len=275"
"5","0.000337","104.234.169.167","192.168.0.200","TCP","330","25565  >  50356 [PSH, ACK] Seq=822 Ack=1 Win=501 Len=276"
"6","0.000411","192.168.0.200","104.234.169.167","TCP","54","50356  >  25565 [ACK] Seq=1 Ack=1098 Win=1022 Len=0"
"7","0.000509","192.168.0.200","104.234.169.167","TCP","54","50356  >  25565 [ACK] Seq=1 Ack=547 Win=1024 Len=0"
"8","0.046075","104.234.169.167","192.168.0.200","TCP","261","25565  >  50356 [PSH, ACK] Seq=1098 Ack=1 Win=501 Len=207"
"9","0.046352","104.234.169.167","192.168.0.200","TCP","295","25565  >  50356 [PSH, ACK] Seq=1305 Ack=1 Win=501 Len=241"
"10","0.046795","104.234.169.167","192.168.0.200","TCP","359","25565  >  50356 [PSH, ACK] Seq=1546 Ack=1 Win=501 Len=305"
"11","0.046795","104.234.169.167","192.168.0.200","TCP","573","25565  >  50356 [PSH, ACK] Seq=1851 Ack=1 Win=501 Len=519"
"12","0.046904","192.168.0.200","104.234.169.167","TCP","54","50356  >  25565 [ACK] Seq=1 Ack=2370 Win=1026 Len=0"
"13","0.047090","192.168.0.200","104.234.169.167","TCP","54","50356  >  25565 [ACK] Seq=1 Ack=1305 Win=1021 Len=0"
"14","0.093906","104.234.169.167","192.168.0.200","TCP","86","25565  >  50356 [PSH, ACK] Seq=2370 Ack=1 Win=501 Len=32"
"15","0.094058","192.168.0.200","104.234.169.167","TCP","54","50356  >  25565 [ACK] Seq=1 Ack=2402 Win=1026 Len=0"
"16","0.097259","104.234.169.167","192.168.0.200","TCP","346","25565  >  50356 [PSH, ACK] Seq=2402 Ack=1 Win=501 Len=292"
"17","0.098244","104.234.169.167","192.168.0.200","TCP","327","25565  >  50356 [PSH, ACK] Seq=2694 Ack=1 Win=501 Len=273"
"18","0.098244","104.234.169.167","192.168.0.200","TCP","573","25565  >  50356 [PSH, ACK] Seq=2967 Ack=1 Win=501 Len=519"
"19","0.098349","192.168.0.200","104.234.169.167","TCP","54","50356  >  25565 [ACK] Seq=1 Ack=3486 Win=1022 Len=0"
"20","0.146945","104.234.169.167","192.168.0.200","TCP","213","25565  >  50356 [PSH, ACK] Seq=3486 Ack=1 Win=501 Len=159"
"21","0.146945","104.234.169.167","192.168.0.200","TCP","327","25565  >  50356 [PSH, ACK] Seq=3645 Ack=1 Win=501 Len=273"
"22","0.147161","104.234.169.167","192.168.0.200","TCP","327","25565  >  50356 [PSH, ACK] Seq=3918 Ack=1 Win=501 Len=273"
"23","0.147161","104.234.169.167","192.168.0.200","TCP","573","25565  >  50356 [PSH, ACK] Seq=4191 Ack=1 Win=501 Len=519"
"24","0.147301","192.168.0.200","104.234.169.167","TCP","54","50356  >  25565 [ACK] Seq=1 Ack=3918 Win=1026 Len=0"
"25","0.147347","192.168.0.200","104.234.169.167","TCP","54","50356  >  25565 [ACK] Seq=1 Ack=4710 Win=1023 Len=0"
"26","0.196555","104.234.169.167","192.168.0.200","TCP","86","25565  >  50356 [PSH, ACK] Seq=4710 Ack=1 Win=501 Len=32"
"27","0.196555","104.234.169.167","192.168.0.200","TCP","295","25565  >  50356 [PSH, ACK] Seq=4742 Ack=1 Win=501 Len=241"
"28","0.196555","104.234.169.167","192.168.0.200","TCP","86","25565  >  50356 [PSH, ACK] Seq=4983 Ack=1 Win=501 Len=32"
"29","0.196555","104.234.169.167","192.168.0.200","TCP","327","25565  >  50356 [PSH, ACK] Seq=5015 Ack=1 Win=501 Len=273"
"30","0.196555","104.234.169.167","192.168.0.200","TCP","329","25565  >  50356 [PSH, ACK] Seq=5288 Ack=1 Win=501 Len=275"
"31","0.196555","104.234.169.167","192.168.0.200","TCP","298","25565  >  50356 [PSH, ACK] Seq=5563 Ack=1 Win=501 Len=244"
"32","0.196687","192.168.0.200","104.234.169.167","TCP","54","50356  >  25565 [ACK] Seq=1 Ack=5807 Win=1026 Len=0"
"33","0.247188","104.234.169.167","192.168.0.200","TCP","231","25565  >  50356 [PSH, ACK] Seq=5807 Ack=1 Win=501 Len=177"
"34","0.247188","104.234.169.167","192.168.0.200","TCP","86","25565  >  50356 [PSH, ACK] Seq=5984 Ack=1 Win=501 Len=32"
"35","0.247188","104.234.169.167","192.168.0.200","TCP","327","25565  >  50356 [PSH, ACK] Seq=6016 Ack=1 Win=501 Len=273"
"36","0.247188","104.234.169.167","192.168.0.200","TCP","327","25565  >  50356 [PSH, ACK] Seq=6289 Ack=1 Win=501 Len=273"
"37","0.247188","104.234.169.167","192.168.0.200","TCP","297","25565  >  50356 [PSH, ACK] Seq=6562 Ack=1 Win=501 Len=243"
"38","0.247188","104.234.169.167","192.168.0.200","TCP","86","25565  >  50356 [PSH, ACK] Seq=6805 Ack=1 Win=501 Len=32"
"39","0.247188","104.234.169.167","192.168.0.200","TCP","298","25565  >  50356 [PSH, ACK] Seq=6837 Ack=1 Win=501 Len=244"
"40","0.247297","192.168.0.200","104.234.169.167","TCP","54","50356  >  25565 [ACK] Seq=1 Ack=7081 Win=1021 Len=0"
"41","0.296083","104.234.169.167","192.168.0.200","TCP","86","25565  >  50356 [PSH, ACK] Seq=7081 Ack=1 Win=501 Len=32"
"42","0.296214","192.168.0.200","104.234.169.167","TCP","54","50356  >  25565 [ACK] Seq=1 Ack=7113 Win=1021 Len=0"
"43","0.301884","104.234.169.167","192.168.0.200","TCP","327","25565  >  50356 [PSH, ACK] Seq=7113 Ack=1 Win=501 Len=273"
"44","0.301884","104.234.169.167","192.168.0.200","TCP","295","25565  >  50356 [PSH, ACK] Seq=7386 Ack=1 Win=501 Len=241"
"45","0.301884","104.234.169.167","192.168.0.200","TCP","86","25565  >  50356 [PSH, ACK] Seq=7627 Ack=1 Win=501 Len=32"
"46","0.301884","104.234.169.167","192.168.0.200","TCP","297","25565  >  50356 [PSH, ACK] Seq=7659 Ack=1 Win=501 Len=243"
"47","0.301983","192.168.0.200","104.234.169.167","TCP","54","50356  >  25565 [ACK] Seq=1 Ack=7902 Win=1026 Len=0"
"48","0.302338","104.234.169.167","192.168.0.200","TCP","86","25565  >  50356 [PSH, ACK] Seq=7902 Ack=1 Win=501 Len=32"
"49","0.302713","104.234.169.167","192.168.0.200","TCP","298","25565  >  50356 [PSH, ACK] Seq=7934 Ack=1 Win=501 Len=244"
"50","0.302755","192.168.0.200","104.234.169.167","TCP","54","50356  >  25565 [ACK] Seq=1 Ack=8178 Win=1025 Len=0"
"51","0.346616","104.234.169.167","192.168.0.200","TCP","263","25565  >  50356 [PSH, ACK] Seq=8178 Ack=1 Win=501 Len=209"
"52","0.346616","104.234.169.167","192.168.0.200","TCP","295","25565  >  50356 [PSH, ACK] Seq=8387 Ack=1 Win=501 Len=241"
"53","0.346706","192.168.0.200","104.234.169.167","TCP","54","50356  >  25565 [ACK] Seq=1 Ack=8628 Win=1023 Len=0"
"54","0.347643","104.234.169.167","192.168.0.200","TCP","86","25565  >  50356 [PSH, ACK] Seq=8628 Ack=1 Win=501 Len=32"
"55","0.347643","104.234.169.167","192.168.0.200","TCP","327","25565  >  50356 [PSH, ACK] Seq=8660 Ack=1 Win=501 Len=273"
"56","0.347705","192.168.0.200","104.234.169.167","TCP","54","50356  >  25565 [ACK] Seq=1 Ack=8933 Win=1022 Len=0"
"57","0.348415","104.234.169.167","192.168.0.200","TCP","573","25565  >  50356 [PSH, ACK] Seq=8933 Ack=1 Win=501 Len=519"
"58","0.392652","192.168.0.200","104.234.169.167","TCP","54","50356  >  25565 [ACK] Seq=1 Ack=9452 Win=1026 Len=0"
"60","0.396118","104.234.169.167","192.168.0.200","TCP","86","25565  >  50356 [PSH, ACK] Seq=9452 Ack=1 Win=501 Len=32"
"61","0.396813","104.234.169.167","192.168.0.200","TCP","327","25565  >  50356 [PSH, ACK] Seq=9484 Ack=1 Win=501 Len=273"
"62","0.396813","104.234.169.167","192.168.0.200","TCP","327","25565  >  50356 [PSH, ACK] Seq=9757 Ack=1 Win=501 Len=273"
"63","0.396813","104.234.169.167","192.168.0.200","TCP","329","25565  >  50356 [PSH, ACK] Seq=10030 Ack=1 Win=501 Len=275"
"64","0.396813","104.234.169.167","192.168.0.200","TCP","298","25565  >  50356 [PSH, ACK] Seq=10305 Ack=1 Win=501 Len=244"
"65","0.396885","192.168.0.200","104.234.169.167","TCP","54","50356  >  25565 [ACK] Seq=1 Ack=10549 Win=1022 Len=0"
"66","0.397032","192.168.0.200","104.234.169.167","TCP","58","50356  >  25565 [PSH, ACK] Seq=1 Ack=10549 Win=1022 Len=4"
"72","0.445978","104.234.169.167","192.168.0.200","TCP","231","25565  >  50356 [PSH, ACK] Seq=10549 Ack=5 Win=501 Len=177"
"73","0.446372","104.234.169.167","192.168.0.200","TCP","86","25565  >  50356 [PSH, ACK] Seq=10726 Ack=5 Win=501 Len=32"
"74","0.446451","192.168.0.200","104.234.169.167","TCP","54","50356  >  25565 [ACK] Seq=5 Ack=10758 Win=1021 Len=0"
"75","0.446844","104.234.169.167","192.168.0.200","TCP","327","25565  >  50356 [PSH, ACK] Seq=10758 Ack=5 Win=501 Len=273"
"76","0.446844","104.234.169.167","192.168.0.200","TCP","327","25565  >  50356 [PSH, ACK] Seq=11031 Ack=5 Win=501 Len=273"
"77","0.446844","104.234.169.167","192.168.0.200","TCP","329","25565  >  50356 [PSH, ACK] Seq=11304 Ack=5 Win=501 Len=275"
"78","0.446873","104.234.169.167","192.168.0.200","TCP","298","25565  >  50356 [PSH, ACK] Seq=11579 Ack=5 Win=501 Len=244"
"79","0.446889","192.168.0.200","104.234.169.167","TCP","54","50356  >  25565 [ACK] Seq=5 Ack=11579 Win=1026 Len=0"
"80","0.446934","192.168.0.200","104.234.169.167","TCP","54","50356  >  25565 [ACK] Seq=5 Ack=11823 Win=1025 Len=0"
"85","0.496594","192.168.0.200","104.234.169.167","TCP","82","50356  >  25565 [PSH, ACK] Seq=5 Ack=11823 Win=1025 Len=28"
"87","0.496677","104.234.169.167","192.168.0.200","TCP","86","25565  >  50356 [PSH, ACK] Seq=11823 Ack=5 Win=501 Len=32"
"88","0.497120","104.234.169.167","192.168.0.200","TCP","327","25565  >  50356 [PSH, ACK] Seq=11855 Ack=5 Win=501 Len=273"
"89","0.497120","104.234.169.167","192.168.0.200","TCP","327","25565  >  50356 [PSH, ACK] Seq=12128 Ack=5 Win=501 Len=273"
"90","0.497120","104.234.169.167","192.168.0.200","TCP","573","25565  >  50356 [PSH, ACK] Seq=12401 Ack=5 Win=501 Len=519"
"91","0.497189","192.168.0.200","104.234.169.167","TCP","54","50356  >  25565 [ACK] Seq=33 Ack=12920 Win=1021 Len=0"
"107","0.547254","104.234.169.167","192.168.0.200","TCP","216","25565  >  50356 [PSH, ACK] Seq=12920 Ack=33 Win=501 Len=162"
"108","0.547701","104.234.169.167","192.168.0.200","TCP","266","25565  >  50356 [PSH, ACK] Seq=13082 Ack=33 Win=501 Len=212"
"109","0.547701","104.234.169.167","192.168.0.200","TCP","217","25565  >  50356 [PSH, ACK] Seq=13294 Ack=33 Win=501 Len=163"
"110","0.547701","104.234.169.167","192.168.0.200","TCP","327","25565  >  50356 [PSH, ACK] Seq=13457 Ack=33 Win=501 Len=273"
"111","0.547701","104.234.169.167","192.168.0.200","TCP","327","25565  >  50356 [PSH, ACK] Seq=13730 Ack=33 Win=501 Len=273"
"112","0.547701","104.234.169.167","192.168.0.200","TCP","573","25565  >  50356 [PSH, ACK] Seq=14003 Ack=33 Win=501 Len=519"
"113","0.547797","192.168.0.200","104.234.169.167","TCP","54","50356  >  25565 [ACK] Seq=33 Ack=14522 Win=1026 Len=0"
"119","0.596107","104.234.169.167","192.168.0.200","TCP","86","25565  >  50356 [PSH, ACK] Seq=14522 Ack=33 Win=501 Len=32"
"120","0.596683","104.234.169.167","192.168.0.200","TCP","875","25565  >  50356 [PSH, ACK] Seq=14554 Ack=33 Win=501 Len=821"
"121","0.596683","104.234.169.167","192.168.0.200","TCP","298","25565  >  50356 [PSH, ACK] Seq=15375 Ack=33 Win=501 Len=244"
"122","0.596801","192.168.0.200","104.234.169.167","TCP","54","50356  >  25565 [ACK] Seq=33 Ack=15619 Win=1022 Len=0"
"123","0.645871","104.234.169.167","192.168.0.200","TCP","263","25565  >  50356 [PSH, ACK] Seq=15619 Ack=33 Win=501 Len=209"
"124","0.646178","104.234.169.167","192.168.0.200","TCP","295","25565  >  50356 [PSH, ACK] Seq=15828 Ack=33 Win=501 Len=241"
"125","0.646178","104.234.169.167","192.168.0.200","TCP","327","25565  >  50356 [PSH, ACK] Seq=16069 Ack=33 Win=501 Len=273"
"126","0.646178","104.234.169.167","192.168.0.200","TCP","361","25565  >  50356 [PSH, ACK] Seq=16342 Ack=33 Win=501 Len=307"
"127","0.646252","192.168.0.200","104.234.169.167","TCP","54","50356  >  25565 [ACK] Seq=33 Ack=16649 Win=1026 Len=0"
"128","0.646580","104.234.169.167","192.168.0.200","TCP","298","25565  >  50356 [PSH, ACK] Seq=16649 Ack=33 Win=501 Len=244"
"129","0.695430","104.234.169.167","192.168.0.200","TCP","86","25565  >  50356 [PSH, ACK] Seq=16893 Ack=33 Win=501 Len=32"
"130","0.695521","192.168.0.200","104.234.169.167","TCP","54","50356  >  25565 [ACK] Seq=33 Ack=16925 Win=1025 Len=0"
"131","0.695956","104.234.169.167","192.168.0.200","TCP","295","25565  >  50356 [PSH, ACK] Seq=16925 Ack=33 Win=501 Len=241"
"132","0.695956","104.234.169.167","192.168.0.200","TCP","327","25565  >  50356 [PSH, ACK] Seq=17166 Ack=33 Win=501 Len=273"
"133","0.695956","104.234.169.167","192.168.0.200","TCP","361","25565  >  50356 [PSH, ACK] Seq=17439 Ack=33 Win=501 Len=307"
"134","0.695956","104.234.169.167","192.168.0.200","TCP","298","25565  >  50356 [PSH, ACK] Seq=17746 Ack=33 Win=501 Len=244"
"135","0.696003","192.168.0.200","104.234.169.167","TCP","54","50356  >  25565 [ACK] Seq=33 Ack=17990 Win=1021 Len=0"
"136","0.746710","104.234.169.167","192.168.0.200","TCP","310","25565  >  50356 [PSH, ACK] Seq=17990 Ack=33 Win=501 Len=256"
"137","0.746710","104.234.169.167","192.168.0.200","TCP","327","25565  >  50356 [PSH, ACK] Seq=18246 Ack=33 Win=501 Len=273"
"138","0.746710","104.234.169.167","192.168.0.200","TCP","327","25565  >  50356 [PSH, ACK] Seq=18519 Ack=33 Win=501 Len=273"
"139","0.746710","104.234.169.167","192.168.0.200","TCP","329","25565  >  50356 [PSH, ACK] Seq=18792 Ack=33 Win=501 Len=275"
"140","0.746710","104.234.169.167","192.168.0.200","TCP","298","25565  >  50356 [PSH, ACK] Seq=19067 Ack=33 Win=501 Len=244"
"141","0.746803","192.168.0.200","104.234.169.167","TCP","54","50356  >  25565 [ACK] Seq=33 Ack=19311 Win=1026 Len=0"
"142","0.793615","192.168.0.200","104.234.169.167","TCP","90","50356  >  25565 [PSH, ACK] Seq=33 Ack=19311 Win=1026 Len=36"
"143","0.796004","104.234.169.167","192.168.0.200","TCP","86","25565  >  50356 [PSH, ACK] Seq=19311 Ack=33 Win=501 Len=32"
"144","0.796288","104.234.169.167","192.168.0.200","TCP","327","25565  >  50356 [PSH, ACK] Seq=19343 Ack=33 Win=501 Len=273"
"145","0.796288","104.234.169.167","192.168.0.200","TCP","327","25565  >  50356 [PSH, ACK] Seq=19616 Ack=33 Win=501 Len=273"
"146","0.796288","104.234.169.167","192.168.0.200","TCP","329","25565  >  50356 [PSH, ACK] Seq=19889 Ack=33 Win=501 Len=275"
"147","0.796343","192.168.0.200","104.234.169.167","TCP","54","50356  >  25565 [ACK] Seq=69 Ack=20164 Win=1023 Len=0"
"148","0.796741","104.234.169.167","192.168.0.200","TCP","298","25565  >  50356 [PSH, ACK] Seq=20164 Ack=33 Win=501 Len=244"
"149","0.838177","192.168.0.200","104.234.169.167","TCP","54","50356  >  25565 [ACK] Seq=69 Ack=20408 Win=1022 Len=0"
"150","0.843181","192.168.0.200","104.234.169.167","TCP","90","50356  >  25565 [PSH, ACK] Seq=69 Ack=20408 Win=1022 Len=36"
"151","0.845999","104.234.169.167","192.168.0.200","TCP","310","25565  >  50356 [PSH, ACK] Seq=20408 Ack=69 Win=501 Len=256"
"152","0.846202","104.234.169.167","192.168.0.200","TCP","295","25565  >  50356 [PSH, ACK] Seq=20664 Ack=69 Win=501 Len=241"
"153","0.846202","104.234.169.167","192.168.0.200","TCP","327","25565  >  50356 [PSH, ACK] Seq=20905 Ack=69 Win=501 Len=273"
"154","0.846265","192.168.0.200","104.234.169.167","TCP","54","50356  >  25565 [ACK] Seq=105 Ack=21178 Win=1026 Len=0"
"155","0.846662","104.234.169.167","192.168.0.200","TCP","329","25565  >  50356 [PSH, ACK] Seq=21178 Ack=69 Win=501 Len=275"
"156","0.846662","104.234.169.167","192.168.0.200","TCP","330","25565  >  50356 [PSH, ACK] Seq=21453 Ack=69 Win=501 Len=276"
"157","0.846709","192.168.0.200","104.234.169.167","TCP","54","50356  >  25565 [ACK] Seq=105 Ack=21729 Win=1024 Len=0"
"160","0.896478","104.234.169.167","192.168.0.200","TCP","86","25565  >  50356 [PSH, ACK] Seq=21729 Ack=105 Win=501 Len=32"
"161","0.896600","192.168.0.200","104.234.169.167","TCP","54","50356  >  25565 [ACK] Seq=105 Ack=21761 Win=1024 Len=0"
"162","0.896989","104.234.169.167","192.168.0.200","TCP","327","25565  >  50356 [PSH, ACK] Seq=21761 Ack=105 Win=501 Len=273"
"163","0.897369","104.234.169.167","192.168.0.200","TCP","327","25565  >  50356 [PSH, ACK] Seq=22034 Ack=105 Win=501 Len=273"
"164","0.897369","104.234.169.167","192.168.0.200","TCP","573","25565  >  50356 [PSH, ACK] Seq=22307 Ack=105 Win=501 Len=519"
"165","0.897426","192.168.0.200","104.234.169.167","TCP","54","50356  >  25565 [ACK] Seq=105 Ack=22826 Win=1026 Len=0"
"166","0.897946","192.168.0.200","104.234.169.167","TCP","90","50356  >  25565 [PSH, ACK] Seq=105 Ack=22826 Win=1026 Len=36"
"167","0.944053","192.168.0.200","104.234.169.167","TCP","90","50356  >  25565 [PSH, ACK] Seq=141 Ack=22826 Win=1026 Len=36"
"168","0.948553","104.234.169.167","192.168.0.200","TCP","261","25565  >  50356 [PSH, ACK] Seq=22826 Ack=141 Win=501 Len=207"
"169","0.949705","104.234.169.167","192.168.0.200","TCP","295","25565  >  50356 [PSH, ACK] Seq=23033 Ack=141 Win=501 Len=241"
"170","0.949705","104.234.169.167","192.168.0.200","TCP","86","25565  >  50356 [PSH, ACK] Seq=23274 Ack=141 Win=501 Len=32"
"171","0.949705","104.234.169.167","192.168.0.200","TCP","327","25565  >  50356 [PSH, ACK] Seq=23306 Ack=141 Win=501 Len=273"
"172","0.949705","104.234.169.167","192.168.0.200","TCP","329","25565  >  50356 [PSH, ACK] Seq=23579 Ack=141 Win=501 Len=275"
"173","0.949705","104.234.169.167","192.168.0.200","TCP","298","25565  >  50356 [PSH, ACK] Seq=23854 Ack=141 Win=501 Len=244"
"174","0.949787","192.168.0.200","104.234.169.167","TCP","54","50356  >  25565 [ACK] Seq=177 Ack=24098 Win=1021 Len=0"
"175","0.996283","192.168.0.200","104.234.169.167","TCP","90","50356  >  25565 [PSH, ACK] Seq=177 Ack=24098 Win=1021 Len=36"
"176","0.996504","104.234.169.167","192.168.0.200","TCP","86","25565  >  50356 [PSH, ACK] Seq=24098 Ack=177 Win=501 Len=32"
"177","0.996821","104.234.169.167","192.168.0.200","TCP","327","25565  >  50356 [PSH, ACK] Seq=24130 Ack=177 Win=501 Len=273"
"178","0.996821","104.234.169.167","192.168.0.200","TCP","327","25565  >  50356 [PSH, ACK] Seq=24403 Ack=177 Win=501 Len=273"
"179","0.996872","192.168.0.200","104.234.169.167","TCP","54","50356  >  25565 [ACK] Seq=213 Ack=24676 Win=1026 Len=0"
"180","0.996902","104.234.169.167","192.168.0.200","TCP","329","25565  >  50356 [PSH, ACK] Seq=24676 Ack=177 Win=501 Len=275"
"181","0.996902","104.234.169.167","192.168.0.200","TCP","298","25565  >  50356 [PSH, ACK] Seq=24951 Ack=177 Win=501 Len=244"
"182","0.996942","192.168.0.200","104.234.169.167","TCP","54","50356  >  25565 [ACK] Seq=213 Ack=25195 Win=1024 Len=0"
"183","1.043732","192.168.0.200","104.234.169.167","TCP","90","50356  >  25565 [PSH, ACK] Seq=213 Ack=25195 Win=1024 Len=36"
"184","1.046154","104.234.169.167","192.168.0.200","TCP","262","25565  >  50356 [PSH, ACK] Seq=25195 Ack=213 Win=501 Len=208"
"185","1.046921","104.234.169.167","192.168.0.200","TCP","86","25565  >  50356 [PSH, ACK] Seq=25403 Ack=213 Win=501 Len=32"
"186","1.047371","192.168.0.200","104.234.169.167","TCP","54","50356  >  25565 [ACK] Seq=249 Ack=25435 Win=1023 Len=0"
"187","1.047453","104.234.169.167","192.168.0.200","TCP","327","25565  >  50356 [PSH, ACK] Seq=25435 Ack=213 Win=501 Len=273"
"188","1.047453","104.234.169.167","192.168.0.200","TCP","327","25565  >  50356 [PSH, ACK] Seq=25708 Ack=213 Win=501 Len=273"
"189","1.047453","104.234.169.167","192.168.0.200","TCP","329","25565  >  50356 [PSH, ACK] Seq=25981 Ack=213 Win=501 Len=275"
"190","1.047453","104.234.169.167","192.168.0.200","TCP","298","25565  >  50356 [PSH, ACK] Seq=26256 Ack=213 Win=501 Len=244"
"191","1.047517","192.168.0.200","104.234.169.167","TCP","54","50356  >  25565 [ACK] Seq=249 Ack=26500 Win=1026 Len=0"
"192","1.093131","104.234.169.167","192.168.0.200","TCP","86","25565  >  50356 [PSH, ACK] Seq=26500 Ack=249 Win=501 Len=32"
"193","1.096492","104.234.169.167","192.168.0.200","TCP","587","25565  >  50356 [PSH, ACK] Seq=26532 Ack=249 Win=501 Len=533"
"194","1.096492","104.234.169.167","192.168.0.200","TCP","361","25565  >  50356 [PSH, ACK] Seq=27065 Ack=249 Win=501 Len=307"
"195","1.096603","192.168.0.200","104.234.169.167","TCP","54","50356  >  25565 [ACK] Seq=249 Ack=27372 Win=1023 Len=0"
"196","1.096954","104.234.169.167","192.168.0.200","TCP","298","25565  >  50356 [PSH, ACK] Seq=27372 Ack=249 Win=501 Len=244"
"197","1.097006","192.168.0.200","104.234.169.167","TCP","54","50356  >  25565 [ACK] Seq=249 Ack=27616 Win=1022 Len=0"
"198","1.098186","192.168.0.200","104.234.169.167","TCP","61","50356  >  25565 [PSH, ACK] Seq=249 Ack=27616 Win=1022 Len=7"
"199","1.098188","192.168.0.200","104.234.169.167","TCP","82","50356  >  25565 [PSH, ACK] Seq=256 Ack=27616 Win=1022 Len=28"
"200","1.116552","104.234.169.167","192.168.0.200","TCP","66","[TCP Dup ACK 192#1] 25565  >  50356 [ACK] Seq=27616 Ack=249 Win=501 Len=0 SLE=256 SRE=284"
"201","1.116552","104.234.169.167","192.168.0.200","TCP","60","25565  >  50356 [ACK] Seq=27616 Ack=284 Win=501 Len=0"
"202","1.116552","104.234.169.167","192.168.0.200","TCP","60","[TCP Dup ACK 201#1] 25565  >  50356 [ACK] Seq=27616 Ack=284 Win=501 Len=0"
"203","1.145768","104.234.169.167","192.168.0.200","TCP","261","25565  >  50356 [PSH, ACK] Seq=27616 Ack=284 Win=501 Len=207"
"204","1.146031","104.234.169.167","192.168.0.200","TCP","295","25565  >  50356 [PSH, ACK] Seq=27823 Ack=284 Win=501 Len=241"
"205","1.146031","104.234.169.167","192.168.0.200","TCP","86","25565  >  50356 [PSH, ACK] Seq=28064 Ack=284 Win=501 Len=32"
"206","1.146031","104.234.169.167","192.168.0.200","TCP","327","25565  >  50356 [PSH, ACK] Seq=28096 Ack=284 Win=501 Len=273"
"207","1.146031","104.234.169.167","192.168.0.200","TCP","297","25565  >  50356 [PSH, ACK] Seq=28369 Ack=284 Win=501 Len=243"
"208","1.146031","104.234.169.167","192.168.0.200","TCP","86","25565  >  50356 [PSH, ACK] Seq=28612 Ack=284 Win=501 Len=32"
"209","1.146113","104.234.169.167","192.168.0.200","TCP","298","25565  >  50356 [PSH, ACK] Seq=28644 Ack=284 Win=501 Len=244"
"210","1.146113","104.234.169.167","192.168.0.200","TCP","142","25565  >  50356 [PSH, ACK] Seq=28888 Ack=284 Win=501 Len=88"
"211","1.146179","192.168.0.200","104.234.169.167","TCP","54","50356  >  25565 [ACK] Seq=284 Ack=28644 Win=1026 Len=0"
"212","1.146180","192.168.0.200","104.234.169.167","TCP","54","50356  >  25565 [ACK] Seq=284 Ack=28976 Win=1025 Len=0"
"213","1.146530","192.168.0.200","104.234.169.167","TCP","82","50356  >  25565 [PSH, ACK] Seq=284 Ack=28976 Win=1025 Len=28"
"214","1.166469","104.234.169.167","192.168.0.200","TCP","65","25565  >  50356 [PSH, ACK] Seq=28976 Ack=312 Win=501 Len=11"
"215","1.166846","104.234.169.167","192.168.0.200","TCP","87","25565  >  50356 [PSH, ACK] Seq=28987 Ack=312 Win=501 Len=33"
"216","1.166846","104.234.169.167","192.168.0.200","TCP","109","25565  >  50356 [PSH, ACK] Seq=29020 Ack=312 Win=501 Len=55"
"217","1.166846","104.234.169.167","192.168.0.200","TCP","109","25565  >  50356 [PSH, ACK] Seq=29075 Ack=312 Win=501 Len=55"
"218","1.166942","192.168.0.200","104.234.169.167","TCP","54","50356  >  25565 [ACK] Seq=312 Ack=29130 Win=1024 Len=0"
"219","1.167439","104.234.169.167","192.168.0.200","TCP","120","25565  >  50356 [PSH, ACK] Seq=29130 Ack=312 Win=501 Len=66"
"220","1.167439","104.234.169.167","192.168.0.200","TCP","100","25565  >  50356 [PSH, ACK] Seq=29196 Ack=312 Win=501 Len=46"
"221","1.167500","192.168.0.200","104.234.169.167","TCP","54","50356  >  25565 [ACK] Seq=312 Ack=29242 Win=1024 Len=0"
"222","1.194905","104.234.169.167","192.168.0.200","TCP","86","25565  >  50356 [PSH, ACK] Seq=29242 Ack=312 Win=501 Len=32"
"223","1.195025","104.234.169.167","192.168.0.200","TCP","327","25565  >  50356 [PSH, ACK] Seq=29274 Ack=312 Win=501 Len=273"
"224","1.195105","192.168.0.200","104.234.169.167","TCP","54","50356  >  25565 [ACK] Seq=312 Ack=29547 Win=1022 Len=0"
"225","1.195345","104.234.169.167","192.168.0.200","TCP","327","25565  >  50356 [PSH, ACK] Seq=29547 Ack=312 Win=501 Len=273"
"226","1.195345","104.234.169.167","192.168.0.200","TCP","573","25565  >  50356 [PSH, ACK] Seq=29820 Ack=312 Win=501 Len=519"
"227","1.195383","192.168.0.200","104.234.169.167","TCP","54","50356  >  25565 [ACK] Seq=312 Ack=30339 Win=1026 Len=0"
"228","1.196940","104.234.169.167","192.168.0.200","TCP","60","25565  >  50356 [PSH, ACK] Seq=30339 Ack=312 Win=501 Len=6"
"229","1.198001","192.168.0.200","104.234.169.167","TCP","82","50356  >  25565 [PSH, ACK] Seq=312 Ack=30345 Win=1026 Len=28"
"230","1.214419","104.234.169.167","192.168.0.200","TCP","66","25565  >  50356 [PSH, ACK] Seq=30345 Ack=340 Win=501 Len=12"
"231","1.246178","192.168.0.200","104.234.169.167","TCP","82","50356  >  25565 [PSH, ACK] Seq=340 Ack=30357 Win=1026 Len=28"
"232","1.247968","104.234.169.167","192.168.0.200","TCP","229","25565  >  50356 [PSH, ACK] Seq=30357 Ack=340 Win=501 Len=175"
"233","1.247968","104.234.169.167","192.168.0.200","TCP","86","25565  >  50356 [PSH, ACK] Seq=30532 Ack=340 Win=501 Len=32"
"234","1.248072","192.168.0.200","104.234.169.167","TCP","54","50356  >  25565 [ACK] Seq=368 Ack=30564 Win=1025 Len=0"
"235","1.250362","104.234.169.167","192.168.0.200","TCP","295","25565  >  50356 [PSH, ACK] Seq=30564 Ack=340 Win=501 Len=241"
"236","1.250362","104.234.169.167","192.168.0.200","TCP","327","25565  >  50356 [PSH, ACK] Seq=30805 Ack=340 Win=501 Len=273"
"237","1.250362","104.234.169.167","192.168.0.200","TCP","329","25565  >  50356 [PSH, ACK] Seq=31078 Ack=340 Win=501 Len=275"
"238","1.250362","104.234.169.167","192.168.0.200","TCP","330","25565  >  50356 [PSH, ACK] Seq=31353 Ack=340 Win=501 Len=276"
"239","1.250536","192.168.0.200","104.234.169.167","TCP","54","50356  >  25565 [ACK] Seq=368 Ack=31629 Win=1021 Len=0"
"240","1.266280","104.234.169.167","192.168.0.200","TCP","66","25565  >  50356 [PSH, ACK] Seq=31629 Ack=368 Win=501 Len=12"
"241","1.293232","104.234.169.167","192.168.0.200","TCP","86","25565  >  50356 [PSH, ACK] Seq=31641 Ack=368 Win=501 Len=32"
"242","1.293340","192.168.0.200","104.234.169.167","TCP","54","50356  >  25565 [ACK] Seq=368 Ack=31673 Win=1021 Len=0"
"243","1.293579","104.234.169.167","192.168.0.200","TCP","407","25565  >  50356 [PSH, ACK] Seq=31673 Ack=368 Win=501 Len=353"
"244","1.293579","104.234.169.167","192.168.0.200","TCP","486","25565  >  50356 [PSH, ACK] Seq=32026 Ack=368 Win=501 Len=432"
"245","1.293630","192.168.0.200","104.234.169.167","TCP","54","50356  >  25565 [ACK] Seq=368 Ack=32458 Win=1026 Len=0"
"246","1.295946","104.234.169.167","192.168.0.200","TCP","409","25565  >  50356 [PSH, ACK] Seq=32458 Ack=368 Win=501 Len=355"
"247","1.295946","104.234.169.167","192.168.0.200","TCP","298","25565  >  50356 [PSH, ACK] Seq=32813 Ack=368 Win=501 Len=244"
"248","1.296044","192.168.0.200","104.234.169.167","TCP","54","50356  >  25565 [ACK] Seq=368 Ack=33057 Win=1024 Len=0"
"249","1.297381","192.168.0.200","104.234.169.167","TCP","82","50356  >  25565 [PSH, ACK] Seq=368 Ack=33057 Win=1024 Len=28"
"250","1.343261","192.168.0.200","104.234.169.167","TCP","90","50356  >  25565 [PSH, ACK] Seq=396 Ack=33057 Win=1024 Len=36"
"251","1.343666","104.234.169.167","192.168.0.200","TCP","261","25565  >  50356 [PSH, ACK] Seq=33057 Ack=396 Win=501 Len=207"
"252","1.344431","104.234.169.167","192.168.0.200","TCP","295","25565  >  50356 [PSH, ACK] Seq=33264 Ack=396 Win=501 Len=241"
"253","1.344431","104.234.169.167","192.168.0.200","TCP","327","25565  >  50356 [PSH, ACK] Seq=33505 Ack=396 Win=501 Len=273"
"254","1.344431","104.234.169.167","192.168.0.200","TCP","329","25565  >  50356 [PSH, ACK] Seq=33778 Ack=396 Win=501 Len=275"
"255","1.344431","104.234.169.167","192.168.0.200","TCP","330","25565  >  50356 [PSH, ACK] Seq=34053 Ack=396 Win=501 Len=276"
"256","1.344732","192.168.0.200","104.234.169.167","TCP","54","50356  >  25565 [ACK] Seq=432 Ack=34329 Win=1026 Len=0"
"257","1.349781","104.234.169.167","192.168.0.200","TCP","378","25565  >  50356 [PSH, ACK] Seq=34329 Ack=396 Win=501 Len=324"
"258","1.349870","192.168.0.200","104.234.169.167","TCP","54","50356  >  25565 [ACK] Seq=432 Ack=34653 Win=1025 Len=0"
"259","1.393294","104.234.169.167","192.168.0.200","TCP","86","25565  >  50356 [PSH, ACK] Seq=34653 Ack=432 Win=501 Len=32"
"260","1.393680","104.234.169.167","192.168.0.200","TCP","295","25565  >  50356 [PSH, ACK] Seq=34685 Ack=432 Win=501 Len=241"
"261","1.393758","192.168.0.200","104.234.169.167","TCP","54","50356  >  25565 [ACK] Seq=432 Ack=34926 Win=1024 Len=0"
"262","1.394075","104.234.169.167","192.168.0.200","TCP","165","25565  >  50356 [PSH, ACK] Seq=34926 Ack=432 Win=501 Len=111"
"263","1.394088","104.234.169.167","192.168.0.200","TCP","649","25565  >  50356 [PSH, ACK] Seq=35037 Ack=432 Win=501 Len=595"
"264","1.394128","192.168.0.200","104.234.169.167","TCP","54","50356  >  25565 [ACK] Seq=432 Ack=35632 Win=1021 Len=0"
"265","1.396220","104.234.169.167","192.168.0.200","TCP","166","25565  >  50356 [PSH, ACK] Seq=35632 Ack=432 Win=501 Len=112"
"266","1.396511","104.234.169.167","192.168.0.200","TCP","298","25565  >  50356 [PSH, ACK] Seq=35744 Ack=432 Win=501 Len=244"
"267","1.396588","192.168.0.200","104.234.169.167","TCP","54","50356  >  25565 [ACK] Seq=432 Ack=35988 Win=1026 Len=0"
"268","1.396743","192.168.0.200","104.234.169.167","TCP","90","50356  >  25565 [PSH, ACK] Seq=432 Ack=35988 Win=1026 Len=36"
"269","1.443452","104.234.169.167","192.168.0.200","TCP","213","25565  >  50356 [PSH, ACK] Seq=35988 Ack=468 Win=501 Len=159"
"270","1.443777","104.234.169.167","192.168.0.200","TCP","1306","25565  >  50356 [PSH, ACK] Seq=36147 Ack=468 Win=501 Len=1252"
"271","1.443862","192.168.0.200","104.234.169.167","TCP","54","50356  >  25565 [ACK] Seq=468 Ack=37399 Win=1021 Len=0"
"272","1.444024","104.234.169.167","192.168.0.200","TCP","165","25565  >  50356 [PSH, ACK] Seq=37399 Ack=468 Win=501 Len=111"
"273","1.444348","104.234.169.167","192.168.0.200","TCP","375","25565  >  50356 [PSH, ACK] Seq=37510 Ack=468 Win=501 Len=321"
"274","1.444391","192.168.0.200","104.234.169.167","TCP","54","50356  >  25565 [ACK] Seq=468 Ack=37831 Win=1026 Len=0"
"275","1.444744","104.234.169.167","192.168.0.200","TCP","605","25565  >  50356 [PSH, ACK] Seq=37831 Ack=468 Win=501 Len=551"
"276","1.446494","104.234.169.167","192.168.0.200","TCP","60","25565  >  50356 [PSH, ACK] Seq=38382 Ack=468 Win=501 Len=6"
"277","1.446579","192.168.0.200","104.234.169.167","TCP","54","50356  >  25565 [ACK] Seq=468 Ack=38388 Win=1024 Len=0"
"278","1.447784","192.168.0.200","104.234.169.167","TCP","90","50356  >  25565 [PSH, ACK] Seq=468 Ack=38388 Win=1024 Len=36"
"279","1.493679","104.234.169.167","192.168.0.200","TCP","86","25565  >  50356 [PSH, ACK] Seq=38388 Ack=504 Win=501 Len=32"
"280","1.494107","104.234.169.167","192.168.0.200","TCP","375","25565  >  50356 [PSH, ACK] Seq=38420 Ack=504 Win=501 Len=321"
"281","1.494107","104.234.169.167","192.168.0.200","TCP","634","25565  >  50356 [PSH, ACK] Seq=38741 Ack=504 Win=501 Len=580"
"282","1.494107","104.234.169.167","192.168.0.200","TCP","298","25565  >  50356 [PSH, ACK] Seq=39321 Ack=504 Win=501 Len=244"
"283","1.494206","192.168.0.200","104.234.169.167","TCP","54","50356  >  25565 [ACK] Seq=504 Ack=39565 Win=1026 Len=0"
"284","1.496173","104.234.169.167","192.168.0.200","TCP","292","25565  >  50356 [PSH, ACK] Seq=39565 Ack=504 Win=501 Len=238"
"285","1.496270","192.168.0.200","104.234.169.167","TCP","90","50356  >  25565 [PSH, ACK] Seq=504 Ack=39565 Win=1026 Len=36"
"286","1.541500","192.168.0.200","104.234.169.167","TCP","54","50356  >  25565 [ACK] Seq=540 Ack=39803 Win=1025 Len=0"
"287","1.544159","104.234.169.167","192.168.0.200","TCP","263","25565  >  50356 [PSH, ACK] Seq=39803 Ack=540 Win=501 Len=209"
"288","1.544356","192.168.0.200","104.234.169.167","TCP","90","50356  >  25565 [PSH, ACK] Seq=540 Ack=40012 Win=1024 Len=36"
"289","1.544664","104.234.169.167","192.168.0.200","TCP","878","25565  >  50356 [PSH, ACK] Seq=40012 Ack=540 Win=501 Len=824"
"290","1.544664","104.234.169.167","192.168.0.200","TCP","165","25565  >  50356 [PSH, ACK] Seq=40836 Ack=540 Win=501 Len=111"
"291","1.544664","104.234.169.167","192.168.0.200","TCP","602","25565  >  50356 [PSH, ACK] Seq=40947 Ack=540 Win=501 Len=548"
"292","1.544713","192.168.0.200","104.234.169.167","TCP","54","50356  >  25565 [ACK] Seq=576 Ack=41495 Win=1026 Len=0"
"293","1.544745","104.234.169.167","192.168.0.200","TCP","298","25565  >  50356 [PSH, ACK] Seq=41495 Ack=540 Win=501 Len=244"
"294","1.544780","192.168.0.200","104.234.169.167","TCP","54","50356  >  25565 [ACK] Seq=576 Ack=41739 Win=1025 Len=0"
"295","1.545804","104.234.169.167","192.168.0.200","TCP","258","25565  >  50356 [PSH, ACK] Seq=41739 Ack=540 Win=501 Len=204"
"296","1.587996","192.168.0.200","104.234.169.167","TCP","54","50356  >  25565 [ACK] Seq=576 Ack=41943 Win=1024 Len=0"
"297","1.593159","104.234.169.167","192.168.0.200","TCP","86","25565  >  50356 [PSH, ACK] Seq=41943 Ack=576 Win=501 Len=32"
"298","1.596033","104.234.169.167","192.168.0.200","TCP","655","25565  >  50356 [PSH, ACK] Seq=41975 Ack=576 Win=501 Len=601"
"299","1.596125","192.168.0.200","104.234.169.167","TCP","54","50356  >  25565 [ACK] Seq=576 Ack=42576 Win=1022 Len=0"
"300","1.596429","104.234.169.167","192.168.0.200","TCP","846","25565  >  50356 [PSH, ACK] Seq=42576 Ack=576 Win=501 Len=792"
"301","1.596992","192.168.0.200","104.234.169.167","TCP","90","50356  >  25565 [PSH, ACK] Seq=576 Ack=43368 Win=1026 Len=36"
"302","1.614168","104.234.169.167","192.168.0.200","TCP","66","25565  >  50356 [PSH, ACK] Seq=43368 Ack=612 Win=501 Len=12"
"303","1.642855","192.168.0.200","104.234.169.167","TCP","90","50356  >  25565 [PSH, ACK] Seq=612 Ack=43380 Win=1026 Len=36"
"304","1.645675","104.234.169.167","192.168.0.200","TCP","263","25565  >  50356 [PSH, ACK] Seq=43380 Ack=612 Win=501 Len=209"
"305","1.646250","104.234.169.167","192.168.0.200","TCP","295","25565  >  50356 [PSH, ACK] Seq=43589 Ack=612 Win=501 Len=241"
"306","1.646250","104.234.169.167","192.168.0.200","TCP","359","25565  >  50356 [PSH, ACK] Seq=43830 Ack=612 Win=501 Len=305"
"307","1.646250","104.234.169.167","192.168.0.200","TCP","573","25565  >  50356 [PSH, ACK] Seq=44135 Ack=612 Win=501 Len=519"
"308","1.646319","192.168.0.200","104.234.169.167","TCP","54","50356  >  25565 [ACK] Seq=648 Ack=44654 Win=1021 Len=0"
"309","1.662279","104.234.169.167","192.168.0.200","TCP","66","25565  >  50356 [PSH, ACK] Seq=44654 Ack=648 Win=501 Len=12"
"311","1.696114","104.234.169.167","192.168.0.200","TCP","86","25565  >  50356 [PSH, ACK] Seq=44666 Ack=648 Win=501 Len=32"
"312","1.696201","192.168.0.200","104.234.169.167","TCP","54","50356  >  25565 [ACK] Seq=648 Ack=44698 Win=1021 Len=0"
"313","1.696369","192.168.0.200","104.234.169.167","TCP","90","50356  >  25565 [PSH, ACK] Seq=648 Ack=44698 Win=1021 Len=36"
"314","1.696496","104.234.169.167","192.168.0.200","TCP","295","25565  >  50356 [PSH, ACK] Seq=44698 Ack=648 Win=501 Len=241"
"315","1.696496","104.234.169.167","192.168.0.200","TCP","86","25565  >  50356 [PSH, ACK] Seq=44939 Ack=648 Win=501 Len=32"
"316","1.696496","104.234.169.167","192.168.0.200","TCP","327","25565  >  50356 [PSH, ACK] Seq=44971 Ack=648 Win=501 Len=273"
"317","1.696496","104.234.169.167","192.168.0.200","TCP","329","25565  >  50356 [PSH, ACK] Seq=45244 Ack=648 Win=501 Len=275"
"318","1.696532","192.168.0.200","104.234.169.167","TCP","54","50356  >  25565 [ACK] Seq=684 Ack=45519 Win=1026 Len=0"
"319","1.696575","104.234.169.167","192.168.0.200","TCP","298","25565  >  50356 [PSH, ACK] Seq=45519 Ack=648 Win=501 Len=244"
"320","1.716257","104.234.169.167","192.168.0.200","TCP","66","25565  >  50356 [PSH, ACK] Seq=45763 Ack=684 Win=501 Len=12"
"321","1.716341","192.168.0.200","104.234.169.167","TCP","54","50356  >  25565 [ACK] Seq=684 Ack=45775 Win=1025 Len=0"
"322","1.746373","104.234.169.167","192.168.0.200","TCP","263","25565  >  50356 [PSH, ACK] Seq=45775 Ack=684 Win=501 Len=209"
"323","1.746709","104.234.169.167","192.168.0.200","TCP","327","25565  >  50356 [PSH, ACK] Seq=45984 Ack=684 Win=501 Len=273"
"324","1.746709","104.234.169.167","192.168.0.200","TCP","327","25565  >  50356 [PSH, ACK] Seq=46257 Ack=684 Win=501 Len=273"
"325","1.746709","104.234.169.167","192.168.0.200","TCP","329","25565  >  50356 [PSH, ACK] Seq=46530 Ack=684 Win=501 Len=275"
"326","1.746709","104.234.169.167","192.168.0.200","TCP","298","25565  >  50356 [PSH, ACK] Seq=46805 Ack=684 Win=501 Len=244"
"327","1.746800","192.168.0.200","104.234.169.167","TCP","54","50356  >  25565 [ACK] Seq=684 Ack=47049 Win=1026 Len=0"
"328","1.749021","192.168.0.200","104.234.169.167","TCP","90","50356  >  25565 [PSH, ACK] Seq=684 Ack=47049 Win=1026 Len=36"
"329","1.772144","104.234.169.167","192.168.0.200","TCP","66","25565  >  50356 [PSH, ACK] Seq=47049 Ack=720 Win=501 Len=12"
"330","1.793477","192.168.0.200","104.234.169.167","TCP","90","50356  >  25565 [PSH, ACK] Seq=720 Ack=47061 Win=1026 Len=36"
"331","1.794287","104.234.169.167","192.168.0.200","TCP","86","25565  >  50356 [PSH, ACK] Seq=47061 Ack=720 Win=501 Len=32"
"332","1.795720","104.234.169.167","192.168.0.200","TCP","295","25565  >  50356 [PSH, ACK] Seq=47093 Ack=720 Win=501 Len=241"
"333","1.795720","104.234.169.167","192.168.0.200","TCP","86","25565  >  50356 [PSH, ACK] Seq=47334 Ack=720 Win=501 Len=32"
"334","1.795720","104.234.169.167","192.168.0.200","TCP","327","25565  >  50356 [PSH, ACK] Seq=47366 Ack=720 Win=501 Len=273"
"335","1.795720","104.234.169.167","192.168.0.200","TCP","329","25565  >  50356 [PSH, ACK] Seq=47639 Ack=720 Win=501 Len=275"
"336","1.795720","104.234.169.167","192.168.0.200","TCP","298","25565  >  50356 [PSH, ACK] Seq=47914 Ack=720 Win=501 Len=244"
"337","1.795805","192.168.0.200","104.234.169.167","TCP","54","50356  >  25565 [ACK] Seq=756 Ack=48158 Win=1022 Len=0"
"338","1.796004","104.234.169.167","192.168.0.200","TCP","60","25565  >  50356 [PSH, ACK] Seq=48158 Ack=720 Win=501 Len=6"
"339","1.816771","104.234.169.167","192.168.0.200","TCP","66","25565  >  50356 [PSH, ACK] Seq=48164 Ack=756 Win=501 Len=12"
"340","1.816871","192.168.0.200","104.234.169.167","TCP","54","50356  >  25565 [ACK] Seq=756 Ack=48176 Win=1022 Len=0"
"341","1.844327","104.234.169.167","192.168.0.200","TCP","298","25565  >  50356 [PSH, ACK] Seq=48176 Ack=756 Win=501 Len=244"
"342","1.844958","104.234.169.167","192.168.0.200","TCP","295","25565  >  50356 [PSH, ACK] Seq=48420 Ack=756 Win=501 Len=241"
"343","1.844958","104.234.169.167","192.168.0.200","TCP","327","25565  >  50356 [PSH, ACK] Seq=48661 Ack=756 Win=501 Len=273"
"344","1.845070","192.168.0.200","104.234.169.167","TCP","54","50356  >  25565 [ACK] Seq=756 Ack=48934 Win=1026 Len=0"
"345","1.846242","104.234.169.167","192.168.0.200","TCP","86","25565  >  50356 [PSH, ACK] Seq=48934 Ack=756 Win=501 Len=32"
"346","1.846242","104.234.169.167","192.168.0.200","TCP","329","25565  >  50356 [PSH, ACK] Seq=48966 Ack=756 Win=501 Len=275"
"347","1.846242","104.234.169.167","192.168.0.200","TCP","298","25565  >  50356 [PSH, ACK] Seq=49241 Ack=756 Win=501 Len=244"
"348","1.846318","192.168.0.200","104.234.169.167","TCP","54","50356  >  25565 [ACK] Seq=756 Ack=49485 Win=1024 Len=0"
"349","1.846891","104.234.169.167","192.168.0.200","TCP","164","25565  >  50356 [PSH, ACK] Seq=49485 Ack=756 Win=501 Len=110"
"350","1.847014","192.168.0.200","104.234.169.167","TCP","82","50356  >  25565 [PSH, ACK] Seq=756 Ack=49595 Win=1023 Len=28"
"351","1.865929","104.234.169.167","192.168.0.200","TCP","66","25565  >  50356 [PSH, ACK] Seq=49595 Ack=784 Win=501 Len=12"
"353","1.894984","192.168.0.200","104.234.169.167","TCP","82","50356  >  25565 [PSH, ACK] Seq=784 Ack=49607 Win=1023 Len=28"
"354","1.895906","104.234.169.167","192.168.0.200","TCP","86","25565  >  50356 [PSH, ACK] Seq=49607 Ack=784 Win=501 Len=32"
"355","1.898035","104.234.169.167","192.168.0.200","TCP","327","25565  >  50356 [PSH, ACK] Seq=49639 Ack=784 Win=501 Len=273"
"356","1.898035","104.234.169.167","192.168.0.200","TCP","295","25565  >  50356 [PSH, ACK] Seq=49912 Ack=784 Win=501 Len=241"
"357","1.898259","192.168.0.200","104.234.169.167","TCP","54","50356  >  25565 [ACK] Seq=812 Ack=50153 Win=1021 Len=0"
"358","1.898889","104.234.169.167","192.168.0.200","TCP","86","25565  >  50356 [PSH, ACK] Seq=50153 Ack=784 Win=501 Len=32"
"359","1.898889","104.234.169.167","192.168.0.200","TCP","297","25565  >  50356 [PSH, ACK] Seq=50185 Ack=784 Win=501 Len=243"
