"No.","Time","Source","Destination","Protocol","Length","Info"
"10","0.951440","192.168.0.200","31.25.11.18","TCP","66","61346  >  25565 [SYN] Seq=0 Win=64240 Len=0 MSS=1460 WS=256 SACK_PERM"
"11","0.970029","31.25.11.18","192.168.0.200","TCP","66","25565  >  61346 [SYN, ACK] Seq=0 Ack=1 Win=42340 Len=0 MSS=1460 SACK_PERM WS=2048"
"12","0.970145","192.168.0.200","31.25.11.18","TCP","54","61346  >  25565 [ACK] Seq=1 Ack=1 Win=262656 Len=0"
"13","0.994769","192.168.0.200","31.25.11.18","TCP","75","61346  >  25565 [PSH, ACK] Seq=1 Ack=1 Win=262656 Len=21"
"14","0.994769","192.168.0.200","31.25.11.18","TCP","83","61346  >  25565 [PSH, ACK] Seq=22 Ack=1 Win=262656 Len=29"
"15","1.018233","31.25.11.18","192.168.0.200","TCP","66","[TCP Window Update] 25565  >  61346 [ACK] Seq=1 Ack=1 Win=43008 Len=0 SLE=22 SRE=51"
"16","1.018292","31.25.11.18","192.168.0.200","TCP","60","25565  >  61346 [ACK] Seq=1 Ack=51 Win=43008 Len=0"
"17","1.019025","31.25.11.18","192.168.0.200","TCP","227","25565  >  61346 [PSH, ACK] Seq=1 Ack=51 Win=43008 Len=173"
"22","1.067752","192.168.0.200","31.25.11.18","TCP","54","61346  >  25565 [ACK] Seq=51 Ack=174 Win=262400 Len=0"
"48","1.216306","192.168.0.200","31.25.11.18","TCP","317","61346  >  25565 [PSH, ACK] Seq=51 Ack=174 Win=262400 Len=263"
"53","1.296000","31.25.11.18","192.168.0.200","TCP","60","25565  >  61346 [ACK] Seq=174 Ack=314 Win=43008 Len=0"
"55","1.349280","31.25.11.18","192.168.0.200","TCP","60","25565  >  61346 [PSH, ACK] Seq=174 Ack=314 Win=43008 Len=4"
"56","1.349838","31.25.11.18","192.168.0.200","TCP","957","25565  >  61346 [PSH, ACK] Seq=178 Ack=314 Win=43008 Len=903"
"57","1.349938","192.168.0.200","31.25.11.18","TCP","54","61346  >  25565 [ACK] Seq=314 Ack=1081 Win=261632 Len=0"
"58","1.350047","192.168.0.200","31.25.11.18","TCP","57","61346  >  25565 [PSH, ACK] Seq=314 Ack=1081 Win=261632 Len=3"
"59","1.350290","192.168.0.200","31.25.11.18","TCP","81","61346  >  25565 [PSH, ACK] Seq=317 Ack=1081 Win=261632 Len=27"
"60","1.350357","192.168.0.200","31.25.11.18","TCP","70","61346  >  25565 [PSH, ACK] Seq=344 Ack=1081 Win=261632 Len=16"
"61","1.369931","31.25.11.18","192.168.0.200","TCP","60","25565  >  61346 [ACK] Seq=1081 Ack=317 Win=43008 Len=0"
"62","1.370254","31.25.11.18","192.168.0.200","TCP","60","25565  >  61346 [ACK] Seq=1081 Ack=344 Win=43008 Len=0"
"63","1.370254","31.25.11.18","192.168.0.200","TCP","60","[TCP Dup ACK 62#1] 25565  >  61346 [ACK] Seq=1081 Ack=344 Win=43008 Len=0"
"64","1.370254","31.25.11.18","192.168.0.200","TCP","60","25565  >  61346 [ACK] Seq=1081 Ack=360 Win=43008 Len=0"
"65","1.424817","31.25.11.18","192.168.0.200","TCP","92","25565  >  61346 [PSH, ACK] Seq=1081 Ack=360 Win=43008 Len=38"
"66","1.425055","31.25.11.18","192.168.0.200","TCP","76","25565  >  61346 [PSH, ACK] Seq=1119 Ack=360 Win=43008 Len=22"
"67","1.425055","31.25.11.18","192.168.0.200","TCP","1514","25565  >  61346 [PSH, ACK] Seq=1141 Ack=360 Win=43008 Len=1460"
"68","1.425055","31.25.11.18","192.168.0.200","TCP","1514","25565  >  61346 [PSH, ACK] Seq=2601 Ack=360 Win=43008 Len=1460"
"69","1.425090","31.25.11.18","192.168.0.200","TCP","1514","25565  >  61346 [ACK] Seq=4061 Ack=360 Win=43008 Len=1460"
"70","1.425090","31.25.11.18","192.168.0.200","TCP","478","25565  >  61346 [PSH, ACK] Seq=5521 Ack=360 Win=43008 Len=424"
"71","1.425090","31.25.11.18","192.168.0.200","TCP","1514","25565  >  61346 [PSH, ACK] Seq=5945 Ack=360 Win=43008 Len=1460"
"72","1.425127","192.168.0.200","31.25.11.18","TCP","54","61346  >  25565 [ACK] Seq=360 Ack=4061 Win=262656 Len=0"
"73","1.425159","192.168.0.200","31.25.11.18","TCP","54","61346  >  25565 [ACK] Seq=360 Ack=7405 Win=262656 Len=0"
"74","1.425391","31.25.11.18","192.168.0.200","TCP","1514","25565  >  61346 [ACK] Seq=7405 Ack=360 Win=43008 Len=1460"
"75","1.425417","31.25.11.18","192.168.0.200","TCP","1514","25565  >  61346 [PSH, ACK] Seq=8865 Ack=360 Win=43008 Len=1460"
"76","1.425455","192.168.0.200","31.25.11.18","TCP","54","61346  >  25565 [ACK] Seq=360 Ack=8865 Win=262656 Len=0"
"77","1.425724","31.25.11.18","192.168.0.200","TCP","1514","25565  >  61346 [PSH, ACK] Seq=10325 Ack=360 Win=43008 Len=1460"
"78","1.425757","192.168.0.200","31.25.11.18","TCP","54","61346  >  25565 [ACK] Seq=360 Ack=11785 Win=262656 Len=0"
"79","1.427490","31.25.11.18","192.168.0.200","TCP","1514","25565  >  61346 [ACK] Seq=11785 Ack=360 Win=43008 Len=1460"
"80","1.429582","31.25.11.18","192.168.0.200","TCP","1337","25565  >  61346 [PSH, ACK] Seq=13245 Ack=360 Win=43008 Len=1283"
"81","1.429699","192.168.0.200","31.25.11.18","TCP","54","61346  >  25565 [ACK] Seq=360 Ack=14528 Win=262656 Len=0"
"82","1.436718","192.168.0.200","31.25.11.18","TCP","57","61346  >  25565 [PSH, ACK] Seq=360 Ack=14528 Win=262656 Len=3"
"83","1.462840","31.25.11.18","192.168.0.200","TCP","60","25565  >  61346 [ACK] Seq=14528 Ack=363 Win=43008 Len=0"
"84","1.468728","31.25.11.18","192.168.0.200","TCP","160","25565  >  61346 [PSH, ACK] Seq=14528 Ack=363 Win=43008 Len=106"
"85","1.468728","31.25.11.18","192.168.0.200","TCP","63","25565  >  61346 [PSH, ACK] Seq=14634 Ack=363 Win=43008 Len=9"
"86","1.468728","31.25.11.18","192.168.0.200","TCP","148","25565  >  61346 [PSH, ACK] Seq=14643 Ack=363 Win=43008 Len=94"
"87","1.468728","31.25.11.18","192.168.0.200","TCP","274","25565  >  61346 [PSH, ACK] Seq=14737 Ack=363 Win=43008 Len=220"
"88","1.468844","192.168.0.200","31.25.11.18","TCP","54","61346  >  25565 [ACK] Seq=363 Ack=14957 Win=262144 Len=0"
"89","1.469440","31.25.11.18","192.168.0.200","TCP","1514","25565  >  61346 [PSH, ACK] Seq=14957 Ack=363 Win=43008 Len=1460"
"90","1.469464","31.25.11.18","192.168.0.200","TCP","1514","25565  >  61346 [ACK] Seq=16417 Ack=363 Win=43008 Len=1460"
"91","1.469464","31.25.11.18","192.168.0.200","TCP","1514","25565  >  61346 [PSH, ACK] Seq=17877 Ack=363 Win=43008 Len=1460"
"92","1.469489","31.25.11.18","192.168.0.200","TCP","1514","25565  >  61346 [ACK] Seq=19337 Ack=363 Win=43008 Len=1460"
"93","1.469489","31.25.11.18","192.168.0.200","TCP","1514","25565  >  61346 [PSH, ACK] Seq=20797 Ack=363 Win=43008 Len=1460"
"94","1.469509","31.25.11.18","192.168.0.200","TCP","1514","25565  >  61346 [ACK] Seq=22257 Ack=363 Win=43008 Len=1460"
"95","1.469509","31.25.11.18","192.168.0.200","TCP","1514","25565  >  61346 [PSH, ACK] Seq=23717 Ack=363 Win=43008 Len=1460"
"96","1.469529","31.25.11.18","192.168.0.200","TCP","1514","25565  >  61346 [ACK] Seq=25177 Ack=363 Win=43008 Len=1460"
"97","1.469531","192.168.0.200","31.25.11.18","TCP","54","61346  >  25565 [ACK] Seq=363 Ack=19337 Win=262656 Len=0"
"98","1.469531","192.168.0.200","31.25.11.18","TCP","54","61346  >  25565 [ACK] Seq=363 Ack=22257 Win=262656 Len=0"
"99","1.469555","192.168.0.200","31.25.11.18","TCP","54","61346  >  25565 [ACK] Seq=363 Ack=25177 Win=262656 Len=0"
"100","1.469572","192.168.0.200","31.25.11.18","TCP","54","61346  >  25565 [ACK] Seq=363 Ack=26637 Win=262656 Len=0"
"101","1.476422","31.25.11.18","192.168.0.200","TCP","1514","25565  >  61346 [PSH, ACK] Seq=26637 Ack=363 Win=43008 Len=1460"
"102","1.481716","31.25.11.18","192.168.0.200","TCP","1514","25565  >  61346 [ACK] Seq=28097 Ack=363 Win=43008 Len=1460"
"103","1.481772","31.25.11.18","192.168.0.200","TCP","1514","25565  >  61346 [PSH, ACK] Seq=29557 Ack=363 Win=43008 Len=1460"
"104","1.481772","31.25.11.18","192.168.0.200","TCP","1514","25565  >  61346 [ACK] Seq=31017 Ack=363 Win=43008 Len=1460"
"105","1.481772","31.25.11.18","192.168.0.200","TCP","1514","25565  >  61346 [PSH, ACK] Seq=32477 Ack=363 Win=43008 Len=1460"
"106","1.481772","31.25.11.18","192.168.0.200","TCP","1514","25565  >  61346 [ACK] Seq=33937 Ack=363 Win=43008 Len=1460"
"107","1.481772","31.25.11.18","192.168.0.200","TCP","1514","25565  >  61346 [PSH, ACK] Seq=35397 Ack=363 Win=43008 Len=1460"
"108","1.481804","192.168.0.200","31.25.11.18","TCP","54","61346  >  25565 [ACK] Seq=363 Ack=29557 Win=262656 Len=0"
"109","1.481805","31.25.11.18","192.168.0.200","TCP","1514","25565  >  61346 [ACK] Seq=36857 Ack=363 Win=43008 Len=1460"
"110","1.481805","31.25.11.18","192.168.0.200","TCP","1514","25565  >  61346 [PSH, ACK] Seq=38317 Ack=363 Win=43008 Len=1460"
"111","1.481805","31.25.11.18","192.168.0.200","TCP","1514","25565  >  61346 [ACK] Seq=39777 Ack=363 Win=43008 Len=1460"
"112","1.481825","192.168.0.200","31.25.11.18","TCP","54","61346  >  25565 [ACK] Seq=363 Ack=36857 Win=262656 Len=0"
"113","1.481825","31.25.11.18","192.168.0.200","TCP","1514","25565  >  61346 [PSH, ACK] Seq=41237 Ack=363 Win=43008 Len=1460"
"114","1.481844","192.168.0.200","31.25.11.18","TCP","54","61346  >  25565 [ACK] Seq=363 Ack=41237 Win=262656 Len=0"
"115","1.482050","31.25.11.18","192.168.0.200","TCP","1514","25565  >  61346 [ACK] Seq=42697 Ack=363 Win=43008 Len=1460"
"116","1.482073","31.25.11.18","192.168.0.200","TCP","1514","25565  >  61346 [PSH, ACK] Seq=44157 Ack=363 Win=43008 Len=1460"
"117","1.482089","192.168.0.200","31.25.11.18","TCP","54","61346  >  25565 [ACK] Seq=363 Ack=44157 Win=262656 Len=0"
"118","1.494316","31.25.11.18","192.168.0.200","TCP","1514","25565  >  61346 [ACK] Seq=45617 Ack=363 Win=43008 Len=1460"
"119","1.494464","192.168.0.200","31.25.11.18","TCP","54","61346  >  25565 [ACK] Seq=363 Ack=47077 Win=262656 Len=0"
"120","1.494548","31.25.11.18","192.168.0.200","TCP","1514","25565  >  61346 [PSH, ACK] Seq=47077 Ack=363 Win=43008 Len=1460"
"121","1.494563","31.25.11.18","192.168.0.200","TCP","1514","25565  >  61346 [ACK] Seq=48537 Ack=363 Win=43008 Len=1460"
"122","1.494583","31.25.11.18","192.168.0.200","TCP","1514","25565  >  61346 [PSH, ACK] Seq=49997 Ack=363 Win=43008 Len=1460"
"123","1.494679","192.168.0.200","31.25.11.18","TCP","54","61346  >  25565 [ACK] Seq=363 Ack=49997 Win=262656 Len=0"
"124","1.495293","31.25.11.18","192.168.0.200","TCP","1514","25565  >  61346 [PSH, ACK] Seq=51457 Ack=363 Win=43008 Len=1460"
"125","1.495339","192.168.0.200","31.25.11.18","TCP","54","61346  >  25565 [ACK] Seq=363 Ack=52917 Win=262656 Len=0"
"126","1.495995","31.25.11.18","192.168.0.200","TCP","1514","25565  >  61346 [ACK] Seq=52917 Ack=363 Win=43008 Len=1460"
"127","1.496799","31.25.11.18","192.168.0.200","TCP","1514","25565  >  61346 [PSH, ACK] Seq=54377 Ack=363 Win=43008 Len=1460"
"128","1.496863","192.168.0.200","31.25.11.18","TCP","54","61346  >  25565 [ACK] Seq=363 Ack=55837 Win=262656 Len=0"
"129","1.498291","31.25.11.18","192.168.0.200","TCP","1514","25565  >  61346 [ACK] Seq=55837 Ack=363 Win=43008 Len=1460"
"130","1.499752","31.25.11.18","192.168.0.200","TCP","1514","25565  >  61346 [PSH, ACK] Seq=57297 Ack=363 Win=43008 Len=1460"
"131","1.499831","192.168.0.200","31.25.11.18","TCP","54","61346  >  25565 [ACK] Seq=363 Ack=58757 Win=262656 Len=0"
"132","1.500047","31.25.11.18","192.168.0.200","TCP","1514","25565  >  61346 [ACK] Seq=58757 Ack=363 Win=43008 Len=1460"
"133","1.500063","31.25.11.18","192.168.0.200","TCP","1514","25565  >  61346 [PSH, ACK] Seq=60217 Ack=363 Win=43008 Len=1460"
"134","1.500123","192.168.0.200","31.25.11.18","TCP","54","61346  >  25565 [ACK] Seq=363 Ack=61677 Win=262656 Len=0"
"135","1.500338","31.25.11.18","192.168.0.200","TCP","1514","25565  >  61346 [ACK] Seq=61677 Ack=363 Win=43008 Len=1460"
"136","1.500671","31.25.11.18","192.168.0.200","TCP","1514","25565  >  61346 [PSH, ACK] Seq=63137 Ack=363 Win=43008 Len=1460"
"137","1.500709","192.168.0.200","31.25.11.18","TCP","54","61346  >  25565 [ACK] Seq=363 Ack=64597 Win=262656 Len=0"
"138","1.502621","31.25.11.18","192.168.0.200","TCP","1514","25565  >  61346 [ACK] Seq=64597 Ack=363 Win=43008 Len=1460"
"139","1.503762","31.25.11.18","192.168.0.200","TCP","1514","25565  >  61346 [PSH, ACK] Seq=66057 Ack=363 Win=43008 Len=1460"
"140","1.503856","192.168.0.200","31.25.11.18","TCP","54","61346  >  25565 [ACK] Seq=363 Ack=67517 Win=262656 Len=0"
"141","1.505093","31.25.11.18","192.168.0.200","TCP","1514","25565  >  61346 [ACK] Seq=67517 Ack=363 Win=43008 Len=1460"
"142","1.505111","31.25.11.18","192.168.0.200","TCP","1514","25565  >  61346 [PSH, ACK] Seq=68977 Ack=363 Win=43008 Len=1460"
"143","1.505173","192.168.0.200","31.25.11.18","TCP","54","61346  >  25565 [ACK] Seq=363 Ack=70437 Win=262656 Len=0"
"144","1.505574","31.25.11.18","192.168.0.200","TCP","1514","25565  >  61346 [ACK] Seq=70437 Ack=363 Win=43008 Len=1460"
"145","1.505589","31.25.11.18","192.168.0.200","TCP","1514","25565  >  61346 [PSH, ACK] Seq=71897 Ack=363 Win=43008 Len=1460"
"146","1.505632","192.168.0.200","31.25.11.18","TCP","54","61346  >  25565 [ACK] Seq=363 Ack=73357 Win=262656 Len=0"
"147","1.506419","31.25.11.18","192.168.0.200","TCP","1514","25565  >  61346 [ACK] Seq=73357 Ack=363 Win=43008 Len=1460"
"148","1.506642","31.25.11.18","192.168.0.200","TCP","1514","25565  >  61346 [PSH, ACK] Seq=74817 Ack=363 Win=43008 Len=1460"
"149","1.506699","192.168.0.200","31.25.11.18","TCP","54","61346  >  25565 [ACK] Seq=363 Ack=76277 Win=262656 Len=0"
"150","1.509106","31.25.11.18","192.168.0.200","TCP","474","25565  >  61346 [PSH, ACK] Seq=76277 Ack=363 Win=43008 Len=420"
"151","1.509139","31.25.11.18","192.168.0.200","TCP","1514","25565  >  61346 [ACK] Seq=76697 Ack=363 Win=43008 Len=1460"
"152","1.509201","192.168.0.200","31.25.11.18","TCP","54","61346  >  25565 [ACK] Seq=363 Ack=78157 Win=262656 Len=0"
"153","1.509378","31.25.11.18","192.168.0.200","TCP","1514","25565  >  61346 [PSH, ACK] Seq=78157 Ack=363 Win=43008 Len=1460"
"154","1.509389","31.25.11.18","192.168.0.200","TCP","1514","25565  >  61346 [ACK] Seq=79617 Ack=363 Win=43008 Len=1460"
"155","1.509406","31.25.11.18","192.168.0.200","TCP","1514","25565  >  61346 [PSH, ACK] Seq=81077 Ack=363 Win=43008 Len=1460"
"156","1.509454","192.168.0.200","31.25.11.18","TCP","54","61346  >  25565 [ACK] Seq=363 Ack=81077 Win=262656 Len=0"
"157","1.510156","31.25.11.18","192.168.0.200","TCP","1514","25565  >  61346 [ACK] Seq=82537 Ack=363 Win=43008 Len=1460"
"158","1.510201","192.168.0.200","31.25.11.18","TCP","54","61346  >  25565 [ACK] Seq=363 Ack=83997 Win=262656 Len=0"
"159","1.511415","31.25.11.18","192.168.0.200","TCP","1514","25565  >  61346 [PSH, ACK] Seq=83997 Ack=363 Win=43008 Len=1460"
"160","1.512455","31.25.11.18","192.168.0.200","TCP","1514","25565  >  61346 [ACK] Seq=85457 Ack=363 Win=43008 Len=1460"
"161","1.512501","31.25.11.18","192.168.0.200","TCP","1514","25565  >  61346 [PSH, ACK] Seq=86917 Ack=363 Win=43008 Len=1460"
"162","1.512531","192.168.0.200","31.25.11.18","TCP","54","61346  >  25565 [ACK] Seq=363 Ack=86917 Win=262656 Len=0"
"163","1.512927","31.25.11.18","192.168.0.200","TCP","804","25565  >  61346 [PSH, ACK] Seq=88377 Ack=363 Win=43008 Len=750"
"164","1.512996","192.168.0.200","31.25.11.18","TCP","54","61346  >  25565 [ACK] Seq=363 Ack=89127 Win=262656 Len=0"
"165","1.517515","31.25.11.18","192.168.0.200","TCP","1514","25565  >  61346 [ACK] Seq=89127 Ack=363 Win=43008 Len=1460"
"166","1.517854","31.25.11.18","192.168.0.200","TCP","1514","25565  >  61346 [PSH, ACK] Seq=90587 Ack=363 Win=43008 Len=1460"
"167","1.517882","31.25.11.18","192.168.0.200","TCP","1514","25565  >  61346 [ACK] Seq=92047 Ack=363 Win=43008 Len=1460"
"168","1.517882","31.25.11.18","192.168.0.200","TCP","1514","25565  >  61346 [PSH, ACK] Seq=93507 Ack=363 Win=43008 Len=1460"
"169","1.517900","31.25.11.18","192.168.0.200","TCP","1514","25565  >  61346 [ACK] Seq=94967 Ack=363 Win=43008 Len=1460"
"170","1.517900","31.25.11.18","192.168.0.200","TCP","1514","25565  >  61346 [PSH, ACK] Seq=96427 Ack=363 Win=43008 Len=1460"
"171","1.517913","192.168.0.200","31.25.11.18","TCP","54","61346  >  25565 [ACK] Seq=363 Ack=92047 Win=262656 Len=0"
"172","1.517914","31.25.11.18","192.168.0.200","TCP","782","25565  >  61346 [PSH, ACK] Seq=97887 Ack=363 Win=43008 Len=728"
"173","1.517921","31.25.11.18","192.168.0.200","TCP","1514","25565  >  61346 [ACK] Seq=98615 Ack=363 Win=43008 Len=1460"
"174","1.517933","31.25.11.18","192.168.0.200","TCP","1514","25565  >  61346 [PSH, ACK] Seq=100075 Ack=363 Win=43008 Len=1460"
"175","1.517941","192.168.0.200","31.25.11.18","TCP","54","61346  >  25565 [ACK] Seq=363 Ack=94967 Win=262656 Len=0"
"176","1.517954","192.168.0.200","31.25.11.18","TCP","54","61346  >  25565 [ACK] Seq=363 Ack=100075 Win=262656 Len=0"
"177","1.517963","192.168.0.200","31.25.11.18","TCP","54","61346  >  25565 [ACK] Seq=363 Ack=97887 Win=262656 Len=0"
"178","1.518401","31.25.11.18","192.168.0.200","TCP","1514","25565  >  61346 [ACK] Seq=101535 Ack=363 Win=43008 Len=1460"
"179","1.518446","192.168.0.200","31.25.11.18","TCP","54","61346  >  25565 [ACK] Seq=363 Ack=102995 Win=262656 Len=0"
"180","1.518653","31.25.11.18","192.168.0.200","TCP","1514","25565  >  61346 [PSH, ACK] Seq=102995 Ack=363 Win=43008 Len=1460"
"181","1.519793","31.25.11.18","192.168.0.200","TCP","1197","25565  >  61346 [PSH, ACK] Seq=104455 Ack=363 Win=43008 Len=1143"
"182","1.519878","192.168.0.200","31.25.11.18","TCP","54","61346  >  25565 [ACK] Seq=363 Ack=105598 Win=262656 Len=0"
"183","1.520149","31.25.11.18","192.168.0.200","TCP","1514","25565  >  61346 [ACK] Seq=105598 Ack=363 Win=43008 Len=1460"
"184","1.520686","31.25.11.18","192.168.0.200","TCP","1514","25565  >  61346 [PSH, ACK] Seq=107058 Ack=363 Win=43008 Len=1460"
"185","1.520726","192.168.0.200","31.25.11.18","TCP","54","61346  >  25565 [ACK] Seq=363 Ack=108518 Win=262656 Len=0"
"186","1.521322","31.25.11.18","192.168.0.200","TCP","1514","25565  >  61346 [ACK] Seq=108518 Ack=363 Win=43008 Len=1460"
"187","1.522352","31.25.11.18","192.168.0.200","TCP","1514","25565  >  61346 [PSH, ACK] Seq=109978 Ack=363 Win=43008 Len=1460"
"188","1.522380","31.25.11.18","192.168.0.200","TCP","1514","25565  >  61346 [ACK] Seq=111438 Ack=363 Win=43008 Len=1460"
"189","1.522428","192.168.0.200","31.25.11.18","TCP","54","61346  >  25565 [ACK] Seq=363 Ack=111438 Win=262656 Len=0"
"190","1.522645","31.25.11.18","192.168.0.200","TCP","1514","25565  >  61346 [PSH, ACK] Seq=112898 Ack=363 Win=43008 Len=1460"
"191","1.522666","31.25.11.18","192.168.0.200","TCP","1514","25565  >  61346 [ACK] Seq=114358 Ack=363 Win=43008 Len=1460"
"192","1.522666","31.25.11.18","192.168.0.200","TCP","1460","25565  >  61346 [PSH, ACK] Seq=115818 Ack=363 Win=43008 Len=1406"
"193","1.522681","192.168.0.200","31.25.11.18","TCP","54","61346  >  25565 [ACK] Seq=363 Ack=114358 Win=262656 Len=0"
"194","1.522707","192.168.0.200","31.25.11.18","TCP","54","61346  >  25565 [ACK] Seq=363 Ack=117224 Win=262656 Len=0"
"195","1.523082","31.25.11.18","192.168.0.200","TCP","1514","25565  >  61346 [ACK] Seq=117224 Ack=363 Win=43008 Len=1460"
"196","1.523082","31.25.11.18","192.168.0.200","TCP","777","25565  >  61346 [PSH, ACK] Seq=118684 Ack=363 Win=43008 Len=723"
"197","1.523117","192.168.0.200","31.25.11.18","TCP","54","61346  >  25565 [ACK] Seq=363 Ack=119407 Win=262656 Len=0"
"198","1.527581","31.25.11.18","192.168.0.200","TCP","1514","25565  >  61346 [ACK] Seq=119407 Ack=363 Win=43008 Len=1460"
"199","1.527581","31.25.11.18","192.168.0.200","TCP","822","25565  >  61346 [PSH, ACK] Seq=120867 Ack=363 Win=43008 Len=768"
"200","1.527671","192.168.0.200","31.25.11.18","TCP","54","61346  >  25565 [ACK] Seq=363 Ack=121635 Win=262656 Len=0"
"201","1.527979","31.25.11.18","192.168.0.200","TCP","1514","25565  >  61346 [ACK] Seq=121635 Ack=363 Win=43008 Len=1460"
"202","1.527979","31.25.11.18","192.168.0.200","TCP","893","25565  >  61346 [PSH, ACK] Seq=123095 Ack=363 Win=43008 Len=839"
"203","1.528018","31.25.11.18","192.168.0.200","TCP","1514","25565  >  61346 [ACK] Seq=123934 Ack=363 Win=43008 Len=1460"
"204","1.528018","31.25.11.18","192.168.0.200","TCP","559","25565  >  61346 [PSH, ACK] Seq=125394 Ack=363 Win=43008 Len=505"
"205","1.528037","31.25.11.18","192.168.0.200","TCP","1514","25565  >  61346 [ACK] Seq=125899 Ack=363 Win=43008 Len=1460"
"206","1.528037","31.25.11.18","192.168.0.200","TCP","248","25565  >  61346 [PSH, ACK] Seq=127359 Ack=363 Win=43008 Len=194"
"207","1.528041","192.168.0.200","31.25.11.18","TCP","54","61346  >  25565 [ACK] Seq=363 Ack=123934 Win=262656 Len=0"
"208","1.528052","31.25.11.18","192.168.0.200","TCP","1514","25565  >  61346 [ACK] Seq=127553 Ack=363 Win=43008 Len=1460"
"209","1.528052","31.25.11.18","192.168.0.200","TCP","343","25565  >  61346 [PSH, ACK] Seq=129013 Ack=363 Win=43008 Len=289"
"210","1.528057","192.168.0.200","31.25.11.18","TCP","54","61346  >  25565 [ACK] Seq=363 Ack=125899 Win=262656 Len=0"
"211","1.528066","31.25.11.18","192.168.0.200","TCP","1514","25565  >  61346 [ACK] Seq=129302 Ack=363 Win=43008 Len=1460"
"212","1.528066","31.25.11.18","192.168.0.200","TCP","670","25565  >  61346 [PSH, ACK] Seq=130762 Ack=363 Win=43008 Len=616"
"213","1.528069","192.168.0.200","31.25.11.18","TCP","54","61346  >  25565 [ACK] Seq=363 Ack=127553 Win=262656 Len=0"
"214","1.528082","31.25.11.18","192.168.0.200","TCP","1260","25565  >  61346 [PSH, ACK] Seq=131378 Ack=363 Win=43008 Len=1206"
"215","1.528084","192.168.0.200","31.25.11.18","TCP","54","61346  >  25565 [ACK] Seq=363 Ack=129302 Win=262656 Len=0"
"216","1.528092","31.25.11.18","192.168.0.200","TCP","1514","25565  >  61346 [ACK] Seq=132584 Ack=363 Win=43008 Len=1460"
"217","1.528092","31.25.11.18","192.168.0.200","TCP","512","25565  >  61346 [PSH, ACK] Seq=134044 Ack=363 Win=43008 Len=458"
"218","1.528100","192.168.0.200","31.25.11.18","TCP","54","61346  >  25565 [ACK] Seq=363 Ack=131378 Win=262656 Len=0"
"219","1.528146","192.168.0.200","31.25.11.18","TCP","54","61346  >  25565 [ACK] Seq=363 Ack=134502 Win=262656 Len=0"
"220","1.528357","31.25.11.18","192.168.0.200","TCP","859","25565  >  61346 [PSH, ACK] Seq=134502 Ack=363 Win=43008 Len=805"
"221","1.528388","192.168.0.200","31.25.11.18","TCP","54","61346  >  25565 [ACK] Seq=363 Ack=135307 Win=261888 Len=0"
"222","1.569832","31.25.11.18","192.168.0.200","TCP","372","25565  >  61346 [PSH, ACK] Seq=135307 Ack=363 Win=43008 Len=318"
"223","1.570453","31.25.11.18","192.168.0.200","TCP","406","25565  >  61346 [PSH, ACK] Seq=135625 Ack=363 Win=43008 Len=352"
"224","1.570537","192.168.0.200","31.25.11.18","TCP","54","61346  >  25565 [ACK] Seq=363 Ack=135977 Win=262656 Len=0"
"225","1.571015","31.25.11.18","192.168.0.200","TCP","154","25565  >  61346 [PSH, ACK] Seq=135977 Ack=363 Win=43008 Len=100"
"226","1.571015","31.25.11.18","192.168.0.200","TCP","99","25565  >  61346 [PSH, ACK] Seq=136077 Ack=363 Win=43008 Len=45"
"227","1.571015","31.25.11.18","192.168.0.200","TCP","150","25565  >  61346 [PSH, ACK] Seq=136122 Ack=363 Win=43008 Len=96"
"228","1.571015","31.25.11.18","192.168.0.200","TCP","200","25565  >  61346 [PSH, ACK] Seq=136218 Ack=363 Win=43008 Len=146"
"229","1.571015","31.25.11.18","192.168.0.200","TCP","406","25565  >  61346 [PSH, ACK] Seq=136364 Ack=363 Win=43008 Len=352"
"230","1.571015","31.25.11.18","192.168.0.200","TCP","110","25565  >  61346 [PSH, ACK] Seq=136716 Ack=363 Win=43008 Len=56"
"231","1.571077","192.168.0.200","31.25.11.18","TCP","54","61346  >  25565 [ACK] Seq=363 Ack=136772 Win=261888 Len=0"
"232","1.571580","31.25.11.18","192.168.0.200","TCP","195","25565  >  61346 [PSH, ACK] Seq=136772 Ack=363 Win=43008 Len=141"
"233","1.571580","31.25.11.18","192.168.0.200","TCP","166","25565  >  61346 [PSH, ACK] Seq=136913 Ack=363 Win=43008 Len=112"
"234","1.571580","31.25.11.18","192.168.0.200","TCP","110","25565  >  61346 [PSH, ACK] Seq=137025 Ack=363 Win=43008 Len=56"
"235","1.571580","31.25.11.18","192.168.0.200","TCP","154","25565  >  61346 [PSH, ACK] Seq=137081 Ack=363 Win=43008 Len=100"
"236","1.571647","192.168.0.200","31.25.11.18","TCP","54","61346  >  25565 [ACK] Seq=363 Ack=137181 Win=261376 Len=0"
"237","1.572170","31.25.11.18","192.168.0.200","TCP","241","25565  >  61346 [PSH, ACK] Seq=137181 Ack=363 Win=43008 Len=187"
"238","1.572170","31.25.11.18","192.168.0.200","TCP","368","25565  >  61346 [PSH, ACK] Seq=137368 Ack=363 Win=43008 Len=314"
"239","1.572170","31.25.11.18","192.168.0.200","TCP","378","25565  >  61346 [PSH, ACK] Seq=137682 Ack=363 Win=43008 Len=324"
"240","1.572202","31.25.11.18","192.168.0.200","TCP","431","25565  >  61346 [PSH, ACK] Seq=138006 Ack=363 Win=43008 Len=377"
"241","1.572216","31.25.11.18","192.168.0.200","TCP","239","25565  >  61346 [PSH, ACK] Seq=138383 Ack=363 Win=43008 Len=185"
"242","1.572216","31.25.11.18","192.168.0.200","TCP","110","25565  >  61346 [PSH, ACK] Seq=138568 Ack=363 Win=43008 Len=56"
"243","1.572216","31.25.11.18","192.168.0.200","TCP","267","25565  >  61346 [PSH, ACK] Seq=138624 Ack=363 Win=43008 Len=213"
"244","1.572226","192.168.0.200","31.25.11.18","TCP","54","61346  >  25565 [ACK] Seq=363 Ack=138006 Win=262656 Len=0"
"245","1.572234","31.25.11.18","192.168.0.200","TCP","414","25565  >  61346 [PSH, ACK] Seq=138837 Ack=363 Win=43008 Len=360"
"246","1.572234","31.25.11.18","192.168.0.200","TCP","154","25565  >  61346 [PSH, ACK] Seq=139197 Ack=363 Win=43008 Len=100"
"247","1.572235","192.168.0.200","31.25.11.18","TCP","54","61346  >  25565 [ACK] Seq=363 Ack=138383 Win=262400 Len=0"
"248","1.572234","31.25.11.18","192.168.0.200","TCP","241","25565  >  61346 [PSH, ACK] Seq=139297 Ack=363 Win=43008 Len=187"
"249","1.572234","31.25.11.18","192.168.0.200","TCP","255","25565  >  61346 [PSH, ACK] Seq=139484 Ack=363 Win=43008 Len=201"
"250","1.572234","31.25.11.18","192.168.0.200","TCP","194","25565  >  61346 [PSH, ACK] Seq=139685 Ack=363 Win=43008 Len=140"
"251","1.572251","192.168.0.200","31.25.11.18","TCP","54","61346  >  25565 [ACK] Seq=363 Ack=138837 Win=261888 Len=0"
"252","1.572256","31.25.11.18","192.168.0.200","TCP","189","25565  >  61346 [PSH, ACK] Seq=139825 Ack=363 Win=43008 Len=135"
"253","1.572256","31.25.11.18","192.168.0.200","TCP","110","25565  >  61346 [PSH, ACK] Seq=139960 Ack=363 Win=43008 Len=56"
"254","1.572256","31.25.11.18","192.168.0.200","TCP","166","25565  >  61346 [PSH, ACK] Seq=140016 Ack=363 Win=43008 Len=112"
"255","1.572256","31.25.11.18","192.168.0.200","TCP","423","25565  >  61346 [PSH, ACK] Seq=140128 Ack=363 Win=43008 Len=369"
"256","1.572265","192.168.0.200","31.25.11.18","TCP","54","61346  >  25565 [ACK] Seq=363 Ack=139825 Win=262656 Len=0"
"257","1.572282","192.168.0.200","31.25.11.18","TCP","54","61346  >  25565 [ACK] Seq=363 Ack=140497 Win=261888 Len=0"
"258","1.572338","31.25.11.18","192.168.0.200","TCP","335","25565  >  61346 [PSH, ACK] Seq=140497 Ack=363 Win=43008 Len=281"
"259","1.572338","31.25.11.18","192.168.0.200","TCP","384","25565  >  61346 [PSH, ACK] Seq=140778 Ack=363 Win=43008 Len=330"
"260","1.572338","31.25.11.18","192.168.0.200","TCP","406","25565  >  61346 [PSH, ACK] Seq=141108 Ack=363 Win=43008 Len=352"
"261","1.572338","31.25.11.18","192.168.0.200","TCP","98","25565  >  61346 [PSH, ACK] Seq=141460 Ack=363 Win=43008 Len=44"
"262","1.572363","192.168.0.200","31.25.11.18","TCP","54","61346  >  25565 [ACK] Seq=363 Ack=141504 Win=262656 Len=0"
"263","1.573047","31.25.11.18","192.168.0.200","TCP","142","25565  >  61346 [PSH, ACK] Seq=141504 Ack=363 Win=43008 Len=88"
"264","1.573047","31.25.11.18","192.168.0.200","TCP","195","25565  >  61346 [PSH, ACK] Seq=141592 Ack=363 Win=43008 Len=141"
"265","1.573047","31.25.11.18","192.168.0.200","TCP","294","25565  >  61346 [PSH, ACK] Seq=141733 Ack=363 Win=43008 Len=240"
"266","1.573047","31.25.11.18","192.168.0.200","TCP","336","25565  >  61346 [PSH, ACK] Seq=141973 Ack=363 Win=43008 Len=282"
"267","1.573073","31.25.11.18","192.168.0.200","TCP","410","25565  >  61346 [PSH, ACK] Seq=142255 Ack=363 Win=43008 Len=356"
"268","1.573073","31.25.11.18","192.168.0.200","TCP","208","25565  >  61346 [PSH, ACK] Seq=142611 Ack=363 Win=43008 Len=154"
"269","1.573073","31.25.11.18","192.168.0.200","TCP","154","25565  >  61346 [PSH, ACK] Seq=142765 Ack=363 Win=43008 Len=100"
"270","1.573073","31.25.11.18","192.168.0.200","TCP","314","25565  >  61346 [PSH, ACK] Seq=142865 Ack=363 Win=43008 Len=260"
"271","1.573088","192.168.0.200","31.25.11.18","TCP","54","61346  >  25565 [ACK] Seq=363 Ack=142255 Win=261888 Len=0"
"272","1.573100","192.168.0.200","31.25.11.18","TCP","54","61346  >  25565 [ACK] Seq=363 Ack=143125 Win=262656 Len=0"
"273","1.573112","31.25.11.18","192.168.0.200","TCP","322","25565  >  61346 [PSH, ACK] Seq=143125 Ack=363 Win=43008 Len=268"
"274","1.573112","31.25.11.18","192.168.0.200","TCP","330","25565  >  61346 [PSH, ACK] Seq=143393 Ack=363 Win=43008 Len=276"
"275","1.573112","31.25.11.18","192.168.0.200","TCP","210","25565  >  61346 [PSH, ACK] Seq=143669 Ack=363 Win=43008 Len=156"
"276","1.573130","31.25.11.18","192.168.0.200","TCP","227","25565  >  61346 [PSH, ACK] Seq=143825 Ack=363 Win=43008 Len=173"
"277","1.573130","31.25.11.18","192.168.0.200","TCP","206","25565  >  61346 [PSH, ACK] Seq=143998 Ack=363 Win=43008 Len=152"
"278","1.573130","31.25.11.18","192.168.0.200","TCP","222","25565  >  61346 [PSH, ACK] Seq=144150 Ack=363 Win=43008 Len=168"
"279","1.573130","31.25.11.18","192.168.0.200","TCP","98","25565  >  61346 [PSH, ACK] Seq=144318 Ack=363 Win=43008 Len=44"
"280","1.573130","31.25.11.18","192.168.0.200","TCP","334","25565  >  61346 [PSH, ACK] Seq=144362 Ack=363 Win=43008 Len=280"
"281","1.573134","192.168.0.200","31.25.11.18","TCP","54","61346  >  25565 [ACK] Seq=363 Ack=143825 Win=261888 Len=0"
"282","1.573154","192.168.0.200","31.25.11.18","TCP","54","61346  >  25565 [ACK] Seq=363 Ack=144642 Win=262656 Len=0"
"283","1.573158","31.25.11.18","192.168.0.200","TCP","323","25565  >  61346 [PSH, ACK] Seq=144642 Ack=363 Win=43008 Len=269"
"284","1.573158","31.25.11.18","192.168.0.200","TCP","142","25565  >  61346 [PSH, ACK] Seq=144911 Ack=363 Win=43008 Len=88"
"285","1.573158","31.25.11.18","192.168.0.200","TCP","296","25565  >  61346 [PSH, ACK] Seq=144999 Ack=363 Win=43008 Len=242"
"286","1.573173","31.25.11.18","192.168.0.200","TCP","406","25565  >  61346 [PSH, ACK] Seq=145241 Ack=363 Win=43008 Len=352"
"287","1.573181","192.168.0.200","31.25.11.18","TCP","54","61346  >  25565 [ACK] Seq=363 Ack=145241 Win=262144 Len=0"
"288","1.573192","31.25.11.18","192.168.0.200","TCP","292","25565  >  61346 [PSH, ACK] Seq=145593 Ack=363 Win=43008 Len=238"
"289","1.573192","31.25.11.18","192.168.0.200","TCP","279","25565  >  61346 [PSH, ACK] Seq=145831 Ack=363 Win=43008 Len=225"
"290","1.573204","192.168.0.200","31.25.11.18","TCP","54","61346  >  25565 [ACK] Seq=363 Ack=145593 Win=261632 Len=0"
"291","1.573212","192.168.0.200","31.25.11.18","TCP","54","61346  >  25565 [ACK] Seq=363 Ack=146056 Win=261376 Len=0"
"292","1.573668","31.25.11.18","192.168.0.200","TCP","1514","25565  >  61346 [PSH, ACK] Seq=146056 Ack=363 Win=43008 Len=1460"
"293","1.574037","31.25.11.18","192.168.0.200","TCP","1514","25565  >  61346 [ACK] Seq=147516 Ack=363 Win=43008 Len=1460"
"294","1.574068","31.25.11.18","192.168.0.200","TCP","1514","25565  >  61346 [PSH, ACK] Seq=148976 Ack=363 Win=43008 Len=1460"
"295","1.574095","192.168.0.200","31.25.11.18","TCP","54","61346  >  25565 [ACK] Seq=363 Ack=148976 Win=262656 Len=0"
"296","1.574781","31.25.11.18","192.168.0.200","TCP","1514","25565  >  61346 [ACK] Seq=150436 Ack=363 Win=43008 Len=1460"
"297","1.574809","31.25.11.18","192.168.0.200","TCP","1514","25565  >  61346 [ACK] Seq=151896 Ack=363 Win=43008 Len=1460"
"298","1.574809","31.25.11.18","192.168.0.200","TCP","1514","25565  >  61346 [ACK] Seq=153356 Ack=363 Win=43008 Len=1460"
"299","1.574826","192.168.0.200","31.25.11.18","TCP","54","61346  >  25565 [ACK] Seq=363 Ack=151896 Win=262656 Len=0"
"300","1.574846","192.168.0.200","31.25.11.18","TCP","54","61346  >  25565 [ACK] Seq=363 Ack=154816 Win=262656 Len=0"
"301","1.575174","31.25.11.18","192.168.0.200","TCP","1514","25565  >  61346 [PSH, ACK] Seq=154816 Ack=363 Win=43008 Len=1460"
"302","1.575203","31.25.11.18","192.168.0.200","TCP","1514","25565  >  61346 [ACK] Seq=156276 Ack=363 Win=43008 Len=1460"
"303","1.575203","31.25.11.18","192.168.0.200","TCP","258","25565  >  61346 [PSH, ACK] Seq=157736 Ack=363 Win=43008 Len=204"
"304","1.575232","192.168.0.200","31.25.11.18","TCP","54","61346  >  25565 [ACK] Seq=363 Ack=157940 Win=262656 Len=0"
"305","1.622086","31.25.11.18","192.168.0.200","TCP","1514","25565  >  61346 [PSH, ACK] Seq=157940 Ack=363 Win=43008 Len=1460"
"306","1.623710","31.25.11.18","192.168.0.200","TCP","1514","25565  >  61346 [ACK] Seq=159400 Ack=363 Win=43008 Len=1460"
"307","1.623805","192.168.0.200","31.25.11.18","TCP","54","61346  >  25565 [ACK] Seq=363 Ack=160860 Win=262656 Len=0"
"308","1.625144","31.25.11.18","192.168.0.200","TCP","1514","25565  >  61346 [PSH, ACK] Seq=160860 Ack=363 Win=43008 Len=1460"
"309","1.625176","31.25.11.18","192.168.0.200","TCP","1514","25565  >  61346 [ACK] Seq=162320 Ack=363 Win=43008 Len=1460"
"310","1.625176","31.25.11.18","192.168.0.200","TCP","1514","25565  >  61346 [ACK] Seq=163780 Ack=363 Win=43008 Len=1460"
"311","1.625176","31.25.11.18","192.168.0.200","TCP","1514","25565  >  61346 [ACK] Seq=165240 Ack=363 Win=43008 Len=1460"
"312","1.625213","31.25.11.18","192.168.0.200","TCP","1514","25565  >  61346 [PSH, ACK] Seq=166700 Ack=363 Win=43008 Len=1460"
"313","1.625213","31.25.11.18","192.168.0.200","TCP","1514","25565  >  61346 [ACK] Seq=168160 Ack=363 Win=43008 Len=1460"
"314","1.625213","31.25.11.18","192.168.0.200","TCP","1514","25565  >  61346 [ACK] Seq=169620 Ack=363 Win=43008 Len=1460"
"315","1.625240","31.25.11.18","192.168.0.200","TCP","1514","25565  >  61346 [ACK] Seq=171080 Ack=363 Win=43008 Len=1460"
"316","1.625240","31.25.11.18","192.168.0.200","TCP","1514","25565  >  61346 [ACK] Seq=172540 Ack=363 Win=43008 Len=1460"
"317","1.625246","192.168.0.200","31.25.11.18","TCP","54","61346  >  25565 [ACK] Seq=363 Ack=166700 Win=262656 Len=0"
"318","1.625256","192.168.0.200","31.25.11.18","TCP","54","61346  >  25565 [ACK] Seq=363 Ack=171080 Win=262656 Len=0"
"319","1.625257","31.25.11.18","192.168.0.200","TCP","1514","25565  >  61346 [ACK] Seq=174000 Ack=363 Win=43008 Len=1460"
"320","1.625257","31.25.11.18","192.168.0.200","TCP","1514","25565  >  61346 [ACK] Seq=175460 Ack=363 Win=43008 Len=1460"
"321","1.625273","31.25.11.18","192.168.0.200","TCP","1146","25565  >  61346 [PSH, ACK] Seq=176920 Ack=363 Win=43008 Len=1092"
"322","1.625276","192.168.0.200","31.25.11.18","TCP","54","61346  >  25565 [ACK] Seq=363 Ack=174000 Win=262656 Len=0"
"323","1.625292","192.168.0.200","31.25.11.18","TCP","54","61346  >  25565 [ACK] Seq=363 Ack=176920 Win=262656 Len=0"
"324","1.625324","192.168.0.200","31.25.11.18","TCP","54","61346  >  25565 [ACK] Seq=363 Ack=178012 Win=261632 Len=0"
"325","1.671144","31.25.11.18","192.168.0.200","TCP","70","25565  >  61346 [PSH, ACK] Seq=178012 Ack=363 Win=43008 Len=16"
"326","1.672860","31.25.11.18","192.168.0.200","TCP","1514","25565  >  61346 [PSH, ACK] Seq=178028 Ack=363 Win=43008 Len=1460"
"327","1.672912","31.25.11.18","192.168.0.200","TCP","1514","25565  >  61346 [ACK] Seq=179488 Ack=363 Win=43008 Len=1460"
"328","1.672945","192.168.0.200","31.25.11.18","TCP","54","61346  >  25565 [ACK] Seq=363 Ack=179488 Win=262656 Len=0"
"329","1.673255","31.25.11.18","192.168.0.200","TCP","1514","25565  >  61346 [PSH, ACK] Seq=180948 Ack=363 Win=43008 Len=1460"
"330","1.673280","31.25.11.18","192.168.0.200","TCP","1514","25565  >  61346 [ACK] Seq=182408 Ack=363 Win=43008 Len=1460"
"331","1.673280","31.25.11.18","192.168.0.200","TCP","1514","25565  >  61346 [ACK] Seq=183868 Ack=363 Win=43008 Len=1460"
"332","1.673297","31.25.11.18","192.168.0.200","TCP","1514","25565  >  61346 [ACK] Seq=185328 Ack=363 Win=43008 Len=1460"
"333","1.673302","192.168.0.200","31.25.11.18","TCP","54","61346  >  25565 [ACK] Seq=363 Ack=182408 Win=262656 Len=0"
"334","1.673304","31.25.11.18","192.168.0.200","TCP","1514","25565  >  61346 [PSH, ACK] Seq=186788 Ack=363 Win=43008 Len=1460"
"335","1.673317","192.168.0.200","31.25.11.18","TCP","54","61346  >  25565 [ACK] Seq=363 Ack=185328 Win=262656 Len=0"
"336","1.673316","31.25.11.18","192.168.0.200","TCP","1514","25565  >  61346 [ACK] Seq=188248 Ack=363 Win=43008 Len=1460"
"337","1.673325","31.25.11.18","192.168.0.200","TCP","1514","25565  >  61346 [ACK] Seq=189708 Ack=363 Win=43008 Len=1460"
"338","1.673337","31.25.11.18","192.168.0.200","TCP","1514","25565  >  61346 [ACK] Seq=191168 Ack=363 Win=43008 Len=1460"
"339","1.673347","192.168.0.200","31.25.11.18","TCP","54","61346  >  25565 [ACK] Seq=363 Ack=191168 Win=262656 Len=0"
"340","1.673350","31.25.11.18","192.168.0.200","TCP","1512","25565  >  61346 [PSH, ACK] Seq=192628 Ack=363 Win=43008 Len=1458"
"341","1.673380","192.168.0.200","31.25.11.18","TCP","54","61346  >  25565 [ACK] Seq=363 Ack=194086 Win=262656 Len=0"
"342","1.673421","192.168.0.200","31.25.11.18","TCP","54","61346  >  25565 [ACK] Seq=363 Ack=188248 Win=262656 Len=0"
"343","1.721423","31.25.11.18","192.168.0.200","TCP","1514","25565  >  61346 [PSH, ACK] Seq=194086 Ack=363 Win=43008 Len=1460"
"344","1.722878","31.25.11.18","192.168.0.200","TCP","1514","25565  >  61346 [ACK] Seq=195546 Ack=363 Win=43008 Len=1460"
"345","1.722916","31.25.11.18","192.168.0.200","TCP","1514","25565  >  61346 [PSH, ACK] Seq=197006 Ack=363 Win=43008 Len=1460"
"346","1.722916","31.25.11.18","192.168.0.200","TCP","1514","25565  >  61346 [ACK] Seq=198466 Ack=363 Win=43008 Len=1460"
"347","1.722916","31.25.11.18","192.168.0.200","TCP","1514","25565  >  61346 [ACK] Seq=199926 Ack=363 Win=43008 Len=1460"
"348","1.722938","31.25.11.18","192.168.0.200","TCP","1514","25565  >  61346 [ACK] Seq=201386 Ack=363 Win=43008 Len=1460"
"349","1.722938","31.25.11.18","192.168.0.200","TCP","1514","25565  >  61346 [PSH, ACK] Seq=202846 Ack=363 Win=43008 Len=1460"
"350","1.722948","192.168.0.200","31.25.11.18","TCP","54","61346  >  25565 [ACK] Seq=363 Ack=197006 Win=262656 Len=0"
"351","1.722959","192.168.0.200","31.25.11.18","TCP","54","61346  >  25565 [ACK] Seq=363 Ack=201386 Win=262656 Len=0"
"352","1.723010","192.168.0.200","31.25.11.18","TCP","54","61346  >  25565 [ACK] Seq=363 Ack=204306 Win=262656 Len=0"
"353","1.723912","31.25.11.18","192.168.0.200","TCP","258","25565  >  61346 [PSH, ACK] Seq=204306 Ack=363 Win=43008 Len=204"
"354","1.724106","192.168.0.200","31.25.11.18","TCP","54","61346  >  25565 [ACK] Seq=363 Ack=204510 Win=262400 Len=0"
"355","1.770164","31.25.11.18","192.168.0.200","TCP","61","25565  >  61346 [PSH, ACK] Seq=204510 Ack=363 Win=43008 Len=7"
"356","1.774492","31.25.11.18","192.168.0.200","TCP","1514","25565  >  61346 [PSH, ACK] Seq=204517 Ack=363 Win=43008 Len=1460"
"357","1.774579","192.168.0.200","31.25.11.18","TCP","54","61346  >  25565 [ACK] Seq=363 Ack=205977 Win=262656 Len=0"
"358","1.775389","31.25.11.18","192.168.0.200","TCP","1514","25565  >  61346 [PSH, ACK] Seq=205977 Ack=363 Win=43008 Len=1460"
"359","1.775403","31.25.11.18","192.168.0.200","TCP","1514","25565  >  61346 [ACK] Seq=207437 Ack=363 Win=43008 Len=1460"
"360","1.775420","31.25.11.18","192.168.0.200","TCP","1514","25565  >  61346 [PSH, ACK] Seq=208897 Ack=363 Win=43008 Len=1460"
"361","1.775420","31.25.11.18","192.168.0.200","TCP","1514","25565  >  61346 [ACK] Seq=210357 Ack=363 Win=43008 Len=1460"
"362","1.775436","31.25.11.18","192.168.0.200","TCP","1514","25565  >  61346 [ACK] Seq=211817 Ack=363 Win=43008 Len=1460"
"363","1.775442","192.168.0.200","31.25.11.18","TCP","54","61346  >  25565 [ACK] Seq=363 Ack=208897 Win=262656 Len=0"
"364","1.775448","31.25.11.18","192.168.0.200","TCP","1514","25565  >  61346 [ACK] Seq=213277 Ack=363 Win=43008 Len=1460"
"365","1.775455","192.168.0.200","31.25.11.18","TCP","54","61346  >  25565 [ACK] Seq=363 Ack=211817 Win=262656 Len=0"
"366","1.775466","31.25.11.18","192.168.0.200","TCP","1514","25565  >  61346 [PSH, ACK] Seq=214737 Ack=363 Win=43008 Len=1460"
"367","1.775475","192.168.0.200","31.25.11.18","TCP","54","61346  >  25565 [ACK] Seq=363 Ack=214737 Win=262656 Len=0"
"368","1.775475","31.25.11.18","192.168.0.200","TCP","1514","25565  >  61346 [ACK] Seq=216197 Ack=363 Win=43008 Len=1460"
"369","1.775475","31.25.11.18","192.168.0.200","TCP","786","25565  >  61346 [PSH, ACK] Seq=217657 Ack=363 Win=43008 Len=732"
"370","1.775500","192.168.0.200","31.25.11.18","TCP","54","61346  >  25565 [ACK] Seq=363 Ack=218389 Win=262656 Len=0"
