"No.","Time","Source","Destination","Protocol","Length","Info"
"1","0.000000","100.86.7.137","3.225.92.8","TCP","55","64956  >  443 [ACK] Seq=1 Ack=1 Win=513 Len=1 [TCP segment of a reassembled PDU]"
"2","0.011381","3.225.92.8","100.86.7.137","TCP","66","443  >  64956 [ACK] Seq=1 Ack=2 Win=68 Len=0 SLE=1 SRE=2"
"3","1.893820","100.86.7.137","54.160.93.182","TCP","55","64997  >  443 [ACK] Seq=1 Ack=1 Win=513 Len=1 [TCP segment of a reassembled PDU]"
"4","1.906613","54.160.93.182","100.86.7.137","TCP","66","443  >  64997 [ACK] Seq=1 Ack=2 Win=69 Len=0 SLE=1 SRE=2"
"5","1.984018","100.86.7.137","54.160.93.182","TCP","55","64998  >  443 [ACK] Seq=1 Ack=1 Win=513 Len=1 [TCP segment of a reassembled PDU]"
"6","1.993969","54.160.93.182","100.86.7.137","TCP","66","443  >  64998 [ACK] Seq=1 Ack=2 Win=68 Len=0 SLE=1 SRE=2"
"7","4.262548","100.86.7.137","54.160.93.182","TLSv1.2","146","Application Data"
"8","4.348016","54.160.93.182","100.86.7.137","TCP","56","443  >  65136 [ACK] Seq=1 Ack=93 Win=1050 Len=0"
"9","5.523896","54.160.93.182","100.86.7.137","TLSv1.2","267","Application Data"
"10","5.524475","54.160.93.182","100.86.7.137","TCP","1514","443  >  65136 [ACK] Seq=214 Ack=93 Win=1050 Len=1460 [TCP segment of a reassembled PDU]"
"11","5.524526","100.86.7.137","54.160.93.182","TCP","54","65136  >  443 [ACK] Seq=93 Ack=1674 Win=1026 Len=0"
"12","5.525518","54.160.93.182","100.86.7.137","TCP","4434","443  >  65136 [ACK] Seq=1674 Ack=93 Win=1050 Len=4380 [TCP segment of a reassembled PDU]"
"13","5.525518","54.160.93.182","100.86.7.137","TLSv1.2","412","Application Data"
"14","5.525518","54.160.93.182","100.86.7.137","TCP","2974","443  >  65136 [ACK] Seq=6412 Ack=93 Win=1050 Len=2920 [TCP segment of a reassembled PDU]"
"15","5.525638","100.86.7.137","54.160.93.182","TCP","54","65136  >  443 [ACK] Seq=93 Ack=9332 Win=1026 Len=0"
"16","5.526858","54.160.93.182","100.86.7.137","TLSv1.2","550","Application Data"
"17","5.526858","54.160.93.182","100.86.7.137","TCP","1514","443  >  65136 [ACK] Seq=9828 Ack=93 Win=1050 Len=1460 [TCP segment of a reassembled PDU]"
"18","5.526858","54.160.93.182","100.86.7.137","TCP","1514","443  >  65136 [ACK] Seq=11288 Ack=93 Win=1050 Len=1460 [TCP segment of a reassembled PDU]"
"19","5.526858","54.160.93.182","100.86.7.137","TLSv1.2","123","Application Data"
"20","5.526967","100.86.7.137","54.160.93.182","TCP","54","65136  >  443 [ACK] Seq=93 Ack=12817 Win=1026 Len=0"
"21","5.530047","54.160.93.182","100.86.7.137","TCP","1514","443  >  65136 [ACK] Seq=12817 Ack=93 Win=1050 Len=1460 [TCP segment of a reassembled PDU]"
"22","5.530047","54.160.93.182","100.86.7.137","TCP","1514","443  >  65136 [ACK] Seq=14277 Ack=93 Win=1050 Len=1460 [TCP segment of a reassembled PDU]"
"23","5.530047","54.160.93.182","100.86.7.137","TLSv1.2","857","Application Data"
"24","5.530047","54.160.93.182","100.86.7.137","TLSv1.2","1223","Application Data"
"25","5.530193","100.86.7.137","54.160.93.182","TCP","54","65136  >  443 [ACK] Seq=93 Ack=17709 Win=1026 Len=0"
"26","5.530772","54.160.93.182","100.86.7.137","TCP","2974","443  >  65136 [ACK] Seq=17709 Ack=93 Win=1050 Len=2920 [TCP segment of a reassembled PDU]"
"27","5.530772","54.160.93.182","100.86.7.137","TLSv1.2","550","Application Data"
"28","5.530772","54.160.93.182","100.86.7.137","TCP","1514","443  >  65136 [ACK] Seq=21125 Ack=93 Win=1050 Len=1460 [TCP segment of a reassembled PDU]"
"29","5.530772","54.160.93.182","100.86.7.137","TLSv1.2","1287","Application Data"
"30","5.530881","100.86.7.137","54.160.93.182","TCP","54","65136  >  443 [ACK] Seq=93 Ack=23818 Win=1026 Len=0"
"31","5.534055","100.86.7.137","54.160.93.182","TLSv1.2","89","Application Data"
"32","5.535870","54.160.93.182","100.86.7.137","TCP","4434","443  >  65136 [ACK] Seq=23818 Ack=93 Win=1050 Len=4380 [TCP segment of a reassembled PDU]"
"33","5.535870","54.160.93.182","100.86.7.137","TLSv1.2","329","Application Data"
"34","5.535870","54.160.93.182","100.86.7.137","TCP","1514","443  >  65136 [ACK] Seq=28473 Ack=93 Win=1050 Len=1460 [TCP segment of a reassembled PDU]"
"35","5.536014","100.86.7.137","54.160.93.182","TCP","54","65136  >  443 [ACK] Seq=128 Ack=29933 Win=1026 Len=0"
"36","5.537805","54.160.93.182","100.86.7.137","TCP","1514","443  >  65136 [ACK] Seq=29933 Ack=93 Win=1050 Len=1460 [TCP segment of a reassembled PDU]"
"37","5.537805","54.160.93.182","100.86.7.137","TLSv1.2","1330","Application Data"
"38","5.537805","54.160.93.182","100.86.7.137","TLSv1.2","177","Application Data"
"39","5.537805","54.160.93.182","100.86.7.137","TCP","2974","443  >  65136 [ACK] Seq=32792 Ack=93 Win=1050 Len=2920 [TCP segment of a reassembled PDU]"
"40","5.537805","54.160.93.182","100.86.7.137","TLSv1.2","552","Application Data"
"41","5.537805","54.160.93.182","100.86.7.137","TCP","2974","443  >  65136 [ACK] Seq=36210 Ack=93 Win=1050 Len=2920 [TCP segment of a reassembled PDU]"
"42","5.537956","100.86.7.137","54.160.93.182","TCP","54","65136  >  443 [ACK] Seq=128 Ack=39130 Win=1026 Len=0"
"43","5.538137","54.160.93.182","100.86.7.137","TLSv1.2","1011","Application Data"
"44","5.538137","54.160.93.182","100.86.7.137","TCP","1514","443  >  65136 [ACK] Seq=40087 Ack=93 Win=1050 Len=1460 [TCP segment of a reassembled PDU]"
"45","5.538137","54.160.93.182","100.86.7.137","TCP","1176","[TCP Previous segment not captured] 443  >  65136 [PSH, ACK] Seq=43007 Ack=93 Win=1050 Len=1122 [TCP segment of a reassembled PDU]"
"46","5.538137","54.160.93.182","100.86.7.137","TCP","1514","443  >  65136 [ACK] Seq=44129 Ack=93 Win=1050 Len=1460 [TCP segment of a reassembled PDU]"
"47","5.538253","100.86.7.137","54.160.93.182","TCP","66","65136  >  443 [ACK] Seq=128 Ack=41547 Win=1026 Len=0 SLE=43007 SRE=44129"
"48","5.538329","100.86.7.137","54.160.93.182","TCP","66","[TCP Dup ACK 47#1] 65136  >  443 [ACK] Seq=128 Ack=41547 Win=1026 Len=0 SLE=43007 SRE=45589"
"49","5.538457","54.160.93.182","100.86.7.137","TLSv1.2","812","Application Data"
"50","5.538491","100.86.7.137","54.160.93.182","TCP","66","[TCP Dup ACK 47#2] 65136  >  443 [ACK] Seq=128 Ack=41547 Win=1026 Len=0 SLE=43007 SRE=46347"
"51","5.539885","54.160.93.182","100.86.7.137","TCP","4434","443  >  65136 [ACK] Seq=46347 Ack=93 Win=1050 Len=4380 [TCP segment of a reassembled PDU]"
"52","5.539949","100.86.7.137","54.160.93.182","TCP","66","[TCP Dup ACK 47#3] 65136  >  443 [ACK] Seq=128 Ack=41547 Win=1026 Len=0 SLE=43007 SRE=50727"
"53","5.540159","54.160.93.182","100.86.7.137","TLSv1.2","352","Application Data"
"54","5.540159","54.160.93.182","100.86.7.137","TLSv1.2","367","Application Data"
"55","5.540208","100.86.7.137","54.160.93.182","TCP","66","[TCP Dup ACK 47#4] 65136  >  443 [ACK] Seq=128 Ack=41547 Win=1026 Len=0 SLE=43007 SRE=51025"
"56","5.540282","100.86.7.137","54.160.93.182","TCP","66","[TCP Dup ACK 47#5] 65136  >  443 [ACK] Seq=128 Ack=41547 Win=1026 Len=0 SLE=43007 SRE=51338"
"57","5.554681","54.160.93.182","100.86.7.137","TCP","1514","[TCP Previous segment not captured] 443  >  65136 [ACK] Seq=56144 Ack=93 Win=1050 Len=1460 [TCP segment of a reassembled PDU]"
"58","5.554681","54.160.93.182","100.86.7.137","TLSv1.2","847","Application Data"
"59","5.554681","54.160.93.182","100.86.7.137","TCP","1514","443  >  65136 [ACK] Seq=58397 Ack=93 Win=1050 Len=1460 [TCP segment of a reassembled PDU]"
"60","5.554681","54.160.93.182","100.86.7.137","TLSv1.2","1360","Application Data"
"61","5.554681","54.160.93.182","100.86.7.137","TCP","1514","443  >  65136 [ACK] Seq=61163 Ack=93 Win=1050 Len=1460 [TCP segment of a reassembled PDU]"
"62","5.554681","54.160.93.182","100.86.7.137","TLSv1.2","702","Application Data"
"63","5.554681","54.160.93.182","100.86.7.137","TLSv1.2","189","Application Data"
"64","5.554681","54.160.93.182","100.86.7.137","TCP","1514","443  >  65136 [ACK] Seq=63406 Ack=93 Win=1050 Len=1460 [TCP segment of a reassembled PDU]"
"65","5.554681","54.160.93.182","100.86.7.137","TLSv1.2","1481","Application Data"
"66","5.554681","54.160.93.182","100.86.7.137","TCP","56","443  >  65136 [ACK] Seq=66293 Ack=128 Win=1050 Len=0"
"67","5.554681","54.160.93.182","100.86.7.137","TCP","1514","443  >  65136 [ACK] Seq=66293 Ack=128 Win=1050 Len=1460 [TCP segment of a reassembled PDU]"
"68","5.554681","54.160.93.182","100.86.7.137","TLSv1.2","1127","Application Data"
"69","5.554681","54.160.93.182","100.86.7.137","TCP","1514","443  >  65136 [ACK] Seq=68826 Ack=128 Win=1050 Len=1460 [TCP segment of a reassembled PDU]"
"70","5.554681","54.160.93.182","100.86.7.137","TLSv1.2","823","Application Data"
"71","5.554681","54.160.93.182","100.86.7.137","TCP","1514","443  >  65136 [ACK] Seq=71055 Ack=128 Win=1050 Len=1460 [TCP segment of a reassembled PDU]"
"72","5.554681","54.160.93.182","100.86.7.137","TLSv1.2","822","Application Data"
"73","5.554681","54.160.93.182","100.86.7.137","TCP","2974","443  >  65136 [ACK] Seq=73283 Ack=128 Win=1050 Len=2920 [TCP segment of a reassembled PDU]"
"74","5.554681","54.160.93.182","100.86.7.137","TLSv1.2","259","Application Data"
"75","5.554681","54.160.93.182","100.86.7.137","TLSv1.2","284","Application Data"
"76","5.554681","54.160.93.182","100.86.7.137","TCP","2974","443  >  65136 [ACK] Seq=76638 Ack=128 Win=1050 Len=2920 [TCP segment of a reassembled PDU]"
"77","5.554681","54.160.93.182","100.86.7.137","TLSv1.2","1460","Application Data"
"78","5.554681","54.160.93.182","100.86.7.137","TCP","2974","443  >  65136 [ACK] Seq=80964 Ack=128 Win=1050 Len=2920 [TCP segment of a reassembled PDU]"
"79","5.554681","54.160.93.182","100.86.7.137","TLSv1.2","263","Application Data"
"80","5.554681","54.160.93.182","100.86.7.137","TCP","4434","443  >  65136 [ACK] Seq=84093 Ack=128 Win=1050 Len=4380 [TCP segment of a reassembled PDU]"
"81","5.554681","54.160.93.182","100.86.7.137","TLSv1.2","1234","Application Data"
"82","5.554681","54.160.93.182","100.86.7.137","TCP","5894","443  >  65136 [ACK] Seq=89653 Ack=128 Win=1050 Len=5840 [TCP segment of a reassembled PDU]"
"83","5.554681","54.160.93.182","100.86.7.137","TLSv1.2","412","Application Data"
"84","5.554681","54.160.93.182","100.86.7.137","TCP","4434","443  >  65136 [ACK] Seq=95851 Ack=128 Win=1050 Len=4380 [TCP segment of a reassembled PDU]"
"85","5.554681","54.160.93.182","100.86.7.137","TLSv1.2","141","Application Data"
"86","5.554681","54.160.93.182","100.86.7.137","TLSv1.2","230","Application Data"
"87","5.554907","100.86.7.137","54.160.93.182","TCP","74","[TCP Dup ACK 47#6] 65136  >  443 [ACK] Seq=128 Ack=41547 Win=1026 Len=0 SLE=56144 SRE=57604 SLE=43007 SRE=51338"
"88","5.555031","100.86.7.137","54.160.93.182","TCP","74","[TCP Dup ACK 47#7] 65136  >  443 [ACK] Seq=128 Ack=41547 Win=1026 Len=0 SLE=56144 SRE=58397 SLE=43007 SRE=51338"
"89","5.555070","100.86.7.137","54.160.93.182","TCP","74","[TCP Dup ACK 47#8] 65136  >  443 [ACK] Seq=128 Ack=41547 Win=1026 Len=0 SLE=56144 SRE=59857 SLE=43007 SRE=51338"
"90","5.555105","100.86.7.137","54.160.93.182","TCP","74","[TCP Dup ACK 47#9] 65136  >  443 [ACK] Seq=128 Ack=41547 Win=1026 Len=0 SLE=56144 SRE=61163 SLE=43007 SRE=51338"
"91","5.555138","100.86.7.137","54.160.93.182","TCP","74","[TCP Dup ACK 47#10] 65136  >  443 [ACK] Seq=128 Ack=41547 Win=1026 Len=0 SLE=56144 SRE=62623 SLE=43007 SRE=51338"
"92","5.555171","100.86.7.137","54.160.93.182","TCP","74","[TCP Dup ACK 47#11] 65136  >  443 [ACK] Seq=128 Ack=41547 Win=1026 Len=0 SLE=56144 SRE=63271 SLE=43007 SRE=51338"
"93","5.555202","100.86.7.137","54.160.93.182","TCP","74","[TCP Dup ACK 47#12] 65136  >  443 [ACK] Seq=128 Ack=41547 Win=1026 Len=0 SLE=56144 SRE=63406 SLE=43007 SRE=51338"
"94","5.555236","100.86.7.137","54.160.93.182","TCP","74","[TCP Dup ACK 47#13] 65136  >  443 [ACK] Seq=128 Ack=41547 Win=1026 Len=0 SLE=56144 SRE=64866 SLE=43007 SRE=51338"
"95","5.555266","100.86.7.137","54.160.93.182","TCP","74","[TCP Dup ACK 47#14] 65136  >  443 [ACK] Seq=128 Ack=41547 Win=1026 Len=0 SLE=56144 SRE=66293 SLE=43007 SRE=51338"
"96","5.555306","100.86.7.137","54.160.93.182","TCP","74","[TCP Dup ACK 47#15] 65136  >  443 [ACK] Seq=128 Ack=41547 Win=1026 Len=0 SLE=56144 SRE=67753 SLE=43007 SRE=51338"
"97","5.555338","100.86.7.137","54.160.93.182","TCP","74","[TCP Dup ACK 47#16] 65136  >  443 [ACK] Seq=128 Ack=41547 Win=1026 Len=0 SLE=56144 SRE=68826 SLE=43007 SRE=51338"
"98","5.555377","100.86.7.137","54.160.93.182","TCP","74","[TCP Dup ACK 47#17] 65136  >  443 [ACK] Seq=128 Ack=41547 Win=1026 Len=0 SLE=56144 SRE=70286 SLE=43007 SRE=51338"
"99","5.555412","100.86.7.137","54.160.93.182","TCP","74","[TCP Dup ACK 47#18] 65136  >  443 [ACK] Seq=128 Ack=41547 Win=1026 Len=0 SLE=56144 SRE=71055 SLE=43007 SRE=51338"
"100","5.555452","100.86.7.137","54.160.93.182","TCP","74","[TCP Dup ACK 47#19] 65136  >  443 [ACK] Seq=128 Ack=41547 Win=1026 Len=0 SLE=56144 SRE=72515 SLE=43007 SRE=51338"
"101","5.555486","100.86.7.137","54.160.93.182","TCP","74","[TCP Dup ACK 47#20] 65136  >  443 [ACK] Seq=128 Ack=41547 Win=1026 Len=0 SLE=56144 SRE=73283 SLE=43007 SRE=51338"
"102","5.555522","100.86.7.137","54.160.93.182","TCP","74","[TCP Dup ACK 47#21] 65136  >  443 [ACK] Seq=128 Ack=41547 Win=1026 Len=0 SLE=56144 SRE=76203 SLE=43007 SRE=51338"
"103","5.555557","100.86.7.137","54.160.93.182","TCP","74","[TCP Dup ACK 47#22] 65136  >  443 [ACK] Seq=128 Ack=41547 Win=1026 Len=0 SLE=56144 SRE=76408 SLE=43007 SRE=51338"
"104","5.555642","100.86.7.137","54.160.93.182","TCP","74","[TCP Dup ACK 47#23] 65136  >  443 [ACK] Seq=128 Ack=41547 Win=1026 Len=0 SLE=56144 SRE=76638 SLE=43007 SRE=51338"
"105","5.555677","100.86.7.137","54.160.93.182","TCP","74","[TCP Dup ACK 47#24] 65136  >  443 [ACK] Seq=128 Ack=41547 Win=1026 Len=0 SLE=56144 SRE=79558 SLE=43007 SRE=51338"
"106","5.555711","100.86.7.137","54.160.93.182","TCP","74","[TCP Dup ACK 47#25] 65136  >  443 [ACK] Seq=128 Ack=41547 Win=1026 Len=0 SLE=56144 SRE=80964 SLE=43007 SRE=51338"
"107","5.555750","100.86.7.137","54.160.93.182","TCP","74","[TCP Dup ACK 47#26] 65136  >  443 [ACK] Seq=128 Ack=41547 Win=1026 Len=0 SLE=56144 SRE=83884 SLE=43007 SRE=51338"
"108","5.555903","100.86.7.137","54.160.93.182","TCP","74","[TCP Dup ACK 47#27] 65136  >  443 [ACK] Seq=128 Ack=41547 Win=1026 Len=0 SLE=56144 SRE=84093 SLE=43007 SRE=51338"
"109","5.555950","100.86.7.137","54.160.93.182","TCP","74","[TCP Dup ACK 47#28] 65136  >  443 [ACK] Seq=128 Ack=41547 Win=1026 Len=0 SLE=56144 SRE=88473 SLE=43007 SRE=51338"
"110","5.555995","100.86.7.137","54.160.93.182","TCP","74","[TCP Dup ACK 47#29] 65136  >  443 [ACK] Seq=128 Ack=41547 Win=1026 Len=0 SLE=56144 SRE=89653 SLE=43007 SRE=51338"
"111","5.556036","100.86.7.137","54.160.93.182","TCP","74","[TCP Dup ACK 47#30] 65136  >  443 [ACK] Seq=128 Ack=41547 Win=1026 Len=0 SLE=56144 SRE=95493 SLE=43007 SRE=51338"
"112","5.556072","100.86.7.137","54.160.93.182","TCP","74","[TCP Dup ACK 47#31] 65136  >  443 [ACK] Seq=128 Ack=41547 Win=1026 Len=0 SLE=56144 SRE=95851 SLE=43007 SRE=51338"
"113","5.556112","100.86.7.137","54.160.93.182","TCP","74","[TCP Dup ACK 47#32] 65136  >  443 [ACK] Seq=128 Ack=41547 Win=1026 Len=0 SLE=56144 SRE=100231 SLE=43007 SRE=51338"
"114","5.556145","100.86.7.137","54.160.93.182","TCP","74","[TCP Dup ACK 47#33] 65136  >  443 [ACK] Seq=128 Ack=41547 Win=1026 Len=0 SLE=56144 SRE=100318 SLE=43007 SRE=51338"
"115","5.556180","100.86.7.137","54.160.93.182","TCP","74","[TCP Dup ACK 47#34] 65136  >  443 [ACK] Seq=128 Ack=41547 Win=1026 Len=0 SLE=56144 SRE=100494 SLE=43007 SRE=51338"
"116","5.557559","54.160.93.182","100.86.7.137","TCP","1514","443  >  65136 [ACK] Seq=100494 Ack=128 Win=1050 Len=1460 [TCP segment of a reassembled PDU]"
"117","5.557559","54.160.93.182","100.86.7.137","TLSv1.2","1213","Application Data"
"118","5.557559","54.160.93.182","100.86.7.137","TCP","1514","443  >  65136 [ACK] Seq=103113 Ack=128 Win=1050 Len=1460 [TCP segment of a reassembled PDU]"
"119","5.557559","54.160.93.182","100.86.7.137","TLSv1.2","1287","Application Data"
"120","5.557640","100.86.7.137","54.160.93.182","TCP","74","[TCP Dup ACK 47#35] 65136  >  443 [ACK] Seq=128 Ack=41547 Win=1026 Len=0 SLE=56144 SRE=101954 SLE=43007 SRE=51338"
"121","5.557733","100.86.7.137","54.160.93.182","TCP","74","[TCP Dup ACK 47#36] 65136  >  443 [ACK] Seq=128 Ack=41547 Win=1026 Len=0 SLE=56144 SRE=103113 SLE=43007 SRE=51338"
"122","5.557766","100.86.7.137","54.160.93.182","TCP","74","[TCP Dup ACK 47#37] 65136  >  443 [ACK] Seq=128 Ack=41547 Win=1026 Len=0 SLE=56144 SRE=104573 SLE=43007 SRE=51338"
"123","5.557796","100.86.7.137","54.160.93.182","TCP","74","[TCP Dup ACK 47#38] 65136  >  443 [ACK] Seq=128 Ack=41547 Win=1026 Len=0 SLE=56144 SRE=105806 SLE=43007 SRE=51338"
"124","5.577695","54.160.93.182","100.86.7.137","TLSv1.2","1258","[TCP Previous segment not captured] , Application Data"
"125","5.577695","54.160.93.182","100.86.7.137","TLSv1.2","1514","[TCP Fast Retransmission] , Application Data"
"126","5.577695","54.160.93.182","100.86.7.137","TCP","1514","[TCP Out-Of-Order] 443  >  65136 [ACK] Seq=51338 Ack=128 Win=1050 Len=1460"
"127","5.577695","54.160.93.182","100.86.7.137","TCP","900","[TCP Out-Of-Order] 443  >  65136 [PSH, ACK] Seq=52798 Ack=128 Win=1050 Len=846"
"128","5.577695","54.160.93.182","100.86.7.137","TCP","1514","[TCP Out-Of-Order] 443  >  65136 [ACK] Seq=53644 Ack=128 Win=1050 Len=1460"
"129","5.577695","54.160.93.182","100.86.7.137","TCP","1094","[TCP Out-Of-Order] 443  >  65136 [PSH, ACK] Seq=55104 Ack=128 Win=1050 Len=1040"
"130","5.577828","100.86.7.137","54.160.93.182","TCP","82","[TCP Dup ACK 47#39] 65136  >  443 [ACK] Seq=128 Ack=41547 Win=1026 Len=0 SLE=110732 SRE=111936 SLE=56144 SRE=105806 SLE=43007 SRE=51338"
"131","5.578112","100.86.7.137","54.160.93.182","TCP","74","65136  >  443 [ACK] Seq=128 Ack=51338 Win=1026 Len=0 SLE=110732 SRE=111936 SLE=56144 SRE=105806"
"132","5.578165","100.86.7.137","54.160.93.182","TCP","74","65136  >  443 [ACK] Seq=128 Ack=52798 Win=1026 Len=0 SLE=110732 SRE=111936 SLE=56144 SRE=105806"
"133","5.578199","100.86.7.137","54.160.93.182","TCP","74","65136  >  443 [ACK] Seq=128 Ack=53644 Win=1023 Len=0 SLE=110732 SRE=111936 SLE=56144 SRE=105806"
"134","5.578236","100.86.7.137","54.160.93.182","TCP","74","65136  >  443 [ACK] Seq=128 Ack=55104 Win=1026 Len=0 SLE=110732 SRE=111936 SLE=56144 SRE=105806"
"135","5.578354","100.86.7.137","54.160.93.182","TCP","66","65136  >  443 [ACK] Seq=128 Ack=105806 Win=1026 Len=0 SLE=110732 SRE=111936"
"136","5.591531","54.160.93.182","100.86.7.137","TCP","1514","[TCP Retransmission] 443  >  65136 [ACK] Seq=105806 Ack=128 Win=1050 Len=1460"
"137","5.591531","54.160.93.182","100.86.7.137","TCP","1238","[TCP Retransmission] 443  >  65136 [PSH, ACK] Seq=107266 Ack=128 Win=1050 Len=1184"
"138","5.591531","54.160.93.182","100.86.7.137","TCP","1514","[TCP Retransmission] 443  >  65136 [ACK] Seq=108450 Ack=128 Win=1050 Len=1460"
"139","5.591531","54.160.93.182","100.86.7.137","TCP","876","[TCP Retransmission] 443  >  65136 [PSH, ACK] Seq=109910 Ack=128 Win=1050 Len=822"
"140","5.591662","100.86.7.137","54.160.93.182","TCP","66","65136  >  443 [ACK] Seq=128 Ack=107266 Win=1026 Len=0 SLE=110732 SRE=111936"
"141","5.591758","100.86.7.137","54.160.93.182","TCP","66","65136  >  443 [ACK] Seq=128 Ack=108450 Win=1021 Len=0 SLE=110732 SRE=111936"
"142","5.591806","100.86.7.137","54.160.93.182","TCP","66","65136  >  443 [ACK] Seq=128 Ack=109910 Win=1026 Len=0 SLE=110732 SRE=111936"
"143","5.591843","100.86.7.137","54.160.93.182","TCP","54","65136  >  443 [ACK] Seq=128 Ack=111936 Win=1026 Len=0"
"144","6.231189","100.86.7.137","3.225.92.8","TCP","55","65178  >  443 [ACK] Seq=1 Ack=1 Win=510 Len=1 [TCP segment of a reassembled PDU]"
"145","6.241720","3.225.92.8","100.86.7.137","TCP","66","443  >  65178 [ACK] Seq=1 Ack=2 Win=68 Len=0 SLE=1 SRE=2"
"146","6.282048","100.86.7.137","3.225.92.8","TCP","55","65184  >  443 [ACK] Seq=1 Ack=1 Win=510 Len=1 [TCP segment of a reassembled PDU]"
"147","6.292951","3.225.92.8","100.86.7.137","TCP","66","443  >  65184 [ACK] Seq=1 Ack=2 Win=68 Len=0 SLE=1 SRE=2"
"148","7.014540","100.86.7.137","54.160.93.182","TLSv1.2","650","Application Data"
"149","7.014687","100.86.7.137","54.160.93.182","TLSv1.2","740","Application Data"
"150","7.026997","54.160.93.182","100.86.7.137","TCP","56","443  >  65136 [ACK] Seq=111936 Ack=1410 Win=1050 Len=0"
"151","7.084438","54.160.93.182","100.86.7.137","TLSv1.2","279","Application Data"
"152","7.127421","100.86.7.137","54.160.93.182","TCP","54","65136  >  443 [ACK] Seq=1410 Ack=112161 Win=1025 Len=0"
"153","7.217963","100.86.7.137","54.160.93.182","TLSv1.2","386","Application Data"
"154","7.218160","100.86.7.137","54.160.93.182","TLSv1.2","207","Application Data"
"155","7.238766","54.160.93.182","100.86.7.137","TCP","56","443  >  65136 [ACK] Seq=112161 Ack=1895 Win=1050 Len=0"
"156","7.271449","54.160.93.182","100.86.7.137","TLSv1.2","371","Application Data"
"157","7.300422","100.86.7.137","3.225.92.8","TLSv1.2","123","Ignored Unknown Record"
"158","7.300479","100.86.7.137","3.225.92.8","TLSv1.2","93","Application Data"
"159","7.312126","3.225.92.8","100.86.7.137","TCP","56","443  >  65178 [ACK] Seq=1 Ack=110 Win=68 Len=0"
"160","7.312138","100.86.7.137","54.160.93.182","TCP","54","65136  >  443 [ACK] Seq=1895 Ack=112478 Win=1024 Len=0"
"161","7.312293","3.225.92.8","100.86.7.137","TLSv1.2","93","Application Data"
"162","7.315995","3.225.92.8","100.86.7.137","TLSv1.2","221","Application Data"
"163","7.316094","100.86.7.137","3.225.92.8","TCP","54","65178  >  443 [ACK] Seq=110 Ack=207 Win=509 Len=0"
"164","7.317153","100.86.7.137","3.225.92.8","TLSv1.2","119","Ignored Unknown Record"
"165","7.317224","100.86.7.137","3.225.92.8","TLSv1.2","93","Application Data"
"166","7.317265","100.86.7.137","3.225.92.8","TLSv1.2","186","Application Data"
"167","7.328988","3.225.92.8","100.86.7.137","TCP","56","443  >  65184 [ACK] Seq=1 Ack=106 Win=68 Len=0"
"168","7.328988","3.225.92.8","100.86.7.137","TCP","56","443  >  65184 [ACK] Seq=1 Ack=238 Win=68 Len=0"
"169","7.329272","3.225.92.8","100.86.7.137","TLSv1.2","93","Application Data"
"170","7.333125","3.225.92.8","100.86.7.137","TLSv1.2","296","Application Data"
"171","7.333161","100.86.7.137","3.225.92.8","TCP","54","65184  >  443 [ACK] Seq=238 Ack=282 Win=509 Len=0"
"172","7.596757","100.86.7.137","54.160.93.182","TLSv1.2","386","Application Data"
"173","7.596940","100.86.7.137","54.160.93.182","TLSv1.2","776","Application Data"
"174","7.608908","54.160.93.182","100.86.7.137","TCP","56","443  >  65136 [ACK] Seq=112478 Ack=2949 Win=1050 Len=0"
"175","7.810733","100.86.7.137","54.160.93.182","TLSv1.2","647","Application Data"
"176","7.810895","100.86.7.137","54.160.93.182","TLSv1.2","1394","Application Data"
"177","7.822250","54.160.93.182","100.86.7.137","TCP","56","443  >  65136 [ACK] Seq=112478 Ack=4882 Win=1050 Len=0"
"178","8.014328","100.86.7.137","54.160.93.182","TLSv1.2","174","Application Data"
"179","8.040279","54.160.93.182","100.86.7.137","TLSv1.2","504","Application Data"
"180","8.092286","100.86.7.137","54.160.93.182","TCP","54","65136  >  443 [ACK] Seq=5002 Ack=112928 Win=1022 Len=0"
"181","8.427778","54.160.93.182","100.86.7.137","TLSv1.2","1390","Application Data"
"182","8.466976","100.86.7.137","54.160.93.182","TCP","54","65136  >  443 [ACK] Seq=5002 Ack=114264 Win=1026 Len=0"
"183","8.667839","100.86.7.137","54.160.93.182","TLSv1.2","271","Application Data"
"184","8.667991","100.86.7.137","54.160.93.182","TLSv1.2","11149","Application Data"
"185","8.685338","100.86.7.137","54.160.93.182","TLSv1.2","271","Application Data"
"186","8.685421","100.86.7.137","54.160.93.182","TLSv1.2","10237","Application Data"
"187","8.689943","54.160.93.182","100.86.7.137","TCP","56","443  >  65136 [ACK] Seq=114264 Ack=16314 Win=1034 Len=0"
"188","8.697062","54.160.93.182","100.86.7.137","TCP","2974","443  >  65136 [ACK] Seq=114264 Ack=16314 Win=1050 Len=2920 [TCP segment of a reassembled PDU]"
"189","8.697062","54.160.93.182","100.86.7.137","TLSv1.2","678","Application Data"
"190","8.697155","100.86.7.137","54.160.93.182","TCP","54","65136  >  443 [ACK] Seq=26714 Ack=117808 Win=1026 Len=0"
"191","8.719210","54.160.93.182","100.86.7.137","TCP","56","443  >  65136 [ACK] Seq=117808 Ack=26714 Win=1050 Len=0"
"192","8.719210","54.160.93.182","100.86.7.137","TCP","2974","443  >  65136 [ACK] Seq=117808 Ack=26714 Win=1050 Len=2920 [TCP segment of a reassembled PDU]"
"193","8.720005","100.86.7.137","54.160.93.182","TCP","54","65136  >  443 [ACK] Seq=26714 Ack=120728 Win=1026 Len=0"
"194","8.720479","54.160.93.182","100.86.7.137","TLSv1.2","607","Application Data"
"195","8.720620","100.86.7.137","54.160.93.182","TCP","54","65136  >  443 [ACK] Seq=26714 Ack=121281 Win=1024 Len=0"
"196","9.251644","100.86.7.137","54.160.93.182","TLSv1.2","263","Application Data"
"197","9.251717","100.86.7.137","54.160.93.182","TLSv1.2","1606","Application Data"
"198","9.266543","54.160.93.182","100.86.7.137","TCP","56","443  >  65136 [ACK] Seq=121281 Ack=28475 Win=1050 Len=0"
"199","9.311993","100.86.7.137","54.160.93.182","TLSv1.2","273","Application Data"
"200","9.312115","100.86.7.137","54.160.93.182","TLSv1.2","9049","Application Data"
"201","9.317993","54.160.93.182","100.86.7.137","TCP","5894","443  >  65136 [ACK] Seq=121281 Ack=28475 Win=1050 Len=5840 [TCP segment of a reassembled PDU]"
"202","9.317993","54.160.93.182","100.86.7.137","TLSv1.2","765","Application Data"
"203","9.318147","100.86.7.137","54.160.93.182","TCP","54","65136  >  443 [ACK] Seq=37689 Ack=127832 Win=1026 Len=0"
"204","9.321301","54.160.93.182","100.86.7.137","TCP","1514","443  >  65136 [ACK] Seq=127832 Ack=28475 Win=1050 Len=1460 [TCP segment of a reassembled PDU]"
"205","9.321301","54.160.93.182","100.86.7.137","TLSv1.2","97","Application Data"
"206","9.321407","100.86.7.137","54.160.93.182","TCP","54","65136  >  443 [ACK] Seq=37689 Ack=129335 Win=1026 Len=0"
"207","9.323560","54.160.93.182","100.86.7.137","TCP","1514","443  >  65136 [ACK] Seq=129335 Ack=28475 Win=1050 Len=1460 [TCP segment of a reassembled PDU]"
"208","9.323560","54.160.93.182","100.86.7.137","TCP","1514","443  >  65136 [ACK] Seq=130795 Ack=28475 Win=1050 Len=1460 [TCP segment of a reassembled PDU]"
"209","9.323560","54.160.93.182","100.86.7.137","TLSv1.2","1038","Application Data"
"210","9.323560","54.160.93.182","100.86.7.137","TCP","1514","443  >  65136 [ACK] Seq=133239 Ack=28475 Win=1050 Len=1460 [TCP segment of a reassembled PDU]"
"211","9.323560","54.160.93.182","100.86.7.137","TLSv1.2","1327","Application Data"
"212","9.323835","100.86.7.137","54.160.93.182","TCP","54","65136  >  443 [ACK] Seq=37689 Ack=135972 Win=1026 Len=0"
"213","9.325032","54.160.93.182","100.86.7.137","TCP","56","443  >  65136 [ACK] Seq=135972 Ack=37689 Win=1035 Len=0"
"214","9.423153","54.160.93.182","100.86.7.137","TLSv1.2","29254","Application Data"
"215","9.423153","54.160.93.182","100.86.7.137","TCP","1514","443  >  65136 [ACK] Seq=165172 Ack=37689 Win=1050 Len=1460 [TCP segment of a reassembled PDU]"
"216","9.423153","54.160.93.182","100.86.7.137","TCP","1514","443  >  65136 [ACK] Seq=166632 Ack=37689 Win=1050 Len=1460 [TCP segment of a reassembled PDU]"
"217","9.423153","54.160.93.182","100.86.7.137","TLSv1.2","1514","Application Data"
"218","9.423153","54.160.93.182","100.86.7.137","TCP","1514","443  >  65136 [ACK] Seq=169552 Ack=37689 Win=1050 Len=1460 [TCP segment of a reassembled PDU]"
"219","9.423153","54.160.93.182","100.86.7.137","TCP","1514","443  >  65136 [ACK] Seq=171012 Ack=37689 Win=1050 Len=1460 [TCP segment of a reassembled PDU]"
"220","9.423153","54.160.93.182","100.86.7.137","TCP","1514","443  >  65136 [ACK] Seq=172472 Ack=37689 Win=1050 Len=1460 [TCP segment of a reassembled PDU]"
"221","9.423153","54.160.93.182","100.86.7.137","TCP","5894","443  >  65136 [PSH, ACK] Seq=173932 Ack=37689 Win=1050 Len=5840 [TCP segment of a reassembled PDU]"
"222","9.423153","54.160.93.182","100.86.7.137","TCP","1514","443  >  65136 [ACK] Seq=179772 Ack=37689 Win=1050 Len=1460 [TCP segment of a reassembled PDU]"
"223","9.423153","54.160.93.182","100.86.7.137","TCP","1514","443  >  65136 [ACK] Seq=181232 Ack=37689 Win=1050 Len=1460 [TCP segment of a reassembled PDU]"
"224","9.423153","54.160.93.182","100.86.7.137","TLSv1.2","4434","Application Data"
"225","9.423153","54.160.93.182","100.86.7.137","TLSv1.2","1159","Application Data"
"226","9.423984","100.86.7.137","54.160.93.182","TCP","54","65136  >  443 [ACK] Seq=37689 Ack=188177 Win=1026 Len=0"
"227","9.460561","54.160.93.182","100.86.7.137","TCP","1159","[TCP Spurious Retransmission] 443  >  65136 [PSH, ACK] Seq=187072 Ack=37689 Win=1050 Len=1105 [TCP segment of a reassembled PDU]"
"228","9.460664","100.86.7.137","54.160.93.182","TCP","66","[TCP Dup ACK 226#1] 65136  >  443 [ACK] Seq=37689 Ack=188177 Win=1026 Len=0 SLE=187072 SRE=188177"
"229","9.866295","100.86.7.137","54.160.93.182","TLSv1.2","391","Application Data"
"230","9.866415","100.86.7.137","54.160.93.182","TLSv1.2","604","Application Data"
"231","9.887658","54.160.93.182","100.86.7.137","TCP","56","443  >  65136 [ACK] Seq=188177 Ack=38576 Win=1050 Len=0"
"232","9.950044","54.160.93.182","100.86.7.137","TLSv1.2","723","Application Data"
"233","9.963186","54.160.93.182","100.86.7.137","TLSv1.2","223","Application Data"
"234","9.963186","54.160.93.182","100.86.7.137","TCP","1514","443  >  65136 [ACK] Seq=189015 Ack=38576 Win=1050 Len=1460 [TCP segment of a reassembled PDU]"
"235","9.963186","54.160.93.182","100.86.7.137","TCP","1514","443  >  65136 [ACK] Seq=190475 Ack=38576 Win=1050 Len=1460 [TCP segment of a reassembled PDU]"
"236","9.963186","54.160.93.182","100.86.7.137","TLSv1.2","939","Application Data"
"237","9.963186","54.160.93.182","100.86.7.137","TCP","2974","443  >  65136 [ACK] Seq=192820 Ack=38576 Win=1050 Len=2920 [TCP segment of a reassembled PDU]"
"238","9.963186","54.160.93.182","100.86.7.137","TLSv1.2","379","Application Data"
"239","9.963186","54.160.93.182","100.86.7.137","TCP","2974","443  >  65136 [ACK] Seq=196065 Ack=38576 Win=1050 Len=2920 [TCP segment of a reassembled PDU]"
"240","9.963186","54.160.93.182","100.86.7.137","TLSv1.2","654","Application Data"
"241","9.963186","54.160.93.182","100.86.7.137","TCP","2974","443  >  65136 [ACK] Seq=199585 Ack=38576 Win=1050 Len=2920 [TCP segment of a reassembled PDU]"
"242","9.963186","54.160.93.182","100.86.7.137","TLSv1.2","1260","Application Data"
"243","9.963186","54.160.93.182","100.86.7.137","TLSv1.2","477","Application Data"
"244","9.963186","54.160.93.182","100.86.7.137","TCP","1514","443  >  65136 [ACK] Seq=204134 Ack=38576 Win=1050 Len=1460 [TCP segment of a reassembled PDU]"
"245","9.963186","54.160.93.182","100.86.7.137","TCP","1514","443  >  65136 [ACK] Seq=205594 Ack=38576 Win=1050 Len=1460 [TCP segment of a reassembled PDU]"
"246","9.963186","54.160.93.182","100.86.7.137","TLSv1.2","699","Application Data"
"247","9.963186","54.160.93.182","100.86.7.137","TCP","1514","443  >  65136 [ACK] Seq=207699 Ack=38576 Win=1050 Len=1460 [TCP segment of a reassembled PDU]"
"248","9.963186","54.160.93.182","100.86.7.137","TLSv1.2","1445","Application Data"
"249","9.963186","54.160.93.182","100.86.7.137","TCP","1514","443  >  65136 [ACK] Seq=210550 Ack=38576 Win=1050 Len=1460 [TCP segment of a reassembled PDU]"
"250","9.963186","54.160.93.182","100.86.7.137","TLSv1.2","705","Application Data"
"251","9.963186","54.160.93.182","100.86.7.137","TCP","2974","443  >  65136 [ACK] Seq=212661 Ack=38576 Win=1050 Len=2920 [TCP segment of a reassembled PDU]"
"252","9.963186","54.160.93.182","100.86.7.137","TLSv1.2","324","Application Data"
"253","9.963186","54.160.93.182","100.86.7.137","TCP","1514","443  >  65136 [ACK] Seq=215851 Ack=38576 Win=1050 Len=1460 [TCP segment of a reassembled PDU]"
"254","9.963186","54.160.93.182","100.86.7.137","TLSv1.2","1475","Application Data"
"255","9.963186","54.160.93.182","100.86.7.137","TLSv1.2","389","Application Data"
"256","9.963186","54.160.93.182","100.86.7.137","TCP","1514","443  >  65136 [ACK] Seq=219067 Ack=38576 Win=1050 Len=1460 [TCP segment of a reassembled PDU]"
"257","9.963437","100.86.7.137","54.160.93.182","TCP","54","65136  >  443 [ACK] Seq=38576 Ack=220527 Win=1026 Len=0"
"258","9.969673","54.160.93.182","100.86.7.137","TLSv1.2","1369","Application Data"
"259","9.969781","100.86.7.137","54.160.93.182","TCP","54","65136  >  443 [ACK] Seq=38576 Ack=221842 Win=1021 Len=0"
"260","9.973225","54.160.93.182","100.86.7.137","TCP","1514","443  >  65136 [ACK] Seq=221842 Ack=38576 Win=1050 Len=1460 [TCP segment of a reassembled PDU]"
"261","9.973225","54.160.93.182","100.86.7.137","TLSv1.2","1381","Application Data"
"262","9.973225","54.160.93.182","100.86.7.137","TCP","1514","443  >  65136 [ACK] Seq=224629 Ack=38576 Win=1050 Len=1460 [TCP segment of a reassembled PDU]"
"263","9.973525","100.86.7.137","54.160.93.182","TCP","54","65136  >  443 [ACK] Seq=38576 Ack=226089 Win=1026 Len=0"
"264","9.980527","54.160.93.182","100.86.7.137","TLSv1.2","1433","Application Data"
"265","9.980631","100.86.7.137","54.160.93.182","TCP","54","65136  >  443 [ACK] Seq=38576 Ack=227468 Win=1021 Len=0"
"266","9.983656","100.86.7.137","54.160.93.182","TLSv1.2","273","Application Data"
"267","9.983812","100.86.7.137","54.160.93.182","TLSv1.2","9049","Application Data"
"268","9.989619","54.160.93.182","100.86.7.137","TCP","1514","443  >  65136 [ACK] Seq=227468 Ack=38576 Win=1050 Len=1460 [TCP segment of a reassembled PDU]"
"269","9.989619","54.160.93.182","100.86.7.137","TLSv1.2","1315","Application Data"
"270","9.989619","54.160.93.182","100.86.7.137","TCP","1514","443  >  65136 [ACK] Seq=230189 Ack=38576 Win=1050 Len=1460 [TCP segment of a reassembled PDU]"
"271","9.989619","54.160.93.182","100.86.7.137","TLSv1.2","1276","Application Data"
"272","9.989619","54.160.93.182","100.86.7.137","TLSv1.2","429","Application Data"
"273","9.989619","54.160.93.182","100.86.7.137","TCP","1514","443  >  65136 [ACK] Seq=233246 Ack=38576 Win=1050 Len=1460 [TCP segment of a reassembled PDU]"
"274","9.989619","54.160.93.182","100.86.7.137","TLSv1.2","1513","Application Data"
"275","9.990239","100.86.7.137","54.160.93.182","TCP","54","65136  >  443 [ACK] Seq=47790 Ack=236165 Win=1026 Len=0"
"276","9.992470","54.160.93.182","100.86.7.137","TCP","1514","443  >  65136 [ACK] Seq=236165 Ack=38576 Win=1050 Len=1460 [TCP segment of a reassembled PDU]"
"277","9.992470","54.160.93.182","100.86.7.137","TCP","1514","443  >  65136 [ACK] Seq=237625 Ack=38576 Win=1050 Len=1460 [TCP segment of a reassembled PDU]"
"278","9.992470","54.160.93.182","100.86.7.137","TLSv1.2","300","Application Data"
"279","9.992470","54.160.93.182","100.86.7.137","TCP","1514","443  >  65136 [ACK] Seq=239331 Ack=38576 Win=1050 Len=1460 [TCP segment of a reassembled PDU]"
"280","9.992470","54.160.93.182","100.86.7.137","TLSv1.2","1237","Application Data"
"281","9.993010","100.86.7.137","54.160.93.182","TCP","54","65136  >  443 [ACK] Seq=47790 Ack=241974 Win=1026 Len=0"
"282","9.993093","54.160.93.182","100.86.7.137","TCP","1514","443  >  65136 [ACK] Seq=241974 Ack=38576 Win=1050 Len=1460 [TCP segment of a reassembled PDU]"
"283","9.993093","54.160.93.182","100.86.7.137","TLSv1.2","1330","Application Data"
"284","9.993223","100.86.7.137","54.160.93.182","TCP","54","65136  >  443 [ACK] Seq=47790 Ack=244710 Win=1026 Len=0"
"285","9.998711","54.160.93.182","100.86.7.137","TCP","2974","443  >  65136 [ACK] Seq=244710 Ack=38576 Win=1050 Len=2920 [TCP segment of a reassembled PDU]"
"286","9.998711","54.160.93.182","100.86.7.137","TLSv1.2","279","Application Data"
"287","9.998711","54.160.93.182","100.86.7.137","TLSv1.2","456","Application Data"
"288","9.998711","54.160.93.182","100.86.7.137","TCP","2974","443  >  65136 [ACK] Seq=248257 Ack=38576 Win=1050 Len=2920 [TCP segment of a reassembled PDU]"
"289","9.998711","54.160.93.182","100.86.7.137","TLSv1.2","131","Application Data"
"290","9.998711","54.160.93.182","100.86.7.137","TCP","1514","443  >  65136 [ACK] Seq=251254 Ack=38576 Win=1050 Len=1460 [TCP segment of a reassembled PDU]"
"291","9.998711","54.160.93.182","100.86.7.137","TLSv1.2","1379","Application Data"
"292","9.998711","54.160.93.182","100.86.7.137","TCP","1514","443  >  65136 [ACK] Seq=254039 Ack=38576 Win=1050 Len=1460 [TCP segment of a reassembled PDU]"
"293","9.998711","54.160.93.182","100.86.7.137","TLSv1.2","977","Application Data"
"294","9.998711","54.160.93.182","100.86.7.137","TCP","2974","443  >  65136 [ACK] Seq=256422 Ack=38576 Win=1050 Len=2920 [TCP segment of a reassembled PDU]"
"295","9.998711","54.160.93.182","100.86.7.137","TLSv1.2","254","Application Data"
"296","9.998711","54.160.93.182","100.86.7.137","TCP","1514","443  >  65136 [ACK] Seq=259542 Ack=38576 Win=1050 Len=1460 [TCP segment of a reassembled PDU]"
"297","9.998711","54.160.93.182","100.86.7.137","TLSv1.2","344","[TCP Previous segment not captured] , Application Data"
"298","9.998711","54.160.93.182","100.86.7.137","TCP","1514","443  >  65136 [ACK] Seq=262412 Ack=38576 Win=1050 Len=1460 [TCP segment of a reassembled PDU]"
"299","9.998711","54.160.93.182","100.86.7.137","TLSv1.2","1195","Application Data"
"300","9.998711","54.160.93.182","100.86.7.137","TCP","1514","443  >  65136 [ACK] Seq=265013 Ack=38576 Win=1050 Len=1460 [TCP segment of a reassembled PDU]"
"301","9.998711","54.160.93.182","100.86.7.137","TLSv1.2","1051","Application Data"
"302","9.998711","54.160.93.182","100.86.7.137","TCP","1514","443  >  65136 [ACK] Seq=267470 Ack=38576 Win=1050 Len=1460 [TCP segment of a reassembled PDU]"
"303","9.998711","54.160.93.182","100.86.7.137","TLSv1.2","859","Application Data"
"304","9.998711","54.160.93.182","100.86.7.137","TCP","1514","443  >  65136 [ACK] Seq=269735 Ack=38576 Win=1050 Len=1460 [TCP segment of a reassembled PDU]"
"305","9.998711","54.160.93.182","100.86.7.137","TLSv1.2","844","Application Data"
"306","9.998711","54.160.93.182","100.86.7.137","TCP","1514","443  >  65136 [ACK] Seq=271985 Ack=38576 Win=1050 Len=1460 [TCP segment of a reassembled PDU]"
"307","9.998711","54.160.93.182","100.86.7.137","TLSv1.2","1030","Application Data"
"308","9.998711","54.160.93.182","100.86.7.137","TLSv1.2","295","Application Data"
"309","9.998711","54.160.93.182","100.86.7.137","TCP","1514","443  >  65136 [ACK] Seq=274662 Ack=38576 Win=1050 Len=1460 [TCP segment of a reassembled PDU]"
"310","9.998711","54.160.93.182","100.86.7.137","TLSv1.2","674","Application Data"
"311","9.998711","54.160.93.182","100.86.7.137","TCP","1514","443  >  65136 [ACK] Seq=276742 Ack=38576 Win=1050 Len=1460 [TCP segment of a reassembled PDU]"
"312","9.998711","54.160.93.182","100.86.7.137","TLSv1.2","1137","Application Data"
"313","9.998711","54.160.93.182","100.86.7.137","TCP","1514","443  >  65136 [ACK] Seq=279285 Ack=38576 Win=1050 Len=1460 [TCP segment of a reassembled PDU]"
"314","9.998711","54.160.93.182","100.86.7.137","TLSv1.2","1082","Application Data"
"315","9.998711","54.160.93.182","100.86.7.137","TCP","1514","443  >  65136 [ACK] Seq=281773 Ack=38576 Win=1050 Len=1460 [TCP segment of a reassembled PDU]"
"316","9.998876","100.86.7.137","54.160.93.182","TCP","66","65136  >  443 [ACK] Seq=47790 Ack=261002 Win=1026 Len=0 SLE=262122 SRE=262412"
"317","9.998931","100.86.7.137","54.160.93.182","TCP","66","[TCP Dup ACK 316#1] 65136  >  443 [ACK] Seq=47790 Ack=261002 Win=1026 Len=0 SLE=262122 SRE=263872"
"318","9.998947","100.86.7.137","54.160.93.182","TCP","66","[TCP Dup ACK 316#2] 65136  >  443 [ACK] Seq=47790 Ack=261002 Win=1026 Len=0 SLE=262122 SRE=265013"
"319","9.998962","100.86.7.137","54.160.93.182","TCP","66","[TCP Dup ACK 316#3] 65136  >  443 [ACK] Seq=47790 Ack=261002 Win=1026 Len=0 SLE=262122 SRE=266473"
"320","9.998984","100.86.7.137","54.160.93.182","TCP","66","[TCP Dup ACK 316#4] 65136  >  443 [ACK] Seq=47790 Ack=261002 Win=1026 Len=0 SLE=262122 SRE=267470"
"321","9.999006","100.86.7.137","54.160.93.182","TCP","66","[TCP Dup ACK 316#5] 65136  >  443 [ACK] Seq=47790 Ack=261002 Win=1026 Len=0 SLE=262122 SRE=268930"
"322","9.999018","100.86.7.137","54.160.93.182","TCP","66","[TCP Dup ACK 316#6] 65136  >  443 [ACK] Seq=47790 Ack=261002 Win=1026 Len=0 SLE=262122 SRE=269735"
