"No.","Time","Source","Destination","Protocol","Length","Info"
"19","1.823068","100.86.171.196","104.16.133.27","TCP","1454","64932  >  443 [ACK] Seq=1 Ack=1 Win=12436 Len=1388 TSval=34897776 TSecr=2675414059 [TCP segment of a reassembled PDU]"
"20","1.823070","100.86.171.196","104.16.133.27","TCP","1454","64932  >  443 [ACK] Seq=1389 Ack=1 Win=12436 Len=1388 TSval=34897776 TSecr=2675414059 [TCP segment of a reassembled PDU]"
"21","1.823104","100.86.171.196","104.16.133.27","TLSv1.2","124","Application Data"
"22","1.848565","104.16.133.27","100.86.171.196","TCP","66","443  >  64932 [ACK] Seq=1 Ack=2835 Win=15 Len=0 TSval=2675443508 TSecr=34897776"
"23","2.711639","104.16.133.27","100.86.171.196","TLSv1.2","687","Application Data"
"24","2.711641","104.16.133.27","100.86.171.196","TLSv1.2","99","Application Data"
"25","2.711641","104.16.133.27","100.86.171.196","TCP","1514","443  >  64932 [ACK] Seq=655 Ack=2835 Win=15 Len=1448 TSval=2675444309 TSecr=34897776 [TCP segment of a reassembled PDU]"
"26","2.711642","104.16.133.27","100.86.171.196","TCP","1514","443  >  64932 [ACK] Seq=2103 Ack=2835 Win=15 Len=1448 TSval=2675444309 TSecr=34897776 [TCP segment of a reassembled PDU]"
"27","2.711643","104.16.133.27","100.86.171.196","TLSv1.2","1169","Application Data"
"28","2.711735","100.86.171.196","104.16.133.27","TCP","66","64932  >  443 [ACK] Seq=2835 Ack=622 Win=12426 Len=0 TSval=34898664 TSecr=2675444308"
"29","2.711792","100.86.171.196","104.16.133.27","TCP","66","64932  >  443 [ACK] Seq=2835 Ack=4654 Win=12363 Len=0 TSval=34898664 TSecr=2675444309"
"30","2.711859","100.86.171.196","104.16.133.27","TCP","66","[TCP Window Update] 64932  >  443 [ACK] Seq=2835 Ack=4654 Win=12436 Len=0 TSval=34898664 TSecr=2675444309"
"31","2.711938","104.16.133.27","100.86.171.196","TCP","1514","443  >  64932 [ACK] Seq=4654 Ack=2835 Win=15 Len=1448 TSval=2675444310 TSecr=34897776 [TCP segment of a reassembled PDU]"
"32","2.711939","104.16.133.27","100.86.171.196","TCP","1514","443  >  64932 [ACK] Seq=6102 Ack=2835 Win=15 Len=1448 TSval=2675444310 TSecr=34897776 [TCP segment of a reassembled PDU]"
"33","2.711939","104.16.133.27","100.86.171.196","TLSv1.2","1469","Application Data"
"34","2.711940","104.16.133.27","100.86.171.196","TCP","1514","443  >  64932 [ACK] Seq=8953 Ack=2835 Win=15 Len=1448 TSval=2675444311 TSecr=34897776 [TCP segment of a reassembled PDU]"
"35","2.711941","104.16.133.27","100.86.171.196","TCP","1514","443  >  64932 [ACK] Seq=10401 Ack=2835 Win=15 Len=1448 TSval=2675444311 TSecr=34897776 [TCP segment of a reassembled PDU]"
"36","2.711942","104.16.133.27","100.86.171.196","TLSv1.2","984","Application Data"
"37","2.711942","104.16.133.27","100.86.171.196","TCP","1514","443  >  64932 [ACK] Seq=12767 Ack=2835 Win=15 Len=1448 TSval=2675444311 TSecr=34897776 [TCP segment of a reassembled PDU]"
"38","2.711943","104.16.133.27","100.86.171.196","TCP","1514","443  >  64932 [ACK] Seq=14215 Ack=2835 Win=15 Len=1448 TSval=2675444311 TSecr=34897776 [TCP segment of a reassembled PDU]"
"39","2.711944","104.16.133.27","100.86.171.196","TLSv1.2","1408","Application Data"
"40","2.711945","104.16.133.27","100.86.171.196","TCP","1514","443  >  64932 [ACK] Seq=17005 Ack=2835 Win=15 Len=1448 TSval=2675444312 TSecr=34897776 [TCP segment of a reassembled PDU]"
"41","2.711946","104.16.133.27","100.86.171.196","TCP","1514","443  >  64932 [ACK] Seq=18453 Ack=2835 Win=15 Len=1448 TSval=2675444312 TSecr=34897776 [TCP segment of a reassembled PDU]"
"42","2.711947","104.16.133.27","100.86.171.196","TLSv1.2","1096","Application Data"
"43","2.711947","104.16.133.27","100.86.171.196","TCP","1514","443  >  64932 [ACK] Seq=20931 Ack=2835 Win=15 Len=1448 TSval=2675444312 TSecr=34897776 [TCP segment of a reassembled PDU]"
"44","2.711948","104.16.133.27","100.86.171.196","TCP","1514","443  >  64932 [ACK] Seq=22379 Ack=2835 Win=15 Len=1448 TSval=2675444312 TSecr=34897776 [TCP segment of a reassembled PDU]"
"45","2.711949","104.16.133.27","100.86.171.196","TLSv1.2","1274","Application Data"
"46","2.711949","104.16.133.27","100.86.171.196","TCP","1514","443  >  64932 [ACK] Seq=25035 Ack=2835 Win=15 Len=1448 TSval=2675444312 TSecr=34897776 [TCP segment of a reassembled PDU]"
"47","2.711950","104.16.133.27","100.86.171.196","TCP","1514","443  >  64932 [ACK] Seq=26483 Ack=2835 Win=15 Len=1448 TSval=2675444312 TSecr=34897776 [TCP segment of a reassembled PDU]"
"48","2.711951","104.16.133.27","100.86.171.196","TLSv1.2","1342","Application Data"
"49","2.711951","104.16.133.27","100.86.171.196","TCP","1514","443  >  64932 [ACK] Seq=29207 Ack=2835 Win=15 Len=1448 TSval=2675444313 TSecr=34897776 [TCP segment of a reassembled PDU]"
"50","2.711952","104.16.133.27","100.86.171.196","TCP","1514","443  >  64932 [ACK] Seq=30655 Ack=2835 Win=15 Len=1448 TSval=2675444313 TSecr=34897776 [TCP segment of a reassembled PDU]"
"51","2.711953","104.16.133.27","100.86.171.196","TLSv1.2","1303","Application Data"
"52","2.711954","104.16.133.27","100.86.171.196","TLSv1.2","230","Application Data"
"53","2.711954","104.16.133.27","100.86.171.196","TCP","1514","443  >  64932 [ACK] Seq=33504 Ack=2835 Win=15 Len=1448 TSval=2675444313 TSecr=34897776 [TCP segment of a reassembled PDU]"
"54","2.711955","104.16.133.27","100.86.171.196","TCP","1514","443  >  64932 [ACK] Seq=34952 Ack=2835 Win=15 Len=1448 TSval=2675444313 TSecr=34897776 [TCP segment of a reassembled PDU]"
"55","2.711955","104.16.133.27","100.86.171.196","TLSv1.2","1307","Application Data"
"56","2.711956","104.16.133.27","100.86.171.196","TLSv1.2","146","Application Data"
"57","2.711956","104.16.133.27","100.86.171.196","TCP","1514","443  >  64932 [ACK] Seq=37721 Ack=2835 Win=15 Len=1448 TSval=2675444314 TSecr=34897776 [TCP segment of a reassembled PDU]"
"58","2.711957","104.16.133.27","100.86.171.196","TCP","1514","443  >  64932 [ACK] Seq=39169 Ack=2835 Win=15 Len=1448 TSval=2675444314 TSecr=34897776 [TCP segment of a reassembled PDU]"
"59","2.711958","104.16.133.27","100.86.171.196","TLSv1.2","1220","Application Data"
"60","2.711958","104.16.133.27","100.86.171.196","TCP","1514","443  >  64932 [ACK] Seq=41771 Ack=2835 Win=15 Len=1448 TSval=2675444314 TSecr=34897776 [TCP segment of a reassembled PDU]"
"61","2.711959","104.16.133.27","100.86.171.196","TCP","1514","443  >  64932 [ACK] Seq=43219 Ack=2835 Win=15 Len=1448 TSval=2675444314 TSecr=34897776 [TCP segment of a reassembled PDU]"
"62","2.711960","104.16.133.27","100.86.171.196","TLSv1.2","668","Application Data"
"63","2.712240","104.16.133.27","100.86.171.196","TCP","1514","443  >  64932 [ACK] Seq=45269 Ack=2835 Win=15 Len=1448 TSval=2675444315 TSecr=34897776 [TCP segment of a reassembled PDU]"
"64","2.712241","104.16.133.27","100.86.171.196","TLSv1.2","1178","Application Data"
"65","2.712242","104.16.133.27","100.86.171.196","TCP","1514","443  >  64932 [ACK] Seq=47829 Ack=2835 Win=15 Len=1448 TSval=2675444315 TSecr=34897776 [TCP segment of a reassembled PDU]"
"66","2.712242","104.16.133.27","100.86.171.196","TLSv1.2","267","Application Data"
"67","2.712243","104.16.133.27","100.86.171.196","TLSv1.2","98","Application Data"
"68","2.712243","104.16.133.27","100.86.171.196","TLSv1.2","97","Application Data"
"69","2.712243","104.16.133.27","100.86.171.196","TCP","97","[TCP Retransmission] 443  >  64932 [PSH, ACK] Seq=49510 Ack=2835 Win=15 Len=31 TSval=2675444360 TSecr=34897776"
"70","2.712257","100.86.171.196","104.16.133.27","TCP","66","64932  >  443 [ACK] Seq=2835 Ack=45269 Win=12436 Len=0 TSval=34898664 TSecr=2675444314"
"71","2.712274","100.86.171.196","104.16.133.27","TCP","66","64932  >  443 [ACK] Seq=2835 Ack=49541 Win=12369 Len=0 TSval=34898664 TSecr=2675444315"
"72","2.712287","100.86.171.196","104.16.133.27","TCP","78","[TCP Dup ACK 71#1] 64932  >  443 [ACK] Seq=2835 Ack=49541 Win=12369 Len=0 TSval=34898664 TSecr=2675444360 SLE=49510 SRE=49541"
"73","2.714488","100.86.171.196","104.16.133.27","TCP","66","[TCP Window Update] 64932  >  443 [ACK] Seq=2835 Ack=49541 Win=12436 Len=0 TSval=34898667 TSecr=2675444360"
"74","2.844693","100.86.171.196","104.16.133.27","TCP","1454","64932  >  443 [ACK] Seq=2835 Ack=49541 Win=12436 Len=1388 TSval=34898797 TSecr=2675444360 [TCP segment of a reassembled PDU]"
"75","2.844695","100.86.171.196","104.16.133.27","TCP","1454","64932  >  443 [ACK] Seq=4223 Ack=49541 Win=12436 Len=1388 TSval=34898797 TSecr=2675444360 [TCP segment of a reassembled PDU]"
"76","2.844771","100.86.171.196","104.16.133.27","TLSv1.2","145","Application Data"
"77","2.853921","100.86.171.196","104.16.133.27","TCP","1454","64932  >  443 [ACK] Seq=5690 Ack=49541 Win=12436 Len=1388 TSval=34898806 TSecr=2675444360 [TCP segment of a reassembled PDU]"
"78","2.853923","100.86.171.196","104.16.133.27","TCP","1454","64932  >  443 [ACK] Seq=7078 Ack=49541 Win=12436 Len=1388 TSval=34898806 TSecr=2675444360 [TCP segment of a reassembled PDU]"
"79","2.853951","100.86.171.196","104.16.133.27","TLSv1.2","146","Application Data"
"80","2.860530","100.86.171.196","104.16.133.27","TCP","1454","64932  >  443 [ACK] Seq=8546 Ack=49541 Win=12436 Len=1388 TSval=34898813 TSecr=2675444360 [TCP segment of a reassembled PDU]"
"81","2.860534","100.86.171.196","104.16.133.27","TCP","1454","64932  >  443 [ACK] Seq=9934 Ack=49541 Win=12436 Len=1388 TSval=34898813 TSecr=2675444360 [TCP segment of a reassembled PDU]"
"82","2.860823","100.86.171.196","104.16.133.27","TLSv1.2","146","Application Data"
"83","2.862751","104.16.133.27","100.86.171.196","TCP","66","443  >  64932 [ACK] Seq=49541 Ack=5690 Win=15 Len=0 TSval=2675444523 TSecr=34898797"
"84","2.863774","100.86.171.196","104.16.133.27","TCP","1454","64932  >  443 [ACK] Seq=11402 Ack=49541 Win=12436 Len=1388 TSval=34898815 TSecr=2675444523 [TCP segment of a reassembled PDU]"
"85","2.863777","100.86.171.196","104.16.133.27","TCP","1454","64932  >  443 [ACK] Seq=12790 Ack=49541 Win=12436 Len=1388 TSval=34898815 TSecr=2675444523 [TCP segment of a reassembled PDU]"
"86","2.863830","100.86.171.196","104.16.133.27","TLSv1.2","146","Application Data"
"87","2.868067","100.86.171.196","104.16.133.27","TCP","1454","64932  >  443 [ACK] Seq=14258 Ack=49541 Win=12436 Len=1388 TSval=34898821 TSecr=2675444523 [TCP segment of a reassembled PDU]"
"88","2.868084","100.86.171.196","104.16.133.27","TCP","1454","64932  >  443 [ACK] Seq=15646 Ack=49541 Win=12436 Len=1388 TSval=34898821 TSecr=2675444523 [TCP segment of a reassembled PDU]"
"89","2.868143","100.86.171.196","104.16.133.27","TLSv1.2","146","Application Data"
"90","2.872184","100.86.171.196","104.16.133.27","TCP","1454","64932  >  443 [ACK] Seq=17114 Ack=49541 Win=12436 Len=1388 TSval=34898824 TSecr=2675444523 [TCP segment of a reassembled PDU]"
"91","2.872187","100.86.171.196","104.16.133.27","TCP","1454","64932  >  443 [ACK] Seq=18502 Ack=49541 Win=12436 Len=1388 TSval=34898824 TSecr=2675444523 [TCP segment of a reassembled PDU]"
"92","2.872217","100.86.171.196","104.16.133.27","TLSv1.2","146","Application Data"
"93","2.876398","100.86.171.196","104.16.133.27","TCP","1454","64932  >  443 [ACK] Seq=19970 Ack=49541 Win=12436 Len=1388 TSval=34898829 TSecr=2675444523 [TCP segment of a reassembled PDU]"
"94","2.876402","100.86.171.196","104.16.133.27","TCP","1454","64932  >  443 [ACK] Seq=21358 Ack=49541 Win=12436 Len=1388 TSval=34898829 TSecr=2675444523 [TCP segment of a reassembled PDU]"
"95","2.876434","100.86.171.196","104.16.133.27","TLSv1.2","145","Application Data"
"96","2.880253","104.16.133.27","100.86.171.196","TCP","66","443  >  64932 [ACK] Seq=49541 Ack=8546 Win=15 Len=0 TSval=2675444532 TSecr=34898806"
"97","2.881288","100.86.171.196","104.16.133.27","TCP","1454","64932  >  443 [ACK] Seq=22825 Ack=49541 Win=12436 Len=1388 TSval=34898833 TSecr=2675444532 [TCP segment of a reassembled PDU]"
"98","2.881290","100.86.171.196","104.16.133.27","TCP","1454","64932  >  443 [ACK] Seq=24213 Ack=49541 Win=12436 Len=1388 TSval=34898833 TSecr=2675444532 [TCP segment of a reassembled PDU]"
"99","2.881310","100.86.171.196","104.16.133.27","TLSv1.2","146","Application Data"
"100","2.885358","100.86.171.196","104.16.133.27","TCP","1454","64932  >  443 [ACK] Seq=25681 Ack=49541 Win=12436 Len=1388 TSval=34898838 TSecr=2675444532 [TCP segment of a reassembled PDU]"
"101","2.885363","100.86.171.196","104.16.133.27","TCP","1454","64932  >  443 [ACK] Seq=27069 Ack=49541 Win=12436 Len=1388 TSval=34898838 TSecr=2675444532 [TCP segment of a reassembled PDU]"
"102","2.885395","100.86.171.196","104.16.133.27","TLSv1.2","146","Application Data"
"103","2.889476","100.86.171.196","104.16.133.27","TCP","1454","64932  >  443 [ACK] Seq=28537 Ack=49541 Win=12436 Len=1388 TSval=34898842 TSecr=2675444532 [TCP segment of a reassembled PDU]"
"104","2.889478","100.86.171.196","104.16.133.27","TCP","1454","64932  >  443 [ACK] Seq=29925 Ack=49541 Win=12436 Len=1388 TSval=34898842 TSecr=2675444532 [TCP segment of a reassembled PDU]"
"105","2.889499","100.86.171.196","104.16.133.27","TLSv1.2","150","Application Data"
"106","2.894283","100.86.171.196","104.16.133.27","TCP","1454","64932  >  443 [ACK] Seq=31397 Ack=49541 Win=12436 Len=1388 TSval=34898847 TSecr=2675444532 [TCP segment of a reassembled PDU]"
"107","2.894285","100.86.171.196","104.16.133.27","TCP","1454","64932  >  443 [ACK] Seq=32785 Ack=49541 Win=12436 Len=1388 TSval=34898847 TSecr=2675444532 [TCP segment of a reassembled PDU]"
"108","2.894311","100.86.171.196","104.16.133.27","TLSv1.2","146","Application Data"
"109","2.895207","104.16.133.27","100.86.171.196","TCP","66","443  >  64932 [ACK] Seq=49541 Ack=9934 Win=15 Len=0 TSval=2675444555 TSecr=34898813"
"110","2.895208","104.16.133.27","100.86.171.196","TCP","66","443  >  64932 [ACK] Seq=49541 Ack=14258 Win=15 Len=0 TSval=2675444555 TSecr=34898815"
"111","2.895209","104.16.133.27","100.86.171.196","TCP","66","443  >  64932 [ACK] Seq=49541 Ack=19970 Win=15 Len=0 TSval=2675444555 TSecr=34898824"
"112","2.895209","104.16.133.27","100.86.171.196","TCP","66","443  >  64932 [ACK] Seq=49541 Ack=21358 Win=15 Len=0 TSval=2675444556 TSecr=34898829"
"113","2.895209","104.16.133.27","100.86.171.196","TCP","66","443  >  64932 [ACK] Seq=49541 Ack=22825 Win=15 Len=0 TSval=2675444556 TSecr=34898829"
"114","2.897824","104.16.133.27","100.86.171.196","TLSv1.2","254","Application Data"
"115","2.897825","104.16.133.27","100.86.171.196","TCP","1514","443  >  64932 [ACK] Seq=49729 Ack=22825 Win=15 Len=1448 TSval=2675444558 TSecr=34898829 [TCP segment of a reassembled PDU]"
"116","2.897826","104.16.133.27","100.86.171.196","TLSv1.2","960","Application Data"
"117","2.897827","104.16.133.27","100.86.171.196","TLSv1.2","97","Application Data"
"118","2.897921","100.86.171.196","104.16.133.27","TCP","66","64932  >  443 [ACK] Seq=34253 Ack=52102 Win=12396 Len=0 TSval=34898850 TSecr=2675444558"
"119","2.899538","104.16.133.27","100.86.171.196","TCP","66","443  >  64932 [ACK] Seq=52102 Ack=25601 Win=15 Len=0 TSval=2675444560 TSecr=34898833"
"120","2.907166","104.16.133.27","100.86.171.196","TCP","66","443  >  64932 [ACK] Seq=52102 Ack=28457 Win=15 Len=0 TSval=2675444564 TSecr=34898833"
"121","2.907167","104.16.133.27","100.86.171.196","TCP","66","443  >  64932 [ACK] Seq=52102 Ack=31313 Win=15 Len=0 TSval=2675444568 TSecr=34898838"
"122","2.911510","104.16.133.27","100.86.171.196","TCP","66","443  >  64932 [ACK] Seq=52102 Ack=32785 Win=15 Len=0 TSval=2675444572 TSecr=34898842"
"123","2.911512","104.16.133.27","100.86.171.196","TCP","66","443  >  64932 [ACK] Seq=52102 Ack=34253 Win=16 Len=0 TSval=2675444572 TSecr=34898847"
"124","2.923198","104.16.133.27","100.86.171.196","TLSv1.2","168","Application Data"
"125","2.923199","104.16.133.27","100.86.171.196","TLSv1.2","98","Application Data"
"126","2.923199","104.16.133.27","100.86.171.196","TLSv1.2","151","Application Data"
"127","2.923200","104.16.133.27","100.86.171.196","TCP","1514","443  >  64932 [ACK] Seq=52321 Ack=34253 Win=16 Len=1448 TSval=2675444583 TSecr=34898850 [TCP segment of a reassembled PDU]"
"128","2.923201","104.16.133.27","100.86.171.196","TCP","1514","443  >  64932 [ACK] Seq=53769 Ack=34253 Win=16 Len=1448 TSval=2675444583 TSecr=34898850 [TCP segment of a reassembled PDU]"
"129","2.923287","100.86.171.196","104.16.133.27","TCP","66","64932  >  443 [ACK] Seq=34253 Ack=55217 Win=12387 Len=0 TSval=34898876 TSecr=2675444583"
"131","2.923950","100.86.171.196","104.16.133.27","TCP","66","[TCP Window Update] 64932  >  443 [ACK] Seq=34253 Ack=55217 Win=12436 Len=0 TSval=34898876 TSecr=2675444583"
"132","2.925001","104.16.133.27","100.86.171.196","TLSv1.2","635","Application Data"
"133","2.925001","104.16.133.27","100.86.171.196","TCP","1514","443  >  64932 [ACK] Seq=55786 Ack=34253 Win=16 Len=1448 TSval=2675444584 TSecr=34898850 [TCP segment of a reassembled PDU]"
"134","2.925002","104.16.133.27","100.86.171.196","TLSv1.2","305","Application Data"
"135","2.925003","104.16.133.27","100.86.171.196","TLSv1.2","97","Application Data"
"136","2.925003","104.16.133.27","100.86.171.196","TLSv1.2","158","Application Data"
"137","2.925003","104.16.133.27","100.86.171.196","TCP","1514","443  >  64932 [ACK] Seq=57596 Ack=34253 Win=16 Len=1448 TSval=2675444584 TSecr=34898850 [TCP segment of a reassembled PDU]"
"138","2.925004","104.16.133.27","100.86.171.196","TCP","1514","443  >  64932 [ACK] Seq=59044 Ack=34253 Win=16 Len=1448 TSval=2675444584 TSecr=34898850 [TCP segment of a reassembled PDU]"
"139","2.925005","104.16.133.27","100.86.171.196","TLSv1.2","793","Application Data"
"140","2.925006","104.16.133.27","100.86.171.196","TLSv1.2","97","Application Data"
"141","2.925006","104.16.133.27","100.86.171.196","TCP","1514","443  >  64932 [ACK] Seq=61250 Ack=34253 Win=16 Len=1448 TSval=2675444584 TSecr=34898850 [TCP segment of a reassembled PDU]"
"142","2.925038","100.86.171.196","104.16.133.27","TCP","66","64932  >  443 [ACK] Seq=34253 Ack=62698 Win=12319 Len=0 TSval=34898878 TSecr=2675444584"
"143","2.925098","100.86.171.196","104.16.133.27","TCP","66","[TCP Window Update] 64932  >  443 [ACK] Seq=34253 Ack=62698 Win=12436 Len=0 TSval=34898878 TSecr=2675444584"
"144","2.926805","104.16.133.27","100.86.171.196","TCP","1514","443  >  64932 [ACK] Seq=62698 Ack=34253 Win=16 Len=1448 TSval=2675444584 TSecr=34898850 [TCP segment of a reassembled PDU]"
"145","2.926806","104.16.133.27","100.86.171.196","TCP","1514","443  >  64932 [ACK] Seq=64146 Ack=34253 Win=16 Len=1448 TSval=2675444584 TSecr=34898850 [TCP segment of a reassembled PDU]"
"146","2.926807","104.16.133.27","100.86.171.196","TCP","1514","443  >  64932 [ACK] Seq=65594 Ack=34253 Win=16 Len=1448 TSval=2675444584 TSecr=34898850 [TCP segment of a reassembled PDU]"
"147","2.926808","104.16.133.27","100.86.171.196","TCP","1514","443  >  64932 [ACK] Seq=67042 Ack=34253 Win=16 Len=1448 TSval=2675444584 TSecr=34898850 [TCP segment of a reassembled PDU]"
"148","2.926809","104.16.133.27","100.86.171.196","TLSv1.2","943","Application Data"
"149","2.926809","104.16.133.27","100.86.171.196","TLSv1.2","145","Application Data"
"150","2.926810","104.16.133.27","100.86.171.196","TCP","1514","443  >  64932 [ACK] Seq=69446 Ack=34253 Win=16 Len=1448 TSval=2675444585 TSecr=34898850 [TCP segment of a reassembled PDU]"
"151","2.926810","104.16.133.27","100.86.171.196","TCP","741","[TCP Previous segment not captured] 443  >  64932 [PSH, ACK] Seq=72342 Ack=34253 Win=16 Len=675 TSval=2675444585 TSecr=34898850 [TCP segment of a reassembled PDU]"
"152","2.926811","104.16.133.27","100.86.171.196","TLSv1.2","183","Application Data"
"153","2.926811","104.16.133.27","100.86.171.196","TLSv1.2","97","Application Data"
"154","2.926812","104.16.133.27","100.86.171.196","TCP","1514","443  >  64932 [ACK] Seq=73165 Ack=34253 Win=16 Len=1448 TSval=2675444585 TSecr=34898850 [TCP segment of a reassembled PDU]"
"155","2.926812","104.16.133.27","100.86.171.196","TCP","1514","443  >  64932 [ACK] Seq=74613 Ack=34253 Win=16 Len=1448 TSval=2675444585 TSecr=34898850 [TCP segment of a reassembled PDU]"
"156","2.926813","104.16.133.27","100.86.171.196","TCP","1514","443  >  64932 [ACK] Seq=76061 Ack=34253 Win=16 Len=1448 TSval=2675444585 TSecr=34898850 [TCP segment of a reassembled PDU]"
"157","2.926814","104.16.133.27","100.86.171.196","TLSv1.2","76","Application Data"
"158","2.926848","100.86.171.196","104.16.133.27","TCP","66","64932  >  443 [ACK] Seq=34253 Ack=70894 Win=12308 Len=0 TSval=34898879 TSecr=2675444585"
"159","2.926883","100.86.171.196","104.16.133.27","TCP","78","[TCP Dup ACK 158#1] 64932  >  443 [ACK] Seq=34253 Ack=70894 Win=12308 Len=0 TSval=34898879 TSecr=2675444585 SLE=72342 SRE=77519"
"160","2.926916","100.86.171.196","104.16.133.27","TCP","78","[TCP Window Update] 64932  >  443 [ACK] Seq=34253 Ack=70894 Win=12436 Len=0 TSval=34898879 TSecr=2675444585 SLE=72342 SRE=77519"
"161","2.927393","104.16.133.27","100.86.171.196","TLSv1.2","97","Application Data"
"162","2.927418","100.86.171.196","104.16.133.27","TCP","78","[TCP Dup ACK 158#2] 64932  >  443 [ACK] Seq=34253 Ack=70894 Win=12436 Len=0 TSval=34898879 TSecr=2675444585 SLE=72342 SRE=77550"
"163","2.930889","104.16.133.27","100.86.171.196","TLSv1.2","150","Application Data"
"164","2.930890","104.16.133.27","100.86.171.196","TCP","1514","443  >  64932 [ACK] Seq=77634 Ack=34253 Win=16 Len=1448 TSval=2675444589 TSecr=34898850 [TCP segment of a reassembled PDU]"
"165","2.930892","104.16.133.27","100.86.171.196","TCP","1514","443  >  64932 [ACK] Seq=79082 Ack=34253 Win=16 Len=1448 TSval=2675444589 TSecr=34898850 [TCP segment of a reassembled PDU]"
"166","2.930971","100.86.171.196","104.16.133.27","TCP","78","[TCP Dup ACK 158#3] 64932  >  443 [ACK] Seq=34253 Ack=70894 Win=12436 Len=0 TSval=34898884 TSecr=2675444585 SLE=72342 SRE=80530"
"168","2.935628","104.16.133.27","100.86.171.196","TLSv1.2","638","Application Data"
"169","2.935629","104.16.133.27","100.86.171.196","TCP","1514","443  >  64932 [ACK] Seq=81102 Ack=34253 Win=16 Len=1448 TSval=2675444590 TSecr=34898850 [TCP segment of a reassembled PDU]"
"170","2.935630","104.16.133.27","100.86.171.196","TCP","1514","443  >  64932 [ACK] Seq=82550 Ack=34253 Win=16 Len=1448 TSval=2675444590 TSecr=34898850 [TCP segment of a reassembled PDU]"
"171","2.935631","104.16.133.27","100.86.171.196","TLSv1.2","1506","Application Data"
"172","2.935632","104.16.133.27","100.86.171.196","TCP","1514","443  >  64932 [ACK] Seq=85438 Ack=34253 Win=16 Len=1448 TSval=2675444590 TSecr=34898850 [TCP segment of a reassembled PDU]"
"173","2.935633","104.16.133.27","100.86.171.196","TLSv1.2","260","Application Data"
"174","2.935633","104.16.133.27","100.86.171.196","TLSv1.2","98","Application Data"
"175","2.935633","104.16.133.27","100.86.171.196","TLSv1.2","97","Application Data"
"176","2.935634","104.16.133.27","100.86.171.196","TLSv1.2","145","Application Data"
"177","2.935634","104.16.133.27","100.86.171.196","TCP","1514","443  >  64932 [ACK] Seq=87222 Ack=34253 Win=16 Len=1448 TSval=2675444592 TSecr=34898850 [TCP segment of a reassembled PDU]"
"178","2.935635","104.16.133.27","100.86.171.196","TCP","1514","443  >  64932 [ACK] Seq=88670 Ack=34253 Win=16 Len=1448 TSval=2675444592 TSecr=34898850 [TCP segment of a reassembled PDU]"
"179","2.935635","104.16.133.27","100.86.171.196","TLSv1.2","622","Application Data"
"180","2.935636","104.16.133.27","100.86.171.196","TCP","1514","443  >  64932 [ACK] Seq=90674 Ack=34253 Win=16 Len=1448 TSval=2675444592 TSecr=34898850 [TCP segment of a reassembled PDU]"
"181","2.935637","104.16.133.27","100.86.171.196","TCP","1514","443  >  64932 [ACK] Seq=92122 Ack=34253 Win=16 Len=1448 TSval=2675444592 TSecr=34898850 [TCP segment of a reassembled PDU]"
"182","2.935637","104.16.133.27","100.86.171.196","TLSv1.2","1471","Application Data"
"183","2.935638","104.16.133.27","100.86.171.196","TLSv1.2","416","Application Data"
"184","2.935639","104.16.133.27","100.86.171.196","TLSv1.2","98","Application Data"
"185","2.935639","104.16.133.27","100.86.171.196","TLSv1.2","97","Application Data"
"186","2.935640","104.16.133.27","100.86.171.196","TLSv1.2","187","Application Data"
"187","2.935640","104.16.133.27","100.86.171.196","TCP","1514","443  >  64932 [ACK] Seq=95509 Ack=34253 Win=16 Len=1448 TSval=2675444593 TSecr=34898850 [TCP segment of a reassembled PDU]"
"188","2.935641","104.16.133.27","100.86.171.196","TLSv1.2","278","Application Data"
"189","2.935641","104.16.133.27","100.86.171.196","TLSv1.2","174","Application Data"
"190","2.935642","104.16.133.27","100.86.171.196","TLSv1.2","1452","[TCP Previous segment not captured] , Ignored Unknown Record"
"191","2.935643","104.16.133.27","100.86.171.196","TCP","1514","443  >  64932 [ACK] Seq=100111 Ack=34253 Win=16 Len=1448 TSval=2675444593 TSecr=34898850 [TCP segment of a reassembled PDU]"
"192","2.935643","104.16.133.27","100.86.171.196","TCP","1514","443  >  64932 [ACK] Seq=101559 Ack=34253 Win=16 Len=1448 TSval=2675444593 TSecr=34898850 [TCP segment of a reassembled PDU]"
"193","2.935644","104.16.133.27","100.86.171.196","TLSv1.2","1086","Application Data"
"194","2.935645","104.16.133.27","100.86.171.196","TLSv1.2","98","Application Data"
"195","2.935645","104.16.133.27","100.86.171.196","TLSv1.2","97","Application Data"
"196","2.935646","104.16.133.27","100.86.171.196","TLSv1.2","98","Application Data"
"197","2.935646","104.16.133.27","100.86.171.196","TLSv1.2","97","Application Data"
"198","2.935694","100.86.171.196","104.16.133.27","TCP","78","[TCP Dup ACK 158#4] 64932  >  443 [ACK] Seq=34253 Ack=70894 Win=12436 Len=0 TSval=34898887 TSecr=2675444585 SLE=72342 SRE=95509"
"199","2.935712","100.86.171.196","104.16.133.27","TCP","78","[TCP Dup ACK 158#5] 64932  >  443 [ACK] Seq=34253 Ack=70894 Win=12436 Len=0 TSval=34898887 TSecr=2675444585 SLE=72342 SRE=97277"
"200","2.935724","100.86.171.196","104.16.133.27","TCP","86","[TCP Dup ACK 158#6] 64932  >  443 [ACK] Seq=34253 Ack=70894 Win=12436 Len=0 TSval=34898887 TSecr=2675444585 SLE=98725 SRE=104153 SLE=72342 SRE=97277"
"201","2.937758","104.16.133.27","100.86.171.196","TLSv1.2","144","Application Data"
"202","2.937759","104.16.133.27","100.86.171.196","TLSv1.2","375","Application Data"
"203","2.937759","104.16.133.27","100.86.171.196","TLSv1.2","97","Application Data"
"204","2.937760","104.16.133.27","100.86.171.196","TLSv1.2","189","Application Data"
"205","2.937784","100.86.171.196","104.16.133.27","TCP","86","[TCP Dup ACK 158#7] 64932  >  443 [ACK] Seq=34253 Ack=70894 Win=12436 Len=0 TSval=34898890 TSecr=2675444585 SLE=98725 SRE=104694 SLE=72342 SRE=97277"
"206","2.939328","104.16.133.27","100.86.171.196","TCP","1514","443  >  64932 [ACK] Seq=104694 Ack=34253 Win=16 Len=1448 TSval=2675444599 TSecr=34898850 [TCP segment of a reassembled PDU]"
"207","2.939329","104.16.133.27","100.86.171.196","TCP","1514","443  >  64932 [ACK] Seq=106142 Ack=34253 Win=16 Len=1448 TSval=2675444599 TSecr=34898850 [TCP segment of a reassembled PDU]"
"208","2.939330","104.16.133.27","100.86.171.196","TLSv1.2","1171","Application Data"
"209","2.939331","104.16.133.27","100.86.171.196","TLSv1.2","97","Application Data"
"210","2.939391","100.86.171.196","104.16.133.27","TCP","86","[TCP Dup ACK 158#8] 64932  >  443 [ACK] Seq=34253 Ack=70894 Win=12436 Len=0 TSval=34898892 TSecr=2675444585 SLE=98725 SRE=108726 SLE=72342 SRE=97277"
"213","2.948610","104.16.133.27","100.86.171.196","TLSv1.2","1514","[TCP Fast Retransmission] , Application Data"
"214","2.948708","100.86.171.196","104.16.133.27","TCP","78","64932  >  443 [ACK] Seq=34253 Ack=97277 Win=12024 Len=0 TSval=34898901 TSecr=2675444609 SLE=98725 SRE=108726"
"216","2.948858","100.86.171.196","104.16.133.27","TCP","78","[TCP Window Update] 64932  >  443 [ACK] Seq=34253 Ack=97277 Win=12436 Len=0 TSval=34898901 TSecr=2675444609 SLE=98725 SRE=108726"
"218","2.956550","104.16.133.27","100.86.171.196","TCP","1514","[TCP Retransmission] 443  >  64932 [ACK] Seq=97277 Ack=34253 Win=16 Len=1448 TSval=2675444617 TSecr=34898890"
"219","2.956634","100.86.171.196","104.16.133.27","TCP","66","64932  >  443 [ACK] Seq=34253 Ack=108726 Win=12257 Len=0 TSval=34898909 TSecr=2675444617"
"220","2.956724","100.86.171.196","104.16.133.27","TCP","66","[TCP Window Update] 64932  >  443 [ACK] Seq=34253 Ack=108726 Win=12436 Len=0 TSval=34898909 TSecr=2675444617"
"222","2.961568","100.86.171.196","104.16.133.27","TCP","1454","64932  >  443 [ACK] Seq=34253 Ack=108726 Win=12436 Len=1388 TSval=34898914 TSecr=2675444617 [TCP segment of a reassembled PDU]"
"223","2.961570","100.86.171.196","104.16.133.27","TCP","1454","64932  >  443 [ACK] Seq=35641 Ack=108726 Win=12436 Len=1388 TSval=34898914 TSecr=2675444617 [TCP segment of a reassembled PDU]"
"224","2.961596","100.86.171.196","104.16.133.27","TLSv1.2","128","Application Data"
"281","2.978679","104.16.133.27","100.86.171.196","TCP","66","443  >  64932 [ACK] Seq=108726 Ack=37029 Win=16 Len=0 TSval=2675444639 TSecr=34898914"
"331","3.008370","100.86.171.196","104.16.133.27","TCP","128","[TCP Retransmission] 64932  >  443 [PSH, ACK] Seq=37029 Ack=108726 Win=12436 Len=62 TSval=34898961 TSecr=2675444639 [TCP segment of a reassembled PDU]"
"332","3.020320","104.16.133.27","100.86.171.196","TCP","66","443  >  64932 [ACK] Seq=108726 Ack=37091 Win=16 Len=0 TSval=2675444681 TSecr=34898914"
"333","3.025840","104.16.133.27","100.86.171.196","TCP","78","[TCP Dup ACK 332#1] 443  >  64932 [ACK] Seq=108726 Ack=37091 Win=16 Len=0 TSval=2675444686 TSecr=34898961 SLE=37029 SRE=37091"
"334","3.071906","104.16.133.27","100.86.171.196","TLSv1.2","871","Application Data"
"335","3.071907","104.16.133.27","100.86.171.196","TLSv1.2","868","Application Data"
"336","3.071908","104.16.133.27","100.86.171.196","TLSv1.2","97","Application Data"
"337","3.072001","100.86.171.196","104.16.133.27","TCP","66","64932  >  443 [ACK] Seq=37091 Ack=109531 Win=12423 Len=0 TSval=34899025 TSecr=2675444732"
"338","3.072043","100.86.171.196","104.16.133.27","TCP","66","64932  >  443 [ACK] Seq=37091 Ack=110364 Win=12410 Len=0 TSval=34899025 TSecr=2675444732"
"434","3.930372","100.86.171.196","104.16.133.27","TLSv1.2","125","Application Data"
"446","3.950196","104.16.133.27","100.86.171.196","TCP","66","443  >  64937 [ACK] Seq=1 Ack=60 Win=24 Len=0 TSval=1601614466 TSecr=1548906049"
"457","3.991249","104.16.133.27","100.86.171.196","TLSv1.2","457","Application Data"
"458","3.991337","100.86.171.196","104.16.133.27","TCP","66","64937  >  443 [ACK] Seq=60 Ack=392 Win=2041 Len=0 TSval=1548906110 TSecr=1601614510"
"459","3.993176","100.86.171.196","104.16.133.27","TLSv1.2","139","Application Data"
"460","3.993403","100.86.171.196","104.16.133.27","TLSv1.2","1261","Application Data"
"461","4.010346","104.16.133.27","100.86.171.196","TCP","66","443  >  64937 [ACK] Seq=392 Ack=133 Win=24 Len=0 TSval=1601614529 TSecr=1548906112"
"462","4.011612","104.16.133.27","100.86.171.196","TCP","66","443  >  64937 [ACK] Seq=392 Ack=1328 Win=24 Len=0 TSval=1601614531 TSecr=1548906112"
"463","4.042588","100.86.171.196","104.16.133.27","TCP","1454","64932  >  443 [ACK] Seq=37091 Ack=110364 Win=12436 Len=1388 TSval=34899995 TSecr=2675444732 [TCP segment of a reassembled PDU]"
"464","4.042591","100.86.171.196","104.16.133.27","TCP","1454","64932  >  443 [ACK] Seq=38479 Ack=110364 Win=12436 Len=1388 TSval=34899995 TSecr=2675444732 [TCP segment of a reassembled PDU]"
"465","4.042649","100.86.171.196","104.16.133.27","TLSv1.2","132","Application Data"
"466","4.052209","104.16.133.27","100.86.171.196","TLSv1.2","254","Application Data"
"467","4.052210","104.16.133.27","100.86.171.196","TLSv1.2","99","Application Data"
"468","4.052211","104.16.133.27","100.86.171.196","TLSv1.2","97","Application Data"
"469","4.052299","100.86.171.196","104.16.133.27","TCP","66","64937  >  443 [ACK] Seq=1328 Ack=644 Win=2044 Len=0 TSval=1548906171 TSecr=1601614571"
"470","4.060449","104.16.133.27","100.86.171.196","TCP","66","443  >  64932 [ACK] Seq=110364 Ack=38479 Win=16 Len=0 TSval=2675445721 TSecr=34899995"
"471","4.060450","104.16.133.27","100.86.171.196","TCP","66","443  >  64932 [ACK] Seq=110364 Ack=39933 Win=16 Len=0 TSval=2675445721 TSecr=34899995"
"510","4.161839","100.86.171.196","104.16.133.27","TLSv1.2","117","Application Data"
"512","4.162083","100.86.171.196","104.16.133.27","TCP","1454","64937  >  443 [ACK] Seq=1379 Ack=644 Win=2048 Len=1388 TSval=1548906280 TSecr=1601614571 [TCP segment of a reassembled PDU]"
"514","4.162112","100.86.171.196","104.16.133.27","TLSv1.2","388","Application Data"
"523","4.178542","104.16.133.27","100.86.171.196","TCP","66","443  >  64937 [ACK] Seq=644 Ack=1379 Win=24 Len=0 TSval=1601614697 TSecr=1548906280"
"533","4.179895","104.16.133.27","100.86.171.196","TCP","66","443  >  64937 [ACK] Seq=644 Ack=3089 Win=25 Len=0 TSval=1601614699 TSecr=1548906280"
"566","4.226991","104.16.133.27","100.86.171.196","TLSv1.2","482","Application Data"
"567","4.226992","104.16.133.27","100.86.171.196","TLSv1.2","99","Application Data"
"568","4.226993","104.16.133.27","100.86.171.196","TLSv1.2","97","Application Data"
"569","4.227091","100.86.171.196","104.16.133.27","TCP","66","64937  >  443 [ACK] Seq=3089 Ack=1124 Win=2040 Len=0 TSval=1548906346 TSecr=1601614746"
"572","4.255743","104.16.133.27","100.86.171.196","TLSv1.2","819","Application Data"
"573","4.255744","104.16.133.27","100.86.171.196","TLSv1.2","1514","[TCP Previous segment not captured] , Ignored Unknown Record"
"574","4.255745","104.16.133.27","100.86.171.196","TLSv1.2","1514","Ignored Unknown Record"
"575","4.255746","104.16.133.27","100.86.171.196","TLSv1.2","229","Ignored Unknown Record"
"576","4.255820","100.86.171.196","104.16.133.27","TCP","66","64932  >  443 [ACK] Seq=39933 Ack=111117 Win=12424 Len=0 TSval=34900208 TSecr=2675445916"
"577","4.255860","100.86.171.196","104.16.133.27","TCP","78","[TCP Dup ACK 576#1] 64932  >  443 [ACK] Seq=39933 Ack=111117 Win=12424 Len=0 TSval=34900208 TSecr=2675445916 SLE=112565 SRE=115624"
"578","4.256560","104.16.133.27","100.86.171.196","TLSv1.2","98","Application Data"
"579","4.256561","104.16.133.27","100.86.171.196","TLSv1.2","97","Application Data"
"580","4.256631","100.86.171.196","104.16.133.27","TCP","78","[TCP Window Update] 64932  >  443 [ACK] Seq=39933 Ack=111117 Win=12436 Len=0 TSval=34900208 TSecr=2675445916 SLE=112565 SRE=115687"
"584","4.281614","104.16.133.27","100.86.171.196","TCP","1514","[TCP Retransmission] 443  >  64932 [ACK] Seq=111117 Ack=39933 Win=16 Len=1448 TSval=2675445942 TSecr=34900208"
"585","4.281728","100.86.171.196","104.16.133.27","TCP","66","64932  >  443 [ACK] Seq=39933 Ack=115687 Win=12364 Len=0 TSval=34900234 TSecr=2675445942"
"586","4.281819","100.86.171.196","104.16.133.27","TCP","66","[TCP Window Update] 64932  >  443 [ACK] Seq=39933 Ack=115687 Win=12436 Len=0 TSval=34900234 TSecr=2675445942"
"634","4.734416","100.86.171.196","104.16.133.27","TCP","1454","64932  >  443 [ACK] Seq=39933 Ack=115687 Win=12436 Len=1388 TSval=34900687 TSecr=2675445942 [TCP segment of a reassembled PDU]"
"635","4.734441","100.86.171.196","104.16.133.27","TLSv1.2","1176","Application Data"
"637","4.742236","100.86.171.196","104.16.133.27","TCP","1454","64932  >  443 [ACK] Seq=42431 Ack=115687 Win=12436 Len=1388 TSval=34900695 TSecr=2675445942 [TCP segment of a reassembled PDU]"
"638","4.742239","100.86.171.196","104.16.133.27","TCP","1454","64932  >  443 [ACK] Seq=43819 Ack=115687 Win=12436 Len=1388 TSval=34900695 TSecr=2675445942 [TCP segment of a reassembled PDU]"
"639","4.742335","100.86.171.196","104.16.133.27","TLSv1.2","172","Application Data"
"640","4.744993","100.86.171.196","104.16.133.27","TCP","1454","64932  >  443 [ACK] Seq=45313 Ack=115687 Win=12436 Len=1388 TSval=34900698 TSecr=2675445942 [TCP segment of a reassembled PDU]"
"641","4.744994","100.86.171.196","104.16.133.27","TCP","1454","64932  >  443 [ACK] Seq=46701 Ack=115687 Win=12436 Len=1388 TSval=34900698 TSecr=2675445942 [TCP segment of a reassembled PDU]"
"642","4.745018","100.86.171.196","104.16.133.27","TLSv1.2","180","Application Data"
"643","4.749225","100.86.171.196","104.16.133.27","TCP","1454","64932  >  443 [ACK] Seq=48203 Ack=115687 Win=12436 Len=1388 TSval=34900702 TSecr=2675445942 [TCP segment of a reassembled PDU]"
"644","4.749228","100.86.171.196","104.16.133.27","TCP","1454","64932  >  443 [ACK] Seq=49591 Ack=115687 Win=12436 Len=1388 TSval=34900702 TSecr=2675445942 [TCP segment of a reassembled PDU]"
"645","4.749253","100.86.171.196","104.16.133.27","TLSv1.2","166","Application Data"
"646","4.752746","104.16.133.27","100.86.171.196","TCP","66","443  >  64932 [ACK] Seq=115687 Ack=42431 Win=16 Len=0 TSval=2675446412 TSecr=34900687"
"647","4.753338","100.86.171.196","104.16.133.27","TCP","1454","64932  >  443 [ACK] Seq=51079 Ack=115687 Win=12436 Len=1388 TSval=34900705 TSecr=2675446412 [TCP segment of a reassembled PDU]"
"648","4.753340","100.86.171.196","104.16.133.27","TCP","1454","64932  >  443 [ACK] Seq=52467 Ack=115687 Win=12436 Len=1388 TSval=34900705 TSecr=2675446412 [TCP segment of a reassembled PDU]"
"649","4.753366","100.86.171.196","104.16.133.27","TLSv1.2","170","Application Data"
"668","4.760479","104.16.133.27","100.86.171.196","TCP","66","443  >  64932 [ACK] Seq=115687 Ack=45313 Win=16 Len=0 TSval=2675446420 TSecr=34900695"
"677","4.762414","104.16.133.27","100.86.171.196","TCP","66","443  >  64932 [ACK] Seq=115687 Ack=48203 Win=16 Len=0 TSval=2675446423 TSecr=34900698"
"679","4.767076","104.16.133.27","100.86.171.196","TCP","66","443  >  64932 [ACK] Seq=115687 Ack=51079 Win=16 Len=0 TSval=2675446427 TSecr=34900702"
"680","4.771939","104.16.133.27","100.86.171.196","TCP","66","443  >  64932 [ACK] Seq=115687 Ack=53959 Win=16 Len=0 TSval=2675446432 TSecr=34900705"
"697","4.925674","104.16.133.27","100.86.171.196","TLSv1.2","183","Application Data"
"698","4.925676","104.16.133.27","100.86.171.196","TLSv1.2","256","Application Data"
"699","4.925676","104.16.133.27","100.86.171.196","TLSv1.2","98","Application Data"
"700","4.925677","104.16.133.27","100.86.171.196","TLSv1.2","97","Application Data"
"701","4.925774","100.86.171.196","104.16.133.27","TCP","66","64932  >  443 [ACK] Seq=53959 Ack=115804 Win=12434 Len=0 TSval=34900878 TSecr=2675446585"
"702","4.925828","100.86.171.196","104.16.133.27","TCP","66","64932  >  443 [ACK] Seq=53959 Ack=116057 Win=12430 Len=0 TSval=34900878 TSecr=2675446586"
"704","4.935520","104.16.133.27","100.86.171.196","TLSv1.2","152","Application Data"
"705","4.935521","104.16.133.27","100.86.171.196","TLSv1.2","364","Application Data"
"706","4.935522","104.16.133.27","100.86.171.196","TLSv1.2","98","Application Data"
"707","4.935522","104.16.133.27","100.86.171.196","TLSv1.2","97","Application Data"
"708","4.935614","100.86.171.196","104.16.133.27","TCP","66","64932  >  443 [ACK] Seq=53959 Ack=116504 Win=12429 Len=0 TSval=34900888 TSecr=2675446596"
"713","4.958509","104.16.133.27","100.86.171.196","TLSv1.2","154","Application Data"
"714","4.958590","100.86.171.196","104.16.133.27","TCP","66","64932  >  443 [ACK] Seq=53959 Ack=116592 Win=12434 Len=0 TSval=34900911 TSecr=2675446619"
"715","4.960498","104.16.133.27","100.86.171.196","TLSv1.2","337","Application Data"
"716","4.960499","104.16.133.27","100.86.171.196","TLSv1.2","97","Application Data"
"717","4.960500","104.16.133.27","100.86.171.196","TLSv1.2","161","Application Data"
"718","4.960500","104.16.133.27","100.86.171.196","TLSv1.2","139","Application Data"
"719","4.960501","104.16.133.27","100.86.171.196","TLSv1.2","97","Application Data"
"720","4.960552","100.86.171.196","104.16.133.27","TCP","66","64932  >  443 [ACK] Seq=53959 Ack=117093 Win=12428 Len=0 TSval=34900913 TSecr=2675446619"
"721","4.978675","100.86.171.196","104.16.133.27","TCP","1454","64932  >  443 [ACK] Seq=53959 Ack=117093 Win=12436 Len=1388 TSval=34900931 TSecr=2675446619 [TCP segment of a reassembled PDU]"
"722","4.978677","100.86.171.196","104.16.133.27","TCP","1454","64932  >  443 [ACK] Seq=55347 Ack=117093 Win=12436 Len=1388 TSval=34900931 TSecr=2675446619 [TCP segment of a reassembled PDU]"
"723","4.978716","100.86.171.196","104.16.133.27","TLSv1.2","235","Application Data"
"728","4.994970","104.16.133.27","100.86.171.196","TLSv1.2","152","Application Data"
"729","4.995058","100.86.171.196","104.16.133.27","TCP","66","64932  >  443 [ACK] Seq=56904 Ack=117179 Win=12434 Len=0 TSval=34900948 TSecr=2675446655"
"730","4.996650","104.16.133.27","100.86.171.196","TCP","1514","443  >  64932 [ACK] Seq=117179 Ack=53959 Win=16 Len=1448 TSval=2675446656 TSecr=34900913 [TCP segment of a reassembled PDU]"
"731","4.996651","104.16.133.27","100.86.171.196","TLSv1.2","469","Application Data"
"732","4.996652","104.16.133.27","100.86.171.196","TLSv1.2","98","Application Data"
"733","4.996652","104.16.133.27","100.86.171.196","TLSv1.2","97","Application Data"
"734","4.996652","104.16.133.27","100.86.171.196","TCP","66","443  >  64932 [ACK] Seq=119093 Ack=56904 Win=16 Len=0 TSval=2675446656 TSecr=34900931"
"735","4.996740","100.86.171.196","104.16.133.27","TCP","66","64932  >  443 [ACK] Seq=56904 Ack=119093 Win=12406 Len=0 TSval=34900949 TSecr=2675446656"
"745","5.027786","104.16.133.27","100.86.171.196","TLSv1.2","211","Application Data"
"746","5.027787","104.16.133.27","100.86.171.196","TLSv1.2","1185","Application Data"
"747","5.027788","104.16.133.27","100.86.171.196","TLSv1.2","97","Application Data"
"748","5.027880","100.86.171.196","104.16.133.27","TCP","66","64932  >  443 [ACK] Seq=56904 Ack=120388 Win=12416 Len=0 TSval=34900980 TSecr=2675446688"
"749","5.056239","100.86.171.196","104.16.133.27","TCP","1454","64932  >  443 [ACK] Seq=56904 Ack=120388 Win=12436 Len=1388 TSval=34901009 TSecr=2675446688 [TCP segment of a reassembled PDU]"
"750","5.056241","100.86.171.196","104.16.133.27","TCP","1454","64932  >  443 [ACK] Seq=58292 Ack=120388 Win=12436 Len=1388 TSval=34901009 TSecr=2675446688 [TCP segment of a reassembled PDU]"
"751","5.056276","100.86.171.196","104.16.133.27","TLSv1.2","240","Application Data"
"752","5.061887","100.86.171.196","104.16.133.27","TCP","1454","64932  >  443 [ACK] Seq=59854 Ack=120388 Win=12436 Len=1388 TSval=34901014 TSecr=2675446688 [TCP segment of a reassembled PDU]"
"753","5.061890","100.86.171.196","104.16.133.27","TCP","1454","64932  >  443 [ACK] Seq=61242 Ack=120388 Win=12436 Len=1388 TSval=34901014 TSecr=2675446688 [TCP segment of a reassembled PDU]"
"754","5.061911","100.86.171.196","104.16.133.27","TLSv1.2","236","Application Data"
"755","5.067123","100.86.171.196","104.16.133.27","TCP","1454","64932  >  443 [ACK] Seq=62800 Ack=120388 Win=12436 Len=1388 TSval=34901020 TSecr=2675446688 [TCP segment of a reassembled PDU]"
"756","5.067125","100.86.171.196","104.16.133.27","TCP","1454","64932  >  443 [ACK] Seq=64188 Ack=120388 Win=12436 Len=1388 TSval=34901020 TSecr=2675446688 [TCP segment of a reassembled PDU]"
"757","5.067144","100.86.171.196","104.16.133.27","TLSv1.2","242","Application Data"
"758","5.072205","100.86.171.196","104.16.133.27","TCP","1454","64932  >  443 [ACK] Seq=65752 Ack=120388 Win=12436 Len=1388 TSval=34901025 TSecr=2675446688 [TCP segment of a reassembled PDU]"
"759","5.072206","100.86.171.196","104.16.133.27","TCP","1454","64932  >  443 [ACK] Seq=67140 Ack=120388 Win=12436 Len=1388 TSval=34901025 TSecr=2675446688 [TCP segment of a reassembled PDU]"
"760","5.072222","100.86.171.196","104.16.133.27","TLSv1.2","241","Application Data"
"761","5.077518","100.86.171.196","104.16.133.27","TCP","1454","64932  >  443 [ACK] Seq=68703 Ack=120388 Win=12436 Len=1388 TSval=34901030 TSecr=2675446688 [TCP segment of a reassembled PDU]"
"762","5.077520","100.86.171.196","104.16.133.27","TCP","1454","64932  >  443 [ACK] Seq=70091 Ack=120388 Win=12436 Len=1388 TSval=34901030 TSecr=2675446688 [TCP segment of a reassembled PDU]"
"763","5.077538","100.86.171.196","104.16.133.27","TLSv1.2","236","Application Data"
"764","5.078228","104.16.133.27","100.86.171.196","TCP","66","443  >  64932 [ACK] Seq=120388 Ack=59680 Win=16 Len=0 TSval=2675446737 TSecr=34901009"
"765","5.080282","104.16.133.27","100.86.171.196","TCP","66","443  >  64932 [ACK] Seq=120388 Ack=62630 Win=16 Len=0 TSval=2675446740 TSecr=34901009"
"766","5.082581","100.86.171.196","104.16.133.27","TCP","1454","64932  >  443 [ACK] Seq=71649 Ack=120388 Win=12436 Len=1388 TSval=34901035 TSecr=2675446740 [TCP segment of a reassembled PDU]"
"767","5.082583","100.86.171.196","104.16.133.27","TCP","1454","64932  >  443 [ACK] Seq=73037 Ack=120388 Win=12436 Len=1388 TSval=34901035 TSecr=2675446740 [TCP segment of a reassembled PDU]"
"768","5.082600","100.86.171.196","104.16.133.27","TLSv1.2","237","Application Data"
"769","5.084025","104.16.133.27","100.86.171.196","TCP","66","443  >  64932 [ACK] Seq=120388 Ack=65576 Win=16 Len=0 TSval=2675446745 TSecr=34901014"
"770","5.087784","100.86.171.196","104.16.133.27","TCP","1454","64932  >  443 [ACK] Seq=74596 Ack=120388 Win=12436 Len=1388 TSval=34901040 TSecr=2675446745 [TCP segment of a reassembled PDU]"
"771","5.087787","100.86.171.196","104.16.133.27","TCP","1454","64932  >  443 [ACK] Seq=75984 Ack=120388 Win=12436 Len=1388 TSval=34901040 TSecr=2675446745 [TCP segment of a reassembled PDU]"
"772","5.087807","100.86.171.196","104.16.133.27","TLSv1.2","240","Application Data"
"773","5.089189","104.16.133.27","100.86.171.196","TCP","66","443  >  64932 [ACK] Seq=120388 Ack=68528 Win=16 Len=0 TSval=2675446750 TSecr=34901020"
"774","5.094950","104.16.133.27","100.86.171.196","TCP","66","443  >  64932 [ACK] Seq=120388 Ack=71479 Win=16 Len=0 TSval=2675446755 TSecr=34901025"
"775","5.098675","100.86.171.196","104.16.133.27","TCP","1454","64932  >  443 [ACK] Seq=77546 Ack=120388 Win=12436 Len=1388 TSval=34901051 TSecr=2675446755 [TCP segment of a reassembled PDU]"
"776","5.098677","100.86.171.196","104.16.133.27","TCP","1454","64932  >  443 [ACK] Seq=78934 Ack=120388 Win=12436 Len=1388 TSval=34901051 TSecr=2675446755 [TCP segment of a reassembled PDU]"
"777","5.098716","100.86.171.196","104.16.133.27","TLSv1.2","245","Application Data"
"779","5.099376","104.16.133.27","100.86.171.196","TCP","66","443  >  64932 [ACK] Seq=120388 Ack=73037 Win=16 Len=0 TSval=2675446760 TSecr=34901030"
"780","5.099377","104.16.133.27","100.86.171.196","TCP","66","443  >  64932 [ACK] Seq=120388 Ack=74596 Win=16 Len=0 TSval=2675446760 TSecr=34901035"
"781","5.104176","100.86.171.196","104.16.133.27","TCP","1454","64932  >  443 [ACK] Seq=80501 Ack=120388 Win=12436 Len=1388 TSval=34901057 TSecr=2675446760 [TCP segment of a reassembled PDU]"
"782","5.104178","100.86.171.196","104.16.133.27","TCP","1454","64932  >  443 [ACK] Seq=81889 Ack=120388 Win=12436 Len=1388 TSval=34901057 TSecr=2675446760 [TCP segment of a reassembled PDU]"
"783","5.104200","100.86.171.196","104.16.133.27","TLSv1.2","232","Application Data"
"784","5.105061","104.16.133.27","100.86.171.196","TCP","66","443  >  64932 [ACK] Seq=120388 Ack=77372 Win=16 Len=0 TSval=2675446765 TSecr=34901040"
"785","5.112204","104.16.133.27","100.86.171.196","TLSv1.2","203","Application Data"
"786","5.112205","104.16.133.27","100.86.171.196","TLSv1.2","1047","Application Data"
"787","5.112206","104.16.133.27","100.86.171.196","TLSv1.2","98","Application Data"
"788","5.112207","104.16.133.27","100.86.171.196","TLSv1.2","97","Application Data"
"789","5.112300","100.86.171.196","104.16.133.27","TCP","66","64932  >  443 [ACK] Seq=83443 Ack=121569 Win=12417 Len=0 TSval=34901065 TSecr=2675446772"
"790","5.113546","104.16.133.27","100.86.171.196","TLSv1.2","154","Application Data"
"791","5.113547","104.16.133.27","100.86.171.196","TLSv1.2","1099","Application Data"
"792","5.113548","104.16.133.27","100.86.171.196","TLSv1.2","98","Application Data"
"793","5.113548","104.16.133.27","100.86.171.196","TLSv1.2","97","Application Data"
"794","5.113621","100.86.171.196","104.16.133.27","TCP","66","64932  >  443 [ACK] Seq=83443 Ack=122753 Win=12417 Len=0 TSval=34901066 TSecr=2675446774"
"795","5.115431","104.16.133.27","100.86.171.196","TCP","66","443  >  64932 [ACK] Seq=122753 Ack=80322 Win=16 Len=0 TSval=2675446776 TSecr=34901051"
"796","5.119817","104.16.133.27","100.86.171.196","TLSv1.2","154","Application Data"
"797","5.119818","104.16.133.27","100.86.171.196","TCP","1514","443  >  64932 [ACK] Seq=122841 Ack=80501 Win=16 Len=1448 TSval=2675446779 TSecr=34901051 [TCP segment of a reassembled PDU]"
"798","5.119819","104.16.133.27","100.86.171.196","TLSv1.2","197","Application Data"
"799","5.119820","104.16.133.27","100.86.171.196","TLSv1.2","98","Application Data"
"800","5.119820","104.16.133.27","100.86.171.196","TLSv1.2","97","Application Data"
"801","5.119918","100.86.171.196","104.16.133.27","TCP","66","64932  >  443 [ACK] Seq=83443 Ack=124483 Win=12409 Len=0 TSval=34901073 TSecr=2675446779"
"802","5.121850","104.16.133.27","100.86.171.196","TCP","66","443  >  64932 [ACK] Seq=124483 Ack=83277 Win=16 Len=0 TSval=2675446782 TSecr=34901057"
"803","5.124379","104.16.133.27","100.86.171.196","TLSv1.2","153","Application Data"
"804","5.124380","104.16.133.27","100.86.171.196","TLSv1.2","1066","Application Data"
"805","5.124381","104.16.133.27","100.86.171.196","TLSv1.2","98","Application Data"
"806","5.124381","104.16.133.27","100.86.171.196","TLSv1.2","97","Application Data"
"807","5.124471","100.86.171.196","104.16.133.27","TCP","66","64932  >  443 [ACK] Seq=83443 Ack=125633 Win=12418 Len=0 TSval=34901077 TSecr=2675446785"
"808","5.139285","104.16.133.27","100.86.171.196","TLSv1.2","154","Application Data"
"809","5.139286","104.16.133.27","100.86.171.196","TLSv1.2","1037","Application Data"
"810","5.139287","104.16.133.27","100.86.171.196","TLSv1.2","129","Application Data, Application Data"
"811","5.139373","100.86.171.196","104.16.133.27","TCP","66","64932  >  443 [ACK] Seq=83443 Ack=126755 Win=12418 Len=0 TSval=34901092 TSecr=2675446800"
"812","5.141554","104.16.133.27","100.86.171.196","TLSv1.2","154","Application Data"
"813","5.141555","104.16.133.27","100.86.171.196","TCP","1514","443  >  64932 [ACK] Seq=126843 Ack=83443 Win=16 Len=1448 TSval=2675446802 TSecr=34901073 [TCP segment of a reassembled PDU]"
"814","5.141556","104.16.133.27","100.86.171.196","TLSv1.2","426","Application Data"
"815","5.141556","104.16.133.27","100.86.171.196","TLSv1.2","129","Application Data, Application Data"
"816","5.141557","104.16.133.27","100.86.171.196","TLSv1.2","154","Application Data"
"817","5.141557","104.16.133.27","100.86.171.196","TCP","1514","443  >  64932 [ACK] Seq=128802 Ack=83443 Win=16 Len=1448 TSval=2675446802 TSecr=34901073 [TCP segment of a reassembled PDU]"
"818","5.141558","104.16.133.27","100.86.171.196","TLSv1.2","437","Application Data"
"819","5.141559","104.16.133.27","100.86.171.196","TLSv1.2","97","Application Data"
"820","5.141625","100.86.171.196","104.16.133.27","TCP","66","64932  >  443 [ACK] Seq=83443 Ack=130652 Win=12375 Len=0 TSval=34901094 TSecr=2675446802"
"821","5.141693","100.86.171.196","104.16.133.27","TCP","66","[TCP Window Update] 64932  >  443 [ACK] Seq=83443 Ack=130652 Win=12436 Len=0 TSval=34901094 TSecr=2675446802"
"822","5.149328","104.16.133.27","100.86.171.196","TLSv1.2","127","Application Data"
"823","5.149329","104.16.133.27","100.86.171.196","TLSv1.2","1232","Application Data"
"824","5.149330","104.16.133.27","100.86.171.196","TLSv1.2","97","Application Data"
"825","5.149404","100.86.171.196","104.16.133.27","TCP","66","64932  >  443 [ACK] Seq=83443 Ack=131910 Win=12416 Len=0 TSval=34901102 TSecr=2675446810"
"826","5.152858","104.16.133.27","100.86.171.196","TLSv1.2","154","Application Data"
"827","5.152859","104.16.133.27","100.86.171.196","TCP","1514","443  >  64932 [ACK] Seq=131998 Ack=83443 Win=16 Len=1448 TSval=2675446813 TSecr=34901077 [TCP segment of a reassembled PDU]"
"828","5.152859","104.16.133.27","100.86.171.196","TLSv1.2","153","Application Data"
"829","5.152860","104.16.133.27","100.86.171.196","TLSv1.2","129","Application Data, Application Data"
"830","5.152931","100.86.171.196","104.16.133.27","TCP","66","64932  >  443 [ACK] Seq=83443 Ack=133596 Win=12409 Len=0 TSval=34901106 TSecr=2675446813"
"831","5.153649","100.86.171.196","104.16.133.27","TCP","1454","64932  >  443 [ACK] Seq=83443 Ack=133596 Win=12409 Len=1388 TSval=34901106 TSecr=2675446813 [TCP segment of a reassembled PDU]"
"832","5.153650","100.86.171.196","104.16.133.27","TCP","1454","64932  >  443 [ACK] Seq=84831 Ack=133596 Win=12409 Len=1388 TSval=34901106 TSecr=2675446813 [TCP segment of a reassembled PDU]"
"833","5.153668","100.86.171.196","104.16.133.27","TLSv1.2","233","Application Data"
"834","5.171971","104.16.133.27","100.86.171.196","TCP","66","443  >  64932 [ACK] Seq=133596 Ack=86219 Win=16 Len=0 TSval=2675446832 TSecr=34901106"
"835","5.196769","100.86.171.196","104.16.133.27","TCP","233","[TCP Retransmission] 64932  >  443 [PSH, ACK] Seq=86219 Ack=133596 Win=12436 Len=167 TSval=34901149 TSecr=2675446832 [TCP segment of a reassembled PDU]"
"836","5.202456","104.16.133.27","100.86.171.196","TLSv1.2","150","Application Data"
"837","5.202457","104.16.133.27","100.86.171.196","TLSv1.2","1324","Application Data"
"838","5.202458","104.16.133.27","100.86.171.196","TLSv1.2","129","Application Data, Application Data"
"839","5.202576","100.86.171.196","104.16.133.27","TCP","66","64932  >  443 [ACK] Seq=86386 Ack=135001 Win=12414 Len=0 TSval=34901155 TSecr=2675446863"
"840","5.214322","104.16.133.27","100.86.171.196","TCP","78","[TCP Dup ACK 836#1] 443  >  64932 [ACK] Seq=135001 Ack=86386 Win=16 Len=0 TSval=2675446875 TSecr=34901149 SLE=86219 SRE=86386"
"841","5.228847","100.86.171.196","104.16.133.27","TCP","1454","64932  >  443 [ACK] Seq=86386 Ack=135001 Win=12436 Len=1388 TSval=34901181 TSecr=2675446875 [TCP segment of a reassembled PDU]"
"842","5.228848","100.86.171.196","104.16.133.27","TCP","1454","64932  >  443 [ACK] Seq=87774 Ack=135001 Win=12436 Len=1388 TSval=34901181 TSecr=2675446875 [TCP segment of a reassembled PDU]"
"843","5.228873","100.86.171.196","104.16.133.27","TLSv1.2","233","Application Data"
"844","5.242109","100.86.171.196","104.16.133.27","TCP","1454","64932  >  443 [ACK] Seq=89329 Ack=135001 Win=12436 Len=1388 TSval=34901195 TSecr=2675446875 [TCP segment of a reassembled PDU]"
"845","5.242111","100.86.171.196","104.16.133.27","TCP","1454","64932  >  443 [ACK] Seq=90717 Ack=135001 Win=12436 Len=1388 TSval=34901195 TSecr=2675446875 [TCP segment of a reassembled PDU]"
"846","5.242135","100.86.171.196","104.16.133.27","TLSv1.2","238","Application Data"
"847","5.246528","104.16.133.27","100.86.171.196","TCP","66","443  >  64932 [ACK] Seq=135001 Ack=87774 Win=16 Len=0 TSval=2675446906 TSecr=34901181"
"848","5.246529","104.16.133.27","100.86.171.196","TCP","66","443  >  64932 [ACK] Seq=135001 Ack=89162 Win=16 Len=0 TSval=2675446907 TSecr=34901181"
"849","5.246530","104.16.133.27","100.86.171.196","TCP","66","443  >  64932 [ACK] Seq=135001 Ack=89329 Win=16 Len=0 TSval=2675446907 TSecr=34901181"
"850","5.259770","104.16.133.27","100.86.171.196","TCP","66","443  >  64932 [ACK] Seq=135001 Ack=92277 Win=16 Len=0 TSval=2675446920 TSecr=34901195"
"851","5.276104","104.16.133.27","100.86.171.196","TLSv1.2","154","Application Data"
"852","5.276106","104.16.133.27","100.86.171.196","TLSv1.2","1364","Application Data"
"853","5.276107","104.16.133.27","100.86.171.196","TLSv1.2","98","Application Data"
"854","5.276108","104.16.133.27","100.86.171.196","TLSv1.2","97","Application Data"
"855","5.276472","100.86.171.196","104.16.133.27","TCP","66","64932  >  443 [ACK] Seq=92277 Ack=136450 Win=12436 Len=0 TSval=34901229 TSecr=2675446936"
"856","5.297703","104.16.133.27","100.86.171.196","TLSv1.2","150","Application Data"
"857","5.297704","104.16.133.27","100.86.171.196","TLSv1.2","1349","Application Data"
"858","5.297705","104.16.133.27","100.86.171.196","TLSv1.2","97","Application Data"
"859","5.304186","100.86.171.196","104.16.133.27","TCP","66","64932  >  443 [ACK] Seq=92277 Ack=137848 Win=12436 Len=0 TSval=34901257 TSecr=2675446958"
"860","5.402123","100.86.171.196","104.16.133.27","TCP","1454","64932  >  443 [ACK] Seq=92277 Ack=137848 Win=12436 Len=1388 TSval=34901355 TSecr=2675446958 [TCP segment of a reassembled PDU]"
"861","5.402124","100.86.171.196","104.16.133.27","TCP","1454","64932  >  443 [ACK] Seq=93665 Ack=137848 Win=12436 Len=1388 TSval=34901355 TSecr=2675446958 [TCP segment of a reassembled PDU]"
"862","5.402202","100.86.171.196","104.16.133.27","TLSv1.2","239","Application Data"
"863","5.419802","104.16.133.27","100.86.171.196","TCP","66","443  >  64932 [ACK] Seq=137848 Ack=95053 Win=16 Len=0 TSval=2675447080 TSecr=34901355"
"864","5.444492","104.16.133.27","100.86.171.196","TLSv1.2","150","Application Data"
"865","5.444493","104.16.133.27","100.86.171.196","TLSv1.2","1282","Application Data"
"866","5.444493","104.16.133.27","100.86.171.196","TLSv1.2","129","Application Data, Application Data"
"867","5.444588","100.86.171.196","104.16.133.27","TCP","66","64932  >  443 [ACK] Seq=95226 Ack=139211 Win=12415 Len=0 TSval=34901397 TSecr=2675447105"
"880","6.805325","100.86.171.196","104.16.133.27","TLSv1.2","117","Application Data"
"881","6.805662","100.86.171.196","104.16.133.27","TCP","1454","64937  >  443 [ACK] Seq=3140 Ack=1124 Win=2048 Len=1388 TSval=1548908924 TSecr=1601614746 [TCP segment of a reassembled PDU]"
"882","6.805673","100.86.171.196","104.16.133.27","TLSv1.2","1029","Application Data"
"884","6.827236","104.16.133.27","100.86.171.196","TCP","66","443  >  64937 [ACK] Seq=1124 Ack=3140 Win=25 Len=0 TSval=1601617346 TSecr=1548908924"
"885","6.827238","104.16.133.27","100.86.171.196","TCP","66","443  >  64937 [ACK] Seq=1124 Ack=5491 Win=25 Len=0 TSval=1601617346 TSecr=1548908924"
"888","6.874089","104.16.133.27","100.86.171.196","TLSv1.2","458","Application Data"
"889","6.874091","104.16.133.27","100.86.171.196","TLSv1.2","99","Application Data"
"890","6.874092","104.16.133.27","100.86.171.196","TLSv1.2","97","Application Data"
"891","6.874228","100.86.171.196","104.16.133.27","TCP","66","64937  >  443 [ACK] Seq=5491 Ack=1580 Win=2040 Len=0 TSval=1548908993 TSecr=1601617393"
"906","10.592166","100.86.171.196","104.16.133.27","TCP","1454","64932  >  443 [ACK] Seq=95226 Ack=139211 Win=12436 Len=1388 TSval=34906545 TSecr=2675447105 [TCP segment of a reassembled PDU]"
"907","10.592168","100.86.171.196","104.16.133.27","TCP","1454","64932  >  443 [ACK] Seq=96614 Ack=139211 Win=12436 Len=1388 TSval=34906545 TSecr=2675447105 [TCP segment of a reassembled PDU]"
"908","10.592193","100.86.171.196","104.16.133.27","TLSv1.2","137","Application Data"
"910","10.617176","104.16.133.27","100.86.171.196","TCP","66","443  >  64932 [ACK] Seq=139211 Ack=98002 Win=16 Len=0 TSval=2675452278 TSecr=34906545"
"917","10.641286","100.86.171.196","104.16.133.27","TCP","137","[TCP Retransmission] 64932  >  443 [PSH, ACK] Seq=98002 Ack=139211 Win=12436 Len=71 TSval=34906594 TSecr=2675452278 [TCP segment of a reassembled PDU]"
"923","10.659190","104.16.133.27","100.86.171.196","TCP","66","443  >  64932 [ACK] Seq=139211 Ack=98073 Win=16 Len=0 TSval=2675452320 TSecr=34906545"
"924","10.659191","104.16.133.27","100.86.171.196","TCP","78","[TCP Dup ACK 923#1] 443  >  64932 [ACK] Seq=139211 Ack=98073 Win=16 Len=0 TSval=2675452320 TSecr=34906594 SLE=98002 SRE=98073"
"925","10.831519","104.16.133.27","100.86.171.196","TLSv1.2","832","Application Data"
"926","10.831521","104.16.133.27","100.86.171.196","TLSv1.2","121","Application Data"
"927","10.831522","104.16.133.27","100.86.171.196","TLSv1.2","97","Application Data"
"928","10.831669","100.86.171.196","104.16.133.27","TCP","66","64932  >  443 [ACK] Seq=98073 Ack=140063 Win=12423 Len=0 TSval=34906784 TSecr=2675452492"
"929","10.850029","100.86.171.196","104.16.133.27","TCP","1454","64932  >  443 [ACK] Seq=98073 Ack=140063 Win=12436 Len=1388 TSval=34906803 TSecr=2675452492 [TCP segment of a reassembled PDU]"
"930","10.850032","100.86.171.196","104.16.133.27","TCP","1454","64932  >  443 [ACK] Seq=99461 Ack=140063 Win=12436 Len=1388 TSval=34906803 TSecr=2675452492 [TCP segment of a reassembled PDU]"
"931","10.850070","100.86.171.196","104.16.133.27","TLSv1.2","177","Application Data"
"932","10.868083","104.16.133.27","100.86.171.196","TCP","66","443  >  64932 [ACK] Seq=140063 Ack=100960 Win=16 Len=0 TSval=2675452528 TSecr=34906803"
"938","11.173252","104.16.133.27","100.86.171.196","TLSv1.2","403","Application Data"
"939","11.173254","104.16.133.27","100.86.171.196","TCP","1514","443  >  64932 [ACK] Seq=140400 Ack=100960 Win=16 Len=1448 TSval=2675452834 TSecr=34906803 [TCP segment of a reassembled PDU]"
"940","11.173298","104.16.133.27","100.86.171.196","TLSv1.2","1190","Application Data"
"941","11.173383","100.86.171.196","104.16.133.27","TCP","66","64932  >  443 [ACK] Seq=100960 Ack=141848 Win=12408 Len=0 TSval=34907126 TSecr=2675452834"
"942","11.173464","100.86.171.196","104.16.133.27","TCP","66","64932  >  443 [ACK] Seq=100960 Ack=142972 Win=12390 Len=0 TSval=34907126 TSecr=2675452834"
"943","11.173506","100.86.171.196","104.16.133.27","TCP","66","[TCP Window Update] 64932  >  443 [ACK] Seq=100960 Ack=142972 Win=12436 Len=0 TSval=34907126 TSecr=2675452834"
"944","11.174639","104.16.133.27","100.86.171.196","TCP","1514","443  >  64932 [ACK] Seq=142972 Ack=100960 Win=16 Len=1448 TSval=2675452834 TSecr=34906803 [TCP segment of a reassembled PDU]"
"945","11.174640","104.16.133.27","100.86.171.196","TCP","1514","443  >  64932 [ACK] Seq=144420 Ack=100960 Win=16 Len=1448 TSval=2675452834 TSecr=34906803 [TCP segment of a reassembled PDU]"
"946","11.174641","104.16.133.27","100.86.171.196","TLSv1.2","1371","Application Data"
"947","11.174642","104.16.133.27","100.86.171.196","TCP","1514","443  >  64932 [ACK] Seq=147173 Ack=100960 Win=16 Len=1448 TSval=2675452835 TSecr=34906803 [TCP segment of a reassembled PDU]"
"948","11.174644","104.16.133.27","100.86.171.196","TCP","1514","443  >  64932 [ACK] Seq=148621 Ack=100960 Win=16 Len=1448 TSval=2675452835 TSecr=34906803 [TCP segment of a reassembled PDU]"
"949","11.174645","104.16.133.27","100.86.171.196","TLSv1.2","1194","Application Data"
"950","11.174646","104.16.133.27","100.86.171.196","TCP","1514","443  >  64932 [ACK] Seq=151197 Ack=100960 Win=16 Len=1448 TSval=2675452835 TSecr=34906803 [TCP segment of a reassembled PDU]"
"951","11.174647","104.16.133.27","100.86.171.196","TCP","1514","443  >  64932 [ACK] Seq=152645 Ack=100960 Win=16 Len=1448 TSval=2675452835 TSecr=34906803 [TCP segment of a reassembled PDU]"
"952","11.174648","104.16.133.27","100.86.171.196","TLSv1.2","1300","Application Data"
"953","11.174649","104.16.133.27","100.86.171.196","TCP","1514","443  >  64932 [ACK] Seq=155327 Ack=100960 Win=16 Len=1448 TSval=2675452836 TSecr=34906803 [TCP segment of a reassembled PDU]"
"954","11.174712","100.86.171.196","104.16.133.27","TCP","66","64932  >  443 [ACK] Seq=100960 Ack=156775 Win=12220 Len=0 TSval=34907127 TSecr=2675452836"
"955","11.174784","100.86.171.196","104.16.133.27","TCP","66","[TCP Window Update] 64932  >  443 [ACK] Seq=100960 Ack=156775 Win=12436 Len=0 TSval=34907127 TSecr=2675452836"
"956","11.175495","104.16.133.27","100.86.171.196","TCP","1514","443  >  64932 [ACK] Seq=156775 Ack=100960 Win=16 Len=1448 TSval=2675452836 TSecr=34906803 [TCP segment of a reassembled PDU]"
"957","11.175497","104.16.133.27","100.86.171.196","TLSv1.2","1148","Application Data"
"958","11.175498","104.16.133.27","100.86.171.196","TCP","1514","443  >  64932 [ACK] Seq=159305 Ack=100960 Win=16 Len=1448 TSval=2675452836 TSecr=34906803 [TCP segment of a reassembled PDU]"
"959","11.175499","104.16.133.27","100.86.171.196","TCP","1514","443  >  64932 [ACK] Seq=160753 Ack=100960 Win=16 Len=1448 TSval=2675452836 TSecr=34906803 [TCP segment of a reassembled PDU]"
"960","11.175580","100.86.171.196","104.16.133.27","TCP","66","64932  >  443 [ACK] Seq=100960 Ack=162201 Win=12351 Len=0 TSval=34907127 TSecr=2675452836"
"961","11.175641","100.86.171.196","104.16.133.27","TCP","66","[TCP Window Update] 64932  >  443 [ACK] Seq=100960 Ack=162201 Win=12436 Len=0 TSval=34907127 TSecr=2675452836"
"962","11.177463","104.16.133.27","100.86.171.196","TLSv1.2","1234","Application Data"
"963","11.177465","104.16.133.27","100.86.171.196","TCP","1514","443  >  64932 [ACK] Seq=163369 Ack=100960 Win=16 Len=1448 TSval=2675452836 TSecr=34906803 [TCP segment of a reassembled PDU]"
"964","11.177466","104.16.133.27","100.86.171.196","TCP","1514","443  >  64932 [ACK] Seq=164817 Ack=100960 Win=16 Len=1448 TSval=2675452836 TSecr=34906803 [TCP segment of a reassembled PDU]"
"965","11.177467","104.16.133.27","100.86.171.196","TLSv1.2","1356","Application Data"
"966","11.177468","104.16.133.27","100.86.171.196","TCP","1514","443  >  64932 [ACK] Seq=167555 Ack=100960 Win=16 Len=1448 TSval=2675452837 TSecr=34906803 [TCP segment of a reassembled PDU]"
"967","11.177469","104.16.133.27","100.86.171.196","TLSv1.2","1483","Application Data"
"968","11.177470","104.16.133.27","100.86.171.196","TLSv1.2","144","Application Data"
"969","11.177471","104.16.133.27","100.86.171.196","TLSv1.2","1321","Application Data"
"970","11.177472","104.16.133.27","100.86.171.196","TCP","1514","443  >  64932 [ACK] Seq=171753 Ack=100960 Win=16 Len=1448 TSval=2675452838 TSecr=34906803 [TCP segment of a reassembled PDU]"
"971","11.177473","104.16.133.27","100.86.171.196","TCP","1514","443  >  64932 [ACK] Seq=173201 Ack=100960 Win=16 Len=1448 TSval=2675452838 TSecr=34906803 [TCP segment of a reassembled PDU]"
"972","11.177474","104.16.133.27","100.86.171.196","TLSv1.2","249","Application Data"
"973","11.177475","104.16.133.27","100.86.171.196","TCP","1514","443  >  64932 [ACK] Seq=174832 Ack=100960 Win=16 Len=1448 TSval=2675452838 TSecr=34906803 [TCP segment of a reassembled PDU]"
"974","11.177548","100.86.171.196","104.16.133.27","TCP","66","64932  >  443 [ACK] Seq=100960 Ack=176280 Win=12216 Len=0 TSval=34907130 TSecr=2675452838"
"975","11.177615","100.86.171.196","104.16.133.27","TCP","66","[TCP Window Update] 64932  >  443 [ACK] Seq=100960 Ack=176280 Win=12436 Len=0 TSval=34907130 TSecr=2675452838"
"976","11.179470","104.16.133.27","100.86.171.196","TCP","1514","443  >  64932 [ACK] Seq=176280 Ack=100960 Win=16 Len=1448 TSval=2675452838 TSecr=34906803 [TCP segment of a reassembled PDU]"
"977","11.179471","104.16.133.27","100.86.171.196","TLSv1.2","1240","Application Data"
"978","11.179472","104.16.133.27","100.86.171.196","TCP","1514","443  >  64932 [ACK] Seq=178902 Ack=100960 Win=16 Len=1448 TSval=2675452838 TSecr=34906803 [TCP segment of a reassembled PDU]"
"979","11.179473","104.16.133.27","100.86.171.196","TCP","1514","443  >  64932 [ACK] Seq=180350 Ack=100960 Win=16 Len=1448 TSval=2675452838 TSecr=34906803 [TCP segment of a reassembled PDU]"
"980","11.179474","104.16.133.27","100.86.171.196","TLSv1.2","745","Application Data"
"981","11.179474","104.16.133.27","100.86.171.196","TCP","1514","443  >  64932 [ACK] Seq=182477 Ack=100960 Win=16 Len=1448 TSval=2675452839 TSecr=34906803 [TCP segment of a reassembled PDU]"
"982","11.179475","104.16.133.27","100.86.171.196","TLSv1.2","1262","Application Data"
"983","11.179476","104.16.133.27","100.86.171.196","TCP","1514","443  >  64932 [ACK] Seq=185121 Ack=100960 Win=16 Len=1448 TSval=2675452839 TSecr=34906803 [TCP segment of a reassembled PDU]"
"984","11.179476","104.16.133.27","100.86.171.196","TLSv1.2","1271","Application Data"
"985","11.179477","104.16.133.27","100.86.171.196","TLSv1.2","98","Application Data"
"986","11.179478","104.16.133.27","100.86.171.196","TLSv1.2","97","Application Data"
"987","11.179545","100.86.171.196","104.16.133.27","TCP","66","64932  >  443 [ACK] Seq=100960 Ack=187837 Win=12255 Len=0 TSval=34907132 TSecr=2675452839"
"988","11.179976","100.86.171.196","104.16.133.27","TCP","66","[TCP Window Update] 64932  >  443 [ACK] Seq=100960 Ack=187837 Win=12436 Len=0 TSval=34907132 TSecr=2675452839"
"989","11.185529","100.86.171.196","104.16.133.27","TLSv1.2","689","Application Data"
"990","11.185731","100.86.171.196","104.16.133.27","TCP","1454","64937  >  443 [ACK] Seq=6114 Ack=1580 Win=2048 Len=1388 TSval=1548913304 TSecr=1601617393 [TCP segment of a reassembled PDU]"
"991","11.185739","100.86.171.196","104.16.133.27","TLSv1.2","506","Application Data"
"992","11.203011","104.16.133.27","100.86.171.196","TCP","66","443  >  64937 [ACK] Seq=1580 Ack=7942 Win=26 Len=0 TSval=1601621722 TSecr=1548913304"
"993","11.250200","104.16.133.27","100.86.171.196","TLSv1.2","147","Application Data"
"994","11.250201","104.16.133.27","100.86.171.196","TLSv1.2","99","Application Data"
"995","11.250201","104.16.133.27","100.86.171.196","TLSv1.2","97","Application Data"
"996","11.250309","100.86.171.196","104.16.133.27","TCP","66","64937  >  443 [ACK] Seq=7942 Ack=1725 Win=2045 Len=0 TSval=1548913369 TSecr=1601621769"
"997","11.304707","100.86.171.196","104.16.133.27","TCP","1454","64932  >  443 [ACK] Seq=100960 Ack=187837 Win=12436 Len=1388 TSval=34907257 TSecr=2675452839 [TCP segment of a reassembled PDU]"
"998","11.304709","100.86.171.196","104.16.133.27","TCP","1454","64932  >  443 [ACK] Seq=102348 Ack=187837 Win=12436 Len=1388 TSval=34907257 TSecr=2675452839 [TCP segment of a reassembled PDU]"
"999","11.304738","100.86.171.196","104.16.133.27","TLSv1.2","158","Application Data"
"1000","11.309503","100.86.171.196","104.16.133.27","TCP","1454","64932  >  443 [ACK] Seq=103828 Ack=187837 Win=12436 Len=1388 TSval=34907262 TSecr=2675452839 [TCP segment of a reassembled PDU]"
"1001","11.309505","100.86.171.196","104.16.133.27","TCP","1454","64932  >  443 [ACK] Seq=105216 Ack=187837 Win=12436 Len=1388 TSval=34907262 TSecr=2675452839 [TCP segment of a reassembled PDU]"
"1002","11.309526","100.86.171.196","104.16.133.27","TLSv1.2","152","Application Data"
"1003","11.322521","104.16.133.27","100.86.171.196","TCP","66","443  >  64932 [ACK] Seq=187837 Ack=103828 Win=16 Len=0 TSval=2675452983 TSecr=34907257"
"1004","11.327366","104.16.133.27","100.86.171.196","TCP","66","443  >  64932 [ACK] Seq=187837 Ack=106690 Win=16 Len=0 TSval=2675452988 TSecr=34907262"
"1007","11.352257","104.16.133.27","100.86.171.196","TLSv1.2","236","Application Data"
"1008","11.352258","104.16.133.27","100.86.171.196","TCP","1514","443  >  64932 [ACK] Seq=188007 Ack=106690 Win=16 Len=1448 TSval=2675453013 TSecr=34907262 [TCP segment of a reassembled PDU]"
"1009","11.352258","104.16.133.27","100.86.171.196","TCP","1514","443  >  64932 [ACK] Seq=189455 Ack=106690 Win=16 Len=1448 TSval=2675453013 TSecr=34907262 [TCP segment of a reassembled PDU]"
"1010","11.352260","104.16.133.27","100.86.171.196","TLSv1.2","390","Application Data"
"1011","11.352260","104.16.133.27","100.86.171.196","TLSv1.2","97","Application Data"
"1013","11.352382","100.86.171.196","104.16.133.27","TCP","66","64932  >  443 [ACK] Seq=106690 Ack=191258 Win=12436 Len=0 TSval=34907305 TSecr=2675453013"
"1016","11.369018","100.86.171.196","104.16.133.27","TCP","1454","64932  >  443 [ACK] Seq=106690 Ack=191258 Win=12436 Len=1388 TSval=34907322 TSecr=2675453013 [TCP segment of a reassembled PDU]"
"1017","11.369020","100.86.171.196","104.16.133.27","TCP","1454","64932  >  443 [ACK] Seq=108078 Ack=191258 Win=12436 Len=1388 TSval=34907322 TSecr=2675453013 [TCP segment of a reassembled PDU]"
"1018","11.369042","100.86.171.196","104.16.133.27","TLSv1.2","135","Application Data"
"1019","11.369909","104.16.133.27","100.86.171.196","TLSv1.2","193","Application Data"
"1020","11.369910","104.16.133.27","100.86.171.196","TCP","1514","443  >  64932 [ACK] Seq=191385 Ack=106690 Win=16 Len=1448 TSval=2675453030 TSecr=34907305 [TCP segment of a reassembled PDU]"
"1021","11.369911","104.16.133.27","100.86.171.196","TCP","1514","443  >  64932 [ACK] Seq=192833 Ack=106690 Win=16 Len=1448 TSval=2675453030 TSecr=34907305 [TCP segment of a reassembled PDU]"
"1022","11.369986","100.86.171.196","104.16.133.27","TCP","66","64932  >  443 [ACK] Seq=109535 Ack=194281 Win=12389 Len=0 TSval=34907322 TSecr=2675453030"
"1023","11.370052","100.86.171.196","104.16.133.27","TCP","66","[TCP Window Update] 64932  >  443 [ACK] Seq=109535 Ack=194281 Win=12436 Len=0 TSval=34907323 TSecr=2675453030"
"1024","11.371277","104.16.133.27","100.86.171.196","TLSv1.2","103","Application Data"
"1025","11.371278","104.16.133.27","100.86.171.196","TLSv1.2","98","Application Data"
"1026","11.371278","104.16.133.27","100.86.171.196","TLSv1.2","97","Application Data"
"1028","11.371338","100.86.171.196","104.16.133.27","TCP","66","64932  >  443 [ACK] Seq=109535 Ack=194381 Win=12434 Len=0 TSval=34907324 TSecr=2675453030"
"1065","11.388586","104.16.133.27","100.86.171.196","TCP","66","443  >  64932 [ACK] Seq=194381 Ack=109466 Win=16 Len=0 TSval=2675453048 TSecr=34907322"
"1113","11.423139","100.86.171.196","104.16.133.27","TCP","135","[TCP Retransmission] 64932  >  443 [PSH, ACK] Seq=109466 Ack=194381 Win=12436 Len=69 TSval=34907376 TSecr=2675453048 [TCP segment of a reassembled PDU]"
"1114","11.428398","104.16.133.27","100.86.171.196","TCP","66","443  >  64932 [ACK] Seq=194381 Ack=109535 Win=16 Len=0 TSval=2675453089 TSecr=34907322"
"1115","11.440248","104.16.133.27","100.86.171.196","TCP","78","[TCP Dup ACK 1114#1] 443  >  64932 [ACK] Seq=194381 Ack=109535 Win=16 Len=0 TSval=2675453100 TSecr=34907376 SLE=109466 SRE=109535"
"1116","11.481324","104.16.133.27","100.86.171.196","TLSv1.2","140","Application Data"
"1117","11.481325","104.16.133.27","100.86.171.196","TLSv1.2","868","Application Data"
"1118","11.481326","104.16.133.27","100.86.171.196","TLSv1.2","97","Application Data"
"1119","11.481409","100.86.171.196","104.16.133.27","TCP","66","64932  >  443 [ACK] Seq=109535 Ack=195288 Win=12422 Len=0 TSval=34907434 TSecr=2675453142"
"1138","12.386798","100.86.171.196","104.16.133.27","TLSv1.2","117","Application Data"
"1139","12.387101","100.86.171.196","104.16.133.27","TLSv1.2","1142","Application Data"
"1140","12.405483","104.16.133.27","100.86.171.196","TCP","66","443  >  64937 [ACK] Seq=1725 Ack=7993 Win=26 Len=0 TSval=1601622924 TSecr=1548914506"
"1141","12.405484","104.16.133.27","100.86.171.196","TCP","66","443  >  64937 [ACK] Seq=1725 Ack=9069 Win=27 Len=0 TSval=1601622924 TSecr=1548914506"
"1156","12.451754","104.16.133.27","100.86.171.196","TLSv1.2","461","Application Data"
"1157","12.451756","104.16.133.27","100.86.171.196","TLSv1.2","99","Application Data"
"1158","12.451757","104.16.133.27","100.86.171.196","TLSv1.2","97","Application Data"
"1159","12.451873","100.86.171.196","104.16.133.27","TCP","66","64937  >  443 [ACK] Seq=9069 Ack=2184 Win=2040 Len=0 TSval=1548914571 TSecr=1601622971"
"1160","12.582589","100.86.171.196","104.16.133.27","TLSv1.2","125","Application Data"
"1161","12.600233","104.16.133.27","100.86.171.196","TCP","66","443  >  64937 [ACK] Seq=2184 Ack=9128 Win=27 Len=0 TSval=1601623119 TSecr=1548914701"
"1162","12.641451","104.16.133.27","100.86.171.196","TLSv1.2","533","Application Data"
"1163","12.641535","100.86.171.196","104.16.133.27","TCP","66","64937  >  443 [ACK] Seq=9128 Ack=2651 Win=2040 Len=0 TSval=1548914760 TSecr=1601623160"
"1165","12.672799","100.86.171.196","104.16.133.27","TLSv1.2","499","Application Data"
"1166","12.673132","100.86.171.196","104.16.133.27","TLSv1.2","1261","Application Data"
"1168","12.681059","100.86.171.196","104.16.133.27","TCP","1454","64932  >  443 [ACK] Seq=109535 Ack=195288 Win=12436 Len=1388 TSval=34908634 TSecr=2675453142 [TCP segment of a reassembled PDU]"
"1169","12.681126","100.86.171.196","104.16.133.27","TLSv1.2","1396","Application Data"
"1170","12.686821","100.86.171.196","104.16.133.27","TCP","1454","64932  >  443 [ACK] Seq=112253 Ack=195288 Win=12436 Len=1388 TSval=34908640 TSecr=2675453142 [TCP segment of a reassembled PDU]"
"1171","12.686824","100.86.171.196","104.16.133.27","TCP","1454","64932  >  443 [ACK] Seq=113641 Ack=195288 Win=12436 Len=1388 TSval=34908640 TSecr=2675453142 [TCP segment of a reassembled PDU]"
"1172","12.686850","100.86.171.196","104.16.133.27","TLSv1.2","180","Application Data"
"1173","12.691731","104.16.133.27","100.86.171.196","TCP","66","443  >  64937 [ACK] Seq=2651 Ack=9561 Win=27 Len=0 TSval=1601623209 TSecr=1548914792"
"1174","12.691732","104.16.133.27","100.86.171.196","TCP","66","443  >  64937 [ACK] Seq=2651 Ack=10756 Win=27 Len=0 TSval=1601623211 TSecr=1548914792"
"1175","12.698906","104.16.133.27","100.86.171.196","TCP","66","443  >  64932 [ACK] Seq=195288 Ack=112253 Win=16 Len=0 TSval=2675454359 TSecr=34908634"
"1176","12.705405","104.16.133.27","100.86.171.196","TCP","66","443  >  64932 [ACK] Seq=195288 Ack=115143 Win=16 Len=0 TSval=2675454366 TSecr=34908640"
"1177","12.734898","104.16.133.27","100.86.171.196","TLSv1.2","354","Application Data"
"1178","12.734899","104.16.133.27","100.86.171.196","TLSv1.2","99","Application Data"
"1179","12.734900","104.16.133.27","100.86.171.196","TLSv1.2","97","Application Data"
"1180","12.734990","100.86.171.196","104.16.133.27","TCP","66","64937  >  443 [ACK] Seq=10756 Ack=3003 Win=2042 Len=0 TSval=1548914854 TSecr=1601623254"
"1181","12.862935","104.16.133.27","100.86.171.196","TLSv1.2","798","Application Data"
"1182","12.862936","104.16.133.27","100.86.171.196","TLSv1.2","99","Application Data"
"1183","12.862937","104.16.133.27","100.86.171.196","TLSv1.2","151","Application Data"
"1184","12.862937","104.16.133.27","100.86.171.196","TLSv1.2","98","Application Data"
"1185","12.862938","104.16.133.27","100.86.171.196","TLSv1.2","97","Application Data"
"1186","12.863029","100.86.171.196","104.16.133.27","TCP","66","64932  >  443 [ACK] Seq=115143 Ack=196201 Win=12422 Len=0 TSval=34908816 TSecr=2675454523"
"1187","12.864541","104.16.133.27","100.86.171.196","TLSv1.2","163","Application Data"
"1188","12.864580","100.86.171.196","104.16.133.27","TCP","66","64932  >  443 [ACK] Seq=115143 Ack=196298 Win=12434 Len=0 TSval=34908817 TSecr=2675454525"
"1189","12.865278","104.16.133.27","100.86.171.196","TLSv1.2","256","Application Data"
"1190","12.865302","100.86.171.196","104.16.133.27","TCP","66","64932  >  443 [ACK] Seq=115143 Ack=196488 Win=12433 Len=0 TSval=34908817 TSecr=2675454526"
"1191","12.865812","104.16.133.27","100.86.171.196","TLSv1.2","98","Application Data"
"1192","12.865813","104.16.133.27","100.86.171.196","TLSv1.2","97","Application Data"
"1193","12.865837","100.86.171.196","104.16.133.27","TCP","66","64932  >  443 [ACK] Seq=115143 Ack=196551 Win=12435 Len=0 TSval=34908819 TSecr=2675454526"
"1203","14.595601","100.86.171.196","104.16.133.27","TLSv1.2","307","Application Data"
"1204","14.595945","100.86.171.196","104.16.133.27","TCP","1454","64937  >  443 [ACK] Seq=10997 Ack=3003 Win=2048 Len=1388 TSval=1548916714 TSecr=1601623254 [TCP segment of a reassembled PDU]"
"1205","14.595966","100.86.171.196","104.16.133.27","TLSv1.2","915","Application Data"
"1206","14.621022","104.16.133.27","100.86.171.196","TCP","66","443  >  64937 [ACK] Seq=3003 Ack=13234 Win=28 Len=0 TSval=1601625140 TSecr=1548916714"
"1207","14.669915","104.16.133.27","100.86.171.196","TLSv1.2","459","Application Data"
"1208","14.669922","104.16.133.27","100.86.171.196","TLSv1.2","99","Application Data"
"1209","14.669923","104.16.133.27","100.86.171.196","TLSv1.2","97","Application Data"
"1210","14.670141","100.86.171.196","104.16.133.27","TCP","66","64937  >  443 [ACK] Seq=13234 Ack=3460 Win=2040 Len=0 TSval=1548916789 TSecr=1601625189"
