"No.","Time","Source","Destination","Protocol","Length","Info"
"56","5.205685","100.86.171.196","104.16.133.27","TLSv1.2","125","Application Data"
"57","5.225972","104.16.133.27","100.86.171.196","TCP","66","443  >  64937 [ACK] Seq=1 Ack=60 Win=8 Len=0 TSval=1601465377 TSecr=1548756954"
"60","5.492305","104.16.133.27","100.86.171.196","TLSv1.2","461","Application Data"
"61","5.492436","100.86.171.196","104.16.133.27","TCP","66","64937  >  443 [ACK] Seq=60 Ack=396 Win=2041 Len=0 TSval=1548757240 TSecr=1601465643"
"62","5.495305","100.86.171.196","104.16.133.27","TLSv1.2","139","Application Data"
"63","5.496035","100.86.171.196","104.16.133.27","TLSv1.2","1276","Application Data"
"64","5.513079","104.16.133.27","100.86.171.196","TCP","66","443  >  64937 [ACK] Seq=396 Ack=133 Win=8 Len=0 TSval=1601465663 TSecr=1548757243"
"65","5.513081","104.16.133.27","100.86.171.196","TCP","66","443  >  64937 [ACK] Seq=396 Ack=1343 Win=8 Len=0 TSval=1601465665 TSecr=1548757243"
"66","5.557520","104.16.133.27","100.86.171.196","TLSv1.2","885","Application Data"
"67","5.557522","104.16.133.27","100.86.171.196","TLSv1.2","99","Application Data"
"68","5.557522","104.16.133.27","100.86.171.196","TLSv1.2","97","Application Data"
"69","5.557629","100.86.171.196","104.16.133.27","TCP","66","64937  >  443 [ACK] Seq=1343 Ack=1279 Win=2034 Len=0 TSval=1548757305 TSecr=1601465708"
"74","7.446633","100.86.171.196","104.16.133.27","TCP","1454","64932  >  443 [ACK] Seq=1 Ack=1 Win=12436 Len=1388 TSval=34753029 TSecr=2675269138 [TCP segment of a reassembled PDU]"
"75","7.446671","100.86.171.196","104.16.133.27","TLSv1.2","505","Application Data"
"76","7.470461","104.16.133.27","100.86.171.196","TCP","66","443  >  64932 [ACK] Seq=1 Ack=1828 Win=15 Len=0 TSval=2675298763 TSecr=34753029"
"77","7.658838","104.16.133.27","100.86.171.196","TLSv1.2","913","Application Data"
"78","7.658839","104.16.133.27","100.86.171.196","TLSv1.2","255","Application Data"
"79","7.658840","104.16.133.27","100.86.171.196","TLSv1.2","98","Application Data"
"80","7.658840","104.16.133.27","100.86.171.196","TLSv1.2","97","Application Data"
"81","7.658945","100.86.171.196","104.16.133.27","TCP","66","64932  >  443 [ACK] Seq=1828 Ack=1100 Win=12419 Len=0 TSval=34753241 TSecr=2675298951"
"84","9.453119","100.86.171.196","104.16.133.27","TLSv1.2","1076","Application Data"
"85","9.453331","100.86.171.196","104.16.133.27","TLSv1.2","180","Application Data"
"86","9.479674","104.16.133.27","100.86.171.196","TCP","66","443  >  64932 [ACK] Seq=1100 Ack=2952 Win=15 Len=0 TSval=2675300771 TSecr=34755035"
"87","9.677711","104.16.133.27","100.86.171.196","TLSv1.2","679","Application Data"
"88","9.677713","104.16.133.27","100.86.171.196","TLSv1.2","450","Application Data"
"89","9.677714","104.16.133.27","100.86.171.196","TLSv1.2","98","Application Data"
"90","9.677715","104.16.133.27","100.86.171.196","TLSv1.2","97","Application Data"
"91","9.677828","100.86.171.196","104.16.133.27","TCP","66","64932  >  443 [ACK] Seq=2952 Ack=2160 Win=12419 Len=0 TSval=34755260 TSecr=2675300969"
"102","11.434158","100.86.171.196","104.16.133.27","TLSv1.2","117","Application Data"
"103","11.434646","100.86.171.196","104.16.133.27","TLSv1.2","844","Application Data"
"104","11.451077","104.16.133.27","100.86.171.196","TCP","66","443  >  64937 [ACK] Seq=1279 Ack=1394 Win=8 Len=0 TSval=1601471602 TSecr=1548763182"
"105","11.453813","104.16.133.27","100.86.171.196","TCP","66","443  >  64937 [ACK] Seq=1279 Ack=2172 Win=8 Len=0 TSval=1601471603 TSecr=1548763182"
"106","11.497080","104.16.133.27","100.86.171.196","TLSv1.2","484","Application Data"
"107","11.497083","104.16.133.27","100.86.171.196","TLSv1.2","99","Application Data"
"108","11.497084","104.16.133.27","100.86.171.196","TLSv1.2","97","Application Data"
"109","11.497271","100.86.171.196","104.16.133.27","TCP","66","64937  >  443 [ACK] Seq=2172 Ack=1697 Win=2041 Len=0 TSval=1548763245 TSecr=1601471648"
"110","11.497357","100.86.171.196","104.16.133.27","TCP","66","64937  >  443 [ACK] Seq=2172 Ack=1761 Win=2040 Len=0 TSval=1548763245 TSecr=1601471648"
"113","13.577378","100.86.171.196","104.16.133.27","TCP","1454","64932  >  443 [ACK] Seq=2952 Ack=2160 Win=12436 Len=1388 TSval=34759159 TSecr=2675300969 [TCP segment of a reassembled PDU]"
"114","13.577426","100.86.171.196","104.16.133.27","TLSv1.2","568","Application Data"
"115","13.577556","100.86.171.196","104.16.133.27","TLSv1.2","290","Application Data"
"116","13.601530","104.16.133.27","100.86.171.196","TCP","66","443  >  64932 [ACK] Seq=2160 Ack=5066 Win=15 Len=0 TSval=2675304894 TSecr=34759159"
"117","13.917633","104.16.133.27","100.86.171.196","TLSv1.2","670","Application Data"
"118","13.917636","104.16.133.27","100.86.171.196","TLSv1.2","507","Application Data"
"119","13.917637","104.16.133.27","100.86.171.196","TLSv1.2","98","Application Data"
"120","13.917638","104.16.133.27","100.86.171.196","TLSv1.2","97","Application Data"
"121","13.917835","100.86.171.196","104.16.133.27","TCP","66","64932  >  443 [ACK] Seq=5066 Ack=3268 Win=12419 Len=0 TSval=34759500 TSecr=2675305151"
"122","13.928418","104.16.133.27","100.86.171.196","TCP","97","[TCP Spurious Retransmission] 443  >  64932 [PSH, ACK] Seq=3237 Ack=5066 Win=15 Len=31 TSval=2675305221 TSecr=34759159"
"123","13.928525","100.86.171.196","104.16.133.27","TCP","78","[TCP Window Update] 64932  >  443 [ACK] Seq=5066 Ack=3268 Win=12436 Len=0 TSval=34759511 TSecr=2675305221 SLE=3237 SRE=3268"
"124","15.212502","100.86.171.196","104.16.133.27","TLSv1.2","125","Application Data"
"125","15.237832","104.16.133.27","100.86.171.196","TCP","66","443  >  64937 [ACK] Seq=1761 Ack=2231 Win=8 Len=0 TSval=1601475389 TSecr=1548766961"
"126","15.281294","104.16.133.27","100.86.171.196","TLSv1.2","508","Application Data"
"127","15.281405","100.86.171.196","104.16.133.27","TCP","66","64937  >  443 [ACK] Seq=2231 Ack=2203 Win=2041 Len=0 TSval=1548767029 TSecr=1601475432"
"128","15.283425","100.86.171.196","104.16.133.27","TLSv1.2","139","Application Data"
"129","15.283667","100.86.171.196","104.16.133.27","TLSv1.2","1277","Application Data"
"130","15.300884","104.16.133.27","100.86.171.196","TCP","66","443  >  64937 [ACK] Seq=2203 Ack=2304 Win=8 Len=0 TSval=1601475452 TSecr=1548767032"
"131","15.300885","104.16.133.27","100.86.171.196","TCP","66","443  >  64937 [ACK] Seq=2203 Ack=3515 Win=8 Len=0 TSval=1601475453 TSecr=1548767032"
"132","15.327288","100.86.171.196","104.16.133.27","TLSv1.2","1374","Application Data"
"134","15.342612","104.16.133.27","100.86.171.196","TLSv1.2","230","Application Data"
"135","15.342613","104.16.133.27","100.86.171.196","TLSv1.2","99","Application Data"
"136","15.342613","104.16.133.27","100.86.171.196","TLSv1.2","97","Application Data"
"137","15.342700","100.86.171.196","104.16.133.27","TCP","66","64937  >  443 [ACK] Seq=3515 Ack=2431 Win=2044 Len=0 TSval=1548767091 TSecr=1601475494"
"138","15.348260","104.16.133.27","100.86.171.196","TCP","66","443  >  64932 [ACK] Seq=3268 Ack=6374 Win=15 Len=0 TSval=2675306640 TSecr=34760909"
"152","15.523055","104.16.133.27","100.86.171.196","TLSv1.2","706","Application Data"
"153","15.523056","104.16.133.27","100.86.171.196","TLSv1.2","243","Application Data"
"154","15.523056","104.16.133.27","100.86.171.196","TLSv1.2","97","Application Data"
"155","15.523150","100.86.171.196","104.16.133.27","TCP","66","64932  >  443 [ACK] Seq=6374 Ack=4116 Win=12423 Len=0 TSval=34761105 TSecr=2675306815"
"227","18.746920","100.86.171.196","104.16.133.27","TCP","1454","64932  >  443 [ACK] Seq=6374 Ack=4116 Win=12436 Len=1388 TSval=34764329 TSecr=2675306815 [TCP segment of a reassembled PDU]"
"228","18.746944","100.86.171.196","104.16.133.27","TLSv1.2","340","Application Data"
"229","18.772601","104.16.133.27","100.86.171.196","TCP","66","443  >  64932 [ACK] Seq=4116 Ack=8036 Win=15 Len=0 TSval=2675310065 TSecr=34764329"
"230","19.449438","104.16.133.27","100.86.171.196","TLSv1.2","1169","Application Data"
"231","19.449439","104.16.133.27","100.86.171.196","TLSv1.2","1274","Application Data"
"232","19.449441","104.16.133.27","100.86.171.196","TLSv1.2","98","Application Data"
"233","19.449442","104.16.133.27","100.86.171.196","TLSv1.2","97","Application Data"
"234","19.449585","100.86.171.196","104.16.133.27","TCP","66","64932  >  443 [ACK] Seq=8036 Ack=6490 Win=12399 Len=0 TSval=34765032 TSecr=2675310717"
"469","20.597789","100.86.171.196","104.16.133.27","TLSv1.2","1325","Application Data"
"470","20.598001","100.86.171.196","104.16.133.27","TLSv1.2","291","Application Data"
"471","20.616149","104.16.133.27","100.86.171.196","TCP","66","443  >  64932 [ACK] Seq=6490 Ack=9520 Win=15 Len=0 TSval=2675311908 TSecr=34766180"
"517","20.743800","100.86.171.196","104.16.133.27","TLSv1.2","117","Application Data"
"518","20.744034","100.86.171.196","104.16.133.27","TCP","1454","64937  >  443 [ACK] Seq=3566 Ack=2431 Win=2048 Len=1388 TSval=1548772492 TSecr=1601475494 [TCP segment of a reassembled PDU]"
"519","20.744045","100.86.171.196","104.16.133.27","TLSv1.2","306","Application Data"
"520","20.761427","104.16.133.27","100.86.171.196","TCP","66","443  >  64937 [ACK] Seq=2431 Ack=3566 Win=8 Len=0 TSval=1601480912 TSecr=1548772492"
"521","20.761428","104.16.133.27","100.86.171.196","TCP","66","443  >  64937 [ACK] Seq=2431 Ack=5194 Win=8 Len=0 TSval=1601480913 TSecr=1548772492"
"522","20.806435","104.16.133.27","100.86.171.196","TLSv1.2","460","Application Data"
"523","20.806436","104.16.133.27","100.86.171.196","TLSv1.2","99","Application Data"
"524","20.806436","104.16.133.27","100.86.171.196","TLSv1.2","97","Application Data"
"525","20.806533","100.86.171.196","104.16.133.27","TCP","66","64937  >  443 [ACK] Seq=5194 Ack=2889 Win=2040 Len=0 TSval=1548772555 TSecr=1601480958"
"526","20.878077","104.16.133.27","100.86.171.196","TLSv1.2","681","Application Data"
"527","20.878078","104.16.133.27","100.86.171.196","TLSv1.2","457","Application Data"
"528","20.878079","104.16.133.27","100.86.171.196","TLSv1.2","98","Application Data"
"529","20.878079","104.16.133.27","100.86.171.196","TLSv1.2","97","Application Data"
"530","20.878171","100.86.171.196","104.16.133.27","TCP","66","64932  >  443 [ACK] Seq=9520 Ack=7559 Win=12419 Len=0 TSval=34766460 TSecr=2675312170"
"544","22.810930","100.86.171.196","104.16.133.27","TLSv1.2","117","Application Data"
"545","22.811694","100.86.171.196","104.16.133.27","TLSv1.2","878","Application Data"
"546","22.835601","104.16.133.27","100.86.171.196","TCP","66","443  >  64937 [ACK] Seq=2889 Ack=5245 Win=8 Len=0 TSval=1601482987 TSecr=1548774559"
"547","22.835602","104.16.133.27","100.86.171.196","TCP","66","443  >  64937 [ACK] Seq=2889 Ack=6057 Win=8 Len=0 TSval=1601482987 TSecr=1548774559"
"548","22.887691","104.16.133.27","100.86.171.196","TLSv1.2","458","Application Data"
"549","22.887775","100.86.171.196","104.16.133.27","TCP","66","64937  >  443 [ACK] Seq=6057 Ack=3281 Win=2041 Len=0 TSval=1548774636 TSecr=1601483038"
"550","23.238477","104.16.133.27","100.86.171.196","TLSv1.2","130","Application Data, Application Data"
"551","23.238583","100.86.171.196","104.16.133.27","TCP","66","64937  >  443 [ACK] Seq=6057 Ack=3345 Win=2047 Len=0 TSval=1548774987 TSecr=1601483284"
"554","25.209629","100.86.171.196","104.16.133.27","TLSv1.2","125","Application Data"
"555","25.232655","104.16.133.27","100.86.171.196","TCP","66","443  >  64937 [ACK] Seq=3345 Ack=6116 Win=8 Len=0 TSval=1601485384 TSecr=1548776958"
"556","25.275109","104.16.133.27","100.86.171.196","TLSv1.2","548","Application Data"
"557","25.275162","100.86.171.196","104.16.133.27","TCP","66","64937  >  443 [ACK] Seq=6116 Ack=3827 Win=2040 Len=0 TSval=1548777024 TSecr=1601485426"
"558","25.276844","100.86.171.196","104.16.133.27","TLSv1.2","139","Application Data"
"559","25.277052","100.86.171.196","104.16.133.27","TLSv1.2","1276","Application Data"
"560","25.294117","104.16.133.27","100.86.171.196","TCP","66","443  >  64937 [ACK] Seq=3827 Ack=6189 Win=8 Len=0 TSval=1601485445 TSecr=1548777025"
"561","25.295517","104.16.133.27","100.86.171.196","TCP","66","443  >  64937 [ACK] Seq=3827 Ack=7399 Win=8 Len=0 TSval=1601485446 TSecr=1548777025"
"562","25.334700","104.16.133.27","100.86.171.196","TLSv1.2","315","Application Data"
"563","25.334701","104.16.133.27","100.86.171.196","TLSv1.2","99","Application Data"
"564","25.334701","104.16.133.27","100.86.171.196","TLSv1.2","97","Application Data"
"565","25.334753","100.86.171.196","104.16.133.27","TCP","66","64937  >  443 [ACK] Seq=7399 Ack=4076 Win=2044 Len=0 TSval=1548777083 TSecr=1601485486"
"566","25.334774","100.86.171.196","104.16.133.27","TCP","66","64937  >  443 [ACK] Seq=7399 Ack=4140 Win=2043 Len=0 TSval=1548777083 TSecr=1601485486"
"593","27.925212","100.86.171.196","104.16.133.27","TCP","1454","64932  >  443 [ACK] Seq=9520 Ack=7559 Win=12436 Len=1388 TSval=34773508 TSecr=2675312170 [TCP segment of a reassembled PDU]"
"594","27.925266","100.86.171.196","104.16.133.27","TLSv1.2","463","Application Data"
"595","27.925601","100.86.171.196","104.16.133.27","TLSv1.2","238","Application Data"
"596","27.942816","104.16.133.27","100.86.171.196","TCP","66","443  >  64932 [ACK] Seq=7559 Ack=11305 Win=15 Len=0 TSval=2675319235 TSecr=34773508"
"597","27.942817","104.16.133.27","100.86.171.196","TCP","66","443  >  64932 [ACK] Seq=7559 Ack=11477 Win=15 Len=0 TSval=2675319236 TSecr=34773508"
"604","28.218986","104.16.133.27","100.86.171.196","TLSv1.2","672","Application Data"
"605","28.218988","104.16.133.27","100.86.171.196","TLSv1.2","490","Application Data"
"606","28.218989","104.16.133.27","100.86.171.196","TLSv1.2","98","Application Data"
"607","28.218990","104.16.133.27","100.86.171.196","TLSv1.2","97","Application Data"
"608","28.219207","100.86.171.196","104.16.133.27","TCP","66","64932  >  443 [ACK] Seq=11477 Ack=8652 Win=12419 Len=0 TSval=34773802 TSecr=2675319511"
"609","28.241003","100.86.171.196","104.16.133.27","TLSv1.2","1172","Application Data"
"610","28.241150","100.86.171.196","104.16.133.27","TLSv1.2","197","Application Data"
"611","28.241196","100.86.171.196","104.16.133.27","TLSv1.2","97","Application Data"
"612","28.258795","104.16.133.27","100.86.171.196","TCP","66","443  >  64932 [ACK] Seq=8652 Ack=12745 Win=15 Len=0 TSval=2675319551 TSecr=34773823"
"621","28.514038","104.16.133.27","100.86.171.196","TLSv1.2","461","[TCP Previous segment not captured] , Application Data"
"622","28.514040","104.16.133.27","100.86.171.196","TLSv1.2","98","Application Data"
"623","28.514040","104.16.133.27","100.86.171.196","TLSv1.2","97","Application Data"
"624","28.514165","100.86.171.196","104.16.133.27","TCP","78","[TCP Dup ACK 608#1] 64932  >  443 [ACK] Seq=12745 Ack=8652 Win=12436 Len=0 TSval=34774097 TSecr=2675319551 SLE=9045 SRE=9503"
"629","28.538532","104.16.133.27","100.86.171.196","TCP","459","[TCP Retransmission] 443  >  64932 [PSH, ACK] Seq=8652 Ack=12745 Win=15 Len=393 TSval=2675319831 TSecr=34774097"
"630","28.538600","100.86.171.196","104.16.133.27","TCP","66","64932  >  443 [ACK] Seq=12745 Ack=9503 Win=12423 Len=0 TSval=34774120 TSecr=2675319831"
"635","28.567687","100.86.171.196","104.16.133.27","TCP","1454","64932  >  443 [ACK] Seq=12745 Ack=9503 Win=12436 Len=1388 TSval=34774150 TSecr=2675319831 [TCP segment of a reassembled PDU]"
"636","28.567722","100.86.171.196","104.16.133.27","TLSv1.2","448","Application Data"
"644","28.585426","104.16.133.27","100.86.171.196","TCP","66","443  >  64932 [ACK] Seq=9503 Ack=14515 Win=15 Len=0 TSval=2675319878 TSecr=34774150"
"650","29.210476","104.16.133.27","100.86.171.196","TLSv1.2","852","Application Data"
"651","29.210477","104.16.133.27","100.86.171.196","TCP","1514","443  >  64932 [ACK] Seq=10289 Ack=14515 Win=15 Len=1448 TSval=2675320503 TSecr=34774150 [TCP segment of a reassembled PDU]"
"652","29.210593","100.86.171.196","104.16.133.27","TCP","66","64932  >  443 [ACK] Seq=14515 Ack=10289 Win=12424 Len=0 TSval=34774793 TSecr=2675320503"
"653","29.210661","100.86.171.196","104.16.133.27","TCP","66","64932  >  443 [ACK] Seq=14515 Ack=11737 Win=12401 Len=0 TSval=34774793 TSecr=2675320503"
"654","29.212166","104.16.133.27","100.86.171.196","TLSv1.2","1173","Application Data"
"655","29.212167","104.16.133.27","100.86.171.196","TCP","1514","443  >  64932 [ACK] Seq=12844 Ack=14515 Win=15 Len=1448 TSval=2675320504 TSecr=34774150 [TCP segment of a reassembled PDU]"
"656","29.212168","104.16.133.27","100.86.171.196","TCP","1514","443  >  64932 [ACK] Seq=14292 Ack=14515 Win=15 Len=1448 TSval=2675320504 TSecr=34774150 [TCP segment of a reassembled PDU]"
"657","29.212230","100.86.171.196","104.16.133.27","TCP","66","64932  >  443 [ACK] Seq=14515 Ack=15740 Win=12373 Len=0 TSval=34774795 TSecr=2675320504"
"658","29.212322","100.86.171.196","104.16.133.27","TCP","66","[TCP Window Update] 64932  >  443 [ACK] Seq=14515 Ack=15740 Win=12436 Len=0 TSval=34774795 TSecr=2675320504"
"659","29.213829","104.16.133.27","100.86.171.196","TLSv1.2","1373","Application Data"
"660","29.213830","104.16.133.27","100.86.171.196","TCP","1514","443  >  64932 [ACK] Seq=17047 Ack=14515 Win=15 Len=1448 TSval=2675320505 TSecr=34774150 [TCP segment of a reassembled PDU]"
"661","29.213831","104.16.133.27","100.86.171.196","TCP","1514","443  >  64932 [ACK] Seq=18495 Ack=14515 Win=15 Len=1448 TSval=2675320505 TSecr=34774150 [TCP segment of a reassembled PDU]"
"662","29.213881","100.86.171.196","104.16.133.27","TCP","66","64932  >  443 [ACK] Seq=14515 Ack=19943 Win=12370 Len=0 TSval=34774796 TSecr=2675320505"
"663","29.213947","100.86.171.196","104.16.133.27","TCP","66","[TCP Window Update] 64932  >  443 [ACK] Seq=14515 Ack=19943 Win=12436 Len=0 TSval=34774796 TSecr=2675320505"
"664","29.215155","104.16.133.27","100.86.171.196","TLSv1.2","1267","Application Data"
"665","29.215156","104.16.133.27","100.86.171.196","TCP","1514","443  >  64932 [ACK] Seq=21144 Ack=14515 Win=15 Len=1448 TSval=2675320505 TSecr=34774150 [TCP segment of a reassembled PDU]"
"666","29.215157","104.16.133.27","100.86.171.196","TCP","1514","443  >  64932 [ACK] Seq=22592 Ack=14515 Win=15 Len=1448 TSval=2675320505 TSecr=34774150 [TCP segment of a reassembled PDU]"
"667","29.215175","104.16.133.27","100.86.171.196","TLSv1.2","1129","Application Data"
"668","29.215176","104.16.133.27","100.86.171.196","TLSv1.2","1473","Application Data"
"669","29.215216","100.86.171.196","104.16.133.27","TCP","66","64932  >  443 [ACK] Seq=14515 Ack=24040 Win=12372 Len=0 TSval=34774798 TSecr=2675320505"
"670","29.215235","100.86.171.196","104.16.133.27","TCP","66","64932  >  443 [ACK] Seq=14515 Ack=26510 Win=12333 Len=0 TSval=34774798 TSecr=2675320506"
"671","29.215255","100.86.171.196","104.16.133.27","TCP","66","[TCP Window Update] 64932  >  443 [ACK] Seq=14515 Ack=26510 Win=12436 Len=0 TSval=34774798 TSecr=2675320506"
"672","29.227635","100.86.171.196","104.16.133.27","TLSv1.2","135","Application Data"
"673","29.228156","100.86.171.196","104.16.133.27","TLSv1.2","819","Application Data"
"674","29.244984","104.16.133.27","100.86.171.196","TCP","66","443  >  64937 [ACK] Seq=4140 Ack=7468 Win=8 Len=0 TSval=1601489396 TSecr=1548780976"
"675","29.244986","104.16.133.27","100.86.171.196","TCP","66","443  >  64937 [ACK] Seq=4140 Ack=8221 Win=8 Len=0 TSval=1601489397 TSecr=1548780976"
"676","29.293136","104.16.133.27","100.86.171.196","TLSv1.2","762","Application Data"
"677","29.293138","104.16.133.27","100.86.171.196","TLSv1.2","99","Application Data"
"678","29.293139","104.16.133.27","100.86.171.196","TLSv1.2","97","Application Data"
"679","29.293234","100.86.171.196","104.16.133.27","TCP","66","64937  >  443 [ACK] Seq=8221 Ack=4900 Win=2036 Len=0 TSval=1548781042 TSecr=1601489444"
"680","29.306911","104.16.133.27","100.86.171.196","TLSv1.2","147","Application Data"
"681","29.307015","100.86.171.196","104.16.133.27","TCP","66","64932  >  443 [ACK] Seq=14515 Ack=26591 Win=12435 Len=0 TSval=34774889 TSecr=2675320598"
"682","29.309237","104.16.133.27","100.86.171.196","TCP","1514","443  >  64932 [ACK] Seq=26591 Ack=14515 Win=15 Len=1448 TSval=2675320599 TSecr=34774798 [TCP segment of a reassembled PDU]"
"683","29.309238","104.16.133.27","100.86.171.196","TCP","1514","443  >  64932 [ACK] Seq=28039 Ack=14515 Win=15 Len=1448 TSval=2675320599 TSecr=34774798 [TCP segment of a reassembled PDU]"
"684","29.309239","104.16.133.27","100.86.171.196","TLSv1.2","1147","Application Data"
"685","29.309240","104.16.133.27","100.86.171.196","TCP","1514","443  >  64932 [ACK] Seq=30568 Ack=14515 Win=15 Len=1448 TSval=2675320600 TSecr=34774798 [TCP segment of a reassembled PDU]"
"686","29.309351","100.86.171.196","104.16.133.27","TCP","66","64932  >  443 [ACK] Seq=14515 Ack=32016 Win=12350 Len=0 TSval=34774892 TSecr=2675320600"
"687","29.309923","104.16.133.27","100.86.171.196","TCP","1514","443  >  64932 [ACK] Seq=32016 Ack=14515 Win=15 Len=1448 TSval=2675320600 TSecr=34774798 [TCP segment of a reassembled PDU]"
"688","29.309925","104.16.133.27","100.86.171.196","TLSv1.2","1110","Application Data"
"689","29.310013","100.86.171.196","104.16.133.27","TCP","66","64932  >  443 [ACK] Seq=14515 Ack=34508 Win=12311 Len=0 TSval=34774892 TSecr=2675320600"
"690","29.311082","100.86.171.196","104.16.133.27","TCP","66","[TCP Window Update] 64932  >  443 [ACK] Seq=14515 Ack=34508 Win=12436 Len=0 TSval=34774894 TSecr=2675320600"
"691","29.312437","104.16.133.27","100.86.171.196","TCP","1514","443  >  64932 [ACK] Seq=34508 Ack=14515 Win=15 Len=1448 TSval=2675320600 TSecr=34774798 [TCP segment of a reassembled PDU]"
"692","29.312438","104.16.133.27","100.86.171.196","TCP","1514","443  >  64932 [ACK] Seq=35956 Ack=14515 Win=15 Len=1448 TSval=2675320600 TSecr=34774798 [TCP segment of a reassembled PDU]"
"693","29.312439","104.16.133.27","100.86.171.196","TLSv1.2","1440","Application Data"
"694","29.312439","104.16.133.27","100.86.171.196","TCP","1514","443  >  64932 [ACK] Seq=38778 Ack=14515 Win=15 Len=1448 TSval=2675320601 TSecr=34774798 [TCP segment of a reassembled PDU]"
"695","29.312441","104.16.133.27","100.86.171.196","TCP","1514","443  >  64932 [ACK] Seq=40226 Ack=14515 Win=15 Len=1448 TSval=2675320601 TSecr=34774798 [TCP segment of a reassembled PDU]"
"696","29.312442","104.16.133.27","100.86.171.196","TLSv1.2","1406","Application Data"
"697","29.312443","104.16.133.27","100.86.171.196","TCP","1514","443  >  64932 [ACK] Seq=43014 Ack=14515 Win=15 Len=1448 TSval=2675320601 TSecr=34774798 [TCP segment of a reassembled PDU]"
"698","29.312444","104.16.133.27","100.86.171.196","TCP","1514","443  >  64932 [ACK] Seq=44462 Ack=14515 Win=15 Len=1448 TSval=2675320601 TSecr=34774798 [TCP segment of a reassembled PDU]"
"699","29.312561","100.86.171.196","104.16.133.27","TCP","66","64932  >  443 [ACK] Seq=14515 Ack=45910 Win=12258 Len=0 TSval=34774895 TSecr=2675320601"
"700","29.313590","100.86.171.196","104.16.133.27","TCP","66","[TCP Window Update] 64932  >  443 [ACK] Seq=14515 Ack=45910 Win=12436 Len=0 TSval=34774896 TSecr=2675320601"
"701","29.314786","104.16.133.27","100.86.171.196","TLSv1.2","1397","Application Data"
"702","29.314788","104.16.133.27","100.86.171.196","TCP","1514","443  >  64932 [ACK] Seq=47241 Ack=14515 Win=15 Len=1448 TSval=2675320602 TSecr=34774798 [TCP segment of a reassembled PDU]"
"703","29.314788","104.16.133.27","100.86.171.196","TCP","1514","443  >  64932 [ACK] Seq=48689 Ack=14515 Win=15 Len=1448 TSval=2675320602 TSecr=34774798 [TCP segment of a reassembled PDU]"
"704","29.314789","104.16.133.27","100.86.171.196","TLSv1.2","1461","Application Data"
"705","29.314790","104.16.133.27","100.86.171.196","TCP","1514","443  >  64932 [ACK] Seq=51532 Ack=14515 Win=15 Len=1448 TSval=2675320603 TSecr=34774798 [TCP segment of a reassembled PDU]"
"706","29.314790","104.16.133.27","100.86.171.196","TCP","1514","443  >  64932 [ACK] Seq=52980 Ack=14515 Win=15 Len=1448 TSval=2675320603 TSecr=34774798 [TCP segment of a reassembled PDU]"
"707","29.314791","104.16.133.27","100.86.171.196","TLSv1.2","1196","Application Data"
"708","29.314792","104.16.133.27","100.86.171.196","TCP","1514","443  >  64932 [ACK] Seq=55558 Ack=14515 Win=15 Len=1448 TSval=2675320603 TSecr=34774798 [TCP segment of a reassembled PDU]"
"709","29.314793","104.16.133.27","100.86.171.196","TCP","1514","443  >  64932 [ACK] Seq=57006 Ack=14515 Win=15 Len=1448 TSval=2675320603 TSecr=34774798 [TCP segment of a reassembled PDU]"
"710","29.314794","104.16.133.27","100.86.171.196","TLSv1.2","933","Application Data"
"711","29.314794","104.16.133.27","100.86.171.196","TLSv1.2","155","Application Data"
"712","29.314795","104.16.133.27","100.86.171.196","TLSv1.2","147","Application Data"
"713","29.314795","104.16.133.27","100.86.171.196","TCP","1514","443  >  64932 [ACK] Seq=59491 Ack=14515 Win=15 Len=1448 TSval=2675320604 TSecr=34774798 [TCP segment of a reassembled PDU]"
"714","29.314796","104.16.133.27","100.86.171.196","TCP","1514","443  >  64932 [ACK] Seq=60939 Ack=14515 Win=15 Len=1448 TSval=2675320604 TSecr=34774798 [TCP segment of a reassembled PDU]"
"715","29.314797","104.16.133.27","100.86.171.196","TLSv1.2","1048","Application Data"
"716","29.314798","104.16.133.27","100.86.171.196","TCP","1514","443  >  64932 [ACK] Seq=63369 Ack=14515 Win=15 Len=1448 TSval=2675320604 TSecr=34774798 [TCP segment of a reassembled PDU]"
"717","29.314799","104.16.133.27","100.86.171.196","TCP","1514","443  >  64932 [ACK] Seq=64817 Ack=14515 Win=15 Len=1448 TSval=2675320604 TSecr=34774798 [TCP segment of a reassembled PDU]"
"718","29.314799","104.16.133.27","100.86.171.196","TLSv1.2","1238","Application Data"
"719","29.314800","104.16.133.27","100.86.171.196","TCP","1514","443  >  64932 [ACK] Seq=67437 Ack=14515 Win=15 Len=1448 TSval=2675320605 TSecr=34774798 [TCP segment of a reassembled PDU]"
"720","29.314801","104.16.133.27","100.86.171.196","TCP","1514","443  >  64932 [ACK] Seq=68885 Ack=14515 Win=15 Len=1448 TSval=2675320605 TSecr=34774798 [TCP segment of a reassembled PDU]"
"721","29.314802","104.16.133.27","100.86.171.196","TLSv1.2","1152","Application Data"
"722","29.314803","104.16.133.27","100.86.171.196","TCP","1514","443  >  64932 [ACK] Seq=71419 Ack=14515 Win=15 Len=1448 TSval=2675320606 TSecr=34774798 [TCP segment of a reassembled PDU]"
"723","29.314803","104.16.133.27","100.86.171.196","TCP","1514","443  >  64932 [ACK] Seq=72867 Ack=14515 Win=15 Len=1448 TSval=2675320606 TSecr=34774798 [TCP segment of a reassembled PDU]"
"724","29.314804","104.16.133.27","100.86.171.196","TLSv1.2","811","Application Data"
"725","29.314805","104.16.133.27","100.86.171.196","TCP","1514","443  >  64932 [ACK] Seq=75060 Ack=14515 Win=15 Len=1448 TSval=2675320606 TSecr=34774798 [TCP segment of a reassembled PDU]"
"726","29.314806","104.16.133.27","100.86.171.196","TCP","1514","443  >  64932 [ACK] Seq=76508 Ack=14515 Win=15 Len=1448 TSval=2675320606 TSecr=34774798 [TCP segment of a reassembled PDU]"
"727","29.314807","104.16.133.27","100.86.171.196","TLSv1.2","151","Application Data"
"728","29.314807","104.16.133.27","100.86.171.196","TCP","1514","443  >  64932 [ACK] Seq=78041 Ack=14515 Win=15 Len=1448 TSval=2675320607 TSecr=34774798 [TCP segment of a reassembled PDU]"
"729","29.314808","104.16.133.27","100.86.171.196","TCP","1514","443  >  64932 [ACK] Seq=79489 Ack=14515 Win=15 Len=1448 TSval=2675320607 TSecr=34774798 [TCP segment of a reassembled PDU]"
"730","29.314809","104.16.133.27","100.86.171.196","TLSv1.2","1063","Application Data"
"731","29.314810","104.16.133.27","100.86.171.196","TCP","1514","443  >  64932 [ACK] Seq=81934 Ack=14515 Win=15 Len=1448 TSval=2675320607 TSecr=34774798 [TCP segment of a reassembled PDU]"
"732","29.314811","104.16.133.27","100.86.171.196","TLSv1.2","1065","Application Data"
"733","29.314942","100.86.171.196","104.16.133.27","TCP","66","64932  >  443 [ACK] Seq=14515 Ack=60939 Win=12201 Len=0 TSval=34774897 TSecr=2675320604"
"734","29.314959","100.86.171.196","104.16.133.27","TCP","66","64932  >  443 [ACK] Seq=14515 Ack=76508 Win=11958 Len=0 TSval=34774897 TSecr=2675320606"
"735","29.314966","100.86.171.196","104.16.133.27","TCP","66","64932  >  443 [ACK] Seq=14515 Ack=84381 Win=11835 Len=0 TSval=34774897 TSecr=2675320607"
"736","29.315038","100.86.171.196","104.16.133.27","TCP","66","[TCP Window Update] 64932  >  443 [ACK] Seq=14515 Ack=84381 Win=12436 Len=0 TSval=34774897 TSecr=2675320607"
"737","29.316474","104.16.133.27","100.86.171.196","TLSv1.2","98","Application Data"
"738","29.316475","104.16.133.27","100.86.171.196","TLSv1.2","97","Application Data"
"739","29.316569","100.86.171.196","104.16.133.27","TCP","66","64932  >  443 [ACK] Seq=14515 Ack=84444 Win=12435 Len=0 TSval=34774899 TSecr=2675320607"
"741","29.440418","100.86.171.196","104.16.133.27","TLSv1.2","1176","Application Data"
"746","29.458407","104.16.133.27","100.86.171.196","TCP","66","443  >  64932 [ACK] Seq=84444 Ack=15625 Win=15 Len=0 TSval=2675320751 TSecr=34775023"
"747","29.560111","104.16.133.27","100.86.171.196","TLSv1.2","164","Application Data"
"748","29.560112","104.16.133.27","100.86.171.196","TLSv1.2","868","Application Data"
"749","29.560113","104.16.133.27","100.86.171.196","TLSv1.2","97","Application Data"
"750","29.560218","100.86.171.196","104.16.133.27","TCP","66","64932  >  443 [ACK] Seq=15625 Ack=85375 Win=12421 Len=0 TSval=34775143 TSecr=2675320852"
"1192","30.755403","100.86.171.196","104.16.133.27","TLSv1.2","125","Application Data"
"1215","30.772616","104.16.133.27","100.86.171.196","TCP","66","443  >  64937 [ACK] Seq=4900 Ack=8280 Win=8 Len=0 TSval=1601490924 TSecr=1548782504"
"1258","30.816408","104.16.133.27","100.86.171.196","TLSv1.2","510","Application Data"
"1259","30.816478","100.86.171.196","104.16.133.27","TCP","66","64937  >  443 [ACK] Seq=8280 Ack=5344 Win=2041 Len=0 TSval=1548782565 TSecr=1601490968"
"1260","30.818375","100.86.171.196","104.16.133.27","TLSv1.2","139","Application Data"
"1261","30.818578","100.86.171.196","104.16.133.27","TLSv1.2","1265","Application Data"
"1265","30.835670","104.16.133.27","100.86.171.196","TCP","66","443  >  64937 [ACK] Seq=5344 Ack=9552 Win=8 Len=0 TSval=1601490987 TSecr=1548782567"
"1266","30.880117","104.16.133.27","100.86.171.196","TLSv1.2","230","Application Data"
"1267","30.880119","104.16.133.27","100.86.171.196","TLSv1.2","99","Application Data"
"1268","30.880119","104.16.133.27","100.86.171.196","TLSv1.2","97","Application Data"
"1269","30.880204","100.86.171.196","104.16.133.27","TCP","66","64937  >  443 [ACK] Seq=9552 Ack=5572 Win=2044 Len=0 TSval=1548782629 TSecr=1601491031"
"1270","31.014585","100.86.171.196","104.16.133.27","TCP","1454","64932  >  443 [ACK] Seq=15625 Ack=85375 Win=12436 Len=1388 TSval=34776597 TSecr=2675320852 [TCP segment of a reassembled PDU]"
"1271","31.014618","100.86.171.196","104.16.133.27","TLSv1.2","506","Application Data"
"1272","31.019142","100.86.171.196","104.16.133.27","TLSv1.2","1225","Application Data"
"1274","31.032515","104.16.133.27","100.86.171.196","TCP","66","443  >  64932 [ACK] Seq=85375 Ack=17453 Win=15 Len=0 TSval=2675322325 TSecr=34776597"
"1275","31.036846","104.16.133.27","100.86.171.196","TCP","66","443  >  64932 [ACK] Seq=85375 Ack=18612 Win=15 Len=0 TSval=2675322329 TSecr=34776602"
"1278","31.056841","104.16.133.27","100.86.171.196","TLSv1.2","446","Application Data"
"1279","31.056843","104.16.133.27","100.86.171.196","TCP","1514","443  >  64932 [ACK] Seq=85755 Ack=18612 Win=15 Len=1448 TSval=2675322349 TSecr=34776602 [TCP segment of a reassembled PDU]"
"1280","31.056844","104.16.133.27","100.86.171.196","TLSv1.2","1424","Application Data"
"1281","31.056845","104.16.133.27","100.86.171.196","TLSv1.2","97","Application Data"
"1282","31.056965","100.86.171.196","104.16.133.27","TCP","66","64932  >  443 [ACK] Seq=18612 Ack=88592 Win=12386 Len=0 TSval=34776639 TSecr=2675322349"
"1283","31.058880","100.86.171.196","104.16.133.27","TCP","66","[TCP Window Update] 64932  >  443 [ACK] Seq=18612 Ack=88592 Win=12436 Len=0 TSval=34776641 TSecr=2675322349"
"1284","31.060681","104.16.133.27","100.86.171.196","TLSv1.2","259","Application Data"
"1285","31.060768","100.86.171.196","104.16.133.27","TCP","66","64932  >  443 [ACK] Seq=18612 Ack=88785 Win=12433 Len=0 TSval=34776643 TSecr=2675322353"
"1286","31.062157","104.16.133.27","100.86.171.196","TCP","1514","443  >  64932 [ACK] Seq=88785 Ack=18612 Win=15 Len=1448 TSval=2675322353 TSecr=34776602 [TCP segment of a reassembled PDU]"
"1287","31.062160","104.16.133.27","100.86.171.196","TCP","1514","443  >  64932 [ACK] Seq=90233 Ack=18612 Win=15 Len=1448 TSval=2675322353 TSecr=34776602 [TCP segment of a reassembled PDU]"
"1288","31.062312","100.86.171.196","104.16.133.27","TCP","66","64932  >  443 [ACK] Seq=18612 Ack=91681 Win=12391 Len=0 TSval=34776645 TSecr=2675322353"
"1289","31.063640","104.16.133.27","100.86.171.196","TLSv1.2","1145","Application Data"
"1290","31.063641","104.16.133.27","100.86.171.196","TLSv1.2","97","Application Data"
"1291","31.063739","100.86.171.196","104.16.133.27","TCP","66","64932  >  443 [ACK] Seq=18612 Ack=92791 Win=12373 Len=0 TSval=34776646 TSecr=2675322353"
"1292","31.065149","100.86.171.196","104.16.133.27","TCP","66","[TCP Window Update] 64932  >  443 [ACK] Seq=18612 Ack=92791 Win=12436 Len=0 TSval=34776648 TSecr=2675322353"
"1295","31.087857","100.86.171.196","104.16.133.27","TCP","1454","64932  >  443 [ACK] Seq=18612 Ack=92791 Win=12436 Len=1388 TSval=34776670 TSecr=2675322353 [TCP segment of a reassembled PDU]"
"1296","31.087997","100.86.171.196","104.16.133.27","TLSv1.2","375","Application Data"
"1297","31.105539","104.16.133.27","100.86.171.196","TCP","66","443  >  64932 [ACK] Seq=92791 Ack=20309 Win=15 Len=0 TSval=2675322398 TSecr=34776670"
"1330","31.268208","100.86.171.196","104.16.133.27","TLSv1.2","1158","Application Data"
"1331","31.279732","104.16.133.27","100.86.171.196","TLSv1.2","816","Application Data"
"1332","31.279734","104.16.133.27","100.86.171.196","TCP","1514","443  >  64932 [ACK] Seq=93541 Ack=20309 Win=15 Len=1448 TSval=2675322573 TSecr=34776670 [TCP segment of a reassembled PDU]"
"1333","31.279734","104.16.133.27","100.86.171.196","TCP","1514","443  >  64932 [ACK] Seq=94989 Ack=20309 Win=15 Len=1448 TSval=2675322573 TSecr=34776670 [TCP segment of a reassembled PDU]"
"1334","31.279735","104.16.133.27","100.86.171.196","TCP","1514","443  >  64932 [ACK] Seq=96437 Ack=20309 Win=15 Len=1448 TSval=2675322573 TSecr=34776670 [TCP segment of a reassembled PDU]"
"1335","31.279833","100.86.171.196","104.16.133.27","TCP","66","64932  >  443 [ACK] Seq=21401 Ack=97885 Win=12356 Len=0 TSval=34776862 TSecr=2675322573"
"1336","31.279940","100.86.171.196","104.16.133.27","TCP","66","[TCP Window Update] 64932  >  443 [ACK] Seq=21401 Ack=97885 Win=12436 Len=0 TSval=34776862 TSecr=2675322573"
"1337","31.281049","104.16.133.27","100.86.171.196","TLSv1.2","220","Application Data"
"1338","31.281049","104.16.133.27","100.86.171.196","TLSv1.2","98","Application Data"
"1339","31.281050","104.16.133.27","100.86.171.196","TLSv1.2","97","Application Data"
"1340","31.281106","100.86.171.196","104.16.133.27","TCP","66","64932  >  443 [ACK] Seq=21401 Ack=98102 Win=12432 Len=0 TSval=34776864 TSecr=2675322573"
"1341","31.326158","104.16.133.27","100.86.171.196","TCP","66","443  >  64932 [ACK] Seq=98102 Ack=21401 Win=15 Len=0 TSval=2675322619 TSecr=34776851"
"1342","31.414936","100.86.171.196","104.16.133.27","TLSv1.2","117","Application Data"
"1343","31.415269","100.86.171.196","104.16.133.27","TCP","1454","64937  >  443 [ACK] Seq=9603 Ack=5572 Win=2048 Len=1388 TSval=1548783163 TSecr=1601491031 [TCP segment of a reassembled PDU]"
"1344","31.415287","100.86.171.196","104.16.133.27","TLSv1.2","1217","Application Data"
"1345","31.432286","104.16.133.27","100.86.171.196","TCP","66","443  >  64937 [ACK] Seq=5572 Ack=9603 Win=8 Len=0 TSval=1601491583 TSecr=1548783163"
"1346","31.432287","104.16.133.27","100.86.171.196","TCP","66","443  >  64937 [ACK] Seq=5572 Ack=12142 Win=8 Len=0 TSval=1601491584 TSecr=1548783163"
"1347","31.443777","104.16.133.27","100.86.171.196","TLSv1.2","186","Application Data"
"1348","31.443778","104.16.133.27","100.86.171.196","TLSv1.2","257","Application Data"
"1349","31.443779","104.16.133.27","100.86.171.196","TLSv1.2","97","Application Data"
"1350","31.443866","100.86.171.196","104.16.133.27","TCP","66","64932  >  443 [ACK] Seq=21401 Ack=98444 Win=12430 Len=0 TSval=34777026 TSecr=2675322736"
"1351","31.483276","104.16.133.27","100.86.171.196","TLSv1.2","485","Application Data"
"1352","31.483278","104.16.133.27","100.86.171.196","TLSv1.2","99","Application Data"
"1353","31.483278","104.16.133.27","100.86.171.196","TLSv1.2","97","Application Data"
"1354","31.483386","100.86.171.196","104.16.133.27","TCP","66","64937  >  443 [ACK] Seq=12142 Ack=6055 Win=2040 Len=0 TSval=1548783232 TSecr=1601491634"
"1630","32.413132","100.86.171.196","104.16.133.27","TLSv1.2","117","Application Data"
"1631","32.413395","100.86.171.196","104.16.133.27","TCP","1454","64937  >  443 [ACK] Seq=12193 Ack=6055 Win=2048 Len=1388 TSval=1548784162 TSecr=1601491634 [TCP segment of a reassembled PDU]"
"1632","32.413397","100.86.171.196","104.16.133.27","TCP","1454","64937  >  443 [ACK] Seq=13581 Ack=6055 Win=2048 Len=1388 TSval=1548784162 TSecr=1601491634 [TCP segment of a reassembled PDU]"
"1633","32.413399","100.86.171.196","104.16.133.27","TCP","1454","64937  >  443 [ACK] Seq=14969 Ack=6055 Win=2048 Len=1388 TSval=1548784162 TSecr=1601491634 [TCP segment of a reassembled PDU]"
"1634","32.413399","100.86.171.196","104.16.133.27","TCP","1454","64937  >  443 [ACK] Seq=16357 Ack=6055 Win=2048 Len=1388 TSval=1548784162 TSecr=1601491634 [TCP segment of a reassembled PDU]"
"1635","32.413412","100.86.171.196","104.16.133.27","TLSv1.2","251","Application Data"
"1636","32.430483","104.16.133.27","100.86.171.196","TCP","66","443  >  64937 [ACK] Seq=6055 Ack=12193 Win=8 Len=0 TSval=1601492582 TSecr=1548784162"
"1637","32.431740","104.16.133.27","100.86.171.196","TCP","66","443  >  64937 [ACK] Seq=6055 Ack=14969 Win=8 Len=0 TSval=1601492583 TSecr=1548784162"
"1638","32.431741","104.16.133.27","100.86.171.196","TCP","66","443  >  64937 [ACK] Seq=6055 Ack=17745 Win=8 Len=0 TSval=1601492583 TSecr=1548784162"
"1639","32.431741","104.16.133.27","100.86.171.196","TCP","66","443  >  64937 [ACK] Seq=6055 Ack=17930 Win=8 Len=0 TSval=1601492583 TSecr=1548784162"
"1640","32.499854","104.16.133.27","100.86.171.196","TLSv1.2","464","Application Data"
"1641","32.499856","104.16.133.27","100.86.171.196","TLSv1.2","99","Application Data"
"1642","32.499856","104.16.133.27","100.86.171.196","TLSv1.2","97","Application Data"
"1643","32.499944","100.86.171.196","104.16.133.27","TCP","66","64937  >  443 [ACK] Seq=17930 Ack=6517 Win=2040 Len=0 TSval=1548784248 TSecr=1601492651"
