"No.","Time","Source","Destination","Protocol","Length","Info"
"1","0.000000","100.86.7.137","13.84.36.2","TLSv1.2","1691","Application Data"
"2","0.000177","100.86.7.137","13.84.36.2","TLSv1.2","93","Application Data"
"3","0.044937","13.84.36.2","100.86.7.137","TCP","56","443  >  57514 [ACK] Seq=1 Ack=1638 Win=16385 Len=0"
"4","0.046288","13.84.36.2","100.86.7.137","TLSv1.2","93","Application Data"
"5","0.054188","100.86.7.137","13.84.36.2","TCP","54","57513  >  443 [FIN, ACK] Seq=1 Ack=1 Win=517 Len=0"
"6","0.097611","100.86.7.137","13.84.36.2","TCP","54","57514  >  443 [ACK] Seq=1677 Ack=40 Win=2065 Len=0"
"7","0.113968","13.84.36.2","100.86.7.137","TCP","2974","443  >  57514 [ACK] Seq=40 Ack=1677 Win=16384 Len=2920 [TCP segment of a reassembled PDU]"
"8","0.113968","13.84.36.2","100.86.7.137","TLSv1.2","1297","Application Data, Application Data"
"9","0.113968","13.84.36.2","100.86.7.137","TCP","56","443  >  57513 [FIN, ACK] Seq=1 Ack=2 Win=16380 Len=0"
"10","0.113968","13.84.36.2","100.86.7.137","TCP","2974","443  >  57514 [ACK] Seq=4203 Ack=1677 Win=16384 Len=2920 [TCP segment of a reassembled PDU]"
"11","0.113968","13.84.36.2","100.86.7.137","TLSv1.2","1277","Application Data, Application Data"
"12","0.113968","13.84.36.2","100.86.7.137","TLSv1.2","7354","Application Data"
"13","0.113968","13.84.36.2","100.86.7.137","TLSv1.2","990","Application Data"
"14","0.113968","13.84.36.2","100.86.7.137","TCP","2974","443  >  57514 [ACK] Seq=16582 Ack=1677 Win=16384 Len=2920 [TCP segment of a reassembled PDU]"
"15","0.113968","13.84.36.2","100.86.7.137","TLSv1.2","1252","Application Data"
"16","0.113968","13.84.36.2","100.86.7.137","TLSv1.2","153","Application Data"
"17","0.113968","13.84.36.2","100.86.7.137","TLSv1.2","85","Application Data"
"18","0.114218","100.86.7.137","13.84.36.2","TCP","54","57513  >  443 [ACK] Seq=2 Ack=2 Win=517 Len=0"
"19","0.114505","100.86.7.137","13.84.36.2","TCP","54","57514  >  443 [ACK] Seq=1677 Ack=20830 Win=2070 Len=0"
"20","0.118345","100.86.7.137","13.84.36.2","TLSv1.2","89","Application Data"
"21","0.210589","13.84.36.2","100.86.7.137","TCP","56","443  >  57514 [ACK] Seq=20830 Ack=1712 Win=16384 Len=0"
"22","0.217531","100.86.7.137","13.84.36.2","TLSv1.2","862","Application Data"
"23","0.218522","100.86.7.137","13.84.36.2","TLSv1.2","1441","Application Data"
"24","0.263228","13.84.36.2","100.86.7.137","TCP","56","443  >  57514 [ACK] Seq=20830 Ack=3907 Win=16385 Len=0"
"25","0.271734","13.84.36.2","100.86.7.137","TCP","1514","443  >  57514 [ACK] Seq=20830 Ack=3907 Win=16385 Len=1460 [TCP segment of a reassembled PDU]"
"26","0.271899","13.84.36.2","100.86.7.137","TCP","1514","443  >  57514 [ACK] Seq=22290 Ack=3907 Win=16385 Len=1460 [TCP segment of a reassembled PDU]"
"27","0.271899","13.84.36.2","100.86.7.137","TLSv1.2","295","Application Data"
"28","0.272000","100.86.7.137","13.84.36.2","TCP","54","57514  >  443 [ACK] Seq=3907 Ack=23991 Win=2070 Len=0"
"29","0.272260","13.84.36.2","100.86.7.137","TLSv1.2","968","Application Data"
"30","0.272304","100.86.7.137","13.84.36.2","TCP","54","57514  >  443 [ACK] Seq=3907 Ack=24905 Win=2066 Len=0"
"31","0.274351","13.84.36.2","100.86.7.137","TCP","1514","443  >  57514 [ACK] Seq=24905 Ack=3907 Win=16385 Len=1460 [TCP segment of a reassembled PDU]"
"32","0.274748","13.84.36.2","100.86.7.137","TCP","1514","443  >  57514 [ACK] Seq=26365 Ack=3907 Win=16385 Len=1460 [TCP segment of a reassembled PDU]"
"33","0.274748","13.84.36.2","100.86.7.137","TLSv1.2","861","Application Data"
"34","0.274816","100.86.7.137","13.84.36.2","TCP","54","57514  >  443 [ACK] Seq=3907 Ack=28632 Win=2070 Len=0"
"35","0.275125","13.84.36.2","100.86.7.137","TCP","1514","443  >  57514 [ACK] Seq=28632 Ack=3907 Win=16385 Len=1460 [TCP segment of a reassembled PDU]"
"36","0.275125","13.84.36.2","100.86.7.137","TLSv1.2","434","Application Data"
"37","0.275169","100.86.7.137","13.84.36.2","TCP","54","57514  >  443 [ACK] Seq=3907 Ack=30472 Win=2070 Len=0"
"38","0.279971","13.84.36.2","100.86.7.137","TCP","1514","443  >  57514 [ACK] Seq=30472 Ack=3907 Win=16385 Len=1460 [TCP segment of a reassembled PDU]"
"39","0.280066","100.86.7.137","13.84.36.2","TCP","54","57514  >  443 [ACK] Seq=3907 Ack=31932 Win=2070 Len=0"
"40","0.280215","13.84.36.2","100.86.7.137","TCP","1514","443  >  57514 [ACK] Seq=31932 Ack=3907 Win=16385 Len=1460 [TCP segment of a reassembled PDU]"
"41","0.280215","13.84.36.2","100.86.7.137","TLSv1.2","1277","Application Data, Application Data"
"42","0.280335","100.86.7.137","13.84.36.2","TCP","54","57514  >  443 [ACK] Seq=3907 Ack=34615 Win=2070 Len=0"
"43","0.280715","13.84.36.2","100.86.7.137","TCP","2974","443  >  57514 [ACK] Seq=34615 Ack=3907 Win=16385 Len=2920 [TCP segment of a reassembled PDU]"
"44","0.280715","13.84.36.2","100.86.7.137","TLSv1.2","1252","Application Data"
"45","0.280715","13.84.36.2","100.86.7.137","TLSv1.2","5894","Application Data"
"46","0.280715","13.84.36.2","100.86.7.137","TLSv1.2","673","Application Data"
"47","0.280786","100.86.7.137","13.84.36.2","TCP","54","57514  >  443 [ACK] Seq=3907 Ack=45192 Win=2070 Len=0"
"48","0.281806","13.84.36.2","100.86.7.137","TLSv1.2","85","Application Data"
"49","0.313828","13.84.36.2","100.86.7.137","TCP","2974","443  >  57514 [ACK] Seq=45223 Ack=3907 Win=16385 Len=2920 [TCP segment of a reassembled PDU]"
"50","0.313828","13.84.36.2","100.86.7.137","TLSv1.2","1276","Application Data, Application Data"
"51","0.313828","13.84.36.2","100.86.7.137","TLSv1.2","7354","Application Data"
"52","0.313828","13.84.36.2","100.86.7.137","TLSv1.2","1423","Application Data, Application Data"
"53","0.313828","13.84.36.2","100.86.7.137","TLSv1.2","23414","Application Data, Application Data, Application Data, Application Data, Application Data"
"54","0.313828","13.84.36.2","100.86.7.137","TLSv1.2","1402","Application Data"
"55","0.313828","13.84.36.2","100.86.7.137","TLSv1.2","7354","Application Data"
"56","0.314096","100.86.7.137","13.84.36.2","TCP","54","57514  >  443 [ACK] Seq=3907 Ack=90042 Win=2070 Len=0"
"57","0.314788","13.84.36.2","100.86.7.137","TLSv1.2","20494","Application Data, Application Data, Application Data, Application Data, Application Data"
"58","0.314845","100.86.7.137","13.84.36.2","TCP","54","57514  >  443 [ACK] Seq=3907 Ack=110482 Win=2070 Len=0"
"59","0.314930","13.84.36.2","100.86.7.137","TLSv1.2","1514","Application Data"
"60","0.314930","13.84.36.2","100.86.7.137","TLSv1.2","855","Application Data"
"61","0.314968","100.86.7.137","13.84.36.2","TCP","54","57514  >  443 [ACK] Seq=3907 Ack=112743 Win=2070 Len=0"
"62","0.317129","13.84.36.2","100.86.7.137","TCP","2974","443  >  57514 [ACK] Seq=112743 Ack=3907 Win=16385 Len=2920 [TCP segment of a reassembled PDU]"
"63","0.317129","13.84.36.2","100.86.7.137","TLSv1.2","1276","Application Data, Application Data"
"64","0.317220","100.86.7.137","13.84.36.2","TCP","54","57514  >  443 [ACK] Seq=3907 Ack=116885 Win=2070 Len=0"
"65","0.318863","13.84.36.2","100.86.7.137","TLSv1.2","20494","Application Data, Application Data, Application Data, Application Data"
"66","0.318956","100.86.7.137","13.84.36.2","TCP","54","57514  >  443 [ACK] Seq=3907 Ack=137325 Win=2070 Len=0"
"67","0.320271","13.84.36.2","100.86.7.137","TLSv1.2","204","Application Data"
"68","0.320271","13.84.36.2","100.86.7.137","TLSv1.2","11734","Application Data, Application Data"
"69","0.320271","13.84.36.2","100.86.7.137","TLSv1.2","728","Application Data"
"70","0.320271","13.84.36.2","100.86.7.137","TLSv1.2","29254","Application Data, Application Data, Application Data, Application Data, Application Data, Application Data, Application Data"
"71","0.320373","100.86.7.137","13.84.36.2","TCP","54","57514  >  443 [ACK] Seq=3907 Ack=179029 Win=2070 Len=0"
"72","0.321166","13.84.36.2","100.86.7.137","TLSv1.2","897","Application Data"
"73","0.321209","100.86.7.137","13.84.36.2","TCP","54","57514  >  443 [ACK] Seq=3907 Ack=179872 Win=2066 Len=0"
"74","0.325915","13.84.36.2","100.86.7.137","TCP","2974","443  >  57514 [ACK] Seq=179872 Ack=3907 Win=16385 Len=2920 [TCP segment of a reassembled PDU]"
"75","0.325915","13.84.36.2","100.86.7.137","TLSv1.2","1276","Application Data, Application Data"
"76","0.325915","13.84.36.2","100.86.7.137","TLSv1.2","23414","Application Data, Application Data, Application Data, Application Data, Application Data"
"77","0.325915","13.84.36.2","100.86.7.137","TLSv1.2","1402","Application Data"
"78","0.325915","13.84.36.2","100.86.7.137","TLSv1.2","17574","Application Data, Application Data, Application Data, Application Data"
"79","0.326203","100.86.7.137","13.84.36.2","TCP","54","57514  >  443 [ACK] Seq=3907 Ack=226242 Win=2070 Len=0"
"80","0.326983","13.84.36.2","100.86.7.137","TLSv1.2","10274","Application Data, Application Data"
"81","0.326983","13.84.36.2","100.86.7.137","TLSv1.2","1140","Application Data"
"82","0.326983","13.84.36.2","100.86.7.137","TLSv1.2","8814","Application Data, Application Data"
"83","0.326983","13.84.36.2","100.86.7.137","TLSv1.2","167","Application Data"
"84","0.327169","100.86.7.137","13.84.36.2","TCP","54","57514  >  443 [ACK] Seq=3907 Ack=246421 Win=2070 Len=0"
"85","0.335135","13.84.36.2","100.86.7.137","TCP","2974","443  >  57514 [ACK] Seq=246421 Ack=3907 Win=16385 Len=2920 [TCP segment of a reassembled PDU]"
"86","0.335135","13.84.36.2","100.86.7.137","TLSv1.2","1276","Application Data, Application Data"
"87","0.335135","13.84.36.2","100.86.7.137","TLSv1.2","17574","Application Data, Application Data, Application Data, Application Data"
"88","0.335237","100.86.7.137","13.84.36.2","TCP","54","57514  >  443 [ACK] Seq=3907 Ack=268083 Win=2070 Len=0"
"89","0.336134","100.86.7.137","13.84.36.2","TLSv1.2","935","Application Data"
"90","0.336968","13.84.36.2","100.86.7.137","TLSv1.2","5894","Application Data"
"91","0.336968","13.84.36.2","100.86.7.137","TLSv1.2","1402","Application Data"
"92","0.336968","13.84.36.2","100.86.7.137","TLSv1.2","23414","Application Data, Application Data, Application Data, Application Data, Application Data"
"93","0.336968","13.84.36.2","100.86.7.137","TLSv1.2","1402","Application Data"
"94","0.336968","13.84.36.2","100.86.7.137","TLSv1.2","11734","Application Data, Application Data"
"95","0.337085","100.86.7.137","13.84.36.2","TCP","54","57514  >  443 [ACK] Seq=4788 Ack=311659 Win=2070 Len=0"
"96","0.339578","13.84.36.2","100.86.7.137","TLSv1.2","1514","Application Data"
"97","0.339578","13.84.36.2","100.86.7.137","TLSv1.2","871","Application Data"
"98","0.339578","13.84.36.2","100.86.7.137","TLSv1.2","4434","Application Data, Application Data"
"99","0.339578","13.84.36.2","100.86.7.137","TLSv1.2","1392","Application Data"
"100","0.339578","13.84.36.2","100.86.7.137","TLSv1.2","20494","Application Data, Application Data, Application Data, Application Data"
"101","0.339578","13.84.36.2","100.86.7.137","TLSv1.2","204","Application Data"
"102","0.339578","13.84.36.2","100.86.7.137","TLSv1.2","7354","Application Data"
"103","0.339578","13.84.36.2","100.86.7.137","TLSv1.2","168","Application Data"
"104","0.339724","100.86.7.137","13.84.36.2","TCP","54","57514  >  443 [ACK] Seq=4788 Ack=313936 Win=2070 Len=0"
"105","0.339864","100.86.7.137","13.84.36.2","TCP","54","57514  >  443 [ACK] Seq=4788 Ack=347658 Win=4140 Len=0"
"106","0.340573","13.84.36.2","100.86.7.137","TLSv1.2","85","Application Data"
"107","0.340620","100.86.7.137","13.84.36.2","TCP","54","57514  >  443 [ACK] Seq=4788 Ack=347689 Win=4139 Len=0"
"108","0.399239","13.84.36.2","100.86.7.137","TCP","1514","443  >  57514 [ACK] Seq=347689 Ack=4788 Win=16381 Len=1460 [TCP segment of a reassembled PDU]"
"109","0.403727","13.84.36.2","100.86.7.137","TCP","1514","443  >  57514 [ACK] Seq=349149 Ack=4788 Win=16381 Len=1460 [TCP segment of a reassembled PDU]"
"110","0.403727","13.84.36.2","100.86.7.137","TLSv1.2","285","Application Data"
"111","0.403727","13.84.36.2","100.86.7.137","TLSv1.2","20494","Application Data, Application Data, Application Data, Application Data"
"112","0.403727","13.84.36.2","100.86.7.137","TLSv1.2","204","Application Data"
"113","0.403727","13.84.36.2","100.86.7.137","TLSv1.2","23414","Application Data, Application Data, Application Data, Application Data, Application Data"
"114","0.403727","13.84.36.2","100.86.7.137","TLSv1.2","1402","Application Data"
"115","0.403727","13.84.36.2","100.86.7.137","TLSv1.2","11734","Application Data, Application Data"
"116","0.403727","13.84.36.2","100.86.7.137","TLSv1.2","728","Application Data"
"117","0.403727","13.84.36.2","100.86.7.137","TLSv1.2","7354","Application Data"
"118","0.403727","13.84.36.2","100.86.7.137","TLSv1.2","1048","Application Data, Application Data"
"119","0.403727","13.84.36.2","100.86.7.137","TLSv1.2","209","Application Data"
"120","0.403727","13.84.36.2","100.86.7.137","TLSv1.2","85","Application Data"
"121","0.404129","100.86.7.137","13.84.36.2","TCP","54","57514  >  443 [ACK] Seq=4788 Ack=416972 Win=4135 Len=0"
"122","0.409011","100.86.7.137","13.84.36.2","TLSv1.2","1489","Application Data"
"123","0.409315","100.86.7.137","13.84.36.2","TLSv1.2","977","Application Data"
"124","0.409516","100.86.7.137","13.84.36.2","TLSv1.2","1492","Application Data"
"125","0.412395","100.86.7.137","13.84.36.2","TLSv1.2","948","Application Data"
"126","0.412650","100.86.7.137","13.84.36.2","TLSv1.2","1469","Application Data"
"127","0.420512","100.86.7.137","13.84.36.2","TLSv1.2","913","Application Data"
"128","0.420726","100.86.7.137","13.84.36.2","TLSv1.2","1465","Application Data"
"129","0.446151","100.86.7.137","13.84.36.2","TLSv1.2","90","Application Data"
"130","0.446263","100.86.7.137","13.84.36.2","TLSv1.2","90","Application Data"
"131","0.446343","100.86.7.137","13.84.36.2","TLSv1.2","90","Application Data"
"132","0.446380","100.86.7.137","13.84.36.2","TLSv1.2","90","Application Data"
"133","0.446548","100.86.7.137","13.84.36.2","TLSv1.2","90","Application Data"
"134","0.446587","100.86.7.137","13.84.36.2","TLSv1.2","90","Application Data"
"135","0.446618","100.86.7.137","13.84.36.2","TLSv1.2","90","Application Data"
"136","0.446648","100.86.7.137","13.84.36.2","TLSv1.2","90","Application Data"
"137","0.446680","100.86.7.137","13.84.36.2","TLSv1.2","90","Application Data"
"138","0.453972","13.84.36.2","100.86.7.137","TCP","56","443  >  57514 [ACK] Seq=416972 Ack=7146 Win=16385 Len=0"
"139","0.457740","13.84.36.2","100.86.7.137","TCP","56","443  >  57514 [ACK] Seq=416972 Ack=9478 Win=16385 Len=0"
"140","0.465512","13.84.36.2","100.86.7.137","TCP","56","443  >  57514 [ACK] Seq=416972 Ack=11752 Win=16385 Len=0"
"141","0.482416","13.84.36.2","100.86.7.137","TCP","2974","443  >  57514 [ACK] Seq=416972 Ack=13163 Win=16379 Len=2920 [TCP segment of a reassembled PDU]"
"142","0.482416","13.84.36.2","100.86.7.137","TLSv1.2","291","Application Data"
"143","0.482416","13.84.36.2","100.86.7.137","TCP","2974","443  >  57514 [ACK] Seq=420129 Ack=13163 Win=16379 Len=2920 [TCP segment of a reassembled PDU]"
"144","0.482416","13.84.36.2","100.86.7.137","TLSv1.2","1252","Application Data"
"145","0.482416","13.84.36.2","100.86.7.137","TLSv1.2","4434","Application Data"
"146","0.482416","13.84.36.2","100.86.7.137","TLSv1.2","225","Application Data"
"147","0.482416","13.84.36.2","100.86.7.137","TLSv1.2","7354","Application Data"
"148","0.482993","100.86.7.137","13.84.36.2","TCP","54","57514  >  443 [ACK] Seq=13487 Ack=436098 Win=4140 Len=0"
"149","0.499898","13.84.36.2","100.86.7.137","TLSv1.2","4434","Application Data"
"150","0.499898","13.84.36.2","100.86.7.137","TLSv1.2","728","Application Data"
"151","0.499898","13.84.36.2","100.86.7.137","TLSv1.2","27794","Application Data, Application Data, Application Data, Application Data, Application Data, Application Data"
"152","0.499898","13.84.36.2","100.86.7.137","TLSv1.2","1140","Application Data"
"153","0.499898","13.84.36.2","100.86.7.137","TLSv1.2","23414","Application Data, Application Data, Application Data, Application Data, Application Data"
"154","0.499898","13.84.36.2","100.86.7.137","TLSv1.2","1402","Application Data"
"155","0.499898","13.84.36.2","100.86.7.137","TLSv1.2","112","Application Data"
"156","0.499898","13.84.36.2","100.86.7.137","TLSv1.2","23414","Application Data, Application Data, Application Data, Application Data, Application Data"
"157","0.499898","13.84.36.2","100.86.7.137","TLSv1.2","1402","Application Data"
"158","0.499898","13.84.36.2","100.86.7.137","TLSv1.2","27794","Application Data, Application Data, Application Data, Application Data, Application Data, Application Data"
"159","0.499898","13.84.36.2","100.86.7.137","TLSv1.2","1140","Application Data"
"160","0.499898","13.84.36.2","100.86.7.137","TLSv1.2","769","Application Data"
"161","0.499898","13.84.36.2","100.86.7.137","TCP","2974","443  >  57514 [ACK] Seq=548993 Ack=13163 Win=16379 Len=2920 [TCP segment of a reassembled PDU]"
"162","0.499898","13.84.36.2","100.86.7.137","TLSv1.2","285","Application Data"
"163","0.499898","13.84.36.2","100.86.7.137","TLSv1.2","219","Application Data"
"164","0.499898","13.84.36.2","100.86.7.137","TLSv1.2","23414","Application Data, Application Data, Application Data, Application Data, Application Data"
"165","0.499898","13.84.36.2","100.86.7.137","TLSv1.2","1402","Application Data"
"166","0.499898","13.84.36.2","100.86.7.137","TLSv1.2","27794","Application Data, Application Data, Application Data, Application Data, Application Data, Application Data"
"167","0.499898","13.84.36.2","100.86.7.137","TLSv1.2","1140","Application Data"
"168","0.499898","13.84.36.2","100.86.7.137","TLSv1.2","11734","Application Data, Application Data"
"169","0.499898","13.84.36.2","100.86.7.137","TLSv1.2","786","Application Data, Application Data"
"170","0.499898","13.84.36.2","100.86.7.137","TLSv1.2","32174","Application Data, Application Data, Application Data, Application Data, Application Data, Application Data, Application Data"
"171","0.499898","13.84.36.2","100.86.7.137","TLSv1.2","878","Application Data"
"172","0.499898","13.84.36.2","100.86.7.137","TLSv1.2","20494","Application Data, Application Data, Application Data, Application Data"
"173","0.499898","13.84.36.2","100.86.7.137","TLSv1.2","1143","Application Data, Application Data"
"174","0.499898","13.84.36.2","100.86.7.137","TLSv1.2","85","Application Data"
"175","0.499898","13.84.36.2","100.86.7.137","TCP","56","443  >  57514 [ACK] Seq=672759 Ack=13235 Win=16385 Len=0"
"176","0.499898","13.84.36.2","100.86.7.137","TCP","56","443  >  57514 [ACK] Seq=672759 Ack=13487 Win=16384 Len=0"
"177","0.500480","100.86.7.137","13.84.36.2","TCP","54","57514  >  443 [ACK] Seq=13487 Ack=672759 Win=3535 Len=0"
"178","0.500959","100.86.7.137","13.84.36.2","TCP","54","[TCP Window Update] 57514  >  443 [ACK] Seq=13487 Ack=672759 Win=3567 Len=0"
"179","0.501223","100.86.7.137","13.84.36.2","TCP","54","[TCP Window Update] 57514  >  443 [ACK] Seq=13487 Ack=672759 Win=4140 Len=0"
"180","0.514956","13.84.36.2","100.86.7.137","TCP","1514","443  >  57514 [ACK] Seq=672759 Ack=13487 Win=16384 Len=1460 [TCP segment of a reassembled PDU]"
"181","0.514956","13.84.36.2","100.86.7.137","TCP","1514","443  >  57514 [ACK] Seq=674219 Ack=13487 Win=16384 Len=1460 [TCP segment of a reassembled PDU]"
"182","0.514956","13.84.36.2","100.86.7.137","TLSv1.2","285","Application Data"
"183","0.514956","13.84.36.2","100.86.7.137","TCP","1514","443  >  57514 [ACK] Seq=675910 Ack=13487 Win=16384 Len=1460 [TCP segment of a reassembled PDU]"
"184","0.514956","13.84.36.2","100.86.7.137","TLSv1.2","169","Application Data"
"185","0.514956","13.84.36.2","100.86.7.137","TLSv1.2","16114","Application Data, Application Data, Application Data"
"186","0.514956","13.84.36.2","100.86.7.137","TLSv1.2","466","Application Data"
"187","0.514956","13.84.36.2","100.86.7.137","TLSv1.2","16114","Application Data, Application Data, Application Data"
"188","0.514956","13.84.36.2","100.86.7.137","TLSv1.2","466","Application Data"
"189","0.514956","13.84.36.2","100.86.7.137","TLSv1.2","7354","Application Data"
"190","0.514956","13.84.36.2","100.86.7.137","TLSv1.2","990","Application Data"
"191","0.514956","13.84.36.2","100.86.7.137","TLSv1.2","7354","Application Data"
"192","0.514956","13.84.36.2","100.86.7.137","TLSv1.2","990","Application Data"
"193","0.514956","13.84.36.2","100.86.7.137","TCP","2974","443  >  57514 [ACK] Seq=726901 Ack=13487 Win=16384 Len=2920 [TCP segment of a reassembled PDU]"
"194","0.514956","13.84.36.2","100.86.7.137","TLSv1.2","1252","Application Data"
"195","0.514956","13.84.36.2","100.86.7.137","TCP","2974","443  >  57514 [ACK] Seq=731019 Ack=13487 Win=16384 Len=2920 [TCP segment of a reassembled PDU]"
"196","0.514956","13.84.36.2","100.86.7.137","TLSv1.2","1252","Application Data"
"197","0.514956","13.84.36.2","100.86.7.137","TLSv1.2","7354","Application Data"
"198","0.514956","13.84.36.2","100.86.7.137","TLSv1.2","990","Application Data"
"199","0.514956","13.84.36.2","100.86.7.137","TLSv1.2","112","Application Data"
"200","0.514956","13.84.36.2","100.86.7.137","TLSv1.2","16114","Application Data, Application Data, Application Data"
"201","0.514956","13.84.36.2","100.86.7.137","TLSv1.2","466","Application Data"
"202","0.514956","13.84.36.2","100.86.7.137","TLSv1.2","8814","Application Data, Application Data"
"203","0.514956","13.84.36.2","100.86.7.137","TCP","1514","[TCP Previous segment not captured] 443  >  57514 [ACK] Seq=770123 Ack=13487 Win=16384 Len=1460 [TCP segment of a reassembled PDU]"
"204","0.514956","13.84.36.2","100.86.7.137","TCP","728","443  >  57514 [PSH, ACK] Seq=771583 Ack=13487 Win=16384 Len=674 [TCP segment of a reassembled PDU]"
"205","0.514956","13.84.36.2","100.86.7.137","TCP","2974","443  >  57514 [ACK] Seq=772257 Ack=13487 Win=16384 Len=2920 [TCP segment of a reassembled PDU]"
"206","0.514956","13.84.36.2","100.86.7.137","TLSv1.2","1252","Application Data"
"207","0.514956","13.84.36.2","100.86.7.137","TLSv1.2","7354","Application Data"
"208","0.515543","100.86.7.137","13.84.36.2","TCP","66","57514  >  443 [ACK] Seq=13487 Ack=768663 Win=4037 Len=0 SLE=770123 SRE=771583"
"209","0.515574","100.86.7.137","13.84.36.2","TCP","66","[TCP Dup ACK 208#1] 57514  >  443 [ACK] Seq=13487 Ack=768663 Win=4037 Len=0 SLE=770123 SRE=772257"
"210","0.515588","100.86.7.137","13.84.36.2","TCP","66","[TCP Dup ACK 208#2] 57514  >  443 [ACK] Seq=13487 Ack=768663 Win=4037 Len=0 SLE=770123 SRE=775177"
"211","0.515603","100.86.7.137","13.84.36.2","TCP","66","[TCP Dup ACK 208#3] 57514  >  443 [ACK] Seq=13487 Ack=768663 Win=4037 Len=0 SLE=770123 SRE=776375"
"212","0.515617","100.86.7.137","13.84.36.2","TCP","66","[TCP Dup ACK 208#4] 57514  >  443 [ACK] Seq=13487 Ack=768663 Win=4037 Len=0 SLE=770123 SRE=783675"
"213","0.515784","13.84.36.2","100.86.7.137","TLSv1.2","990","Application Data"
"214","0.515784","13.84.36.2","100.86.7.137","TLSv1.2","17574","Application Data, Application Data, Application Data, Application Data"
"215","0.515784","13.84.36.2","100.86.7.137","TCP","1514","443  >  57514 [ACK] Seq=802131 Ack=13487 Win=16384 Len=1460 [TCP segment of a reassembled PDU]"
"216","0.515784","13.84.36.2","100.86.7.137","TLSv1.2","1215","Application Data"
"217","0.515784","13.84.36.2","100.86.7.137","TLSv1.2","571","Application Data"
"218","0.515784","13.84.36.2","100.86.7.137","TLSv1.2","32174","Application Data, Application Data, Application Data, Application Data, Application Data, Application Data, Application Data"
"219","0.515784","13.84.36.2","100.86.7.137","TLSv1.2","878","Application Data"
"220","0.515784","13.84.36.2","100.86.7.137","TLSv1.2","32174","Application Data, Application Data, Application Data, Application Data, Application Data, Application Data, Application Data"
"221","0.515784","13.84.36.2","100.86.7.137","TLSv1.2","878","Application Data"
"222","0.515784","13.84.36.2","100.86.7.137","TLSv1.2","112","Application Data"
"223","0.515784","13.84.36.2","100.86.7.137","TLSv1.2","10274","Application Data, Application Data"
"224","0.515899","100.86.7.137","13.84.36.2","TCP","66","[TCP Dup ACK 208#5] 57514  >  443 [ACK] Seq=13487 Ack=768663 Win=4037 Len=0 SLE=770123 SRE=784611"
"225","0.515927","100.86.7.137","13.84.36.2","TCP","66","[TCP Dup ACK 208#6] 57514  >  443 [ACK] Seq=13487 Ack=768663 Win=4037 Len=0 SLE=770123 SRE=802131"
"226","0.515941","100.86.7.137","13.84.36.2","TCP","66","[TCP Dup ACK 208#7] 57514  >  443 [ACK] Seq=13487 Ack=768663 Win=4037 Len=0 SLE=770123 SRE=803591"
"227","0.515954","100.86.7.137","13.84.36.2","TCP","66","[TCP Dup ACK 208#8] 57514  >  443 [ACK] Seq=13487 Ack=768663 Win=4037 Len=0 SLE=770123 SRE=804752"
"228","0.516002","100.86.7.137","13.84.36.2","TCP","66","[TCP Dup ACK 208#9] 57514  >  443 [ACK] Seq=13487 Ack=768663 Win=4037 Len=0 SLE=770123 SRE=805269"
"229","0.516029","100.86.7.137","13.84.36.2","TCP","66","[TCP Dup ACK 208#10] 57514  >  443 [ACK] Seq=13487 Ack=768663 Win=4037 Len=0 SLE=770123 SRE=837389"
"230","0.516041","100.86.7.137","13.84.36.2","TCP","66","[TCP Dup ACK 208#11] 57514  >  443 [ACK] Seq=13487 Ack=768663 Win=4037 Len=0 SLE=770123 SRE=838213"
"231","0.516060","100.86.7.137","13.84.36.2","TCP","66","[TCP Dup ACK 208#12] 57514  >  443 [ACK] Seq=13487 Ack=768663 Win=4037 Len=0 SLE=770123 SRE=870333"
"232","0.516074","100.86.7.137","13.84.36.2","TCP","66","[TCP Dup ACK 208#13] 57514  >  443 [ACK] Seq=13487 Ack=768663 Win=4037 Len=0 SLE=770123 SRE=871157"
"233","0.516086","100.86.7.137","13.84.36.2","TCP","66","[TCP Dup ACK 208#14] 57514  >  443 [ACK] Seq=13487 Ack=768663 Win=4037 Len=0 SLE=770123 SRE=871215"
"234","0.516104","100.86.7.137","13.84.36.2","TCP","66","[TCP Dup ACK 208#15] 57514  >  443 [ACK] Seq=13487 Ack=768663 Win=4037 Len=0 SLE=770123 SRE=881435"
"235","0.516747","100.86.7.137","13.84.36.2","TCP","66","[TCP Window Update] 57514  >  443 [ACK] Seq=13487 Ack=768663 Win=4140 Len=0 SLE=770123 SRE=881435"
"236","0.522848","13.84.36.2","100.86.7.137","TLSv1.2","10274","Application Data, Application Data"
"237","0.522848","13.84.36.2","100.86.7.137","TLSv1.2","204","Application Data"
"238","0.522848","13.84.36.2","100.86.7.137","TLSv1.2","10274","Application Data, Application Data"
"239","0.522848","13.84.36.2","100.86.7.137","TLSv1.2","1314","Application Data"
"240","0.522848","13.84.36.2","100.86.7.137","TLSv1.2","85","Application Data"
"241","0.522848","13.84.36.2","100.86.7.137","TCP","1514","443  >  57514 [ACK] Seq=903316 Ack=13487 Win=16384 Len=1460 [TCP segment of a reassembled PDU]"
"242","0.522848","13.84.36.2","100.86.7.137","TLSv1.2","439","Application Data"
"243","0.522848","13.84.36.2","100.86.7.137","TLSv1.2","11734","Application Data, Application Data"
"244","0.522848","13.84.36.2","100.86.7.137","TLSv1.2","728","Application Data"
"245","0.522848","13.84.36.2","100.86.7.137","TLSv1.2","7354","Application Data"
"246","0.522848","13.84.36.2","100.86.7.137","TLSv1.2","990","Application Data"
"247","0.522848","13.84.36.2","100.86.7.137","TCP","2974","443  >  57514 [ACK] Seq=925751 Ack=13487 Win=16384 Len=2920 [TCP segment of a reassembled PDU]"
"248","0.522848","13.84.36.2","100.86.7.137","TLSv1.2","1252","Application Data"
"249","0.522848","13.84.36.2","100.86.7.137","TLSv1.2","7354","Application Data"
"250","0.522848","13.84.36.2","100.86.7.137","TLSv1.2","990","Application Data"
"251","0.522848","13.84.36.2","100.86.7.137","TLSv1.2","7354","Application Data"
"252","0.522848","13.84.36.2","100.86.7.137","TLSv1.2","990","Application Data"
"253","0.522848","13.84.36.2","100.86.7.137","TLSv1.2","14654","Application Data, Application Data, Application Data"
"254","0.522848","13.84.36.2","100.86.7.137","TCP","1514","[TCP Previous segment not captured] 443  >  57514 [ACK] Seq=962401 Ack=13487 Win=16384 Len=1460 [TCP segment of a reassembled PDU]"
"255","0.522848","13.84.36.2","100.86.7.137","TCP","1514","[TCP Previous segment not captured] 443  >  57514 [ACK] Seq=965321 Ack=13487 Win=16384 Len=1460 [TCP segment of a reassembled PDU]"
"256","0.523046","100.86.7.137","13.84.36.2","TCP","66","[TCP Dup ACK 208#16] 57514  >  443 [ACK] Seq=13487 Ack=768663 Win=4140 Len=0 SLE=770123 SRE=891655"
"257","0.523107","100.86.7.137","13.84.36.2","TCP","66","[TCP Dup ACK 208#17] 57514  >  443 [ACK] Seq=13487 Ack=768663 Win=4140 Len=0 SLE=770123 SRE=891805"
"258","0.523126","100.86.7.137","13.84.36.2","TCP","66","[TCP Dup ACK 208#18] 57514  >  443 [ACK] Seq=13487 Ack=768663 Win=4140 Len=0 SLE=770123 SRE=902025"
"259","0.523138","100.86.7.137","13.84.36.2","TCP","66","[TCP Dup ACK 208#19] 57514  >  443 [ACK] Seq=13487 Ack=768663 Win=4140 Len=0 SLE=770123 SRE=903285"
"260","0.523149","100.86.7.137","13.84.36.2","TCP","66","[TCP Dup ACK 208#20] 57514  >  443 [ACK] Seq=13487 Ack=768663 Win=4140 Len=0 SLE=770123 SRE=903316"
"261","0.523193","100.86.7.137","13.84.36.2","TCP","66","[TCP Dup ACK 208#21] 57514  >  443 [ACK] Seq=13487 Ack=768663 Win=4140 Len=0 SLE=770123 SRE=904776"
"262","0.523204","100.86.7.137","13.84.36.2","TCP","66","[TCP Dup ACK 208#22] 57514  >  443 [ACK] Seq=13487 Ack=768663 Win=4140 Len=0 SLE=770123 SRE=905161"
"263","0.523221","100.86.7.137","13.84.36.2","TCP","66","[TCP Dup ACK 208#23] 57514  >  443 [ACK] Seq=13487 Ack=768663 Win=4140 Len=0 SLE=770123 SRE=916841"
"264","0.523233","100.86.7.137","13.84.36.2","TCP","66","[TCP Dup ACK 208#24] 57514  >  443 [ACK] Seq=13487 Ack=768663 Win=4140 Len=0 SLE=770123 SRE=917515"
"265","0.523246","100.86.7.137","13.84.36.2","TCP","66","[TCP Dup ACK 208#25] 57514  >  443 [ACK] Seq=13487 Ack=768663 Win=4140 Len=0 SLE=770123 SRE=924815"
"266","0.523258","100.86.7.137","13.84.36.2","TCP","66","[TCP Dup ACK 208#26] 57514  >  443 [ACK] Seq=13487 Ack=768663 Win=4140 Len=0 SLE=770123 SRE=925751"
"267","0.523272","100.86.7.137","13.84.36.2","TCP","66","[TCP Dup ACK 208#27] 57514  >  443 [ACK] Seq=13487 Ack=768663 Win=4140 Len=0 SLE=770123 SRE=928671"
"268","0.523285","100.86.7.137","13.84.36.2","TCP","66","[TCP Dup ACK 208#28] 57514  >  443 [ACK] Seq=13487 Ack=768663 Win=4140 Len=0 SLE=770123 SRE=929869"
"269","0.523301","100.86.7.137","13.84.36.2","TCP","66","[TCP Dup ACK 208#29] 57514  >  443 [ACK] Seq=13487 Ack=768663 Win=4140 Len=0 SLE=770123 SRE=937169"
"270","0.523312","100.86.7.137","13.84.36.2","TCP","66","[TCP Dup ACK 208#30] 57514  >  443 [ACK] Seq=13487 Ack=768663 Win=4140 Len=0 SLE=770123 SRE=938105"
"271","0.523327","100.86.7.137","13.84.36.2","TCP","66","[TCP Dup ACK 208#31] 57514  >  443 [ACK] Seq=13487 Ack=768663 Win=4140 Len=0 SLE=770123 SRE=945405"
"272","0.523340","100.86.7.137","13.84.36.2","TCP","66","[TCP Dup ACK 208#32] 57514  >  443 [ACK] Seq=13487 Ack=768663 Win=4140 Len=0 SLE=770123 SRE=946341"
"273","0.523359","100.86.7.137","13.84.36.2","TCP","66","[TCP Dup ACK 208#33] 57514  >  443 [ACK] Seq=13487 Ack=768663 Win=4140 Len=0 SLE=770123 SRE=960941"
"274","0.523371","100.86.7.137","13.84.36.2","TCP","74","[TCP Dup ACK 208#34] 57514  >  443 [ACK] Seq=13487 Ack=768663 Win=4140 Len=0 SLE=962401 SRE=963861 SLE=770123 SRE=960941"
"275","0.523428","100.86.7.137","13.84.36.2","TCP","82","[TCP Dup ACK 208#35] 57514  >  443 [ACK] Seq=13487 Ack=768663 Win=4140 Len=0 SLE=965321 SRE=966781 SLE=962401 SRE=963861 SLE=770123 SRE=960941"
"276","0.532530","13.84.36.2","100.86.7.137","TLSv1.2","4434","[TCP Previous segment not captured] , Application Data, Application Data"
"277","0.532579","100.86.7.137","13.84.36.2","TCP","90","[TCP Dup ACK 208#36] 57514  >  443 [ACK] Seq=13487 Ack=768663 Win=4140 Len=0 SLE=966931 SRE=971311 SLE=965321 SRE=966781 SLE=962401 SRE=963861 SLE=770123 SRE=960941"
"278","0.534386","13.84.36.2","100.86.7.137","TLSv1.2","40934","Application Data, Application Data, Application Data, Application Data, Application Data, Application Data, Application Data, Application Data, Application Data"
"279","0.534437","100.86.7.137","13.84.36.2","TCP","90","[TCP Dup ACK 208#37] 57514  >  443 [ACK] Seq=13487 Ack=768663 Win=4140 Len=0 SLE=966931 SRE=1012191 SLE=965321 SRE=966781 SLE=962401 SRE=963861 SLE=770123 SRE=960941"
"280","0.535497","13.84.36.2","100.86.7.137","TLSv1.2","150","Application Data"
"281","0.535523","100.86.7.137","13.84.36.2","TCP","90","[TCP Dup ACK 208#38] 57514  >  443 [ACK] Seq=13487 Ack=768663 Win=4140 Len=0 SLE=966931 SRE=1012287 SLE=965321 SRE=966781 SLE=962401 SRE=963861 SLE=770123 SRE=960941"
"282","0.547713","13.84.36.2","100.86.7.137","TCP","1514","443  >  57514 [ACK] Seq=1012287 Ack=13487 Win=16384 Len=1460 [TCP segment of a reassembled PDU]"
"283","0.547761","100.86.7.137","13.84.36.2","TCP","90","[TCP Dup ACK 208#39] 57514  >  443 [ACK] Seq=13487 Ack=768663 Win=4140 Len=0 SLE=966931 SRE=1013747 SLE=965321 SRE=966781 SLE=962401 SRE=963861 SLE=770123 SRE=960941"
"284","0.548258","13.84.36.2","100.86.7.137","TCP","1514","443  >  57514 [ACK] Seq=1013747 Ack=13487 Win=16384 Len=1460 [TCP segment of a reassembled PDU]"
"285","0.548258","13.84.36.2","100.86.7.137","TLSv1.2","1514","Application Data"
"286","0.548258","13.84.36.2","100.86.7.137","TCP","2974","443  >  57514 [ACK] Seq=1016667 Ack=13487 Win=16384 Len=2920 [TCP segment of a reassembled PDU]"
"287","0.548258","13.84.36.2","100.86.7.137","TLSv1.2","539","Application Data"
"288","0.548258","13.84.36.2","100.86.7.137","TLSv1.2","7354","Application Data"
"289","0.548258","13.84.36.2","100.86.7.137","TLSv1.2","990","Application Data"
"290","0.548258","13.84.36.2","100.86.7.137","TLSv1.2","7354","Application Data"
"291","0.548258","13.84.36.2","100.86.7.137","TLSv1.2","990","Application Data"
"292","0.548258","13.84.36.2","100.86.7.137","TLSv1.2","7354","Application Data"
"293","0.548258","13.84.36.2","100.86.7.137","TLSv1.2","990","Application Data"
"294","0.548258","13.84.36.2","100.86.7.137","TLSv1.2","7354","Application Data"
"295","0.548258","13.84.36.2","100.86.7.137","TLSv1.2","990","Application Data"
"296","0.548258","13.84.36.2","100.86.7.137","TCP","1514","443  >  57514 [ACK] Seq=1053016 Ack=13487 Win=16384 Len=1460 [TCP segment of a reassembled PDU]"
"297","0.548372","100.86.7.137","13.84.36.2","TCP","90","[TCP Dup ACK 208#40] 57514  >  443 [ACK] Seq=13487 Ack=768663 Win=4140 Len=0 SLE=966931 SRE=1015207 SLE=965321 SRE=966781 SLE=962401 SRE=963861 SLE=770123 SRE=960941"
"298","0.548413","100.86.7.137","13.84.36.2","TCP","90","[TCP Dup ACK 208#41] 57514  >  443 [ACK] Seq=13487 Ack=768663 Win=4140 Len=0 SLE=966931 SRE=1016667 SLE=965321 SRE=966781 SLE=962401 SRE=963861 SLE=770123 SRE=960941"
"299","0.548427","100.86.7.137","13.84.36.2","TCP","90","[TCP Dup ACK 208#42] 57514  >  443 [ACK] Seq=13487 Ack=768663 Win=4140 Len=0 SLE=966931 SRE=1019587 SLE=965321 SRE=966781 SLE=962401 SRE=963861 SLE=770123 SRE=960941"
"300","0.548439","100.86.7.137","13.84.36.2","TCP","90","[TCP Dup ACK 208#43] 57514  >  443 [ACK] Seq=13487 Ack=768663 Win=4140 Len=0 SLE=966931 SRE=1020072 SLE=965321 SRE=966781 SLE=962401 SRE=963861 SLE=770123 SRE=960941"
"301","0.548452","100.86.7.137","13.84.36.2","TCP","90","[TCP Dup ACK 208#44] 57514  >  443 [ACK] Seq=13487 Ack=768663 Win=4140 Len=0 SLE=966931 SRE=1027372 SLE=965321 SRE=966781 SLE=962401 SRE=963861 SLE=770123 SRE=960941"
"302","0.548467","100.86.7.137","13.84.36.2","TCP","90","[TCP Dup ACK 208#45] 57514  >  443 [ACK] Seq=13487 Ack=768663 Win=4140 Len=0 SLE=966931 SRE=1028308 SLE=965321 SRE=966781 SLE=962401 SRE=963861 SLE=770123 SRE=960941"
"303","0.548480","100.86.7.137","13.84.36.2","TCP","90","[TCP Dup ACK 208#46] 57514  >  443 [ACK] Seq=13487 Ack=768663 Win=4140 Len=0 SLE=966931 SRE=1035608 SLE=965321 SRE=966781 SLE=962401 SRE=963861 SLE=770123 SRE=960941"
"304","0.548491","100.86.7.137","13.84.36.2","TCP","90","[TCP Dup ACK 208#47] 57514  >  443 [ACK] Seq=13487 Ack=768663 Win=4140 Len=0 SLE=966931 SRE=1036544 SLE=965321 SRE=966781 SLE=962401 SRE=963861 SLE=770123 SRE=960941"
"305","0.548505","100.86.7.137","13.84.36.2","TCP","90","[TCP Dup ACK 208#48] 57514  >  443 [ACK] Seq=13487 Ack=768663 Win=4140 Len=0 SLE=966931 SRE=1043844 SLE=965321 SRE=966781 SLE=962401 SRE=963861 SLE=770123 SRE=960941"
"306","0.548516","100.86.7.137","13.84.36.2","TCP","90","[TCP Dup ACK 208#49] 57514  >  443 [ACK] Seq=13487 Ack=768663 Win=4140 Len=0 SLE=966931 SRE=1044780 SLE=965321 SRE=966781 SLE=962401 SRE=963861 SLE=770123 SRE=960941"
"307","0.548530","100.86.7.137","13.84.36.2","TCP","90","[TCP Dup ACK 208#50] 57514  >  443 [ACK] Seq=13487 Ack=768663 Win=4140 Len=0 SLE=966931 SRE=1052080 SLE=965321 SRE=966781 SLE=962401 SRE=963861 SLE=770123 SRE=960941"
"308","0.548545","100.86.7.137","13.84.36.2","TCP","90","[TCP Dup ACK 208#51] 57514  >  443 [ACK] Seq=13487 Ack=768663 Win=4140 Len=0 SLE=966931 SRE=1053016 SLE=965321 SRE=966781 SLE=962401 SRE=963861 SLE=770123 SRE=960941"
"309","0.548557","100.86.7.137","13.84.36.2","TCP","90","[TCP Dup ACK 208#52] 57514  >  443 [ACK] Seq=13487 Ack=768663 Win=4140 Len=0 SLE=966931 SRE=1054476 SLE=965321 SRE=966781 SLE=962401 SRE=963861 SLE=770123 SRE=960941"
"310","0.556143","13.84.36.2","100.86.7.137","TLSv1.2","5894","Application Data"
"311","0.556143","13.84.36.2","100.86.7.137","TLSv1.2","990","Application Data"
"312","0.556143","13.84.36.2","100.86.7.137","TLSv1.2","20494","Application Data, Application Data, Application Data, Application Data"
"313","0.556143","13.84.36.2","100.86.7.137","TLSv1.2","204","Application Data"
"314","0.556143","13.84.36.2","100.86.7.137","TCP","2974","443  >  57514 [ACK] Seq=1081842 Ack=13487 Win=16384 Len=2920 [TCP segment of a reassembled PDU]"
"315","0.556143","13.84.36.2","100.86.7.137","TLSv1.2","1418","Application Data, Application Data"
"316","0.556143","13.84.36.2","100.86.7.137","TLSv1.2","51154","Application Data, Application Data, Application Data, Application Data, Application Data, Application Data, Application Data, Application Data, Application Data, Application Data, Application Data, Application Data, Application Data"
"317","0.556143","13.84.36.2","100.86.7.137","TCP","1514","[TCP Previous segment not captured] 443  >  57514 [ACK] Seq=1138686 Ack=13487 Win=16384 Len=1460 [TCP segment of a reassembled PDU]"
"318","0.556143","13.84.36.2","100.86.7.137","TCP","1514","[TCP Previous segment not captured] 443  >  57514 [ACK] Seq=1141606 Ack=13487 Win=16384 Len=1460 [TCP segment of a reassembled PDU]"
"319","0.556143","13.84.36.2","100.86.7.137","TLSv1.2","2974","[TCP Previous segment not captured] , Ignored Unknown Record"
"320","0.556143","13.84.36.2","100.86.7.137","TLSv1.2","1514","[TCP Previous segment not captured] , Ignored Unknown Record"
"321","0.556143","13.84.36.2","100.86.7.137","TLSv1.2","65","[TCP Previous segment not captured] , Ignored Unknown Record"
"322","0.556143","13.84.36.2","100.86.7.137","TCP","1514","443  >  57514 [ACK] Seq=1151837 Ack=13487 Win=16384 Len=1460 [TCP segment of a reassembled PDU]"
"323","0.556143","13.84.36.2","100.86.7.137","TCP","1252","[TCP Previous segment not captured] 443  >  57514 [PSH, ACK] Seq=1154757 Ack=13487 Win=16384 Len=1198 [TCP segment of a reassembled PDU]"
"324","0.556143","13.84.36.2","100.86.7.137","TLSv1.2","1514","[TCP Previous segment not captured] , Ignored Unknown Record"
"325","0.556143","13.84.36.2","100.86.7.137","TLSv1.2","1514","[TCP Previous segment not captured] , Ignored Unknown Record"
"326","0.556143","13.84.36.2","100.86.7.137","TLSv1.2","1514","[TCP Previous segment not captured] , Ignored Unknown Record"
"327","0.556143","13.84.36.2","100.86.7.137","TLSv1.2","1514","[TCP Previous segment not captured] , Ignored Unknown Record"
"328","0.556143","13.84.36.2","100.86.7.137","TLSv1.2","1514","[TCP Previous segment not captured] , Ignored Unknown Record"
"329","0.556143","13.84.36.2","100.86.7.137","TLSv1.2","1514","[TCP Previous segment not captured] , Ignored Unknown Record"
"330","0.556143","13.84.36.2","100.86.7.137","TLSv1.2","1514","[TCP Previous segment not captured] , Ignored Unknown Record"
"331","0.556143","13.84.36.2","100.86.7.137","TLSv1.2","1514","[TCP Previous segment not captured] , Ignored Unknown Record"
"332","0.556143","13.84.36.2","100.86.7.137","TCP","1514","[TCP Previous segment not captured] 443  >  57514 [ACK] Seq=1180663 Ack=13487 Win=16384 Len=1460 [TCP segment of a reassembled PDU]"
"333","0.556143","13.84.36.2","100.86.7.137","TCP","1514","[TCP Previous segment not captured] 443  >  57514 [ACK] Seq=1183583 Ack=13487 Win=16384 Len=1460 [TCP segment of a reassembled PDU]"
"334","0.556143","13.84.36.2","100.86.7.137","TCP","1514","[TCP Previous segment not captured] 443  >  57514 [ACK] Seq=1186503 Ack=13487 Win=16384 Len=1460 [TCP segment of a reassembled PDU]"
"335","0.556143","13.84.36.2","100.86.7.137","TLSv1.2","1514","[TCP Previous segment not captured] , Ignored Unknown Record"
"336","0.556143","13.84.36.2","100.86.7.137","TLSv1.2","728","[TCP Previous segment not captured] , Ignored Unknown Record"
"337","0.556143","13.84.36.2","100.86.7.137","TLSv1.2","1514","[TCP Previous segment not captured] , Ignored Unknown Record"
"338","0.556143","13.84.36.2","100.86.7.137","TLSv1.2","94","[TCP Previous segment not captured] , Application Data"
"339","0.556143","13.84.36.2","100.86.7.137","TCP","1514","443  >  57514 [ACK] Seq=1197233 Ack=13487 Win=16384 Len=1460 [TCP segment of a reassembled PDU]"
"340","0.556143","13.84.36.2","100.86.7.137","TCP","1514","[TCP Previous segment not captured] 443  >  57514 [ACK] Seq=1200153 Ack=13487 Win=16384 Len=1460 [TCP segment of a reassembled PDU]"
"341","0.556143","13.84.36.2","100.86.7.137","TCP","1514","[TCP Previous segment not captured] 443  >  57514 [ACK] Seq=1203073 Ack=13487 Win=16384 Len=1460 [TCP segment of a reassembled PDU]"
"342","0.556397","100.86.7.137","13.84.36.2","TCP","90","[TCP Dup ACK 208#53] 57514  >  443 [ACK] Seq=13487 Ack=768663 Win=4140 Len=0 SLE=966931 SRE=1060316 SLE=965321 SRE=966781 SLE=962401 SRE=963861 SLE=770123 SRE=960941"
"343","0.556445","100.86.7.137","13.84.36.2","TCP","90","[TCP Dup ACK 208#54] 57514  >  443 [ACK] Seq=13487 Ack=768663 Win=4140 Len=0 SLE=966931 SRE=1061252 SLE=965321 SRE=966781 SLE=962401 SRE=963861 SLE=770123 SRE=960941"
"344","0.556460","100.86.7.137","13.84.36.2","TCP","90","[TCP Dup ACK 208#55] 57514  >  443 [ACK] Seq=13487 Ack=768663 Win=4140 Len=0 SLE=966931 SRE=1081692 SLE=965321 SRE=966781 SLE=962401 SRE=963861 SLE=770123 SRE=960941"
"345","0.556468","100.86.7.137","13.84.36.2","TCP","90","[TCP Dup ACK 208#56] 57514  >  443 [ACK] Seq=13487 Ack=768663 Win=4140 Len=0 SLE=966931 SRE=1081842 SLE=965321 SRE=966781 SLE=962401 SRE=963861 SLE=770123 SRE=960941"
"346","0.556479","100.86.7.137","13.84.36.2","TCP","90","[TCP Dup ACK 208#57] 57514  >  443 [ACK] Seq=13487 Ack=768663 Win=4140 Len=0 SLE=966931 SRE=1084762 SLE=965321 SRE=966781 SLE=962401 SRE=963861 SLE=770123 SRE=960941"
"347","0.556515","100.86.7.137","13.84.36.2","TCP","90","[TCP Dup ACK 208#58] 57514  >  443 [ACK] Seq=13487 Ack=768663 Win=4140 Len=0 SLE=966931 SRE=1086126 SLE=965321 SRE=966781 SLE=962401 SRE=963861 SLE=770123 SRE=960941"
"348","0.556530","100.86.7.137","13.84.36.2","TCP","90","[TCP Dup ACK 208#59] 57514  >  443 [ACK] Seq=13487 Ack=768663 Win=4140 Len=0 SLE=966931 SRE=1137226 SLE=965321 SRE=966781 SLE=962401 SRE=963861 SLE=770123 SRE=960941"
"349","0.556540","100.86.7.137","13.84.36.2","TCP","90","[TCP Dup ACK 208#60] 57514  >  443 [ACK] Seq=13487 Ack=768663 Win=4140 Len=0 SLE=1138686 SRE=1140146 SLE=966931 SRE=1137226 SLE=965321 SRE=966781 SLE=962401 SRE=963861"
"350","0.556548","100.86.7.137","13.84.36.2","TCP","90","[TCP Dup ACK 208#61] 57514  >  443 [ACK] Seq=13487 Ack=768663 Win=4140 Len=0 SLE=1141606 SRE=1143066 SLE=1138686 SRE=1140146 SLE=966931 SRE=1137226 SLE=965321 SRE=966781"
"351","0.556557","100.86.7.137","13.84.36.2","TCP","90","[TCP Dup ACK 208#62] 57514  >  443 [ACK] Seq=13487 Ack=768663 Win=4140 Len=0 SLE=1144526 SRE=1147446 SLE=1141606 SRE=1143066 SLE=1138686 SRE=1140146 SLE=966931 SRE=1137226"
"352","0.556565","100.86.7.137","13.84.36.2","TCP","90","[TCP Dup ACK 208#63] 57514  >  443 [ACK] Seq=13487 Ack=768663 Win=4140 Len=0 SLE=1148906 SRE=1150366 SLE=1144526 SRE=1147446 SLE=1141606 SRE=1143066 SLE=1138686 SRE=1140146"
"353","0.556573","100.86.7.137","13.84.36.2","TCP","90","[TCP Dup ACK 208#64] 57514  >  443 [ACK] Seq=13487 Ack=768663 Win=4140 Len=0 SLE=1151826 SRE=1151837 SLE=1148906 SRE=1150366 SLE=1144526 SRE=1147446 SLE=1141606 SRE=1143066"
"354","0.556584","100.86.7.137","13.84.36.2","TCP","90","[TCP Dup ACK 208#65] 57514  >  443 [ACK] Seq=13487 Ack=768663 Win=4140 Len=0 SLE=1151826 SRE=1153297 SLE=1148906 SRE=1150366 SLE=1144526 SRE=1147446 SLE=1141606 SRE=1143066"
"355","0.556595","100.86.7.137","13.84.36.2","TCP","90","[TCP Dup ACK 208#66] 57514  >  443 [ACK] Seq=13487 Ack=768663 Win=4140 Len=0 SLE=1154757 SRE=1155955 SLE=1151826 SRE=1153297 SLE=1148906 SRE=1150366 SLE=1144526 SRE=1147446"
"356","0.556603","100.86.7.137","13.84.36.2","TCP","90","[TCP Dup ACK 208#67] 57514  >  443 [ACK] Seq=13487 Ack=768663 Win=4140 Len=0 SLE=1157415 SRE=1158875 SLE=1154757 SRE=1155955 SLE=1151826 SRE=1153297 SLE=1148906 SRE=1150366"
"357","0.556611","100.86.7.137","13.84.36.2","TCP","90","[TCP Dup ACK 208#68] 57514  >  443 [ACK] Seq=13487 Ack=768663 Win=4140 Len=0 SLE=1160335 SRE=1161795 SLE=1157415 SRE=1158875 SLE=1154757 SRE=1155955 SLE=1151826 SRE=1153297"
"358","0.556620","100.86.7.137","13.84.36.2","TCP","90","[TCP Dup ACK 208#69] 57514  >  443 [ACK] Seq=13487 Ack=768663 Win=4140 Len=0 SLE=1163255 SRE=1164715 SLE=1160335 SRE=1161795 SLE=1157415 SRE=1158875 SLE=1154757 SRE=1155955"
"359","0.556629","100.86.7.137","13.84.36.2","TCP","90","[TCP Dup ACK 208#70] 57514  >  443 [ACK] Seq=13487 Ack=768663 Win=4140 Len=0 SLE=1166175 SRE=1167635 SLE=1163255 SRE=1164715 SLE=1160335 SRE=1161795 SLE=1157415 SRE=1158875"
"360","0.556637","100.86.7.137","13.84.36.2","TCP","90","[TCP Dup ACK 208#71] 57514  >  443 [ACK] Seq=13487 Ack=768663 Win=4140 Len=0 SLE=1169769 SRE=1171229 SLE=1166175 SRE=1167635 SLE=1163255 SRE=1164715 SLE=1160335 SRE=1161795"
"361","0.556646","100.86.7.137","13.84.36.2","TCP","90","[TCP Dup ACK 208#72] 57514  >  443 [ACK] Seq=13487 Ack=768663 Win=4140 Len=0 SLE=1172689 SRE=1174149 SLE=1169769 SRE=1171229 SLE=1166175 SRE=1167635 SLE=1163255 SRE=1164715"
"362","0.556654","100.86.7.137","13.84.36.2","TCP","90","[TCP Dup ACK 208#73] 57514  >  443 [ACK] Seq=13487 Ack=768663 Win=4140 Len=0 SLE=1175609 SRE=1177069 SLE=1172689 SRE=1174149 SLE=1169769 SRE=1171229 SLE=1166175 SRE=1167635"
"363","0.556670","100.86.7.137","13.84.36.2","TCP","90","[TCP Dup ACK 208#74] 57514  >  443 [ACK] Seq=13487 Ack=768663 Win=4140 Len=0 SLE=1178529 SRE=1179989 SLE=1175609 SRE=1177069 SLE=1172689 SRE=1174149 SLE=1169769 SRE=1171229"
"364","0.556679","100.86.7.137","13.84.36.2","TCP","90","[TCP Dup ACK 208#75] 57514  >  443 [ACK] Seq=13487 Ack=768663 Win=4140 Len=0 SLE=1180663 SRE=1182123 SLE=1178529 SRE=1179989 SLE=1175609 SRE=1177069 SLE=1172689 SRE=1174149"
"365","0.556688","100.86.7.137","13.84.36.2","TCP","90","[TCP Dup ACK 208#76] 57514  >  443 [ACK] Seq=13487 Ack=768663 Win=4140 Len=0 SLE=1183583 SRE=1185043 SLE=1180663 SRE=1182123 SLE=1178529 SRE=1179989 SLE=1175609 SRE=1177069"
"366","0.556698","100.86.7.137","13.84.36.2","TCP","90","[TCP Dup ACK 208#77] 57514  >  443 [ACK] Seq=13487 Ack=768663 Win=4140 Len=0 SLE=1186503 SRE=1187963 SLE=1183583 SRE=1185043 SLE=1180663 SRE=1182123 SLE=1178529 SRE=1179989"
"367","0.556708","100.86.7.137","13.84.36.2","TCP","90","[TCP Dup ACK 208#78] 57514  >  443 [ACK] Seq=13487 Ack=768663 Win=4140 Len=0 SLE=1189423 SRE=1190883 SLE=1186503 SRE=1187963 SLE=1183583 SRE=1185043 SLE=1180663 SRE=1182123"
"368","0.556717","100.86.7.137","13.84.36.2","TCP","90","[TCP Dup ACK 208#79] 57514  >  443 [ACK] Seq=13487 Ack=768663 Win=4140 Len=0 SLE=1192343 SRE=1193017 SLE=1189423 SRE=1190883 SLE=1186503 SRE=1187963 SLE=1183583 SRE=1185043"
"369","0.556728","100.86.7.137","13.84.36.2","TCP","90","[TCP Dup ACK 208#80] 57514  >  443 [ACK] Seq=13487 Ack=768663 Win=4140 Len=0 SLE=1194477 SRE=1195937 SLE=1192343 SRE=1193017 SLE=1189423 SRE=1190883 SLE=1186503 SRE=1187963"
"370","0.556736","100.86.7.137","13.84.36.2","TCP","90","[TCP Dup ACK 208#81] 57514  >  443 [ACK] Seq=13487 Ack=768663 Win=4140 Len=0 SLE=1197193 SRE=1197233 SLE=1194477 SRE=1195937 SLE=1192343 SRE=1193017 SLE=1189423 SRE=1190883"
"371","0.556745","100.86.7.137","13.84.36.2","TCP","90","[TCP Dup ACK 208#82] 57514  >  443 [ACK] Seq=13487 Ack=768663 Win=4140 Len=0 SLE=1197193 SRE=1198693 SLE=1194477 SRE=1195937 SLE=1192343 SRE=1193017 SLE=1189423 SRE=1190883"
"372","0.556753","100.86.7.137","13.84.36.2","TCP","90","[TCP Dup ACK 208#83] 57514  >  443 [ACK] Seq=13487 Ack=768663 Win=4140 Len=0 SLE=1200153 SRE=1201613 SLE=1197193 SRE=1198693 SLE=1194477 SRE=1195937 SLE=1192343 SRE=1193017"
"373","0.556762","100.86.7.137","13.84.36.2","TCP","90","[TCP Dup ACK 208#84] 57514  >  443 [ACK] Seq=13487 Ack=768663 Win=4140 Len=0 SLE=1203073 SRE=1204533 SLE=1200153 SRE=1201613 SLE=1197193 SRE=1198693 SLE=1194477 SRE=1195937"
"374","0.556871","13.84.36.2","100.86.7.137","TLSv1.2","1514","[TCP Previous segment not captured] , Ignored Unknown Record"
"375","0.556871","13.84.36.2","100.86.7.137","TLSv1.2","1514","[TCP Previous segment not captured] , Ignored Unknown Record"
"376","0.556871","13.84.36.2","100.86.7.137","TLSv1.2","1514","[TCP Previous segment not captured] , Ignored Unknown Record"
"377","0.556871","13.84.36.2","100.86.7.137","TLSv1.2","1514","[TCP Previous segment not captured] , Ignored Unknown Record"
"378","0.556871","13.84.36.2","100.86.7.137","TLSv1.2","204","[TCP Previous segment not captured] , Ignored Unknown Record"
"379","0.556871","13.84.36.2","100.86.7.137","TCP","1514","443  >  57514 [ACK] Seq=1217823 Ack=13487 Win=16384 Len=1460 [TCP segment of a reassembled PDU]"
"380","0.556871","13.84.36.2","100.86.7.137","TCP","1514","[TCP Previous segment not captured] 443  >  57514 [ACK] Seq=1220743 Ack=13487 Win=16384 Len=1460 [TCP segment of a reassembled PDU]"
"381","0.556871","13.84.36.2","100.86.7.137","TCP","1514","[TCP Previous segment not captured] 443  >  57514 [ACK] Seq=1223663 Ack=13487 Win=16384 Len=1460 [TCP segment of a reassembled PDU]"
"382","0.556871","13.84.36.2","100.86.7.137","TLSv1.2","1514","[TCP Previous segment not captured] , Ignored Unknown Record"
"383","0.556871","13.84.36.2","100.86.7.137","TLSv1.2","1514","[TCP Previous segment not captured] , Ignored Unknown Record"
"384","0.556871","13.84.36.2","100.86.7.137","TLSv1.2","1514","[TCP Previous segment not captured] , Ignored Unknown Record"
"385","0.556871","13.84.36.2","100.86.7.137","TLSv1.2","1514","[TCP Previous segment not captured] , Ignored Unknown Record"
"386","0.556871","13.84.36.2","100.86.7.137","TLSv1.2","1514","[TCP Previous segment not captured] , Ignored Unknown Record"
"387","0.556871","13.84.36.2","100.86.7.137","TLSv1.2","1402","[TCP Previous segment not captured] , Ignored Unknown Record"
"388","0.556871","13.84.36.2","100.86.7.137","TLSv1.2","1514","[TCP Previous segment not captured] , Ignored Unknown Record"
"389","0.556871","13.84.36.2","100.86.7.137","TLSv1.2","1514","[TCP Previous segment not captured] , Ignored Unknown Record"
"390","0.556871","13.84.36.2","100.86.7.137","TLSv1.2","1514","[TCP Previous segment not captured] , Ignored Unknown Record"
"391","0.556871","13.84.36.2","100.86.7.137","TLSv1.2","1514","[TCP Previous segment not captured] , Ignored Unknown Record"
"392","0.556871","13.84.36.2","100.86.7.137","TCP","1514","[TCP Previous segment not captured] 443  >  57514 [ACK] Seq=1254885 Ack=13487 Win=16384 Len=1460 [TCP segment of a reassembled PDU]"
"393","0.556871","13.84.36.2","100.86.7.137","TCP","1514","[TCP Previous segment not captured] 443  >  57514 [ACK] Seq=1257805 Ack=13487 Win=16384 Len=1460 [TCP segment of a reassembled PDU]"
"394","0.556974","100.86.7.137","13.84.36.2","TCP","90","[TCP Dup ACK 208#85] 57514  >  443 [ACK] Seq=13487 Ack=768663 Win=4140 Len=0 SLE=1205993 SRE=1207453 SLE=1203073 SRE=1204533 SLE=1200153 SRE=1201613 SLE=1197193 SRE=1198693"
"395","0.556993","100.86.7.137","13.84.36.2","TCP","90","[TCP Dup ACK 208#86] 57514  >  443 [ACK] Seq=13487 Ack=768663 Win=4140 Len=0 SLE=1208913 SRE=1210373 SLE=1205993 SRE=1207453 SLE=1203073 SRE=1204533 SLE=1200153 SRE=1201613"
"396","0.557017","100.86.7.137","13.84.36.2","TCP","90","[TCP Dup ACK 208#87] 57514  >  443 [ACK] Seq=13487 Ack=768663 Win=4140 Len=0 SLE=1211833 SRE=1213293 SLE=1208913 SRE=1210373 SLE=1205993 SRE=1207453 SLE=1203073 SRE=1204533"
"397","0.557026","100.86.7.137","13.84.36.2","TCP","90","[TCP Dup ACK 208#88] 57514  >  443 [ACK] Seq=13487 Ack=768663 Win=4140 Len=0 SLE=1214753 SRE=1216213 SLE=1211833 SRE=1213293 SLE=1208913 SRE=1210373 SLE=1205993 SRE=1207453"
"398","0.557036","100.86.7.137","13.84.36.2","TCP","90","[TCP Dup ACK 208#89] 57514  >  443 [ACK] Seq=13487 Ack=768663 Win=4140 Len=0 SLE=1217673 SRE=1217823 SLE=1214753 SRE=1216213 SLE=1211833 SRE=1213293 SLE=1208913 SRE=1210373"
"399","0.557044","100.86.7.137","13.84.36.2","TCP","90","[TCP Dup ACK 208#90] 57514  >  443 [ACK] Seq=13487 Ack=768663 Win=4140 Len=0 SLE=1217673 SRE=1219283 SLE=1214753 SRE=1216213 SLE=1211833 SRE=1213293 SLE=1208913 SRE=1210373"
"400","0.557053","100.86.7.137","13.84.36.2","TCP","90","[TCP Dup ACK 208#91] 57514  >  443 [ACK] Seq=13487 Ack=768663 Win=4140 Len=0 SLE=1220743 SRE=1222203 SLE=1217673 SRE=1219283 SLE=1214753 SRE=1216213 SLE=1211833 SRE=1213293"
"401","0.557085","100.86.7.137","13.84.36.2","TCP","90","[TCP Dup ACK 208#92] 57514  >  443 [ACK] Seq=13487 Ack=768663 Win=4140 Len=0 SLE=1223663 SRE=1225123 SLE=1220743 SRE=1222203 SLE=1217673 SRE=1219283 SLE=1214753 SRE=1216213"
"402","0.557093","100.86.7.137","13.84.36.2","TCP","90","[TCP Dup ACK 208#93] 57514  >  443 [ACK] Seq=13487 Ack=768663 Win=4140 Len=0 SLE=1226583 SRE=1228043 SLE=1223663 SRE=1225123 SLE=1220743 SRE=1222203 SLE=1217673 SRE=1219283"
"403","0.557103","100.86.7.137","13.84.36.2","TCP","90","[TCP Dup ACK 208#94] 57514  >  443 [ACK] Seq=13487 Ack=768663 Win=4140 Len=0 SLE=1229503 SRE=1230963 SLE=1226583 SRE=1228043 SLE=1223663 SRE=1225123 SLE=1220743 SRE=1222203"
"404","0.557112","100.86.7.137","13.84.36.2","TCP","90","[TCP Dup ACK 208#95] 57514  >  443 [ACK] Seq=13487 Ack=768663 Win=4140 Len=0 SLE=1232423 SRE=1233883 SLE=1229503 SRE=1230963 SLE=1226583 SRE=1228043 SLE=1223663 SRE=1225123"
"405","0.557120","100.86.7.137","13.84.36.2","TCP","90","[TCP Dup ACK 208#96] 57514  >  443 [ACK] Seq=13487 Ack=768663 Win=4140 Len=0 SLE=1235343 SRE=1236803 SLE=1232423 SRE=1233883 SLE=1229503 SRE=1230963 SLE=1226583 SRE=1228043"
"406","0.557128","100.86.7.137","13.84.36.2","TCP","90","[TCP Dup ACK 208#97] 57514  >  443 [ACK] Seq=13487 Ack=768663 Win=4140 Len=0 SLE=1238263 SRE=1239723 SLE=1235343 SRE=1236803 SLE=1232423 SRE=1233883 SLE=1229503 SRE=1230963"
"407","0.557136","100.86.7.137","13.84.36.2","TCP","90","[TCP Dup ACK 208#98] 57514  >  443 [ACK] Seq=13487 Ack=768663 Win=4140 Len=0 SLE=1241183 SRE=1242531 SLE=1238263 SRE=1239723 SLE=1235343 SRE=1236803 SLE=1232423 SRE=1233883"
"408","0.557145","100.86.7.137","13.84.36.2","TCP","90","[TCP Dup ACK 208#99] 57514  >  443 [ACK] Seq=13487 Ack=768663 Win=4140 Len=0 SLE=1243991 SRE=1245451 SLE=1241183 SRE=1242531 SLE=1238263 SRE=1239723 SLE=1235343 SRE=1236803"
"409","0.557153","100.86.7.137","13.84.36.2","TCP","90","[TCP Dup ACK 208#100] 57514  >  443 [ACK] Seq=13487 Ack=768663 Win=4140 Len=0 SLE=1246911 SRE=1248371 SLE=1243991 SRE=1245451 SLE=1241183 SRE=1242531 SLE=1238263 SRE=1239723"
"410","0.557161","100.86.7.137","13.84.36.2","TCP","90","[TCP Dup ACK 208#101] 57514  >  443 [ACK] Seq=13487 Ack=768663 Win=4140 Len=0 SLE=1249831 SRE=1251291 SLE=1246911 SRE=1248371 SLE=1243991 SRE=1245451 SLE=1241183 SRE=1242531"
"411","0.557169","100.86.7.137","13.84.36.2","TCP","90","[TCP Dup ACK 208#102] 57514  >  443 [ACK] Seq=13487 Ack=768663 Win=4140 Len=0 SLE=1252751 SRE=1254211 SLE=1249831 SRE=1251291 SLE=1246911 SRE=1248371 SLE=1243991 SRE=1245451"
"412","0.557187","100.86.7.137","13.84.36.2","TCP","90","[TCP Dup ACK 208#103] 57514  >  443 [ACK] Seq=13487 Ack=768663 Win=4140 Len=0 SLE=1254885 SRE=1256345 SLE=1252751 SRE=1254211 SLE=1249831 SRE=1251291 SLE=1246911 SRE=1248371"
"413","0.557249","100.86.7.137","13.84.36.2","TCP","90","[TCP Dup ACK 208#104] 57514  >  443 [ACK] Seq=13487 Ack=768663 Win=4140 Len=0 SLE=1257805 SRE=1259265 SLE=1254885 SRE=1256345 SLE=1252751 SRE=1254211 SLE=1249831 SRE=1251291"
"414","0.560571","13.84.36.2","100.86.7.137","TCP","2974","[TCP Previous segment not captured] 443  >  57514 [ACK] Seq=1260126 Ack=13487 Win=16384 Len=2920 [TCP segment of a reassembled PDU]"
"415","0.560571","13.84.36.2","100.86.7.137","TLSv1.2","285","Application Data"
"416","0.560571","13.84.36.2","100.86.7.137","TLSv1.2","20494","Application Data, Application Data, Application Data, Application Data"
"417","0.560571","13.84.36.2","100.86.7.137","TLSv1.2","204","Application Data"
"418","0.560571","13.84.36.2","100.86.7.137","TLSv1.2","23414","Application Data, Application Data, Application Data, Application Data, Application Data"
"419","0.560571","13.84.36.2","100.86.7.137","TLSv1.2","1402","Application Data"
"420","0.560571","13.84.36.2","100.86.7.137","TLSv1.2","20494","Application Data, Application Data, Application Data, Application Data"
"421","0.560571","13.84.36.2","100.86.7.137","TLSv1.2","262","Application Data, Application Data"
"422","0.560571","13.84.36.2","100.86.7.137","TLSv1.2","4434","Application Data"
"423","0.560677","100.86.7.137","13.84.36.2","TCP","90","[TCP Dup ACK 208#105] 57514  >  443 [ACK] Seq=13487 Ack=768663 Win=4140 Len=0 SLE=1260126 SRE=1263046 SLE=1257805 SRE=1259265 SLE=1254885 SRE=1256345 SLE=1252751 SRE=1254211"
"424","0.560714","100.86.7.137","13.84.36.2","TCP","90","[TCP Dup ACK 208#106] 57514  >  443 [ACK] Seq=13487 Ack=768663 Win=4140 Len=0 SLE=1260126 SRE=1263277 SLE=1257805 SRE=1259265 SLE=1254885 SRE=1256345 SLE=1252751 SRE=1254211"
"425","0.560754","100.86.7.137","13.84.36.2","TCP","90","[TCP Dup ACK 208#107] 57514  >  443 [ACK] Seq=13487 Ack=768663 Win=4140 Len=0 SLE=1260126 SRE=1283717 SLE=1257805 SRE=1259265 SLE=1254885 SRE=1256345 SLE=1252751 SRE=1254211"
"426","0.560766","100.86.7.137","13.84.36.2","TCP","90","[TCP Dup ACK 208#108] 57514  >  443 [ACK] Seq=13487 Ack=768663 Win=4140 Len=0 SLE=1260126 SRE=1283867 SLE=1257805 SRE=1259265 SLE=1254885 SRE=1256345 SLE=1252751 SRE=1254211"
"427","0.560782","100.86.7.137","13.84.36.2","TCP","90","[TCP Dup ACK 208#109] 57514  >  443 [ACK] Seq=13487 Ack=768663 Win=4140 Len=0 SLE=1260126 SRE=1307227 SLE=1257805 SRE=1259265 SLE=1254885 SRE=1256345 SLE=1252751 SRE=1254211"
"428","0.560800","100.86.7.137","13.84.36.2","TCP","90","[TCP Dup ACK 208#110] 57514  >  443 [ACK] Seq=13487 Ack=768663 Win=4140 Len=0 SLE=1260126 SRE=1308575 SLE=1257805 SRE=1259265 SLE=1254885 SRE=1256345 SLE=1252751 SRE=1254211"
"429","0.560820","100.86.7.137","13.84.36.2","TCP","90","[TCP Dup ACK 208#111] 57514  >  443 [ACK] Seq=13487 Ack=768663 Win=4140 Len=0 SLE=1260126 SRE=1329015 SLE=1257805 SRE=1259265 SLE=1254885 SRE=1256345 SLE=1252751 SRE=1254211"
"430","0.560831","100.86.7.137","13.84.36.2","TCP","90","[TCP Dup ACK 208#112] 57514  >  443 [ACK] Seq=13487 Ack=768663 Win=4140 Len=0 SLE=1260126 SRE=1329223 SLE=1257805 SRE=1259265 SLE=1254885 SRE=1256345 SLE=1252751 SRE=1254211"
"431","0.560872","100.86.7.137","13.84.36.2","TCP","90","[TCP Dup ACK 208#113] 57514  >  443 [ACK] Seq=13487 Ack=768663 Win=4140 Len=0 SLE=1260126 SRE=1333603 SLE=1257805 SRE=1259265 SLE=1254885 SRE=1256345 SLE=1252751 SRE=1254211"
"432","0.565460","13.84.36.2","100.86.7.137","TCP","2974","443  >  57514 [ACK] Seq=1333603 Ack=13487 Win=16384 Len=2920 [TCP segment of a reassembled PDU]"
"433","0.565460","13.84.36.2","100.86.7.137","TLSv1.2","1514","[TCP Fast Retransmission] , Application Data"
"434","0.565460","13.84.36.2","100.86.7.137","TLSv1.2","17574","Application Data, Application Data, Application Data, Application Data, Application Data"
"435","0.565526","100.86.7.137","13.84.36.2","TCP","90","[TCP Dup ACK 208#114] 57514  >  443 [ACK] Seq=13487 Ack=768663 Win=4140 Len=0 SLE=1260126 SRE=1336523 SLE=1257805 SRE=1259265 SLE=1254885 SRE=1256345 SLE=1252751 SRE=1254211"
"436","0.565666","100.86.7.137","13.84.36.2","TCP","90","57514  >  443 [ACK] Seq=13487 Ack=960941 Win=4140 Len=0 SLE=1260126 SRE=1336523 SLE=1257805 SRE=1259265 SLE=1254885 SRE=1256345 SLE=1252751 SRE=1254211"
"437","0.565728","100.86.7.137","13.84.36.2","TCP","90","[TCP Dup ACK 436#1] 57514  >  443 [ACK] Seq=13487 Ack=960941 Win=4140 Len=0 SLE=1260126 SRE=1354043 SLE=1257805 SRE=1259265 SLE=1254885 SRE=1256345 SLE=1252751 SRE=1254211"
"438","0.568664","13.84.36.2","100.86.7.137","TLSv1.2","8814","Application Data, Application Data"
"439","0.568726","100.86.7.137","13.84.36.2","TCP","90","[TCP Dup ACK 436#2] 57514  >  443 [ACK] Seq=13487 Ack=960941 Win=4140 Len=0 SLE=1260126 SRE=1362803 SLE=1257805 SRE=1259265 SLE=1254885 SRE=1256345 SLE=1252751 SRE=1254211"
"440","0.569688","13.84.36.2","100.86.7.137","TLSv1.2","17574","Application Data, Application Data, Application Data, Application Data"
"441","0.569737","100.86.7.137","13.84.36.2","TCP","90","[TCP Dup ACK 436#3] 57514  >  443 [ACK] Seq=13487 Ack=960941 Win=4140 Len=0 SLE=1260126 SRE=1380323 SLE=1257805 SRE=1259265 SLE=1254885 SRE=1256345 SLE=1252751 SRE=1254211"
"442","0.569989","13.84.36.2","100.86.7.137","TLSv1.2","2974","Application Data"
"443","0.570019","100.86.7.137","13.84.36.2","TCP","90","[TCP Dup ACK 436#4] 57514  >  443 [ACK] Seq=13487 Ack=960941 Win=4140 Len=0 SLE=1260126 SRE=1383243 SLE=1257805 SRE=1259265 SLE=1254885 SRE=1256345 SLE=1252751 SRE=1254211"
"444","0.578830","13.84.36.2","100.86.7.137","TLSv1.2","1514","[TCP Fast Retransmission] , Application Data"
"445","0.578896","100.86.7.137","13.84.36.2","TCP","90","57514  >  443 [ACK] Seq=13487 Ack=963861 Win=4140 Len=0 SLE=1260126 SRE=1383243 SLE=1257805 SRE=1259265 SLE=1254885 SRE=1256345 SLE=1252751 SRE=1254211"
"446","0.579224","13.84.36.2","100.86.7.137","TCP","204","[TCP Retransmission] 443  >  57514 [PSH, ACK] Seq=966781 Ack=13487 Win=16384 Len=150 [TCP segment of a reassembled PDU]"
"447","0.579224","13.84.36.2","100.86.7.137","TCP","1514","443  >  57514 [ACK] Seq=1383243 Ack=13487 Win=16384 Len=1460 [TCP segment of a reassembled PDU]"
"448","0.579242","100.86.7.137","13.84.36.2","TCP","90","[TCP Dup ACK 445#1] 57514  >  443 [ACK] Seq=13487 Ack=963861 Win=4140 Len=0 SLE=965321 SRE=1137226 SLE=1260126 SRE=1383243 SLE=1257805 SRE=1259265 SLE=1254885 SRE=1256345"
"449","0.579257","100.86.7.137","13.84.36.2","TCP","90","[TCP Dup ACK 445#2] 57514  >  443 [ACK] Seq=13487 Ack=963861 Win=4140 Len=0 SLE=1260126 SRE=1384703 SLE=965321 SRE=1137226 SLE=1257805 SRE=1259265 SLE=1254885 SRE=1256345"
"450","0.580620","13.84.36.2","100.86.7.137","TCP","1514","443  >  57514 [ACK] Seq=1384703 Ack=13487 Win=16384 Len=1460 [TCP segment of a reassembled PDU]"
"451","0.580642","100.86.7.137","13.84.36.2","TCP","90","[TCP Dup ACK 445#3] 57514  >  443 [ACK] Seq=13487 Ack=963861 Win=4140 Len=0 SLE=1260126 SRE=1386163 SLE=965321 SRE=1137226 SLE=1257805 SRE=1259265 SLE=1254885 SRE=1256345"
"452","0.581237","13.84.36.2","100.86.7.137","TLSv1.2","1514","Application Data"
"453","0.581259","100.86.7.137","13.84.36.2","TCP","90","[TCP Dup ACK 445#4] 57514  >  443 [ACK] Seq=13487 Ack=963861 Win=4140 Len=0 SLE=1260126 SRE=1387623 SLE=965321 SRE=1137226 SLE=1257805 SRE=1259265 SLE=1254885 SRE=1256345"
"454","0.592719","13.84.36.2","100.86.7.137","TCP","1514","443  >  57514 [ACK] Seq=1387623 Ack=13487 Win=16384 Len=1460 [TCP segment of a reassembled PDU]"
"455","0.592766","100.86.7.137","13.84.36.2","TCP","90","[TCP Dup ACK 445#5] 57514  >  443 [ACK] Seq=13487 Ack=963861 Win=4140 Len=0 SLE=1260126 SRE=1389083 SLE=965321 SRE=1137226 SLE=1257805 SRE=1259265 SLE=1254885 SRE=1256345"
"456","0.600134","13.84.36.2","100.86.7.137","TCP","1514","443  >  57514 [ACK] Seq=1389083 Ack=13487 Win=16384 Len=1460 [TCP segment of a reassembled PDU]"
"457","0.600259","100.86.7.137","13.84.36.2","TCP","90","[TCP Dup ACK 445#6] 57514  >  443 [ACK] Seq=13487 Ack=963861 Win=4140 Len=0 SLE=1260126 SRE=1390543 SLE=965321 SRE=1137226 SLE=1257805 SRE=1259265 SLE=1254885 SRE=1256345"
"458","0.600373","13.84.36.2","100.86.7.137","TLSv1.2","2974","Application Data, Application Data"
"459","0.600397","100.86.7.137","13.84.36.2","TCP","90","[TCP Dup ACK 445#7] 57514  >  443 [ACK] Seq=13487 Ack=963861 Win=4140 Len=0 SLE=1260126 SRE=1393463 SLE=965321 SRE=1137226 SLE=1257805 SRE=1259265 SLE=1254885 SRE=1256345"
"460","0.600872","13.84.36.2","100.86.7.137","TLSv1.2","11734","Application Data, Application Data, Application Data"
"461","0.600913","100.86.7.137","13.84.36.2","TCP","90","[TCP Dup ACK 445#8] 57514  >  443 [ACK] Seq=13487 Ack=963861 Win=4140 Len=0 SLE=1260126 SRE=1405143 SLE=965321 SRE=1137226 SLE=1257805 SRE=1259265 SLE=1254885 SRE=1256345"
"462","0.602194","13.84.36.2","100.86.7.137","TCP","2974","443  >  57514 [ACK] Seq=1405143 Ack=13487 Win=16384 Len=2920 [TCP segment of a reassembled PDU]"
"463","0.602237","100.86.7.137","13.84.36.2","TCP","90","[TCP Dup ACK 445#9] 57514  >  443 [ACK] Seq=13487 Ack=963861 Win=4140 Len=0 SLE=1260126 SRE=1408063 SLE=965321 SRE=1137226 SLE=1257805 SRE=1259265 SLE=1254885 SRE=1256345"
"464","0.605623","13.84.36.2","100.86.7.137","TLSv1.2","4434","Application Data"
"465","0.605686","100.86.7.137","13.84.36.2","TCP","90","[TCP Dup ACK 445#10] 57514  >  443 [ACK] Seq=13487 Ack=963861 Win=4140 Len=0 SLE=1260126 SRE=1412443 SLE=965321 SRE=1137226 SLE=1257805 SRE=1259265 SLE=1254885 SRE=1256345"
"466","0.608848","13.84.36.2","100.86.7.137","TLSv1.2","49694","Application Data, Application Data, Application Data, Application Data, Application Data, Application Data, Application Data, Application Data, Application Data, Application Data, Application Data, Application Data, Application Data"
"467","0.608848","13.84.36.2","100.86.7.137","TLSv1.2","4434","Application Data, Application Data"
"468","0.608848","13.84.36.2","100.86.7.137","TCP","16114","[TCP Previous segment not captured] 443  >  57514 [PSH, ACK] Seq=1467923 Ack=13487 Win=16384 Len=16060 [TCP segment of a reassembled PDU], Application Data, Application Data, Application Data"
"469","0.608927","100.86.7.137","13.84.36.2","TCP","90","[TCP Dup ACK 445#11] 57514  >  443 [ACK] Seq=13487 Ack=963861 Win=4140 Len=0 SLE=1260126 SRE=1462083 SLE=965321 SRE=1137226 SLE=1257805 SRE=1259265 SLE=1254885 SRE=1256345"
"470","0.608975","100.86.7.137","13.84.36.2","TCP","90","[TCP Dup ACK 445#12] 57514  >  443 [ACK] Seq=13487 Ack=963861 Win=4140 Len=0 SLE=1260126 SRE=1466463 SLE=965321 SRE=1137226 SLE=1257805 SRE=1259265 SLE=1254885 SRE=1256345"
"471","0.608994","100.86.7.137","13.84.36.2","TCP","90","[TCP Dup ACK 445#13] 57514  >  443 [ACK] Seq=13487 Ack=963861 Win=4140 Len=0 SLE=1467923 SRE=1483983 SLE=1260126 SRE=1466463 SLE=965321 SRE=1137226 SLE=1257805 SRE=1259265"
"472","0.610502","13.84.36.2","100.86.7.137","TLSv1.2","11734","Application Data, Application Data, Application Data"
"473","0.610542","100.86.7.137","13.84.36.2","TCP","90","[TCP Dup ACK 445#14] 57514  >  443 [ACK] Seq=13487 Ack=963861 Win=4140 Len=0 SLE=1467923 SRE=1495663 SLE=1260126 SRE=1466463 SLE=965321 SRE=1137226 SLE=1257805 SRE=1259265"
"474","0.614005","13.84.36.2","100.86.7.137","TLSv1.2","1514","Application Data"
"475","0.614005","13.84.36.2","100.86.7.137","TCP","1514","[TCP Out-Of-Order] 443  >  57514 [ACK] Seq=1137226 Ack=13487 Win=16384 Len=1460"
"476","0.614005","13.84.36.2","100.86.7.137","TCP","1514","[TCP Out-Of-Order] 443  >  57514 [ACK] Seq=1140146 Ack=13487 Win=16384 Len=1460 [TCP segment of a reassembled PDU]"
"477","0.614005","13.84.36.2","100.86.7.137","TCP","1514","[TCP Out-Of-Order] 443  >  57514 [ACK] Seq=1143066 Ack=13487 Win=16384 Len=1460"
"478","0.614005","13.84.36.2","100.86.7.137","TCP","1514","[TCP Out-Of-Order] 443  >  57514 [ACK] Seq=1147446 Ack=13487 Win=16384 Len=1460"
"479","0.614005","13.84.36.2","100.86.7.137","TCP","1514","[TCP Out-Of-Order] 443  >  57514 [ACK] Seq=1150366 Ack=13487 Win=16384 Len=1460"
"480","0.614005","13.84.36.2","100.86.7.137","TCP","1514","[TCP Out-Of-Order] 443  >  57514 [ACK] Seq=1153297 Ack=13487 Win=16384 Len=1460"
"481","0.614005","13.84.36.2","100.86.7.137","TCP","1514","[TCP Out-Of-Order] 443  >  57514 [ACK] Seq=1155955 Ack=13487 Win=16384 Len=1460"
"482","0.614005","13.84.36.2","100.86.7.137","TCP","1514","[TCP Out-Of-Order] 443  >  57514 [ACK] Seq=1158875 Ack=13487 Win=16384 Len=1460"
"483","0.614005","13.84.36.2","100.86.7.137","TCP","1514","[TCP Out-Of-Order] 443  >  57514 [ACK] Seq=1161795 Ack=13487 Win=16384 Len=1460"
"484","0.614005","13.84.36.2","100.86.7.137","TCP","1514","[TCP Out-Of-Order] 443  >  57514 [ACK] Seq=1164715 Ack=13487 Win=16384 Len=1460"
"485","0.614005","13.84.36.2","100.86.7.137","TCP","1514","[TCP Out-Of-Order] 443  >  57514 [PSH, ACK] Seq=1167635 Ack=13487 Win=16384 Len=1460"
"486","0.614005","13.84.36.2","100.86.7.137","TCP","728","[TCP Out-Of-Order] 443  >  57514 [ACK] Seq=1169095 Ack=13487 Win=16384 Len=674"
"487","0.614005","13.84.36.2","100.86.7.137","TCP","1514","[TCP Out-Of-Order] 443  >  57514 [ACK] Seq=1171229 Ack=13487 Win=16384 Len=1460"
"488","0.614005","13.84.36.2","100.86.7.137","TCP","1514","[TCP Out-Of-Order] 443  >  57514 [ACK] Seq=1174149 Ack=13487 Win=16384 Len=1460"
"489","0.614005","13.84.36.2","100.86.7.137","TCP","1514","[TCP Out-Of-Order] 443  >  57514 [ACK] Seq=1177069 Ack=13487 Win=16384 Len=1460"
"490","0.614005","13.84.36.2","100.86.7.137","TCP","728","[TCP Out-Of-Order] 443  >  57514 [PSH, ACK] Seq=1179989 Ack=13487 Win=16384 Len=674"
"491","0.614005","13.84.36.2","100.86.7.137","TCP","1514","[TCP Out-Of-Order] 443  >  57514 [ACK] Seq=1182123 Ack=13487 Win=16384 Len=1460"
"492","0.614005","13.84.36.2","100.86.7.137","TCP","1514","[TCP Out-Of-Order] 443  >  57514 [ACK] Seq=1185043 Ack=13487 Win=16384 Len=1460 [TCP segment of a reassembled PDU]"
"493","0.614005","13.84.36.2","100.86.7.137","TCP","1514","[TCP Out-Of-Order] 443  >  57514 [ACK] Seq=1187963 Ack=13487 Win=16384 Len=1460"
"494","0.614005","13.84.36.2","100.86.7.137","TCP","1514","[TCP Out-Of-Order] 443  >  57514 [ACK] Seq=1190883 Ack=13487 Win=16384 Len=1460"
"495","0.614005","13.84.36.2","100.86.7.137","TCP","1514","[TCP Out-Of-Order] 443  >  57514 [ACK] Seq=1193017 Ack=13487 Win=16384 Len=1460"
"496","0.614005","13.84.36.2","100.86.7.137","TCP","1310","[TCP Out-Of-Order] 443  >  57514 [PSH, ACK] Seq=1195937 Ack=13487 Win=16384 Len=1256"
"497","0.614005","13.84.36.2","100.86.7.137","TCP","1514","[TCP Out-Of-Order] 443  >  57514 [ACK] Seq=1198693 Ack=13487 Win=16384 Len=1460"
"498","0.614005","13.84.36.2","100.86.7.137","TCP","1514","[TCP Out-Of-Order] 443  >  57514 [ACK] Seq=1201613 Ack=13487 Win=16384 Len=1460 [TCP segment of a reassembled PDU]"
"499","0.614005","13.84.36.2","100.86.7.137","TCP","1514","[TCP Out-Of-Order] 443  >  57514 [ACK] Seq=1204533 Ack=13487 Win=16384 Len=1460"
"500","0.614005","13.84.36.2","100.86.7.137","TCP","1514","[TCP Out-Of-Order] 443  >  57514 [ACK] Seq=1207453 Ack=13487 Win=16384 Len=1460"
"501","0.614005","13.84.36.2","100.86.7.137","TCP","1514","[TCP Out-Of-Order] 443  >  57514 [ACK] Seq=1210373 Ack=13487 Win=16384 Len=1460"
"502","0.614005","13.84.36.2","100.86.7.137","TCP","1514","[TCP Out-Of-Order] 443  >  57514 [ACK] Seq=1213293 Ack=13487 Win=16384 Len=1460"
"503","0.614005","13.84.36.2","100.86.7.137","TCP","1514","[TCP Out-Of-Order] 443  >  57514 [ACK] Seq=1216213 Ack=13487 Win=16384 Len=1460"
"504","0.614200","100.86.7.137","13.84.36.2","TCP","90","[TCP Dup ACK 445#15] 57514  >  443 [ACK] Seq=13487 Ack=963861 Win=4140 Len=0 SLE=1467923 SRE=1497123 SLE=1260126 SRE=1466463 SLE=965321 SRE=1137226 SLE=1257805 SRE=1259265"
"505","0.614284","100.86.7.137","13.84.36.2","TCP","90","[TCP Dup ACK 445#16] 57514  >  443 [ACK] Seq=13487 Ack=963861 Win=4140 Len=0 SLE=965321 SRE=1140146 SLE=1467923 SRE=1497123 SLE=1260126 SRE=1466463 SLE=1257805 SRE=1259265"
"506","0.614294","100.86.7.137","13.84.36.2","TCP","90","[TCP Dup ACK 445#17] 57514  >  443 [ACK] Seq=13487 Ack=963861 Win=4140 Len=0 SLE=965321 SRE=1143066 SLE=1467923 SRE=1497123 SLE=1260126 SRE=1466463 SLE=1257805 SRE=1259265"
"507","0.614322","100.86.7.137","13.84.36.2","TCP","90","[TCP Dup ACK 445#18] 57514  >  443 [ACK] Seq=13487 Ack=963861 Win=4140 Len=0 SLE=965321 SRE=1147446 SLE=1467923 SRE=1497123 SLE=1260126 SRE=1466463 SLE=1257805 SRE=1259265"
"508","0.614332","100.86.7.137","13.84.36.2","TCP","90","[TCP Dup ACK 445#19] 57514  >  443 [ACK] Seq=13487 Ack=963861 Win=4140 Len=0 SLE=965321 SRE=1150366 SLE=1467923 SRE=1497123 SLE=1260126 SRE=1466463 SLE=1257805 SRE=1259265"
"509","0.614343","100.86.7.137","13.84.36.2","TCP","90","[TCP Dup ACK 445#20] 57514  >  443 [ACK] Seq=13487 Ack=963861 Win=4140 Len=0 SLE=965321 SRE=1153297 SLE=1467923 SRE=1497123 SLE=1260126 SRE=1466463 SLE=1257805 SRE=1259265"
"510","0.614353","100.86.7.137","13.84.36.2","TCP","90","[TCP Dup ACK 445#21] 57514  >  443 [ACK] Seq=13487 Ack=963861 Win=4140 Len=0 SLE=965321 SRE=1155955 SLE=1467923 SRE=1497123 SLE=1260126 SRE=1466463 SLE=1257805 SRE=1259265"
"511","0.614362","100.86.7.137","13.84.36.2","TCP","90","[TCP Dup ACK 445#22] 57514  >  443 [ACK] Seq=13487 Ack=963861 Win=4140 Len=0 SLE=965321 SRE=1158875 SLE=1467923 SRE=1497123 SLE=1260126 SRE=1466463 SLE=1257805 SRE=1259265"
"512","0.614371","100.86.7.137","13.84.36.2","TCP","90","[TCP Dup ACK 445#23] 57514  >  443 [ACK] Seq=13487 Ack=963861 Win=4140 Len=0 SLE=965321 SRE=1161795 SLE=1467923 SRE=1497123 SLE=1260126 SRE=1466463 SLE=1257805 SRE=1259265"
"513","0.614379","100.86.7.137","13.84.36.2","TCP","90","[TCP Dup ACK 445#24] 57514  >  443 [ACK] Seq=13487 Ack=963861 Win=4140 Len=0 SLE=965321 SRE=1164715 SLE=1467923 SRE=1497123 SLE=1260126 SRE=1466463 SLE=1257805 SRE=1259265"
"514","0.614389","100.86.7.137","13.84.36.2","TCP","90","[TCP Dup ACK 445#25] 57514  >  443 [ACK] Seq=13487 Ack=963861 Win=4140 Len=0 SLE=965321 SRE=1167635 SLE=1467923 SRE=1497123 SLE=1260126 SRE=1466463 SLE=1257805 SRE=1259265"
"515","0.614399","100.86.7.137","13.84.36.2","TCP","90","[TCP Dup ACK 445#26] 57514  >  443 [ACK] Seq=13487 Ack=963861 Win=4140 Len=0 SLE=965321 SRE=1169095 SLE=1467923 SRE=1497123 SLE=1260126 SRE=1466463 SLE=1257805 SRE=1259265"
"516","0.614409","100.86.7.137","13.84.36.2","TCP","90","[TCP Dup ACK 445#27] 57514  >  443 [ACK] Seq=13487 Ack=963861 Win=4140 Len=0 SLE=965321 SRE=1171229 SLE=1467923 SRE=1497123 SLE=1260126 SRE=1466463 SLE=1257805 SRE=1259265"
"517","0.614418","100.86.7.137","13.84.36.2","TCP","90","[TCP Dup ACK 445#28] 57514  >  443 [ACK] Seq=13487 Ack=963861 Win=4140 Len=0 SLE=965321 SRE=1174149 SLE=1467923 SRE=1497123 SLE=1260126 SRE=1466463 SLE=1257805 SRE=1259265"
"518","0.614427","100.86.7.137","13.84.36.2","TCP","90","[TCP Dup ACK 445#29] 57514  >  443 [ACK] Seq=13487 Ack=963861 Win=4140 Len=0 SLE=965321 SRE=1177069 SLE=1467923 SRE=1497123 SLE=1260126 SRE=1466463 SLE=1257805 SRE=1259265"
"519","0.614436","100.86.7.137","13.84.36.2","TCP","90","[TCP Dup ACK 445#30] 57514  >  443 [ACK] Seq=13487 Ack=963861 Win=4140 Len=0 SLE=965321 SRE=1179989 SLE=1467923 SRE=1497123 SLE=1260126 SRE=1466463 SLE=1257805 SRE=1259265"
"520","0.614444","100.86.7.137","13.84.36.2","TCP","90","[TCP Dup ACK 445#31] 57514  >  443 [ACK] Seq=13487 Ack=963861 Win=4140 Len=0 SLE=965321 SRE=1182123 SLE=1467923 SRE=1497123 SLE=1260126 SRE=1466463 SLE=1257805 SRE=1259265"
"521","0.614453","100.86.7.137","13.84.36.2","TCP","90","[TCP Dup ACK 445#32] 57514  >  443 [ACK] Seq=13487 Ack=963861 Win=4140 Len=0 SLE=965321 SRE=1185043 SLE=1467923 SRE=1497123 SLE=1260126 SRE=1466463 SLE=1257805 SRE=1259265"
"522","0.614462","100.86.7.137","13.84.36.2","TCP","90","[TCP Dup ACK 445#33] 57514  >  443 [ACK] Seq=13487 Ack=963861 Win=4140 Len=0 SLE=965321 SRE=1187963 SLE=1467923 SRE=1497123 SLE=1260126 SRE=1466463 SLE=1257805 SRE=1259265"
"523","0.614479","100.86.7.137","13.84.36.2","TCP","90","[TCP Dup ACK 445#34] 57514  >  443 [ACK] Seq=13487 Ack=963861 Win=4140 Len=0 SLE=965321 SRE=1190883 SLE=1467923 SRE=1497123 SLE=1260126 SRE=1466463 SLE=1257805 SRE=1259265"
"524","0.614488","100.86.7.137","13.84.36.2","TCP","90","[TCP Dup ACK 445#35] 57514  >  443 [ACK] Seq=13487 Ack=963861 Win=4140 Len=0 SLE=965321 SRE=1193017 SLE=1467923 SRE=1497123 SLE=1260126 SRE=1466463 SLE=1257805 SRE=1259265"
"525","0.614497","100.86.7.137","13.84.36.2","TCP","90","[TCP Dup ACK 445#36] 57514  >  443 [ACK] Seq=13487 Ack=963861 Win=4140 Len=0 SLE=965321 SRE=1195937 SLE=1467923 SRE=1497123 SLE=1260126 SRE=1466463 SLE=1257805 SRE=1259265"
"526","0.614505","100.86.7.137","13.84.36.2","TCP","90","[TCP Dup ACK 445#37] 57514  >  443 [ACK] Seq=13487 Ack=963861 Win=4140 Len=0 SLE=965321 SRE=1198693 SLE=1467923 SRE=1497123 SLE=1260126 SRE=1466463 SLE=1257805 SRE=1259265"
"527","0.614514","100.86.7.137","13.84.36.2","TCP","90","[TCP Dup ACK 445#38] 57514  >  443 [ACK] Seq=13487 Ack=963861 Win=4140 Len=0 SLE=965321 SRE=1201613 SLE=1467923 SRE=1497123 SLE=1260126 SRE=1466463 SLE=1257805 SRE=1259265"
"528","0.614523","100.86.7.137","13.84.36.2","TCP","90","[TCP Dup ACK 445#39] 57514  >  443 [ACK] Seq=13487 Ack=963861 Win=4140 Len=0 SLE=965321 SRE=1204533 SLE=1467923 SRE=1497123 SLE=1260126 SRE=1466463 SLE=1257805 SRE=1259265"
"529","0.614532","100.86.7.137","13.84.36.2","TCP","90","[TCP Dup ACK 445#40] 57514  >  443 [ACK] Seq=13487 Ack=963861 Win=4140 Len=0 SLE=965321 SRE=1207453 SLE=1467923 SRE=1497123 SLE=1260126 SRE=1466463 SLE=1257805 SRE=1259265"
"530","0.614549","100.86.7.137","13.84.36.2","TCP","90","[TCP Dup ACK 445#41] 57514  >  443 [ACK] Seq=13487 Ack=963861 Win=4140 Len=0 SLE=965321 SRE=1210373 SLE=1467923 SRE=1497123 SLE=1260126 SRE=1466463 SLE=1257805 SRE=1259265"
"531","0.614559","100.86.7.137","13.84.36.2","TCP","90","[TCP Dup ACK 445#42] 57514  >  443 [ACK] Seq=13487 Ack=963861 Win=4140 Len=0 SLE=965321 SRE=1213293 SLE=1467923 SRE=1497123 SLE=1260126 SRE=1466463 SLE=1257805 SRE=1259265"
"532","0.614568","100.86.7.137","13.84.36.2","TCP","90","[TCP Dup ACK 445#43] 57514  >  443 [ACK] Seq=13487 Ack=963861 Win=4140 Len=0 SLE=965321 SRE=1216213 SLE=1467923 SRE=1497123 SLE=1260126 SRE=1466463 SLE=1257805 SRE=1259265"
"533","0.614576","100.86.7.137","13.84.36.2","TCP","90","[TCP Dup ACK 445#44] 57514  >  443 [ACK] Seq=13487 Ack=963861 Win=4140 Len=0 SLE=965321 SRE=1219283 SLE=1467923 SRE=1497123 SLE=1260126 SRE=1466463 SLE=1257805 SRE=1259265"
"534","0.614674","13.84.36.2","100.86.7.137","TCP","1514","[TCP Out-Of-Order] 443  >  57514 [ACK] Seq=1219283 Ack=13487 Win=16384 Len=1460"
"535","0.614674","13.84.36.2","100.86.7.137","TCP","1514","[TCP Out-Of-Order] 443  >  57514 [ACK] Seq=1222203 Ack=13487 Win=16384 Len=1460 [TCP segment of a reassembled PDU]"
"536","0.614674","13.84.36.2","100.86.7.137","TCP","1514","[TCP Out-Of-Order] 443  >  57514 [ACK] Seq=1225123 Ack=13487 Win=16384 Len=1460"
"537","0.614674","13.84.36.2","100.86.7.137","TCP","1514","[TCP Out-Of-Order] 443  >  57514 [ACK] Seq=1228043 Ack=13487 Win=16384 Len=1460"
"538","0.614674","13.84.36.2","100.86.7.137","TCP","1514","[TCP Out-Of-Order] 443  >  57514 [ACK] Seq=1230963 Ack=13487 Win=16384 Len=1460"
"539","0.614674","13.84.36.2","100.86.7.137","TCP","1514","[TCP Out-Of-Order] 443  >  57514 [ACK] Seq=1233883 Ack=13487 Win=16384 Len=1460"
"540","0.614674","13.84.36.2","100.86.7.137","TCP","1514","[TCP Out-Of-Order] 443  >  57514 [ACK] Seq=1236803 Ack=13487 Win=16384 Len=1460"
"541","0.614674","13.84.36.2","100.86.7.137","TCP","1514","[TCP Out-Of-Order] 443  >  57514 [ACK] Seq=1239723 Ack=13487 Win=16384 Len=1460"
"542","0.614674","13.84.36.2","100.86.7.137","TCP","1514","[TCP Out-Of-Order] 443  >  57514 [ACK] Seq=1242531 Ack=13487 Win=16384 Len=1460"
"543","0.614674","13.84.36.2","100.86.7.137","TCP","1514","[TCP Out-Of-Order] 443  >  57514 [ACK] Seq=1245451 Ack=13487 Win=16384 Len=1460"
"544","0.614674","13.84.36.2","100.86.7.137","TCP","1514","[TCP Out-Of-Order] 443  >  57514 [ACK] Seq=1248371 Ack=13487 Win=16384 Len=1460"
"545","0.614674","13.84.36.2","100.86.7.137","TCP","1514","[TCP Out-Of-Order] 443  >  57514 [ACK] Seq=1251291 Ack=13487 Win=16384 Len=1460"
"546","0.614674","13.84.36.2","100.86.7.137","TCP","728","[TCP Out-Of-Order] 443  >  57514 [PSH, ACK] Seq=1254211 Ack=13487 Win=16384 Len=674"
"547","0.614674","13.84.36.2","100.86.7.137","TCP","1514","[TCP Out-Of-Order] 443  >  57514 [ACK] Seq=1256345 Ack=13487 Win=16384 Len=1460"
"548","0.614674","13.84.36.2","100.86.7.137","TCP","915","[TCP Out-Of-Order] 443  >  57514 [PSH, ACK] Seq=1259265 Ack=13487 Win=16384 Len=861"
"549","0.614674","13.84.36.2","100.86.7.137","TCP","1514","443  >  57514 [ACK] Seq=1497123 Ack=13487 Win=16384 Len=1460 [TCP segment of a reassembled PDU]"
"550","0.614743","100.86.7.137","13.84.36.2","TCP","90","[TCP Dup ACK 445#45] 57514  >  443 [ACK] Seq=13487 Ack=963861 Win=4140 Len=0 SLE=965321 SRE=1222203 SLE=1467923 SRE=1497123 SLE=1260126 SRE=1466463 SLE=1257805 SRE=1259265"
"551","0.614755","100.86.7.137","13.84.36.2","TCP","90","[TCP Dup ACK 445#46] 57514  >  443 [ACK] Seq=13487 Ack=963861 Win=4140 Len=0 SLE=965321 SRE=1225123 SLE=1467923 SRE=1497123 SLE=1260126 SRE=1466463 SLE=1257805 SRE=1259265"
"552","0.614764","100.86.7.137","13.84.36.2","TCP","90","[TCP Dup ACK 445#47] 57514  >  443 [ACK] Seq=13487 Ack=963861 Win=4140 Len=0 SLE=965321 SRE=1228043 SLE=1467923 SRE=1497123 SLE=1260126 SRE=1466463 SLE=1257805 SRE=1259265"
"553","0.614787","100.86.7.137","13.84.36.2","TCP","90","[TCP Dup ACK 445#48] 57514  >  443 [ACK] Seq=13487 Ack=963861 Win=4140 Len=0 SLE=965321 SRE=1230963 SLE=1467923 SRE=1497123 SLE=1260126 SRE=1466463 SLE=1257805 SRE=1259265"
"554","0.614798","100.86.7.137","13.84.36.2","TCP","90","[TCP Dup ACK 445#49] 57514  >  443 [ACK] Seq=13487 Ack=963861 Win=4140 Len=0 SLE=965321 SRE=1233883 SLE=1467923 SRE=1497123 SLE=1260126 SRE=1466463 SLE=1257805 SRE=1259265"
"555","0.614807","100.86.7.137","13.84.36.2","TCP","90","[TCP Dup ACK 445#50] 57514  >  443 [ACK] Seq=13487 Ack=963861 Win=4140 Len=0 SLE=965321 SRE=1236803 SLE=1467923 SRE=1497123 SLE=1260126 SRE=1466463 SLE=1257805 SRE=1259265"
"556","0.614815","100.86.7.137","13.84.36.2","TCP","90","[TCP Dup ACK 445#51] 57514  >  443 [ACK] Seq=13487 Ack=963861 Win=4140 Len=0 SLE=965321 SRE=1239723 SLE=1467923 SRE=1497123 SLE=1260126 SRE=1466463 SLE=1257805 SRE=1259265"
"557","0.614823","100.86.7.137","13.84.36.2","TCP","90","[TCP Dup ACK 445#52] 57514  >  443 [ACK] Seq=13487 Ack=963861 Win=4140 Len=0 SLE=965321 SRE=1242531 SLE=1467923 SRE=1497123 SLE=1260126 SRE=1466463 SLE=1257805 SRE=1259265"
"558","0.614832","100.86.7.137","13.84.36.2","TCP","90","[TCP Dup ACK 445#53] 57514  >  443 [ACK] Seq=13487 Ack=963861 Win=4140 Len=0 SLE=965321 SRE=1245451 SLE=1467923 SRE=1497123 SLE=1260126 SRE=1466463 SLE=1257805 SRE=1259265"
"559","0.614841","100.86.7.137","13.84.36.2","TCP","90","[TCP Dup ACK 445#54] 57514  >  443 [ACK] Seq=13487 Ack=963861 Win=4140 Len=0 SLE=965321 SRE=1248371 SLE=1467923 SRE=1497123 SLE=1260126 SRE=1466463 SLE=1257805 SRE=1259265"
"560","0.614864","100.86.7.137","13.84.36.2","TCP","90","[TCP Dup ACK 445#55] 57514  >  443 [ACK] Seq=13487 Ack=963861 Win=4140 Len=0 SLE=965321 SRE=1251291 SLE=1467923 SRE=1497123 SLE=1260126 SRE=1466463 SLE=1257805 SRE=1259265"
"561","0.614872","100.86.7.137","13.84.36.2","TCP","90","[TCP Dup ACK 445#56] 57514  >  443 [ACK] Seq=13487 Ack=963861 Win=4140 Len=0 SLE=965321 SRE=1254211 SLE=1467923 SRE=1497123 SLE=1260126 SRE=1466463 SLE=1257805 SRE=1259265"
"562","0.614882","100.86.7.137","13.84.36.2","TCP","90","[TCP Dup ACK 445#57] 57514  >  443 [ACK] Seq=13487 Ack=963861 Win=4140 Len=0 SLE=965321 SRE=1256345 SLE=1467923 SRE=1497123 SLE=1260126 SRE=1466463 SLE=1257805 SRE=1259265"
"563","0.614891","100.86.7.137","13.84.36.2","TCP","82","[TCP Dup ACK 445#58] 57514  >  443 [ACK] Seq=13487 Ack=963861 Win=4140 Len=0 SLE=965321 SRE=1259265 SLE=1467923 SRE=1497123 SLE=1260126 SRE=1466463"
"564","0.614900","100.86.7.137","13.84.36.2","TCP","74","[TCP Dup ACK 445#59] 57514  >  443 [ACK] Seq=13487 Ack=963861 Win=4140 Len=0 SLE=965321 SRE=1466463 SLE=1467923 SRE=1497123"
"565","0.614910","100.86.7.137","13.84.36.2","TCP","74","[TCP Dup ACK 445#60] 57514  >  443 [ACK] Seq=13487 Ack=963861 Win=4140 Len=0 SLE=1467923 SRE=1498583 SLE=965321 SRE=1466463"
"566","0.615018","13.84.36.2","100.86.7.137","TLSv1.2","2974","Application Data"
"567","0.615046","100.86.7.137","13.84.36.2","TCP","74","[TCP Dup ACK 445#61] 57514  >  443 [ACK] Seq=13487 Ack=963861 Win=4140 Len=0 SLE=1467923 SRE=1501503 SLE=965321 SRE=1466463"
"568","0.615515","13.84.36.2","100.86.7.137","TLSv1.2","2974","Application Data"
"569","0.615542","100.86.7.137","13.84.36.2","TCP","74","[TCP Dup ACK 445#62] 57514  >  443 [ACK] Seq=13487 Ack=963861 Win=4140 Len=0 SLE=1467923 SRE=1504423 SLE=965321 SRE=1466463"
"570","0.615923","13.84.36.2","100.86.7.137","TCP","1514","443  >  57514 [ACK] Seq=1504423 Ack=13487 Win=16384 Len=1460 [TCP segment of a reassembled PDU]"
"571","0.615946","100.86.7.137","13.84.36.2","TCP","74","[TCP Dup ACK 445#63] 57514  >  443 [ACK] Seq=13487 Ack=963861 Win=4140 Len=0 SLE=1467923 SRE=1505883 SLE=965321 SRE=1466463"
"572","0.626207","13.84.36.2","100.86.7.137","TCP","1514","443  >  57514 [ACK] Seq=1505883 Ack=13487 Win=16384 Len=1460 [TCP segment of a reassembled PDU]"
"573","0.626207","13.84.36.2","100.86.7.137","TLSv1.2","1514","Application Data"
"574","0.626207","13.84.36.2","100.86.7.137","TCP","1514","443  >  57514 [ACK] Seq=1508803 Ack=13487 Win=16384 Len=1460 [TCP segment of a reassembled PDU]"
"575","0.626207","13.84.36.2","100.86.7.137","TLSv1.2","2974","Application Data"
"576","0.626427","100.86.7.137","13.84.36.2","TCP","74","[TCP Dup ACK 445#64] 57514  >  443 [ACK] Seq=13487 Ack=963861 Win=4140 Len=0 SLE=1467923 SRE=1507343 SLE=965321 SRE=1466463"
"577","0.626442","100.86.7.137","13.84.36.2","TCP","74","[TCP Dup ACK 445#65] 57514  >  443 [ACK] Seq=13487 Ack=963861 Win=4140 Len=0 SLE=1467923 SRE=1508803 SLE=965321 SRE=1466463"
"578","0.626456","100.86.7.137","13.84.36.2","TCP","74","[TCP Dup ACK 445#66] 57514  >  443 [ACK] Seq=13487 Ack=963861 Win=4140 Len=0 SLE=1467923 SRE=1510263 SLE=965321 SRE=1466463"
"579","0.626492","100.86.7.137","13.84.36.2","TCP","74","[TCP Dup ACK 445#67] 57514  >  443 [ACK] Seq=13487 Ack=963861 Win=4140 Len=0 SLE=1467923 SRE=1513183 SLE=965321 SRE=1466463"
"580","0.638004","13.84.36.2","100.86.7.137","TLSv1.2","1514","[TCP Fast Retransmission] , Application Data"
"581","0.638189","100.86.7.137","13.84.36.2","TCP","66","57514  >  443 [ACK] Seq=13487 Ack=1466463 Win=4140 Len=0 SLE=1467923 SRE=1513183"
"582","0.640382","13.84.36.2","100.86.7.137","TCP","1514","443  >  57514 [ACK] Seq=1513183 Ack=13487 Win=16384 Len=1460 [TCP segment of a reassembled PDU]"
"583","0.640428","100.86.7.137","13.84.36.2","TCP","66","[TCP Dup ACK 581#1] 57514  >  443 [ACK] Seq=13487 Ack=1466463 Win=4140 Len=0 SLE=1467923 SRE=1514643"
"584","0.646912","13.84.36.2","100.86.7.137","TCP","1514","443  >  57514 [ACK] Seq=1514643 Ack=13487 Win=16384 Len=1460 [TCP segment of a reassembled PDU]"
"585","0.646912","13.84.36.2","100.86.7.137","TLSv1.2","1514","Application Data"
"586","0.646971","100.86.7.137","13.84.36.2","TCP","66","[TCP Dup ACK 581#2] 57514  >  443 [ACK] Seq=13487 Ack=1466463 Win=4140 Len=0 SLE=1467923 SRE=1516103"
"587","0.647032","100.86.7.137","13.84.36.2","TCP","66","[TCP Dup ACK 581#3] 57514  >  443 [ACK] Seq=13487 Ack=1466463 Win=4140 Len=0 SLE=1467923 SRE=1517563"
"588","0.648041","13.84.36.2","100.86.7.137","TLSv1.2","2974","Application Data"
"589","0.648082","100.86.7.137","13.84.36.2","TCP","66","[TCP Dup ACK 581#4] 57514  >  443 [ACK] Seq=13487 Ack=1466463 Win=4140 Len=0 SLE=1467923 SRE=1520483"
"590","0.653884","13.84.36.2","100.86.7.137","TLSv1.2","4434","Application Data"
"591","0.654005","100.86.7.137","13.84.36.2","TCP","66","[TCP Dup ACK 581#5] 57514  >  443 [ACK] Seq=13487 Ack=1466463 Win=4140 Len=0 SLE=1467923 SRE=1524863"
"592","0.654515","13.84.36.2","100.86.7.137","TCP","1514","443  >  57514 [ACK] Seq=1524863 Ack=13487 Win=16384 Len=1460 [TCP segment of a reassembled PDU]"
"593","0.654551","100.86.7.137","13.84.36.2","TCP","66","[TCP Dup ACK 581#6] 57514  >  443 [ACK] Seq=13487 Ack=1466463 Win=4140 Len=0 SLE=1467923 SRE=1526323"
"594","0.658868","13.84.36.2","100.86.7.137","TCP","1514","443  >  57514 [ACK] Seq=1526323 Ack=13487 Win=16384 Len=1460 [TCP segment of a reassembled PDU]"
"595","0.658907","100.86.7.137","13.84.36.2","TCP","66","[TCP Dup ACK 581#7] 57514  >  443 [ACK] Seq=13487 Ack=1466463 Win=4140 Len=0 SLE=1467923 SRE=1527783"
"596","0.659201","13.84.36.2","100.86.7.137","TLSv1.2","1514","Application Data"
"597","0.659215","100.86.7.137","13.84.36.2","TCP","66","[TCP Dup ACK 581#8] 57514  >  443 [ACK] Seq=13487 Ack=1466463 Win=4140 Len=0 SLE=1467923 SRE=1529243"
"598","0.659343","13.84.36.2","100.86.7.137","TCP","2974","443  >  57514 [ACK] Seq=1529243 Ack=13487 Win=16384 Len=2920 [TCP segment of a reassembled PDU]"
"599","0.659355","100.86.7.137","13.84.36.2","TCP","66","[TCP Dup ACK 581#9] 57514  >  443 [ACK] Seq=13487 Ack=1466463 Win=4140 Len=0 SLE=1467923 SRE=1532163"
"600","0.660054","13.84.36.2","100.86.7.137","TLSv1.2","11734","Application Data, Application Data, Application Data, Application Data"
"601","0.660074","100.86.7.137","13.84.36.2","TCP","66","[TCP Dup ACK 581#10] 57514  >  443 [ACK] Seq=13487 Ack=1466463 Win=4140 Len=0 SLE=1467923 SRE=1543843"
"602","0.660769","13.84.36.2","100.86.7.137","TCP","1514","443  >  57514 [ACK] Seq=1543843 Ack=13487 Win=16384 Len=1460 [TCP segment of a reassembled PDU]"
"603","0.660787","100.86.7.137","13.84.36.2","TCP","66","[TCP Dup ACK 581#11] 57514  >  443 [ACK] Seq=13487 Ack=1466463 Win=4140 Len=0 SLE=1467923 SRE=1545303"
"604","0.661367","13.84.36.2","100.86.7.137","TLSv1.2","2974","Application Data"
"605","0.661383","100.86.7.137","13.84.36.2","TCP","66","[TCP Dup ACK 581#12] 57514  >  443 [ACK] Seq=13487 Ack=1466463 Win=4140 Len=0 SLE=1467923 SRE=1548223"
"606","0.661703","13.84.36.2","100.86.7.137","TLSv1.2","11734","Application Data, Application Data, Application Data"
"607","0.661737","100.86.7.137","13.84.36.2","TCP","66","[TCP Dup ACK 581#13] 57514  >  443 [ACK] Seq=13487 Ack=1466463 Win=4140 Len=0 SLE=1467923 SRE=1559903"
"608","0.663314","13.84.36.2","100.86.7.137","TLSv1.2","23414","Application Data, Application Data, Application Data, Application Data, Application Data, Application Data"
"609","0.663314","13.84.36.2","100.86.7.137","TCP","2974","[TCP Previous segment not captured] 443  >  57514 [ACK] Seq=1584723 Ack=13487 Win=16384 Len=2920 [TCP segment of a reassembled PDU]"
"610","0.663381","100.86.7.137","13.84.36.2","TCP","66","[TCP Dup ACK 581#14] 57514  >  443 [ACK] Seq=13487 Ack=1466463 Win=4140 Len=0 SLE=1467923 SRE=1583263"
"611","0.663445","100.86.7.137","13.84.36.2","TCP","74","[TCP Dup ACK 581#15] 57514  >  443 [ACK] Seq=13487 Ack=1466463 Win=4140 Len=0 SLE=1584723 SRE=1587643 SLE=1467923 SRE=1583263"
"612","0.664310","13.84.36.2","100.86.7.137","TCP","1514","443  >  57514 [ACK] Seq=1587643 Ack=13487 Win=16384 Len=1460 [TCP segment of a reassembled PDU]"
"613","0.664337","100.86.7.137","13.84.36.2","TCP","74","[TCP Dup ACK 581#16] 57514  >  443 [ACK] Seq=13487 Ack=1466463 Win=4140 Len=0 SLE=1584723 SRE=1589103 SLE=1467923 SRE=1583263"
"614","0.665157","13.84.36.2","100.86.7.137","TLSv1.2","1514","[TCP Fast Retransmission] , Application Data"
"615","0.665283","100.86.7.137","13.84.36.2","TCP","66","57514  >  443 [ACK] Seq=13487 Ack=1583263 Win=4140 Len=0 SLE=1584723 SRE=1589103"
"616","0.684235","13.84.36.2","100.86.7.137","TLSv1.2","512","Application Data, Application Data, Application Data"
"617","0.684291","100.86.7.137","13.84.36.2","TCP","66","[TCP Dup ACK 615#1] 57514  >  443 [ACK] Seq=13487 Ack=1583263 Win=4140 Len=0 SLE=1584723 SRE=1589561"
"618","0.691985","13.84.36.2","100.86.7.137","TCP","1514","[TCP Spurious Retransmission] 443  >  57514 [ACK] Seq=1466463 Ack=13487 Win=16384 Len=1460 [TCP segment of a reassembled PDU]"
"619","0.692020","100.86.7.137","13.84.36.2","TCP","74","[TCP Dup ACK 615#2] 57514  >  443 [ACK] Seq=13487 Ack=1583263 Win=4140 Len=0 SLE=1466463 SRE=1467923 SLE=1584723 SRE=1589561"
"620","0.730401","13.84.36.2","100.86.7.137","TCP","1514","[TCP Retransmission] 443  >  57514 [ACK] Seq=1583263 Ack=13487 Win=16384 Len=1460"
"621","0.730488","100.86.7.137","13.84.36.2","TCP","54","57514  >  443 [ACK] Seq=13487 Ack=1589561 Win=4140 Len=0"
"622","9.271911","100.86.7.137","13.84.36.2","TLSv1.2","2255","Application Data"
"623","9.316581","13.84.36.2","100.86.7.137","TCP","56","443  >  57514 [ACK] Seq=1589561 Ack=15688 Win=16385 Len=0"
"624","9.384386","13.84.36.2","100.86.7.137","TCP","1514","443  >  57514 [ACK] Seq=1589561 Ack=15688 Win=16385 Len=1460 [TCP segment of a reassembled PDU]"
"625","9.384806","13.84.36.2","100.86.7.137","TCP","1514","443  >  57514 [ACK] Seq=1591021 Ack=15688 Win=16385 Len=1460 [TCP segment of a reassembled PDU]"
"626","9.384806","13.84.36.2","100.86.7.137","TLSv1.2","1313","Application Data, Application Data"
"627","9.384844","100.86.7.137","13.84.36.2","TCP","54","57514  >  443 [ACK] Seq=15688 Ack=1593740 Win=4140 Len=0"
"628","9.385655","100.86.7.137","13.84.36.2","TLSv1.2","89","Application Data"
"629","9.386552","13.84.36.2","100.86.7.137","TCP","1514","443  >  57514 [ACK] Seq=1593740 Ack=15688 Win=16385 Len=1460 [TCP segment of a reassembled PDU]"
"630","9.386594","100.86.7.137","13.84.36.2","TCP","54","57514  >  443 [ACK] Seq=15723 Ack=1595200 Win=4140 Len=0"
"631","9.386841","13.84.36.2","100.86.7.137","TCP","1514","443  >  57514 [ACK] Seq=1595200 Ack=15688 Win=16385 Len=1460 [TCP segment of a reassembled PDU]"
"632","9.386841","13.84.36.2","100.86.7.137","TLSv1.2","1277","Application Data, Application Data"
"633","9.386911","100.86.7.137","13.84.36.2","TCP","54","57514  >  443 [ACK] Seq=15723 Ack=1597883 Win=4140 Len=0"
"634","9.387488","13.84.36.2","100.86.7.137","TCP","2974","443  >  57514 [ACK] Seq=1597883 Ack=15688 Win=16385 Len=2920 [TCP segment of a reassembled PDU]"
"635","9.387488","13.84.36.2","100.86.7.137","TLSv1.2","1252","Application Data"
"636","9.387488","13.84.36.2","100.86.7.137","TLSv1.2","824","Application Data"
"637","9.387531","100.86.7.137","13.84.36.2","TCP","54","57514  >  443 [ACK] Seq=15723 Ack=1602771 Win=4140 Len=0"
"638","9.387626","13.84.36.2","100.86.7.137","TLSv1.2","85","Application Data"
"639","9.387648","100.86.7.137","13.84.36.2","TCP","54","57514  >  443 [ACK] Seq=15723 Ack=1602802 Win=4139 Len=0"
"640","9.501244","13.84.36.2","100.86.7.137","TCP","56","443  >  57514 [ACK] Seq=1602802 Ack=15723 Win=16384 Len=0"
"641","9.510354","100.86.7.137","13.84.36.2","TLSv1.2","2242","Application Data"
"642","9.559883","13.84.36.2","100.86.7.137","TCP","56","443  >  57514 [ACK] Seq=1602802 Ack=17911 Win=16385 Len=0"
"643","9.575092","13.84.36.2","100.86.7.137","TCP","1514","443  >  57514 [ACK] Seq=1602802 Ack=17911 Win=16385 Len=1460 [TCP segment of a reassembled PDU]"
"644","9.575266","13.84.36.2","100.86.7.137","TCP","1514","443  >  57514 [ACK] Seq=1604262 Ack=17911 Win=16385 Len=1460 [TCP segment of a reassembled PDU]"
"645","9.575266","13.84.36.2","100.86.7.137","TLSv1.2","279","Application Data"
"646","9.575299","100.86.7.137","13.84.36.2","TCP","54","57514  >  443 [ACK] Seq=17911 Ack=1605947 Win=4140 Len=0"
"647","9.577633","13.84.36.2","100.86.7.137","TLSv1.2","11734","Application Data, Application Data"
"648","9.577633","13.84.36.2","100.86.7.137","TLSv1.2","728","Application Data"
"649","9.577633","13.84.36.2","100.86.7.137","TLSv1.2","21954","Application Data, Application Data, Application Data, Application Data, Application Data"
"650","9.577746","100.86.7.137","13.84.36.2","TCP","54","57514  >  443 [ACK] Seq=17911 Ack=1640201 Win=4140 Len=0"
"651","9.580557","13.84.36.2","100.86.7.137","TLSv1.2","5894","Application Data"
"652","9.580557","13.84.36.2","100.86.7.137","TLSv1.2","1140","Application Data"
"653","9.580557","13.84.36.2","100.86.7.137","TLSv1.2","20494","Application Data, Application Data, Application Data, Application Data"
"654","9.580557","13.84.36.2","100.86.7.137","TLSv1.2","204","Application Data"
"655","9.580557","13.84.36.2","100.86.7.137","TCP","2974","443  >  57514 [ACK] Seq=1667717 Ack=17911 Win=16385 Len=2920 [TCP segment of a reassembled PDU]"
"656","9.580557","13.84.36.2","100.86.7.137","TLSv1.2","1310","Application Data, Application Data"
"657","9.580557","13.84.36.2","100.86.7.137","TLSv1.2","20494","Application Data, Application Data, Application Data, Application Data"
"658","9.580557","13.84.36.2","100.86.7.137","TLSv1.2","318","Application Data, Application Data"
"659","9.580696","100.86.7.137","13.84.36.2","TCP","54","57514  >  443 [ACK] Seq=17911 Ack=1692597 Win=4140 Len=0"
"660","9.581468","13.84.36.2","100.86.7.137","TLSv1.2","85","Application Data"
"661","9.581502","100.86.7.137","13.84.36.2","TCP","54","57514  >  443 [ACK] Seq=17911 Ack=1692628 Win=4139 Len=0"
"662","9.598245","100.86.7.137","13.84.36.2","TLSv1.2","2307","Application Data"
"663","9.598509","100.86.7.137","13.84.36.2","TLSv1.2","2325","Application Data"
"664","9.655420","13.84.36.2","100.86.7.137","TCP","56","443  >  57514 [ACK] Seq=1692628 Ack=20164 Win=16385 Len=0"
"665","9.655420","13.84.36.2","100.86.7.137","TCP","56","443  >  57514 [ACK] Seq=1692628 Ack=22435 Win=16385 Len=0"
"666","9.744404","13.84.36.2","100.86.7.137","TLSv1.2","768","Application Data"
"667","9.745056","13.84.36.2","100.86.7.137","TLSv1.2","373","Application Data"
"668","9.745097","100.86.7.137","13.84.36.2","TCP","54","57514  >  443 [ACK] Seq=22435 Ack=1693661 Win=4135 Len=0"
"669","9.745390","13.84.36.2","100.86.7.137","TLSv1.2","179","Application Data"
"670","9.746081","13.84.36.2","100.86.7.137","TLSv1.2","96","Application Data"
"671","9.746081","13.84.36.2","100.86.7.137","TLSv1.2","85","Application Data"
"672","9.746111","100.86.7.137","13.84.36.2","TCP","54","57514  >  443 [ACK] Seq=22435 Ack=1693859 Win=4135 Len=0"
"673","9.832001","13.84.36.2","100.86.7.137","TLSv1.2","710","Application Data"
"674","9.832001","13.84.36.2","100.86.7.137","TLSv1.2","163","Application Data"
"675","9.832001","13.84.36.2","100.86.7.137","TLSv1.2","103","Application Data"
"676","9.832073","100.86.7.137","13.84.36.2","TCP","54","57514  >  443 [ACK] Seq=22435 Ack=1694673 Win=4140 Len=0"
"677","9.832772","13.84.36.2","100.86.7.137","TLSv1.2","95","Application Data"
"678","9.832804","100.86.7.137","13.84.36.2","TCP","54","57514  >  443 [ACK] Seq=22435 Ack=1694714 Win=4139 Len=0"
"679","9.833173","13.84.36.2","100.86.7.137","TLSv1.2","85","Application Data"
"680","9.890400","100.86.7.137","13.84.36.2","TCP","54","57514  >  443 [ACK] Seq=22435 Ack=1694745 Win=4139 Len=0"
