"No.","Time","Source","Destination","Protocol","Length","Info"
"1","0.000000","100.86.7.137","13.84.36.2","TLSv1.2","2306","Application Data"
"2","0.000096","100.86.7.137","13.84.36.2","TLSv1.2","93","Application Data"
"3","0.045008","13.84.36.2","100.86.7.137","TCP","56","443  >  57514 [ACK] Seq=1 Ack=2292 Win=16385 Len=0"
"4","0.045309","13.84.36.2","100.86.7.137","TLSv1.2","93","Application Data"
"5","0.091117","100.86.7.137","13.84.36.2","TCP","54","57514  >  443 [ACK] Seq=2292 Ack=40 Win=4139 Len=0"
"6","0.171203","13.84.36.2","100.86.7.137","TCP","1514","443  >  57514 [ACK] Seq=40 Ack=2292 Win=16385 Len=1460 [TCP segment of a reassembled PDU]"
"7","0.174015","13.84.36.2","100.86.7.137","TCP","1514","443  >  57514 [ACK] Seq=1500 Ack=2292 Win=16385 Len=1460 [TCP segment of a reassembled PDU]"
"8","0.174015","13.84.36.2","100.86.7.137","TLSv1.2","1304","Application Data, Application Data"
"9","0.174015","13.84.36.2","100.86.7.137","TCP","2974","443  >  57514 [ACK] Seq=4210 Ack=2292 Win=16385 Len=2920 [TCP segment of a reassembled PDU]"
"10","0.174015","13.84.36.2","100.86.7.137","TLSv1.2","1277","Application Data, Application Data"
"11","0.174015","13.84.36.2","100.86.7.137","TCP","2974","443  >  57514 [ACK] Seq=8353 Ack=2292 Win=16385 Len=2920 [TCP segment of a reassembled PDU]"
"12","0.174015","13.84.36.2","100.86.7.137","TLSv1.2","1252","Application Data"
"13","0.174015","13.84.36.2","100.86.7.137","TCP","1514","443  >  57514 [ACK] Seq=12471 Ack=2292 Win=16385 Len=1460 [TCP segment of a reassembled PDU]"
"14","0.174199","100.86.7.137","13.84.36.2","TCP","54","57514  >  443 [ACK] Seq=2292 Ack=13931 Win=4140 Len=0"
"15","0.174469","13.84.36.2","100.86.7.137","TLSv1.2","675","Application Data"
"16","0.174469","13.84.36.2","100.86.7.137","TLSv1.2","85","Application Data"
"17","0.174529","100.86.7.137","13.84.36.2","TCP","54","57514  >  443 [ACK] Seq=2292 Ack=14583 Win=4137 Len=0"
"18","0.175570","100.86.7.137","13.84.36.2","TLSv1.2","89","Application Data"
"19","0.269390","13.84.36.2","100.86.7.137","TCP","56","443  >  57514 [ACK] Seq=14583 Ack=2327 Win=16384 Len=0"
"20","0.364355","100.86.7.137","13.84.36.2","TLSv1.2","1822","Application Data"
"21","0.364512","100.86.7.137","13.84.36.2","TLSv1.2","591","Application Data"
"22","0.364609","100.86.7.137","13.84.36.2","TLSv1.2","1855","Application Data"
"23","0.364855","100.86.7.137","13.84.36.2","TLSv1.2","590","Application Data"
"24","0.364956","100.86.7.137","13.84.36.2","TLSv1.2","1851","Application Data"
"25","0.408930","13.84.36.2","100.86.7.137","TCP","56","443  >  57514 [ACK] Seq=14583 Ack=4095 Win=16385 Len=0"
"26","0.409282","13.84.36.2","100.86.7.137","TCP","56","443  >  57514 [ACK] Seq=14583 Ack=6433 Win=16385 Len=0"
"27","0.410152","13.84.36.2","100.86.7.137","TCP","56","443  >  57514 [ACK] Seq=14583 Ack=8766 Win=16385 Len=0"
"28","0.425794","100.86.7.137","13.84.36.2","TLSv1.2","720","Application Data"
"29","0.427359","100.86.7.137","13.84.36.2","TLSv1.2","1862","Application Data"
"30","0.459604","13.84.36.2","100.86.7.137","TCP","1514","443  >  57514 [ACK] Seq=14583 Ack=8766 Win=16385 Len=1460 [TCP segment of a reassembled PDU]"
"31","0.459604","13.84.36.2","100.86.7.137","TCP","1514","443  >  57514 [ACK] Seq=16043 Ack=8766 Win=16385 Len=1460 [TCP segment of a reassembled PDU]"
"32","0.459604","13.84.36.2","100.86.7.137","TLSv1.2","279","Application Data"
"33","0.459683","100.86.7.137","13.84.36.2","TCP","54","57514  >  443 [ACK] Seq=11240 Ack=17728 Win=4140 Len=0"
"34","0.461407","13.84.36.2","100.86.7.137","TLSv1.2","20494","Application Data, Application Data, Application Data, Application Data"
"35","0.461407","13.84.36.2","100.86.7.137","TLSv1.2","204","Application Data"
"36","0.461407","13.84.36.2","100.86.7.137","TLSv1.2","21954","Application Data, Application Data, Application Data, Application Data, Application Data"
"37","0.461407","13.84.36.2","100.86.7.137","TLSv1.2","1047","Application Data"
"38","0.461407","13.84.36.2","100.86.7.137","TLSv1.2","85","Application Data"
"39","0.461552","100.86.7.137","13.84.36.2","TCP","54","57514  >  443 [ACK] Seq=11240 Ack=61242 Win=4140 Len=0"
"40","0.463812","13.84.36.2","100.86.7.137","TCP","1514","443  >  57514 [ACK] Seq=61242 Ack=8766 Win=16385 Len=1460 [TCP segment of a reassembled PDU]"
"41","0.463812","13.84.36.2","100.86.7.137","TCP","1514","443  >  57514 [ACK] Seq=62702 Ack=8766 Win=16385 Len=1460 [TCP segment of a reassembled PDU]"
"42","0.463812","13.84.36.2","100.86.7.137","TLSv1.2","285","Application Data"
"43","0.463893","100.86.7.137","13.84.36.2","TCP","54","57514  >  443 [ACK] Seq=11240 Ack=64393 Win=4140 Len=0"
"44","0.480707","13.84.36.2","100.86.7.137","TCP","1514","443  >  57514 [ACK] Seq=64393 Ack=8766 Win=16385 Len=1460 [TCP segment of a reassembled PDU]"
"45","0.480707","13.84.36.2","100.86.7.137","TCP","1514","443  >  57514 [ACK] Seq=65853 Ack=8766 Win=16385 Len=1460 [TCP segment of a reassembled PDU]"
"46","0.480707","13.84.36.2","100.86.7.137","TLSv1.2","1514","Application Data"
"47","0.480707","13.84.36.2","100.86.7.137","TCP","1514","443  >  57514 [ACK] Seq=68773 Ack=8766 Win=16385 Len=1460 [TCP segment of a reassembled PDU]"
"48","0.480707","13.84.36.2","100.86.7.137","TCP","1514","443  >  57514 [ACK] Seq=70233 Ack=8766 Win=16385 Len=1460 [TCP segment of a reassembled PDU]"
"49","0.480707","13.84.36.2","100.86.7.137","TLSv1.2","1514","Application Data"
"50","0.480707","13.84.36.2","100.86.7.137","TCP","1514","443  >  57514 [ACK] Seq=73153 Ack=8766 Win=16385 Len=1460 [TCP segment of a reassembled PDU]"
"51","0.480707","13.84.36.2","100.86.7.137","TCP","1514","443  >  57514 [ACK] Seq=74613 Ack=8766 Win=16385 Len=1460 [TCP segment of a reassembled PDU]"
"52","0.480707","13.84.36.2","100.86.7.137","TLSv1.2","728","Application Data"
"53","0.480707","13.84.36.2","100.86.7.137","TCP","1514","443  >  57514 [ACK] Seq=76747 Ack=8766 Win=16385 Len=1460 [TCP segment of a reassembled PDU]"
"54","0.480707","13.84.36.2","100.86.7.137","TLSv1.2","5894","Application Data"
"55","0.480707","13.84.36.2","100.86.7.137","TLSv1.2","1514","Application Data"
"56","0.480707","13.84.36.2","100.86.7.137","TCP","1514","443  >  57514 [ACK] Seq=85507 Ack=8766 Win=16385 Len=1460 [TCP segment of a reassembled PDU]"
"57","0.480707","13.84.36.2","100.86.7.137","TCP","1514","443  >  57514 [ACK] Seq=86967 Ack=8766 Win=16385 Len=1460 [TCP segment of a reassembled PDU]"
"58","0.480707","13.84.36.2","100.86.7.137","TLSv1.2","1514","Application Data"
"59","0.480707","13.84.36.2","100.86.7.137","TCP","1514","443  >  57514 [ACK] Seq=89887 Ack=8766 Win=16385 Len=1460 [TCP segment of a reassembled PDU]"
"60","0.480707","13.84.36.2","100.86.7.137","TCP","1514","443  >  57514 [ACK] Seq=91347 Ack=8766 Win=16385 Len=1460 [TCP segment of a reassembled PDU]"
"61","0.480707","13.84.36.2","100.86.7.137","TLSv1.2","2974","Application Data"
"62","0.480707","13.84.36.2","100.86.7.137","TCP","1514","443  >  57514 [ACK] Seq=95727 Ack=8766 Win=16385 Len=1460 [TCP segment of a reassembled PDU]"
"63","0.480707","13.84.36.2","100.86.7.137","TLSv1.2","204","Application Data"
"64","0.480707","13.84.36.2","100.86.7.137","TCP","1514","443  >  57514 [ACK] Seq=97337 Ack=8766 Win=16385 Len=1460 [TCP segment of a reassembled PDU]"
"65","0.480707","13.84.36.2","100.86.7.137","TCP","1514","443  >  57514 [ACK] Seq=98797 Ack=8766 Win=16385 Len=1460 [TCP segment of a reassembled PDU]"
"66","0.480707","13.84.36.2","100.86.7.137","TLSv1.2","1514","Application Data"
"67","0.480707","13.84.36.2","100.86.7.137","TCP","1514","443  >  57514 [ACK] Seq=101717 Ack=8766 Win=16385 Len=1460 [TCP segment of a reassembled PDU]"
"68","0.480707","13.84.36.2","100.86.7.137","TCP","1514","443  >  57514 [ACK] Seq=103177 Ack=8766 Win=16385 Len=1460 [TCP segment of a reassembled PDU]"
"69","0.480707","13.84.36.2","100.86.7.137","TLSv1.2","1514","Application Data"
"70","0.480707","13.84.36.2","100.86.7.137","TCP","1514","443  >  57514 [ACK] Seq=106097 Ack=8766 Win=16385 Len=1460 [TCP segment of a reassembled PDU]"
"71","0.480707","13.84.36.2","100.86.7.137","TCP","1514","443  >  57514 [ACK] Seq=107557 Ack=8766 Win=16385 Len=1460 [TCP segment of a reassembled PDU]"
"72","0.480707","13.84.36.2","100.86.7.137","TLSv1.2","1514","Application Data"
"73","0.480707","13.84.36.2","100.86.7.137","TCP","1514","443  >  57514 [ACK] Seq=110477 Ack=8766 Win=16385 Len=1460 [TCP segment of a reassembled PDU]"
"74","0.480707","13.84.36.2","100.86.7.137","TCP","1514","443  >  57514 [ACK] Seq=111937 Ack=8766 Win=16385 Len=1460 [TCP segment of a reassembled PDU]"
"75","0.480707","13.84.36.2","100.86.7.137","TLSv1.2","1514","Application Data"
"76","0.481062","100.86.7.137","13.84.36.2","TCP","54","57514  >  443 [ACK] Seq=11240 Ack=114857 Win=4140 Len=0"
"77","0.481278","13.84.36.2","100.86.7.137","TCP","1514","443  >  57514 [ACK] Seq=114857 Ack=8766 Win=16385 Len=1460 [TCP segment of a reassembled PDU]"
"78","0.481278","13.84.36.2","100.86.7.137","TCP","204","[TCP Previous segment not captured] 443  >  57514 [PSH, ACK] Seq=117777 Ack=8766 Win=16385 Len=150 [TCP segment of a reassembled PDU]"
"79","0.481278","13.84.36.2","100.86.7.137","TCP","1514","443  >  57514 [ACK] Seq=117927 Ack=8766 Win=16385 Len=1460 [TCP segment of a reassembled PDU]"
"80","0.481278","13.84.36.2","100.86.7.137","TCP","1514","443  >  57514 [ACK] Seq=119387 Ack=8766 Win=16385 Len=1460 [TCP segment of a reassembled PDU]"
"81","0.481278","13.84.36.2","100.86.7.137","TLSv1.2","2974","Application Data"
"82","0.481278","13.84.36.2","100.86.7.137","TCP","1514","443  >  57514 [ACK] Seq=123767 Ack=8766 Win=16385 Len=1460 [TCP segment of a reassembled PDU]"
"83","0.481278","13.84.36.2","100.86.7.137","TLSv1.2","1514","Application Data"
"84","0.481278","13.84.36.2","100.86.7.137","TCP","1514","443  >  57514 [ACK] Seq=126687 Ack=8766 Win=16385 Len=1460 [TCP segment of a reassembled PDU]"
"85","0.481278","13.84.36.2","100.86.7.137","TCP","1514","443  >  57514 [ACK] Seq=128147 Ack=8766 Win=16385 Len=1460 [TCP segment of a reassembled PDU]"
"86","0.481278","13.84.36.2","100.86.7.137","TLSv1.2","786","Application Data, Application Data"
"87","0.481278","13.84.36.2","100.86.7.137","TCP","1514","443  >  57514 [ACK] Seq=130339 Ack=8766 Win=16385 Len=1460 [TCP segment of a reassembled PDU]"
"88","0.481278","13.84.36.2","100.86.7.137","TCP","1514","443  >  57514 [ACK] Seq=131799 Ack=8766 Win=16385 Len=1460 [TCP segment of a reassembled PDU]"
"89","0.481278","13.84.36.2","100.86.7.137","TLSv1.2","1514","Application Data"
"90","0.481278","13.84.36.2","100.86.7.137","TCP","1514","443  >  57514 [ACK] Seq=134719 Ack=8766 Win=16385 Len=1460 [TCP segment of a reassembled PDU]"
"91","0.481278","13.84.36.2","100.86.7.137","TCP","1514","443  >  57514 [ACK] Seq=136179 Ack=8766 Win=16385 Len=1460 [TCP segment of a reassembled PDU]"
"92","0.481278","13.84.36.2","100.86.7.137","TLSv1.2","1514","Application Data"
"93","0.481278","13.84.36.2","100.86.7.137","TCP","1514","443  >  57514 [ACK] Seq=139099 Ack=8766 Win=16385 Len=1460 [TCP segment of a reassembled PDU]"
"94","0.481278","13.84.36.2","100.86.7.137","TCP","1514","443  >  57514 [ACK] Seq=140559 Ack=8766 Win=16385 Len=1460 [TCP segment of a reassembled PDU]"
"95","0.481278","13.84.36.2","100.86.7.137","TLSv1.2","1514","Application Data"
"96","0.481278","13.84.36.2","100.86.7.137","TCP","1514","443  >  57514 [ACK] Seq=143479 Ack=8766 Win=16385 Len=1460 [TCP segment of a reassembled PDU]"
"97","0.481278","13.84.36.2","100.86.7.137","TCP","1514","443  >  57514 [ACK] Seq=144939 Ack=8766 Win=16385 Len=1460 [TCP segment of a reassembled PDU]"
"98","0.481278","13.84.36.2","100.86.7.137","TLSv1.2","2974","Application Data"
"99","0.481278","13.84.36.2","100.86.7.137","TCP","1514","443  >  57514 [ACK] Seq=149319 Ack=8766 Win=16385 Len=1460 [TCP segment of a reassembled PDU]"
"100","0.481278","13.84.36.2","100.86.7.137","TLSv1.2","204","Application Data"
"101","0.481278","13.84.36.2","100.86.7.137","TCP","1514","443  >  57514 [ACK] Seq=150929 Ack=8766 Win=16385 Len=1460 [TCP segment of a reassembled PDU]"
"102","0.481278","13.84.36.2","100.86.7.137","TCP","1514","443  >  57514 [ACK] Seq=152389 Ack=8766 Win=16385 Len=1460 [TCP segment of a reassembled PDU]"
"103","0.481278","13.84.36.2","100.86.7.137","TLSv1.2","1514","Application Data"
"104","0.481278","13.84.36.2","100.86.7.137","TCP","1514","443  >  57514 [ACK] Seq=155309 Ack=8766 Win=16385 Len=1460 [TCP segment of a reassembled PDU]"
"105","0.481278","13.84.36.2","100.86.7.137","TCP","1514","443  >  57514 [ACK] Seq=156769 Ack=8766 Win=16385 Len=1460 [TCP segment of a reassembled PDU]"
"106","0.481278","13.84.36.2","100.86.7.137","TLSv1.2","1514","Application Data"
"107","0.481278","13.84.36.2","100.86.7.137","TCP","1514","443  >  57514 [ACK] Seq=159689 Ack=8766 Win=16385 Len=1460 [TCP segment of a reassembled PDU]"
"108","0.481278","13.84.36.2","100.86.7.137","TCP","1514","443  >  57514 [ACK] Seq=161149 Ack=8766 Win=16385 Len=1460 [TCP segment of a reassembled PDU]"
"109","0.481563","100.86.7.137","13.84.36.2","TCP","66","57514  >  443 [ACK] Seq=11240 Ack=116317 Win=4140 Len=0 SLE=117777 SRE=117927"
"110","0.481615","100.86.7.137","13.84.36.2","TCP","66","[TCP Dup ACK 109#1] 57514  >  443 [ACK] Seq=11240 Ack=116317 Win=4140 Len=0 SLE=117777 SRE=119387"
"111","0.481651","100.86.7.137","13.84.36.2","TCP","66","[TCP Dup ACK 109#2] 57514  >  443 [ACK] Seq=11240 Ack=116317 Win=4140 Len=0 SLE=117777 SRE=120847"
"112","0.481673","100.86.7.137","13.84.36.2","TCP","66","[TCP Dup ACK 109#3] 57514  >  443 [ACK] Seq=11240 Ack=116317 Win=4140 Len=0 SLE=117777 SRE=123767"
"113","0.481690","100.86.7.137","13.84.36.2","TCP","66","[TCP Dup ACK 109#4] 57514  >  443 [ACK] Seq=11240 Ack=116317 Win=4140 Len=0 SLE=117777 SRE=125227"
"114","0.481711","100.86.7.137","13.84.36.2","TCP","66","[TCP Dup ACK 109#5] 57514  >  443 [ACK] Seq=11240 Ack=116317 Win=4140 Len=0 SLE=117777 SRE=126687"
"115","0.481726","100.86.7.137","13.84.36.2","TCP","66","[TCP Dup ACK 109#6] 57514  >  443 [ACK] Seq=11240 Ack=116317 Win=4140 Len=0 SLE=117777 SRE=128147"
"116","0.481740","100.86.7.137","13.84.36.2","TCP","66","[TCP Dup ACK 109#7] 57514  >  443 [ACK] Seq=11240 Ack=116317 Win=4140 Len=0 SLE=117777 SRE=129607"
"117","0.481764","100.86.7.137","13.84.36.2","TCP","66","[TCP Dup ACK 109#8] 57514  >  443 [ACK] Seq=11240 Ack=116317 Win=4140 Len=0 SLE=117777 SRE=130339"
"118","0.481782","100.86.7.137","13.84.36.2","TCP","66","[TCP Dup ACK 109#9] 57514  >  443 [ACK] Seq=11240 Ack=116317 Win=4140 Len=0 SLE=117777 SRE=131799"
"119","0.481807","100.86.7.137","13.84.36.2","TCP","66","[TCP Dup ACK 109#10] 57514  >  443 [ACK] Seq=11240 Ack=116317 Win=4140 Len=0 SLE=117777 SRE=133259"
"120","0.481849","100.86.7.137","13.84.36.2","TCP","66","[TCP Dup ACK 109#11] 57514  >  443 [ACK] Seq=11240 Ack=116317 Win=4140 Len=0 SLE=117777 SRE=134719"
"121","0.481869","100.86.7.137","13.84.36.2","TCP","66","[TCP Dup ACK 109#12] 57514  >  443 [ACK] Seq=11240 Ack=116317 Win=4140 Len=0 SLE=117777 SRE=136179"
"122","0.481884","100.86.7.137","13.84.36.2","TCP","66","[TCP Dup ACK 109#13] 57514  >  443 [ACK] Seq=11240 Ack=116317 Win=4140 Len=0 SLE=117777 SRE=137639"
"123","0.481902","100.86.7.137","13.84.36.2","TCP","66","[TCP Dup ACK 109#14] 57514  >  443 [ACK] Seq=11240 Ack=116317 Win=4140 Len=0 SLE=117777 SRE=139099"
"124","0.481947","100.86.7.137","13.84.36.2","TCP","66","[TCP Dup ACK 109#15] 57514  >  443 [ACK] Seq=11240 Ack=116317 Win=4140 Len=0 SLE=117777 SRE=140559"
"125","0.481965","100.86.7.137","13.84.36.2","TCP","66","[TCP Dup ACK 109#16] 57514  >  443 [ACK] Seq=11240 Ack=116317 Win=4140 Len=0 SLE=117777 SRE=142019"
"126","0.481981","100.86.7.137","13.84.36.2","TCP","66","[TCP Dup ACK 109#17] 57514  >  443 [ACK] Seq=11240 Ack=116317 Win=4140 Len=0 SLE=117777 SRE=143479"
"127","0.481999","100.86.7.137","13.84.36.2","TCP","66","[TCP Dup ACK 109#18] 57514  >  443 [ACK] Seq=11240 Ack=116317 Win=4140 Len=0 SLE=117777 SRE=144939"
"128","0.482015","100.86.7.137","13.84.36.2","TCP","66","[TCP Dup ACK 109#19] 57514  >  443 [ACK] Seq=11240 Ack=116317 Win=4140 Len=0 SLE=117777 SRE=146399"
"129","0.482035","100.86.7.137","13.84.36.2","TCP","66","[TCP Dup ACK 109#20] 57514  >  443 [ACK] Seq=11240 Ack=116317 Win=4140 Len=0 SLE=117777 SRE=149319"
"130","0.482051","100.86.7.137","13.84.36.2","TCP","66","[TCP Dup ACK 109#21] 57514  >  443 [ACK] Seq=11240 Ack=116317 Win=4140 Len=0 SLE=117777 SRE=150779"
"131","0.482065","100.86.7.137","13.84.36.2","TCP","66","[TCP Dup ACK 109#22] 57514  >  443 [ACK] Seq=11240 Ack=116317 Win=4140 Len=0 SLE=117777 SRE=150929"
"132","0.482083","100.86.7.137","13.84.36.2","TCP","66","[TCP Dup ACK 109#23] 57514  >  443 [ACK] Seq=11240 Ack=116317 Win=4140 Len=0 SLE=117777 SRE=152389"
"133","0.482100","100.86.7.137","13.84.36.2","TCP","66","[TCP Dup ACK 109#24] 57514  >  443 [ACK] Seq=11240 Ack=116317 Win=4140 Len=0 SLE=117777 SRE=153849"
"134","0.482118","100.86.7.137","13.84.36.2","TCP","66","[TCP Dup ACK 109#25] 57514  >  443 [ACK] Seq=11240 Ack=116317 Win=4140 Len=0 SLE=117777 SRE=155309"
"135","0.482137","100.86.7.137","13.84.36.2","TCP","66","[TCP Dup ACK 109#26] 57514  >  443 [ACK] Seq=11240 Ack=116317 Win=4140 Len=0 SLE=117777 SRE=156769"
"136","0.482158","100.86.7.137","13.84.36.2","TCP","66","[TCP Dup ACK 109#27] 57514  >  443 [ACK] Seq=11240 Ack=116317 Win=4140 Len=0 SLE=117777 SRE=158229"
"137","0.482174","100.86.7.137","13.84.36.2","TCP","66","[TCP Dup ACK 109#28] 57514  >  443 [ACK] Seq=11240 Ack=116317 Win=4140 Len=0 SLE=117777 SRE=159689"
"138","0.482199","100.86.7.137","13.84.36.2","TCP","66","[TCP Dup ACK 109#29] 57514  >  443 [ACK] Seq=11240 Ack=116317 Win=4140 Len=0 SLE=117777 SRE=161149"
"139","0.482232","100.86.7.137","13.84.36.2","TCP","66","[TCP Dup ACK 109#30] 57514  >  443 [ACK] Seq=11240 Ack=116317 Win=4140 Len=0 SLE=117777 SRE=162609"
"140","0.482486","13.84.36.2","100.86.7.137","TLSv1.2","1514","Application Data"
"141","0.482486","13.84.36.2","100.86.7.137","TCP","1514","443  >  57514 [ACK] Seq=164069 Ack=8766 Win=16385 Len=1460 [TCP segment of a reassembled PDU]"
"142","0.482486","13.84.36.2","100.86.7.137","TCP","1514","443  >  57514 [ACK] Seq=165529 Ack=8766 Win=16385 Len=1460 [TCP segment of a reassembled PDU]"
"143","0.482486","13.84.36.2","100.86.7.137","TLSv1.2","1514","Application Data"
"144","0.482486","13.84.36.2","100.86.7.137","TCP","1514","443  >  57514 [ACK] Seq=168449 Ack=8766 Win=16385 Len=1460 [TCP segment of a reassembled PDU]"
"145","0.482486","13.84.36.2","100.86.7.137","TCP","1514","443  >  57514 [ACK] Seq=169909 Ack=8766 Win=16385 Len=1460 [TCP segment of a reassembled PDU]"
"146","0.482486","13.84.36.2","100.86.7.137","TLSv1.2","1514","Application Data"
"147","0.482486","13.84.36.2","100.86.7.137","TCP","1514","443  >  57514 [ACK] Seq=172829 Ack=8766 Win=16385 Len=1460 [TCP segment of a reassembled PDU]"
"148","0.482486","13.84.36.2","100.86.7.137","TLSv1.2","1402","Application Data"
"149","0.482486","13.84.36.2","100.86.7.137","TCP","1514","443  >  57514 [ACK] Seq=175637 Ack=8766 Win=16385 Len=1460 [TCP segment of a reassembled PDU]"
"150","0.482486","13.84.36.2","100.86.7.137","TCP","1514","443  >  57514 [ACK] Seq=177097 Ack=8766 Win=16385 Len=1460 [TCP segment of a reassembled PDU]"
"151","0.482486","13.84.36.2","100.86.7.137","TLSv1.2","1514","Application Data"
"152","0.482486","13.84.36.2","100.86.7.137","TCP","1514","443  >  57514 [ACK] Seq=180017 Ack=8766 Win=16385 Len=1460 [TCP segment of a reassembled PDU]"
"153","0.482486","13.84.36.2","100.86.7.137","TCP","1514","443  >  57514 [ACK] Seq=181477 Ack=8766 Win=16385 Len=1460 [TCP segment of a reassembled PDU]"
"154","0.482486","13.84.36.2","100.86.7.137","TLSv1.2","1514","Application Data"
"155","0.482486","13.84.36.2","100.86.7.137","TCP","1514","443  >  57514 [ACK] Seq=184397 Ack=8766 Win=16385 Len=1460 [TCP segment of a reassembled PDU]"
"156","0.482486","13.84.36.2","100.86.7.137","TCP","1514","443  >  57514 [ACK] Seq=185857 Ack=8766 Win=16385 Len=1460 [TCP segment of a reassembled PDU]"
"157","0.482486","13.84.36.2","100.86.7.137","TLSv1.2","1514","Application Data"
"158","0.482486","13.84.36.2","100.86.7.137","TCP","1514","443  >  57514 [ACK] Seq=188777 Ack=8766 Win=16385 Len=1460 [TCP segment of a reassembled PDU]"
"159","0.482486","13.84.36.2","100.86.7.137","TLSv1.2","610","Application Data"
"160","0.482486","13.84.36.2","100.86.7.137","TCP","1514","443  >  57514 [ACK] Seq=190793 Ack=8766 Win=16385 Len=1460 [TCP segment of a reassembled PDU]"
"161","0.482486","13.84.36.2","100.86.7.137","TLSv1.2","1036","Application Data"
"162","0.482662","100.86.7.137","13.84.36.2","TCP","66","[TCP Dup ACK 109#31] 57514  >  443 [ACK] Seq=11240 Ack=116317 Win=4140 Len=0 SLE=117777 SRE=164069"
"163","0.482709","100.86.7.137","13.84.36.2","TCP","66","[TCP Dup ACK 109#32] 57514  >  443 [ACK] Seq=11240 Ack=116317 Win=4140 Len=0 SLE=117777 SRE=165529"
"164","0.482727","100.86.7.137","13.84.36.2","TCP","66","[TCP Dup ACK 109#33] 57514  >  443 [ACK] Seq=11240 Ack=116317 Win=4140 Len=0 SLE=117777 SRE=166989"
"165","0.482743","100.86.7.137","13.84.36.2","TCP","66","[TCP Dup ACK 109#34] 57514  >  443 [ACK] Seq=11240 Ack=116317 Win=4140 Len=0 SLE=117777 SRE=168449"
"166","0.482766","100.86.7.137","13.84.36.2","TCP","66","[TCP Dup ACK 109#35] 57514  >  443 [ACK] Seq=11240 Ack=116317 Win=4140 Len=0 SLE=117777 SRE=169909"
"167","0.482780","100.86.7.137","13.84.36.2","TCP","66","[TCP Dup ACK 109#36] 57514  >  443 [ACK] Seq=11240 Ack=116317 Win=4140 Len=0 SLE=117777 SRE=171369"
"168","0.482797","100.86.7.137","13.84.36.2","TCP","66","[TCP Dup ACK 109#37] 57514  >  443 [ACK] Seq=11240 Ack=116317 Win=4140 Len=0 SLE=117777 SRE=172829"
"169","0.482819","100.86.7.137","13.84.36.2","TCP","66","[TCP Dup ACK 109#38] 57514  >  443 [ACK] Seq=11240 Ack=116317 Win=4140 Len=0 SLE=117777 SRE=174289"
"170","0.482835","100.86.7.137","13.84.36.2","TCP","66","[TCP Dup ACK 109#39] 57514  >  443 [ACK] Seq=11240 Ack=116317 Win=4140 Len=0 SLE=117777 SRE=175637"
"171","0.482854","100.86.7.137","13.84.36.2","TCP","66","[TCP Dup ACK 109#40] 57514  >  443 [ACK] Seq=11240 Ack=116317 Win=4140 Len=0 SLE=117777 SRE=177097"
"172","0.482873","100.86.7.137","13.84.36.2","TCP","66","[TCP Dup ACK 109#41] 57514  >  443 [ACK] Seq=11240 Ack=116317 Win=4140 Len=0 SLE=117777 SRE=178557"
"173","0.482890","100.86.7.137","13.84.36.2","TCP","66","[TCP Dup ACK 109#42] 57514  >  443 [ACK] Seq=11240 Ack=116317 Win=4140 Len=0 SLE=117777 SRE=180017"
"174","0.482913","100.86.7.137","13.84.36.2","TCP","66","[TCP Dup ACK 109#43] 57514  >  443 [ACK] Seq=11240 Ack=116317 Win=4140 Len=0 SLE=117777 SRE=181477"
"175","0.482932","100.86.7.137","13.84.36.2","TCP","66","[TCP Dup ACK 109#44] 57514  >  443 [ACK] Seq=11240 Ack=116317 Win=4140 Len=0 SLE=117777 SRE=182937"
"176","0.482951","100.86.7.137","13.84.36.2","TCP","66","[TCP Dup ACK 109#45] 57514  >  443 [ACK] Seq=11240 Ack=116317 Win=4140 Len=0 SLE=117777 SRE=184397"
"177","0.482976","100.86.7.137","13.84.36.2","TCP","66","[TCP Dup ACK 109#46] 57514  >  443 [ACK] Seq=11240 Ack=116317 Win=4140 Len=0 SLE=117777 SRE=185857"
"178","0.482992","100.86.7.137","13.84.36.2","TCP","66","[TCP Dup ACK 109#47] 57514  >  443 [ACK] Seq=11240 Ack=116317 Win=4140 Len=0 SLE=117777 SRE=187317"
"179","0.483008","100.86.7.137","13.84.36.2","TCP","66","[TCP Dup ACK 109#48] 57514  >  443 [ACK] Seq=11240 Ack=116317 Win=4140 Len=0 SLE=117777 SRE=188777"
"180","0.483029","100.86.7.137","13.84.36.2","TCP","66","[TCP Dup ACK 109#49] 57514  >  443 [ACK] Seq=11240 Ack=116317 Win=4140 Len=0 SLE=117777 SRE=190237"
"181","0.483045","100.86.7.137","13.84.36.2","TCP","66","[TCP Dup ACK 109#50] 57514  >  443 [ACK] Seq=11240 Ack=116317 Win=4140 Len=0 SLE=117777 SRE=190793"
"182","0.483070","100.86.7.137","13.84.36.2","TCP","66","[TCP Dup ACK 109#51] 57514  >  443 [ACK] Seq=11240 Ack=116317 Win=4140 Len=0 SLE=117777 SRE=192253"
"183","0.483105","100.86.7.137","13.84.36.2","TCP","66","[TCP Dup ACK 109#52] 57514  >  443 [ACK] Seq=11240 Ack=116317 Win=4140 Len=0 SLE=117777 SRE=193235"
"184","0.483400","13.84.36.2","100.86.7.137","TCP","2974","443  >  57514 [ACK] Seq=193235 Ack=9432 Win=16382 Len=2920 [TCP segment of a reassembled PDU]"
"185","0.483400","13.84.36.2","100.86.7.137","TLSv1.2","450","Application Data, Application Data"
"186","0.483400","13.84.36.2","100.86.7.137","TLSv1.2","16114","Application Data, Application Data, Application Data"
"187","0.483477","100.86.7.137","13.84.36.2","TCP","66","[TCP Dup ACK 109#53] 57514  >  443 [ACK] Seq=11240 Ack=116317 Win=4140 Len=0 SLE=117777 SRE=196155"
"188","0.483513","100.86.7.137","13.84.36.2","TCP","66","[TCP Dup ACK 109#54] 57514  >  443 [ACK] Seq=11240 Ack=116317 Win=4140 Len=0 SLE=117777 SRE=196551"
"189","0.483532","100.86.7.137","13.84.36.2","TCP","66","[TCP Dup ACK 109#55] 57514  >  443 [ACK] Seq=11240 Ack=116317 Win=4140 Len=0 SLE=117777 SRE=212611"
"190","0.503263","13.84.36.2","100.86.7.137","TLSv1.2","1514","Application Data"
"191","0.503263","13.84.36.2","100.86.7.137","TCP","1514","443  >  57514 [ACK] Seq=214071 Ack=9432 Win=16382 Len=1460 [TCP segment of a reassembled PDU]"
"192","0.503263","13.84.36.2","100.86.7.137","TCP","1514","443  >  57514 [ACK] Seq=215531 Ack=9432 Win=16382 Len=1460 [TCP segment of a reassembled PDU]"
"193","0.503263","13.84.36.2","100.86.7.137","TLSv1.2","204","Application Data"
"194","0.503263","13.84.36.2","100.86.7.137","TCP","2974","443  >  57514 [ACK] Seq=217141 Ack=9432 Win=16382 Len=2920 [TCP segment of a reassembled PDU]"
"195","0.503263","13.84.36.2","100.86.7.137","TLSv1.2","1514","Application Data"
"196","0.503263","13.84.36.2","100.86.7.137","TCP","1514","443  >  57514 [ACK] Seq=221521 Ack=9432 Win=16382 Len=1460 [TCP segment of a reassembled PDU]"
"197","0.503263","13.84.36.2","100.86.7.137","TCP","1514","443  >  57514 [ACK] Seq=222981 Ack=9432 Win=16382 Len=1460 [TCP segment of a reassembled PDU]"
"198","0.503263","13.84.36.2","100.86.7.137","TLSv1.2","1514","Application Data"
"199","0.503263","13.84.36.2","100.86.7.137","TCP","1514","443  >  57514 [ACK] Seq=225901 Ack=9432 Win=16382 Len=1460 [TCP segment of a reassembled PDU]"
"200","0.503263","13.84.36.2","100.86.7.137","TCP","1514","443  >  57514 [ACK] Seq=227361 Ack=9432 Win=16382 Len=1460 [TCP segment of a reassembled PDU]"
"201","0.503263","13.84.36.2","100.86.7.137","TLSv1.2","1514","Application Data"
"202","0.503263","13.84.36.2","100.86.7.137","TCP","1514","443  >  57514 [ACK] Seq=230281 Ack=9432 Win=16382 Len=1460 [TCP segment of a reassembled PDU]"
"203","0.503263","13.84.36.2","100.86.7.137","TCP","1514","443  >  57514 [ACK] Seq=231741 Ack=9432 Win=16382 Len=1460 [TCP segment of a reassembled PDU]"
"204","0.503263","13.84.36.2","100.86.7.137","TLSv1.2","1514","Application Data"
"205","0.503263","13.84.36.2","100.86.7.137","TCP","1514","443  >  57514 [ACK] Seq=234661 Ack=9432 Win=16382 Len=1460 [TCP segment of a reassembled PDU]"
"206","0.503263","13.84.36.2","100.86.7.137","TCP","1514","443  >  57514 [ACK] Seq=236121 Ack=9432 Win=16382 Len=1460 [TCP segment of a reassembled PDU]"
"207","0.503263","13.84.36.2","100.86.7.137","TLSv1.2","1514","Application Data"
"208","0.503263","13.84.36.2","100.86.7.137","TCP","1514","443  >  57514 [ACK] Seq=239041 Ack=9432 Win=16382 Len=1460 [TCP segment of a reassembled PDU]"
"209","0.503263","13.84.36.2","100.86.7.137","TLSv1.2","1514","Application Data"
"210","0.503263","13.84.36.2","100.86.7.137","TCP","1514","443  >  57514 [ACK] Seq=241961 Ack=9432 Win=16382 Len=1460 [TCP segment of a reassembled PDU]"
"211","0.503263","13.84.36.2","100.86.7.137","TCP","1514","443  >  57514 [ACK] Seq=243421 Ack=9432 Win=16382 Len=1460 [TCP segment of a reassembled PDU]"
"212","0.503263","13.84.36.2","100.86.7.137","TLSv1.2","1514","Application Data"
"213","0.503263","13.84.36.2","100.86.7.137","TCP","1514","443  >  57514 [ACK] Seq=246341 Ack=9432 Win=16382 Len=1460 [TCP segment of a reassembled PDU]"
"214","0.503263","13.84.36.2","100.86.7.137","TCP","1514","443  >  57514 [ACK] Seq=247801 Ack=9432 Win=16382 Len=1460 [TCP segment of a reassembled PDU]"
"215","0.503263","13.84.36.2","100.86.7.137","TLSv1.2","878","Application Data"
"216","0.503263","13.84.36.2","100.86.7.137","TCP","1514","443  >  57514 [ACK] Seq=250085 Ack=9432 Win=16382 Len=1460 [TCP segment of a reassembled PDU]"
"217","0.503263","13.84.36.2","100.86.7.137","TCP","1514","443  >  57514 [ACK] Seq=251545 Ack=9432 Win=16382 Len=1460 [TCP segment of a reassembled PDU]"
"218","0.503263","13.84.36.2","100.86.7.137","TLSv1.2","1514","Application Data"
"219","0.503263","13.84.36.2","100.86.7.137","TCP","1514","443  >  57514 [ACK] Seq=254465 Ack=9432 Win=16382 Len=1460 [TCP segment of a reassembled PDU]"
"220","0.503263","13.84.36.2","100.86.7.137","TCP","1514","443  >  57514 [ACK] Seq=255925 Ack=9432 Win=16382 Len=1460 [TCP segment of a reassembled PDU]"
"221","0.503263","13.84.36.2","100.86.7.137","TLSv1.2","1514","Application Data"
"222","0.503421","100.86.7.137","13.84.36.2","TCP","66","[TCP Dup ACK 109#56] 57514  >  443 [ACK] Seq=11240 Ack=116317 Win=4140 Len=0 SLE=117777 SRE=214071"
"223","0.503460","100.86.7.137","13.84.36.2","TCP","66","[TCP Dup ACK 109#57] 57514  >  443 [ACK] Seq=11240 Ack=116317 Win=4140 Len=0 SLE=117777 SRE=215531"
"224","0.503472","100.86.7.137","13.84.36.2","TCP","66","[TCP Dup ACK 109#58] 57514  >  443 [ACK] Seq=11240 Ack=116317 Win=4140 Len=0 SLE=117777 SRE=216991"
"225","0.503484","100.86.7.137","13.84.36.2","TCP","66","[TCP Dup ACK 109#59] 57514  >  443 [ACK] Seq=11240 Ack=116317 Win=4140 Len=0 SLE=117777 SRE=217141"
"226","0.503495","100.86.7.137","13.84.36.2","TCP","66","[TCP Dup ACK 109#60] 57514  >  443 [ACK] Seq=11240 Ack=116317 Win=4140 Len=0 SLE=117777 SRE=220061"
"227","0.503507","100.86.7.137","13.84.36.2","TCP","66","[TCP Dup ACK 109#61] 57514  >  443 [ACK] Seq=11240 Ack=116317 Win=4140 Len=0 SLE=117777 SRE=221521"
"228","0.503516","100.86.7.137","13.84.36.2","TCP","66","[TCP Dup ACK 109#62] 57514  >  443 [ACK] Seq=11240 Ack=116317 Win=4140 Len=0 SLE=117777 SRE=222981"
"229","0.503529","100.86.7.137","13.84.36.2","TCP","66","[TCP Dup ACK 109#63] 57514  >  443 [ACK] Seq=11240 Ack=116317 Win=4140 Len=0 SLE=117777 SRE=224441"
"230","0.503539","100.86.7.137","13.84.36.2","TCP","66","[TCP Dup ACK 109#64] 57514  >  443 [ACK] Seq=11240 Ack=116317 Win=4140 Len=0 SLE=117777 SRE=225901"
"231","0.503550","100.86.7.137","13.84.36.2","TCP","66","[TCP Dup ACK 109#65] 57514  >  443 [ACK] Seq=11240 Ack=116317 Win=4140 Len=0 SLE=117777 SRE=227361"
"232","0.503561","100.86.7.137","13.84.36.2","TCP","66","[TCP Dup ACK 109#66] 57514  >  443 [ACK] Seq=11240 Ack=116317 Win=4140 Len=0 SLE=117777 SRE=228821"
"233","0.503574","100.86.7.137","13.84.36.2","TCP","66","[TCP Dup ACK 109#67] 57514  >  443 [ACK] Seq=11240 Ack=116317 Win=4140 Len=0 SLE=117777 SRE=230281"
"234","0.503582","100.86.7.137","13.84.36.2","TCP","66","[TCP Dup ACK 109#68] 57514  >  443 [ACK] Seq=11240 Ack=116317 Win=4140 Len=0 SLE=117777 SRE=231741"
"235","0.503594","100.86.7.137","13.84.36.2","TCP","66","[TCP Dup ACK 109#69] 57514  >  443 [ACK] Seq=11240 Ack=116317 Win=4140 Len=0 SLE=117777 SRE=233201"
"236","0.503603","100.86.7.137","13.84.36.2","TCP","66","[TCP Dup ACK 109#70] 57514  >  443 [ACK] Seq=11240 Ack=116317 Win=4140 Len=0 SLE=117777 SRE=234661"
"237","0.503612","100.86.7.137","13.84.36.2","TCP","66","[TCP Dup ACK 109#71] 57514  >  443 [ACK] Seq=11240 Ack=116317 Win=4140 Len=0 SLE=117777 SRE=236121"
"238","0.503623","100.86.7.137","13.84.36.2","TCP","66","[TCP Dup ACK 109#72] 57514  >  443 [ACK] Seq=11240 Ack=116317 Win=4140 Len=0 SLE=117777 SRE=237581"
"239","0.503632","100.86.7.137","13.84.36.2","TCP","66","[TCP Dup ACK 109#73] 57514  >  443 [ACK] Seq=11240 Ack=116317 Win=4140 Len=0 SLE=117777 SRE=239041"
"240","0.503641","100.86.7.137","13.84.36.2","TCP","66","[TCP Dup ACK 109#74] 57514  >  443 [ACK] Seq=11240 Ack=116317 Win=4140 Len=0 SLE=117777 SRE=240501"
"241","0.503652","100.86.7.137","13.84.36.2","TCP","66","[TCP Dup ACK 109#75] 57514  >  443 [ACK] Seq=11240 Ack=116317 Win=4140 Len=0 SLE=117777 SRE=241961"
"242","0.503661","100.86.7.137","13.84.36.2","TCP","66","[TCP Dup ACK 109#76] 57514  >  443 [ACK] Seq=11240 Ack=116317 Win=4140 Len=0 SLE=117777 SRE=243421"
"243","0.503671","100.86.7.137","13.84.36.2","TCP","66","[TCP Dup ACK 109#77] 57514  >  443 [ACK] Seq=11240 Ack=116317 Win=4140 Len=0 SLE=117777 SRE=244881"
"244","0.503689","100.86.7.137","13.84.36.2","TCP","66","[TCP Dup ACK 109#78] 57514  >  443 [ACK] Seq=11240 Ack=116317 Win=4140 Len=0 SLE=117777 SRE=246341"
"245","0.503698","100.86.7.137","13.84.36.2","TCP","66","[TCP Dup ACK 109#79] 57514  >  443 [ACK] Seq=11240 Ack=116317 Win=4140 Len=0 SLE=117777 SRE=247801"
"246","0.503706","100.86.7.137","13.84.36.2","TCP","66","[TCP Dup ACK 109#80] 57514  >  443 [ACK] Seq=11240 Ack=116317 Win=4140 Len=0 SLE=117777 SRE=249261"
"247","0.503719","100.86.7.137","13.84.36.2","TCP","66","[TCP Dup ACK 109#81] 57514  >  443 [ACK] Seq=11240 Ack=116317 Win=4140 Len=0 SLE=117777 SRE=250085"
"248","0.503729","100.86.7.137","13.84.36.2","TCP","66","[TCP Dup ACK 109#82] 57514  >  443 [ACK] Seq=11240 Ack=116317 Win=4140 Len=0 SLE=117777 SRE=251545"
"249","0.503738","100.86.7.137","13.84.36.2","TCP","66","[TCP Dup ACK 109#83] 57514  >  443 [ACK] Seq=11240 Ack=116317 Win=4140 Len=0 SLE=117777 SRE=253005"
"250","0.503751","100.86.7.137","13.84.36.2","TCP","66","[TCP Dup ACK 109#84] 57514  >  443 [ACK] Seq=11240 Ack=116317 Win=4140 Len=0 SLE=117777 SRE=254465"
"251","0.503760","100.86.7.137","13.84.36.2","TCP","66","[TCP Dup ACK 109#85] 57514  >  443 [ACK] Seq=11240 Ack=116317 Win=4140 Len=0 SLE=117777 SRE=255925"
"252","0.503768","100.86.7.137","13.84.36.2","TCP","66","[TCP Dup ACK 109#86] 57514  >  443 [ACK] Seq=11240 Ack=116317 Win=4140 Len=0 SLE=117777 SRE=257385"
"253","0.503779","100.86.7.137","13.84.36.2","TCP","66","[TCP Dup ACK 109#87] 57514  >  443 [ACK] Seq=11240 Ack=116317 Win=4140 Len=0 SLE=117777 SRE=258845"
"254","0.503873","13.84.36.2","100.86.7.137","TCP","1514","443  >  57514 [ACK] Seq=258845 Ack=9432 Win=16382 Len=1460 [TCP segment of a reassembled PDU]"
"255","0.503873","13.84.36.2","100.86.7.137","TLSv1.2","516","Application Data"
"256","0.503873","13.84.36.2","100.86.7.137","TLSv1.2","85","Application Data"
"257","0.503873","13.84.36.2","100.86.7.137","TCP","1514","443  >  57514 [ACK] Seq=260798 Ack=9432 Win=16382 Len=1460 [TCP segment of a reassembled PDU]"
"258","0.503873","13.84.36.2","100.86.7.137","TLSv1.2","469","Application Data"
"259","0.503873","13.84.36.2","100.86.7.137","TCP","1514","443  >  57514 [ACK] Seq=262673 Ack=9432 Win=16382 Len=1460 [TCP segment of a reassembled PDU]"
"260","0.503873","13.84.36.2","100.86.7.137","TCP","1514","443  >  57514 [ACK] Seq=264133 Ack=9432 Win=16382 Len=1460 [TCP segment of a reassembled PDU]"
"261","0.503873","13.84.36.2","100.86.7.137","TLSv1.2","1514","Application Data"
"262","0.503873","13.84.36.2","100.86.7.137","TCP","1514","443  >  57514 [ACK] Seq=267053 Ack=9432 Win=16382 Len=1460 [TCP segment of a reassembled PDU]"
"263","0.503873","13.84.36.2","100.86.7.137","TCP","1514","443  >  57514 [ACK] Seq=268513 Ack=9432 Win=16382 Len=1460 [TCP segment of a reassembled PDU]"
"264","0.503873","13.84.36.2","100.86.7.137","TLSv1.2","1514","Application Data"
"265","0.503873","13.84.36.2","100.86.7.137","TCP","1514","443  >  57514 [ACK] Seq=271433 Ack=9432 Win=16382 Len=1460 [TCP segment of a reassembled PDU]"
"266","0.503873","13.84.36.2","100.86.7.137","TCP","1514","443  >  57514 [ACK] Seq=272893 Ack=9432 Win=16382 Len=1460 [TCP segment of a reassembled PDU]"
"267","0.503873","13.84.36.2","100.86.7.137","TLSv1.2","1514","Application Data"
"268","0.503873","13.84.36.2","100.86.7.137","TCP","1514","443  >  57514 [ACK] Seq=275813 Ack=9432 Win=16382 Len=1460 [TCP segment of a reassembled PDU]"
"269","0.503873","13.84.36.2","100.86.7.137","TCP","1514","443  >  57514 [ACK] Seq=277273 Ack=9432 Win=16382 Len=1460 [TCP segment of a reassembled PDU]"
"270","0.503873","13.84.36.2","100.86.7.137","TLSv1.2","1514","Application Data"
"271","0.503873","13.84.36.2","100.86.7.137","TCP","1514","443  >  57514 [ACK] Seq=280193 Ack=9432 Win=16382 Len=1460 [TCP segment of a reassembled PDU]"
"272","0.503873","13.84.36.2","100.86.7.137","TCP","1514","443  >  57514 [ACK] Seq=281653 Ack=9432 Win=16382 Len=1460 [TCP segment of a reassembled PDU]"
"273","0.503873","13.84.36.2","100.86.7.137","TLSv1.2","204","Application Data"
"274","0.503873","13.84.36.2","100.86.7.137","TCP","1514","443  >  57514 [ACK] Seq=283263 Ack=9432 Win=16382 Len=1460 [TCP segment of a reassembled PDU]"
"275","0.503873","13.84.36.2","100.86.7.137","TCP","1514","443  >  57514 [ACK] Seq=284723 Ack=9432 Win=16382 Len=1460 [TCP segment of a reassembled PDU]"
"276","0.503873","13.84.36.2","100.86.7.137","TLSv1.2","1514","Application Data"
"277","0.503873","13.84.36.2","100.86.7.137","TCP","1514","443  >  57514 [ACK] Seq=287643 Ack=9432 Win=16382 Len=1460 [TCP segment of a reassembled PDU]"
"278","0.503873","13.84.36.2","100.86.7.137","TCP","1514","443  >  57514 [ACK] Seq=289103 Ack=9432 Win=16382 Len=1460 [TCP segment of a reassembled PDU]"
"279","0.503873","13.84.36.2","100.86.7.137","TLSv1.2","1514","Application Data"
"280","0.503873","13.84.36.2","100.86.7.137","TCP","1514","443  >  57514 [ACK] Seq=292023 Ack=9432 Win=16382 Len=1460 [TCP segment of a reassembled PDU]"
"281","0.503873","13.84.36.2","100.86.7.137","TCP","1514","443  >  57514 [ACK] Seq=293483 Ack=9432 Win=16382 Len=1460 [TCP segment of a reassembled PDU]"
"282","0.503873","13.84.36.2","100.86.7.137","TLSv1.2","1514","Application Data"
"283","0.503873","13.84.36.2","100.86.7.137","TCP","1514","443  >  57514 [ACK] Seq=296403 Ack=9432 Win=16382 Len=1460 [TCP segment of a reassembled PDU]"
"284","0.503873","13.84.36.2","100.86.7.137","TCP","1514","443  >  57514 [ACK] Seq=297863 Ack=9432 Win=16382 Len=1460 [TCP segment of a reassembled PDU]"
"285","0.503873","13.84.36.2","100.86.7.137","TLSv1.2","466","Application Data"
"286","0.503995","100.86.7.137","13.84.36.2","TCP","66","[TCP Dup ACK 109#88] 57514  >  443 [ACK] Seq=11240 Ack=116317 Win=4140 Len=0 SLE=117777 SRE=260305"
"287","0.504024","100.86.7.137","13.84.36.2","TCP","66","[TCP Dup ACK 109#89] 57514  >  443 [ACK] Seq=11240 Ack=116317 Win=4140 Len=0 SLE=117777 SRE=260767"
"288","0.504035","100.86.7.137","13.84.36.2","TCP","66","[TCP Dup ACK 109#90] 57514  >  443 [ACK] Seq=11240 Ack=116317 Win=4140 Len=0 SLE=117777 SRE=260798"
"289","0.504045","100.86.7.137","13.84.36.2","TCP","66","[TCP Dup ACK 109#91] 57514  >  443 [ACK] Seq=11240 Ack=116317 Win=4140 Len=0 SLE=117777 SRE=262258"
"290","0.504053","100.86.7.137","13.84.36.2","TCP","66","[TCP Dup ACK 109#92] 57514  >  443 [ACK] Seq=11240 Ack=116317 Win=4140 Len=0 SLE=117777 SRE=262673"
"291","0.504066","100.86.7.137","13.84.36.2","TCP","66","[TCP Dup ACK 109#93] 57514  >  443 [ACK] Seq=11240 Ack=116317 Win=4140 Len=0 SLE=117777 SRE=264133"
"292","0.504074","100.86.7.137","13.84.36.2","TCP","66","[TCP Dup ACK 109#94] 57514  >  443 [ACK] Seq=11240 Ack=116317 Win=4140 Len=0 SLE=117777 SRE=265593"
"293","0.504084","100.86.7.137","13.84.36.2","TCP","66","[TCP Dup ACK 109#95] 57514  >  443 [ACK] Seq=11240 Ack=116317 Win=4140 Len=0 SLE=117777 SRE=267053"
"294","0.504097","100.86.7.137","13.84.36.2","TCP","66","[TCP Dup ACK 109#96] 57514  >  443 [ACK] Seq=11240 Ack=116317 Win=4140 Len=0 SLE=117777 SRE=268513"
"295","0.504106","100.86.7.137","13.84.36.2","TCP","66","[TCP Dup ACK 109#97] 57514  >  443 [ACK] Seq=11240 Ack=116317 Win=4140 Len=0 SLE=117777 SRE=269973"
"296","0.504114","100.86.7.137","13.84.36.2","TCP","66","[TCP Dup ACK 109#98] 57514  >  443 [ACK] Seq=11240 Ack=116317 Win=4140 Len=0 SLE=117777 SRE=271433"
"297","0.504129","100.86.7.137","13.84.36.2","TCP","66","[TCP Dup ACK 109#99] 57514  >  443 [ACK] Seq=11240 Ack=116317 Win=4140 Len=0 SLE=117777 SRE=272893"
"298","0.504138","100.86.7.137","13.84.36.2","TCP","66","[TCP Dup ACK 109#100] 57514  >  443 [ACK] Seq=11240 Ack=116317 Win=4140 Len=0 SLE=117777 SRE=274353"
