"No.","Time","Source","Destination","Protocol","Length","Info"
"1","0.000000","100.86.7.137","13.84.36.2","TLSv1.2","2296","Application Data"
"2","0.000071","100.86.7.137","13.84.36.2","TLSv1.2","93","Application Data"
"3","0.061497","13.84.36.2","100.86.7.137","TLSv1.2","93","Application Data"
"4","0.114194","100.86.7.137","13.84.36.2","TCP","54","57514  >  443 [ACK] Seq=2282 Ack=40 Win=4138 Len=0"
"5","0.129438","13.84.36.2","100.86.7.137","TCP","1514","443  >  57514 [ACK] Seq=40 Ack=2282 Win=16384 Len=1460 [TCP segment of a reassembled PDU]"
"6","0.129590","13.84.36.2","100.86.7.137","TCP","1514","443  >  57514 [ACK] Seq=1500 Ack=2282 Win=16384 Len=1460 [TCP segment of a reassembled PDU]"
"7","0.129590","13.84.36.2","100.86.7.137","TLSv1.2","342","Application Data"
"8","0.129655","100.86.7.137","13.84.36.2","TCP","54","57514  >  443 [ACK] Seq=2282 Ack=3248 Win=4140 Len=0"
"9","0.130427","13.84.36.2","100.86.7.137","TLSv1.2","1013","Application Data"
"10","0.130489","100.86.7.137","13.84.36.2","TCP","54","57514  >  443 [ACK] Seq=2282 Ack=4207 Win=4136 Len=0"
"11","0.131380","100.86.7.137","13.84.36.2","TLSv1.2","89","Application Data"
"12","0.132328","13.84.36.2","100.86.7.137","TCP","1514","443  >  57514 [ACK] Seq=4207 Ack=2282 Win=16384 Len=1460 [TCP segment of a reassembled PDU]"
"13","0.132396","100.86.7.137","13.84.36.2","TCP","54","57514  >  443 [ACK] Seq=2317 Ack=5667 Win=4140 Len=0"
"14","0.133974","13.84.36.2","100.86.7.137","TCP","1514","443  >  57514 [ACK] Seq=5667 Ack=2282 Win=16384 Len=1460 [TCP segment of a reassembled PDU]"
"15","0.133974","13.84.36.2","100.86.7.137","TLSv1.2","1277","Application Data, Application Data"
"16","0.133974","13.84.36.2","100.86.7.137","TLSv1.2","4434","Application Data"
"17","0.133974","13.84.36.2","100.86.7.137","TCP","1514","[TCP Previous segment not captured] 443  >  57514 [ACK] Seq=14190 Ack=2282 Win=16384 Len=1460 [TCP segment of a reassembled PDU]"
"18","0.134080","100.86.7.137","13.84.36.2","TCP","66","57514  >  443 [ACK] Seq=2317 Ack=12730 Win=4140 Len=0 SLE=14190 SRE=15650"
"19","0.134234","13.84.36.2","100.86.7.137","TCP","1123","443  >  57514 [PSH, ACK] Seq=15650 Ack=2282 Win=16384 Len=1069 [TCP segment of a reassembled PDU], Application Data"
"20","0.134234","13.84.36.2","100.86.7.137","TLSv1.2","85","Application Data"
"21","0.134272","100.86.7.137","13.84.36.2","TCP","66","[TCP Dup ACK 18#1] 57514  >  443 [ACK] Seq=2317 Ack=12730 Win=4140 Len=0 SLE=14190 SRE=16719"
"22","0.134310","100.86.7.137","13.84.36.2","TCP","66","[TCP Dup ACK 18#2] 57514  >  443 [ACK] Seq=2317 Ack=12730 Win=4140 Len=0 SLE=14190 SRE=16750"
"23","0.210343","13.84.36.2","100.86.7.137","TCP","1514","[TCP Retransmission] 443  >  57514 [ACK] Seq=12730 Ack=2317 Win=16384 Len=1460"
"24","0.210448","100.86.7.137","13.84.36.2","TCP","54","57514  >  443 [ACK] Seq=2317 Ack=16750 Win=4140 Len=0"
"25","0.327627","100.86.7.137","13.84.36.2","TLSv1.2","2160","Application Data"
"26","0.327764","100.86.7.137","13.84.36.2","TLSv1.2","251","Application Data"
"27","0.343440","100.86.7.137","13.84.36.2","TLSv1.2","2161","Application Data"
"28","0.346325","100.86.7.137","13.84.36.2","TLSv1.2","255","Application Data"
"29","0.351721","100.86.7.137","13.84.36.2","TLSv1.2","2166","Application Data"
"30","0.351811","100.86.7.137","13.84.36.2","TLSv1.2","258","Application Data"
"31","0.351867","100.86.7.137","13.84.36.2","TLSv1.2","2165","Application Data"
"32","0.351895","100.86.7.137","13.84.36.2","TLSv1.2","254","Application Data"
"33","0.353912","100.86.7.137","13.84.36.2","TLSv1.2","2165","Application Data"
"34","0.353985","100.86.7.137","13.84.36.2","TLSv1.2","253","Application Data"
"35","0.354036","100.86.7.137","13.84.36.2","TLSv1.2","2167","Application Data"
"36","0.354075","100.86.7.137","13.84.36.2","TLSv1.2","254","Application Data"
"37","0.354122","100.86.7.137","13.84.36.2","TLSv1.2","2161","Application Data"
"38","0.354149","100.86.7.137","13.84.36.2","TLSv1.2","260","Application Data"
"39","0.354197","100.86.7.137","13.84.36.2","TLSv1.2","2165","Application Data"
"40","0.354244","100.86.7.137","13.84.36.2","TLSv1.2","254","Application Data"
"41","0.354300","100.86.7.137","13.84.36.2","TLSv1.2","2163","Application Data"
"42","0.354996","100.86.7.137","13.84.36.2","TLSv1.2","252","Application Data"
"43","0.355133","100.86.7.137","13.84.36.2","TLSv1.2","2166","Application Data"
"44","0.355183","100.86.7.137","13.84.36.2","TLSv1.2","253","Application Data"
"45","0.355251","100.86.7.137","13.84.36.2","TLSv1.2","2161","Application Data"
"46","0.355291","100.86.7.137","13.84.36.2","TLSv1.2","262","Application Data"
"47","0.355372","100.86.7.137","13.84.36.2","TLSv1.2","2158","Application Data"
"48","0.355417","100.86.7.137","13.84.36.2","TLSv1.2","248","Application Data"
"49","0.355499","100.86.7.137","13.84.36.2","TLSv1.2","2167","Application Data"
"50","0.355551","100.86.7.137","13.84.36.2","TLSv1.2","254","Application Data"
"51","0.381119","13.84.36.2","100.86.7.137","TCP","56","443  >  57514 [ACK] Seq=16750 Ack=4423 Win=16385 Len=0"
"52","0.387068","13.84.36.2","100.86.7.137","TCP","2974","443  >  57514 [ACK] Seq=16750 Ack=4620 Win=16384 Len=2920 [TCP segment of a reassembled PDU]"
"53","0.387159","100.86.7.137","13.84.36.2","TCP","54","57514  >  443 [ACK] Seq=32346 Ack=19670 Win=4140 Len=0"
"54","0.387749","13.84.36.2","100.86.7.137","TLSv1.2","279","Application Data"
"55","0.387749","13.84.36.2","100.86.7.137","TLSv1.2","10274","Application Data, Application Data"
"56","0.387804","100.86.7.137","13.84.36.2","TCP","54","57514  >  443 [ACK] Seq=32346 Ack=30115 Win=4140 Len=0"
"57","0.388698","13.84.36.2","100.86.7.137","TLSv1.2","961","Application Data"
"58","0.388698","13.84.36.2","100.86.7.137","TLSv1.2","85","Application Data"
"59","0.388768","100.86.7.137","13.84.36.2","TCP","54","57514  >  443 [ACK] Seq=32346 Ack=31053 Win=4136 Len=0"
"60","0.393914","13.84.36.2","100.86.7.137","TCP","56","443  >  57514 [ACK] Seq=31053 Ack=6727 Win=16382 Len=0"
"61","0.397017","13.84.36.2","100.86.7.137","TCP","1514","443  >  57514 [ACK] Seq=31053 Ack=6928 Win=16381 Len=1460 [TCP segment of a reassembled PDU]"
"62","0.397017","13.84.36.2","100.86.7.137","TCP","1514","443  >  57514 [ACK] Seq=32513 Ack=6928 Win=16381 Len=1460 [TCP segment of a reassembled PDU]"
"63","0.397017","13.84.36.2","100.86.7.137","TLSv1.2","506","Application Data"
"64","0.397165","100.86.7.137","13.84.36.2","TCP","54","57514  >  443 [ACK] Seq=32346 Ack=34425 Win=4140 Len=0"
"65","0.397319","13.84.36.2","100.86.7.137","TLSv1.2","85","Application Data"
"66","0.397341","100.86.7.137","13.84.36.2","TCP","54","57514  >  443 [ACK] Seq=32346 Ack=34456 Win=4139 Len=0"
"67","0.398185","13.84.36.2","100.86.7.137","TCP","56","443  >  57514 [ACK] Seq=34456 Ack=8368 Win=16385 Len=0"
"68","0.399549","13.84.36.2","100.86.7.137","TCP","56","443  >  57514 [ACK] Seq=34456 Ack=11555 Win=16381 Len=0"
"69","0.401632","13.84.36.2","100.86.7.137","TCP","56","443  >  57514 [ACK] Seq=34456 Ack=22911 Win=16382 Len=0"
"70","0.402741","13.84.36.2","100.86.7.137","TCP","56","443  >  57514 [ACK] Seq=34456 Ack=31473 Win=16385 Len=0"
"71","0.403352","13.84.36.2","100.86.7.137","TCP","56","443  >  57514 [ACK] Seq=34456 Ack=32146 Win=16382 Len=0"
"72","0.433289","100.86.7.137","13.84.36.2","TLSv1.2","2209","Application Data"
"73","0.433431","100.86.7.137","13.84.36.2","TLSv1.2","377","Application Data"
"74","0.434899","13.84.36.2","100.86.7.137","TCP","2974","443  >  57514 [ACK] Seq=34456 Ack=32346 Win=16381 Len=2920 [TCP segment of a reassembled PDU]"
"75","0.434899","13.84.36.2","100.86.7.137","TLSv1.2","279","Application Data"
"76","0.434959","100.86.7.137","13.84.36.2","TCP","54","57514  >  443 [ACK] Seq=34824 Ack=37601 Win=4140 Len=0"
"77","0.436563","13.84.36.2","100.86.7.137","TCP","2974","443  >  57514 [ACK] Seq=37601 Ack=32346 Win=16381 Len=2920 [TCP segment of a reassembled PDU]"
"78","0.436563","13.84.36.2","100.86.7.137","TLSv1.2","119","Application Data"
"79","0.436563","13.84.36.2","100.86.7.137","TLSv1.2","7354","Application Data"
"80","0.436641","100.86.7.137","13.84.36.2","TCP","54","57514  >  443 [ACK] Seq=34824 Ack=47886 Win=4140 Len=0"
"81","0.436727","13.84.36.2","100.86.7.137","TLSv1.2","2974","Application Data"
"82","0.436766","100.86.7.137","13.84.36.2","TCP","54","57514  >  443 [ACK] Seq=34824 Ack=50806 Win=4140 Len=0"
"83","0.437205","13.84.36.2","100.86.7.137","TLSv1.2","7354","Application Data, Application Data"
"84","0.437205","13.84.36.2","100.86.7.137","TLSv1.2","728","Application Data"
"85","0.437250","100.86.7.137","13.84.36.2","TCP","54","57514  >  443 [ACK] Seq=34824 Ack=58780 Win=4140 Len=0"
"86","0.438069","13.84.36.2","100.86.7.137","TLSv1.2","85","Application Data"
"87","0.438069","13.84.36.2","100.86.7.137","TCP","2974","443  >  57514 [ACK] Seq=58811 Ack=32346 Win=16381 Len=2920 [TCP segment of a reassembled PDU]"
"88","0.438069","13.84.36.2","100.86.7.137","TLSv1.2","255","Application Data"
"89","0.438119","100.86.7.137","13.84.36.2","TCP","54","57514  >  443 [ACK] Seq=34824 Ack=61932 Win=4140 Len=0"
"90","0.438819","13.84.36.2","100.86.7.137","TLSv1.2","884","Application Data"
"91","0.438819","13.84.36.2","100.86.7.137","TLSv1.2","85","Application Data"
"92","0.438864","100.86.7.137","13.84.36.2","TCP","54","57514  >  443 [ACK] Seq=34824 Ack=62793 Win=4136 Len=0"
"93","0.439483","13.84.36.2","100.86.7.137","TCP","1514","443  >  57514 [ACK] Seq=62793 Ack=32346 Win=16381 Len=1460 [TCP segment of a reassembled PDU]"
"94","0.439526","100.86.7.137","13.84.36.2","TCP","54","57514  >  443 [ACK] Seq=34824 Ack=64253 Win=4140 Len=0"
"95","0.441200","13.84.36.2","100.86.7.137","TCP","1514","443  >  57514 [ACK] Seq=64253 Ack=32346 Win=16381 Len=1460 [TCP segment of a reassembled PDU]"
"96","0.441200","13.84.36.2","100.86.7.137","TLSv1.2","249","Application Data"
"97","0.441200","13.84.36.2","100.86.7.137","TLSv1.2","96","Application Data"
"98","0.441200","13.84.36.2","100.86.7.137","TLSv1.2","85","Application Data"
"99","0.441267","100.86.7.137","13.84.36.2","TCP","54","57514  >  443 [ACK] Seq=34824 Ack=65981 Win=4140 Len=0"
"100","0.453446","13.84.36.2","100.86.7.137","TCP","1514","443  >  57514 [ACK] Seq=65981 Ack=32346 Win=16381 Len=1460 [TCP segment of a reassembled PDU]"
"101","0.453500","100.86.7.137","13.84.36.2","TCP","54","57514  >  443 [ACK] Seq=34824 Ack=67441 Win=4140 Len=0"
"102","0.455545","13.84.36.2","100.86.7.137","TCP","1514","443  >  57514 [ACK] Seq=67441 Ack=32346 Win=16381 Len=1460 [TCP segment of a reassembled PDU]"
"103","0.455545","13.84.36.2","100.86.7.137","TLSv1.2","279","Application Data"
"104","0.455545","13.84.36.2","100.86.7.137","TLSv1.2","17574","Application Data, Application Data, Application Data, Application Data"
"105","0.455545","13.84.36.2","100.86.7.137","TLSv1.2","1348","Application Data"
"106","0.455545","13.84.36.2","100.86.7.137","TLSv1.2","85","Application Data"
"107","0.455657","100.86.7.137","13.84.36.2","TCP","54","57514  >  443 [ACK] Seq=34824 Ack=87971 Win=4140 Len=0"
"108","0.475765","13.84.36.2","100.86.7.137","TCP","1514","443  >  57514 [ACK] Seq=87971 Ack=32346 Win=16381 Len=1460 [TCP segment of a reassembled PDU]"
"109","0.475765","13.84.36.2","100.86.7.137","TCP","1514","443  >  57514 [ACK] Seq=89431 Ack=32346 Win=16381 Len=1460 [TCP segment of a reassembled PDU]"
"110","0.475765","13.84.36.2","100.86.7.137","TLSv1.2","249","Application Data"
"111","0.475850","100.86.7.137","13.84.36.2","TCP","54","57514  >  443 [ACK] Seq=34824 Ack=91086 Win=4140 Len=0"
"112","0.477325","13.84.36.2","100.86.7.137","TCP","2974","443  >  57514 [ACK] Seq=91086 Ack=32346 Win=16381 Len=2920 [TCP segment of a reassembled PDU]"
"113","0.477325","13.84.36.2","100.86.7.137","TLSv1.2","1252","Application Data"
"114","0.477325","13.84.36.2","100.86.7.137","TCP","1514","443  >  57514 [ACK] Seq=95204 Ack=32346 Win=16381 Len=1460 [TCP segment of a reassembled PDU]"
"115","0.477325","13.84.36.2","100.86.7.137","TLSv1.2","746","Application Data"
"116","0.477325","13.84.36.2","100.86.7.137","TLSv1.2","85","Application Data"
"117","0.477432","100.86.7.137","13.84.36.2","TCP","54","57514  >  443 [ACK] Seq=34824 Ack=97387 Win=4140 Len=0"
"118","0.482385","13.84.36.2","100.86.7.137","TCP","56","443  >  57514 [ACK] Seq=97387 Ack=34501 Win=16382 Len=0"
"119","0.485315","13.84.36.2","100.86.7.137","TCP","1514","443  >  57514 [ACK] Seq=97387 Ack=34824 Win=16381 Len=1460 [TCP segment of a reassembled PDU]"
"120","0.485315","13.84.36.2","100.86.7.137","TCP","1514","443  >  57514 [ACK] Seq=98847 Ack=34824 Win=16381 Len=1460 [TCP segment of a reassembled PDU]"
"121","0.485315","13.84.36.2","100.86.7.137","TLSv1.2","279","Application Data"
"122","0.485397","100.86.7.137","13.84.36.2","TCP","54","57514  >  443 [ACK] Seq=34824 Ack=100532 Win=4140 Len=0"
"123","0.486825","13.84.36.2","100.86.7.137","TLSv1.2","8814","Application Data, Application Data"
"124","0.486825","13.84.36.2","100.86.7.137","TLSv1.2","1373","Application Data"
"125","0.486825","13.84.36.2","100.86.7.137","TLSv1.2","4434","Application Data"
"126","0.486825","13.84.36.2","100.86.7.137","TLSv1.2","1231","Application Data"
"127","0.486825","13.84.36.2","100.86.7.137","TLSv1.2","85","Application Data"
"128","0.486905","100.86.7.137","13.84.36.2","TCP","54","57514  >  443 [ACK] Seq=34824 Ack=116199 Win=4140 Len=0"
"129","0.499644","13.84.36.2","100.86.7.137","TCP","1514","443  >  57514 [ACK] Seq=116199 Ack=34824 Win=16381 Len=1460 [TCP segment of a reassembled PDU]"
"130","0.499644","13.84.36.2","100.86.7.137","TLSv1.2","475","Application Data"
"131","0.499644","13.84.36.2","100.86.7.137","TLSv1.2","85","Application Data"
"132","0.499974","100.86.7.137","13.84.36.2","TCP","54","57514  >  443 [ACK] Seq=34824 Ack=118111 Win=4140 Len=0"
"133","0.520076","13.84.36.2","100.86.7.137","TCP","1514","443  >  57514 [ACK] Seq=118111 Ack=34824 Win=16381 Len=1460 [TCP segment of a reassembled PDU]"
"134","0.520076","13.84.36.2","100.86.7.137","TCP","1514","443  >  57514 [ACK] Seq=119571 Ack=34824 Win=16381 Len=1460 [TCP segment of a reassembled PDU]"
"135","0.520076","13.84.36.2","100.86.7.137","TLSv1.2","249","Application Data"
"136","0.520076","13.84.36.2","100.86.7.137","TLSv1.2","8814","Application Data, Application Data"
"137","0.520076","13.84.36.2","100.86.7.137","TLSv1.2","1373","Application Data"
"138","0.520154","100.86.7.137","13.84.36.2","TCP","54","57514  >  443 [ACK] Seq=34824 Ack=131305 Win=4140 Len=0"
"139","0.522384","13.84.36.2","100.86.7.137","TCP","1514","443  >  57514 [ACK] Seq=131305 Ack=34824 Win=16381 Len=1460 [TCP segment of a reassembled PDU]"
"140","0.522948","13.84.36.2","100.86.7.137","TCP","1514","443  >  57514 [ACK] Seq=132765 Ack=34824 Win=16381 Len=1460 [TCP segment of a reassembled PDU]"
"141","0.522948","13.84.36.2","100.86.7.137","TLSv1.2","1252","Application Data"
"142","0.522948","13.84.36.2","100.86.7.137","TLSv1.2","8814","Application Data, Application Data"
"143","0.523009","100.86.7.137","13.84.36.2","TCP","54","57514  >  443 [ACK] Seq=34824 Ack=144183 Win=4140 Len=0"
"144","0.525244","13.84.36.2","100.86.7.137","TLSv1.2","1465","Application Data"
"145","0.525244","13.84.36.2","100.86.7.137","TLSv1.2","85","Application Data"
"146","0.525310","100.86.7.137","13.84.36.2","TCP","54","57514  >  443 [ACK] Seq=34824 Ack=145625 Win=4140 Len=0"
"147","0.553790","13.84.36.2","100.86.7.137","TCP","2974","443  >  57514 [ACK] Seq=145625 Ack=34824 Win=16381 Len=2920 [TCP segment of a reassembled PDU]"
"148","0.553790","13.84.36.2","100.86.7.137","TLSv1.2","286","Application Data"
"149","0.553790","13.84.36.2","100.86.7.137","TLSv1.2","560","Application Data"
"150","0.553790","13.84.36.2","100.86.7.137","TLSv1.2","85","Application Data"
"151","0.553994","100.86.7.137","13.84.36.2","TCP","54","57514  >  443 [ACK] Seq=34824 Ack=149314 Win=4140 Len=0"
"152","0.560090","13.84.36.2","100.86.7.137","TCP","2974","443  >  57514 [ACK] Seq=149314 Ack=34824 Win=16381 Len=2920 [TCP segment of a reassembled PDU]"
"153","0.560090","13.84.36.2","100.86.7.137","TLSv1.2","249","Application Data"
"154","0.560090","13.84.36.2","100.86.7.137","TLSv1.2","8814","Application Data, Application Data"
"155","0.560090","13.84.36.2","100.86.7.137","TLSv1.2","1373","Application Data"
"156","0.560214","100.86.7.137","13.84.36.2","TCP","54","57514  >  443 [ACK] Seq=34824 Ack=162508 Win=4140 Len=0"
"157","0.563902","13.84.36.2","100.86.7.137","TLSv1.2","4434","Application Data"
"158","0.563999","100.86.7.137","13.84.36.2","TCP","54","57514  >  443 [ACK] Seq=34824 Ack=166888 Win=4140 Len=0"
"159","0.565687","13.84.36.2","100.86.7.137","TLSv1.2","7354","Application Data"
"160","0.565687","13.84.36.2","100.86.7.137","TLSv1.2","1125","Application Data, Application Data"
"161","0.565687","13.84.36.2","100.86.7.137","TLSv1.2","85","Application Data"
"162","0.565767","100.86.7.137","13.84.36.2","TCP","54","57514  >  443 [ACK] Seq=34824 Ack=175290 Win=4140 Len=0"
"163","0.591075","13.84.36.2","100.86.7.137","TCP","1514","443  >  57514 [ACK] Seq=175290 Ack=34824 Win=16381 Len=1460 [TCP segment of a reassembled PDU]"
"164","0.591075","13.84.36.2","100.86.7.137","TLSv1.2","1272","Application Data"
"165","0.591075","13.84.36.2","100.86.7.137","TLSv1.2","85","Application Data"
"166","0.591075","13.84.36.2","100.86.7.137","TCP","2974","443  >  57514 [ACK] Seq=177999 Ack=34824 Win=16381 Len=2920 [TCP segment of a reassembled PDU]"
"167","0.591075","13.84.36.2","100.86.7.137","TLSv1.2","249","Application Data"
"168","0.591075","13.84.36.2","100.86.7.137","TLSv1.2","8814","Application Data, Application Data"
"169","0.591075","13.84.36.2","100.86.7.137","TLSv1.2","1373","Application Data"
"170","0.591075","13.84.36.2","100.86.7.137","TCP","2974","443  >  57514 [ACK] Seq=191193 Ack=34824 Win=16381 Len=2920 [TCP segment of a reassembled PDU]"
"171","0.591075","13.84.36.2","100.86.7.137","TLSv1.2","69","Application Data"
"172","0.591075","13.84.36.2","100.86.7.137","TLSv1.2","85","Application Data"
"173","0.591169","100.86.7.137","13.84.36.2","TCP","54","57514  >  443 [ACK] Seq=34824 Ack=177999 Win=4140 Len=0"
"174","0.591283","100.86.7.137","13.84.36.2","TCP","54","57514  >  443 [ACK] Seq=34824 Ack=194159 Win=4140 Len=0"
"175","0.603336","13.84.36.2","100.86.7.137","TCP","2974","443  >  57514 [ACK] Seq=194159 Ack=34824 Win=16381 Len=2920 [TCP segment of a reassembled PDU]"
"176","0.603336","13.84.36.2","100.86.7.137","TLSv1.2","249","Application Data"
"177","0.603336","13.84.36.2","100.86.7.137","TLSv1.2","8814","Application Data, Application Data"
"178","0.603336","13.84.36.2","100.86.7.137","TLSv1.2","1373","Application Data"
"179","0.603336","13.84.36.2","100.86.7.137","TLSv1.2","13194","Application Data, Application Data, Application Data"
"180","0.603336","13.84.36.2","100.86.7.137","TLSv1.2","965","Application Data"
"181","0.603336","13.84.36.2","100.86.7.137","TLSv1.2","85","Application Data"
"182","0.603336","13.84.36.2","100.86.7.137","TCP","1514","443  >  57514 [ACK] Seq=221435 Ack=34824 Win=16381 Len=1460 [TCP segment of a reassembled PDU]"
"183","0.603336","13.84.36.2","100.86.7.137","TLSv1.2","206","Application Data"
"184","0.603336","13.84.36.2","100.86.7.137","TLSv1.2","85","Application Data"
"185","0.603336","13.84.36.2","100.86.7.137","TCP","2974","443  >  57514 [ACK] Seq=223078 Ack=34824 Win=16381 Len=2920 [TCP segment of a reassembled PDU]"
"186","0.603336","13.84.36.2","100.86.7.137","TLSv1.2","249","Application Data"
"187","0.603336","13.84.36.2","100.86.7.137","TCP","2974","443  >  57514 [ACK] Seq=226193 Ack=34824 Win=16381 Len=2920 [TCP segment of a reassembled PDU]"
"188","0.603336","13.84.36.2","100.86.7.137","TLSv1.2","230","Application Data"
"189","0.603336","13.84.36.2","100.86.7.137","TLSv1.2","85","Application Data"
"190","0.603500","100.86.7.137","13.84.36.2","TCP","54","57514  >  443 [ACK] Seq=34824 Ack=229320 Win=4140 Len=0"
"191","0.606000","13.84.36.2","100.86.7.137","TCP","2974","443  >  57514 [ACK] Seq=229320 Ack=34824 Win=16381 Len=2920 [TCP segment of a reassembled PDU]"
"192","0.606000","13.84.36.2","100.86.7.137","TLSv1.2","249","Application Data"
"193","0.606000","13.84.36.2","100.86.7.137","TLSv1.2","8814","Application Data, Application Data"
"194","0.606074","100.86.7.137","13.84.36.2","TCP","54","57514  >  443 [ACK] Seq=34824 Ack=241195 Win=4140 Len=0"
"195","0.606637","13.84.36.2","100.86.7.137","TLSv1.2","1373","Application Data"
"196","0.606685","100.86.7.137","13.84.36.2","TCP","54","57514  >  443 [ACK] Seq=34824 Ack=242514 Win=4134 Len=0"
"197","0.611284","13.84.36.2","100.86.7.137","TCP","2974","443  >  57514 [ACK] Seq=242514 Ack=34824 Win=16381 Len=2920 [TCP segment of a reassembled PDU]"
"198","0.611284","13.84.36.2","100.86.7.137","TLSv1.2","1181","Application Data"
"199","0.611284","13.84.36.2","100.86.7.137","TLSv1.2","85","Application Data"
"200","0.611369","100.86.7.137","13.84.36.2","TCP","54","57514  >  443 [ACK] Seq=34824 Ack=246592 Win=4140 Len=0"
"201","0.615369","13.84.36.2","100.86.7.137","TCP","1514","443  >  57514 [ACK] Seq=246592 Ack=34824 Win=16381 Len=1460 [TCP segment of a reassembled PDU]"
"202","0.615649","13.84.36.2","100.86.7.137","TLSv1.2","2974","Application Data"
"203","0.615683","100.86.7.137","13.84.36.2","TCP","54","57514  >  443 [ACK] Seq=34824 Ack=250972 Win=4140 Len=0"
"204","0.618788","13.84.36.2","100.86.7.137","TCP","1514","443  >  57514 [ACK] Seq=250972 Ack=34824 Win=16381 Len=1460 [TCP segment of a reassembled PDU]"
"205","0.618788","13.84.36.2","100.86.7.137","TLSv1.2","1447","Application Data"
"206","0.618788","13.84.36.2","100.86.7.137","TCP","1514","443  >  57514 [ACK] Seq=253825 Ack=34824 Win=16381 Len=1460 [TCP segment of a reassembled PDU]"
"207","0.618788","13.84.36.2","100.86.7.137","TLSv1.2","1150","Application Data"
"208","0.618788","13.84.36.2","100.86.7.137","TLSv1.2","85","Application Data"
"209","0.618873","100.86.7.137","13.84.36.2","TCP","54","57514  >  443 [ACK] Seq=34824 Ack=256412 Win=4140 Len=0"
"210","0.622974","13.84.36.2","100.86.7.137","TCP","1514","443  >  57514 [ACK] Seq=256412 Ack=34824 Win=16381 Len=1460 [TCP segment of a reassembled PDU]"
"211","0.623179","13.84.36.2","100.86.7.137","TCP","1514","443  >  57514 [ACK] Seq=257872 Ack=34824 Win=16381 Len=1460 [TCP segment of a reassembled PDU]"
"212","0.623179","13.84.36.2","100.86.7.137","TLSv1.2","249","Application Data"
"213","0.623208","100.86.7.137","13.84.36.2","TCP","54","57514  >  443 [ACK] Seq=34824 Ack=259527 Win=4140 Len=0"
"214","0.624431","13.84.36.2","100.86.7.137","TCP","1514","443  >  57514 [ACK] Seq=259527 Ack=34824 Win=16381 Len=1460 [TCP segment of a reassembled PDU]"
"215","0.624431","13.84.36.2","100.86.7.137","TLSv1.2","1432","Application Data"
"216","0.624496","100.86.7.137","13.84.36.2","TCP","54","57514  >  443 [ACK] Seq=34824 Ack=262365 Win=4140 Len=0"
"217","0.624737","13.84.36.2","100.86.7.137","TLSv1.2","85","Application Data"
"218","0.624758","100.86.7.137","13.84.36.2","TCP","54","57514  >  443 [ACK] Seq=34824 Ack=262396 Win=4139 Len=0"
"219","0.635679","13.84.36.2","100.86.7.137","TCP","2974","443  >  57514 [ACK] Seq=262396 Ack=34824 Win=16381 Len=2920 [TCP segment of a reassembled PDU]"
"220","0.635679","13.84.36.2","100.86.7.137","TLSv1.2","249","Application Data"
"221","0.635679","13.84.36.2","100.86.7.137","TLSv1.2","219","Application Data"
"222","0.635679","13.84.36.2","100.86.7.137","TCP","2974","443  >  57514 [ACK] Seq=265676 Ack=34824 Win=16381 Len=2920 [TCP segment of a reassembled PDU]"
"223","0.635679","13.84.36.2","100.86.7.137","TLSv1.2","1308","Application Data, Application Data"
"224","0.635772","100.86.7.137","13.84.36.2","TCP","54","57514  >  443 [ACK] Seq=34824 Ack=269850 Win=4140 Len=0"
"225","0.639517","13.84.36.2","100.86.7.137","TLSv1.2","85","Application Data"
"226","0.639572","100.86.7.137","13.84.36.2","TCP","54","57514  >  443 [ACK] Seq=34824 Ack=269881 Win=4139 Len=0"
"227","0.643140","13.84.36.2","100.86.7.137","TCP","2974","443  >  57514 [ACK] Seq=269881 Ack=34824 Win=16381 Len=2920 [TCP segment of a reassembled PDU]"
"228","0.643140","13.84.36.2","100.86.7.137","TLSv1.2","249","Application Data"
"229","0.643207","100.86.7.137","13.84.36.2","TCP","54","57514  >  443 [ACK] Seq=34824 Ack=272996 Win=4140 Len=0"
"230","0.644170","13.84.36.2","100.86.7.137","TCP","1514","443  >  57514 [ACK] Seq=272996 Ack=34824 Win=16381 Len=1460 [TCP segment of a reassembled PDU]"
"231","0.644170","13.84.36.2","100.86.7.137","TCP","1514","443  >  57514 [ACK] Seq=274456 Ack=34824 Win=16381 Len=1460 [TCP segment of a reassembled PDU]"
"232","0.644170","13.84.36.2","100.86.7.137","TLSv1.2","1514","Application Data"
"233","0.644170","13.84.36.2","100.86.7.137","TCP","1514","443  >  57514 [ACK] Seq=277376 Ack=34824 Win=16381 Len=1460 [TCP segment of a reassembled PDU]"
"234","0.644170","13.84.36.2","100.86.7.137","TCP","1514","443  >  57514 [ACK] Seq=278836 Ack=34824 Win=16381 Len=1460 [TCP segment of a reassembled PDU]"
"235","0.644170","13.84.36.2","100.86.7.137","TLSv1.2","990","Application Data"
"236","0.644170","13.84.36.2","100.86.7.137","TCP","1514","443  >  57514 [ACK] Seq=281232 Ack=34824 Win=16381 Len=1460 [TCP segment of a reassembled PDU]"
"237","0.644170","13.84.36.2","100.86.7.137","TLSv1.2","437","Application Data"
"238","0.644364","100.86.7.137","13.84.36.2","TCP","54","57514  >  443 [ACK] Seq=34824 Ack=283075 Win=4140 Len=0"
"239","0.644542","13.84.36.2","100.86.7.137","TLSv1.2","1385","Application Data"
"240","0.644542","13.84.36.2","100.86.7.137","TLSv1.2","85","Application Data"
"241","0.644581","100.86.7.137","13.84.36.2","TCP","54","57514  >  443 [ACK] Seq=34824 Ack=284437 Win=4134 Len=0"
"242","0.772818","13.84.36.2","100.86.7.137","TLSv1.2","789","Application Data"
"243","0.775616","13.84.36.2","100.86.7.137","TLSv1.2","373","Application Data"
"244","0.775670","100.86.7.137","13.84.36.2","TCP","54","57514  >  443 [ACK] Seq=34824 Ack=285491 Win=4140 Len=0"
"245","0.777281","13.84.36.2","100.86.7.137","TLSv1.2","179","Application Data"
"246","0.785364","13.84.36.2","100.86.7.137","TLSv1.2","96","Application Data"
"247","0.785364","13.84.36.2","100.86.7.137","TLSv1.2","85","Application Data"
"248","0.785407","100.86.7.137","13.84.36.2","TCP","54","57514  >  443 [ACK] Seq=34824 Ack=285689 Win=4139 Len=0"
"249","0.791733","13.84.36.2","100.86.7.137","TCP","2974","443  >  57514 [ACK] Seq=285689 Ack=34824 Win=16381 Len=2920 [TCP segment of a reassembled PDU]"
"250","0.791733","13.84.36.2","100.86.7.137","TLSv1.2","249","Application Data"
"251","0.791733","13.84.36.2","100.86.7.137","TLSv1.2","8814","Application Data, Application Data"
"252","0.791733","13.84.36.2","100.86.7.137","TLSv1.2","1373","Application Data"
"253","0.791733","13.84.36.2","100.86.7.137","TCP","2974","443  >  57514 [ACK] Seq=298883 Ack=34824 Win=16381 Len=2920 [TCP segment of a reassembled PDU]"
"254","0.791733","13.84.36.2","100.86.7.137","TLSv1.2","249","Application Data"
"255","0.791733","13.84.36.2","100.86.7.137","TLSv1.2","8814","Application Data, Application Data"
"256","0.791733","13.84.36.2","100.86.7.137","TLSv1.2","1373","Application Data"
"257","0.791849","100.86.7.137","13.84.36.2","TCP","54","57514  >  443 [ACK] Seq=34824 Ack=312077 Win=4140 Len=0"
"258","0.794193","13.84.36.2","100.86.7.137","TLSv1.2","4434","Application Data"
"259","0.794193","13.84.36.2","100.86.7.137","TLSv1.2","113","Application Data"
"260","0.794193","13.84.36.2","100.86.7.137","TLSv1.2","85","Application Data"
"261","0.794250","100.86.7.137","13.84.36.2","TCP","54","57514  >  443 [ACK] Seq=34824 Ack=316547 Win=4140 Len=0"
"262","0.808381","13.84.36.2","100.86.7.137","TCP","2974","443  >  57514 [ACK] Seq=316547 Ack=34824 Win=16381 Len=2920 [TCP segment of a reassembled PDU]"
"263","0.808381","13.84.36.2","100.86.7.137","TLSv1.2","279","Application Data"
"264","0.808381","13.84.36.2","100.86.7.137","TLSv1.2","8814","Application Data, Application Data"
"265","0.808381","13.84.36.2","100.86.7.137","TLSv1.2","1373","Application Data"
"266","0.808381","13.84.36.2","100.86.7.137","TLSv1.2","23414","Application Data, Application Data, Application Data, Application Data, Application Data"
"267","0.808381","13.84.36.2","100.86.7.137","TLSv1.2","1402","Application Data"
"268","0.808381","13.84.36.2","100.86.7.137","TLSv1.2","648","Application Data"
"269","0.808381","13.84.36.2","100.86.7.137","TLSv1.2","85","Application Data"
"270","0.808381","13.84.36.2","100.86.7.137","TLSv1.2","4434","Application Data"
"271","0.808381","13.84.36.2","100.86.7.137","TLSv1.2","323","Application Data"
"272","0.808381","13.84.36.2","100.86.7.137","TLSv1.2","85","Application Data"
"273","0.808545","100.86.7.137","13.84.36.2","TCP","54","57514  >  443 [ACK] Seq=34824 Ack=355104 Win=4140 Len=0"
"274","0.808722","100.86.7.137","13.84.36.2","TCP","54","57514  >  443 [ACK] Seq=34824 Ack=359784 Win=4140 Len=0"
"275","0.810562","13.84.36.2","100.86.7.137","TCP","1514","443  >  57514 [ACK] Seq=359784 Ack=34824 Win=16381 Len=1460 [TCP segment of a reassembled PDU]"
"276","0.813801","13.84.36.2","100.86.7.137","TCP","1514","443  >  57514 [ACK] Seq=361244 Ack=34824 Win=16381 Len=1460 [TCP segment of a reassembled PDU]"
"277","0.813801","13.84.36.2","100.86.7.137","TLSv1.2","249","Application Data"
"278","0.813801","13.84.36.2","100.86.7.137","TLSv1.2","8814","Application Data, Application Data"
"279","0.813887","100.86.7.137","13.84.36.2","TCP","54","57514  >  443 [ACK] Seq=34824 Ack=371659 Win=4140 Len=0"
"280","0.823820","13.84.36.2","100.86.7.137","TLSv1.2","1373","Application Data"
"281","0.823863","100.86.7.137","13.84.36.2","TCP","54","57514  >  443 [ACK] Seq=34824 Ack=372978 Win=4134 Len=0"
"282","0.829206","13.84.36.2","100.86.7.137","TCP","1514","443  >  57514 [ACK] Seq=372978 Ack=34824 Win=16381 Len=1460 [TCP segment of a reassembled PDU]"
"283","0.829495","13.84.36.2","100.86.7.137","TLSv1.2","2974","Application Data"
"284","0.829534","100.86.7.137","13.84.36.2","TCP","54","57514  >  443 [ACK] Seq=34824 Ack=377358 Win=4140 Len=0"
"285","0.829987","13.84.36.2","100.86.7.137","TLSv1.2","5894","Application Data"
"286","0.830026","100.86.7.137","13.84.36.2","TCP","54","57514  >  443 [ACK] Seq=34824 Ack=383198 Win=4140 Len=0"
"287","0.830456","13.84.36.2","100.86.7.137","TLSv1.2","1091","Application Data"
"288","0.830456","13.84.36.2","100.86.7.137","TLSv1.2","85","Application Data"
"289","0.830498","100.86.7.137","13.84.36.2","TCP","54","57514  >  443 [ACK] Seq=34824 Ack=384266 Win=4135 Len=0"
"290","0.845094","13.84.36.2","100.86.7.137","TLSv1.2","710","Application Data"
"291","0.845094","13.84.36.2","100.86.7.137","TLSv1.2","163","Application Data"
"292","0.845094","13.84.36.2","100.86.7.137","TLSv1.2","103","Application Data"
"293","0.845174","100.86.7.137","13.84.36.2","TCP","54","57514  >  443 [ACK] Seq=34824 Ack=385080 Win=4140 Len=0"
"294","0.850494","13.84.36.2","100.86.7.137","TLSv1.2","95","Application Data"
"295","0.850494","13.84.36.2","100.86.7.137","TLSv1.2","85","Application Data"
"296","0.850544","100.86.7.137","13.84.36.2","TCP","54","57514  >  443 [ACK] Seq=34824 Ack=385152 Win=4139 Len=0"
"297","3.904108","100.86.7.137","13.84.36.2","TLSv1.2","2204","Application Data"
"298","3.948982","13.84.36.2","100.86.7.137","TCP","56","443  >  57514 [ACK] Seq=385152 Ack=36974 Win=16385 Len=0"
"299","4.057590","13.84.36.2","100.86.7.137","TCP","1514","443  >  57514 [ACK] Seq=385152 Ack=36974 Win=16385 Len=1460 [TCP segment of a reassembled PDU]"
"300","4.058021","13.84.36.2","100.86.7.137","TCP","1514","443  >  57514 [ACK] Seq=386612 Ack=36974 Win=16385 Len=1460 [TCP segment of a reassembled PDU]"
"301","4.058021","13.84.36.2","100.86.7.137","TLSv1.2","1316","Application Data, Application Data"
"302","4.058091","100.86.7.137","13.84.36.2","TCP","54","57514  >  443 [ACK] Seq=36974 Ack=389334 Win=4140 Len=0"
"303","4.058531","13.84.36.2","100.86.7.137","TCP","1514","443  >  57514 [ACK] Seq=389334 Ack=36974 Win=16385 Len=1460 [TCP segment of a reassembled PDU]"
"304","4.058559","100.86.7.137","13.84.36.2","TCP","54","57514  >  443 [ACK] Seq=36974 Ack=390794 Win=4140 Len=0"
"305","4.058922","13.84.36.2","100.86.7.137","TCP","1514","443  >  57514 [ACK] Seq=390794 Ack=36974 Win=16385 Len=1460 [TCP segment of a reassembled PDU]"
"306","4.058922","13.84.36.2","100.86.7.137","TLSv1.2","1277","Application Data, Application Data"
"307","4.058955","100.86.7.137","13.84.36.2","TCP","54","57514  >  443 [ACK] Seq=36974 Ack=393477 Win=4140 Len=0"
"308","4.059410","13.84.36.2","100.86.7.137","TLSv1.2","5894","Application Data"
"309","4.059447","100.86.7.137","13.84.36.2","TCP","54","57514  >  443 [ACK] Seq=36974 Ack=399317 Win=4140 Len=0"
"310","4.059684","13.84.36.2","100.86.7.137","TLSv1.2","215","Application Data"
"311","4.059684","13.84.36.2","100.86.7.137","TLSv1.2","85","Application Data"
"312","4.059712","100.86.7.137","13.84.36.2","TCP","54","57514  >  443 [ACK] Seq=36974 Ack=399509 Win=4139 Len=0"
"313","4.185743","100.86.7.137","13.84.36.2","TLSv1.2","2210","Application Data"
"314","4.185848","100.86.7.137","13.84.36.2","TLSv1.2","2244","Application Data"
"315","4.189598","100.86.7.137","13.84.36.2","TLSv1.2","2252","Application Data"
"316","4.189751","100.86.7.137","13.84.36.2","TLSv1.2","2244","Application Data"
"317","4.189824","100.86.7.137","13.84.36.2","TLSv1.2","2262","Application Data"
"318","4.204290","100.86.7.137","13.84.36.2","TLSv1.2","2290","Application Data"
"319","4.204401","100.86.7.137","13.84.36.2","TLSv1.2","2307","Application Data"
"320","4.230347","13.84.36.2","100.86.7.137","TCP","56","443  >  57514 [ACK] Seq=399509 Ack=39130 Win=16385 Len=0"
"321","4.231001","13.84.36.2","100.86.7.137","TCP","56","443  >  57514 [ACK] Seq=399509 Ack=41320 Win=16385 Len=0"
"322","4.234072","13.84.36.2","100.86.7.137","TCP","56","443  >  57514 [ACK] Seq=399509 Ack=43518 Win=16385 Len=0"
"323","4.234474","13.84.36.2","100.86.7.137","TCP","56","443  >  57514 [ACK] Seq=399509 Ack=47916 Win=16385 Len=0"
"324","4.252152","13.84.36.2","100.86.7.137","TCP","56","443  >  57514 [ACK] Seq=399509 Ack=50152 Win=16385 Len=0"
"325","4.252152","13.84.36.2","100.86.7.137","TCP","56","443  >  57514 [ACK] Seq=399509 Ack=52405 Win=16385 Len=0"
"326","4.373098","13.84.36.2","100.86.7.137","TLSv1.2","736","Application Data"
"327","4.373440","13.84.36.2","100.86.7.137","TLSv1.2","498","Application Data, Application Data"
"328","4.373480","100.86.7.137","13.84.36.2","TCP","54","57514  >  443 [ACK] Seq=52405 Ack=400635 Win=4134 Len=0"
"329","4.374057","13.84.36.2","100.86.7.137","TCP","1514","443  >  57514 [ACK] Seq=400635 Ack=52405 Win=16385 Len=1460 [TCP segment of a reassembled PDU]"
"330","4.374410","13.84.36.2","100.86.7.137","TCP","1514","443  >  57514 [ACK] Seq=402095 Ack=52405 Win=16385 Len=1460 [TCP segment of a reassembled PDU]"
"331","4.374410","13.84.36.2","100.86.7.137","TLSv1.2","319","Application Data"
"332","4.374446","100.86.7.137","13.84.36.2","TCP","54","57514  >  443 [ACK] Seq=52405 Ack=403820 Win=4140 Len=0"
"333","4.376596","13.84.36.2","100.86.7.137","TLSv1.2","20494","Application Data, Application Data, Application Data, Application Data"
"334","4.376596","13.84.36.2","100.86.7.137","TLSv1.2","204","Application Data"
"335","4.376596","13.84.36.2","100.86.7.137","TLSv1.2","7354","Application Data"
"336","4.376683","100.86.7.137","13.84.36.2","TCP","54","57514  >  443 [ACK] Seq=52405 Ack=431710 Win=4140 Len=0"
"337","4.376792","13.84.36.2","100.86.7.137","TLSv1.2","1452","Application Data, Application Data"
"338","4.376792","13.84.36.2","100.86.7.137","TLSv1.2","85","Application Data"
"339","4.376814","100.86.7.137","13.84.36.2","TCP","54","57514  >  443 [ACK] Seq=52405 Ack=433139 Win=4134 Len=0"
"340","4.377696","13.84.36.2","100.86.7.137","TLSv1.2","96","Application Data"
"341","4.377696","13.84.36.2","100.86.7.137","TLSv1.2","85","Application Data"
"342","4.377738","100.86.7.137","13.84.36.2","TCP","54","57514  >  443 [ACK] Seq=52405 Ack=433212 Win=4140 Len=0"
"343","4.387956","13.84.36.2","100.86.7.137","TCP","1514","443  >  57514 [ACK] Seq=433212 Ack=52405 Win=16385 Len=1460 [TCP segment of a reassembled PDU]"
"344","4.388012","100.86.7.137","13.84.36.2","TCP","54","57514  >  443 [ACK] Seq=52405 Ack=434672 Win=4140 Len=0"
"345","4.388136","13.84.36.2","100.86.7.137","TCP","1514","443  >  57514 [ACK] Seq=434672 Ack=52405 Win=16385 Len=1460 [TCP segment of a reassembled PDU]"
"346","4.388136","13.84.36.2","100.86.7.137","TLSv1.2","255","Application Data"
"347","4.388178","100.86.7.137","13.84.36.2","TCP","54","57514  >  443 [ACK] Seq=52405 Ack=436333 Win=4140 Len=0"
"348","4.390054","13.84.36.2","100.86.7.137","TCP","2974","443  >  57514 [ACK] Seq=436333 Ack=52405 Win=16385 Len=2920 [TCP segment of a reassembled PDU]"
"349","4.390054","13.84.36.2","100.86.7.137","TLSv1.2","1252","Application Data"
"350","4.390054","13.84.36.2","100.86.7.137","TLSv1.2","20494","Application Data, Application Data, Application Data, Application Data"
"351","4.390054","13.84.36.2","100.86.7.137","TLSv1.2","204","Application Data"
"352","4.390054","13.84.36.2","100.86.7.137","TCP","2974","443  >  57514 [ACK] Seq=461041 Ack=52405 Win=16385 Len=2920 [TCP segment of a reassembled PDU]"
"353","4.390144","100.86.7.137","13.84.36.2","TCP","54","57514  >  443 [ACK] Seq=52405 Ack=463961 Win=4140 Len=0"
"354","4.390834","13.84.36.2","100.86.7.137","TLSv1.2","382","Application Data"
"355","4.390834","13.84.36.2","100.86.7.137","TLSv1.2","85","Application Data"
"356","4.390874","100.86.7.137","13.84.36.2","TCP","54","57514  >  443 [ACK] Seq=52405 Ack=464320 Win=4138 Len=0"
"357","4.464040","13.84.36.2","100.86.7.137","TCP","1514","443  >  57514 [ACK] Seq=464320 Ack=52405 Win=16385 Len=1460 [TCP segment of a reassembled PDU]"
"358","4.464353","13.84.36.2","100.86.7.137","TCP","1514","443  >  57514 [ACK] Seq=465780 Ack=52405 Win=16385 Len=1460 [TCP segment of a reassembled PDU]"
"359","4.464353","13.84.36.2","100.86.7.137","TLSv1.2","285","Application Data"
"360","4.464391","100.86.7.137","13.84.36.2","TCP","54","57514  >  443 [ACK] Seq=52405 Ack=467471 Win=4140 Len=0"
"361","4.470427","13.84.36.2","100.86.7.137","TCP","1514","443  >  57514 [ACK] Seq=467471 Ack=52405 Win=16385 Len=1460 [TCP segment of a reassembled PDU]"
"362","4.470470","100.86.7.137","13.84.36.2","TCP","54","57514  >  443 [ACK] Seq=52405 Ack=468931 Win=4140 Len=0"
"363","4.470648","13.84.36.2","100.86.7.137","TLSv1.2","2974","Application Data"
"364","4.470661","100.86.7.137","13.84.36.2","TCP","54","57514  >  443 [ACK] Seq=52405 Ack=471851 Win=4140 Len=0"
"365","4.473232","13.84.36.2","100.86.7.137","TLSv1.2","11734","Application Data, Application Data"
"366","4.473232","13.84.36.2","100.86.7.137","TLSv1.2","466","Application Data"
"367","4.473232","13.84.36.2","100.86.7.137","TLSv1.2","11734","Application Data, Application Data"
"368","4.473232","13.84.36.2","100.86.7.137","TLSv1.2","408","Application Data"
"369","4.473232","13.84.36.2","100.86.7.137","TLSv1.2","14654","Application Data, Application Data, Application Data"
"370","4.473318","100.86.7.137","13.84.36.2","TCP","54","57514  >  443 [ACK] Seq=52405 Ack=510577 Win=4140 Len=0"
"371","4.475054","13.84.36.2","100.86.7.137","TLSv1.2","21954","Application Data, Application Data, Application Data, Application Data, Application Data"
"372","4.475054","13.84.36.2","100.86.7.137","TLSv1.2","616","Application Data"
"373","4.475054","13.84.36.2","100.86.7.137","TLSv1.2","335","Application Data"
"374","4.475054","13.84.36.2","100.86.7.137","TLSv1.2","85","Application Data"
"375","4.475124","100.86.7.137","13.84.36.2","TCP","54","57514  >  443 [ACK] Seq=52405 Ack=533351 Win=4140 Len=0"
"376","4.495033","13.84.36.2","100.86.7.137","TCP","2974","443  >  57514 [ACK] Seq=533351 Ack=52405 Win=16385 Len=2920 [TCP segment of a reassembled PDU]"
"377","4.495033","13.84.36.2","100.86.7.137","TLSv1.2","255","Application Data"
"378","4.495033","13.84.36.2","100.86.7.137","TLSv1.2","20494","Application Data, Application Data, Application Data, Application Data"
"379","4.495033","13.84.36.2","100.86.7.137","TLSv1.2","204","Application Data"
"380","4.495033","13.84.36.2","100.86.7.137","TLSv1.2","27794","Application Data, Application Data, Application Data, Application Data, Application Data, Application Data"
"381","4.495033","13.84.36.2","100.86.7.137","TLSv1.2","149","Application Data"
"382","4.495033","13.84.36.2","100.86.7.137","TLSv1.2","85","Application Data"
"383","4.495160","100.86.7.137","13.84.36.2","TCP","54","57514  >  443 [ACK] Seq=52405 Ack=584928 Win=4140 Len=0"
"384","4.521553","13.84.36.2","100.86.7.137","TCP","2974","443  >  57514 [ACK] Seq=584928 Ack=52405 Win=16385 Len=2920 [TCP segment of a reassembled PDU]"
"385","4.521553","13.84.36.2","100.86.7.137","TLSv1.2","255","Application Data"
"386","4.521665","100.86.7.137","13.84.36.2","TCP","54","57514  >  443 [ACK] Seq=52405 Ack=588049 Win=4140 Len=0"
"387","4.528207","13.84.36.2","100.86.7.137","TLSv1.2","11734","Application Data, Application Data"
"388","4.528207","13.84.36.2","100.86.7.137","TLSv1.2","728","Application Data"
"389","4.528207","13.84.36.2","100.86.7.137","TLSv1.2","16114","Application Data, Application Data, Application Data"
"390","4.528207","13.84.36.2","100.86.7.137","TLSv1.2","146","Application Data"
"391","4.528207","13.84.36.2","100.86.7.137","TLSv1.2","710","Application Data"
"392","4.528207","13.84.36.2","100.86.7.137","TLSv1.2","23414","Application Data, Application Data, Application Data, Application Data, Application Data"
"393","4.528207","13.84.36.2","100.86.7.137","TLSv1.2","1402","Application Data"
"394","4.528207","13.84.36.2","100.86.7.137","TLSv1.2","11734","Application Data, Application Data"
"395","4.528207","13.84.36.2","100.86.7.137","TCP","4434","[TCP Previous segment not captured] 443  >  57514 [ACK] Seq=655059 Ack=52405 Win=16385 Len=4380 [TCP segment of a reassembled PDU]"
"396","4.528207","13.84.36.2","100.86.7.137","TCP","443","443  >  57514 [PSH, ACK] Seq=659439 Ack=52405 Win=16385 Len=389 [TCP segment of a reassembled PDU]"
"397","4.528207","13.84.36.2","100.86.7.137","TCP","85","443  >  57514 [PSH, ACK] Seq=659828 Ack=52405 Win=16385 Len=31 [TCP segment of a reassembled PDU]"
"398","4.528207","13.84.36.2","100.86.7.137","TCP","163","443  >  57514 [PSH, ACK] Seq=659859 Ack=52405 Win=16385 Len=109 [TCP segment of a reassembled PDU]"
"399","4.528207","13.84.36.2","100.86.7.137","TCP","103","443  >  57514 [PSH, ACK] Seq=659968 Ack=52405 Win=16385 Len=49 [TCP segment of a reassembled PDU]"
"400","4.528377","100.86.7.137","13.84.36.2","TCP","66","57514  >  443 [ACK] Seq=52405 Ack=653599 Win=4140 Len=0 SLE=655059 SRE=659439"
"401","4.528430","100.86.7.137","13.84.36.2","TCP","66","[TCP Dup ACK 400#1] 57514  >  443 [ACK] Seq=52405 Ack=653599 Win=4140 Len=0 SLE=655059 SRE=659828"
"402","4.528444","100.86.7.137","13.84.36.2","TCP","66","[TCP Dup ACK 400#2] 57514  >  443 [ACK] Seq=52405 Ack=653599 Win=4140 Len=0 SLE=655059 SRE=659859"
"403","4.528456","100.86.7.137","13.84.36.2","TCP","66","[TCP Dup ACK 400#3] 57514  >  443 [ACK] Seq=52405 Ack=653599 Win=4140 Len=0 SLE=655059 SRE=659968"
"404","4.528468","100.86.7.137","13.84.36.2","TCP","66","[TCP Dup ACK 400#4] 57514  >  443 [ACK] Seq=52405 Ack=653599 Win=4140 Len=0 SLE=655059 SRE=660017"
"405","4.528594","13.84.36.2","100.86.7.137","TCP","95","443  >  57514 [PSH, ACK] Seq=660017 Ack=52405 Win=16385 Len=41 [TCP segment of a reassembled PDU]"
"406","4.528594","13.84.36.2","100.86.7.137","TCP","85","443  >  57514 [PSH, ACK] Seq=660058 Ack=52405 Win=16385 Len=31 [TCP segment of a reassembled PDU]"
"407","4.528614","100.86.7.137","13.84.36.2","TCP","66","[TCP Dup ACK 400#5] 57514  >  443 [ACK] Seq=52405 Ack=653599 Win=4140 Len=0 SLE=655059 SRE=660058"
"408","4.528647","100.86.7.137","13.84.36.2","TCP","66","[TCP Dup ACK 400#6] 57514  >  443 [ACK] Seq=52405 Ack=653599 Win=4140 Len=0 SLE=655059 SRE=660089"
"409","4.575271","13.84.36.2","100.86.7.137","TCP","1514","[TCP Retransmission] 443  >  57514 [ACK] Seq=653599 Ack=52405 Win=16385 Len=1460"
"410","4.575377","100.86.7.137","13.84.36.2","TCP","54","57514  >  443 [ACK] Seq=52405 Ack=660089 Win=4140 Len=0"
"411","8.837573","100.86.7.137","13.84.36.2","TLSv1.2","2271","Application Data"
"412","8.882379","13.84.36.2","100.86.7.137","TCP","56","443  >  57514 [ACK] Seq=660089 Ack=54622 Win=16385 Len=0"
"413","8.940191","13.84.36.2","100.86.7.137","TCP","1514","443  >  57514 [ACK] Seq=660089 Ack=54622 Win=16385 Len=1460 [TCP segment of a reassembled PDU]"
"414","8.940313","13.84.36.2","100.86.7.137","TLSv1.2","1514","Ignored Unknown Record"
"415","8.940313","13.84.36.2","100.86.7.137","TLSv1.2","341","Ignored Unknown Record"
"416","8.940371","100.86.7.137","13.84.36.2","TCP","54","57514  >  443 [ACK] Seq=54622 Ack=663296 Win=4140 Len=0"
"417","8.940999","13.84.36.2","100.86.7.137","TLSv1.2","1084","Application Data"
"418","8.941063","100.86.7.137","13.84.36.2","TCP","54","57514  >  443 [ACK] Seq=54622 Ack=664326 Win=4135 Len=0"
"419","8.941971","100.86.7.137","13.84.36.2","TLSv1.2","89","Application Data"
"420","8.944634","13.84.36.2","100.86.7.137","TCP","1514","443  >  57514 [ACK] Seq=664326 Ack=54622 Win=16385 Len=1460 [TCP segment of a reassembled PDU]"
"421","8.944720","100.86.7.137","13.84.36.2","TCP","54","57514  >  443 [ACK] Seq=54657 Ack=665786 Win=4140 Len=0"
"422","8.946481","13.84.36.2","100.86.7.137","TCP","1514","443  >  57514 [ACK] Seq=665786 Ack=54622 Win=16385 Len=1460 [TCP segment of a reassembled PDU]"
"423","8.946481","13.84.36.2","100.86.7.137","TLSv1.2","1277","Application Data, Application Data"
"424","8.946481","13.84.36.2","100.86.7.137","TLSv1.2","7354","Application Data"
"425","8.946481","13.84.36.2","100.86.7.137","TLSv1.2","729","Application Data"
"426","8.946481","13.84.36.2","100.86.7.137","TLSv1.2","85","Application Data"
"427","8.946646","100.86.7.137","13.84.36.2","TCP","54","57514  >  443 [ACK] Seq=54657 Ack=676475 Win=4140 Len=0"
"428","9.040592","13.84.36.2","100.86.7.137","TCP","56","443  >  57514 [ACK] Seq=676475 Ack=54657 Win=16384 Len=0"
"429","9.293375","100.86.7.137","13.84.36.2","TLSv1.2","1678","Application Data"
"430","9.293471","100.86.7.137","13.84.36.2","TLSv1.2","942","Application Data"
"431","9.341045","13.84.36.2","100.86.7.137","TCP","56","443  >  57514 [ACK] Seq=676475 Ack=57169 Win=16385 Len=0"
"432","9.487469","13.84.36.2","100.86.7.137","TLSv1.2","736","Application Data"
"433","9.496353","13.84.36.2","100.86.7.137","TLSv1.2","373","Application Data"
"434","9.496415","100.86.7.137","13.84.36.2","TCP","54","57514  >  443 [ACK] Seq=57169 Ack=677476 Win=4136 Len=0"
"435","9.496492","13.84.36.2","100.86.7.137","TLSv1.2","179","Application Data"
"436","9.496827","13.84.36.2","100.86.7.137","TLSv1.2","96","Application Data"
"437","9.496827","13.84.36.2","100.86.7.137","TLSv1.2","85","Application Data"
"438","9.496856","100.86.7.137","13.84.36.2","TCP","54","57514  >  443 [ACK] Seq=57169 Ack=677674 Win=4135 Len=0"
"439","9.558587","13.84.36.2","100.86.7.137","TLSv1.2","710","Application Data"
"440","9.558587","13.84.36.2","100.86.7.137","TLSv1.2","163","Application Data"
"441","9.558587","13.84.36.2","100.86.7.137","TLSv1.2","103","Application Data"
"442","9.558587","13.84.36.2","100.86.7.137","TLSv1.2","95","Application Data"
"443","9.558587","13.84.36.2","100.86.7.137","TLSv1.2","85","Application Data"
"444","9.558666","100.86.7.137","13.84.36.2","TCP","54","57514  >  443 [ACK] Seq=57169 Ack=678560 Win=4140 Len=0"
